title,author,date_published,url,article_text,source
Katherine Tai.  Kann diese Frau die Beziehung zwischen den USA und China kitten? ,Julian Heißler,10. Dezember 2020,https://www.wiwo.de/politik/ausland/katherine-tai-kann-diese-frau-die-beziehung-zwischen-den-usa-und-china-kitten/26707078.html,"Der designierte US-Präsident Joe Biden setzt beim Aufbau seines Wirtschaftsteams weiter auf Experten. Für den wichtigen Posten der Handelsbeauftragten (USTR) will der 78-Jährige Medienberichten zufolge Katherine Tai nominieren, eine erfahrene Juristin, die bereits mehrere Jahre im USTR-Büro gearbeitet hat und zuletzt die   im Repräsentantenhaus in Handelsfragen beriet. Die Abgeordneten waren mit ihrer Arbeit offensichtlich zufrieden. Bereits im vergangenen Monat drängte einige von ihnen Biden, Tai für die Position zu berücksichtigen. Dieser Aufforderung kommt er nun wohl nach. Es ist ein ungewöhnlicher Karriereschritt für die Juristin. Der USTR-Posten hat zwar Kabinettsrang, gemessen an anderen Ministerien und Behörden lief er in der Vergangenheit jedoch eher unter dem Radar. Das änderte sich unter Donald Trump, der ihn durch seine Handelskriege in den Mittelpunkt seiner Außenwirtschaftspolitik stellte. Angesichts des gewachsenen Profils ist es eher überraschend, dass Biden nun eine Kandidatin nominiert, die selbst noch kein politisches Mandat errungen hat. Angesichts Tais Qualifikation geht er mit ihrer Benennung dennoch kein Risiko ein. Insider erwarten, dass sowohl die   als auch die   ihre Nominierung unterstützten werden. Tai steckt seit Jahren tief in der Materie. Ihre erste Stelle im USTR trat sie noch zu Zeiten der Bush-Administration an. Während der Amtszeit von Barack Obama stieg sie intern zur China-Expertin auf, vertrat etwa die Vereinigten Staaten bei Beschwerden gegen Pekings Handelspraktiken vor der WTO. Im Kongress war sie zuletzt zudem mit der Neuverhandlung des nordamerikanischen Freihandelsabkommens Nafta – heute USMCA – betraut. Sie sorgte für Konzessionen von der Trump Administration, etwa im Bereich Arbeitnehmerrechte und Umweltauflagen, die es den Demokraten ermöglichte, dem Vertrag zuzustimmen. Nun wird sie aller Voraussicht nach die Implementierung des Abkommens verantworten. Die Nominierung der Juristin lässt zudem einen Blick auf Bidens Prioritäten im Handelsbereich zu. Und diese dürften weiterhin die Auseinandersetzung mit China sein. Auch Tai macht sich keine Illusionen darüber, dass der Streit über die Handelspraktiken Pekings das bestimmende Thema der kommenden Jahre bleiben dürfte. Es gebe „wirklich robuste politische Unterstützung für aggressive und mutige Schritte mit Blick auf unseren Wettbewerb mit China“, so Tai im Sommer bei einer Podiumsdiskussion des Centers for American Progress. Im Gegensatz zu den Schritten der Trump-Administration plädierte sie jedoch für einen „strategischeren Ansatz“. China werde schließlich nicht verschwinden. Wie dieser Ansatz genau aussehen wird, ist derzeit noch offen. Das „Wall Street Journal“ berichtet, Tai habe intern etwa für Subventionen für amerikanische Unternehmen geworben, um die Abhängigkeit der   von China zu verringern. Das würde inhaltlich zu Bidens „Buy American“-Agenda passen, durch die US-Unternehmen bei öffentlichen Aufträgen der Vorzug gegeben werden soll. Die Strafzölle, die Trump im Handelskrieg mit China verhängt hatte, will Biden auch nicht sofort aufheben. Vielmehr kündigte er eine „Prüfung“ des Phase-One-Abkommens an, das Washington und Peking zu Jahresbeginn geschlossen hatten. Auch wolle er eine multilaterale Allianz bilden, um den Druck auf China wegen als unfair empfundener Handelspraktiken zu erhöhen. Tai gilt als jemand, der diesen Kurs unterstützen wird. Damit könnte ihre Nominierung auch für Europa eine gute Nachricht sein. Tai gilt unter Handelsexperten als jemand, der mehr Gemeinsamkeiten mit den Verbündeten suchen wird. Autozölle dürften damit keine Rolle mehr spielen.  Ob dies zu einer Wiederbelebung der Handelsgespräche zwischen EU und USA führen wird oder gar die Möglichkeit eines breiteren Abkommens wieder ins Spiel bringt, lässt sich Experten zufolge derzeit noch nicht absehen, doch eine Besserung des Klimas zwischen den Kontinenten scheint nun auch in Handelsfragen wahrscheinlich. Demokraten Demokraten Republikaner USA",wirtschaftswoche
Daimler.  Ineos übernimmt das Smart-Werk in Hambach ,no_author,08. Dezember 2020,https://www.wiwo.de/unternehmen/industrie/daimler-ineos-uebernimmt-das-smart-werk-in-hambach/26698884.html,"Der britische Geländewagenhersteller Ineos übernimmt  . Entsprechende Vereinbarungen zum Verkauf der Fabrik seien nun unterzeichnet, bestätigte Daimler am Dienstag. Ineos Automotive erwerbe alle Gesellschaftsanteile an Smart France und werde das Werk in Hambach nach Klärung der letzten Details in den nächsten Wochen übernehmen, hieß es. Die rund 1300 Arbeitsplätze im Werk selbst sowie bei Partnern am Standort sollen erhalten werden. Auch die Produktion der aktuellen zweisitzigen Elektro-Smarts im Werk werde fortgesetzt. Wie lange, blieb zunächst unklar.  hatte im Sommer angekündigt, sein weltweits Produktionsnetz zu straffen und in diesem Zuge das Werk in Hambach zu verkaufen. Dort wird bisher der Kleinwagen Smart gebaut, den Daimler von der nächsten Modellgeneration an zusammen mit seinem Großaktionär Geely in China produzieren will. Hambach hätte ursprünglichen Plänen zufolge im Gegenzug einen Kompaktwagen aus der neuen Elektro-Modellreihe EQ von Mercedes-Benz bekommen sollen. Ineos Automotive ist eine Tochterfirma des britischen Chemieunternehmens Ineos. Sie will unter dem Namen Grenadier einen großen allradgetriebenen Geländewagen auf den Markt bringen und hatte direkt nach Daimlers Verkaufsankündigung öffentlich Interesse angemeldet. Daimlers Smart-Werk im französischen Hambach Daimler",wirtschaftswoche
Kampf gegen Corona.  US-Arzneimittelbehörde hat keine Bedenken gegen Biontech-Impfstoff ,no_author,08. Dezember 2020,https://www.wiwo.de/kampf-gegen-corona-us-arzneimittelbehoerde-hat-keine-bedenken-gegen-biontech-impfstoff/26699016.html,"Die Mainzer Biotechfirma Biontech und ihr US-Partner Pfizer haben eine wichtige Hürde bei der Notfallzulassung ihres Corona-Impfstoffes in den   genommen. Die Arzneimittelbehörde FDA äußerte in einem am Dienstag veröffentlichten Dokument keine Bedenken gegen den Einsatz des Impfstoffes. Bei Untersuchungen hätten sich keine neuen Probleme hinsichtlich Sicherheit und Wirksamkeit ergeben. Experten rechnen damit, dass das Mittel nun zügig zugelassen wird. -Chef Albert Bourla sagte bei einem Online-Branchenevent, er erwarte ein „sehr intensives“ Treffen mit dem FDA-Beratungsausschuss. „Ich denke, sie werden angesichts der Stärke der Daten mit 'Ja' stimmen.“ Eine Impfung mit zwei Impfdosen habe sich als hochwirksam erwiesen, um bestätigte Fälle von Covid-19 mindestens sieben Tage nach der letzten Dosis zu verhindern, erklärten die Mitarbeiter der US-Behörde. Es gebe allerdings noch nicht genug Daten, um Rückschlüsse auf die Sicherheit des Impfstoffs bei Personen unter 16 Jahren, Schwangeren und Personen mit einem geschwächtem Immunsystem zu ziehen. Die vorgelegten Dokumente seien „sehr einfach und unkompliziert, was unserer Meinung nach unmittelbar zur Genehmigung führen wird“, schrieben Analysten der US-Investmentbank Jefferies. Die Pfizer-Aktien legten um gut ein Prozent zu, die an der Wall Street notierten  -Titel kletterten um 1,6 Prozent. Eine gute Nachricht sei, dass der sehr wichtige Teil des Zulassungsprozesses genau so ablaufe, wie er sollte und wie bei jedem anderen FDA-Überprüfungsverfahren, sagte Helen Boucher, Leiterin für Infektionskrankheiten am Tufts Medical Center in ein Interview mit Reuters. Die Arzneimittelbehörde folgt in der Regel den Empfehlungen ihrer Beratungsgremien, sie ist jedoch nicht dazu verpflichtet. Am Donnerstag treffen sich weitere Experten für Beratungen über den Impfstoff. Es wird erwartet, dass die FDA innerhalb der nächsten Tage oder Wochen über die Notfallzulassung des Biontech-Impfstoffes entscheidet. In Großbritannien gab es am Dienstag bereits erste Impfungen mit dem Biontech-Impfstoff. Anfang Dezember wurde das Mittel dort in einem Schnellverfahren zugelassen. Nach Angaben der Hersteller wies das Vakzin in einer Studie einen 95-prozentigen Schutz vor Covid-19 auf, der Atemwegserkrankung, die das neuartige Coronavirus auslöst. Pfizer hatte zunächst angepeilt, noch in diesem Jahr 100 Millionen Impfdosen auszuliefern. In den vergangenen Wochen wurde die Zielmarke dann auf 50 Millionen Dosen halbiert und dies mit Problemen bei der Lieferkette begründet. Bourla sagte, er sei zuversichtlich, dass die geplanten 50 Millionen Dosen ausgeliefert würden. Im kommenden Jahr sollen dann 1,3 Milliarden Dosen des Impfstoffes verteilt werden. Die Auslieferung des Impfstoffes laufe in Großbritannien sehr gut. In Russland und China wurde bereits vor einiger Zeit mit Impfungen begonnen. Hier kommen allerdings andere Impfstoffe zum Einsatz, die freigegeben wurden, bevor Ergebnisse der entscheidenden Wirksamkeitsstudien vorlagen. USA Pfizer Biontech",wirtschaftswoche
Menschenrechtsverletzung.  Die EU beschließt neues Sanktionsinstrument ,no_author,07. Dezember 2020,https://www.wiwo.de/politik/ausland/menschenrechtsverletzung-die-eu-beschliesst-neues-sanktionsinstrument/26694346.html,"Die EU hat sich im   ein neues Sanktionsinstrument zugelegt. Die Außenminister der Mitgliedstaaten beschlossen am Montag nach Angaben der deutschen EU-Ratspräsidentschaft eine Regelung, die die politische Ahndung solcher Verbrechen deutlich erleichtern soll. Sie wird es ermöglichen, Vermögenswerte von Personen, Unternehmen und Organisationen einzufrieren, die zum Beispiel an Folter, Sklaverei oder systematischer sexueller Gewalt beteiligt sind. Zudem sollen auch Einreiseverbote für Personen verhängt werden. Bislang konnten Menschenrechtsverletzungen nur im Zusammenhang mit Strafmaßnahmen gegen Staaten oder im Rahmen von speziellen Sanktionsregimen geahndet werden, die die EU zum Beispiel im Kampf gegen Cyberangriffe und den Einsatz von Chemiewaffen geschaffen hat. Das hat eine Reaktion der EU auf Menschenrechtsverletzungen bislang kompliziert oder unmöglich gemacht – so zum Beispiel im Fall der grausamen Tötung des Journalisten Jamal Khashoggi im saudi-arabischen Konsulat in Istanbul. Relevant wird das neue Sanktionsregime vor allem dann sein, wenn Menschenrechtsverletzungen in dem Land, in dem sie verübt werden, strafrechtlich nicht verfolgt werden – zum Beispiel, weil die Regierung sie als Mittel der Einschüchterung unterstützt oder duldet. Wer foltert, solle zukünftig zumindest nicht mehr sorgenlos in Europa shoppen gehen können, kommentierte Bundesaußenminister Heiko Maas (SPD) am Montag. Die neue Regelung sei ein wichtiges Anliegen der derzeitigen deutschen EU-Ratspräsidentschaft gewesen. Die politische Einigung der EU-Staaten auf die neue Regelung erfolgte bereits in der vergangenen Woche. Vorbild ist der sogenannte Global Magnitsky Act der USA. Dieser war 2016 vom US-Kongress beschlossen worden, um Sanktionen gegen Einzelpersonen zu verhängen, die für den Tod des russischen Anwalts und Wirtschaftsprüfers Sergej Magnitski verantwortlich sind. Magnitski war 2009 während der Untersuchungshaft in einem russischen Gefängnis gestorben, nachdem er misshandelt und unzureichend medizinisch versorgt worden war. Vorschläge, den geplanten EU-Sanktionsmechanismus nach dem jüngst vergifteten Kremlkritiker   zu benennen, griffen die EU-Staaten nicht auf. Sie hatten wegen des Anschlags auf den Oppositionspolitiker bereits im Oktober über das Chemiewaffen-Regime Einreise- und Vermögenssperren gegen mutmaßliche Verantwortliche aus dem Umfeld von Präsident Wladimir Putin verhängt. Ebenfalls keine ausreichende Unterstützung fand der Vorschlag der EU-Kommission und des Auswärtigen Dienstes, das Prinzip der Einstimmigkeit bei Sanktionsentscheidungen aufzuweichen. Damit können einzelne EU-Staaten Strafmaßnahmen weiter mit einem einfachen Veto verhindern. Auch wird die Sanktionsregelung an sich nach drei Jahren mit Einstimmigkeit verlängert werden müssen. Die einzelnen Strafmaßnahmen gegen Personen, Unternehmen und Organisationen sollen sogar jährlich überprüft und bestätigt werden müssen. Gegen wenn in einer ersten Sanktionsrunde Strafmaßnahmen verhängt werden könnten, war zunächst unklar. Am Montag hieß es lediglich, das neue System solle nicht der Aufarbeitung der Vergangenheit dienen, sondern eine Reaktion auf aktuelle Entwicklungen ermöglichen. Kampf gegen Menschenrechtsverletzungen Alexej Nawalny",wirtschaftswoche
Huawei.  „Deutschland wird erpressbar“ ,Jürgen Berke,10. Dezember 2020,https://www.wiwo.de/unternehmen/it/huawei-deutschland-wird-erpressbar/26701986.html,"Der chinesische Technologiekonzern   gewinnt Marktanteile beim Bau von Netzinfrastrukturen, die anders als die superschnellen 5G-Mobilfunknetze bisher nicht als sicherheitskritisch einstuft werden. Besonders erfolgreich ist das umstrittene Unternehmen bei der   der Schulen. „Mit Kampfpreisen“, berichten Konkurrenten, beteiligt   an aktuell laufenden Ausschreibungen zum Aufbau von WLan-Hotspots in deutschen Schulen. Als eine der ersten Kommunen hat sich der niedersächsische Landkreis Diepholz über die Datenschutz-Sorgen von Eltern hinweggesetzt und bei der Ausschreibung für „WLan-Komponenten in Schulen“ (Auftragsvolumen: 1,3 Millionen Euro) den Auftrag an Huawei vergeben. Offizielle Begründung: Huawei ist der „wirtschaftlichste Bieter“. Auch Kommunen in anderen Bundesländern vertrauen neue WLan-Hotspots zunehmend Huawei an. Aktuelle Erhebungen der   Gesellschaft für Konsumforschung für das im Oktober abgelaufene dritte Quartal 2020 zeigen überraschend gute Verkaufszahlen von Huawei, die ihren Marktanteil in diesem Segment auf 40 Prozent steigern konnte. Zum Vergleich: Im vergangenen Jahr lag der Marktanteil noch bei sieben Prozent. Die drahtlosen Zugangspunkte ins Internet spielen bei der Digitalisierung des Unterrichts eine zentrale Rolle. Über solche WLan-Hotspots können Schüler und Lehrer mit ihren Laptops und Smartphones bequem und kostengünstig auf die Lernplattformen zugreifen. Auch dafür stellt der Bund im Rahmen des Digitalpaktes Fördergelder in Höhe von fünf Milliarden Euro bereit. Sicherheitsbedenken wie beim Bau der 5G-Mobilfunknetze spielen beim Einrichten von öffentlichen WLan-Hotspots aber nur eine untergeordnete Rolle. Das müssten die Bildungs- und Kultusminister korrigieren, heißt es im Brief einer besorgten Mutter an die niedersächsische Landesregierung. Das chinesische Geheimdienstgesetz verpflichte Technologieunternehmen zur Zusammenarbeit. Deshalb könne nicht ausgeschlossen werden, dass „über versteckte Zugriffsmöglichkeiten sensible Daten unserer Schüler abgegriffen werden“. Der Landkreis Diepholz hat sich bei der Auftragsvergabe an Huawei auf die „fachliche Expertise“ des Bundesamtes für Sicherheit in der Informationstechnik (BSI) und des Computer-Emergency-Response-Teams der niedersächsischen Landesverwaltung (N-CERT) verlassen. Die beiden Behörden hatten keine Sicherheitsbedenken. Laut N-CERT hat das BSI die Tests der WLan-Router beim Huawei-eigenen Sicherheitslabor in Bonn vorgenommen. Das BSI wollte auf Anfrage der WirtschaftsWoche zu diesem Vorgang keine Stellungnahme abgeben. Der IT-Sicherheitsexperte Martin Schallbruch warnt vor dem verstärkten Einsatz von Technologien des chinesischen Ausrüsters Huawei in deutschen Schulen. Das sei „Besorgnis erregend“. Hält der Trend an, wäre   in einem weiteren Infrastruktur-Bereich von China abhängig und damit „erpressbar“. Im schlimmsten Fall einer Auseinandersetzung „könnte China die Lieferung von Komponenten und das Bereitstellen von Software-Updates stoppen“, sagt der ehemalige Ministerialdirektor im Bundesinnenministerium und heutige Direktor des Digital Society Institute der European School of Management and Technology (ESMT) in Berlin. Statt auf dem Weltmarkt einzukaufen, sollten Bundesregierung und die Bundesländer im Infrastruktur-Bereich dort, wo es europäische Anbieter noch gibt, auch deren Produkte einsetzen. Das gelte erst recht für staatliche geförderte Projekte – wie die Digitalisierung der Schulen. „Es ist ein Fehler, dass der Bund fünf Milliarden Euro im Rahmen des Digitalpaktes ohne strenge Sicherheitsvorgaben für Infrastruktur-nahe Investitionen bereitstellt.“ Huawei Digitalisierung Huawei GfK Deutschland",wirtschaftswoche
Konjunktur.  Deutschland exportiert im Oktober deutlich weniger als erwartet ,no_author,09. Dezember 2020,https://www.wiwo.de/konjunktur-deutschland-exportiert-im-oktober-deutlich-weniger-als-erwartet/26700510.html,"Die zweite Corona-Welle bei vielen westlichen Handelspartnern schwächt das deutsche Exportgeschäft: Zwar wuchsen die Ausfuhren im Oktober bereits den sechsten Monat in Folge, doch fiel das Plus mit 0,8 Prozent zum Vormonat nur noch mager aus, wie am Mittwoch veröffentlichte Daten des Statistischen Bundesamtes zeigen. Von der Nachrichtenagentur Reuters befragte Ökonomen hatten mit einem Plus von 1,2 Prozent gerechnet, nach einer Zunahme von 2,3 Prozent im September. Trotz der Aufholjagd blieben die Ausfuhren um 6,8 Prozent unter dem Niveau von Februar 2020 – dem Monat vor Beginn der Corona-bedingten Einschränkungen. „Der nur moderate Exportanstieg zeigt, dass Covid-19 die   weiter hemmt“, sagte der Chefvolkswirt des Bankhauses Lampe, Alexander Krüger. „Besonders aus Ländern mit hohen Infektionszahlen, etwa den USA und Großbritannien, fehlt Nachfrage.“ Die hohe Auslastung der Containerschiffe mache aber Mut, dass es weitere Exportzuwächse geben werde. „Hier ruhen die Hoffnungen vor allem auf China, wo die Wirtschaft wieder brummt“, sagte der Chefvolkswirt der VP Bank, Thomas Gitzel. Die Volksrepublik versorge derzeit die Welt mit Gütern, die in der Corona-Pandemie besonders intensiv gekauft würden – neben Hygieneartikeln auch Elektronik für das Homeoffice. „Wenn China produziert, braucht es aber auch deutsche Maschinen, mit deren Hilfe diese Güter hergestellt werden“, sagte Gitzel. Von Januar bis Oktober blieben die Exporte ungeachtet der jüngsten Erholung weit unter dem Vorjahresergebnis: Sie brachen um 11,2 Prozent auf 992,1 Milliarden Euro ein. Der Bundesverband der Deutschen Industrie (BDI) geht davon aus, dass im Gesamtjahr 2020 unterm Strich ein Minus von 13 Prozent herauskommen wird. Die Importe wuchsen im Oktober ebenfalls den sechsten Monat in Folge, wenn auch nur um 0,3 Prozent. Hier war von Analysten ein Wachstum von 1,0 Prozent erwartet worden. Die Einfuhren blieben dennoch um deutliche 5,2 Prozent unter dem Februar-Niveau. Konjunktur",wirtschaftswoche
Kupferkonzern.  E-Auto-Boom sorgt für steigende Kupfernachfrage bei Aurubis ,no_author,09. Dezember 2020,https://www.wiwo.de/unternehmen/industrie/kupferkonzern-e-auto-boom-sorgt-fuer-steigende-kupfernachfrage-bei-aurubis/26701562.html,"Europas größte Kupferhütte Aurubis sieht angesichts des Booms bei Elektroautos und weltweit steigender Investitionen in die Infrastruktur glänzende Aussichten fürs eigene Geschäft. „Mit jedem Elektrofahrzeug sehen wir eine verstärkte Nachfrage nach Kupfer“, sagte Konzernchef Roland Harings am Mittwoch bei der Präsentation der Bilanz für das Ende September abgelaufene Geschäftsjahr. Er verwies darauf, dass batteriegetriebene Wagen und Plug-in-Fahrzeuge zwischen 50 und 90 Kilo Kupfer in Form von Kabeln, Leiterplatten und Steckverbindungen an Bord hätten. Das sei ein Vielfaches dessen, was in herkömmlichen Autos verbaut sei. Auch das Recycling von Batterien, bei dem   bereits aktiv ist, werde zunehmen. Bisher gehen etwa 15 Prozent der Kupferprodukte von Aurubis in die Automobilindustrie. Der Bedarf werde zunehmen, sagte Harings. „Für uns ist die Elektromobilität ein wichtiger Wachstumsmarkt.“ Eine konkrete Prognose nannte er nicht. Die Neuzulassungen von E-Autos stiegen zuletzt rasant, weil der Kauf durch staatliche Prämien angeheizt wird, um den Klimaschutz voranzutreiben. Aurubis recycelt neben Kupfer, Nickel und Zink bereits auch Batterien. Allerdings sind die Mengen aus der Automobilindustrie noch verhältnismäßig gering. Sobald sich dies durch die Zunahme der E-Mobilität ändere, werde Aurubis diesen Bereich ausbauen. „Wir sehen einen wirklichen Markt für Batterierecycling erst am Ende dieser Dekade“, sagte Harings. Momentan geht man davon aus, dass Batterien von E-Autos acht bis zehn Jahre halten. Danach lässt die Ladekapazität nach. Im abgelaufenen Geschäftsjahr 2019/20 sorgte das starke Recyclinggeschäft und die hohe Kupfernachfrage aus China für einen Gewinnsprung. Die in der Corona-Pandemie eingebrochene Nachfrage auf den europäischen Kupfermärkten sei durch Kathodenverkäufe nach Asien wettgemacht worden. Der operative Vorsteuergewinn (EBT) kletterte um 15 Prozent auf 221 Millionen Euro. Dazu trug auch das seit einiger Zeit laufende Sparprogramm und die Übernahme der Metallo-Gruppe bei. An dem gestiegenen Gewinn sollen die Aktionäre durch eine um fünf Cent auf 1,30 Euro erhöhte Dividende teilhaben. Im gerade angelaufene Geschäftsjahr 2020/21 rechnet Aurubis, an der der Stahlkonzern Salzgitter maßgeblich beteiligt ist, mit einer weltweit wieder anziehenden Kupfernachfrage und prognostiziert einen operativen Vorsteuergewinn in einer Spanne zwischen 210 und 270 Millionen Euro. Damit hält das Management sowohl einen leichten Rückgang als auch einen kräftigen Anstieg für möglich. Für das abgelaufene Jahr hatte Aurubis ein operatives EBT zwischen 185 und 250 Millionen Euro in Aussicht gestellt. Aurubis",wirtschaftswoche
