title,author,date_published,url,article_text,source
Autobauer.  VW muss Produktion wegen Engpässen bei Computerchips drosseln ,no_author,18. Dezember 2020,https://www.wiwo.de/unternehmen/industrie/autobauer-vw-muss-produktion-wegen-engpaessen-bei-computerchips-drosseln/26733674.html,"Der weltweite Engpass bei Computerchips sorgt auch bei Volkswagen für Störungen in der Produktion. Der Konzern müsse die Fertigung an einzelnen Standorten in China, Nordamerika und Europa im ersten Quartal an die Versorgung mit Halbleitern anpassen, teilte   am Freitag mit. Betroffen seien Fahrzeuge der Marken VW Pkw und Nutzfahrzeuge sowie  , Seat und in begrenztem Umfang auch Audi. Es würden fortlaufend Gegenmaßnahmen und Alternativen geprüft, um die Auswirkungen des Lieferengpasses und damit die Zahl der betroffenen Fahrzeuge zu begrenzen. Volkswagen sei bisher gut durch die Krise gekommen, erklärte der designierte Einkaufschef des Konzerns, Murat Aksel. „Allerdings bekommen wir nun die Auswirkungen der globalen Engpässe bei Halbleitern zu spüren.“ Weltweit kämpft die Automobilindustrie wegen der Nachwirkungen des Corona-Lockdowns im Frühjahr mit Problemen bei der Versorgung mit elektronischen Bauteilen. Da sich die Autobranche vor allem in China nach dem Abflauen der Pandemie dort schneller als erwartet erholt hat, werden Halbleiter knapp. Volkswagen erklärte, wegen der Pandemie und den daraus resultierenden Absatzrückgängen in der Autoindustrie hätten führenden Halbleiterhersteller ihre Produktion auf andere Abnehmer wie die Unterhaltungselektronik umgestellt. Da sich die Autobranche nun vor allem in China aber deutlich erhole, würden elektronische Bauteile knapp. VW hatte bereits Anfang Dezember auf Anfrage von Reuters in China berichtet, wegen der Corona-Pandemie sei die Lieferung von Computerchips für bestimmte Elektronikkomponenten unsicher geworden. Dadurch drohten Unterbrechungen in der Autoproduktion. Das Problem werde durch die stark steigende Fahrzeugnachfrage in der Volksrepublik noch verschärft. Der Autozulieferer Continental hatte erklärt, obwohl die Halbleiterhersteller wegen der unerwarteten Nachfrage bereits ihre Kapazitäten erweitert hätten, würden die zusätzlichen Volumen aufgrund der Vorlaufzeiten in der Industrie erst in sechs bis neun Monaten zur Verfügung stehen. Daher sei auch im kommenden Jahr mit Lieferengpässe zu rechnen. Der weltgrößte Autozulieferer Bosch teilte Anfang Dezember auf Anfrage mit, nicht nur die Autoindustrie sei betroffen. Gegenwärtig bestehe weltweit ein Mangel an bestimmten Halbleiterkomponenten. Kein Anbieter könne sich dieser Marktentwicklung entziehen. Auch bei   suche man nach Wegen, um die Lieferketten so weit wie möglich aufrechtzuerhalten. Die Engpässe kommen für die gesamte Branche höchst ungelegen, da die Autonachfrage gerade wieder in Fahrt kommt. Volkswagen Skoda Bosch",wirtschaftswoche
Fitnessuhren.  EU-Wettbewerbshüter genehmigen Fitbit-Übernahme durch Google ,no_author,17. Dezember 2020,https://www.wiwo.de/fitnessuhren-eu-wettbewerbshueter-genehmigen-fitbit-uebernahme-durch-google/26729764.html,"Die   haben die geplante Übernahme des Fitnessuhren-Spezialisten Fitbit durch den Online-Riesen Google genehmigt. Die Freigabe des Zusammenschlusses unterliegt allerdings der Bedingung, dass Google Selbstverpflichtungen zur Vermeidung von Wettbewerbsverzerrungen einhält, wie die Brüsseler Behörde am Donnerstag mitteilte. So darf das Unternehmen über Fitbit-Geräte generierte Daten nicht zur Optimierung seines Anzeigengeschäfts nutzen und muss Nutzern die Möglichkeit geben, die Verwendung von Daten für Dienste wie Google Maps und YouTube zu verbieten. Die Wettbewerbshüter hatten in den vergangenen Monaten intensiv untersucht, ob die Übernahme negative Auswirkungen auf die Märkte für Online-Werbung haben könnte. „Wenn Google seinen Datenvorteil bei der Personalisierung von Werbeanzeigen, die es über seine Suchmaschine platziert und auf anderen Internetseiten anzeigt, weiter ausbaut, würde es für Wettbewerber schwieriger, mit den Online-Werbediensten von Google mitzuhalten“, hieß es von der EU-Kommission. Dadurch würden für Wettbewerber Schranken für den Marktzutritt und Hindernisse für die Expansion geschaffen - was letztlich zulasten von Werbetreibenden und Website-Betreibern ginge, die höhere Preisen zahlen müssten und weniger Auswahl hätten. Google hatte Anfang November des vergangenen Jahres Pläne zur Übernahme von Fitbit für gut zwei Milliarden Dollar bekanntgegeben. Dabei hieß es, dass Daten des Fitness-Spezialisten nicht für personalisierte Werbung verwendet werden sollen. Bereits Anfang des Jahres warnten europäische Datenschützer allerdings, eine weitere Ansammlung von Nutzer-Informationen in der Hand eines großen Tech-Unternehmens sei ein Risiko für den Schutz der Privatsphäre. Fitbit war ein Pionier im Geschäft mit Fitness-Armbändern, die Schritte und verbrauchte Kalorien zählen. Allerdings wurde dieses Geschäft inzwischen aus zwei Richtungen aufgerollt: Apple ist sehr erfolgreich mit seiner Computer-Uhr   Watch, die auch diverse Fitness-Funktionen hat - und bei einfachen Armbändern dominieren günstige Geräte aus China vor allem von der Firma Xiaomi. Wettbewerbshüter der EU-Kommission Apple",wirtschaftswoche
Untersuchungsausschuss.  Guttenberg sieht sich im Wirecard-Skandal als Opfer ,no_author,17. Dezember 2020,https://www.wiwo.de/politik/deutschland/untersuchungsausschuss-guttenberg-sieht-sich-im-wirecard-skandal-als-opfer/26728430.html,"Ex-Wirtschaftsminister Karl-Theodor zu Guttenberg hat seine Rolle als externer Berater von Wirecard verteidigt und sieht sich selbst als Opfer in dem Finanzskandal. Seine Beratungsfirma Spitzberg Partners sei weder eine Staatsanwaltschaft noch ein Wirtschaftsprüfer, sagte der 49-Jährige am Donnerstag in Berlin. Zu keinem Zeitpunkt habe seine Firma Kenntnis von Bilanzbetrug oder   des ehemaligen Dax-Konzerns gehabt. „Das war einfach nicht vorstellbar.“ Der milliardenschwere Skandal habe ihn vollkommen überrascht. Seine Firma habe ein begrenztes Wissen gehabt und genauso spät wie die Öffentlichkeit von dem Betrug erfahren. Mit dem Wissen von heute, hätte er sich nicht für den Zahlungsabwickler eingesetzt, sagte der ehemalige  -Politiker. Das Unternehmen habe aber über zehn Jahre uneingeschränkte Testate der Wirtschaftsprüfer bekommen. „Wirecard hat uns alle getäuscht.“ Guttenberg hatte die Bundesregierung über den geplanten Markteintritt von   in China informiert und diese gebeten, die Pläne wohlwollend zu unterstützen. Bundeskanzlerin Angela Merkel hat sich daraufhin bei einer China-Reise im September 2019 für Wirecard eingesetzt. Es sei bei solchen Reisen normal, sich für deutsche Firmen starkzumachen, sagte sie am Mittwoch im Bundestag. Wirecard war im Juni nach Bekanntwerden milliardenschwerer Luftbuchungen in die Pleite gerutscht. Die Staatsanwaltschaft ermittelt unter anderem wegen Bilanzfälschung, Betrug, Marktmanipulation und Geldwäsche. Es ist einer der größten Finanzskandale der Nachkriegszeit. Geldwäsche CSU Wirecard",wirtschaftswoche
Wirecard-Ausschuss.  Die wichtigsten Aussagen und Momente im Überblick ,"Benedikt Becker, Volker ter Haseborg",17. Dezember 2020,https://www.wiwo.de/politik/deutschland/wirecard-ausschuss-die-wichtigsten-aussagen-und-momente-im-ueberblick/26719896.html,"Der parlamentarische Untersuchungsausschuss zum  -Bilanzskandal kam an diesem Donnerstag zum letzten Mal in diesem Jahr zusammen. Die Abgeordneten wollten sich mit der Arbeit der prominenten Lobbyisten des insolventen Zahlungsabwicklers befassen. Bekanntester Strippenzieher war der ehemalige Wirtschafts- und Verteidigungsminister Karl-Theodor zu Guttenberg. Er war ebenso als Zeuge geladen wie der ehemalige Hamburger Bürgermeister Ole von Beust.  Die beiden Politiker hatten sich in ihrer Eigenschaft als  -Lobbyisten an die Bundesregierung gewandt. Besonders interessant für die Abgeordneten ist der Besuch von Guttenberg am 3. September 2019 im Kanzleramt: Er traf mit Bundeskanzlerin Angela Merkel zusammen und warb für den Markteintritt von Wirecard in China. Ob und in welcher Weise sich Ministerien und Diplomaten einspannen ließen, soll auch durch die Zeugenaussagen mehrerer Beamter geklärt werden. Als Zeugen geladen waren zudem etwa Lars-Hendrik Röller, Wirtschaftsberater im Kanzleramt. Und: Wolfgang Schmidt, Staatssekretär im  .  (inklusive der Blogbeiträge zur Ausschusssitzung am 26. November) Wirecard Wirecard Bundesfinanzministerium",wirtschaftswoche
Lockdown-Folgen.  Industrie verzeichnet deutlich mehr Aufträge – sogar mehr als vor Beginn der Coronakrise ,no_author,17. Dezember 2020,https://www.wiwo.de/lockdown-folgen-industrie-verzeichnet-deutlich-mehr-auftraege-sogar-mehr-als-vor-beginn-der-coronakrise/26727490.html,"Die Auftragsbücher der deutschen Industrie sind auch dank der stärkeren Nachfrage aus China praller gefüllt als vor Beginn der Coronakrise.  , wie das Statistische Bundesamt am Donnerstag mitteilte. Dabei nahmen die offenen Aufträge aus dem Inland um 1,8 Prozent zu, die aus dem Ausland um 1,2 Prozent. Im Vergleich zum Februar 2020 – dem Monat vor Beginn der Corona-bedingten Einschränkungen in   – ist der Bestand inzwischen saison- und kalenderbereinigt um 2,3 Prozent höher. Die Industrieaufträge haben sich seit dem Ende des ersten Lockdowns kräftig erholt. Da die Produktion deutlich langsamer anlief, erhöhten sich die Auftragsbestände. Deren Reichweite legte im Oktober leicht zu auf 6,5 Monate. Diese Zahl gibt an, wie lange die Betriebe bei gleichbleibendem Umsatz ohne neue Bestellungen theoretisch produzieren müssten, um die vorhandene Nachfrage abzuarbeiten. Die deutsche Industrie befindet sich ungeachtet der zweiten Corona-Welle im Aufwind. Sie nahm im Dezember sogar noch Fahrt auf, wie das Institut IHS Markit bei seiner monatlichen Umfrage herausfand. „Gestützt wird der Aufschwung weiterhin durch steigende Exportumsätze, die von den Unternehmen häufig auf eine stärkere Nachfrage aus China zurückgeführt werden“, hieß es dazu. Der Auftragsbestand wuchs im Oktober um 1,5 Prozent zum Vormonat Deutschland",wirtschaftswoche
Devisenhandel.  USA beschuldigen Schweiz und Vietnam der Währungsmanipulation ,no_author,16. Dezember 2020,https://www.wiwo.de/devisenhandel-usa-beschuldigen-schweiz-und-vietnam-der-waehrungsmanipulation/26725914.html,"Die US-Regierung hat erstmals die   und Vietnam der Währungsmanipulation bezichtigt. Beide Länder hätten in den vier Quartalen bis Ende Juni 2020 in unfairer Weise ihre Währungen gegenüber dem US-Dollar beeinflusst, teilte das US-Finanzministerium am Mittwoch in Washington mit. Kurz vor dem Regierungswechsel werden damit noch Konflikte mit zwei weiteren Handelspartnern eskaliert. Im vergangenen Jahr hatte die Regierung von Präsident   solche Vorwürfe bereits gegen China erhoben, dann allerdings im Januar 2020 wieder zurückgezogen. Die   (SNB) wies die Vorwürfe der Währungsmanipulation in einer Stellungnahme zurück. Die Notenbank wolle trotz der Kritik der   an ihrer Geldpolitik festhalten und sei weiterhin bereit, angesichts der wirtschaftlichen Lage und des anhaltend hoch bewerteten Frankens „verstärkt“ am Devisenmarkt zu intervenieren, hieß es in dem Statement weiter. Die   bemüht sich schon seit langem, den starken Kursauftrieb beim Franken zu bremsen. Dazu kauft die Notenbank in großem Stil fremde Währungen und bezahlt in Franken. Allerdings hat der Schweizer Franken unter dem Strich dennoch zu wichtigen Währungen wie Euro und US-Dollar an Wert gewonnen – beim Dollar beispielsweise von Mitte 2019 bis heute um bis zu 15 Prozent. Im Gegenzug bedeutet das, dass Dollar-Geschäfte für Schweizer vom Wechselkurs her billiger werden, was amerikanische Exporteure begünstigt. Auch Deutschland haben die USA schon länger wegen des Verdachts unfairer Währungspraktiken auf dem Kieker – die Bundesrepublik zählt zu zehn Ländern auf einer entsprechenden Beobachtungsliste des Finanzministeriums. Durch eine gezielte Schwächung der eigenen Währung können Länder ihre Exportwirtschaften stärken, da sich deren Waren dadurch im Ausland verbilligen. Trump beschuldigte in den vergangenen Jahren immer wieder große Handelspartner der USA, ihre Währungen zu manipulieren, um so die eigene Wirtschaft zu stützen. Schweiz Donald Trump Schweizerische Nationalbank USA SNB",wirtschaftswoche
Nach Trump-Anordnung.  MSCI streicht einige chinesische Werte aus Indizes ,no_author,16. Dezember 2020,https://www.wiwo.de/finanzen/boerse/nach-trump-anordnung-msci-streicht-einige-chinesische-werte-aus-indizes/26724568.html,"Der Indexanbieter MSCI hat einige chinesische Aktienwerte aus seinen Indizes gestrichen. Damit folgt der Finanzdiensleister einer Anordnung der US-Regierung. Bereits am 12. November hatte die Trump-Administration verordnet, dass es keine amerikanischen Investments mehr in Firmen geben dürfe, die dem chinesischen Militär gehören oder von diesem kontrolliert werden. Konkret hat MSCI daraufhin bisher die Aktien der Unternehmen China Railway Construction, China Spacesat, China Communications Construction, CRRC, Hangzhou Hikvision Digital Technology, Dawning Information Industry and Semiconductor Manufacturing International aus den Indizes verbannt. Eine finale Liste werde es Ende Dezember geben, teilte MSCI mit. Umgesetzt würden die Änderungen am 5. Januar. Damit reagiert jetzt bereits der dritte große Indexanbieter auf die Anweisung des US-Präsidenten. Auch FTSE Russell und S&P Dow Jones haben im Dezember chinesische Firmen aus Indizes genommen. Der Einfluss auf die Indizes dürfte gering sein, da die Firmen darin nur geringes Gewicht hatten, beziehungsweise noch haben. Deutlicher dürften die Effekte bei den betroffenen Firmen sein. Die Vorgänge zeigen deutlich, wie stark die US-Regierung den Zugang zu globalem Kapital einschränken kann. Die Aktienkurse der betroffenen Unternehmen reagierten allerdings kaum. Eine entsprechende Ankündigung von MSCI war an den Märkten erwartet worden.",wirtschaftswoche
Biotechunternehmen.  Biontech will Corona-Impfstoff auch nach China liefern ,no_author,16. Dezember 2020,https://www.wiwo.de/unternehmen/industrie/biotechunternehmen-biontech-will-corona-impfstoff-auch-nach-china-liefern/26724760.html,"Der Mainzer Pharma-Unternehmen Biontech hat nun auch mit China eine Auslieferung seines Corona-Impfstoffs vereinbart. Die Vereinbarung mit dem Partnerunternehmen Fosun Pharma sehe die Lieferung von 100 Millionen Dosen im kommenden Jahr vor und stehe noch unter dem Vorbehalt der Zulassung durch die chinesischen Behörden, gab   am Mittwoch bekannt. Beide Unternehmen hatten bereits im März eine   eines potenziellen Covid-19-Impfstoffs beschlossen, der auf der Technologie von Biontech beruht. Die Chefs von Biontech und Fosun Pharma, Ugur Sahin und Wu Yifang, erklärten, die gemeinsame Entwicklungsanstrengung unterstreiche die Bedeutung von globaler Zusammenarbeit in der Forschung. „Unter der Voraussetzung, dass der Impfstoff sicher und wirksam ist, unterstützen wir aktiv die Vermarktung des Impfstoffs in China“, erklärte der Fosun-Vorstandsvorsitzende. Das in Schanghai ansässige Unternehmen und Biontech hatten am 24. November die Phase-2-Studie mit dem Biontech-Impfstoffkandidaten BNT162b2 in der chinesischen Provinz Jiangsu mit der Rekrutierung von 960 gesunden Probanden im Alter von 18 bis 85 Jahren begonnen. Die gesammelten Daten sollen einen künftigen Antrag auf Zulassung des Impfstoffs in der Volksrepublik unterstützen. Lieferverträge haben Biontech und sein US-Partner Pfizer unter anderem mit den  , Großbritannien und Kanada geschlossen, wo das Präparat dank einer Notzulassung bereits verabreicht wird. Auch mit der EU haben die beiden Unternehmen Liefervereinbarungen geschlossen. Die Europäische Arzneimittelbehörde EMA hatte am Dienstag bekannt gegeben, dass sie am 21. Dezember ihr Gutachten zu dem Impfstoff abgeben will. Biontech strategische Zusammenarbeit zur gemeinsamen Entwicklung und Kommerzialisierung USA",wirtschaftswoche
Videokonferenzdienst.  Zoom will Entwicklungszentrum in Singapur eröffnen ,no_author,16. Dezember 2020,https://www.wiwo.de/videokonferenzdienst-zoom-will-entwicklungszentrum-in-singapur-eroeffnen/26724862.html,"Der Videokonferenzdienst Zoom eröffnet ein neues Forschungs- und Entwicklungszentrum in  . Die Online-Plattform wolle „Hunderte Ingenieure“ einstellen und habe bereits mit der Rekrutierung begonnen, hieß es am Mittwoch in einer Mitteilung. In dem Zentrum, das als Tor in die Asien-Pazifik-Region dienen soll, würden künftig „neue Möglichkeiten“ für das Unternehmen ausgelotet. Zudem will   sein vor zwei Jahren eröffnetes Rechenzentrum in der südostasiatischen Wirtschaftsmetropole erweitern. Singapur sei wegen seines „außergewöhnlichen technischen Talents“ als Standort ausgewählt worden. Velchamy Sankarlingam, Unternehmenspräsident für Produkt und Technik, beschrieb den Stadtstaat als „eines der freundlichsten Länder, um ein Unternehmen zu gründen“. Auch sei die Infrastruktur sehr gut. Der Konzern verfügt bereits über ähnliche Zentren in den  , China und  . Zoom hat seinen Hauptsitz in Kalifornien und boomt aufgrund der weltweiten Beschränkungen durch die Corona-Pandemie, die Hunderte Millionen Menschen dazu zwingen, von zu Hause aus zu arbeiten. Konferenzen werden häufig online abgehalten. Zoom gilt dabei als einer der wichtigsten Anbieter. Im dritten Quartal erzielte das Unternehmen einen Umsatz von rund 777,2 Millionen US-Dollar. Im Vergleich zum Vorjahreszeitraum konnte Zoom das Ergebnis damit mehr als vervierfachen. Singapur Zoom USA Indien",wirtschaftswoche
Netzwerkausrüster.  Kabinett billigt offenbar IT-Sicherheitsgesetz ,no_author,16. Dezember 2020,https://www.wiwo.de/politik/deutschland/netzwerkausruester-kabinett-billigt-offenbar-it-sicherheitsgesetz/26724076.html,"Die Bundesregierung erhöht die Maßstäbe für die Prüfung von Ausrüstern für das moderne 5G-Mobilfunknetz. Nach Informationen aus Regierungskreisen stimmte das Bundeskabinett am Mittwoch dem seit Monaten diskutierten IT-Sicherheitsgesetz zu, wie die Nachrichtenagentur Reuters berichtet. Dieses muss nun vom Bundestag beschlossen werden, wo aber nach Angaben aus Koalitionskreisen nur noch geringfügige Änderungen erwartet werden. Das IT-Sicherheitsgesetz sieht unter anderem eine sehr viel strengere Prüfung von Bauteilen von Lieferanten vor. Dies dürfte nach Einschätzung aus Regierungskreisen dazu führen, dass eine Nutzung von Komponenten etwa des chinesischen Netzwerkausrüsters   im 5G-Netz massiv erschwert wird. Künftig soll ein Hersteller auch komplett vom Aufbau des 5G-Netzes ausgeschlossen werden können - allerdings erst nach wiederholten Verstößen gegen die Vertrauenswürdigkeit. Herstellerfirmen müssen umfangreiche Zusagen machen, etwa dass keine Daten an eine ausländische Regierung abfließen. Dies wird beim kommunistischen China als Problem angesehen. Diese Angaben werden von einem gemeinsamen Gremium aus Kanzleramt, Innenministerium, Wirtschaftsministerium und Auswärtigen Amt geprüft. Das Außenministerium hatte durchgesetzt, dass neben technischen Prüfungen auch außen- und sicherheitspolitische Erwägungen in die Beurteilung miteinfließen. Der Forderung der US-Regierung nach einem Ausschluss von chinesischen Firmen folgt die Bundesregierung nicht. Die US-Regierung wirft   Spionage sowie eine mögliche Manipulation der 5G-Netze vor. Huawei weist die Vorwürfe zurück. Regierungskreisen zufolge dürfte es Huawei aber zumindest bei kritischen Komponenten des 5G-Netzes schwer fallen, die Vertrauenswürdigkeit glaubhaft nachzuweisen. In dem Gesetzentwurf wird ein Hersteller einer kritischen Komponente als nicht vertrauenswürdig eingestuft, wenn er gegen die in seiner Garantieerklärung eingegangenen Verpflichtungen verstößt, falsche Angaben gemacht hat, Sicherheitsüberprüfungen nicht unterstützt oder IT-Schwachstellen nicht unverzüglich meldet und beseitigt. Ein Verbot kann es auch geben, wenn eine kritische Komponente „über technische Eigenschaften verfügt oder verfügt hat, die geeignet sind oder waren, missbräuchlich auf die Sicherheit, Integrität, Verfügbarkeit oder Funktionsfähigkeit der Kritischen Infrastruktur einwirken zu können“. Huawei Huawei",wirtschaftswoche
