title,author,date_published,url,article_text,source
NEV.  China kippt Beihilfen für Elektroautos ,no_author,31. Dezember 2020,https://www.wiwo.de/unternehmen/industrie/nev-china-kippt-beihilfen-fuer-elektroautos/26761388.html,"China zahlt ab dem kommenden Jahr weniger Beihilfen für Elektroautos. Die Zuwendungen für Fahrzeuge mit „neuen Antrieben“ (NEV) würden um 20 Prozent gekürzt, teilte das Finanzministerium am Donnerstag mit. Für Autos und Busse für den öffentlichen Sektor, zu dem auch Taxis gehören, sind es zehn Prozent. Subventionen und Steuernachlässe solle es aber auch 2022 noch geben. China erwartet, dass der Absatz der Fahrzeuge mit alternativen Antrieben 2021 auf 1,8 Millionen steigt, nach 1,3 Millionen in diesem Jahr. Hersteller wie Volkswagen, Toyota, Tesla und General Motors haben ihre Produktion von Elektroautos in China ausgebaut. Der Staat will, dass 2025 rund 20 Prozent der verkauften Autos alternative Antriebe haben. Derzeit sind es fünf Prozent.",wirtschaftswoche
Kritik aus Europäischem Parlament.  EU-Kommission hält Wortlaut des EU-China-Abkommens unter Verschluss ,Silke Wettach,31. Dezember 2020,https://www.wiwo.de/politik/ausland/kritik-aus-europaeischem-parlament-eu-kommission-haelt-wortlaut-des-eu-china-abkommens-unter-verschluss/26760332.html,"Die   hält die Details des Investitionsabkommens mit China (CAI) unter Verschluss und wird dafür aus dem Europäischen Parlament scharf kritisiert. „Der Prozess ist weit weniger transparent als bei TTIP und Ceta“, sagte der Vorsitzende der China-Delegation im Europäischen Parlament, Reinhard Bütikofer (Grüne), der WirtschaftsWoche mit Blick auf das gescheiterte transatlantische Handelsabkommen und den Pakt mit  . Die EU-Kommission hat den Text mit den genauen Vereinbarungen zwischen der EU und China bisher nicht veröffentlicht. Eine Sprecherin bestätigte der WirtschaftsWoche, dass noch nicht absehbar sei, wann dies passieren werde.  Ausgewählten Europa-Abgeordneten hat die EU-Kommission den Text zur Verfügung gestellt - jedoch ausschließlich zur eigenen Lektüre . „Ich darf nicht daraus zitieren“, sagt Bütikofer, „ich darf auch noch nicht einmal die Einschätzungen von Experten dazu einholen.“ Das transatlantische Handelsabkommen TTIP war 2016 nicht zuletzt wegen der massiven Kritik an seiner Intransparenz gescheitert. EU-Kommission Kanada",wirtschaftswoche
Wirtschaftspolitische Jahresvorschau.  Diese Termine müssen Sie 2021 im Blick haben ,no_author,31. Dezember 2020,https://www.wiwo.de/politik/ausland/wirtschaftspolitische-jahresvorschau-diese-termine-muessen-sie-2021-im-blick-haben/26755718.html,"Brexit und Bundestageswahl, Corona und China. 2021 stehen einige Entscheidungen und Termine an, die weitreichende Folgen für die wirtschaftspolitische Landschaft in Deutschland, Europa und der Welt haben. Wer beerbt Angela Merkel als Bundeskanzlerin und wird die Coronakrise überwunden? Welche Termine im neuen Jahr wichtig werden – ein Überblick:  Brexit is done: Nach über vier Jahren schwieriger Verhandlungen verlässt Großbritannien gleich zu Beginn des Jahres endgültig die EU.   Wie gut er ist, werden die kommenden Monate zeigen.  Stichwahl in Georgia: Im südlichen US-Bundesstaat Georgia gibt es für zwei Sitze im US-Senat eine Stichwahl.   Bei der ersten Abstimmung am 3. November hatte keiner der Kandidaten die nötige absolute Mehrheit erreicht.  Parteitag der CDU: Friedrich Merz, Armin Laschet oder doch Norbert Röttgen? Diese Frage muss die   Mitte Januar beantworten. Einer der drei Herren wird der neue  -Vorsitzende.   Denn es ist sehr wahrscheinlich, dass der neue Chef auch der Spitzenkandidat im Herbst wird.  Die Amtseinführung von Joe Biden:   Seit 1937 findet die Amtseinführung (Inauguration) an einem 20. Januar statt. Das Datum ist im Zusatzartikel 20 der Verfassung festgelegt.  Politischer Aschermittwoch: Der politische Aschermittwoch geht auf einen Viehmarkt im 19. Jahrhundert im niederbayerischen Vilshofen zurück, später folgten dort Kundgebungen des Bauernbundes.  .  -Patriarch Franz Josef Strauß war zunächst viele Jahre in einem kleinen Wirtshaus aufgetreten, bevor er die Kundgebung 1975 in die Passauer Nibelungenhalle verlegen ließ. Im Laufe der Jahre kopierten sämtliche Parteien das Format.  Chinas Volkskongress kommt zusammen: Besonders aufmerksam muss in diesem Jahr Chinas Volkskongress verfolgt werden. Wenn die Delegierten ab dem 5. März für gut zwei Wochen in Peking zusammentreffen, wird der neue Fünf-Jahres-Plan der zweitgrößten Volkswirtschaft verabschiedet. Es handelt sich um die bedeutendste Neuausrichtung seit langem. Laut einem Kommuniqué sollen eigenständige Innovationen verbessert und der Aufbau Chinas zu einer „wissenschaftlichen und technologischen Macht“ beschleunigt werden. Die neue Strategie der „zwei Wirtschaftskreisläufe“, die Staats- und Parteichef Xi Jinping seit Monaten propagiert, soll mit dem neuen Plan verwirklicht werden. Darin wird zwar die Öffnung Chinas betont, aber stärker die Förderung des heimischen Marktes als Hauptmotor und der eigenen Innovation für eine größere Unabhängigkeit hervorgehoben. Ausländische Unternehmen müssen sich an die neuen Gegebenheiten anpassen.   -Zinsentscheidung: Wie reagiert die   auf die Coronakrise?  Landtagswahlen: Die Bürger in Rheinland-Pfalz und Baden-Württemberg wählen ihren neuen Landtag.  Hexensabbat an der Börse: An diesem Tag verfallen gleichzeitig die drei Wetten auf künftige Kursentwicklungen von Aktien, Indizes und Futures.  Frühjahrstagung des Internationalen Währungsfonds (IWF) und der Weltbank:   um bei Zahlungsbilanzproblemen von Regierungen oder drohendem Staatsbankrott einzugreifen (IWF).  Weltwirtschaftsforum: Das traditionsreiche Treffen der Wirtschafts- und Politik-Elite in Davos findet 2021 in abgespeckter Form in einem Hotel bei Luzern und in Luzern selbst statt.   CO2-Ziel der EU: Voraussichtlich im Juni macht die EU-Kommission eine Reihe von Vorschlägen, um das gemeinsame CO2-Einsparungsziel von 55 Prozent zu konkretisieren:   Landtagswahl: Die Bürger in Sachsen-Anhalt entscheiden über den neuen Landtag.  Bundestagswahl: Aus deutscher Sicht vermutlich einer der wichtigsten Termine des Jahres.   Wie geht es für die   weiter und wie stark schneiden Grüne und   ab?  Gipfel der EU-Staats- und Regierungschefs: In Brüssel kommen die Regierungschefs der EU zusammen.  Der dafür nötige Handelsdeal wurde erst auf den letzten Metern ausgehandelt. Das Ergebnis der beiden Wahlen dürfte entscheiden, ob die Republikaner ihre Mehrheit in der Parlamentskammer in Washington behalten können und daher auch darüber, wie erfolgreich Joe Biden als US-Präsident regieren kann. CDU CDU Das könnte auch mit Blick auf die Bundestagwahl spannend werden. Gut zwei Monate nach der Präsidentenwahl leistet Joe Biden bei einer festlichen Zeremonie vor dem Kapitol in Washington seinen Amtseid ab. Lange wurde der politische Aschermittwoch überwiegend mit der CSU in Verbindung gebracht CSU EZB EZB Es bleibt spannend, ob Chefin Christin Lagarde ihren Kurs ändert.  Die Umsätze sind dann meist sehr hoch und die Kurse schlagen stärker aus als gewöhnlich. Die Funktion der UN-Sonderorganisationen ist zum einen die Förderung der Entwicklungshilfe (Weltbank) und zum anderen die globale Überwachung der Finanzsysteme, Thema: „The Great Reset - Der große Neustart“. Reform des Emissionshandels, eine Grenzausgleichssteuer für CO2, ein Vorschlag zur Kastenteilung und die CO2-Vorgaben für Lkw. Wer folgt nach 16 Jahren auf Angela Merkel? SPD AfD Zwei Tage lang sollen wichtige Themen besprochen werden.",wirtschaftswoche
Konjunktur.  Erholung der chinesischen Industrieproduktion verlangsamt sich ,no_author,31. Dezember 2020,https://www.wiwo.de/konjunktur-erholung-der-chinesischen-industrieproduktion-verlangsamt-sich/26760514.html,"Die chinesische Industrie hat im Dezember ihren Erholungskurs aus der Pandemie langsamer als im Vormonat fortgesetzt. Der offizielle Einkaufsmanagerindex für das verarbeitende Gewerbe (PMI) fiel auf 51,9 von 52,1 im November, wie Daten des nationalen Statistikbüros NBS am Donnerstag zeigten. Von Reuters befragte Analysten hatten einen Rückgang auf 52,0 erwartet. Die 50-Punkte Marke trennt auf monatlicher Basis Wachstum von Kontraktion. Chinas riesiger Industriesektor konnte sich dank der überraschend starken Exporte weiter von den Einbrüchen infolge des Coronavirus-Ausbruchs erholen. Erneute Lockdown-Maßnahmen bei weltweiten Handelspartnern und steigende Infektionszahlen im Inland drückten aber die industrielle Nachfrage.",wirtschaftswoche
Banken.  China schränkt Vergabe von Immobilien-Krediten ein ,no_author,31. Dezember 2020,https://www.wiwo.de/banken-china-schraenkt-vergabe-von-immobilien-krediten-ein/26761056.html,"China begrenzt erstmals die Vergabe von Immobilien-Krediten durch Banken. Damit solle das Risiko einer Immobilien-Blase begrenzt werden, berichtet die Nachrichtenagentur Bloomberg. Ab 2021 dürfen die staatseigenen Institute nicht mehr als 40 Prozent ihrer Kredite an Immobilienentwickler vergeben, das Volumen für ausstehende Hypotheken wird auf 32,5 Prozent begrenzt. Das teilte die staatliche Regulierungsbehörde mit. Banken, die diese Grenzen bislang überschreiten, sollen eine Übergangsfrist von vier Jahren bekommen, um die neuen Regularien einzuhalten. Mit dem Schritt unterstreicht die chinesische Führung ihren Anspruch, eine Blasen-Bildung auf dem Immobilienmarkt zu verhindern und die Macht der großen Immobilienentwickler zu begrenzen. Die Immobilienpreise in China steigen seit Mitte 2015 stetig, obwohl die Regierung immer wieder versucht, die Preisanstiege einzudämmen. Zwar war der Preiszuwachs im November mit nur 0,12 Prozent vergleichsweise gering. Doch das lag vor allem daran, dass neue Eigentumsregeln die Nachfrage reduziert hatten. „Dieser Schritt passt zum Plan, die Aufsicht über die Branche zu stärken und eine Blase zu verhindern“, sagt Chengyu Huang, Investment Manager bei der staatlichen Vermögensverwaltung China Cinda. „Damit wird das Interesse an Aktien im Immobilien-Bereich gebremst.“ Die chinesische Zentralbank und die Immobilien-Aufsichtsbehörde hatten Anfang 2020 strenge Berichtspflichten für die zwölf größten Bauträger des Landes eingeführt. Diese müssen nun monatlich detaillierte Auskünfte über ihre Finanzen geben. Damit solle ihre finanzielle Stabilität gesichert werden, heißt es von Regierungsseite.",wirtschaftswoche
