title,author,date_published,url,article_text,source
Langzeitarbeitslose.  Mit 40 der erste feste Job – und raus aus Hartz IV ,Harald Schumacher,08. Februar 2020,https://www.wiwo.de/unternehmen/mittelstand/langzeitarbeitslose-mit-40-der-erste-feste-job-und-raus-aus-hartz-iv/25524460.html,"Adrette Erscheinung, höfliches Auftreten, geschliffene Ausdrucksweise, abgeschlossene Ausbildung als Metallbauer: Auf den ersten Blick und auch auf den zweiten ist es kaum zu verstehen, dass Alexander Bibinger für die Jobvermittler der Agentur für Arbeit im niedersächsischen Neustadt am Rübenberge so etwas wie ein hoffnungsloser Fall war. „Sozialphobie“ nennt Bibinger das Handicap, das ihn lange daran gehindert hat einen festen Arbeitgeber zu finden und sich in die Welt eines gewöhnlichen Unternehmens zu integrieren. Seine Scheu und seine Angst in Gruppen von Menschen und Menschenansammlungen ist für andere nicht nachvollziehbar und irritierend. Ein Großraumbüro oder eine große Fertigungshalle wären für ihn das Fegefeuer, die Kantine die Hölle. So einer wird schnell als nicht teamfähig abgestempelt. Zwei Jahrzehnte ging das so. Höchstens mal ein Ein-Euro-Job, Lebensstandard Hartz IV, keine Perspektive. Aber das ist vorbei. Für immer, wenn alles gut läuft. Seit fast einem Jahr schon hat Alexander Bibinger nun einen festen Job – in einem nicht ganz gewöhnlichen Unternehmen. Nicole Willig-Pachaly und ihr Mann Georg Willig haben vor fünf Jahren eine kleine Firma übernommen, die in einer winzigen Marktnische ganz groß ist: Das Unternehmen Kunibert Michel im Neustädter Stadtteil Hagen stellt Hobelmaschinen für Teile von Oboen und Fagott-Instrumenten her. Zu ihren Kunden gehören die weltbesten Orchester- und Jazzmusiker, die mit den Maschinen individuell zugeschnittene Rohre für ihre Instrumente anfertigen. Das beste Schilfrohr dafür kommt aus dem südfranzösischen Avignon und aus Kalifornien. Fassonschneider, Außen- und Innenhobelmaschinen, sowie Messuhren für Oboe und Fagott liefert das kleine Familienunternehmen nach Russland, China, Japan und „in alle Welt“, verkürzt Willig-Pachaly die Aufzählung. Mit dem Gruß „Best wishes, The MICHEL-TEAM“ verschickt der kleine Handwerks-Betrieb Mails an seine anspruchsvollen Kunden. Vor zwei Jahren wurde klar, dass das erfolgreiche Klein-Unternehmen Verstärkung braucht. Georg Willig arbeitet seit 40 Jahren in der 1969 gegründeten Firma und ist jetzt 74, seine Frau, die heutige Firmenchefin hat 2010 dort angefangen und den Betrieb 2014 von Gründer „Kuni“ übernommen. Sohn Timo Willig, inzwischen Feinmechaniker-Meister, kam 2017 dazu. Aber Kuni ist 2015 verstorben und fehlt nicht nur als Mensch, sondern auch als Arbeitskraft. Gegen eine Neueinstellung allerdings stand die Sorge, dieses winzige Juwel des deutschen Mittelstandes mit den Fixkosten einer familienfremden Arbeitskraft zu stark zu belasten. Nach der Übernahme und mit dem Umzug vom alten Standort Hannover in ihren Wohnort Neustadt hatten die Willigs ja schon in den Bau einer neuen 240 Quadratmeter-Werkshalle und neue Maschinen investiert und zahlen noch Kredite ab. Vor fünf Jahren ist die Firma in das schmucke Gebäude in Hellgrau und Rot eingezogen.  Anfang vergangenen Jahres fand Georg Willig die Lösung des Problems beim Frühstück. In der „Leine-Zeitung“ las er, die Agentur für Arbeit übernehme ab 1. Januar 2019 für Langzeitarbeitslose die Lohnkosten, wenn Unternehmen schwer vermittelbare Arbeitssuchende einstellen. Willig rief bei der Agentur für Arbeit an und beschrieb die Situation. Die Agentur-Mitarbeiter schickten bald darauf Alexander Bibinger zum Probe-Arbeiten. 14 Tage später bekam Bibinger seinen Arbeitsvertrag. „Es passte von Anfang an“, sagt Georg Willig und findet gute Worte für den neuen Mitarbeiter und Kollegen: „Herr Bibinger ist immer pünktlich morgens um sieben Uhr da und findet sich gut ein in die Tätigkeiten unseres hoch spezialisierten Maschinenbaus mit Fräsen, Drehen, Feinmechanik.“ Finanziell ist die Situation komfortabel für die Firma. Zwei Jahre, von denen das erste im März vorbei ist, trägt die Agentur für Arbeit die kompletten Lohn- und Personalkosten für Bibinger, im dritten Jahr dann 90, im vierten Jahr 80 und im fünften Jahr 70 Prozent der Kosten. Und dann, 2024? Sagt das Unternehmen Tschüß und fängt mit einem neuen Kandidaten von vorne an? Auf keinen Fall, widerspricht Willig vehement: Das Arbeitsverhältnis mit Alexander Bibinger solle langfristig bestehen. Man brauche fünf Jahre, um alles zu begreifen und zu können, was für die Anfertigung der Kunibert-Michel-Geräte wichtig sei: „Dann wird Herr Bibinger ein noch viel wertvollerer Mitarbeiter für uns sein als jetzt. Und finanziell werden wir dann auch in der Lage sein, Lohn und Kosten selber zu tragen.“ 42.000 Arbeitslose haben bis Ende 2019 subventionierte Jobs über das Teilhabechancengesetz gefunden. 34.000 von ihnen bezogen zuvor, wie Bibinger, mehr als sechs Jahre Hartz IV. Für sie gilt der maximale Förderrahmen. Wer mindestens zwei Jahre arbeitslos war und nun eingestellt wird, für den zahlt die   im ersten Jahr 75 Prozent und im zweiten Jahr 50 Prozent der Lohnkosten. Mindestens 25 Jahre alt müssen die Jobsuchenden sein, schreibt das geänderte Sozialgesetzbuch II vor. Dass die Grundlage für die Jobsituation ein Gesetz ist und kein Förderprogramm, ist dabei wichtig. Denn Förderprogramme laufen aus, wenn ihre Befristung endet oder der Geldtopf leer ist. Gesetze gelten bis der Bundestag als Gesetzgeber sie ändert. So ist das Teilhabechancengesetz ein zuverlässiges Instrument und ein starkes Argument in den Debatten um die in der Gesellschaft umstrittene Zuwanderung ausländischer Arbeitskräfte oder die Integration von geflüchteten Migranten. Es ist die Antwort auf die berechtigte Forderung, auch den Arbeitslosen im Land eine Chance zu geben. Die Neu-Arbeitskräfte werden ein Jahr lang mit festen wöchentlichen Terminen von Coaches begleitet – auf eigenen Wunsch auch länger. 2019 wurden so jeden Monat im Schnitt 3500 Langzeitarbeitslose aus der Sackgasse geholt. Zählt man Januar und Februar 2020 hinzu, dürften es inzwischen 50.000 sein. Dreimal so viele sollen es werden, hat die Bundesregierung sich bei der Verabschiedung des Gesetzes als Ziel gesetzt:150.000. Der Fachkräftemangel trägt dazu bei, dass die Wirtschaft benachteiligte Gruppen wie Langzeitarbeitslose und Menschen mit Behinderung zunehmend als Arbeitskräftepotential sieht und diese Potentiale heben will. „Bei früheren Initiativen zur Vermittlung Langzeitarbeitsloser war das Interesse der Unternehmen nicht annähernd so groß“, sagt Detlev Scheele, der Vorstandsvorsitzende der   auf Anfrage der WirtschaftsWoche. Dreiviertel der subventionierten neuen Stellen für Langzeitarbeitslose sind bei privaten Unternehmen entstanden, nur ein Viertel bei öffentlichen Unternehmen und bei Töchtern gemeinnütziger Unternehmen. Die   etwa nutzt die neue Rekrutierungs-Möglichkeit intensiv. Vier Milliarden Euro stehen im Etat des Bundesarbeitsministerium bereit für Jobs über das Teilhabechancengesetz. „Positiver als erwartet“ sei die Zwischenbilanz, meint Agentur-Chef Scheele. Aber wie nachhaltig sind die Vermittlungen? „Spannend“ findet Scheele es, wie die Firmen nach dem Auslaufen der Fördergelder mit den Mitarbeitern umgehen werden: „Aber wir gehen von keiner Abbruchkante aus.“ In einem Jahr werden die ersten Förderphasen auslaufen, dann weiß man mehr. „Der Klebeeffekt ist nicht das Kriterium für den Erfolg der Vermittlungen“, baut Scheele vor. Es gehe darum Menschen in Lohn und Brot zu bringen, die bisher „zwar rechtlich arbeitsfähig sind, faktisch aber nicht“. Ihnen Arbeitsplätze zu vermitteln, habe langfristig positive Auswirkungen auf ihre Familien und die Zukunft ihrer Kinder. Eine Frage der Würde. Aber auch sozialpolitisch und ökonomisch ist es sinnvoll, was da passiert. Steht der Staat vor der Alternative, jemandem den Lebensunterhalt zu bezahlen oder die Arbeit, dann steckt in der zweiten Möglichkeit mehr Perspektive als in der ersten. Alexander Bibinger, ledig mit fester Freundin, sagt: „Ich finde es super, bei Kunibert-Michel Mitarbeiter zu sein.“ Georg Willig sagt: „Wir sind von der Agentur für Arbeit gut beraten worden.“  Und die Sozialphobie? Die Michel-Werkhalle liegt direkt am Bahnhof von Neustadt-Hagen. Bequem könnte Bibinger mit dem Zug kommen. Er nimmt aber Moped oder Fahrrad. Mit so vielen Leuten in den Abteilen zusammen zu sein, das würde er nicht aushalten. In der überschaubaren Michel-Werkstatt aber kommt der zurückhaltende Mann klar. Für Georg Willig ist Alexander Bibinger ein ganz normaler Mitarbeiter, denn „Macken haben wir ja alle“.  Arbeitsagentur Bundesagentur für Arbeit Deutsche Bahn",wirtschaftswoche
"Euro/Dollar .  Eurokurs bleibt unter Marke von 1,10 US-Dollar ",no_author,10. Februar 2020,https://www.wiwo.de/finanzen/boerse/euro-dollar-eurokurs-bleibt-unter-marke-von-1-10-us-dollar/25528668.html,"Der Euro hat sich am Montag nur wenig bewegt und damit die Kursverluste der vergangenen Woche vorerst nicht fortgesetzt. Am Morgen wurde die Gemeinschaftswährung bei 1,0955 US-Dollar gehandelt und damit etwa auf dem gleichen Niveau wie am Freitagabend. Die   hatte den Referenzkurs zuletzt am Freitagnachmittag auf 1,0969 Dollar festgesetzt. Zum Wochenauftakt zählte Chinas Yuan zu den Gewinnern am Devisenmarkt. Marktbeobachter verwiesen auf Meldungen über Krediterleichterungen chinesischer Banken für Unternehmen aus dem Bereich Dienstleistungen. Mit der Maßnahme sollen negative Folgen der Virus-Krise für Chinas Wirtschaft abgemildert werden. Neben dem Yuan profitierte auch der australische Dollar, der zu allen wichtigen Währungen zulegen konnte. Australiens Wirtschaft ist stark von der konjunkturellen Entwicklung im wichtigen Handelspartner China anhängig. Im weiteren Handelsverlauf stehen kaum Konjunkturdaten auf dem Programm, die für Impulse im Devisenhandel sorgen könnten. Am Vormittag richtet sich das Interesse auf den Sentix-Konjunkturindikator für die Eurozone. Am Markt wird bei einem der ersten Stimmungstests für Februar mit einem Rückgang gerechnet. Europäische Zentralbank (EZB)",wirtschaftswoche
Chefgespräch - So wurde ich die Nummer 1.  „Warum werden Hollywood-Filme durch Arri besser?“ ,Christian Schlesiger,07. Februar 2020,https://www.wiwo.de/podcast/nummer-1/chefgespraech-so-wurde-ich-die-nummer-1-warum-werden-hollywood-filme-durch-arri-besser/25523006.html,"Hören können Sie die Podcast-Folgen auf   und überall, wo Sie Podcasts abrufen: www.wiwo.de/podcast",wirtschaftswoche
"Nikkei, Topix & C0.  Asiatische Aktien rutschen wegen des Coronavirus ab ",no_author,10. Februar 2020,https://www.wiwo.de/finanzen/boerse/nikkei-topix-und-c0-asiatische-aktien-rutschen-wegen-des-coronavirus-ab/25528382.html,"Der asiatische Aktienmarkt ist am Montag infolge der jüngsten Meldungen zum Coronavirus gefallen. Die Stimmung der Anleger war trotz positiver Nachrichten über die teilweise Aufhebung von Arbeits- und Reisebeschränkungen immer noch nervös, da die Zahl der Todesopfer und Infizierten weiterhin steigt. „Die heutige (Lockerung von Beschränkungen) scheint eher eine symbolische Geste zu sein, als dass die Regierung tatsächlich dieses Virus im Griff hat“, sagte James McGlew, Analyst beim Börsenmakler Argonaut. „Wir erwarten, dass Märkte empfindlich auf Virenschlagzeilen reagieren. In diesem Umfeld bevorzugen wir eine defensive Positionierung“, schrieben die Ökonomen der ANZ-Bank in einer Mitteilung. Chinas Zentralbank hatte eine Reihe von Maßnahmen ergriffen, um die Wirtschaft zu stützen, darunter die Senkung der Zinssätze. Zudem sollen ab Montag Banken den Unternehmen, die im Kampf gegen das Virus notwendig sind, spezielle Kredite gewähren können, um die Produktion zu gewährleisten. Trotz der Maßnahmen erwarten Analysten, dass die Weltwirtschaft von einer erwarteten Abschwächung in China betroffen sein wird. „Im Moment ist unsere beste Schätzung, dass die wirtschaftlichen Folgen im Zusammenhang mit dem Coronavirus die Weltwirtschaft im ersten Quartal dieses Jahres über 280 Milliarden Dollar kosten wird“, erklärte Capital Economics. Der 225 Werte umfassende Nikkei-Index lag im Verlauf 0,4 Prozent tiefer bei 23.727 Punkten. Der breiter gefasste Topix-Index sank um 0,6 Prozent und lag bei 1721 Punkten. Die Börse in Schanghai lag 0,4 Prozent im Minus. Der Index der wichtigsten Unternehmen in Schanghai und Shenzen verlor 0,4 Prozent. Der MSCI-Index für asiatische Aktien außerhalb Japans fiel um 0,9 Prozent. Im asiatischen Devisenhandel blieb der Dollar fast unverändert bei 109,75 Yen und gab 0,2 Prozent auf 6,9897 Yuan nach. Zur Schweizer Währung notierte er 0,1 Prozent niedriger bei 0,9770 Franken. Parallel dazu stieg der Euro um 0,1 Prozent auf 1,0952 Dollar und notierte kaum verändert bei 1,0702 Franken. Das Pfund Sterling stagnierte bei 1,2894 Dollar.",wirtschaftswoche
 Europas Tech-Aktien sind ganz vorne dabei,no_author,10. Februar 2020,https://www.wiwo.de/finanzen/boerse/zschabers-boersenblick-europas-tech-aktien-sind-ganz-vorne-dabei/25524150.html,"Dass das Coronavirus alles andere als zu unterschätzen ist, dürfte einige Wochen nach seinem erstmaligen Auftreten in China jedem klar sein. Doch selbst unter Virologen wird darüber gestritten, wie gefährlich es wirklich ist. Vor diesem Hintergrund ist es einigermaßen bemerkenswert, dass die Meinung der Börsianer, von denen die meisten keine Mediziner sein dürften, von Beginn an eine derart eindeutige war. So suggerierten die Kurse am Aktienmarkt zumindest zeitweise, dass die Auswirkungen des Virus auf die Weltwirtschaft enorm sein würden.  Ungewöhnlich ist das Verhalten der Anleger nicht, immerhin sind die Grenzen zwischen begründeter Sorge und übertriebener Hysterie am Markt mitunter fließend. Das Ausmaß der Kurskorrekturen rund um den Globus lässt sich daher auch mit der aktuellen allgemeinen Nervosität begründen – eine erhöhte Schwankungsbreite an der Börse ist immer auch ein Zeichen von Unsicherheit. Da kann es, wie jüngst im Fall des Chipherstellers   geschehen, mit dem Aktienkurs in wenigen Tagen um insgesamt zehn Prozent nach unten gehen – und anschließend nach der Bekanntgabe unerwartet guter Quartalszahlen von einem auf den anderen Tag einen ebenso großen Schritt nach oben geben.  Dass Technologieaktien – egal, ob es sich dabei um ein Schwergewicht wie   oder eher einen Nischenanbieter handelt – grundsätzlich anfälliger für Schwankungen sind als die Papiere der Vertreter aus traditionellen Industrien, ist allerdings bekannt. Und so bietet auch die im Zuge der Corona-Thematik entstandenen Kursausschläge, die sich möglicherweise in der Retrospektive als übertrieben herausstellen werden, Einstiegschancen. Das oft bemühte Börsianer-Bonmot „Kaufe, wenn die Kanonen donnern“ könnte mal wieder seine Berechtigung haben. Vor diesem Hintergrund ist der Index Stoxx Europe 600 Technology einen Blick wert. Er ist es aber auch wegen eines weiteren Aspekts: Auf Sicht der vergangenen zwölf Monate hat er nicht nur den Dax, sondern auch den TecDax hinter sich gelassen. Unter den 30 Unternehmen des STOXX Europe 600 Technology sind zudem nicht nur solche aus Deutschland, sondern auch aus Frankreich, der Schweiz, den Niederlanden, Großbritannien und Schweden, Dänemark, Finnland und Spanien zu finden.  Mit seiner breiteren Aufstellung eignet er sich also noch besser für diejenigen Investoren, die aus Gründen der Risikostreuung ein höheres Maß an Diversifikation bevorzugen. Die Musik in Sachen Technologie spielt zwar zweifelsohne in den  , wo mit  ,  , der  -Mutter   und   gleich vier Konzerne aus diesem Sektor mittlerweile eine Marktkapitalisierung jenseits der Marke von einer Billion US-Dollar haben. Die europäischen Vertreter aus dem Stoxx Europe 600 Technology als zweite Reihe zu bezeichnen, würde ihrem Potenzial aber nicht gerecht werden, immerhin deckt der Index innerhalb des Technologiesektors ein breites Spektrum ab: Neben Chipherstellern wie Infineon sind Softwareanbieter wie   und   ebenso vertreten wie Payment-Unternehmen wie Ingenico, Dienstleister wie   und Marktplatzbetreiber wie   – allesamt Spezialisten in ihren Bereichen, zum Teil von internationalem Ruf.  Diese Werte zeigen auch, dass die vielzitierte   kein abstraktes Thema darstellt, das sich ausschließlich jenseits des normalen Lebens in abgeriegelten Labors abspielen würde. Digitalisierung ist vielmehr längst Teil unseres Alltags, des jetzigen und des zukünftigen. Cyber-Sicherheit, Mobilfunk oder Künstliche Intelligenz sind nur einige der Bereiche, die in den kommenden Jahren immer größeren Einfluss haben werden.  Zudem stellen immer mehr klassische Branchen ihre Prozesse digital auf. Daraus entsteht nicht selten Raum für Rationalisierungen und somit Potenzial für mehr Produktivität. Hinzu kommt, dass die wachsende Digitalisierung auch neue Geschäftsmodelle vorantreibt. Entsprechend werden ihre Wachstumsraten sein, und ähnlich stark dürften sie sich am Aktienmarkt entwickeln. Temporäre Kurskorrekturen wie die jüngste könnten Anleger daher für einen Einstieg nutzen, im Fall des Stoxx Europe 600 Technology beispielsweise über einen ETF. Infineon Infineon USA Apple Amazon Google Alphabet Microsoft SAP Bechtle Capgemini Scout24 Digitalisierung",wirtschaftswoche
Jim Farley.  Ford bringt möglichen Nachfolger für den Konzernchef in Stellung ,no_author,07. Februar 2020,https://www.wiwo.de/unternehmen/jim-farley-ford-bringt-moeglichen-nachfolger-fuer-den-konzernchef-in-stellung/25523894.html,"Ford zieht nach einer Gewinnwarnung und einem deutlichen Vertrauensverlust bei den Aktionären personelle Konsequenzen. Der zweitgrößte US-Autobauer berief am Freitag Jim Farley zum Chief Operating Officer. Damit wird der 57-Jährige für alle globalen Märkte, das Automobilgeschäft und die Themen neue Mobilität und autonomes Fahren zuständig sein. Er gilt zugleich als potenzieller Nachfolger für Konzernchef Jim Hackett, der 2017 angetreten war, um den Konzern umzubauen. Farleys Ernennung erfolgte nur drei Tage, nachdem   mit einer enttäuschenden Gewinnprognose die Anleger verschreckt hatte. Die Aktie von Ford war daraufhin an der Wall Street unter die Räder gekommen. Farleys Beförderung mit Wirkung zum 1. März ist Teil eines größeren Stühlerückens bei Ford. So soll der Präsident der Automotive-Sparte, Joe Henrichs, in den Ruhestand gehen. Er hatte bisher als einer der Favoriten für Hacketts Nachfolge gegolten. Henrichs war zuletzt intern wegen Fehlern bei Markteinführung des wichtigen SUV Explorer und steigenden Garantiekosten unter Druck geraten. Farley war lange für das Europageschäft von Ford zuständig, bevor er in die Konzernzentrale nach Dearborn wechselte. Dort war er zuletzt für neue Geschäftsfelder, Technologien und die Strategie zuständig. Hackett erklärte: „Jim Farley ist die richtige Person, um diese wichtige neue Rolle zu übernehmen.“ Seine Leidenschaft für das Autogeschäft und sein intensiver Drang nach Ergebnissen seien bekannt. Er habe sich als Manager empfohlen, „der mit Fantasie und Weitsicht dazu beiträgt, Ford in die Zukunft zu führen“. Ford hatte am Dienstag (Ortszeit) für das erste Quartal einen Rückgang des Betriebsergebnisses um mehr als eine Milliarde Dollar in Aussicht gestellt, weil eine Kombination aus geringeren Fahrzeugvolumina, höheren Investitionen in die neue Mobilität und der Nachfrageeinbruch in China zu Buche schlagen. Zugleich wurde klar, dass der Restrukturierungsplan, mit dem Hackett vor drei Jahren angetreten ist, noch lange nicht abgeschlossen ist. Ford hatte im vergangenen Jahr seine Allianz mit Volkswagen auf Elektroautos ausgeweitet. Ford",wirtschaftswoche
Zukunftstechnologie 5G.  US-Justizminister: USA sollten Nokia und Ericsson unterstützen ,no_author,09. Februar 2020,https://www.wiwo.de/unternehmen/it/zukunftstechnologie-5g-us-justizminister-usa-sollten-nokia-und-ericsson-unterstuetzen/25526990.html,"Im Kampf gegen eine wirtschaftliche Vormachtstellung Chinas hat US-Justizminister William Barr eine aktive Unterstützung der europäischen Konkurrenz des chinesischen Technologie-Konzerns   ins Gespräch gebracht. Die Vereinigten Staaten sollten ihre „finanziellen Muskeln“ spielen lassen, um die skandinavischen 5G-Ausrüster   und   zu unterstützen, sagte Barr am Donnerstag (Ortszeit) auf einer China-Konferenz des Center for Strategic and International Studies in Washington. Barr räumte ein, dass die   selbst über keinen Lieferanten verfügen, der Infrastruktur für das Netz der fünften Mobilfunkgeneration (5G) liefern könnte.   mehr. Der US-Anbieter Lucent Technologies fusionierte im Jahr 2006 mit der französischen  . Das Gemeinschaftsunternehmen landete später bei  . Das Mobilfunknetzgeschäft des zweiten relevanten US-Anbieters,  , ging im Jahr 2010 an Nokia   Networks. Aktuell versuchen die amerikanischen Netzwerk-Spezialisten   und Adtran, im 5G-Markt Fuß zu fassen, können aber bislang nur einige Bereiche mit eigenen Produkten abdecken und keine Komplettlösungen liefern. Weltweit führend sind die chinesischen Anbieter   und  . Barr bezifferte in seiner Rede den Marktanteil der beiden Konzerne auf zusammen 40 Prozent, Tendenz steigend. Nokia komme nur auf 17 Prozent, Ericsson auf 14 Prozent. Und nach Ansicht des US-Politikers geht es bei dem chinesischen Vormarsch nicht mit rechten Dingen zu. „Die Chinesen nutzen jeden Hebel der Macht, um ihren 5G-Marktanteil rund um den Globus auszubauen“, sagte Barr. Mit hohen Anschubfinanzierungen ermögliche es China den Kunden von Huawei, 5G-Netze auf Pump ohne jegliche Anzahlung aufzubauen. Im Infrastrukturgeschäft wie bei 5G sei die Größe entscheidend. In Kombination mit dem weltgrößten Inlandsmarkt seien die Chinesen in der Lage, immer mehr in ihre Technologie zu investieren. Barr betonte, die 5G-Angebote von Nokia und Ericsson seien „zuverlässige Produkte“. „Sie können die Leistung garantieren. Die europäischen Anbieter ermöglichten auch einen erfolgreichen Übergang von 4G (LTE) auf 5G. „Die Hauptsorge bei diesen Anbietern ist, dass sie weder die Größe von Huawei noch die Unterstützung eines mächtigen Landes mit einem großen eingebetteten Markt wie China haben.“ Der republikanische Justizminister, der als einer der engsten Vertrauten von US-Präsident Donald Trump gilt, verwies in diesem Zusammenhang auf Vorschläge, den Europäern unter die Arme zu greifen, um diese Bedenken auszuräumen. , entweder direkt oder über ein Konsortium aus privaten amerikanischen und verbündeten Unternehmen. „Wenn wir unseren großen Markt und unsere Finanzkraft hinter eine oder beide dieser Firmen stellen würden, würde sie zu einem weitaus stärkeren Konkurrenten werden und die Bedenken hinsichtlich ihres Durchhaltevermögens oder ihrer Ausdauer beseitigen.“ Die USA und seine engsten Verbündeten müssten diesen Ansatz sicherlich aktiv in Betracht ziehen, meinte Barr. Zuletzt hatten die USA massiven Druck auf Großbritannien, Deutschland und andere europäische Nationen ausgeübt, beim Aufbau ihrer 5G-Netzwerke auf Technologie von Huawei zu verzichten. Dabei wurde aber nicht so sehr mit einer drohenden Vormachtstellung Chinas in einem industriepolitisch wichtigen Segment argumentiert, sondern mit möglichen Sicherheitsrisiken. Die USA unterstellen dem Huawei-Konzern, eng mit der chinesischen Regierung verbandelt zu sein. Länder, die auf 5G-Technik aus China setzten, lieferten sich der Gefahr von Spionage und Sabotage aus. Konkrete Beweise für diese These wurden von den USA bislang aber nicht veröffentlicht. Auch weil bislang keine „smoking gun“, also ein handfester Beweis, vorgelegt wurde, sind die Europäer bislang nicht auf den Kurs einer Total-Blockade eingeschwenkt. Die EU-Kommission und die britische Regierung sprachen sich zuletzt nur dafür aus, risikobehaftete Anbieter aus Kernbereichen der 5G-Netze fernzuhalten, ohne Huawei oder ZTE zu erwähnen - wohl auch aus Furcht vor Boykott-Aktionen Chinas. Auch in Deutschland wird seit Monaten darüber diskutiert, ob Huawei vom 5G-Ausbau in Deutschland ausgeschlossen werden soll. Noch unklar ist, ob Anforderungen für die 5G-Sicherheit in einer Novelle des Telekommunikationsgesetzes oder im IT-Sicherheitsgesetz 2.0 landen. Huawei Nokia Ericsson USA Im Markt der Mobilfunkausrüster spielen US-Firmen tatsächlich schon seit Jahren keine Rolle Alcatel Nokia Motorola Solutions Siemens Cisco Huawei ZTE  Die USA könnten sich mit Nokia und/oder Ericsson durch eine amerikanische Kontrollbeteiligung zusammentun",wirtschaftswoche
"Geldpolitik.  Inflationsrate in China steigt auf 5,4 Prozent ",no_author,10. Februar 2020,https://www.wiwo.de/geldpolitik-inflationsrate-in-china-steigt-auf-5-4-prozent/25528606.html,"Die Inflationsrate in China ist auf den höchsten Stand seit Oktober 2011 gestiegen. Sie lag im Januar bei 5,4 Prozent, wie die nationale Statistikbehörde am Montag in Peking mitteilte. Damit fiel die Teuerung zum Jahresanfang noch etwas höher aus, als Experten erwartet hatten. Volkswirte hatten damit gerechnet, dass die Inflationsrate von 4,5 Prozent im Dezember auf 4,9 Prozent anziehen würde. Gründe für den Anstieg sind unter anderem die   wegen der Schweinepest und das Neujahrsfest. Angebotsknappheit bei Schweinefleisch",wirtschaftswoche
