title,author,date_published,url,article_text,source
Start-up-Szene.  „Keine Bürokraten am Ruder“ ,Matthias Hohensee,29. Februar 2020,https://www.wiwo.de/erfolg/gruender/start-up-szene-keine-buerokraten-am-ruder/25585770.html," Dass wir in   mit unserer Green-Deal-Strategie, also der umweltverträglichen Wirtschaft, einen für die Welt immer wichtigeren Markt bei den entsprechenden Technologien besetzen wollen und dabei globale Standards definieren. Und ich habe auch betont, dass wir in Europa bereits jetzt mehr Start-ups hervorbringen als die USA. Die Daten belegen das durchaus. Über die vergangenen zehn Jahre haben viele Mitgliedstaaten der EU und einzelne Regionen Inkubatoren, Hubs und Wissenschaftsparks geschaffen, die viele Jungunternehmen hervorbringen. Die wiederum davon zehren, dass wir sehr gute Schulen und Universitäten haben. Beim Skalieren der Unternehmen, worin das Silicon Valley so gut ist, haben wir tatsächlich Nachholbedarf. Das liegt auch daran, dass es in Europa weniger Risikokapital gibt. Aber auch viele Wagnisfinanzierer aus dem Silicon Valley investieren zunehmend in Europa. Und die EU will ihren Teil dazu beitragen, dass Jungunternehmen in Europa entstehen und auch groß werden. Und eben nicht in die USA wechseln oder aber an chinesische Investoren verkauft werden. Der European Innovation Council (EIC) richtet dazu einen 10,5-Milliarden-Euro-Fonds ein, zu dem auch 3,5 Milliarden Dollar Wagniskapital gehören. Davon können dann Unternehmen mit bis zu 17,5 Millionen Euro finanziert werden – gegen Anteile. Zudem wollen wir mit Zuschüssen die Forschungs- und Entwicklungsphase von Start-ups und Kleinunternehmen stützen. Und zwar so, dass Risiken herausgenommen werden, um weitere Investitionen zu erleichtern. Wir wollen ganz bewusst andere Geldgeber als Mitinvestoren gewinnen. Das können auch Institutionen von Mitgliedstaaten sein. Wir führen etwa Gespräche mit der Kreditanstalt für Wiederaufbau, allerdings stehen die noch am Anfang. Wir verlangen das nicht. Aber unser Ziel ist schon, dass der Fonds auch private Wagniskapitalgeber anzieht, die mitinvestieren und beim Wachstum der Unternehmen helfen. Das Gewinnen privater Investoren wird in der Startphase sicherlich eine Herausforderung sein. Aber je bessere Start-ups wir anziehen, umso einfacher wird das werden. Der Fokus liegt auf sogenannten  , also Start-ups etwa, die sich mit Biotechnologie, Medizintechnik, Fertigungsmethoden, Hardware und Künstlicher Intelligenz beschäftigen. Wir wollen es nicht zu eng definieren. Aber dort ansetzen, wo die Eintrittshürden höher liegen und Forschung und Entwicklung voraussetzen. Der EIC-Fonds ist in der Pilotphase, bislang sind dafür 1,5 Milliarden Euro bereitgestellt. Im nächsten Jahr wollen wir richtig loslegen, haben bereits 200 Leute in Brüssel. Wir hatten Ende vergangenen Jahres bereits eine erste Investitionsrunde in Höhe von 278 Millionen Euro. Beworben haben sich Start-ups mit Finanzierungswünschen von insgesamt 5,3 Milliarden Euro. Weit mehr, als wir erwartet hatten. Es waren Hunderte, allein 142 aus Deutschland. Die meisten davon Unternehmen, die zwischen fünf und 20 Mitarbeiter beschäftigen. Momentan läuft eine weitere Finanzierungsrunde. Das Interesse ist noch größer. Viele, die in der ersten Runde nicht ausgewählt wurden, haben sich erneut beworben. Wir haben 75 Unternehmen ausgewählt, 39 davon bekamen sowohl Zuschüsse als auch eine Finanzierung gegen Anteile. Darunter waren auch sieben Unternehmen aus Deutschland und sieben aus Frankreich. Mit Lösungen wie hochauflösende Mikroskope oder Sensoren für autonome Fahrzeuge. Nein. Es zählt nur die Qualität der Unternehmen. Wir wollen mit dem European Innovation Council auch eine Art Gütesiegel aufbauen. Das soll nicht nur den ausgewählten Jungunternehmen helfen, Kunden zu finden. Sondern auch Mitinvestoren für den Fonds anziehen. Da haben wir unsere Lektion gelernt. Ganz wichtig: Da sind keine Bürokraten am Ruder. Der Prozess wird von einem Gremium aus Wissenschaftlern, Experten für Risikokapital und Gründungen gesteuert. In der Pilotphase unterstützt uns die Europäische Investitionsbank. Wir denken darüber nach. Wir werden allerdings keine Innovation von Konzernen finanziell fördern. Dazu sind diese selbst in der Lage. Wenn wir es jedoch schaffen, dass die Jung- und Kleinunternehmen wachsen und wertvolle Produkte oder Dienste anbieten, die auch für europäische Großkonzerne sinnvoll sind, dann ist das doch gut. Besser jedenfalls, als sie nach China zu verkaufen. Jungunternehmen groß machen, damit sie Jobs in Europa schaffen – und echte Probleme lösen. Einmal die Qualität der Wissenschaft. Und dann die Lebensqualität: Viele Talente kommen zurück nach Europa oder gehen hierhin. In der Vergangenheit mangelte es an einer kritischen Masse von Innovationshubs. Aber die haben wir nun an Orten wie Paris, Berlin oder Helsinki. Europa Deep-Tech-Unternehmen",wirtschaftswoche
 Armin Merz? Friedrich Laschet?,no_author,29. Februar 2020,https://www.wiwo.de/politik/deutschland/tauchsieder-armin-merz-friedrich-laschet/25596098-all.html,"Sage niemand, das Ausmaß der Selbstzerlegungslust in der   sei dann doch überraschend. Der abfällige Ton, mit dem NRW-Regierungschef Armin Laschet die egomane Großmäuligkeit des theoretischen Cheferneuerers Friedrich Merz herausstreicht und ihn zum nörgelnden Revanchisten ohne politische Erfahrung stempelt? Die kalte Herablassung, mit der Merz das irrlichternde „Weiter so“ des provinziellen Leichtmatrosen Laschet der Lächerlichkeit preisgibt, den man besser nichts ans Ruder lässt? Genauso musste es im Rennen um die Führung der   kommen. Man wusste und weiß es sicher. Seit fast 15 Jahren. Damals, am Abend des 18. September 2005, beschloss Angela Merkel   lieber nicht zu regieren. Sie war wochenlang siegestrunken und reformbeschwipst durchs Land gezogen, weil sie allen Ernstes glaubte, die Deutschen mit Kopfpauschalen und einfachen Steuersätzen verzaubern zu können, angefeuert von einer schwarzgelb-karierten Medienmeute, die nach neoliberaler Katharsis verlangte – und ermuntert von einem Bundespräsidenten, der mit weit aufgerissenen Notverordnungsaugen eine „nie dagewesene, kritische Lage“ herbeiraunte, um dem rot-grünen Spuk der unseligen Schröder-Fischer-Ära endlich ein Ende zu bereiten: „Unsere Zukunft und die unserer Kinder stehen auf dem Spiel.“ Es spricht für die Deutschen, dass sie damals ruhig Blut bewahrten, Merkel nur einen denkbar knappen Sieg bescherten und ihre neue Kanzlerin lehrten: Nicht mit uns!  Aber leider stellte sich heraus, dass Merkel die Deutschen nicht verstand. Sie wähnte ihr Volk technikfeindlich und veränderungsresistent, wohlstandssatt und reformunwillig – und entschied sich fortan, blöden Schafen eine gute Hirtin zu sein. „Asymmetrische Demobilisierung“ nannten sie das im Konrad-Adenauer-Haus und waren mächtig stolz darauf: kontroverse Themen so lange und konsequent meiden, bis potenzielle Wähler des politischen Gegners maximal demotiviert sind, am Wahltag zur Urne zu schreiten. Dass Merkel mit ihrer entschiedenen Unentschiedenheit auch die eigenen Wähler dazu aufrief, sich bloß nicht für die Union zu begeistern, konnte auch damals schon niemandem entgehen.  Gewiss, als Kanzlerin war Merkel mit der Narkotisierung der politischen Öffentlichkeit zunächst erfolgreich. Doch der Parteichefin war die CDU spätestens seit 2009 egal: „Angela Merkel nährt sich vom Fleisch der Union“,  , und: „Es gehört nicht viel Fantasie dazu, sich vorzustellen, wie Merkel dereinst… vom Thron stürzt und gnadenlos zerpflückt wird… Die CDU wird nicht ewig zusehen, wie sie auf Distanz zu ihr geht, die Partei paralysiert.“ Tatsächlich erinnerte die CDU den Innenpolitiker Wolfgang Bosbach schon damals an einen „angezählten Boxer, dessen Auge zugeschwollen ist, der seinen Mundschutz längst verloren hat – und zu dem die Trainerin immer wieder sagt: Ruhig – es läuft. Ruhig – es läuft.“  Und ja, es lief tatsächlich, irgendwie, immer weiter: Weil die Union schwach und schwächer wurde – aber als Hegemon relativ erstarkte. Die CDU holte damals bei Landtagswahlen in Sachsen oder Baden-Württemberg noch knapp 40 Prozent der Stimmen. Merkel regierte im Bund mal mit den Roten, mal mit den Gelben, ganz gleich: Sie raubte der CDU ihr rheinisches Herz und ihr katholisches Zentrum, ihren konservativen Kern und ihre sozialen Prinzipien (Subsidiarität, Selbstverantwortung) – und sie verankerte die CDU im deutschen Parteienspektrum zugleich als einzige Volkspartei in einer ortlosen „Mitte“. Merkel gönnte Linken, Sozialdemokraten, Liberalen und Grünen jederzeit, sich im Glanz polierter Weltanschauungen zu sonnen. Umso strahlender konnte sie selbst erscheinen – und als nüchterne, rein vernunftgeleitete, quasipräsidiale Politschiedsrichterin glänzen, die ihrem Regierungshandeln ausdrücklich keine Weltanschauung zugrunde legt. Die Kehrseite ihrer ambitionslosen Gestaltungsarmut: Merkel ignorierte den Sinnhunger und die Resonanzbedürftigkeit der Deutschen, die politische Ortsverbundenheit namentlich der Unions-Wähler – und sah tatenlos zu, wie sie sich in Scharen von der CDU abwendeten,  , oder um sich den verbürgerlichten Babyboom-Linken anzuschließen, die ihr Leben gern mit einem normativen Surplus anreichern und als überzeugte Postmaterialisten nur das Allerselbstverständlichste für ihre Familien und Kinder fordern: saubere Fahrradstädte, eine bessere Tierhaltung, ein prima Klima (Grüne). Es ist daher nicht übertrieben,   – vor allem damit soll es in der Partei endlich ein Ende haben.  Denn Hauptsache Merkel, das hieß in den vergangenen Jahren noch dazu: verordnete Alternativlosigkeit. Die Finanz- und Eurokrise, die Rettung Griechenlands, der Ausstieg (aus dem Ausstieg aus dem Ausstieg) aus der Kernenergie,  – wann immer sich Lagen zuspitzten, moralisierte Merkel ihr situatives Handeln, um es der Kritik zu entziehen. Das war beim Thema Bankenrettung so, als sie den Zusammenhang von Risiko und Verantwortung verriet – und private Verluste sozialisierte. Das war beim Thema Griechenland der Fall, als sie die Metapher „Europa“ positivierte, um sich in den Regierungsfraktionen jede Mäkelei an der verheerenden Geldpolitik der  , an Rettungsschirmen und Hilfspaketen zu verbitten. Und das war erst recht im Falle der Flüchtlingspolitik so, als Merkel die Grenzöffnung zum „humanitären Imperativ“ erklärte: Die Behauptung ethischer Maximalprinzipien, denen Merkel vorher nicht gerecht geworden war und schon bald nicht mehr gerecht werden wollte, zielte auf die Abschaffung des Politischen schlechthin, nämlich auf die moralische Disqualifikation Andersdenkender. Man musste sich damals entscheiden zwischen Merkels Deutschland und dem Land, das nicht mehr ihres sein sollte. Spätestens als Merkel am Wahlabend im September 2017 vor lauter Selbstblindheit „nicht sehen“ konnte, „was wir anders machen sollten“, war daher klar:  Armin Laschet also oder Friedrich Merz? Es ist wahrscheinlich, dass die 1001 Delegierten des  -Parteitags am 25. April diese Frage vor allem ästhetisch beantworten werden. Jedenfalls geht es weder um eine „Richtungsentscheidung“, zu der Merz aufruft, also um die Alternative zwischen „Aufbruch und Weiter so“. Noch geht es um darum, wie Laschet insinuiert, dass die   (mit ihm) in der Mitte bliebe oder aber (mit Merz) nach rechts rücke. Und schon gar nicht geht es (vorerst) um den Entwurf eines politischen Programms, mit dem der dritte Kandidat, Norbert Röttgen, punkten will. Sondern es geht um das skizzenhafte Redesign der Partei, um einen frischen Soundauftritt nach der bleiernen Merkel-Zeit – also konkret darum, ob sich die Partei mit Laschet auf das Prinzip Gemüt(lichkeit), mit Merz auf das Prinzip Kraft(meierei) oder mit Röttgen auf das Prinzip Kompetenz(anmaßung) verpflichtet.  Das spricht zunächst einmal für Merz, den selbstüberzeugten Goldstandard christdemokratischer Wirtschafts- und Finanzpolitik, dessen Standardrefrain viele in der Union endlich mal wieder herausbrüllen wollen: Erwirtschaften vor Verteilen! Steuern runter! Soli weg! Leistung muss sich lohnen! Es ist der Sound der Neunzigerjahre, gewiss, der alten Lagerpolitik und der  . Und doch schadete es nicht, wenn er mal wieder vernehmbarer würde im allgegenwärtigen Lärm der Umverteilungsvorschläge und Identitätsnichtigkeiten. Und weist Merz nicht etwa zu Recht darauf hin, dass Typen wie er oder Bosbach als sichtbare, nicht marginalisierte Protagonisten einer Partei, die auch mal Stammtisch, common sense und klare Kante demonstrierte, dafür sorgen könnten, dass „das (Klein-)Bürgerliche“ nicht in Richtung   entgleist? Der Versuch einiger seiner CDU-Feinde, Merz gleichsam präventiv aus der Mitte zu verbannen, ist bis zum Beweis des Gegenteils grotesk. Es war nicht Merz, der Hans-Georg Maassen als Verfassungsschutzchef duldete. Und es war auch nicht Merz, sondern es waren Markus Söder, der heutige  -Chef, und Jens Spahn, der Junior aus dem Laschet-Team, die vor zwei Jahren keine Gelegenheit verstreichen ließen,   – die es für eine schlaue Strategie hielten, sich der   rhetorisch anzunähern. Bis zum Beweis des Gegenteils bleibt daher festzuhalten: Merz grenzt sich klipp und klar ab von der AfD und vom Rechtsextremismus, weshalb er selbstverständlich auch „nach Hanau“ über das polizeiliche Vorgehen gegen kriminelle Clans sprechen kann. Warum sollte er nicht? Merz’ Problem ist vielmehr, dass seine breitbeinige Impulsivität und pennälerhafte Männlichkeit die gedanklichen Kurzschlüsse eines Weltbildes offenlegt, das erkennbar aus dem 20. Jahrhundert stammt. Und dass er nicht nur deshalb ein begnadeter Produzent von Missverständlichkeiten ist. Merz ist es auch, weil er das typisch moderne Nebeneinander von zwei Phänomenen („Fremdenfeindlichkeit“ und „Ausländerkriminalität“) nicht analytisch trennt, um beide Phänomene politisch zu adressieren – weil er die Phänomene stattdessen halbkausal miteinander verknüpft. Warum nur? An einem Mangel an Intelligenz kann es nicht liegen. Aber was ist es dann? Absicht? Das wäre in der Tat verwerflich. So oder so: Man wird einen Parteichef Friedrich Merz wieder und wieder fragen müssen, was er eigentlich meint und wie er es meint – und das ist (s)ein Problem. Armin Laschets Problem ist ein anderes, man kann es in zwei kurze Fragen fassen: Will er überhaupt Kanzler werden, und wenn ja: warum? Merz wird klug genug sein, um seinen Leistungsrefrain zeitgemäß zu akzentuieren, ihn gleichsam neu aufzulegen: Wie behauptet sich   ökonomisch und technologisch, politisch und militärisch? Wie sichern wir unseren Wohlstand? Wie verteidigen wir das Modell Europa, die soziale Marktwirtschaft gegenüber den forcierten Interessen der amerikanischen Finanz- und Datenindustrie in den USA und gegenüber dem Staatskapitalismus in China? Wie kann es gelingen, die deutsche Autoindustrie zu retten? Die Energiewende zu gestalten? Die Menschen im Osten wieder für die Parteien der demokratischen Mitte zu gewinnen? Man glaubt Merz aufs Wort, dass er darauf brennt, diese Fragen als CDU-Chef und Kanzler beantworten zu können – auch wenn sich manche vor diesen Antworten fürchten dürften. Und auch wenn Merz erst noch beweisen müsste, dass ausgerechnet er die Deutschen nicht seinerseits mit einem Vokabular der Alternativlosigkeit (Die Kräfte der Globalisierung! Der Druck der Finanzmärkte!) vor scheinvollendete Tatsachen (Löhne runter! Schwarze Null!) stellen will. Aber brennt auch Laschet darauf? Es ist womöglich der entscheidende Unterschied in den kommenden Wahlkampf-Wochen: Sie werden sich fragen in der CDU, ob Merz, der testosteronreich Jungenstolze und mimosenhaft Empfindsame, der Kritik gewachsen sein würde, die ihm an der Spitze der Partei (und des Staates) täglich entgegenschlüge. Und sie werden sich mit Blick auf Armin Laschet fragen – ja, was eigentlich? Laschet kann die CDU, wie es scheint, nur als „Mitte“ erhalten, als politische Leerstelle, die allein durch das definiert ist, was sich zu gegebener Zeit auf den größten gemeinsamen Nenner bringen lässt. Reicht das einer CDU in der schwersten Identitätskrise ihres Lebens? Wie sähe Laschets Leitkultur für die CDU aus? Und wie wollte er damit auch nur einen Wähler mehr als Merz von den Grünen zurückgewinnen, die Merkel an die Grünen verloren hat? Es ist unwahrscheinlich, dass Laschet auf diese Fragen bis zum 25. April eine definitive Antwort finden muss. Aber dass er hungrig ist, sich diesen Fragen als Parteichef und womöglich als Kanzler auch wirklich zu stellen – das ist die ästhetische Minimalanforderung, die die CDU am 25. April auch an ihn stellen wird.  CDU CDU Deutschland habe ich an dieser Stelle vor elf Jahren geschrieben um entweder als Heimatvertriebene der konservativen Revolution ihre Stimme zu leihen (AfD) wenn der neue Juniorpartner von Armin Laschet im Rennen um den CDU-Vorsitz, Jens Spahn, eine restlos inhaltsleere CDU heute in der „größten Krise ihrer Geschichte“ sieht: Hauptsache Merkel?  nicht zuletzt der Grenzkontrollverlust während der Flüchtlings- und Migrationskrise 2015/16 EZB Ihre Nachspielzeit hatte begonnen. CDU CDU Jungen Union AfD CSU um sich mit Sprüchen wie „Niemand muss in Deutschland hungern!“ oder „Ich bin burkaphob!“ oder „Asyltourismus!“ als hauptamtliche Rechtsausleger der CDU zu profilieren AfD Deutschland",wirtschaftswoche
Fast so heftige Auswirkungen wie Finanzkrise.  Wie die Handelsschifffahrt unter dem Coronavirus leidet ,"Jacqueline Goebel, Jannik Deters",29. Februar 2020,https://www.wiwo.de/unternehmen/dienstleister/fast-so-heftige-auswirkungen-wie-finanzkrise-wie-die-handelsschifffahrt-unter-dem-coronavirus-leidet/25590726.html,"Vor dem Hafen Ningbo-Zhoushan liegen dutzende Schiffe vor Anker. Sie treiben in der Bucht und rund um die vorgelagerten Inseln. Wer auf Analyseseiten wie MarineTraffic die Position der Schiffe nachverfolgen will, sieht jede Menge grüne Punkte im seichten Wasser vor den Inseln. Jeder Punkt steht für ein Schiff. Viele davon haben sich seit Tagen nicht bewegt, einige sogar seit Wochen nicht. Sie warten auf neue Aufträge. Der Grund: Das grassierende neue Coronavirus. Die wirtschaftlichen Einschränkungen durch die Epidemie mit dem Virus SARS-CoV-2 bedeuten für die Handelsschifffahrt fast so große Einschnitte wie die Finanzkrise. Das geht aus einer Analyse des Branchendienstes Alphaliner über die zur Zeit unbeschäftigte Flotte hervor: Schiffe mit einer Kapazität von 2,4 Millionen Standardcontainern haben ihre Fahrten gestoppt und liegen ohne weiteres Ziel vor Anker. Gemessen an der Kapazität ist das sogar mehr als 2009 während der Finanzkrise: Damals waren Handelsschiffe mit einer Kapazität von 1,52 Millionen Standardcontainern unbeschäftigt. Prozentual gesehen ist der Anteil der Handelsschiffe ohne Beschäftigung aktuell jedoch etwas kleiner: In der Finanzkrise traf die Flaute 11,7 Prozent der gesamten Handelsflotte. Heute sind es nach Berechnungen von Alphaliner nur etwa 8,8 Prozent. Der Grund: Im vergangenen Jahrzehnt wurde durch neue, größere Schiffe die weltweite Kapazität auf fast 23 Millionen Standardcontainer aufgestockt. Die Zahlen zeigen die Dimension der wirtschaftlichen Einschränkungen durch das Coronavirus. Die Containerschifffahrt gilt als Indikator für den Welthandel, etwa 80 Prozent aller Güter werden über die Meere transportiert. Ningbo-Zhoushan ist der drittgrößte Hafen der Welt – mittlerweile liegen sieben der Top Ten in China. Wenn dort kein Handel stattfindet, dann ist das kein gutes Zeichen für den Welthandel. Beinahe alle Reedereien haben in Folge der chinesischen Neujahrsfeierlichkeiten Fahrten zwischen China und Europa abgesagt. Zu einem gewissen Grad ist das normal rund um den wichtigsten chinesischen Feiertag. Doch durch das Coronavirus hat sich die Zeitspanne enorm ausgeweitet: In den vergangenen Wochen haben die Reedereien nach Daten von Alphaliner beinahe 50 Prozent ihrer Dienste zwischen Asien und Europa gecancelt. Das Problem sind nicht nur die Produktionsstopps: In den chinesischen Häfen kommt es wegen Personalmangel durch die Quarantänemaßnahmen zu Stau. Außerdem fehlt es an Lastwagenfahrern, um die Ware abzutransportieren. So warnte der weltgrößte Seefrachtspediteur Kühne und Nagel vor wenigen Tagen seine Kunden noch: „Die Häfen von Shanghai, Tianjin und Ningbo bleiben überlastet.“ Für Kühlcontainer, in denen etwa Fleisch und Gemüse transportiert werden, gäbe es in den Häfen kaum noch Steckdosen. Die Kühlcontainer können deshalb nicht von den Schiffen entladen werden – die Ware würde ohne Kühlung vergammeln. Hinzu kommen die Sicherheitsmaßnahmen zum Schutz vor einer weiteren Ausbreitung der Krankheit: Oldendorff, eine der größten Reedereien für Massengüter wie Getreide, hat aus früheren Krisen gelernt, zum Schutz der eigenen Mitarbeiter schneller zu reagieren. Das Lübecker Unternehmen verhängte unmittelbar nach der ersten Verbreitung des Coronavirus einen Reisestopp für seine 4000 Mitarbeiter weltweit. In Risikogebieten wie China und Singapur seien Landgänge, Besucher an Bord und das Wechseln der Crews verboten. So stark wie jetzt seien die Einschränkungen für die Flotte noch nie gewesen, berichtet Oldendorff-Kommunikationschef Scott Jones. Für die Reedereien birgt die Situation auch finanziell große Risiken. Die Frachtraten sind in den vergangenen Wochen stark gesunken. So kostet ein Container von China nach Europa laut dem Frachtindex SCFI aktuell kaum noch 800 Dollar. Ende 2019 lag der Index noch bei über 1000 Dollar je Container. Dabei haben die Reeder sogar Glück, dass die Handelsflaute sie nicht noch schlimmer trifft: „Weil seit Jahresanfang in der Schifffahrt strengere Umweltregeln gelten, befinden sich viele Schiffe für Nachrüstungen von Abgasreinigungsanlagen in Werften“, erklärt Analyst Thomas Wybierek von der NordLB: „Sonst würden die Effekte durch das Coronavirus die Containerschifffahrt noch härter treffen.“ Doch wegen der strengeren Umweltvorschriften steigen zugleich auch die Treibstoffkosten für viele Reeder. „Die Branche gerät doppelt unter Druck“, erklärt Wybierek. Nur zwei Mal hat die Schifffahrt es bisher erlebt, dass in so kurzer Zeit so viele Schiffe ohne Beschäftigung waren. Das erste Mal während der Finanzkrise, das zweite Mal traf die Branche die Pleite der Reederei Hanjin. Quasi über Nacht war die südkoreanische Reederei zahlungsunfähig, Häfen hielten deshalb Hanjin-Schiffe fest. Andere blockierten die Einfahrt, weil unklar war, wer für die Hafengebühren aufkommt. Die Pleite von Hanjin nahm 2016 etwa 1,6 Millionen Standardcontainer aus dem Markt, berichtet Alphaliner. Doch innerhalb von wenigen Wochen normalisierte sich die Situation wieder. Wie lange es diesmal dauern wird, bis die Containerschiffe wieder über die Meere fahren, hängt wohl vom weiteren Verlauf der Coronavirus-Epidemie ab. Die Seefrachtspedition Kühne und Nagel warnt Kunden bereits: „Auf Langstrecken werden die Leerfahrten bis Mitte März fortgesetzt.“",wirtschaftswoche
"Dow Jones, Nasdaq, S&P 500.  Wall Street steht vor dem größten Wochenverlust seit der Finanzkrise ",no_author,28. Februar 2020,https://www.wiwo.de/finanzen/boerse/dow-jones-nasdaq-sundp-500-wall-street-steht-vor-dem-groessten-wochenverlust-seit-der-finanzkrise/25594696.html,"Die weltweite Börsenpanik wegen des Coronavirus hält die Aktienmärkte in den   fest im Griff. Die Kurse an der Wall Street brachen zum Wochenschluss weiter ein und steuerten auf den größten Wochenverlust seit der Finanzkrise 2008 zu. Der Dow-Jones-Index der Standardwerte, der breiter gefasste S&P und der Index der Technologiebörse Nasdaq notierten in den ersten Handelsminuten jeweils 2,7 Prozent im Minus bei 25.155, 2898 und 8332 Punkten. „Diese Verkäufe sind ein bisschen extrem für etwas, über das wir nicht genug wissen“, sagte Robert Pavlik, Chefstratege beim Vermögensverwalter SlateStone Wealth. „Was ich weiß, ist, dass das Coronavirus uns nicht in eine lange anhaltende Finanzkrise führen wird. Es könnte zu einer technischen Rezession kommen.“ In China hat die Epidemie zwar ihren Höhepunkt überschritten, in anderen Ländern steigt aber die Zahl der Neuinfektionen. Das schürt bei Investoren die Furcht vor einer Rezession. Die Zinsen für langfristige Papiere liegen inzwischen unter denen für Anleihen mit kürzeren Laufzeiten, was als Warnsignal für eine schrumpfende Wirtschaft gilt. Am Markt wird nun mit einer Zinssenkung der US-Notenbank   möglicherweise schon im März gerechnet. Allerdings wachsen Zweifel, ob das die   in Schwung bringen könnte. „Niedrigere Zinsen bringen fast gar nichts, wenn es einen Angebotsschock wie diesen gibt, und auch die positiven Auswirkungen auf die Nachfrage sind fraglich, wenn ganze Volkswirtschaften abgeriegelt werden“, sagte Marios Hadjikyriacos, Analyst beim Onlinebroker XM. USA Fed Konjunktur",wirtschaftswoche
