title,author,date_published,url,article_text,source
Absatz von Apple-Geräten gesunken.  Apple kippt Umsatzprognose – wegen Coronavirus ,no_author,18. Februar 2020,https://www.wiwo.de/unternehmen/it/absatz-von-apple-geraeten-gesunken-apple-kippt-umsatzprognose-wegen-coronavirus/25556240.html," wird wegen des Coronavirus-Ausbruchs in China die erst   für das laufende Quartal verfehlen. Bei iPhones gebe es Lieferengpässe, weil die Produktion in China langsamer hochgefahren werde als geplant, teilte der Konzern am Montag mit. Zudem sei der Absatz von  -Geräten in China zuletzt gedämpft gewesen, da viele Geschäfte – und auch die Stores der Firma – zeitweise geschlossen blieben und schlecht besucht worden seien. Aus diesen Gründen werde Apple die   verfehlen, hieß es. Apple hatte damals unter Verweis auf die Coronavirus-Risiken bereits eine ungewöhnlich breite Spanne von 63 bis 67 Milliarden Dollar (58,1 bis 62,8 Milliarden Euro) angegeben. Damit lagen die Kalifornier über den durchschnittlichen Analystenschätzungen von 62,4 Milliarden Dollar. Eine neue Prognose gab es jetzt nicht. Die Einschränkungen für das Geschäft seien nur vorübergehend, betonte der Konzern. Im Vorjahresquartal hatte Apple 58 Milliarden Dollar Umsatz erwirtschaftet. Die Ankündigung erfolgte an einem US-Feiertag, die Wall Street beginnt diese Woche den Handel am Dienstag. Zwar werde bereits seit Wochen über die Auswirkungen der Epidemie auf das Smartphone-Geschäft von Apple diskutiert, schrieb der Analyst Daniel Ives zu der Ankündigung. Dass Apple allerdings bereits Mitte Februar deswegen seine Umsatzerwartungen zurücknehme zeige dass die Folgen „offensichtlich größer sind als befürchtet“. Die Werke der Apple-Fertiger wie Foxconn und Pegatron sowie der wichtigsten Zulieferer befinden sich zwar außerhalb der besonders von der neuen Lungenkrankheit Covid-19 betroffenen Provinz Hubei. Doch in China wurden auch anderswo die traditionellen Werksferien zum chinesischen Neujahrsfest verlängert, um eine Ausbreitung zu vermeiden. Alle Produktionswerke liefen zwar wieder. Aber: „Die iPhone-Lieferengpässe werden vorübergehend den Umsatz weltweit beeinträchtigen.“ Die Situation sei im Fluss - und mehr Informationen zu den Auswirkungen auf das Apple-Geschäft solle es erst mit den Zahlen zum laufenden Quartal im April geben. Die Gesundheit der Mitarbeiter habe Priorität, schrieb Apple-Chef Tim Cook in einer Mail an die Belegschaft, die vom Finanzdienst Bloomberg veröffentlicht wurde. Es ist das zweite Mal binnen gut eines Jahres, dass Apple eine Umsatzprognose zurücknehmen muss – zuletzt war es für das Weihnachtsquartal 2018. Damals hatte Apple die Abschwächung der chinesischen Wirtschaft für schwächer als erwartet ausgefallene iPhone-Verkäufe verantwortlich gemacht. Die Ankündigung erfolgte an einem US-Feiertag, die Wall Street beginnt diese Woche den Handel am Dienstag. Apple hat bislang einen Umsatz für das zweite Geschäftsquartal bis März von 63 Milliarden bis 67 Milliarden Dollar in Aussicht gestellt. Damit lagen die Kalifornier über den durchschnittlichen Analystenschätzungen von 62,4 Milliarden Dollar. Zwar werde bereits seit Wochen über die Auswirkungen der Epidemie auf das Smartphone-Geschäft von Apple diskutiert, schrieb der Analyst Daniel Ives zu der Ankündigung. Dass Apple allerdings bereits Mitte Februar deswegen seine Umsatzerwartungen zurücknehme zeige dass die Folgen „offensichtlich größer sind als befürchtet“. Apple ist nicht der einzige Elektronik-Anbieter, der von Coronavirus-Folgen erfasst wird. So warnte   bereits Anfang Februar vor Engpässen bei seiner Spielekonsole Switch, weil einige Bauteile aus China knapp seien.  Einige Betriebe von Zulieferern befinden sich in der besonders betroffenen Region rund um die Stadt Wuhan. Es gebe aber alternative Quellen für ihre Produkte, sagte damals Konzernchef Tim Cook. Zugleich räumte er aber auch ein, dass Entwicklung in anderen Teilen der Produktionskette schwer vorherzusagen sei. Die Anleger nahmen Apples Warnung gelassen auf: Die Aktie notierte im nachbörslichen US-Handel am Montag kaum verändert. Bis Montag waren in China rund 1770 Menschen an Covid-19 gestorben. Experten gehen von einer hohen Dunkelziffer bei den Fallzahlen aus. Apple wenige Wochen alte Umsatzprognose Apple erst Ende Januar gemachte Umsatzprognose für dieses Vierteljahr Nintendo Apple hatte im Januar von Beeinträchtigungen für die Produktion gesprochen.",wirtschaftswoche
"Nikkei, Topix & Co.  Apples Umsatzwarnung lastet auf Tokioter Aktienmarkt ",no_author,18. Februar 2020,https://www.wiwo.de/finanzen/boerse/nikkei-topix-und-co-apples-umsatzwarnung-lastet-auf-tokioter-aktienmarkt/25556134.html,"Der Aktienmarkt in Tokio hat nach einer Umsatzwarnung von Apple wegen des Coronavirus-Ausbruchs mit einem deutlichen Minus den Handel begonnen. Besonders Technologie-Werte zogen die wichtigsten Indizes am Dienstag ins Minus. Der iPhone-Hersteller hatte zuvor wegen des Ausbruchs in China  . Die Hersteller von Maschinen zur Fertigung von Halbleitern wie Tokyo Electron sackten ab. Zuvor war bekanntgeworden, dass die   Maßnahmen zur Unterbindung von Chiplieferungen an   prüfen. Der 225 Werte umfassende Nikkei-Index lag im Verlauf 1,2 Prozent tiefer bei 23.237 Punkten. Der breiter gefasste Topix-Index sank ebenfalls um 1,2 Prozent und lag bei 1668 Punkten. Die Börse in Shanghai lag 0,2 Prozent im Minus. Der Index der wichtigsten Unternehmen in Shanghai und Shenzen verlor 0,6 Prozent. Im asiatischen Devisenhandel verlor der Dollar 0,2 Prozent auf 109,67 Yen und legte 0,2 Prozent auf 6,9947 Yuan zu. Zur Schweizer Währung notierte er kaum verändert bei 0,9806 Franken. Parallel dazu fiel der Euro um 0,1 Prozent auf 1,0828 Dollar und gab 0,1 Prozent auf 1,0619 Franken nach. Das Pfund Sterling verlor 0,1 Prozent auf 1,2998 Dollar. seine eigenen Umsatz-Ziele zurückgenommen USA Huawei",wirtschaftswoche
Luftfahrt.  Deutsche Flughäfen melden Passagierrekord ,no_author,18. Februar 2020,https://www.wiwo.de/unternehmen/handel/luftfahrt-deutsche-flughaefen-melden-passagierrekord/25556802.html,"Die Zahl der Passagiere an deutschen Flughäfen hat 2019 trotz spürbar weniger Wachstum einen Rekord erreicht. Von den bundesweit 24 größten Airports starteten rund 124,4 Millionen Fluggäste, wie das Statistische Bundesamt am Dienstag mitteilte. Der Anstieg von 1,5 Prozent zum Vorjahr fällt damit aber deutlich geringer aus als noch 2018 mit 4,2 Prozent. Starker Wettbewerb führte dazu, dass einige Airlines wie die Lufthansa-Billigtochter   Kapazitäten abbauten. Während Flugreisen im Inland um 1,8 Prozent zurückgingen, legte der Auslandsflugverkehr, der seit Jahren für kräftiges Wachstum sorgt, überdurchschnittlich um 2,3 Prozent zu. Seit 2009 stieg die Passagierzahl auf Auslandsflügen um gut 50 Prozent. Im laufenden Jahr dürfte die Coronavirus-Epidemie in China den Luftverkehr bremsen. Der Branchenverband BDL hatte allerdings jüngst angekündigt, der Dämpfer werde eher gering ausfallen, wenn die Krankheitswelle ab Mitte März wieder abebben sollte. Die Unsicherheit über den Brexit dürfte dazu beigetragen haben, dass die Zahl der Passagiere mit Ziel Großbritannien 2019 um fast vier Prozent gesunken ist. Damit rutschte das Vereinigte Königreich von Platz zwei auf Rang vier der beliebtesten Ziele deutscher Flugreisender. Spitzenreiter mit großem Abstand bleibt Spanien, während sich die Türkei auf Platz zwei verbesserte und Italien auf Rang drei kletterte. Eurowings",wirtschaftswoche
„Sorgen über mögliche Folgen“.  Bundesbank: Coronavirus dürfte deutsche Exporte dämpfen ,no_author,17. Februar 2020,https://www.wiwo.de/politik/deutschland/sorgen-ueber-moegliche-folgen-bundesbank-coronavirus-duerfte-deutsche-exporte-daempfen/25553826.html,"Die Bundesbank sieht in der Coronavirus-Epidemie in China eine neue Gefahr für die ohnehin schwächelnde deutsche Wirtschaft. „Konjunkturrisiken bestehen im Hinblick auf den Coronavirus-Ausbruch in der Volksrepublik China“, warnt sie in ihrem am Montag veröffentlichten Monatsbericht. „So dürfte dort ein vorübergehender Rückgang der gesamtwirtschaftlichen Nachfrage die deutsche Exportaktivität dämpfen.“ Zudem könnten globale Wertschöpfungsketten durch die Sicherheitsvorkehrungen beeinträchtigt werden. „Lieferengpässe in einzelnen Branchen hierzulande wären die Folge“, betonte die Bundesbank. Sie verwies darauf, dass im Kampf gegen die Ausbreitung des Virus das öffentliche Leben in China seit Mitte Januar weitgehend lahmgelegt worden sei. Das drücke im laufenden Quartal die   beim wichtigsten deutschen Handelspartner. „Die Wachstumseinbußen könnten spürbar höher ausfallen als während der SARS-Epidemie von 2002/2003, bei der die Zahl der Infizierten deutlich kleiner war und die Behörden weniger rigoros reagiert hatten“, schrieb die Bundesbank. „Gleichwohl sollte auch für die aktuelle Krankheitswelle gelten, dass sich nach ihrer Eindämmung die Wirtschaftstätigkeit wieder zügig normalisieren wird.“ Die Finanzmärkte seien derzeit von „Sorgen über mögliche Folgen des Coronavirus geprägt“. Die deutsche Wirtschaft ist im vergangenen Jahr wegen schwacher Weltkonjunktur, Handelskonflikten und Brexit-Chaos mit 0,6 Prozent so langsam gewachsen wie seit 2013 nicht mehr. Für dieses Jahr geht die Bundesbank bislang von einem Plus beim Bruttoinlandsprodukt von 1,0 Prozent aus.  (BCG). „Aber die Autoindustrie sticht hervor als eine, die die Auswirkungen schnell und tief spürt angesichts der entscheidenden Rolle Chinas.“ So sei das Land der größte Absatzmarkt für Neuwagen und zugleich wichtiger Standort für Hersteller und Zulieferer. „Die Autoindustrie wird lokal und rund um den Globus betroffen sein“, schreiben die Berater mit Blick auf gestörte Lieferketten. Allein in der besonders betroffenen Provinz Hubei würden an gut einem Dutzend Standorten fast zwei Millionen Autos pro Jahr gefertigt,   Das seien etwa acht Prozent der Fahrzeugproduktion Chinas. Insgesamt gebe es über 700 ausländische und chinesische Zulieferer in der Provinz mit ihrer abgeriegelten Hauptstadt Wuhan. Auch ausländische Autohersteller seien in Hubei stark engagiert: Ein Großteil der Produktion von Gemeinschaftsfirmen mit chinesischen Unternehmen entfalle auf die Provinz, so BCG. Gemeinschaftsfirmen des chinesischen Herstellers Dongfeng mit  ,   und   etwa haben ihren Hauptsitz in Wuhan.   – etwa bei Bremsen, Elektronik, Fahrgestellen und Rädern. Jede dieser Kategorien stehe für Exporte im Wert von 5 bis 6 Milliarden US-Dollar, so BCG. Über die Hälfte dieser Ausfuhren gehe in die USA und die EU. Die Folgen gestörter Lieferketten würden „in den Firmenzentralen rund um den Globus zu spüren sein“, prophezeien sie.   für Turbulenzen oder Aktivitäten in andere Länder verlagern. Die weltweite Konjunktur hängt inzwischen viel stärker vom Wohle Chinas ab als noch während der Sars-Epidemie 2002/2003. „Der Anteil Chinas an der globalen Wirtschaftsleistung hat sich seitdem verdreifacht und China ist zu einem wesentlichen Käufer praktisch jedes Rohstoffs geworden“, sagt Portfoliomanager Jeroen Blokland vom Vermögensverwalter Robeco. Die schiere Größe der chinesischen Volkswirtschaft führe dazu, dass andere aufstrebende Länder in der Region zumindest zeitweilig ebenfalls eine Wachstumsdelle erleiden werden. Die Quarantäne für zahlreiche Millionenstädte wie Wuhan, dem Zentrum der Coronavirus-Krise, könnte das chinesische Wirtschaftswachstum 2020 um 0,4 Prozentpunkte schmälern, prognostiziert Anlagestratege Frank Häusler von der  . Ursprünglich hatten Experten ein Plus von sechs Prozent erwartet. Sollte die chinesische Industrieproduktion länger ins Stocken geraten, werde sich dies wegen der eng verwobenen Lieferketten vor allem auf Taiwan, Malaysia und Südkorea auswirken, warnt Ulrich Stephan, Chef-Anlagestratege für Privat- und Firmenkunden bei der  . Bei den Schwellenländern außerhalb Asiens gilt Lateinamerika als besonders anfällig. Im vergangenen Jahr trieben Investoren schwere Unruhen in Chile und in Kolumbien um. Die Bemühungen um marktfreundliche Reformen wurden letztlich zunichte gemacht. „Der Coronavirus-Schreck war sicherlich nicht hilfreich“, resümieren die Nikko-Experten. Wegen der Brisanz hat die Regierung in Peking Experten zufolge keine andere Wahl, als mit allen verfügbaren Mitteln die Verbreitung des Virus zu stoppen. Mit massiven fiskal- und geldpolitischen Maßnahmen müsse zudem der unvermeidbare scharfen Einbruch der Wirtschaft im ersten Quartal aufgefangen und im weiteren Jahresverlauf wieder ausglichen werden, rät Adolf Rosenstock, volkswirtschaftlicher Berater vom Vermögensverwalter MainSky. Da die chinesische Notenbank bereits mit Geldspritzen und Zinssenkungen reagiert und die Regierung geringere Steuern und Abgaben in Aussicht gestellt hat, setzen viele Experten auf eine rasche Erholung der Konjunktur in China und weltweit. Große Investmenthäuser wie JPMorgan oder die Vermögensverwaltung der Bank   halten an ihren positiven Schwellenländer-Prognosen für 2020 fest. „Die Bewertungen sind wirklich überzeugend, und wir haben Anzeichen für eine wirtschaftliche Erholung gesehen“, sagt Portfolio-Manager Robert Phipps vom Vermögensverwalter Per Stirling. „Wenn beim Coronavirus erst einmal die Pausetaste gedrückt ist, wird das meiner Meinung nach wieder der Haupttrend sein.“ Vorerst ist Peking aber noch um die Eindämmung bemüht. Mit dem Anstieg erfasster Coronavirus-Infektionen auf mehr als 70.000 plant China nun eine Verschiebung der Jahrestagung seines Parlaments. Es ist das erste Mal in der jüngeren Geschichte der Volksrepublik, dass die Sitzung des nationalen Volkskongresses verlegt wird. Das wichtigste politische Ritual des Jahres hätte am 5. März in Peking beginnen sollen.  Der Führungskreis des Ständigen Ausschusses halte die Verschiebung des Volkskongresses auf einen angemessenen Zeitpunkt für „notwendig“, berichtete die amtliche Nachrichtenagentur Xinhua am Montag. Formell soll der Ausschuss am nächsten Montag darüber entscheiden. Rund 6000 Abgeordnete des Volkskongresses und Mitglieder der parallel tagenden beratenden Konsultativkonferenz hätten aus allen Provinzen in die Hauptstadt kommen müssen. Die ungewöhnliche Verschiebung wurde auch damit begründet, dass viele der Abgeordneten „an vorderster Front“ gegen die Covid-19-Epidemie kämpften. Innerhalb eines Tages war zuvor die Zahl erfasster Ansteckungen mit dem neuen Coronavirus Sars-CoV-2 im Land um mehr als 2000 auf über 70.500 gestiegen. Mehr als 100 weitere Todesfälle wurden gemeldet. Damit starben bis Montag in China rund 1770 Menschen an der Covid-19 genannten Lungenkrankheit. Experten gehen von einer hohen Dunkelziffer bei den Fallzahlen aus. Besonders schwer ist in Zentralchina die 60 Millionen Einwohner zählende Provinz Hubei mit der Metropole Wuhan betroffen. Konjunktur Das Coronavirus habe schon viele Branchen in Mitleidenschaft gezogen, kommentierte die Beratungsfirma Boston Consulting Group heißt es in einer Studie der BCG. Honda PSA Renault Ein Produktionseinbruch könnte globale Folgen für Lieferketten haben, da China einer der größten Exporteure von Fahrzeugteilen sei Autokonzerne mit großem China-Geschäft sollten ihre Lieferketten rüsten Bank Vontobel Deutschen Bank UBS",wirtschaftswoche
Nach Brexit.  Brüssel steht vor hartem Budget-Poker ,no_author,17. Februar 2020,https://www.wiwo.de/politik/europa/nach-brexit-bruessel-steht-vor-hartem-budget-poker/25551286.html,"Das Drama um den Brexit hat Europa lange gelähmt. Dabei wurden auch einige schwerwiegende Schwächen im System sehr deutlich: Jede Entscheidung erfordert zunächst ein zähes Ringen unter zunehmend zerstrittenen Partnern. Oft genügt dann das Veto eines einzigen Staates, um mühsam ausgehandelte Kompromisse doch noch zu kippen. Jetzt kommt ein weiteres Problem hinzu: Mit den Briten hat die Union einen wichtigen Beitragszahler verloren. Beim Budget sind Anpassungen also unvermeidbar. Entweder müssen Kürzungen durchgesetzt werden oder die Beiträge der verbliebenen 27 Staaten müssen steigen. Womöglich läuft es auf eine Mischung aus beidem hinaus. In jedem Fall droht ein harter Kampf darum, wer auf was verzichtet und wer wie viel draufzahlt. Dahinter steht aber auch eine ganz andere Frage - nämlich die, wo es mit der EU künftig hingehen soll. Kritiker vermissen schon seit Jahren eine klare Vision. Politisch könnte der Brexit in Brüssel also einen Prozess in Bewegung bringen, den viele Experten als überfällig betrachten. Ob in Fragen der Wirtschaft, der Verteidigung, der Außenbeziehungen oder der Erweiterung der Union auf dem Balkan - der Handlungsbedarf lässt sich kaum ignorieren. Entsprechend wurde der Wunsch nach strukturellen Veränderungen zuletzt immer öfter und immer offener ausgesprochen. „All dies erfordert eine Erneuerung des europäischen Ansatzes“, sagte der französische Präsident Emmanuel Macron. „Wir leben nicht mehr in der Welt der 1990er Jahre.“ Wie sehr die EU hinter ihren Potenzialen zurückbleibt, hat nicht erst der Brexit gezeigt. Auch in der Finanzkrise vor zehn Jahren, als die Verschuldung Griechenlands den Euro in Bedrängnis brachte, machte Brüssel nicht immer eine gute Figur. Die Schwerfälligkeit der Institutionen lässt ein starkes, agiles Europa oft wie ein Wunschtraum erscheinen. Durch den Brexit klafft ab sofort nicht nur in der Kasse der EU eine Lücke. Fast noch schwerer wiegt der Verlust in geopolitischer Hinsicht. Denn auf globaler Ebene hat Großbritannien als Atommacht und ständiges Mitglied im UN-Sicherheitsrat ein Standing wie nur wenige andere Länder der Welt. Gerade angesichts der seit dem Amtsantritt von US-Präsident Donald Trump komplizierter gewordenen Beziehungen zu Washington wächst in Brüssel die Sorge, auf dem internationalen Parkett bald endgültig ins Hintertreffen zu geraten. „Die   muss mehr Verantwortung für die eigene Sicherheit übernehmen und auch ihre geopolitische Präsenz verstärken“, sagte der neue EU-Außenbeauftragte Josep Borrell diese Woche im Europäischen Parlament. „Bei einer so wesentlichen Sache wie der Verteidigung sind die Kräfte der EU begrenzt.“ Es müsse daher einige fundamentale Veränderungen geben. Seit Jahrzehnten setzt die EU statt auf militärisches Muskelspiel bewusst eher auf „soft power“. Ihr Einfluss auf globaler Ebene beruht primär auf wirtschaftlichen Beziehungen und Entwicklungshilfe, auf kulturelle Anziehungskraft und dem Eintreten für Menschenrechte. Doch die Herangehensweise scheint an ihre Grenzen zu stoßen. Die Europäer müssten umdenken, schrieb Borrell diese Woche in einem Artikel. „Um zu vermeiden, dass wir zu den Verlierern im Wettstreit zwischen den   und China werden, müssen wir die Sprache der Macht neu erlernen.“ Genau das allerdings dürfte ohne die Briten noch etwas schwieriger werden. Zwar betonte zuletzt auch Macron, als Vertreter der einzigen verbliebenen Atommacht innerhalb des Staatenverbundes, dass Europa „mehr Verantwortung für die europäische Verteidigung“ übernehmen müsse. Aber die Abhängigkeit von Washington war schon in den vergangenen Jahren immer wieder offensichtlich. Zu den jüngeren geopolitischen Errungenschaften der EU zählte 2015 der Atomvertrag mit dem Iran. Unter Einbindung der globalen Mächte Russland, China und USA gelang eine Einigung, bei der sich Teheran zum Verzicht auf eigene Nuklearwaffen bereit erklärte. Der Erfolg war jedoch nur von kurzer Dauer - vor zwei Jahren kündigte Trump den amerikanischen Ausstieg aus dem Deal an, der unter seinem Vorgänger Barack Obama ausgehandelt worden war. Während die Europäer vergeblich versuchten, den Atomvertrag zu retten, stellte das Marktanalyse-Unternehmen IHS Markit der EU ein ernüchterndes Zeugnis aus. „Europa wird von Washington gesteuert“, sagte der Analyst Firas Modad. „Das europäische Bankensystem ist vom Dollar abhängig, die europäische Wirtschaft ist vom europäischen Bankensystem abhängig. Die Europäer investieren nicht in ihre eigene Verteidigung. Die Schwachen haben nichts zu sagen. Punkt.“ Die Wirtschaftskraft der EU ist enorm. Doch bisher schafft es Brüssel nicht, dies in politisches Gewicht umzumünzen. Gerade in außenpolitischen Fragen verhindert der Zwang zur Einstimmigkeit oft ein entschlossenes Vorgehen. „Mit Einstimmigkeitsregeln“, schrieb Borrell in der vergangenen Woche, „ist das Risiko einer Lähmung stets vorhanden. Die Mitgliedsstaaten müssen erkennen, dass sie mit dem Einlegen eines Vetos nicht nur der Union schaden, sondern auch sich selbst.“ Auch beim anstehenden Haushaltspoker müssen die Mitgliedstaaten neben ihren nationalen Interessen das Wohl der EU als Ganzes im Blick behalten. Insgesamt wird für die nächsten sieben Jahre etwa eine Billion Euro gebraucht. Und kein Land wird wohl freiwillig anbieten, den eigenen Beitrag zu erhöhen, um die durch den Brexit entstandene Lücke von etwa 75 Milliarden Euro zu schließen. Gleichzeitig wollen die ärmeren Länder möglichst auch weiterhin genauso viel ausgezahlt bekommen wie bisher. Darüber hinaus müssen neue Projekte, wie etwa der „Green Deal“, der die EU bis 2050 klimaneutral machen soll, finanziert werden. „Eine Einigung zu erzielen, wird daher eine große Herausforderung sein, das wissen wir alle“, betonte EU-Kommissionspräsidentin Ursula von der Leyen vor dem am Donnerstag beginnenden Sondergipfel. Konkret wird es in den Verhandlungen darum gehen, ob 1 Prozent, 1,1 Prozent oder 1,3 Prozent des Bruttoinlandsprodukts in den EU-Haushalt fließen. Vom Ergebnis dürfte aber eben auch abhängen, welche Rolle die EU künftig im globalen Machtgefüge einnehmen wird. Europäische Union USA",wirtschaftswoche
Münchener Sicherheitskonferenz.  Chinesischer Außenminister wirft USA „Schmierenkampagnen“ vor ,no_author,15. Februar 2020,https://www.wiwo.de/politik/ausland/muenchener-sicherheitskonferenz-chinesischer-aussenminister-wirft-usa-schmierenkampagnen-vor/25549894.html,"Der chinesische Außenminister Wang Yi hat den   „Schmierenkampagnen“ gegen China vorgeworfen. Damit reagierte er auf der Münchner Sicherheitskonferenz am Samstag   „Grundsätzlich kann ich sagen, dass alle Beschuldigungen gegen China Lügen sind“, sagte Wang laut offizieller Übersetzung. Nur wenn man die Kritik auf die USA selbst anwende, „dann werden die Lügen vielleicht zu Tatsachen“. Die beiden US-Minister hatten zuvor heftig gegen China ausgeteilt und die westlichen Partner unter anderem vor der chinesischen 5G-Technologie oder den Handelspraktiken Pekings gewarnt: „Wir müssen als internationale Gemeinschaft aufwachen“, sagte Esper. „Wir suchen nicht den Konflikt mit China.“ Aber das asiatische Land müsse sich an die Regeln halten und die Souveränität anderer respektieren. Außenminister Mike Pompeo warnte vor chinesischen Technologiefirmen, die „Trojanische Pferde“ chinesischer Geheimdienste seien. Die USA seien jedoch aufgewacht und stellten sich nun gegen die aggressive Handelspraktiken Chinas sowie gegen die militärische, diplomatische und wirtschaftliche Haltung des Landes. Wang sagte zu den beiden Reden: „Sie haben ihre Schmierenkampagnen und ihre Kritik an China wieder einmal wiederholt.“ Die USA akzeptierten „keine Erfolge eines sozialistischen Landes in den USA, aber das ist ungerecht.“ Chinas Modernisierung sei ein unumkehrbarer Trend. „Wir werden uns von keiner Macht auf der Welt aufhalten lassen.“ USA auf Kritik der US-Minister für Äußeres und Verteidigung, Mike Pompeo und Mark Esper.",wirtschaftswoche
