title,author,date_published,url,article_text,source
Angst vor Folgen für die Wirtschaft wächst.  Coronavirus schickt Dax auf Talfahrt ,no_author,24. Februar 2020,https://www.wiwo.de/finanzen/boerse/angst-vor-folgen-fuer-die-wirtschaft-waechst-coronavirus-schickt-dax-auf-talfahrt/25576556.html,"Die Angst vor den wirtschaftlichen Folgen der Coronavirus-Epidemie hat am deutschen und europäischen Aktienmarkt am Montag zu einem Ausverkauf geführt. Dax und EuroStoxx50 rutschten am Montag zeitweise um jeweils knapp vier Prozent auf 13.035 beziehungsweise 3647 Punkte ab. Der Leitindex der Mailänder Börse brach sogar um mehr als fünf Prozent ein. Damit steuerten alle drei Indizes auf ihren größten Tagesverlust seit etwa dreieinhalb Jahren zu. Damals hatten Spekulationen auf eine Abkühlung der chinesischen Konjunktur die Börsen weltweit auf Talfahrt geschickt. In Asien ging es zum Wochenstart insbesondere an Südkoreas Börsen deutlich nach unten, wenngleich sich die Kursverluste in Festlandchina in Grenzen hielten. „Die Hoffnung und Euphorie für die konjunkturelle Entwicklung in Europa scheinen die Kurse doch zu weit nach oben getrieben zu haben. Die Investoren ziehen vorerst die Notbremse und trennen sich wieder von Aktienbeständen in deutschen Standardwerten“, kommentierte Marktbeobachter Andreas Lipkow von der   Bank. Jetzt müsse sich zeigen, ob die konjunkturelle Situation tatsächlich so robust ist, wie viele Investoren angenommen haben – ansonsten werde es für den Dax in den kommenden Handelstagen noch sehr ungemütlich. Auch am Rohstoffmarkt spiegelte sich die Angst vor einem Rückschlag für die Weltwirtschaft wider. Die Rohöl-Sorte Brent aus der Nordsee verbilligte sich um bis zu fünf Prozent auf 55,56 Dollar je Barrel (159 Liter). Der Preis für das wichtige Industriemetall Kupfer fiel um bis zu 1,6 Prozent auf 5671,50 Dollar je Tonne.  Fast alle Aktien in den wichtigen Indizes lagen im Minus, vor allem Fluggesellschaften flogen aus den Depots. Die Titel von Lufthansa, Air France-KLM und der British Airways-Mutter IAG verloren bis zu neun Prozent. Die auf innereuropäische Verbindungen spezialisierten Billig-Flieger Ryanair und EasyJet brachen sogar um mehr als 16 Prozent ein. Doch auch für Luxusgüter-Hersteller, Autobauer, Chipwerte, Bergbaukonzerne und Banken ging es kräftig abwärts   diese Branchen gelten als besonders anfällig für eine weltweite Konjunkturabkühlung. Der US-Investor Warren Buffett hält Aktien dennoch weiter langfristig für attraktiv. „Es ist schon erschreckend“, sagte er dem TV-Sender CNBC. „Ich denke aber nicht, dass es eine Rolle spielen sollte bei dem, was man am Aktienmarkt macht.“ Er selbst werde jedenfalls wegen des Virus keine Aktien verkaufen. Überraschend kam die Meldung, dass das Barometer für das Ifo-Geschäftsklima auf 96,1 Punkte von 96,0 Zählern im Januar gestiegen ist. Das Münchner Institut veröffentlichte am Montag die Zahlen zu seiner Umfrage unter rund 9000 Managern. Volkswirte hatten hingegen mit einem Rückgang auf 95,3 Punkte gerechnet. „Die deutsche Wirtschaft scheint von der Entwicklung rund um das Coronavirus unbeeindruckt“, erklärte Ifo-Präsident Clemens Fuest. Viele Experten befürchten aber, dass die Folgen der Epidemie die Konjunktur künftig bremsen dürfte.  „Sollte es zu einer weiteren Ausbreitung der Epidemie und daraus resultierenden Maßnahmen weltweit kommen, so hat dies auch Auswirkungen auf die konjunkturelle Lage in Deutschland“, warnte etwa Oliver Holtemöller, Leiter der Abteilung Makroökonomik und Vizepräsident des IWH,  . Auch Ifo-Konjunkturexperte Klaus Wohlrabe bestätigte der Nachrichtenagentur Reuters, dass in der aktuellen Umfrage die jüngste Dynamik rund um die Epidemie noch nicht voll abgebildet sei. Denn das Virus breitet sich aktuell weltweit aus. Die Zahl der Toten durch das Virus ist in China sprunghaft angestiegen. Die Gesundheitskommission berichtete am Montag in Peking weitere 150 neue Covid-19-Todesfälle – so viele wie noch nie innerhalb eines Tages. In Südkorea, wo sich gerade ein größerer Ausbruch entwickelt, wurden zwei neue Tote durch die Lungenkrankheit und 231 neu entdeckte Infektionen gemeldet. Damit gibt es schon 833 Ansteckungen und sieben Todesfälle in Südkorea. In keinem anderen Land außerhalb Chinas, wo das Sars-CoV-2-Virus im Dezember ausgebrochen war, wurden bisher mehr Infektionen gemeldet. In Europa ist   mit mehr als 150 Infektionen am schwersten betroffen. Ein Fehlalarm legte am Sonntagabend den Zugverkehr zwischen Italien und Österreich über Stunden lahm. Zwei Eurocitys auf dem Weg von Venedig nach München wurden von Österreichs Behörden am Brenner gestoppt. Einer der Züge hatte zwei deutsche Frauen an Bord, die Fieber und starken Husten hatten. Sie wurden aber in Verone nach Angaben des österreichischen Innenministeriums negativ getestet. Danach konnten die 500 Passagiere nach München weiterfahren. In vielen Gegenden in Norditalien steht das öffentliche Leben praktisch still. In der Lombardei wurden zehn Gemeinden in der Provinz Lodi zu Sperrzonen erklärt. Sie liegen in der Nähe des Finanzzentrums Mailand, der zweitgrößten Stadt Italiens. In Venetien wurde die Gemeinde Vo abgeriegelt. Schulen, Universitäten und Museen bleiben geschlossen. Auch der Karneval von Venedig, der bis Dienstag gehen sollte, wurde vorzeitig beendet. Drei Infizierte sind in Italien bisher an der Krankheit gestorben. Die EU-Kommission kündigte wegen des rasanten Anstiegs Hilfszahlungen in Höhe von 232 Millionen Euro an. „Mit mehr als 2600 Toten gibt es keine andere Option, als sich auf allen Ebenen vorzubereiten“, sagte der EU-Kommissar für Krisenmanagement, Janez Lenarcic, am Montag in Brüssel. Das neue Hilfspaket solle die     unterstützen und Ländern mit schwächerem Gesundheitssystem zur Verfügung stehen. Allein 90 Millionen Euro sollen in die Suche nach einem Impfstoff investiert werden. Aus rund 30 Ländern und Regionen außerhalb Festlandchinas sind mehr als 2200 Infektionen und 27 Todesfälle berichtet worden. In Südkorea konzentriert sich der Ausbruch auf die südöstliche Millionen-Stadt Daegu und Umgebung. Allein 129 neue Infizierungen wurden wieder unter Mitgliedern der christlichen Sekte Shincheonji-Kirche Jesu gezählt. Mehr als die Hälfte aller Fälle im Land entfällt auf Anhänger der Sekte – möglicherweise durch einen „Superverbreiter“. Die Regierung hat die höchste Alarmstufe für Infektionskrankheiten verhängt. In China stieg die Zahl der Infizierten bis Montag erneut um 409 auf insgesamt 77 150. Mit den 150 neuen Todesfällen sind 2592 Tote zu beklagen. Die überwiegende Zahl der Toten und Infektionen wurden aus der schwer betroffenen Provinz Hubei in Zentralchina gemeldet. Am Wochenende besuchte ein Team der Weltgesundheitsorganisation (WHO) mit chinesischen Kollegen die Provinzhauptstadt Wuhan. Comdirect im WiWo Konjunkturradar Italien Weltgesundheitsorganisation WHO",wirtschaftswoche
"Nikkei, Topix & Co.  Virus-Sorgen lassen asiatische Aktienmärkte einbrechen ",no_author,25. Februar 2020,https://www.wiwo.de/finanzen/boerse/nikkei-topix-und-co-virus-sorgen-lassen-asiatische-aktienmaerkte-einbrechen/25579300.html,"Die wachsende Furcht vor der globalen Verbreitung des Coronavirus dämpft weiterhin die Kauflaune der asiatischen Anleger. Die Börsianer befürchten, dass die Krankheit sich zur Pandemie entwickelt und als Folge globale Handelsketten lahmgelegt würden, die das weltweite Wachstum belasten könnten. „Wenn sich Reisebeschränkungen und Unterbrechungen der Lieferkette fortsetzen, könnten die Auswirkungen auf das globale Wachstum weiter verbreitet sein und länger anhalten“, sagte Jonas Glotermann von Capital Economics. Einige Händler zitierten hingegen als Stimmungsaufheller einen Bericht der Zeitung „Wall Street Journal“ über einen möglichen Impfstoff, obwohl Testreihen des Medikaments an Menschen möglicherweise erst Ende April beginnen. Die Zentralbanken in ganz   hatten ihre Politik bereits gelockert und die Regierungen haben große Finanzspritzen zugesagt. Japans Finanzminister Taro Aso sagte, er beobachte die Marktvolatilität genau, da asiatische Aktien aus Angst vor dem Virus einen größeren wirtschaftlichen Schaden nehmen könnten als ursprünglich angenommen. Der Nikkei-Index und der Yen wurden besonders hart getroffen, da Störungen der Lieferkette und der schrumpfende Tourismus aufgrund der Epidemie die Marktersorgen erhöhten, dass die Wirtschaft des Landes in eine Rezession rutschen könnte. Der 225 Werte umfassende Nikkei-Index lag im Verlauf 3,2 Prozent tiefer bei 22.631 Punkten. Der breiter gefasste Topix-Index sank um 3,4 Prozent und lag bei 1617 Punkten. Die Börse in Shanghai lag 2 Prozent im Minus. Der Index der wichtigsten Unternehmen in Shanghai und Shenzen verlor 1,6 Prozent. Der MSCI-Index für asiatische Aktien außerhalb Japans fiel um 2,5 Prozent. Im asiatischen Devisenhandel gewann der Dollar 0,1 Prozent auf 110,81 Yen und gab 0,2 Prozent auf 7,0133 Yuan nach. Zur Schweizer Währung notierte er kaum verändert bei 0,9788 Franken. Parallel dazu stieg der Euro um 0,1 Prozent auf 1,0862 Dollar und zog um 0,1 Prozent auf 1,0632 Franken an. Das Pfund Sterling gewann 0,1 Prozent auf 1,2937 Dollar. Asien",wirtschaftswoche
Coronavirus.  Das Virus der Kontrollokratie ,no_author,24. Februar 2020,https://www.wiwo.de/politik/ausland/coronavirus-das-virus-der-kontrollokratie/25577066.html,"In seinem 2016 erschienenen Buch „The Perfect Dictatorship: China in the 21st Century“ („Die perfekte Diktatur: China im 21. Jahrhundert“) bezeichnet der norwegische Politologe Stein Ringen das heutige China als „Kontrollokratie“. Sein Herrschaftssystem wurde in ein neues Regime überführt, das radikal härter und ideologischer ist als das vorherige. Derzeit trägt Chinas „Kontrollokratie“ die Hauptverantwortung für die Coronavirus-Epidemie, die über das Land und die Welt hinwegfegt. In den vergangenen acht Jahren hat die zentrale Führung der Kommunistischen Partei Chinas Maßnahmen ergriffen, um die persönliche Macht von Präsident Xi Jinping zu stärken sowie die Befugnisse der Kommunistischen Partei Chinas (KPCh) auf Kosten der Ministerien und der Lokal- und Provinzverwaltungen zu erweitern. Die Zentralbehörden sind zudem kontinuierlich scharf gegen Dissidenten vorgegangen, was sich in allen Bereichen des gesellschaftlichen und politischen Lebens Chinas bemerkbar macht. Unter der Kontrollokratie wurden Webseiten gesperrt; Anwälte, Aktivisten und Schriftsteller verhaftet, und Äußerungen im Internet und die Berichterstattung in den Medien sind mit einem Gefühl der allgemeinen Furcht verbunden. Ebenso wichtig ist, dass das System, das Xi seit 2012 installiert hat, auch die Richtung für die Entwicklung neuer Technologien in China vorgibt. Cloud Computing, Big Data und künstliche Intelligenz (KI) werden eingesetzt, um die Kontrolle der Zentralregierung über die Gesellschaft zu verstärken. Der erste Coronavirus-Fall trat am 1. Dezember 2019 in Wuhan, der Hauptstadt der Provinz Hubei, auf, und bereits Mitte des Monats lagen den chinesischen Behörden Hinweise darauf vor, dass das Virus von Mensch zu Mensch übertragen werden kann. Dennoch hat die Regierung die Epidemie erst am 20. Januar im Staatsfernsehen offiziell bestätigt. Während dieser sieben Wochen bestrafte die Polizei von Wuhan acht Mitarbeiter des Gesundheitswesens, weil sie versucht hatten, in den sozialen Medien Alarm zu schlagen. Sie wurden der „Verbreitung von Gerüchten“ und der Störung der „sozialen Ordnung“ bezichtigt. Derweil verheimlichte die Regionalregierung von Hubei weiterhin die tatsächliche Zahl der Coronavirus-Fälle, bis sich lokale Beamte Mitte Januar mit der Zentralregierung getroffen hatten. Tatsächlich ist die Chance, das Virus unter Kontrolle zu bringen, bevor es sich in der 14-Millionen-Stadt Wuhan ausbreitet, durch anmaßende Zensur und Verschleierung seitens der Verwaltung vertan worden. Als die Regierung am 23. Januar endlich eine Quarantäne für die Einwohner von Wuhan verkündete, hatten rund fünf Millionen Menschen die Stadt bereits verlassen: Eine Epidemie wurde ausgelöst, die sich nun in China und im Rest der Welt ausbreitet. Als das tatsächliche Ausmaß der Epidemie schließlich bekannt wurde, brach sich eine vorhersehbare Mischung aus Wut, Angst und Verzweiflung in der chinesischen Öffentlichkeit Bahn. Die Menschen machten ihrer Wut und Frustration im Internet Luft. Aber es dauerte nicht lange, bis der Staat hart durchgriff und die Möglichkeiten von Journalisten und besorgten Bürgern stark einschränkte, Informationen über die Krise auszutauschen. Am 3. Februar, nachdem Xi den Vorsitz bei der zweiten Sitzung des Ständigen Ausschusses des Politbüros zur Epidemie geführt hatte, wurde der Propagandaapparat der KPCh angewiesen, „die öffentliche Meinung zu lenken und die Informationskontrolle zu verstärken“. In der Praxis bedeutet dies, dass modernste KI- und Big-Data-Technologien eingesetzt werden, um die gesamte chinesische Öffentlichkeit online zu überwachen. Die Kontrollokratie läuft nun auf Hochtouren, und es werden Gesichts-, Bild- und Spracherkennungsalgorithmen eingesetzt, um jegliche potenzielle Kritik an der Regierung zu antizipieren und zu unterbinden und alle „inoffiziellen“ Informationen über die Epidemie zu unterdrücken. Am 7. Februar ist der chinesische Arzt und Whistleblower Li Wenliang, der als Erster vor dem Ausbruch gewarnt hatte, am Coronavirus gestorben. Lis Tod löste in den sozialen Medien einen Sturm der Entrüstung aus. Die chinesische Öffentlichkeit gedenkt seiner bereits als Märtyrer, der versucht habe, die Wahrheit zu sagen. Millionen von Menschen bringen in den sozialen Medien ihre Trauer zum Ausdruck. Sie fordern eine Entschuldigung der chinesischen Regierung. Und Meinungsfreiheit. Zum ersten Mal seit seiner Machtübernahme stößt Xis Hightech-Zensurmaschine bei Millionen chinesischer Internetnutzer auf heftigen Widerstand. Die Kontrollokratie wird auf die Probe gestellt. Höchstwahrscheinlich wird der Ausbruch aber selbst dazu benutzt werden, noch mehr Überwachung und Kontrolle der Bevölkerung zu rechtfertigen. Xi ist ein unerschrockener Diktator. Aber seine Diktatur ist keineswegs „perfekt“. Sein zwanghaftes Bedürfnis, Informationen zu kontrollieren, hat die chinesischen Bürger ihres Rechts beraubt, zu erfahren, was in ihren Gemeinden vor sich geht. Und möglicherweise auch, was sich in ihren eigenen Körpern abspielt. Mit Stand vom 24. Februar hat der Ausbruch mehr als 2500 Todesopfer gefordert, und weitere 77.000 Personen in 30 Ländern sind infiziert. Trotz all seiner fortschrittlichen digitalen Technologien und seiner außerordentlichen wirtschaftlichen und militärischen Macht wird China wie eine vormoderne Autokratie regiert. Das chinesische Volk hat etwas Besseres verdient. Bedauerlicherweise werden die Menschen in China und der Rest der Welt weiterhin einen hohen Preis für Xis Hi-Tech-Despotismus zahlen.",wirtschaftswoche
Wegen Coronavirus.  IWF senkt die Wachstumsprognose für China ,no_author,22. Februar 2020,https://www.wiwo.de/politik/konjunktur/wegen-coronavirus-iwf-senkt-die-wachstumsprognose-fuer-china/25573400.html," Der Internationale Währungsfonds (IWF) hat wegen der Auswirkungen der Lungenkrankheit Covid-19 die   für China gesenkt. Der Fonds erwarte nun für 2020 ein Wirtschaftswachstum von 5,6 Prozent statt der noch im Januar vorhergesagten 6,0 Prozent, sagte  -Chefin Kristalina Georgiewa am Samstag beim Treffen der Finanzminister der führenden Industrie- und Schwellenländern (G20) in Riad. Das Wachstum der   werde wegen des Coronavirus voraussichtlich 0,1 Prozent geringer ausfallen. Hier war der   vor kurzem noch von 3,3 Prozent Zuwachs im laufenden Jahr ausgegangen. Man gehe bei diesem Szenario davon aus, dass die chinesische Wirtschaft im zweiten Quartal zur Normalität zurückkehren kann, sagte Georgiewa. Die chinesischen Behörden arbeiteten daran, die negativen Auswirkungen auf die Wirtschaft durch Krisenmaßnahmen, Liquiditätsversorgung, steuerliche Maßnahmen und finanzielle Unterstützung abzumildern. Die Auswirkungen auf die Weltwirtschaft könnten so relativ gering und von kurzer Dauer sein. Die IWF-Chefin räumte allerdings ein, es gebe noch große Unsicherheiten - etwa über die Verbreitung des Virus. Das erschwere eine verlässliche Prognose. „Viele Szenarien können sich abspielen, je nachdem, wie schnell das Virus eingedämmt wird und wie schnell sich die chinesischen und anderen betroffenen Volkswirtschaften wieder normalisieren“, sagte Georgiewa. Die globale Zusammenarbeit sei für die Eindämmung des Virus und der wirtschaftlichen Auswirkungen von wesentlicher Bedeutung, gerade wenn sich der Ausbruch als länger anhaltend und weiter verbreitet herausstellen sollte. Staaten mit einem weniger entwickelten Gesundheitswesen hätten ein größeres Risiko. Der IWF stehe bereit, den schwächeren Mitgliedern zu helfen. Wachstumsprognose IWF Weltwirtschaft IWF",wirtschaftswoche
"Nikkei, Topix & Co.  Weltweite Ausbreitung des Coronavirus bremst asiatische Anleger ",no_author,24. Februar 2020,https://www.wiwo.de/finanzen/boerse/nikkei-topix-und-co-weltweite-ausbreitung-des-coronavirus-bremst-asiatische-anleger/25576050.html,"Die asiatischen Anleger sind weiterhin durch die Ausbreitung des Coronavirus außerhalb Chinas beunruhigt. Die Aussichten für das weltweite Wachstum verdunkeln sich, Infektionen und Todesfälle in Südkorea, Italien und im Nahen Osten haben zugenommen. „Es gibt viele schlechte Nachrichten an der Coronavirus-Front, und die Gesamtzahl der neuen Fälle steigt weiter“, schrieb AMP-Chefökonom Shane Oliver in einer Mitteilung. „Natürlich gibt es viel Unsicherheit über die Falldaten und neue Fälle außerhalb Chinas scheinen sich immer noch zu entwickeln. Der wirtschaftspolitische Fluss muss weiter gehen, obwohl die chinesische Wirtschaft im Märzquartal wahrscheinlich geschrumpft sein wird.“ Ökonomen haben die Wachstumsprognosen für China und die Welt herabgestuft, da Reisebeschränkungen und -verbote in einer Reihe von Ländern bereits den Tourismus, die Lieferkette und die Fabrikproduktion getroffen haben. Oxford Economics schätzte, dass das Wachstum der Weltwirtschaft in der ersten Jahreshälfte 2020 auf nahezu Null sinken würde, wenn der Ausbruch des Coronavirus zu einer globalen Pandemie würde. Die japanischen Märkte waren wegen eines Feiertags geschlossen. Die Börse in Shanghai lag 0,3 Prozent im Minus. Der Index der wichtigsten Unternehmen in Shanghai und Shenzen verlor 0,5 Prozent. Der MSCI-Index für asiatische Aktien außerhalb Japans fiel um 1 Prozent. Im asiatischen Devisenhandel blieb der Dollar fast unverändert bei 111,53 Yen und legte 0,1 Prozent auf 7,0316 Yuan zu. Zur Schweizer Währung notierte er 0,3 Prozent höher bei 0,9804 Franken. Parallel dazu fiel der Euro um 0,2 Prozent auf 1,0822 Dollar und notierte kaum verändert bei 1,0612 Franken. Das Pfund Sterling verlor 0,3 Prozent auf 1,2937 Dollar.",wirtschaftswoche
CSU-Politiker.  Manfred Weber wirft Regierungen im EU-Haushaltsstreit Egoismus vor ,no_author,23. Februar 2020,https://www.wiwo.de/politik/ausland/csu-politiker-manfred-weber-wirft-regierungen-im-eu-haushaltsstreit-egoismus-vor/25574126.html,"Nach dem   hat der Fraktionsvorsitzende der Christdemokraten im Europaparlament,  , den Mitgliedstaaten schwere Vorwürfe gemacht. „Es geht um Egoismus und nicht um den notwendigen europäischen Ehrgeiz“, sagte der stellvertretende CSU-Vorsitzende den Zeitungen der Funke Mediengruppe. „Die vielen guten Ideen für ein ambitioniertes Europa werden im kleinklein zermahlen. China und die USA freuen sich.“ Weber drohte mit einer Ablehnung des Haushaltsplans: „Eine Zustimmung des Europäischen Parlaments wird es nur geben, wenn sich die Richtung ändert.“ Die 27 EU-Staaten waren sich bei einem Sondergipfel in Brüssel nicht einig geworden, welche Aufgaben sie in den nächsten Jahren mit Vorrang anpacken und wie sie das finanzieren wollen. Bundeskanzlerin Angela Merkel sagte am Freitagabend nach mehr als 24-stündigen Verhandlungen, die Differenzen seien einfach zu groß gewesen. Es ging um den Haushaltsrahmen für die Jahre 2021 bis 2027 und damit auch um Hilfsgelder für Millionen Landwirte, Kommunen, Unternehmen oder Studenten, auch in Deutschland. Eine Einigung ist diesmal besonders schwer, weil nach dem Brexit bis zu 75 Milliarden Euro britischer Beitragsgelder fehlen. Selbst wenn sich die 27 Staaten einig werden, ist das nur der erste Schritt. Dann muss ein Kompromiss mit dem Europaparlament folgen, das den Plan am Ende billigen muss. gescheiterten EU-Haushaltsgipfel Manfred Weber",wirtschaftswoche
Öl.  Ölpreise geben wegen Virus-Krise deutlich nach ,no_author,24. Februar 2020,https://www.wiwo.de/finanzen/boerse/oel-oelpreise-geben-wegen-virus-krise-deutlich-nach/25576518.html,"Die Ölpreise sind am Montag wegen der Sorgen wegen der internationalen Verbreitung des Coronavirus gefallen. Sowohl europäisches als auch amerikanisches Rohöl geriet deutlich unter Druck. Ein Barrel (159 Liter) der Nordseesorte Brent kostete am Morgen 57,13 US-Dollar. Das waren 1,37 Dollar weniger als am Freitag. Der Preis für amerikanisches Rohöl der Sorte WTI fiel um 1,16 Dollar auf 52,22 Dollar. Das neuartige Coronavirus hält die Finanzmärkte weiter in Atem. An den Rohstoffmärkten sorgte zum Wochenstart vor allem die zunehmende Ausbreitung des Covid-19 genannten Virus für Nachfragesorgen. Aufsehen erregten zuletzt vor allem steigende Infektionszahlen in Südkorea und Italien. Damit einher geht die Befürchtung einer schwächeren Weltwirtschaft mit sinkendem Erdölverbrauch. Die fallenden Rohölpreise setzen wiederum das Ölkartell Opec unter Druck. Bisher waren die Erdölpreise im Februar gestiegen, nachdem sie seit Jahresbeginn wegen der Virus-Krise in China deutlich gefallen waren. Die Opec-Staaten treffen sich Anfang März mit anderen großen Ölproduzenten, um über ihre Förderpolitik zu beraten. Eine zusätzliche Verringerung der bereits gedeckelten Förderung gilt als Option.",wirtschaftswoche
Handelsstreit .  China hebt weitere Strafzölle auf US-Produkte auf ,no_author,22. Februar 2020,https://www.wiwo.de/politik/ausland/handelsstreit-china-hebt-weitere-strafzoelle-auf-us-produkte-auf/25573016.html,"China befreit ab 28. Februar insgesamt 65 US-Waren von Strafzöllen. Dazu gehören Flugzeugteile und medizinische Ausrüstung, kündigte das Finanzministerium am Freitag in Peking an. Der Schritt ist Teil des zwischen beiden Ländern vereinbarten  , in dem sich die beiden weltgrößten Wirtschaftsmächte gegenseitig mit Strafzöllen überzogen haben. Zuvor hatte China bereits angekündigt, Strafzölle auf 696 Waren aus den   zeitweise auszusetzen. Dazu sollen Schweine- und Rindfleisch, Sojabohnen, Rohöl und Flüssigerdgas gehören. Die US-Regierung geht davon aus, dass China ungeachtet der Coronavirus-Epidemie an dem vereinbarten Kauf von US-Waren festhalten wird, der ebenfalls Bestandteil des Teilabkommens ist. „Zum jetzigen Zeitpunkt erwarten wir keine Änderungen“, sagte ein Vertreter des US-Finanzministeriums. „Wir gehen immer noch davon aus, dass sie ihrer Verpflichtung nachkommen.“ Im Rahmen des Abkommens hat sich China dazu verpflichtet, binnen zwei Jahren zusätzliche Waren und Dienstleistungen aus den USA im Wert von 200 Milliarden Dollar zu beziehen. Die Coronavirus-Epidemie lässt allerdings bei Experten Zweifel an der Fähigkeit Chinas aufkommen, ob die vereinbarten Ziele erreicht werden können. Die Behörden haben erhebliche Reise- und Transportbeschränkungen verhängt, um die Ausbreitung des Virus einzudämmen. : Handelstheoretiker Bhagwati: „Trump verletzt zutiefst US-Wirtschaftsinteressen.“ ersten Abkommens zur Beilegung des Handelsstreits USA",wirtschaftswoche
Osteuropa.  Polen verdrängt Großbritannien als Deutschlands fünftgrößter Handelspartner ,no_author,21. Februar 2020,https://www.wiwo.de/politik/ausland/osteuropa-polen-verdraengt-grossbritannien-als-deutschlands-fuenftgroesster-handelspartner-/25570850.html,"Osteuropa wird für Deutschlands Wirtschaft immer wichtiger:   hat   2019 vom Platz als fünfgrößter Handelspartner Deutschlands verdrängt, teilte der Ostausschusses der Wirtschaft am Freitag mit. Während der Handel mit dem östlichen Nachbarn im vergangenen Jahr um 4,2 Prozent wuchs, schrumpfte er  . Auch die Exporte und Importe im Handel mit den anderen Mitgliedern der sogenannten Visegrad-Gruppe, zu der neben Polen auch Tschechien,   und die Slowakei gehören, nahmen 2019 zu. ""Der deutsche Handel mit den vier Visegrad-Staaten zusammengenommen übertraf 2019 erstmals die Schwelle von 300 Milliarden Euro. Da können weder die   noch China mithalten"", teilte der Ostausschuss-Vorsitzende Oliver Hermes mit. China war danach weiter wichtigster Handelspartner Deutschlands mit einem Handelsvolumen von knapp 206 Milliarden Euro. Danach folgen die Niederlande, die USA und Frankreich. Der Handel mit Russland schrumpfte wegen gesunkener Einfuhren von Gas im vergangenen Jahr um 6,6 Prozent und betrug nur noch 57,8 Milliarden Euro. Zum Vergleich: Das deutsche Handelsvolumen mit Polen belief sich 2019 auf insgesamt 123,4 Milliarden Euro. : Von der Leyen will einen engeren Handel als der britische Premier Johnson. Polen Großbritannien wegen des Brexit mit dem Vereinigten Königreich um 1,8 Prozent Ungarn USA",wirtschaftswoche
