title,author,date_published,url,article_text,source
Digitalkonferenz DLD.  Auf der Suche nach dem europäischen Weg in die Digitalisierung ,Michael Kroker,19. Januar 2020,https://www.wiwo.de/unternehmen/it/digitalkonferenz-dld-auf-der-suche-nach-dem-europaeischen-weg-in-die-digitalisierung/25448790.html,"Bereits zum 16. Mal eröffnete am Samstag DLD-Mitorganisatorin Steffi Czerny die größte Digitalkonferenz ihrer Art in Europa: „Wir dürfen nicht bloß Chancen und Herausforderungen ansprechen“, appellierte sie an die gut 3000 Besucher in der Alten Kongresshalle in München oberhalb der Theresienwiese. „Sondern es gehe nun um konkrete Pläne und messbare Auswirkungen.“ Daher wolle sie die diesjährigen Konferenzbesucher ermutigen, das Lamentieren endlich sein zu lassen und stattdessen mit Handlungen vorzupreschen. Dazu brauche man nicht immer im globalen Maßstab denken – stattdessen sollte jeder vielmehr sein nahes Umfeld im Visier haben, und dort erste Veränderungen anstreben. „Habt keine Angst vor dem ersten Schritt“, beschwor Czerny ihre Zuhörer. Damit knüpfte die Erfinderin der Digitalkonferenz aus dem Hause Burda nahtlos an die letztjährige Veranstaltung an: Schon 2019 war die Organisationstruppe um Steffi Czerny, bemüht, der Digitalszene in   eine neue positive Grundhaltung einzuhauchen: „Optimismus und Mut“, so das mantrahaft beschworene Motto der DLD19 – wobei von Aufbruchstimmung im Januar des Vorjahres tatsächlich nur wenig zu spüren war. Wenig verwunderlich also, dass Czerny genau hier in ihrer Rede einhakte: „Wir gehen in diesem Jahr einen Schritt weiter“, beteuert die Burda-Chefvernetzerin. „Jeder sollte sich fragen: Was kann ich persönlich machen und zum Fortschritt beitragen.“ Oder als DLD-Motto: What are you adding? Wie schwer Optimismus und Voranschreiten dann aber in der Praxis tatsächlich hinzubekommen sind, zeigte sich im weiteren Verlauf des ersten Tages: Die ghanaisch-kanadische Informatikerin und Digitalaktivistin am MIT Media Lab Joy Buolamwini hat im Rahmen ihrer Forschung untersucht, wie voreingenommen Künstliche Intelligenz (KI) für Gesichtserkennung arbeitet. Dafür hat sie unter anderem analysiert, wie gut die Algorithmen von  ,   und Face++ das Geschlecht von Gesichtern vorhersagen. Das Ergebnis: „Dunklere Frauen wurden am schlechtesten erkannt“, so Buolamwini ernüchtert. Immerhin, ihre Erfahrung hat sie in Form eines Gedichts mit dem passenden Titel „Hey KI, bin ich keine Frau?“ verarbeitet. Auch auf der politischen Ebene überwogen gestern eher die nachdenklichen Töne: „Gegenwärtig ist Europa auf dem besten Weg, eine digitale Kolonie der   oder Chinas zu werden“, sagte der  -Europapolitiker Axel Voss, der sich wegen seines Einsatzes für Upload-Filter und Leistungsschutzrecht auf EU-Ebene in der Digitalszene nicht viele Freunde gemacht hat. „Europa muss einen dritten – einen europäischen – Weg der   einschlagen, der auf unseren Werten in Sachen Datenschutz und Datensouveränität beruht.“ Unterstützung erhielt der umstrittene Politiker dafür ausgerechnet von Andrew Keen, einem britisch-amerikanischen Publizisten, der sich in den vergangenen Jahren einen Namen als Kritiker der großen amerikanischen Digitalkonzerne und der Internet-Szene insgesamt gemacht hat, auch und gerade durch mehrfache DLD-Teilnahmen. Im direkten Wettbewerb etwa bei Social Media oder der Internet-Suche könne Europa in den Augen von Keen nicht konkurrieren – dafür seien die USA und China zu weit enteilt. Aber Europa könne mit seinen Stärken wie etwa Demokratie oder dem Schutz persönlicher Daten punkten. „Was kann Europa beitragen?“, griff Keen das DLD-Motto rhetorisch auf – um seine eigene Antwort nachzuschieben: „Europa sollte das Prinzip der Freiheit im Internet hochhalten, denn das machen weder China – noch die USA.“ Wirklich optimistisch, dass dies gelingen kann, ist auch er nicht. Dazu hätten sich in den vergangenen Jahren viel zu deutlich die Negativthemen Autoritarismus und Desinformation ausgebreitet. „Als das Internet vor rund 40 Jahren geboren wurde, dachten wir alle, die Vielfalt an Daten werde Demokratie und Freiheit beflügeln“, so Keen. „Inzwischen zeigt sich – gerade das Gegenteil ist richtig: Je mehr die Digitalisierung voranschreitet, desto erfolgreicher werden Falschinformationen und Fake News.“ Immerhin, auf einen ist angesichts derlei kritischer Betrachtungen wie gehabt Verlass: Yossi Vardi. Der israelische Unternehmer und Investor fungiert seit den Anfangstagen der Konferenz im Jahr 2005 als DLD-Chairman – und bemüht sich dabei gerne um eine gute Stimmung der Besucher. „Ich sage Ihnen jetzt, was der wichtigste Platz auf der DLD ist: Bleiben Sie in den Gängen – und hören Sie sich keine Vorträge an“, so Vardi unter dem Gelächter seiner Zuhörer. Und hebt den vergleichsweise hässlichen, brettchengroßen Konferenzausweis hoch, wie ihn jeder um seinen Hals baumeln hat. „Das ist kein Badge, sondern ein sozialer Vertrag – damit laden Sie andere ein, Sie anzusprechen.“ Besser hat in den vergangenen 15 Jahren niemand das eigentliche Motto der DLD zusammengefasst: Als große und unkomplizierte Kontaktbörse zum Austausch der Digitaljünger aus Europa, Nordamerika und Asien untereinander – tatsächlich vielleicht der wichtigste Zweck der Veranstaltung. Europa IBM Microsoft USA CDU Digitalisierung",wirtschaftswoche
Konjunktur.  US-Industrie fährt Produktion überraschend hoch ,no_author,17. Januar 2020,https://www.wiwo.de/konjunktur-us-industrie-faehrt-produktion-ueberraschend-hoch/25445772.html,"Die unter dem Handelsstreit mit China    . Sie  , wie die US-Notenbank am Freitag mitteilte. Von Reuters befragte Ökonomen waren von einem Rückgang um 0,2 Prozent ausgegangen, nach einem kräftigen Plus von 1,0 Prozent im November. Während die Autobranche ihre Erzeugung drosselte, ging es anderen Bereichen nach oben. Die Produktion im weiteren Sinn - zu der neben der klassischen Industrie auch Versorger und Bergbau gehören - schrumpfte im Dezember hingegen um 0,3 Prozent. Die Industrie macht etwa elf Prozent des Bruttoinlandsproduktes der   aus. Ihre Aussichten haben sich angesichts der schwächeren Weltkonjunktur eingetrübt. Zudem machte ihr der Handelskonflikt mit China zu schaffen machen. Die beiden größten Volkswirtschaften haben sich gegenseitig mit Zollerhöhungen überzogen, am vergangenen Mittwoch aber ein erstes Teilabkommen zur Beilegung des Streits unterzeichnet. : Die Trump-Regierung soll versucht haben, die Europäer mit drohenden Autozöllen zu erpressen. Das Ziel: Die EU sollte in der Iranpolitik auf US-Linie gebracht werden. leidende US-Industrie hat ihre Produktion im Dezember überraschend erhöht stellte 0,2 Prozent mehr her als im Vormonat USA",wirtschaftswoche
IWF.  Handelsdeal von USA und China mildert globale Unsicherheit ,no_author,17. Januar 2020,https://www.wiwo.de/politik/ausland/iwf-handelsdeal-von-usa-und-china-mildert-globale-unsicherheit/25446842.html,"Die Unterzeichnung des Teilabkommens im Handelsstreit zwischen den USA und China wird nach Einschätzung des Internationalen Währungsfonds (IWF)  , die das globale Wirtschaftswachstum belastet hat. Verschwinden werde sie aber nicht, sagte  -Chefin Kristalina Georgieva am Freitag in Washington. Einen aktualisierten Konjunkturausblick für die Weltwirtschaft wollte sie nicht geben. Das werde am Montag beim Wirtschaftsforum im schweizerischen Davos geschehen. US-Präsident   und der chinesische Vize-Ministerpräsident Liu He hatten am Mittwoch im Weißen Haus ihre Unterschriften unter das ""Phase 1"" genannte Abkommen gesetzt. China soll nach US-Angaben in den nächsten beiden Jahren für zusätzlich mindestens 200 Milliarden Dollar amerikanische Waren kaufen, um das riesige Handelsdefizit der Vereinigten Staaten zu verringern. Einige Zölle werden die USA im Gegenzug reduzieren, andere angedrohte Maßnahmen wurden ausgesetzt. Es bleiben aber Sonderzölle in Kraft, die im Zuge des Konflikts von den beiden führenden Wirtschaftsmächten gegenseitig erhoben wurden. Trump will diese erst aufheben, wenn ein zweites Teilabkommen mit weiteren Details steht. Doch bereits die Unterzeichnung des ersten Teilabkommens hat nach Liu Hes Worten vorteilhafte Bedingungen für die künftigen Beziehungen zwischen den USA und China geschaffen. Das meldete die staatliche Nachrichtenagentur Xinhua. Mehr: Die Wirtschaftsleistung der Volksrepublik ist im vergangenen Jahr nur noch um 6,1 Prozent gestiegen. Langfristig steht China vor einem Nachwuchsproblem. für einen Rückgang der Verunsicherung sorgen IWF Donald Trump",wirtschaftswoche
Demonstrationen.  Polizei löst Massenproteste in Hongkong gewaltsam auf ,no_author,19. Januar 2020,https://www.wiwo.de/politik/ausland/demonstrationen-polizei-loest-massenproteste-in-hongkong-gewaltsam-auf/25449570.html,"Zehntausende Menschen haben in Hongkong gegen chinesische Menschenrechtsverletzungen demonstriert. Allerdings ging die Polizei 90 Minuten nach Beginn des genehmigten Protestmarsches am Sonntag mit Tränengas, Pfefferspray und Gummigeschossen gegen die weitgehend friedlichen Demonstranten vor. Eine unbekannte Zahl von Teilnehmern wurde festgenommen. Wie die Polizei weiter mitteilte, wurde die Kundgebung aufgelöst, weil „eine Gruppe Randalierer“ Feuer gelegt, Straßen blockiert und Polizisten „brutal angegriffen“ habe. Die Demonstrationen in der chinesischen Sonderverwaltungsregion dauern seit mehr als einem halben Jahr an. Die Proteste richten sich gegen die eigene Regierung und die chinesische Führung in Peking, die ihren Einfluss auf die frühere britische Kronkolonie ausweitet. Seit der Rückgabe 1997 an China wird Hongkong nach dem Grundsatz „ein Land, zwei Systeme“ unter Pekings Souveränität autonom verwaltet. Die sieben Millionen Hongkonger genießen - anders als die 1,3 Milliarden Menschen in der Volksrepublik -  . Auch fordern sie echte Demokratie, wie es ihnen beim Souveränitätswechsel einst in Aussicht gestellt worden war.  Taiwans Präsidentin Tsai bietet China erfolgreich die Stirn. weitgehende Rechte wie Versammlungs-, Meinungs- und Pressefreiheit, um die sie aber zunehmend fürchten",wirtschaftswoche
Handel.  China will US-Importe gemäß Marktgesetzen steigern ,no_author,19. Januar 2020,https://www.wiwo.de/handel-china-will-us-importe-gemaess-marktgesetzen-steigern/25449128.html,"China will nach offiziellen Angaben mit US-Firmen verhandeln und den Import amerikanischer Waren entsprechend Marktgesetzen erhöhen. Die USA hätten ein qualitativ hohes Angebot im Bereich Energie, Industriegüter, Medizinprodukte und Finanzdienstleistungen, erklärte die nationale Planungsbehörde am Sonntag. Zur Entschärfung des Handelsstreits mit den USA hat China der Regierung in Washington zugesagt, den Kauf amerikanischer Waren und Dienstleistungen um 200 Milliarden Dollar binnen zwei Jahren zu steigern. Die USA wollen im Gegenzug einige Strafzölle aufheben.  Fünf Gründe, warum das Handelsabkommen zwischen den USA und China kein echter Durchbruch ist.",wirtschaftswoche
Coronavirus.  Mysteriöse Lungenkrankheit in China: Ausmaß wohl deutlich größer als bisher angenommen ,no_author,19. Januar 2020,https://www.wiwo.de/coronavirus-mysterioese-lungenkrankheit-in-china-ausmass-wohl-deutlich-groesser-als-bisher-angenommen/25448814.html,"Die Ausbreitung der rätselhaften Lungenkrankheit in China ist möglicherweise viel größer als bisher angenommen. Das britische Zentrum für die Analyse globaler Infektionskrankheiten am Imperial College London schätzt die wahre Zahl der Infizierten auf mehr als 1700. Auch warnen die Experten vor einer Übertragung von Mensch zu Mensch. Die zentralchinesische Metropole Wuhan berichtete am Sonntag, dass bei 17 weiteren Lungenkranken das neuartige Coronavirus entdeckt worden sei. Die Zahl der in China bestätigten Fälle steigt damit auf 62. Zwei Patienten sind bisher gestorben. „Es ist wahrscheinlich, dass der Ausbruch des neuen Coronavirus in Wuhan bedeutend mehr Fälle mit mittleren oder schweren Erkrankungen der Atemwege verursacht hat als bisher berichtet“, heißt es in der Studie der Experten vom Imperial College London, das auch die Weltgesundheitsorganisation (WHO) und die britische Regierung berät. Die Schätzung von mehr als 1700 Infektionen geht auf ein Rechenmodell zurück, in dem die Fachleute die drei im Ausland festgestellten Infektionen mit der Zahl der Flugreisenden, der Bevölkerung und der Inkubationszeit zugrunde gelegt haben. So leben im Einzugsgebiet des Flughafens von Wuhan rund 19 Millionen Menschen, von denen aber nur rund 3400 Personen am Tag ins Ausland fliegen. In Thailand sind zwei Infektionen und in Japan ein Fall bei Reisenden aus Wuhan bestätigt worden. Die drei Patienten hatten auch nicht den Tiermarkt besucht, der nach amtlichen Angaben mit den meisten anderen Infektionen in Wuhan in Verbindung gebracht wurde. Unter Hinweis auf die Erfahrungen mit ähnlichen Coronaviren wie Sars oder Mers warnen die Experten aus London, „dass eine selbst erhaltene Übertragung von Mensch zu Mensch nicht ausgeschlossen werden sollte“. Coronaviren verursachen oft harmlose Erkrankungen wie Erkältungen - allerdings gehören auch Erreger gefährlicher Atemwegskrankheiten wie Sars und Mers dazu. Es wird vermutet, dass das neuartige Virus aus der Tierwelt kommt. Bislang gab es laut WHO aber „keine klaren Beweise“ für eine Übertragung von Mensch zu Mensch. Der neue Erreger ist nach Angaben von Experten dem Sars-Virus sehr ähnlich. Sars steht für „Severe Acute Respiratory Syndrome“, also Schweres Akutes Atemwegssyndrom. Bei der Sars-Pandemie waren 2002/2003 von China ausgehend weltweit rund 8000 Menschen an der Lungenseuche erkrankt. Knapp 800 starben. Nach dem Ausbruch der neuen Lungenkrankheit in Wuhan wurden bereits Verdachtsfälle aus Hongkong, Taiwan, Südkorea, Singapur, Vietnam und Nepal berichtet. Mindestens drei verdächtige Patienten gibt es auch in den chinesischen Städten Shenzhen und Shanghai, wie die Hongkonger Zeitung „South China Morning Post“ berichtete. Die 17 neuen Infektionen in Wuhan seien bei der Untersuchung von weiteren Patienten festgestellt worden, die in verschiedenen Krankenhäusern der Stadt mit Lungenleiden unbekannter Ursache behandelt worden seien, berichtete das Gesundheitsamt. Drei von ihnen seien ernsthaft erkrankt. Der Rest sei stabil. Somit steigt die Gesamtzahl der Patienten im kritischen Zustand auf acht. Das Alter der neu entdeckten Patienten reiche von 30 bis 79 Jahren, hieß es. Die Behörden verfolgten jetzt, welche Personen mit ihnen engen Kontakt gehabt hätten. Die Stadt werde ihre Suche nach weiteren Verdachtsfällen ausweiten und Tests machen, kündigte das Gesundheitsamt an. Von den 62 bestätigten Patienten seien bisher 19 als geheilt entlassen worden.",wirtschaftswoche
