title,author,date_published,url,article_text,source
737-Max-Debakel.  So stark bremst Boeings Krise die US-Konjunktur ,no_author,13. Januar 2020,https://www.wiwo.de/unternehmen/industrie/737-max-debakel-so-stark-bremst-boeings-krise-die-us-konjunktur/25425814.html,"Die Krise des US-Flugzeugbauers   bremst das Wirtschaftswachstum der  . Finanzminister Steven Mnuchin sagte dem Sender „Fox Business“ am Sonntag, ohne das Debakel um den Unglücksflieger   737 Max würde das Bruttoinlandsprodukt (BIP) in diesem Jahr um drei Prozent zulegen. Nun werde das Wachstum näher an 2,5 Prozent liegen. „Es ist keine Frage, dass die Boeing-Situation die BIP-Zahlen verlangsamen wird“, erklärte der Minister. „Boeing ist einer der größten Exporteure, und mit der 737 Max denke ich, das könnte sich um bis zu 50 Basispunkte auf das BIP auswirken.“ Mnuchin betonte, er gehe dennoch von einem „sehr gesunden Wachstum“ im laufenden Jahr aus. Das überarbeitete Freihandelsabkommen für Nordamerika (USMCA) und das Teilabkommen mit China, das demnächst unterzeichnet werden soll, würden dazu bedeutend beitragen. Boeing steckt seit März 2019 in einer schweren Krise. Nach den zwei Abstürzen mit insgesamt 346 Toten hatten Behörden in aller Welt Passagierflüge mit der 737 Max untersagt. Das Flugzeug ist das meistgefragte Modell des US-Konzerns. Auf den Typ sollten eigentlich rund zwei Drittel der ursprünglich angepeilten etwa 900 Verkehrsflugzeug-Auslieferungen entfallen. Das Ziel hat Boeing aber längst gestrichen und stoppt jetzt vorläufig auch die Produktion der 737 Max. Wann das Flugverbot aufgehoben wird, ist weiterhin offen. Die Umstände kosteten den bisherigen CEO Dennis Muilenburg seinen Job. Boeing wird in diesem Monat mit den Ergebnissen des vierten Quartals voraussichtlich eine der größten Abschreibungen in seiner Geschichte bekanntgeben. Der Aktienkurs fiel seit dem weltweiten Flugverbot um insgesamt 22 Prozent – der größte Rückgang in der Geschichte des Dow Jones Industrial. Für die US-Wirtschaft insgesamt ist Boeings Krise eine erhebliche Belastung. Die Probleme der 737 Max haben das Wachstum bereits in Mitleidenschaft gezogen. An Boeing hängen zahlreiche Zulieferer, Airlines und andere Unternehmen, die die Schwäche des Flugzeugbauers zu spüren bekommen. Vor allem die Außenhandelsbilanz der USA litt bereits stark unter dem 737-Max-Auslieferungsstopp. Genau in dieser heiklen Phase tritt der neue Boeing-Chef seinen Dienst an. Dave Calhoun übernimmt an diesem Montag offiziell die Führungsrolle des Konzerns. Sein Vorgänger Dennis Muilenburg blieb nach Monaten der Skandalmeldungen infolge der zwei Flugzeugabstürze nichts anderes übrig, als abzudanken. Nun soll Calhoun es besser machen. „Das Unternehmen hat jetzt die einmalige Gelegenheit, all die schlechten Nachrichten auf den Tisch zu bringen“, sagt Jim Schrager, Professor für Unternehmertum und Strategie an der Booth School of Business der University of Chicago. „Es ist Zeit, dies richtig zu machen und den Turnaround zu schaffen.“ Calhoun ist bei Boeing alles andere als ein Neuling. Der ehemalige Geschäftsführer von   sitzt bereits seit zehn Jahren im Aufsichtsrat des Flugzeugbauers. Der Umgang Boeings mit Sicherheitsmaßnahmen, Transparenz und Schwierigkeiten mit den Aufsichtsbehörden sind ihm also alles andere als neu – und in der Vergangenheit bereits mitgetragen worden. Nichtsdestotrotz verspricht Calhoun nun eine Kehrtwende. Zumindest erste leichte Signale für einen Strategiewechsel scheint er schon gesetzt zu haben. So soll er beispielsweise dafür gesorgt haben, dass Boeing den langjährigen Widerstand gegen das Simulatoren-Training für 737-Max-Piloten fallen ließ, berichtet die Nachrichtenagentur Bloomberg in Berufung auf Unternehmenskreise. Zudem soll Calhoun laut Bloomberg bereits Kontakt zur US-Luftfahrtbehörde FAA aufgenommen haben.  Calhoun und sein Nachfolger im Boeing-Aufsichtsrat Larry Kellner wollten Boeings Unternehmenskultur eine Auffrischung verpassen, zitiert Bloomberg aus Unternehmenskreisen. „Es scheint, als ob es einen absoluten Zusammenbruch gegeben hat“, sagt George Ferguson, Analyst bei Bloomberg Intelligence. „Sie werden einen Weg finden müssen, die Arroganz loszuwerden. Es schadet ihren Beziehungen zur FAA, zu Kunden und Lieferanten.“ Durch die Krise ist Boeing auch dem Risiko ausgesetzt, im globalen Duopol der Luft- und Raumfahrt weitere Marktstärke an   zu verlieren. Wenig überraschend entschied der Boeing-Rivale 2019 das Rennen um die Marktführerschaft infolge der 737-Max-Krise für sich. Insgesamt lieferte Airbus 863 Verkehrsflugzeuge aus und damit acht Prozent mehr als im Vorjahr, wie das Unternehmen vergangene Woche in Toulouse mitteilte. Boeing hat seine Jahreszahlen zwar noch nicht vorgelegt, kam bis Ende November aber lediglich auf 345 ausgelieferte Maschinen. Mehr als 400 bereits fertige Exemplare des Mittelstreckenjets 737 Max kann Boeing bisher nicht an die Kunden übergeben, da für den Typ nach zwei tödlichen Abstürzen ein weltweites Flugverbot gilt. Bei den Neubestellungen dürfte Airbus ebenfalls weit vorn liegen. Der Konzern sammelte im abgelaufenen Jahr nach Abzug von Stornierungen Aufträge über 768 Jets ein, 21 mehr als im Vorjahr. Boeing kam bis Ende November sogar auf mehr Stornierungen als Neuaufträge. Das Minus im Auftragsbestand belief sich auf 84 Flugzeuge. Boeing hatte mit der Entwicklung der 737 Max als spritsparender Neuauflage der Boeing 737 auf den Erfolg des Konkurrenzmodells Airbus A320neo reagiert. Das Ausreizen des technischen Möglichen ging bei den Amerikanern aber schief und führte nach bisherigen Erkenntnissen mit zu den tödlichen Abstürzen. Boeing USA Boeing General Electric Airbus",wirtschaftswoche
Community hilft Sono Motors.  „Wir hatten mehr Unterstützung von der Politik erwartet“ ,Lucas Tenberg,12. Januar 2020,https://www.wiwo.de/erfolg/gruender/community-hilft-sono-motors-wir-hatten-mehr-unterstuetzung-von-der-politik-erwartet/25403822.html,"Jona Christians: Wir hatten schon Finanzierungsrunden mit Investoren und arbeiten mit ihnen auch weiterhin zusammen. Allerdings wäre mit den neuen (vor allem internationalen) Investoren, mit denen wir in den letzten Monaten gesprochen haben, der Sion wohl nie auf die Straße gekommen. Für sie waren vor allem unsere Patente für die Technologien interessant, nicht aber das Unternehmen Sono Motors selbst. An diesem Punkt wollten wir als Gründer nicht mehr weitergehen. Jona Christians: Viele Investoren wollen oft noch nicht im großen Stil in nachhaltige Projekte investieren. Deshalb arbeiten wir mit den Menschen selbst zusammen, die den Wandel hin zu einer neuen Mobilität wollen. Laurin Hahn: Die Verhandlungen mit den Investoren haben länger gedauert, dazu der Finanzierungsengpass. Deswegen konnten wir die Zulieferer noch nicht beauftragen. Mit der Auslieferung beginnen wir voraussichtlich 2022. Laurin Hahn: Für das Team und uns als Gründer ist das natürlich eine sehr schwere Phase. Wir stehen in der Verantwortung und spüren die Last auf den Schultern. Aber das gehört dazu und schweißt uns nochmal sehr zusammen. Es ist ja auch schon sehr viel Geld zusammengekommen, das bestärkt uns. Jona Christians: Dazu gehört auch, sein Gesicht zu zeigen. In den vergangenen Monaten waren wir auf vielen Events und haben dort unsere Unterstützer getroffen. Die wollen den Wandel, obwohl sie natürlich wissen, dass das Projekt risikobehaftet ist. Viele haben auch ihre Anzahlung aufgestockt. Die mehr als 10.000 Reservierungen für den Sion zeigen, dass dieses Auto auf die Straße kommen muss.  Jona Christians: Die Rahmenbedingungen für junge Unternehmen wie uns sind alles andere als gut. Es müsste darum gehen, Innovationen im Land zu halten. Stattdessen wandern viele Technologien zunehmend ab, wie etwa die Solar- und Windenergie. Das ist ein Armutszeugnis. Wir geben nicht auf, aber hatten schon mehr Unterstützung von der Politik erwartet. Jona Christians: Ein Beispiel: Der Wagniskapitalfonds hört sich auf dem Papier gut an. Dahinter steht dann sehr viel Bürokratie, über Jahre hinweg. In einem Start-up rechnet man aber in Monaten und nicht in Jahren. Der Wille, das Neue zu unterstützen, ist in Deutschland nicht da. Die Fördertöpfe hierzulande stützen eher die alte Industrie. ",wirtschaftswoche
"Dow Jones, Nasdaq, S&P 500.  Wall Street setzt Rekordjagd fort – Dow Jones überspringt erstmals 29.000-Punkte-Marke ",no_author,10. Januar 2020,https://www.wiwo.de/finanzen/boerse/dow-jones-nasdaq-sundp-500-wall-street-setzt-rekordjagd-fort-dow-jones-ueberspringt-erstmals-29-000-punkte-marke/25421396.html,"Die schwächer als erwartet ausgefallenen Arbeitsmarktdaten bringen US-Anleger nicht aus dem Konzept. Die Leitindizes Dow Jones, Nasdaq und S&P 500 gewannen zur Eröffnung am Freitag bis zu 0,3 Prozent und markierten jeweils neue Rekordhochs. Der Dow Jones steigt sogar erstmals über die 29.000er Marke. Der US-Standardwerteindex steigt um 0,2 Prozent auf ein Rekordhoch von 29.009,07 Punkten. Börsianer werten den überraschend geringen Anstieg der Löhne als Hinweis auf eine anhaltend lockere Geldpolitik der US-Notenbank Fed. Am Donnerstag hatte die die Entspannung im Konflikt USA/Iran zu neuen Rekordkursen geführt. Der Dow-Jones-Index der Standardwerte schloss 0,7 Prozent höher auf 28.956,90 Punkte. Der technologielastige Nasdaq rückte 0,8 Prozent auf 9203,43 Punkte vor. Der breiter gefasste S&P 500 legte 0,7 Prozent auf 3274,70 Punkte zu. Die Zahl der Beschäftigten außerhalb der US-Landwirtschaft stieg den Angaben zufolge um 145.000. Analysten hatten im Schnitt mit einem Plus von 164.000 Stellen gerechnet. Der viel beachtete Anstieg der Löhne fiel mit 0,1 Prozent im Monatsvergleich ebenfalls niedriger aus als gedacht. Letzteres sei allerdings gut für den Aktienmarkt, sagte Neil Wilson, Chef-Analyst des Online-Brokers Markets.com. Die Aussicht auf eine anhaltend geringe Inflation nehme den Befürwortern einer strafferen Geldpolitik innerhalb der US-Notenbank Wind aus den Segeln. Er gehe sogar von einer Zinssenkung im ersten Halbjahr aus. Parallel zum Gesamtmarkt setzte auch Apple seinen Höhenflug fort. Die Aktien des Elektronik-Konzerns stiegen um 0,4 Prozent auf ein Rekordhoch von 310,91 Dollar, nachdem die Bank Credit Suisse als eine der Letzten dank des starken iPhone-Absatzes ihr Kursziel für die  -Titel angehoben hatte. Bei den Eignern von Six Flags standen die Fahnen dagegen auf Halbmast. Die Aktien des Vergnügungspark-Betreibers stürzten um mehr als 15 Prozent ab und waren mit 37 Dollar so billig wie zuletzt vor fünfeinhalb Jahren. Wegen schwächelnder Besucherzahlen in den   und Problemen mit Parks in China warnt das Unternehmen vor einem Rückgang des Quartalsumsatzes um acht bis zehn Millionen Dollar. Apple USA",wirtschaftswoche
Unabhängigkeit von China.  Amtsinhaberin Tsai siegt bei Wahl in Taiwan ,no_author,11. Januar 2020,https://www.wiwo.de/politik/ausland/unabhaengigkeit-von-china-amtsinhaberin-tsai-siegt-bei-wahl-in-taiwan/25423110.html,"Taiwans Präsidentin Tsai Ing-wen ist für eine zweite Amtszeit wiedergewählt worden. In ihrer Siegesrede vor ihren Anhängern am Samstag in Taipeh dankte die Amtsinhaberin allen, die sich an der Wahl beteiligt haben - egal, für wen sie gestimmt hätten. „Mit jeder Präsidentenwahl zeigt Taiwan der Welt, wie sehr wir unseren freien und demokratischen Lebensstil zu schätzen wissen.“ In einem Appell an die Weltgemeinschaft rief Tsai Ing-wen zu mehr Anerkennung für die von China isolierte Inselrepublik auf. „Alle Länder sollten Taiwan als Partner, nicht als Problem betrachten.“ Taiwan sei ein unverzichtbares Mitglied der Weltgemeinschaft und sei bereit, mehr Verantwortung zu übernehmen. Nach der Wahl hatte der Herausforderer von Präsidentin Tsai Ing-wen seine Niederlage eingestanden. Der Kandidat der oppositionellen Kuomintang-Partei, Han Kuo-yu, trat am Samstagabend in der südchinesischen Hafenstadt Kaohsiung vor seine Anhänger und sagte, er habe die Präsidentin angerufen und ihr seine Glückwünsche übermittelt. Die Amtsinhaberin hat vorläufigen Hochrechnungen zufolge rund 57 Prozent der Stimmen bekommen. Die mehr als 17.000 Wahllokale schlossen am Samstag um 16.00 Uhr Ortszeit (09.00 Uhr MEZ). Danach begann die Auszählung der Stimmen. Mehr als 19 Millionen Wahlberechtigte waren aufgerufen, den künftigen Präsidenten und 113 Abgeordnete im Parlament zu wählen. Bei sonnigem Wetter verlief die Wahl reibungslos. Umfragen vor der Wahl prognostizierten einen Sieg der chinakritischen Amtsinhaberin Tsai Ing-wen von der Fortschrittspartei (DPP). Ihr Herausforderer Han Kuo-yu steht für eine stärkere Annäherung zu China. Als dritter Kandidat trat der 77-jährige James Soong von der kleinen konservativen People-First-Partei an. Dem Veteranen der taiwanischen Politik werden wenig Chancen eingeräumt. Es wurde erwartet, dass er vor allem dem Kuomintang-Kandidaten noch Stimmen abnehmen könnte. Der massive Druck der kommunistischen chinesischen Führung auf Taiwan hat Präsidentin Tsai spürbar Aufwind gegeben, weil sie auf Distanz zu China geht. Peking betrachtet Taiwan nur als Teil der Volksrepublik, obwohl es nie dazu gehört hat. Es droht auch mit einer Eroberung. Der vor einem Jahr verkündete Plan von Chinas Staats- und Parteichef  , Taiwan nach dem gleichen Autonomie-Modell wie in   an die Volksrepublik anschließen zu wollen, hat den Widerstand der 23 Millionen Taiwaner noch einmal mobilisiert. Xi Jinping propagiert den Grundsatz „ein Land, zwei Systeme“, wie er in Hongkong seit der Rückgabe der früheren britischen Kronkolonie 1997 praktiziert wird. Der harte Kurs Pekings gegenüber den seit einem halben Jahr anhaltenden Demonstrationen für mehr Demokratie in der heutigen chinesischen Sonderverwaltungsregion hat die Taiwaner in ihrem Widerstand nur noch bestärkt. Vielen gilt Präsidentin Tsai Ing-wen als Garant für die Wahrung von Demokratie und Freiheit in Taiwan. Xi Jinping Hongkong",wirtschaftswoche
Fahrzeugbauer.  VW federt China-Schwäche mit SUVs ab – Nutzfahrzeuge leicht im Minus ,no_author,10. Januar 2020,https://www.wiwo.de/unternehmen/industrie/fahrzeugbauer-vw-federt-china-schwaeche-mit-suvs-ab-nutzfahrzeuge-leicht-im-minus/25420738.html,"Dank einer deutlich gestiegenen Nachfrage nach Stadtgeländewagen (SUVs) hat Volkswagen im vergangenen Jahr in China trotz der allgemeinen Marktschwäche im Land zugelegt. Insgesamt wurden von der Kernmarke   inklusive der neuen Billigmarke Jetta 3,16 Millionen Fahrzeuge ausgeliefert – 1,7 Prozent mehr als im Vorjahr. Dies teilte der Dax-Konzern am Freitag in Peking mit. Laut Daten des Branchenverbands PCA (Passenger Car Association) ist hingegen der zuvor jahrzehntelang nur nach oben zeigende Gesamtmarkt für Pkw in China 2019 zum zweiten Mal nacheinander geschrumpft. Die Volksrepublik ist wichtigster Einzelmarkt der deutschen Autobauer. Vor allem die SUV-Verkäufe zogen bei VW mit einem Plus von 81,6 Prozent auf 812.500 Stück deutlich an. Das waren 26 Prozent des  . Der Hersteller profitierte dabei auch von der Markteinführung von Modellen wie dem T-Cross und dem Teramont X. Auch die Nachfrage nach Mittelklassewagen sei weiterhin hoch gewesen. Der Konzern bleibe Spitzenreiter im chinesischen Markt. Auch die leichten Nutzfahrzeuge von VW mit Hauptsitz in Hannover meldeten am Freitag Auslieferungszahlen für 2019. Hier sank die Gesamtmenge weltweit um 1,6 Prozent auf 491.600 Wagen. Auf dem deutschen Heimatmarkt nahm sie um 0,8 Prozent ab, in Asien und im Pazifik-Raum war das Minus deutlich größer (13,4 Prozent). Besser lief es in Westeuropa (+0,5 Prozent) und Osteuropa (+8,8 Prozent). Bei der spanischen VW-Tochter Seat gab es im vorigen Jahr deutliche Zuwächse. Die Marke nannte ein Plus bei den Neuzulassungen um insgesamt 10,9 Prozent auf zuletzt 574 100 Autos. Auch hier spielten Verkäufe von SUV-Modellen wie Arona, Ateca oder Tarraco eine zentrale Rolle – ihr Anteil an den Seat-Verkäufen lag bei über 44 Prozent. VW Gesamtabsatzes der Marke VW",wirtschaftswoche
Handelsstreit.  Trump: China-Deal könnte auch „kurz nach“ 15. Januar unterzeichnet werden ,no_author,10. Januar 2020,https://www.wiwo.de/politik/ausland/handelsstreit-trump-china-deal-koennte-auch-kurz-nach-15-januar-unterzeichnet-werden/25419994.html,"g zwischen den   und China könnte sich nach den Worten von US-Präsident   geringfügig verzögern. Trump sagte am Donnerstag dem TV-Sender ABC, die Unterzeichnung könnte auch „kurz nach“ dem von ihm genannten Termin am kommenden Mittwoch (15. Januar) erfolgen. China will Vizeregierungschef Liu He zur Unterzeichnung nach Washington entsenden. Liu soll sich nach früheren Angaben des Handelsministeriums in Peking von Montag bis Mittwoch in der US-Hauptstadt aufhalten. Die beiden größten Wirtschaftsmächte der Welt hatten sich Mitte Dezember nach monatelangem Gezerre auf ein erstes Teilabkommen geeinigt. Es wird erwartet, dass darin Zollsenkungen vorgesehen sind sowie eine Zusage Chinas,   Trump will zu einem späteren Zeitpunkt nach Peking reisen, um mit den Verhandlungen für die sogenannte zweite Phase des Abkommens zu beginnen. Die angestrebte Handelsvereinbarun USA Donald Trump mehr Agrarprodukte und andere Waren in den USA zu erwerben.",wirtschaftswoche
Autobauer.  Chinesische Autokäufer bescheren BMW Rekordabsatz ,no_author,10. Januar 2020,https://www.wiwo.de/unternehmen/industrie/autobauer-chinesische-autokaeufer-bescheren-bmw-rekordabsatz/25420034.html,"Der Autobauer BMW hat im vergangenen Jahr 2,17 Millionen Autos der weiß-blauen Stammmarke verkauft und damit den Rückstand auf den Konkurrenten Mercedes-Benz verkürzt. Die neuen SUV-Modelle hätten zu dem Absatzzuwachs um 2,0 Prozent auf einen   viel beigetragen, sagte Pieter Nota am Freitag in München. Vor allem in China konnte der  -Konzern enorm zulegen: Dort stieg die Nachfrage um gut 13 Prozent. Der BMW-Konzern insgesamt verkaufte im vergangenen Jahr 2,52 Millionen Autos der Marken BMW, Mini und Rolls Royce –   Nota sagte: „Ich bin zuversichtlich, dass wir unseren Erfolgskurs im laufenden Jahr fortführen und weiter profitabel wachsen werden. Wir streben 2020 in der BMW Group insgesamt ein leichtes Absatzplus an.“ Auch in China, wo der BMW-Konzern im abgelaufenen Jahr 724.000 Autos verkauft hat, erwartet er im laufenden Jahr mit lokal gebauten Modellen einen soliden Absatzzuwachs.  hatte im vergangene Jahr inklusive Smart 2,46 Millionen Autos verkauft, davon 2,34 Millionen Mercedes-Benz. Die Stuttgarter hatten den Münchner Konkurrenten 2016 bei der Stammmarke überholt – BMW verkürzte den Abstand im vergangenen Jahr aber von 185.000 auf 171.000 Autos. Audi hat im vergangenen Jahr rund 1,85 Millionen Autos verkauft. Mit 959.000 verkauften SUV-Fahrzeugen machen die Stadtgeländewagen bei der Marke BMW inzwischen 44 Prozent des Absatzes aus. Der Anteil der besonders profitablen Luxusautos stieg dank der neuen 7er-, X7- und 8er-Reihen auf 105.000 Fahrzeuge. Hier will BMW im laufenden Jahr weiter deutlich zulegen. Die Kunden kauften im vergangenen Jahr auch 146.000 Hybrid- und Elektroautos von BMW und Mini. Der Kleinwagen Mini hat ein schwieriges Jahr hinter sich, der Absatz schrumpfte um 4,1 Prozent auf 347 000 Autos. Durchwachsen ist für BMW die Lage in Europa. Hier sank der Absatz des Konzerns im abgelaufenen Jahr um 1,5 Prozent auf 1,08 Millionen Autos. Im laufenden Jahr erwartet der Konzern, der in England Mini- und Rolls-Royce-Fahrtzeuge baut, „aufgrund eines eingetrübten Wirtschaftsumfelds ein Absatzwachstum auf Vorjahresniveau“. neuen Höchstwert BMW das ist ein Plus von 1,2 Prozent. Daimler",wirtschaftswoche
Automotive-Krise.  Der Autozulieferer Schlemmer Group hat Insolvenz angemeldet ,Henryk Hielscher,10. Januar 2020,https://www.wiwo.de/unternehmen/auto/automotive-krise-der-autozulieferer-schlemmer-group-hat-insolvenz-angemeldet/25419766.html,"Mit der Schlemmer Group hat ein weiterer großer Autozulieferer Insolvenz angemeldet. Weitgehend unbemerkt von der Öffentlichkeit haben mehrere Kerngesellschaften der Unternehmensgruppe nach Informationen der WirtschaftsWoche bereits am 19. Dezember Insolvenzanträge gestellt. Rund 500 Mitarbeiter der weltweit 3800 Mitarbeiter dürften von der Insolvenz direkt betroffen sein, heißt es in der Branche. Zum vorläufigen Insolvenzverwalter bestellte das Amtsgericht München den Sanierungsexperten Hubert Ampferl, Partner der Kanzlei Dr. Beck & Partner. Die Unternehmensgruppe mit Holding-Sitz in Aschheim bei München gilt als wichtiger Anbieter für Kunststofflösungen im Automotive-Bereich und stellt unter anderem Kabelschutzsysteme her. Schlemmer betreibt nach eigenen Angaben weltweit 21 Produktionsstandorte und hat 2018 einen Umsatz von rund 290 Millionen Euro erwirtschaftet, davon 227 Millionen Euro im Automotive-Segment. Europäische, asiatische und US-amerikanische Autohersteller gehören zu den Kunden des Unternehmens. Im Mai 2016 war Schlemmer vom britischen Finanzinvestor   übernommen worden. Insbesondere da das Produktsegment Kabelmanagement von den Megatrends in der Automobilindustrie wie E-Mobilität, autonomes Fahren und Sicherheit profitieren werde, sei das Unternehmen gut aufgestellt, hieß es damals. In den Beirat des Unternehmens zog mit Bernd Gottschalk, ehemaliger  -Vorstand und früherer Präsident des Verbands der Automobilindustrie, ein prominenter Branchenvertreter ein. Ziel war es, so heißt es intern, den Schlemmer-Umsatz unter neuem Eigentümer massiv zu erhöhen und das Unternehmen später womöglich an die Börse zu bringen.  Tatsächlich entwickelten sich die Geschäfte innerhalb der Unternehmensgruppe jedoch sehr heterogen. Insbesondere die asiatischen Auslandstöchter und ein Joint Venture in China arbeiten dem Vernehmen nach zwar erfolgreich. Auf dem deutschen Heimatmarkt und in Nordamerika soll Schlemmer dagegen zunehmend Probleme bekommen haben. Schon 2018 lag das Umsatzwachstum unter Plan, geht aus der letzten verfügbaren Konzernbilanz hervor. Abschreibungen sowie gravierende operativen Probleme beim Serienanlauf von Neuprojekten in den USA und Mexiko sowie Kosten für externe Berater führten zu einem Millionenverlust. Zugleich stieg die Verschuldung auf knapp 300 Millionen Euro.  Auch Investor 3i musste Geld nachschießen und stellte für das Geschäftsjahr 2019 zusätzlich 15 Millionen Euro zur Verfügung. Dennoch bezeichnete die Geschäftsleitung die wirtschaftliche Lage der Gruppe in der Konzernbilanz noch als „stabil“. Finanzielle Risiken seien für die Schlemmer Group nur „von mittlerer Bedeutung“, insgesamt bestünden „weder für das abgelaufene Geschäftsjahr noch für die Zukunft Risiken, die den Fortbestand der Schlemmer Group gefährden könnten.“ Das änderte sich im Jahresverlauf 2019 rasant. Im Oktober leitete die Berliner Schlemmer-Tochter Hoppe, ein Hersteller von Hochpräzisionsspritzgussteilen für die Automobil- und Elektroindustrie, eine Insolvenz in Eigenverwaltung ein. Die aktuelle konjunkturelle Lage in der Automobilbranche sowie eine damit verbundene kritische Auslastungssituation, begründete das Unternehmen damals den Schritt. Im Dezember folgte schließlich der Mutterkonzern. Dort hat mit Ampferl jetzt ein erfahrener Insolvenzverwalter und Sanierer das Kommando übernommen. So war Ampferl unter anderem bei den Insolvenzen des Modeunternehmens Strenesse, des Bootsbauers Bavaria Yachtbau und des Großbäckers Müller Brot im Einsatz. Bei Schlemmer soll der Verwalter seit Ende Dezember bereits das Geschäft stabilisiert haben. In den kommenden Monaten dürfte er nun vor allem versuchen, die Investorensuche voranzutreiben und gleichzeitig die Autohersteller als zentrale Kunden an Bord zu halten. Zahlreiche Zulieferer kämpfen derzeit mit erheblichen, teils existenziellen Problemen. So meldete vor Weihnachten die pressmetall-Gruppe, ein Hersteller von Aluminium-Druckgusskomponenten mit mehr als 700 Mitarbeitern, Insolvenz in Eigenverwaltung an. Zuvor traf es bereits Unternehmen wie Weber Automotive, Avir Guss und JD Norman Germany. Auch der Kabelspezialist   muss Finanzlöcher stopfen. Insgesamt gilt das Automotive-Segment Restrukturierungsexperten und Insolvenzverwaltern denn auch als eine der    3i Daimler Leoni zentralen Krisenbranchen für 2020.",wirtschaftswoche
"Nikkei, Topix & Co.  Japanische Börsen im Plus - Sorgen vor Krieg nehmen ab ",no_author,10. Januar 2020,https://www.wiwo.de/finanzen/boerse/nikkei-topix-und-co-japanische-boersen-im-plus-sorgen-vor-krieg-nehmen-ab/25407612.html,"Die vorläufige Entspannung im Konflikt zwischen den   und dem   hat die japanischen Börsen am Freitag gestützt. In Tokio legte der Nikkei-Index um 0,16 Prozent auf 23.777 Punkte zu. Der breiter gefasste Topix-Index stieg um 0,2 Prozent auf 1732 Zähler. Die USA und der Iran hatten zuletzt signalisiert, einen Krieg vermeiden zu wollen. Für Börsianer rückt dadurch wieder der Handelsstreit zwischen den USA und China in den Vordergrund. Mitte Januar soll der erste Teil eines Abkommens unterzeichnet werden, um den Konflikt zu lösen. Im fernöstlichen Devisenhandel lag der Dollar zur japanischen Währung unverändert bei 109,51 Yen. Der Euro gab leicht auf 1,1102 Dollar nach. USA Iran",wirtschaftswoche
