title,author,date_published,url,article_text,source
Rüstungskonzerne.  China ist laut Friedensforschern der zweitgrößte Rüstungsproduzent der Erde ,no_author,27. Januar 2020,https://www.wiwo.de/politik/ausland/ruestungskonzerne-china-ist-laut-friedensforschern-der-zweitgroesste-ruestungsproduzent-der-erde/25475552.html,"China produziert mehr Rüstungsgüter als jedes andere Land der Erde außer den   – zu dieser Einschätzung kommt das Stockholmer Friedensforschungsinstitut Sipri. Chinesische Unternehmen stellten zwar weniger Rüstungsgüter als US-Konzerne her, dafür aber mehr als die gesamte   Russlands, teilten die Friedensforscher in einer an diesem Montag veröffentlichten Analyse mit. Es handelt sich um die erste umfassende Schätzung des chinesischen Waffensektors durch Sipri – bislang hatte das Institut mangels transparenter Daten aus der Volksrepublik auf eine Einordnung von Chinas Rüstungsunternehmen im globalen Vergleich verzichtet. Nun werteten die Sipri-Forscher erstmals verlässliche Daten der Jahre 2015 bis 2017 aus, um basierend auf Kennzahlen großer chinesischer Rüstungskonzerne verlässliche Schätzungen zu veröffentlichen. Die vier untersuchten Konzerne verkaufen demnach Rüstungsgüter im Umfang von insgesamt 54,1 Milliarden Dollar (49 Milliarden Euro), was mehr als 16 Milliarden Dollar über dem Wert der zehn größten russischen Unternehmen, aber weit unter den Zahlen der US-Konzerne liegt. Verglichen mit den Waffenverkäufen der Konzerne aus anderen Ländern liegen alle vier chinesischen Konzerne unter den 20 weltweit größten Rüstungskonzernen des Jahres 2017. Drei davon ordnen sich gar in den Top 10 ein – noch vor der europäischen Airbus-Gruppe. Zu Sipris Top 20 zählten 2017 bisher elf amerikanische, sechs europäische und drei russische Konzerne. „Wir haben länger den Verdacht gehabt und geschätzt, dass Chinas Rüstungsindustrie sehr groß ist“, sagte der Sipri-Experte Nan Tian der Deutschen Presse-Agentur. Weil diese Werte äußerst unverlässlich gewesen seien, habe man in Stockholm aber bisher auf eine Veröffentlichung verzichtet. Durch den Fund neuer Quellen habe sich das nun verändert. Ab diesem Jahr sollen die chinesischen Zahlen somit auch erstmals in dem im Dezember erscheinenden Sipri-Bericht zu den weltweiten Rüstungsverkäufen berücksichtigt werden. Chinas Rüstungsindustrie besteht laut den Forschern aus zehn großen Waffenkonzernen sowie einem Forschungsinstitut. Von vier dieser Unternehmen fanden sie Daten mit verlässlichen Finanzinformationen. In diesen Berichten waren die Rüstungsverkäufe zwar nicht explizit aufgelistet, konnten laut Tian aber dennoch schätzungsweise berechnet werden – meistens deutete die Verkaufskategorie „andere“ in diesen Berichten auf Waffen oder Rüstungsgüter hin. Der tatsächliche Wert der Waffenverkäufe der gesamten chinesischen Rüstungsindustrie dürfte noch etwas höher und insgesamt zwischen 70 und 80 Milliarden Dollar liegen, sagte Tian. Für ein vollständiges Bild müssten weitere Informationen zu den anderen sechs chinesischen Rüstungsunternehmen gefunden werden. Platz zwei unter den weltweiten Rüstungsproduzenten habe China aber bereits anhand der Werte der vier analysierten Konzerne sicher. Größter Abnehmer der Güter ist dabei die Volksrepublik selbst. „Nahezu alle Waffen, die China produziert, werden im Inland vom chinesischen Militär gekauft“, sagte Tian. Ein Grund dafür sei, dass Peking bei der Herstellung der Waffen und Technologien für sein Militär völlig unabhängig von anderen Staaten werden wolle. Zugleich gebe es einen langsamen Trend, wonach die Nachfrage aus dem Ausland nach chinesischer Rüstung steige. Bis China jedoch die Exportzahlen von   erreiche, sei es noch ein weiter Weg, sagte Tian. China hat nach Angaben der Friedensforscher seit den 1960er Jahren große Summen in die Modernisierung seiner Rüstungsindustrie gesteckt, ganz besonders seit 1999. Im Gegensatz zu den meisten Unternehmen im Westen fokussieren sich die chinesischen Rüstungskonzerne dabei auf einen bestimmten Produktionssektor wie den Luftraum oder Landsysteme. Sipri definiert Rüstungsverkäufe als Verkäufe militärischer Güter und Dienstleistungen an militärische Abnehmer im In- wie im Ausland. Die meisten als Rüstungsunternehmen bezeichneten Konzerne verkaufen neben Waffen und Rüstungsgütern auch andere Produkte für den zivilen Markt. USA Rüstungsindustrie Russland",wirtschaftswoche
"Dow Jones, Nasdaq, S&P 500.  Angst vor Coronavirus hält US-Börsen im Griff ",no_author,27. Januar 2020,https://www.wiwo.de/finanzen/boerse/dow-jones-nasdaq-sundp-500-angst-vor-coronavirus-haelt-us-boersen-im-griff/25478260.html,"Die Furcht vor den wirtschaftlichen Folgen der neuartigen Lungenkrankheit in China drückt auf die Stimmung der Anleger in den  . Der Dow-Jones-Index der Standardwerte eröffnete am Montag 1,4 Prozent schwächer bei 28.570 Punkten. Der breiter gefasste S&P 500 sank um 1,8 Prozent auf 3236 Zähler. Der Index der Technologiebörse Nasdaq gab 2,3 Prozent nach auf 9098 Punkte. Das Angstbarometer schnellte auf den höchsten Stand seit Oktober. David Bahnsen, Chefinvestor bei The Bahnsen Group, schrieb an seine Kunden: „Der Dow hat unglaubliche 3000 Punkte in gerade einmal gut drei Monaten zugelegt - es braucht kaum eine Entschuldigung, um hier eine höhere Volatilität zu sehen.“ Viele Anleger brachten ihr Geld am Anleihemarkt in Sicherheit, die   sank auf 1,603 Prozent und damit auf den niedrigsten Stand seit mehr als drei Monaten. Das lastete auf den Bankaktien: Die Titel der Banc of America, der Citigroup und von JP Morgan gaben bis zu 2,9 Prozent nach. Anleger warfen außerdem die Aktien von   aus den Depots. Titel etwa von Wynn Resorts, Melco Resorts, Las Vegas Sands oder MGM Resorts geben deutlich nach, Papiere der Fluggesellschaften United, Southwest, JetBlue oder American Airlines sacken um bis zu sieben Prozent ab. Die Aktien des US-Flugzeugbauers Boeing notieren 1,1 Prozent tiefer. Kreuzfahrt-Anbieter wie Carnival, Norwegian Cruise Line oder Royal Caribbean notieren bis zu 5,9 Prozent schwächer. Die Aktie der Yum China Holding fielen um 5,2 Prozent, nachdem das Unternehmen bekanntgab, es habe einige seiner KFC- und Pizza Hut-Läden in Wuhan vorübergehend geschlossen. Gefragt waren dagegen die   wie Meridian Bioscience, die um ein Viertel nach oben schnellten: Das Unternehmen erklärte, seine Produkte würden bei der Diagnose der Coronavirus-Erkrankungen eingesetzt. Trotz des schwachem Umfelds  . Die Aktie des Fleischersatz-Herstellers legte 4,3 Prozent zu. Grund dafür ist ein Deal des Unternehmens mit der Fast-Food-Kette Dennys, die den Beyond-Burger in sein Sortiment aufnehmen will. Nach einem erfolgreichen Versuch in Los Angeles sollen die veganen Bratlinge in 1700 Restaurants in den USA und Kanada verkauft werden. In dieser Woche werden die großen Technologie-Konzern wie Facebook, Amazon und Google-Mutter Alphabet allesamt ihre Quartalsergebnisse vorlegen. Den Auftakt macht Apple morgen nach US-Börsenschluss. Die Federal Reserve wird zudem ihre Zinsentscheidung am Mittwoch bekanntgeben. Eine Zinsänderung wird nicht erwartet. Konjunkturseitig stehen heute die neuen Hausverkäufe aus den USA auf der Agenda. USA",wirtschaftswoche
"Nikkei, Topix & Co.  Furcht vor Folgen des Coronavirus lässt asiatische Börsen weiter fallen ",no_author,28. Januar 2020,https://www.wiwo.de/finanzen/boerse/nikkei-topix-und-co-furcht-vor-folgen-des-coronavirus-laesst-asiatische-boersen-weiter-fallen/25479682.html,"Die steigenden Zahlen der Todesopfer und Infizierten sowie die Ausbreitung des Virus außerhalb Chinas hat auf die Stimmung der asiatischen Anleger gedrückt. Die wirtschaftlichen Folgen sind noch nicht absehbar. „Die Wildcard ist nicht die Todesrate, sondern wie ansteckend das Wuhan-Virus ist“, schrieben Citi-Ökonomen in einer Mitteilung. „Die wirtschaftlichen Auswirkungen hängen davon ab, wie erfolgreich dieser Ausbruch eingedämmt wird.“ Allerdings werde es noch ein paar Monate dauern, bis offizielle Wirtschaftsdaten veröffentlicht werden. Analysten sagten, dass die Reise- und Tourismusbranche zusammen mit Einzelhandels- und Spirituosenverkäufer die am stärksten betroffenen Sektoren sein würden. Als Outperformer der Virus-Welle würden das Gesundheitswesen und Online-Shops angesehen. Der 225 Werte umfassende Nikkei-Index lag im Verlauf 0,9 Prozent tiefer bei 23.134 Punkten. Der breiter gefasste Topix-Index sank um 0,8 Prozent und lag bei 1689 Punkten. Die Börse in Shanghai lag 2,8 Prozent im Minus. Der Index der wichtigsten Unternehmen in Shanghai und Shenzen verlor 3,1 Prozent. Der MSCI-Index für asiatische Aktien außerhalb Japans fiel um 0,8 Prozent. Im asiatischen Devisenhandel gewann der Dollar 0,1 Prozent auf 108,97 Yen und legte 0,5 Prozent auf 6,9364 Yuan zu. Zur Schweizer Währung notierte er 0,1 Prozent höher bei 0,9704 Franken. Parallel dazu stieg der Euro um 0,1 Prozent auf 1,1021 Dollar und zog um 0,1 Prozent auf 1,0696 Franken an. Das Pfund Sterling stagnierte bei 1,3055 Dollar.",wirtschaftswoche
Arbeitsmarkt.  Deutschland hat so wenige Erwerbslose wie nie seit 1990 ,no_author,27. Januar 2020,https://www.wiwo.de/politik/deutschland/arbeitsmarkt-deutschland-hat-so-wenige-erwerbslose-wie-nie-seit-1990/25476120.html,"Die Zahl der Erwerbslosen in   ist im Jahresdurchschnitt 2019 auf den niedrigsten Stand seit der Wiedervereinigung gesunken. Nach vorläufigen Schätzungen lag sie bei 1,4 Millionen Menschen, wie das Statistische Bundesamt mitteilte. Auch der   in der Europäischen Union habe sich vom Tiefpunkt nach der Finanzkrise 2009 „weitgehend erholt“, stellten die Wiesbadener Statistiker fest. Damals war die Arbeitslosigkeit auf dem Globus auf einen Höchstwert gestiegen: 212 Millionen Menschen ohne Job zählte seinerzeit die Internationale Arbeitsorganisation (ILO). Das waren 6,6 Prozent der Weltbevölkerung im arbeitsfähigen Alter. In ihrem jüngsten Bericht für das Jahr 2019 kommt die ILO weltweit auf 188 Millionen Erwerbslose. Auch EU-weit sinkt die Zahl der Menschen ohne Arbeit dank besserer   seit mehreren Jahren wieder, wie das Statistische Bundesamt ausführt. Ausweislich von Daten des Europäischen Statistikamtes Eurostat gab es demnach im September 2019 – dem aktuellsten Monat, für den Erwerbslosenquoten für alle 28 EU-Staaten vorliegen – im EU-Schnitt 6,3 Prozent Erwerbslose. EU-weit waren in dem Monat 15,6 Millionen Menschen ohne Arbeit. Niedriger als in Deutschland (3,1 Prozent) war die Erwerbslosenquote im September vergangenen Jahres im EU-Vergleich nur in Tschechien (2,1 Prozent). Am schwierigsten ist die Arbeitssuche demnach in Griechenland und Spanien, wo 16,8 Prozent bzw. 14,2 Prozent der Erwerbspersonen ohne Job waren. Für 2020 rechnen Konjunkturforscher allerdings mit einer Trendwende auf dem deutschen Arbeitsmarkt. Das Institut für Makroökonomie und Konjunkturforschung (IMK) der gewerkschaftsnahen Hans-Böckler-Stiftung geht in einer im Herbst 2019 veröffentlichten Konjunkturprognose davon aus, dass 2020 die Zahl der Arbeitslosen erstmals seit Jahren wieder steigen wird – allerdings nur geringfügig um rund 30.000 Personen. Die Arbeitslosenquote werde sich im Jahresdurchschnitt von 5,0 Prozent 2019 auf 5,1 Prozent 2020 erhöhen. Die Ursache für das schwache Wachstum sieht das IMK in den wachsenden internationalen Handelskonflikten, der verlangsamten Wirtschaftsentwicklung in China und der fortbestehenden Unsicherheit über die konkrete Ausgestaltung des Brexit. Aufgrund ihrer hohen Exportorientierung bekomme die deutsche Wirtschaft diese Effekte besonders stark zu spüren. Dennoch zeigte sich der wissenschaftliche Direktor des IMK, Sebastian Dullien, mit Blick auf die weitere Entwicklung gedämpft optimistisch. „Es sieht so aus, als könnte die deutsche Wirtschaft in diesem Abschwung mit einem blauen Auge davon kommen. Allerdings gibt es derzeit zugleich wenig Anzeichen, dass sie sich schnell erholt.“ Deutschland Arbeitsmarkt Konjunktur",wirtschaftswoche
 Lufthansa-Aktie – abheben oder abschmieren?,no_author,27. Januar 2020,https://www.wiwo.de/finanzen/boerse/zschabers-boersenblick-lufthansa-aktie-abheben-oder-abschmieren/25470932.html,"Murphy’s Law ist für diejenigen, die nicht davon betroffen sind, immer einen Lacher wert. Das Gesetz, wonach alles das, was schief gehen kann, auch schief geht, finden allerdings diejenigen, die darunter leiden, weniger lustig. Fragen Sie doch mal bei der Deutsche   AG nach.  Da wäre etwa das seit Ende Dezember feststehende 2019er-Ranking der Out- und Underperformer im Dax. In einem insgesamt sehr starken Börsenjahr, in dem der deutsche Leitindex ein Plus von rund 25 Prozent erzielt hat, musste die  -Aktie einen Verlust von knapp 17 Prozent hinnehmen – schlechter war in der ersten deutschen Börsenliga nur das Enfant terrible  . Dieser Erkenntnis folgte nur kurz später die Nachricht, dass Deutschlands größte Airline einen Rückschlag im europäischen Wettbewerb hinnehmen müsse: Den nach Passagierzahlen ersten Platz in Europa hatte der irische Billigflieger   der Lufthansa weggenommen, die noch in den Jahren 2017 und 2018 die Pole Position innehatte.  Zwar steigerte die Kranich-Airline die Zahl der im Jahr 2019 insgesamt beförderten Fluggäste um 2,3 Prozent auf rund 145 Millionen. Doch der Konkurrent von der grünen Insel legte in dieser Disziplin noch deutlicher zu – um rund neun Prozent auf 152,4 Millionen. Da war es für die Lufthansa nur ein geringer Trost, dass sie im abgelaufenen Jahr ihre Auslastungsquote auf das neue Rekordniveau von 82,5 Prozent schrauben konnte. Ebenfalls in den Negativschlagzeilen war die Lufthansa Anfang des Jahres dann wegen des Streiks der Kabinengewerkschaft UFO und der damit verbundenen Ausfälle und Verzögerungen – genervte Fluggäste taugen nun einmal selten für gute PR. Und kaum scheint dieses Thema vom Tisch zu sein, sorgen sich die Analysten darum, dass das Coronavirus in China den Flugverkehr zumindest in Asien werde leiden lassen. Fast vergisst man, dass sich die Lufthansa noch um ihr Problemkind, die Tochtergesellschaft   zu kümmern hat.  Angesichts dieser Gemengelage mag das zynisch anmuten, aber gerade jetzt ist ein Blick auf die Aktie interessant. „Die Letzten werden die Ersten sein“ ist zwar keine Börsenregel, nach der Anleger sich blind richten sollten. Wenn es aber turbulent wird bei einem Wert, ist das oftmals keine schlechte Gelegenheit, über die Vor- und Nachteile eines Engagements zumindest nachzudenken.  Zu den Vorteilen der Lufthansa-Aktie gehört zweifelsohne deren Bewertung: Das Kurs-Gewinn-Verhältnis auf Basis der Schätzungen für das Geschäftsjahr 2020 liegt bei 5. Ähnlich sieht es beim KUV aus: Die aktuelle Marktkapitalisierung erreicht nicht einmal ein Fünftel des 2018er-Umsatzes. Dass die Dividendenrendite immerhin 5,4 Prozent beträgt, ist ein weiterer Punkt, der gerade langfristig orientierte Investoren interessieren könnte. Und bei allen negativen Nachrichten der jüngeren Vergangenheit darf man nicht unterschlagen, dass der Konzern sich in einer Umstrukturierung befindet, die ihn auch wieder in luftigere Höhen bringen kann. Die jüngsten Spekulationen über einen Börsengang der lukrativen Tochter Lufthansa Technik deuten an, dass dabei sämtliche Optionen geprüft werden. Die Technik-Sparte, die Experten zufolge mehr wert sein soll, als der komplette Konzern derzeit auf die Börsenwaage bringt, könnte diesem dann ordentlich Geld in die Kassen spülen. Natürlich ist auch Lufthansa mit Risiken behaftet, nicht zuletzt wegen der allgegenwärtigen Klimawandeldebatte und den hohen Kosten, die weitere Umstrukturierungen mit sich bringen werden. Dass Flugscham zum Thema werden würde, hätte man vor zwei Jahren schließlich noch nicht gedacht. Doch auch hier hilft es, langfristig zu denken, denn die Flugoption wird gerade von den neuen Bewohnern der nun aufstrebenden Volkswirtschaften Asiens, die viel reisen, weiterhin stark genutzt werden. Am klimafreundlichsten wäre es zwar, ein jeder würde zu Hause bleiben, doch so vernünftig diese Option auch klingen mag, sie ist eigentlich keine. Im 21. Jahrhundert wollen die Menschen die Welt sehen, andere Länder und Kulturen kennenlernen. Das ist nicht nur nachvollziehbar, es ist auch gut so. Denn es erweitert nicht nur den geographischen, sondern auch ihren kulturellen und intellektuellen Horizont – und fördert eine globale Toleranz für das jeweils Andere.  All das können weder Videokonferenzen noch Skype-Sessions leisten. Die Lösung werden daher vielmehr neue Flugzeugtypen darstellen, die nicht mehr pro Flug Tausende von Litern Kerosin ausstoßen, sondern die elektronisch angetrieben werden. Die Zukunft einer Fluggesellschaft wie Lufthansa mag dann anders aussehen als heute – aber es wird sie zweifellos weiterhin geben.  Die Lufthansa mit ihrer über Jahrzehnte aufgebauten, starken Marke und ihrer auch aufgrund der Zugehörigkeit zur Flugallianz Star Alliance großen Anhängerschaft unter Geschäftskunden dürfte dann weiterhin eine gute Position haben. Wettbewerb wird es freilich auch in diesem Verbund geben, dem man sich stellen muss. Gelingt dies, kann auch die Lufthansa-Aktie wieder an Flughöhe gewinnen. Lufthansa Lufthansa Wirecard Ryanair Eurowings",wirtschaftswoche
Kunststoffabfall.  Plastik-Verpackungen in Japan: Doppelt hält besser ,Martin Fritz,24. Januar 2020,https://www.wiwo.de/politik/ausland/kunststoffabfall-plastik-verpackungen-in-japan-doppelt-haelt-besser/25469704.html,"Als sich der japanische Umweltminister Shinjiro Koizumi nach seiner Ernennung im September der ausländischen Presse stellte, stand neben den Mikrofonen auf seinem Tisch eine Glaskaraffe mit Wasser statt einer PET-Trinkflasche. „Die Kritik an   wegen unseres Plastikverbrauchs ist falsch“, beschwerte sich der junge Minister und zeigte auf die Karaffe. „Europa recycelt nur 20 Prozent und Amerika nur 40 Prozent aller PET-Flaschen, aber in Japan sind es 85 Prozent. Bitte vergessen Sie das nicht.“ Doch diese positive Zahl kann das düstere Gesamtbild kaum aufhellen. Denn Japan liebt Kunststoff über alles. Obst und Gemüse liegen einzeln in durchsichtige Folie verpackt im Supermarkt, Schaumstoffnetze rund um empfindliche Waren wie Pfirsiche verhindern Druckstellen. Die Kassierer stecken alle gekühlten oder flüssigen Produkte in eine dünne, passend große Extratüte, damit auslaufende oder kondensierte Feuchtigkeit die anderen Einkaufswaren nicht benetzen kann. Viele Supermärkte bereiten in eigenen Küchen Lebensmittel frisch zu und verkaufen täglich Hunderte von Fertiggerichten in hitzebeständigen Kunststoffbehältern. Bei Regen stehen am Eingang von Kaufhäusern und Supermärkten Vorrichtungen, damit die Kunden ihren nassen Schirm in eine dünne Plastikhülle schieben können. So bleibt der Ladenboden trocken – doch beim Rausgehen wirft man den Tropfschutz gleich wieder weg. Die Liebe zum Plastik hängt möglicherweise mit einem speziellen Empfinden von Schönheit und Sauberkeit in Japan zusammen. „Das japanische Wort kirei bedeutet gleichzeitig sauber und schön, der glatte Kunststoff ruft ein Wohlgefühl hervor“, erzählt ein deutscher Manager, der lange in Japan arbeitet. Viele Restaurants in Japan bilden ihre attraktivsten Gerichte originalgetreu in PVC-Plastik nach und stellen sie ins Schaufenster, damit potenziellen Kunden das Wasser im Munde zusammenläuft. Unterm Strich entstehen in Japan so jährlich neun Millionen Tonnen Plastikabfall, 71 Kilogramm pro Einwohner, davon 40 Prozent Verpackungen. Laut UN-Umweltprogramm generiert Japan pro Kopf gerechnet nach den USA weltweit den meisten Kunststoffabfall. Der Forscher Sadao Harada der Universität Osaka hat einen Jahreskonsum eines Japaners allein an Plastiktüten von 240 Stück errechnet, das wären 30 Milliarden im Jahr. Trotz der hohen Sauberkeit in den Städten finden viele davon ihren Weg in die Umwelt. Drei Millionen Tüten lägen schon auf dem Meeresboden in der Bucht von Osaka, schätzt Harada. Lange Zeit redete sich die japanische Politik mit der hohen Recyclingquote von 86 Prozent heraus, nur acht Prozent des Kunststoffabfalls werden offiziell verbrannt und der geringe Rest deponiert. In der Tat: Alle japanischen Haushalte trennen konsequent Kunststoffe von anderen Abfällen, weit mehr als im deutschen Gelben Sack. Wegen seiner angeblich vorbildlichen Wiederverwertung hat Japan auch die „Ozean-Plastik-Charta“ für die Verringerung von Einmal-Plastikverpackungen nicht unterschrieben, die der G7-Gipfel in Kanada im Juni 2018 auf den Weg brachte. Jedoch dachte die Regierung bei ihrer Weigerung wohl auch daran, dass japanische Unternehmen zu den ganz großen Kunststoffproduzenten der Welt gehören. „Plastik ist eine der großen Erfindungen des 20. Jahrhunderts“, stemmte sich Premierminister Shinzo Abe im Oktober gegen die Verteufelung von Kunststoffverpackungen. Aus Sorge um das wirtschaftliche Wachstum setzt er auf Wiederverwerten statt auf Vermeiden. „Wir brauchen ein gutes Abfallmanagement und Innovationen für Lösungen“, sagte Abe abwehrend. Doch die beeindruckend hohe Wiederverwertungsquote führt in die Irre. In Wirklichkeit werden 58 Prozent des Plastiks „thermisch wiederverwertet“, also zur Stromerzeugung verbrannt. 14 Prozent des Kunststoffabfalls exportiert Japan in andere Länder und nur 13 Prozent bereitet man im eigenen Land wieder auf. Erst nachdem China die Importe verbot und Länder wie Malaysia begannen, den japanischen Plastikmüll containerweise zurückschickten, begann die japanische Regierung zu handeln. Im Mai vergangenen Jahres versprach Premier Abe, die Menge an Einwegverpackungen aus Kunststoff um 25 Prozent zu reduzieren. Bis 2035 sollen 100 Prozent des verbrauchten Plastiks weiter genutzt werden, einschließlich Kunststoff in alten Haushaltsgeräten und Fahrzeugen. Der Staat nimmt auch Fördergelder in die Hand, um kompostierbare Kunststoffe zu entwickeln. Aber   Japan ließ sich davon nicht beeindrucken: „Das Ziel von 25 Prozent weniger Plastik ist vage und kommt ohne Vergleichsjahr“, meint Hiroaki Odachi vom Plastikprojekt der Umweltschutzorganisation in Japan. Auch eine zweite Maßnahme wirkt eher halbherzig: Ab Juli müssen alle Geschäfte für jede Plastiktüte eine Gebühr verlangen. Nur Reinigungen und andere Serviceanbieter dürfen ihre Tüten noch umsonst abgeben. Die Gebühr sollen die Geschäfte selbst bestimmen, aber es braucht nur 1 Yen zu sein, das ist weniger als 1 Eurocent. Ausgenommen sind Tüten aus biologisch abbaubarem Kunststoff, wie sie der größte Tütenhersteller Fukusuke Kogyo ab Juli auf den Markt bringen wird. Allerdings kosten sie in der Herstellung das Sieben- bis Zehnfache. Ohnehin machen Tüten nur zwei Prozent des japanischen Plastikverbrauchs aus. Während die Regierung also weiter auf die Bremse tritt, geben viele Einzelhändler Gas: Sie haben den Kampf gegen Plastik als Werbechance für ihre Dienste und Produkte entdeckt.   Japan verpackt mehrere Kitkat-Schokoriegel neuerdings in einer Papiertüte. Doch dabei bleibt jeder Schokoriegel in der Tüte einzeln in Kunststoff gehüllt.   verzichtet seit Januar in den 1500 Filialen in Japan öffentlichkeitswirksam auf Strohhalme aus Plastik – aber Becher und Deckel bleiben aus Kunststoff. Manche Kunden vermissen schon die gewohnte Bequemlichkeit. „Wiederverwendbare Halme sind eine gute Idee, aber wer trägt so etwas mit sich herum“, kommentiert eine Hausfrau, die mit ihrer Freundin in einem Café sitzt. Skylark, ein Betreiber von zwei großen Restaurantketten, benutzt seit Kurzem keine Container und kein Besteck aus Plastik für Essen zum Mitnehmen mehr. Strohhalme bekommen die Gäste nur noch auf Wunsch. Die kompostierbaren Saugröhrchen sind aus Maisstärke oder Holz, auch Schalen und kleine Teller aus Bambus- und Zuckerrohrfasern sind inzwischen auf dem Markt. Die größte Minisupermarktkette 7-Eleven wickelt Onigiri-Reisbällchen, das Pendant zum deutschen Butterbrot, neuerdings in Bioplastikfolie ein – aber wie hoch der Biokunststoffanteil darin ist, will der Supermarktbetreiber nicht verraten. Professor Hideshige Takada von der Universität Tokio begrüßt den Trend trotzdem: „Die vermiedene Abfallmenge ist zwar gering, aber das Bewusstsein für dieses Problem steigt“, meint der Experte für Umweltverschmutzung. Auch Umweltminister Koizumi setzt gerne auf symbolische Schritte. Seit Dezember dürfen die Geschäfte im Untergrund seines Ministeriums an ihre Kunden keine Plastiktüten mehr ausgeben. Das erspart der Umwelt 860.000 Tüten im Jahr oder 2300 am Tag. Immerhin. Japan Greenpeace Nestlé Starbucks",wirtschaftswoche
