title,author,date_published,url,article_text,source
Chemiekonzern.  Lanxess ist Ziel eines Hackerangriffs geworden ,no_author,31. Januar 2020,https://www.wiwo.de/unternehmen/industrie/chemiekonzern-lanxess-ist-ziel-eines-hackerangriffs-geworden/25495376.html,"Der Chemiekonzern Lanxess ist Opfer eines Hackerangriffs geworden. Die Schadsoftware sei „in der zweiten Hälfte des vergangenen Jahres“ in Teilen des IT-Netzwerks entdeckt worden, sagte ein Unternehmenssprecher am Freitag. Nach Recherchen des Bayerischen Rundfunks und des   soll eine Hacker-Gruppe mit dem Namen „Winnti“ hinter dem Angriff stecken, der Verbindungen zum chinesischen Staat nachgesagt werden.   selbst wollte sich nicht dazu äußern, wer hinter dem Hackerangriff stecken könnte. Der Konzern betonte, nach der Entdeckung der Schadsoftware seien umgehend geeignete Gegenmaßnahmen ergriffen worden. Es gebe keine Erkenntnisse, dass sensible, geschäftsrelevante Daten abgeflossen seien. Dr Fall sei an die Strafverfolgungsbehörden übergeben worden. In den vergangenen Jahren waren bereits mehrere große deutsche Unternehmen  . Unter anderem bestätigten Siemens, Covestro, Bayer, BASF und Henkel Ziel von Cyber-Angriffen gewesen zu sein. : Warum die Chemie kriselt – und das ein Frühwarnsignal für die gesamte Wirtschaft ist. NDR Lanxess Ziel von Ausspäh-Attacken mutmaßlich chinesischer Hacker",wirtschaftswoche
Coronavirus.  Müssen berufliche Vielflieger in den Risiko-Modus umschalten?  ,Tristan Heming,31. Januar 2020,https://www.wiwo.de/erfolg/beruf/coronavirus-muessen-berufliche-vielflieger-in-den-risiko-modus-umschalten/25494774.html,"Die Angst ist groß: Der Coronavirus hat inzwischen mehr Menschen befallen als der SARS-Erreger vor 17 Jahren. Wie sehr das gerade Vielreisende betrifft, zeigt sich an Szenen am Flughafen in Abu Dhabi in Dubai: „Da gibt es in keiner Apotheke mehr Desinfektionsmittel, Atemmasken sind sowieso ausverkauft und auch das ganze Personal ist mit Masken unterwegs“, beschreibt Alexander Koenig, während er gerade in Abu Dhabi umsteigt. Koenig ist Gründer der Vielflieger-Beratung  und kennt sich aus mit Risiken bei Geschäftsreisen. Müssen berufliche Vielflieger nun also in den Risiko-Modus umschalten?  Nicht ganz. Natürlich werden Vorsichtsmaßnahmen ergriffen: Laut einer Befragung unter 105 Mitgliedsunternehmen des Geschäftsreiseverbands VDR haben 96 Prozent der zuständigen Travel Manager Dienstreisen nach China inzwischen verboten oder stark eingeschränkt. Die restlichen vier Prozent planen ebenfalls entsprechende Maßnahmen. Ausnahmeregeln müssen in 43 Prozent der Unternehmen durch Vorgesetzte oder den Vorstand abgesegnet werden. VDR-Präsidiumsmitglied Heiko Luft sagt: „Wichtig ist, dass Unternehmen die Nachrichtenlage im Auge behalten, um Risiken und Lageveränderungen bestmöglich einschätzen zu können.“ Nur eine enge Zusammenarbeit von Travel Management, Personalabteilung, Reiserisiko-Management und Unternehmenssicherheit könne die Sicherheit der Mitarbeiter gewährleisten.  Dennoch betont Heiko Luft im Gespräch mit der WirtschaftsWoche auch, dass die Dienstreise-Manager gut vorbereitet seien. Der Verband hat in Fachgruppen einen Fürsorge-Leitfaden erstellt, der die Vorbereitung der Reisen, den Umgang mit konkreten krisenhaften Situationen und die Nachsorge umfasst. Insofern sind die nun ergriffenen Maßnahmen zwar nicht alltäglich, aber verlaufen ruhig und nach Plan: Absage weiterer Reisen (Vorsorge), Evakuierung aus der Gefahrenzone (Reaktion), Betreuung nach der Rückkehr (Nachsorge).     Die Travel Manager sind noch auf ganz andere Risiken eingestellt. Innerhalb der EU reichen Flüge, ein Hotel und eine A1-Bescheinigung. Diese Bürokratie bezeichnet Luft vom VDR zwar als „Dorn im Auge, da sie Unternehmen unnötig belastet“. Dennoch stelle sie erstmal keine zu große Herausforderung. Anders ist das in Krisengebieten oder Ländern ohne verlässliche Demokratie. „Wenn es für einen Mitarbeiter in bestimmte Risikoländer geht, bekommt er in vielen Firmen ein neues Handy, das nach seiner Rückkehr vernichtet wird. Sein eigenes bleibt wegen der darauf enthaltenen Daten zuhause.“ Und es geht noch exotischer, wie Luft erzählt: „An Orten, wo man sich auf den Handyempfang nicht verlassen kann, kriegen die Reisenden ein Satellitentelefon. In manchen Krisenregionen gibt es noch weitere Unterstützung wie etwa Fahrer oder ein gepanzertes Fahrzeug.“ Das sind natürlich Extremfälle – sie zeigen aber, warum die Dienstreiseverantwortlichen nun vergleichsweise ruhig bleiben.  Die „normale“ Vorsorge umfasst seltener die Beschaffung gepanzerter Gefährte. Hier geht es eher um Impfungen gegen bekannte regionale Krankheiten, die Vorbereitung auf kulturelle Besonderheiten und auch die politische Situation.  Vielflieger-Experte Koenig ist von Abu Dhabi inzwischen in Zürich angekommen. Hier ist die Lage ruhiger, kaum Masken, mehr ganz normaler Alltag. Die Nachricht, dass der Corona-Krankheitsverlauf bei vollständig gesunden Menschen oft nicht sehr schwerwiegend ist und die Infektion nicht im Vorbeigehen geschieht, scheint angekommen zu sein. Dennoch schadet ein wenig Vorsicht natürlich nicht. Es gibt einige Tipps, die jedem Reisenden helfen, gesund zu bleiben, ob es nun um Corona oder „nur“ um eine Erkältung geht.   Koenigs erster Tipp ist es, Business Class zu fliegen – hier haben viele Airlines Einzelsitze für Alleinreisende, die den Kontakt und damit die Ansteckungschance verringern. Doch die Business Class bedeutet natürlich auch einen preislichen Aufschlag. Zudem hilft eine vernünftige Hygiene-Routine: „Die Spots, die im Flugzeug viele Erreger tragen, sind logischerweise die Toilette – aber auch der Tisch. Ich habe oft ein Sagrotan-Tuch dabei, um die Dinge, die ich anfasse, einmal abzuwischen. Bestimmte Dinge schaden einfach nicht“, sagt Alexander Koenig. Wichtig sei zudem, oft die Hände zu waschen. Basis-Programm, sollte man meinen, Krankenkassen empfehlen das bei eigentlich jeder Krankheit, die umgeht. Offenbar halten sich dennoch nicht genügen Leute daran. Die einfachste Methode, die Ausbreitung von Krankheiten einzuschränken, wäre natürlich, Dienstreisen völlig einzustellen. Das ist aber gerade für Heiko Luft keine Option: Er sagt zwar gerade in Hinblick auf die ökologische Effizient, dass man Flugreisen „sicher noch reduzieren“ müsse. Gerade in Sachen kultureller Austausch sei eine Dienstreise jedoch oft nicht zu ersetzen. „Es hilft, das Land zu kennen, in dem man wichtige Geschäftsbeziehungen hat. Gerade bei Unternehmen mit Niederlassungen im Ausland ist es wichtig zu wissen: Wie arbeiten die Menschen vor Ort, wie leben sie?“ Momentan bleibt der kulturelle Austausch jedoch bei den meisten Unternehmen auf der Strecke, zumindest mit China: Interkulturelle Kommunikation gibt es hier in Zeiten von Corona nur per Video-Konferenz.  ",wirtschaftswoche
"Dow Jones, Nasdaq, S&P 500.  Virus-Sorgen machen Wall Street erneut zu schaffen ",no_author,31. Januar 2020,https://www.wiwo.de/finanzen/boerse/dow-jones-nasdaq-sundp-500-virus-sorgen-machen-wall-street-erneut-zu-schaffen/25496890.html,"Die Furcht vor einem Dämpfer für die Weltwirtschaft durch den Coronovirus-Ausbruch hält US-Anleger weiter gefangen. Die Leitindizes Dow Jones, Nasdaq und S&P 500 fielen zur Eröffnung am Freitag um bis zu 0,8 Prozent. Sorgen bereitete Anlegern die rasche Ausbreitung des Erregers. Fluglinien stellten Verbindungen nach China ein, wo die Krankheit ihren Ausgang nahm. Außerdem verlängerte die Regierung in Peking die Neujahrsfeiertage. Die Experten der Ratingagentur Fitch warnten, dass diese Krise das chinesische Wachstum 2020 auf 5,4 Prozent drücken könnte. Bislang rechneten sie mit einem Plus von 5,9 Prozent. Die Erfahrung aus der Sars-Pandemie von 2002/2003, deren Erreger dem Coronavirus ähnelt, lehre, dass die Aktienmärkte vor allem in Asien fallen werden, bis sich die Zahl der Neuinfektionen stabilisiere, sagte Anlagestratege Robert Buckland von der Citibank. In erster Linie würden konjunkturabhängige Werte unter die Räder kommen. Er rate allerdings, Kursrücksetzer zum Einstieg zu nutzen. Bei den Unternehmen stach nach Vorlage überzeugender Geschäftszahlen Amazon heraus. „Die Zahlen haben die Erwartungen der Wall Street in jeder Hinsicht übertroffen“, sagte Naeem Aslam, Chef-Marktanalyst des Brokerhauses AvaTrade. Die Aktien des Online-Händlers stiegen daraufhin um knapp zehn Prozent auf ein Rekordhoch von 2052 Dollar. Das ist der größte Kurssprung seit fast zweieinhalb Jahren. Außerdem kehrte das Unternehmen in den exklusiven Zirkel der Firmen mit einem Börsenwert von mehr als einer Billion Dollar zurück. Die Titel von Visa rutschten dagegen trotz eines Umsatz- und Gewinnanstiegs um 3,9 Prozent ab. Analysten hatten auf mehr gehofft. Bei genauerem Hinsehen laufe das Geschäft aber weiter gut, konstatierte Analyst Trevor Williams von der Investmentbank Jefferies. Die Aktie werde sicher rasch wieder zulegen. : Die aktuelle Entwicklung in Sachen Coronavirus im Überblick.",wirtschaftswoche
Tarifstreit.  Lufthansa und UFO steigen in Schlichtung ein – Keine Streiks mehr ,no_author,31. Januar 2020,https://www.wiwo.de/unternehmen/handel/tarifstreit-lufthansa-und-ufo-steigen-in-schlichtung-ein-keine-streiks-mehr/25494770.html,"Die Lufthansa und die Flugbegleitergewerkschaft UFO haben sich auf einen konkreten Fahrplan zur Lösung   geeinigt und damit Streiks vorerst ausgeschlossen. Geplant sei ein mehrstufiges Vorgehen, wie beide Seiten am Freitag mitteilten. „Der Prozess sieht die Trennung der tariflichen und der nicht tariflichen Themen in drei Verfahren vor: Mediation, Schlichtung und außergerichtliches Güteverfahren.“ Die rund 22.000 Kabinen-Beschäftigten bekommen unter anderem eine Sonderzahlung über 1500 Euro. Zudem gilt ab sofort und mindestens bis zum Abschluss der Schlichtung eine Friedenspflicht bei Lufthansa. Während der Mediation sind Streiks bei allen Konzernairlines ausgeschlossen, etwa auch bei Germanwings und dem Billigflieger Eurowings. Beide Seiten wollen die Gespräche in den nächsten Tagen fortsetzen. An den Märkten kam die Nachricht gut an: Die Lufthansa-Aktie notierte am Freitagmorgen 0,9 Prozent im Plus und gehörte damit zu den Gewinnern im Dax. Branchenexperten gehen davon aus,  . UFO-Verhandlungsführer Daniel Flohr zeigte sich erfreut, dass es nun einen Rahmen gebe, den Konflikt „mit Hilfe Dritter zu klären und zu lernen, was wir in der Zukunft anders machen müssen, damit so ein Konflikt nicht mehr derart eskaliert“. Lufthansa-Personalchef Michael Niggemann bezeichnete es als wichtig, dass „wir mit dem Einstieg in eine große Schlichtung nun unmittelbar die eigentlichen Tarifthemen miteinander besprechen können.“ Gleichzeitig gebe es die Chance, auch die sonstigen bestehenden Konflikte „getrennt zu befrieden“. Die Lufthansa-Aktie lag zum Handelsstart 0,5 Prozent im Plus. Der Streit dreht sich weniger um tarifliche Fragen als um das zerrütteten Verhältnis von Arbeitgeber und Gewerkschaft. Zuletzt waren nach Streiks mehrere Anläufe zu einer Schlichtung gescheitert. Auch eine Mediation kam nicht zustande, weil die Lufthansa auf einen Streikverzicht während der Verhandlungen bestand. Das hatte UFO verweigert. Seit Herbst hatte die Gewerkschaft drei kurze Streiks organisiert und damit die Lufthansa zur Streichung vieler Flüge gezwungen. In der geplanten Mediation sollen Fragen des Miteinanders geklärt werden, die den künftigen Umgang betreffen, aber auch die Konflikte der Vergangenheit mit einschließen. „So soll eine gemeinsame Vertrauensbasis in der Sozialpartnerschaft wiederhergestellt werden“, wie beide Seiten betonten. Parallel dazu steigen die Parteien nun in eine „große“ Schlichtung ein, die die von UFO aufgestellten Tarifforderungen und weitere Tarifthemen umfasst. „In einem davon getrennt geführten außergerichtlichem Güteverfahren werden darüber hinaus die materiellen, juristischen Themen beider Parteien und einzelner Funktionäre von einem Arbeitsrichter möglichst abschließenden Lösungen zugeführt.“ Dies dürfte ein Knackpunkt sein, denn der Konflikt zwischen Lufthansa und UFO eskalierte in rechtlichen Auseinandersetzungen über die Tariffähigkeit und damit der Existenzgrundlage der Gewerkschaft. Nach Rücktritten und Krach im UFO-Vorstand hatte die Lufthansa die Befugnis der Gewerkschaftsspitze zum Abschluss von Tarifverträgen gerichtlich angegriffen. Dieses Statusverfahren zog sie im November zurück. Doch andere Verfahren gegen die Gewerkschaft und einzelne UFO-Vertreter liefen weiter. Bei UFO ist unterdessen die Wahl eines neuen Vorstandes angelaufen. : Lufthansa folgt British Airways und anderen Fluggesellschaften und streicht wegen des Coronavirus alle China-Flüge. ihres hartnäckigen Tarifkonflikts dass die Mediation rund zwei Monaten dauern könnte, die Schlichtung aber womöglich deutlich länger",wirtschaftswoche
"Nikkei, Topix & Co.  Sorgen vor Coronavirus-Auswirkungen belastet asiatische Aktien ",no_author,30. Januar 2020,https://www.wiwo.de/finanzen/boerse/nikkei-topix-und-co-sorgen-vor-coronavirus-auswirkungen-belastet-asiatische-aktien/25489762.html,"Die asiatischen Anleger werden weiterhin von der Angst vor den wirtschaftlichen Folgen der Ausbreitung des Coronavirus in Schach gehalten. Die meisten Analysten haben die Auswirkungen der Ausbreitung des schweren akuten Atemwegssyndroms (SARS) in den Jahren 2002-2003 zurate gezogen, das damals vor allem die Tourismusbranche einbrechen ließ. „Der SARS-Ausbruch legt nahe, dass es zu großen Auswirkungen auf die Wirtschaftstätigkeit führen könnte, zumal der Angstfaktor die Mobilität der Menschen einschränken könnte“, schrieben Analysten der Deutschen Bank. „Die Auswirkungen von China auf den Rest der Welt ist tendenziell nun viel größer als bei SARS, sowohl in Bezug auf einen Nachfrage- als auch auf einen Angebotsschock“, fügten sie hinzu, denn Chinas Anteil an der Weltwirtschaft habe sich seither mehr als verdreifacht. Im Handelsverlauf machte sich zudem die  -Entscheidung bemerkbar. Die Notenbank beließ den Leitzins unverändert und stellte klar, dass sie an ihrem Kurs festhalten und nicht - wie etwa von US-Präsident Donald Trump gefordert - eine laxere Geldpolitik verfolgen werde. „Innerhalb weniger Tage hat das Coronavirus die Karten neu gemischt und die  -Politik passt nicht mehr ganz so gut“, sagte Alan Ruskin, Chefstratege bei der  . „Die Fed wird es, wie alle anderen auch, schwer haben, das Ausmaß des potenziell großen Schocks zu ermitteln.“ Die Börse in Tokio hat sich am Donnerstag zunächst schwächer gezeigt. Der 225 Werte umfassende Nikkei-Index lag im Verlauf 1,9 Prozent tiefer bei 22.937 Punkten. Der breiter gefasste Topix-Index sank um 1,7 Prozent und lag bei 1671 Punkten. Die Börse in Shanghai lag 2,8 Prozent im Minus. Der Index der wichtigsten Unternehmen in Shanghai und Shenzen verlor 3,1 Prozent. Der MSCI-Index für asiatische Aktien außerhalb Japans fiel um 0,6 Prozent. Im asiatischen Devisenhandel verlor der Dollar 0,1 Prozent auf 108,87 Yen und legte 0,5 Prozent auf 6,9364 Yuan zu. Zur Schweizer Währung notierte er 0,1 Prozent niedriger bei 0,9722 Franken. Parallel dazu stieg der Euro um 0,1 Prozent auf 1,1015 Dollar und gab 0,1 Prozent auf 1,0709 Franken nach. Das Pfund Sterling stagnierte bei 1,3015 Dollar. Fed Fed Deutschen Bank",wirtschaftswoche
Mobilfunk.  Italien will chinesische Firmen nicht von 5G-Netz ausschließen ,no_author,30. Januar 2020,https://www.wiwo.de/politik/ausland/mobilfunk-italien-will-chinesische-firmen-nicht-von-5g-netz-ausschliessen/25493940.html," will nach Angaben der Regierung chinesische Firmen nicht von einer Beteiligung am Aufbau des neuen 5G-Mobilfunknetzes ausschließen. Die Regierung in Rom werde die Frage der Sicherheit in den Griff bekommen, „ohne naiv zu sein, mit der notwendigen Vorsicht“, sagte die Staatssekretärin im Industrieministerium, Mirella Liuzza, am Donnerstag der Nachrichtenagentur Reuters. „Aber wir werden niemanden vor der Tür stehen lassen.“ Damit beugt sich Italien nicht der Forderung der USA, beim 5G-Ausbau komplett auf den chinesischen Netzwerkausrüster   zu verzichten. Die USA führen Sicherheitsbedenken an. „Italien muss in erster Linie seine nationalen Interessen schützen“, betonte Liuzza. Erst am Mittwoch hatte die britische Regierung eine teilweise Nutzung von Huawei-Komponenten genehmigt. Die EU-Kommission stellt es ihren Mitgliedstaaten frei, selbst über einen Ausschluss oder eine Beteiligung von   zu entscheiden. Das italienische Parlament hatte im vergangenen Jahr ein Gesetz verabschiedet, das der Regierung ein besonderes Mitspracherecht bei der Auswahl von Zulieferern einräumt. Das 5G-Mobilfunknetz wird auch für Technologien wie autonomes Fahren benötigt und gilt als strategisch wichtig. Italien Huawei Huawei",wirtschaftswoche
Autobauer.  Renault und Nissan wollen ihre Allianz retten ,no_author,30. Januar 2020,https://www.wiwo.de/unternehmen/industrie/autobauer-renault-und-nissan-wollen-ihre-allianz-retten/25492006.html,"Renault und Nissan wollen ihre ins Wanken geratene Autoallianz kitten. Die beiden Konzerne und ihr Juniorpartner Mitsubishi vereinbarten am Donnerstag, die Aufgaben künftig untereinander aufzuteilen. Demnach soll   in Europa,   in China und Mitsubishi in Südostasien die Führung übernehmen, wie Nissan-Chef Makoto Uchida im Anschluss an ein Treffen in Yokohama vor Journalisten sagte. „Wir alle teilen das Gefühl der Dringlichkeit“, fügte Renault-Präsident Jean-Dominique Senard hinzu. Die überarbeitete Rahmenvereinbarung soll im Mai bekanntgeben werden. Dabei soll an den Überkreuzbeteiligungen der Konzerne nicht gerüttelt werden. Die Dreier-Allianz bröckelt seit dem Rausschmiss von  , der bis dahin alle Fäden in der Hand hielt. Der einst gefeierte Manager war im Herbst 2018 von japanischen Behörden festgesetzt und angeklagt worden. Er steht in   wegen Untreue und finanziellen Fehlverhaltens beim Renault-Partner Nissan unter Anklage. Der 65-Jährige hatte sich kurz vor Silvester unter spektakulären Umständen in den Libanon abgesetzt, wo er aufgewachsen ist. Nissan dringt seit längerem darauf, dass die Franzosen ihre Dominanz in der Allianz verringern. Renault ist mit 43 Prozent Hauptaktionär bei seinem japanischen Partner. Der ist umgekehrt mit 15 Prozent an den Franzosen beteiligt, allerdings ohne Stimmrecht. Nissan ist wiederum mit einem Drittel der Anteile maßgeblich an Mitsubishi beteiligt. Das Übergewicht der Franzosen hat in Japan für Spannungen gesorgt. Renault, an dem der französische Staat beteiligt ist, wurde die Absicht zur Fusion mit Nissan unterstellt, wofür sich Ghosn eingesetzt haben soll. Dieser Streit soll mit ein Grund für dessen abruptes Karriereende sein. Zu dem Friedensschluss dürfte beigetragen haben, dass alle drei Autobauer unter Druck stehen, seit die Rivalen Fiat Chrysler und PSA ihren Zusammenschluss angekündigt haben. Renault, Nissan und Mitsubishi hatten sich zeitweise ein Kopf-an-Kopf-Rennen mit Volkswagen um die Krone als weltgrößter Autobauer geliefert. Vor allem Nissan hatte im vergangenen Jahr aber mehr mit den Folgen der von Ghosn verordneten Expansion zu kämpfen, die auf die Rendite durchschlägt. Insidern zufolge wollen die Japaner deshalb ihren Sparkurs verschärfen. Mehr als 4000 Stellen sollen gestrichen und zwei Werke dichtgemacht werden. „Die Situation ist düster. Es geht um Kopf und Kragen“, hatte eine Person aus dem Umfeld der Geschäftsleitung zu Reuters gesagt. Mehr: Erstmals meldet sich die japanische Regierung in dem spektakulären Fall zu Wort. Die Ministerin weist Ghosns Vorwürfe zurück – sein Anwalt hingegen äußert Verständnis. Renault Nissan Carlos Ghosn Japan",wirtschaftswoche
