title,author,date_published,url,article_text,source
Corona-Impfstoff.  Moderna will Zulassung in EU beantragen ,no_author,30. November 2020,https://www.wiwo.de/unternehmen/dienstleister/corona-impfstoff-moderna-will-zulassung-in-eu-beantragen/26672304.html,"Der US-Pharmakonzern   will als erstes Unternehmen die Zulassung für einen Corona-Impfstoff in der EU beantragen. Der Antrag auf eine bedingte Zulassung solle noch am Montag bei der Europäischen Arzneimittel-Agentur Ema gestellt werden, teilte das Unternehmen am selben Tag mit. Parallel dazu soll eine Notfall-Zulassung bei der US-amerikanischen Arzneimittelbehörde FDA beantragt werden. Mit dem Zulassungsantrag bei der Ema rückt eine Corona-Impfung auch in Deutschland näher. Vergangene Woche hatte EU-Kommissionschefin Ursula von der Leyen mitgeteilt, mit Moderna sei ein Rahmenvertrag über bis zu 160 Millionen Impfstoff-Dosen abgeschlossen worden. Demnach sollen zunächst 80 Millionen Dosen geliefert werden, mit der Option auf 80 Millionen weitere Einheiten. In der EU könnte das Mittel nach Angaben von Moderna bereits im Dezember ausgeliefert werden, sofern es eine Zulassung erhält. Zu dem RNA-Impfstoff von Moderna läuft bei der Ema bereits ein sogenanntes Rolling-Review-Verfahren, das den Zulassungsprozess beschleunigen soll. Dabei können Hersteller schon vor dem kompletten Zulassungsantrag einzelne Teile zu Qualität, Unbedenklichkeit und Wirksamkeit eines Präparats einreichen. Die Aussicht auf einen möglicherweise schon bald einsatzfähigen Impfstoff gegen die Lungenkrankheit Covid-19 hat den deutschen Aktienindex   am Montagnachmittag auf den höchsten Stand seit Anfang September klettern lassen. Der Leitindex rückte um 0,64 Prozent auf 13 422 Punkte vor. Damit ist das Rekordhoch vom Februar bei knapp 13 800 Zählern wieder in Reichweite. Moderna-Aktien schossen vorbörslich um zwölf Prozent nach oben auf ein Rekordhoch. Auch der Mainzer Hersteller   hat zusammen mit dem US-Konzern   ein solches Verfahren laufen. Biontech und Pfizer haben zwar bereits in den   eine Notfall-Zulassung beantragt, in der EU aber noch nicht. Modernas Präparat ist dem Impfstoff von Biontech/Pfizer in der Wirkweise und auch in seiner Wirksamkeit vergleichsweise ähnlich. Bei der bedingten Zulassung („Conditional marketing authorisation“) kann die Ema ein Mittel unter bestimmten Bedingungen auch auf Grundlage weniger umfassender Daten zulassen, wenn das Präparat dringend gebraucht wird. Der Moderna-Impfstoff mRNA-1273 hat eine Wirksamkeit von 94,1 Prozent, wie das Unternehmen mitteilte. Das gehe aus der neuesten Analyse von Daten der klinischen Phase III-Studie hervor, an der 30 000 Menschen in den USA teilnehmen. Eine Hälfte der Teilnehmer bekommt dabei den Impfstoff, die andere Hälfte ein Placebo-Mittel. Für den vollen Impfschutz sind zwei Dosen in zeitlichem Abstand notwendig. Insgesamt wurden unter den Probanden demnach bislang 196 Fälle der Krankheit Covid-19 bestätigt. 11 dieser Fälle entfielen auf die Gruppe mit dem Impfstoff, 185 Fälle auf die Placebogruppe. Daraus errechnet sich eine Wirksamkeit von 94,1 Prozent. Die neuen Ergebnisse entsprechen etwa den vorläufigen Daten, die Moderna Mitte November veröffentlicht hatte. Zudem teilte Moderna mit, dass die insgesamt 30 schweren Covid-19-Verläufe in der Studie ausschließlich die Placebogruppe betrafen. Die Wirksamkeit von mRNA-1273 war laut Moderna über alle Altersgruppen hinweg ähnlich. Das Moderna-Präparat ist wie das von Pfizer und Biontech ein sogenannter RNA-Impfstoff. Es enthält genetische Informationen des Erregers, aus denen der Körper dann ein Viruseiweiß herstellt. Ziel der Impfung ist es, das Immunsystem zur Bildung von Antikörpern anzuregen, um die Viren abzufangen. Noch gibt es keinen zugelassenen Impfstoff dieser Art. Zwar haben schon Länder wie Russland, China und kürzlich erst Bahrain Impfstoffe mit Einschränkungen freigegeben und impfen damit bereits Teile der Bevölkerung. Aber wie gut diese Impfungen tatsächlich schützen und welche Nebenwirkungen sie haben können, ist derzeit weitgehend offen. Moderna Dax Biontech Pfizer USA",wirtschaftswoche
Geschäftsreisen .  Ein Rückgang fast auf Null ,Rüdiger Kiani-Kreß,30. November 2020,https://www.wiwo.de/unternehmen/dienstleister/geschaeftsreisen-ein-rueckgang-fast-auf-null/26672352.html,"Bei seinen jüngsten Quartalszahlen konnte  -Finanzchef Brians Olsavsky der Coronakrise gleich mehrere gute Seiten abgewinnen. Nicht nur dass der Online-Riese deutlich höhere Umsätze schaffte als im Vorjahr. Mehr als eine Milliarde Dollar, freute sich der 55-Jährige, habe der Konzern allein bei einem einzigen Posten sparen können: den Geschäftsreisen. „Die kamen zu seinem harten Stillstand“, so der Kassenwart zu den Folgen des Reisebanns für die rund eine Million Beschäftigten des Konzerns aus Seattle. Ähnliche Gefühle haben derzeit wahrscheinlich viele seiner Kollegen bei anderen Konzernen. Wegen Corona haben weltweit fast alle Unternehmen ihren Beschäftigten mehr oder weniger komplett die Dienstreisen gestrichen. Nach einer Übersicht des IT-Dienstleisters Coupa sind weltweit die Ausgaben für Managertrips im dritten Quartal 2020 im Vergleich zum Vorjahr um 97 Prozent gesunken. „Das ist der größte Rückgang aller Ausgabengruppen“, sagt Jeff Collins, Chefökonom des auf Ausgabenmanagement spezialisierten Unternehmens aus Kalifornien, das zu seinen weltweit vielen Hundert Kunden neben US-Konzernen wie   auch deutsche Unternehmen von   bis   zählt. Damit fiel die Zahl der Dienstreisen deutlich stärker als die der Urlaubsreisen. Hier lag das Minus weltweit nur bei rund zwei Dritteln.   Während die Ausgaben in anderen Feldern wie Logistik oder Büromaterial derzeit wieder anziehen, verharren die Reiseausgaben auf niedrigstem Niveau. Das hat Coupa für die WirtschaftsWoche aus den Daten seiner hundert Kunden errechnet. Zu den wenigen Ländern, wo Manager noch vergleichsweise oft zumindest den Handkoffer packen, zählen China sowie  . Und wer hierzulande noch zu Kunden oder Kollegen aufbricht, kann immerhin mit etwas mehr Komfort rechnen. „Die Unternehmen sind in einigen Bereichen großzügiger als früher“, sagt Christoph Carnier, Chef des Geschäftsreiseverbands VDR und oberster Dienstreisemanager des Technologiekonzerns Merck. Treiber für das Absacken bis fast an die Null-Linie ist vor allem der Rückgang bei der Zahl der Flugtickets, traditionell der größte Posten auf den Spesenabrechnungen. Sie liegen bei rund einem Prozent des Vorkrisenwerts. Kaum besser ist es beiden Hotelrechnungen. Hier zeigt die Coupa-Statistik aktuell einen Buchungsrückgang von 92 Prozent. Dafür sorgt ein leichter Anstieg der Übernachtungsausgaben. Im Vergleich zum zweiten Quartal haben zuletzt rund 40 Prozent mehr Manager ein Zimmer bezogen. Die Zahl der Flugbuchungen blieb hingegen gleich niedrig. Für den Einbruch sorgt vor allem ein strenger Reisebann der meisten Unternehmen. „Es werden nur noch die absolut unverzichtbaren Reisen gebucht“, so Carnier. Dahinter steckt nicht allein Sparsamkeit oder dass allen Unternehmen Videokonferenzen als immer besserer Ersatz zu persönlichen Treffen erscheinen. Auch wenn es vielen Managern gelegentlich anders erscheint: der wichtigste Grund für den Rückgang ist aus Sicht der Reisemanager die Fürsorgepflicht für ihre Kollegen, damit die sich unterwegs nicht anstecken. „Die Sicherheit der reisenden Mitarbeiter genießt eine hohe Priorität, weshalb Firmen auf intransparente Regelungen einzelner Länder und unkalkulierbare Ansteckungsrisiken mit Beschränkungen der Reisetätigkeit reagieren“, so Carnier.  Ebenso schwierig ist inzwischen die Organisation der Reise. Dafür sorgen zum einen die nicht mal innerhalb Deutschlands einheitlichen und ständig wechselnden Vorschriften, wo sich Reisende testen lassen müssen oder oft auch bei einem negativen Ergebnis in Quarantäne müssen. Keine große Hilfe ist auch das inzwischen deutlich geringere Angebot an Flügen und geöffneten Hotels. Weil die Kunden ausgeblieben sind, hat nicht nur die   die Zahl ihrer Flüge um bis zu 85 Prozent gekürzt. Laut einer Übersicht des auf die Luftfahrt spezialisierten Datenanbieters ist die Zahl der regelmäßig angebotenen Verbindungen seit Februar von 649 auf 235 gefallen. Und auf den verbliebenen Routen fliegen die Linien deutlich seltener als zu Jahresbeginn. Deshalb müssen Reisende oft mit so langen Wartezeiten umsteigen, dass für viele Reisende die Trips zu viel Zeit kosten und sie lieber verzichten.  Selbst wenn es Flug oder gute Zugverbindungen gibt, scheitern Reisen am Hotelangebot. Besonders in kleineren Städten haben viele Häuser wegen des Beherbergungsverbots für Privatreisende inzwischen geschlossen, so dass es oft schwer ist eine passende Übernachtungsmöglichkeit zu finden.  Die Einschränkungen treffen nicht alle Teile der Welt gleich. Während in Lateinamerika, Afrika und Teilen Asien der Rückgang fast komplett ist, sind Manager aus Ostasien wieder öfter unterwegs. Innerhalb von China reisen im Vergleich zum Vorjahr gar schon wieder gut 80 Prozent der Manager. Ebenfalls überdurchschnittlich oft verlassen deutsche Manager Büro und Homeoffice. Ihre Reiseausgaben liegen laut einer Übersicht des Geschäftsreiseverbands VDR in Summe bereits wieder bei knapp 20 Prozent des vergangenen Jahres. Im Sommer lagen die Rechnungen für Hotelübernachtungen bereits wieder bei fast 40 Prozent des Vorjahres. Und wegen der laut aktueller Buchungszahlen des Hotelverbands Deutschland (IHA) bis zu 30 Prozent niedrigeren Logispreise hat sich die Zahl der Buchungen sogar noch besser erholt. Die Flugetats liegen dagegen noch kaum über zehn Prozent des Werts aus 2019. Das liegt vor allem daran, dass die Unternehmen Reisen innerhalb Deutschlands eher genehmigen, wo Manager bevorzugt Mietwagen oder Zug fahren, wogegen die meist per Flug absolvierten Auslandstrips sicherheitshalber nur deutlich kürzer sein dürfen oder ganz ausfallen. Wer reisen darf, kann zudem mit etwas mehr Komfort rechnen. So erlauben die Unternehmen öfter als früher, dass Manager für die letzten Kilometer zum Kunden oder nach Hause statt des preiswerteren öffentlichen Nahverkehrs nun Taxis oder Mietwagen nutzen dürfen. Zudem dürfen öfter besser und zentral gelegenere Hotels gebucht werden, weil deren Preise dank der Krise nun wieder unter den von den Firmen festlegten Obergrenzen für eine Übernachtung liegen.  Die Großzügigkeit rührt nicht zuletzt daher, dass das Gros der Firmen trotz Corona relativ gute Geschäfte macht und genug Geld hat. „Die Budgets sind ja noch da und werden wohl bei fast keinem Unternehmen ausgeschöpft“, so Carnier. Dazu, so vermuten in Sachen Budgetpolitik erfahrende Manager, wollen viele Abteilungen auch deshalb etwas großzügiger Geld ausgeben, um bei den gerade laufenden Verhandlungen über die Etats des kommenden Jahres allzu starke Kürzungen zu vermeiden.  Doch auch wenn es weiterhin genug Geld für Geschäftsreisen gibt, bis die Zahl der Buchungen wieder steigt, dürfte es noch eine Weile dauern. Das gilt auch wenn es einen Impfstoff gibt, fürchtet Carnier. „Dazu müssen erst die Reisebeschränkungen fallen und das Angebot an Flügen oder Hotels wieder steigen.“  Auf den alten Wert vor der Krise wird die Zahl der Reisen ohnehin nicht wieder klettern, erwartet selbst der für seinen Optimismus bekannte  -Chef Carsten Spohr: „Ich rechne damit, dass die Zahl der Geschäftsreisenden auf Dauer zwischen zehn und 20 Prozent unter dem Jahr 2019 liegt.   Amazon Amazon Adidas Zalando Deutschland Lufthansa Lufthansa",wirtschaftswoche
Gabelstapler-Hersteller.  Kion will mit Kapitalerhöhung gut 800 Millionen Euro einnehmen ,no_author,30. November 2020,https://www.wiwo.de/unternehmen/industrie/gabelstapler-hersteller-kion-will-mit-kapitalerhoehung-gut-800-millionen-euro-einnehmen/26671186.html,"Der Gabelstapler-Konzern Kion will   mehr als 800 Millionen Euro einnehmen und damit unter anderem den Überbrückungskredit der   tilgen. Der Ausgabepreis für die rund 13,1 Millionen neuen Aktien wurde auf 62 Euro festgelegt, wie Kion am Montag mitteilte. Damit kann das Unternehmen 813 Millionen Euro einsammeln. 368 Millionen Euro davon kommen vom chinesischen Großaktionär Weichai Power, der entsprechend seiner Beteiligung von 45 Prozent neue Aktien zeichnen will. Die Papiere können noch bis Donnerstag (3. Dezember) geordert werden, für je neun Aktien erhalten die Kion-Anteilseigner ein Bezugsrecht. Die ehemalige Linde-Tochter will sich mit dem frischen Geld „für forciertes Wachstum nach der Covid-19-Pandemie vorbereiten“, wie es bei der Ankündigung der Kapitalerhöhung vor knapp zwei Wochen hieß. Dazu gehöre die Expansion in China, die Entwicklung neuer Produkte, die Fokussierung auf Software, um sich von der Konkurrenz abzuheben, erklärte Vorstandschef Gordon Riske. Zunächst aber soll die Verschuldung reduziert werden. Kion hatte in der Corona-Pandemie im Mai einen Überbrückungskredit über eine Milliarde Euro aufgenommen, zu dem die Staatsbank   800 Millionen beisteuerte. Der Kredit soll mit Hilfe der Kapitalerhöhung zurückgezahlt werden. Der Verkauf neuer Aktien drückte am Montag Kion ins Minus. Die Titel des Gabelstapler-Herstellers fielen im Frankfurter Frühhandel um gut vier Prozent auf 67 Euro. Hier geht es zum  . mit seiner Kapitalerhöhung KfW KfW aktuellen Aktienkurs von Kion",wirtschaftswoche
Elektronikhersteller.  Xiaomi verdrängt Apple beim Smartphone-Absatz von Platz drei ,no_author,30. November 2020,https://www.wiwo.de/unternehmen/it/elektronikhersteller-xiaomi-verdraengt-apple-beim-smartphone-absatz-von-platz-drei/26671664.html,"Der chinesische Xiaomi-Konzern hat im dritten Quartal den Marktbeobachtern von Gartner zufolge mehr Smartphones als   verkauft und den iPhone-Hersteller damit vom Podest der drei größten Smartphone-Anbieter verstoßen. Während Xiaomi – vor allem bekannt für seine Mi-Reihe – 44,4 Millionen Geräte verkaufte, kam   auf knapp 40,6 Millionen iPhones im Zeitraum Juli bis September,   Das entspricht einem Marktanteil von 12,1 versus 11,1 Prozent und damit in beiden Fällen mehr als im Vorjahreszeitraum. Trotz eines geringeren Marktanteils residiert   Electronics unangefochten an der Spitze mit rund 80,8 Millionen verkauften Alleskönner-Handys. Damit haben die Südkoreaner einen Marktanteil von 22 Prozent. An zweiter Stelle steht weiterhin  . , aus tausenden Kandidaten die vielversprechendsten Unternehmen gekürt, die das Potenzial haben, ein ernst zunehmender  -Konkurrent zu werden. Unter den möglichen Technologie-Stars von morgen ist auch Xiaomi. Der Erfolg bei den Verkaufszahlen zeigt: Vor allem Asien entwickelt sich zum neuen Zentrum der Techindustrie.  War China bisher vor allem Zulieferer für das Silicon Valley, so entstehen dort jetzt eigene Elektronik-Marken, die ihre Produkte mit neusten Komponenten und künstlicher Intelligenz ausstatten. Neben   konnte nur Xiaomi im dritten Quartal Wachstum verzeichnen. Laut Gartner profitiert das Unternehmen dabei aber auch von den Problemen des Konkurrenten Huaweis – der chinesische Konzern litt unter den schärferen US-Sanktionen. Der leichte Rückgang bei den Absätzen von Apples iPhone ist laut Annette Zimmermann, Research Vice President bei Gartner, auch auf Verzögerungen bei der Auslieferung der neuen iPhone-Generation zurückzuführen. „In diesem Jahr begannen die Eröffnungsveranstaltung und der Auslieferungsbeginn vier Wochen später als üblich“, so Zimmermann.  Nicht nur wegen ihrer größeren OLED-Displays, dem laut Apple bis zu 50 Prozent schnelleren Prozessor als der von Wettbewerben und gefälligem Design. Das Wichtigste an einem Smartphone ist seit vielen Jahren die Güte der Kamera. Und da hat Apple beim iPhone 12 erheblich nachgelegt. Auch bei der sogenannten „computational photography“, also der mit künstlicher Intelligenz unterstützten Fotografie, macht der Konzern Fortschritte. Sie soll laut Apple das herausholen, was ausgewachsene Profikameras derzeit leisten und diese sogar noch übertreffen.  Dafür hat Apple ein neues Standardobjektiv mit einer weit offenen Blende entwickelt, die bis zu 27 Prozent mehr Licht auf den Sensor fallen lässt, der ebenfalls vergrößert wurde. Möglich sind damit bessere Aufnahmen unter schwierigen Lichtverhältnissen, also nachts oder in dunklen Räumen. Dieser Nachtmodus war bislang den teuersten Varianten vorbehalten. Mit dem iPhone 12 ist er in allen Modellen verfügbar, um den Konkurrenten Samsung und   Paroli zu bieten, die ihn ebenfalls in günstigen Modellen offerieren. Weltweit wurden im dritten Quartal, als vielerorts Corona-Auflagen gelockert wurden, erneut weniger Smartphones verkauft. Insgesamt fanden 366 Millionen Geräte einen Käufer und damit 5,7 Prozent weniger als im Vorjahreszeitraum. Das Minus fiel damit deutlich geringer aus als in den beiden Vorquartalen, als die Coronapandemie die Verkäufe um rund ein Fünftel drückte. Wirtschaftliche Unsicherheiten und die anhaltende Furcht vor der nächsten Pandemiewelle üben auch bis Ende 2020 weiterhin Druck auf nicht lebensnotwendige Ausgaben aus.  Dazu kommt, dass die Verzögerung bei der Aufrüstung des 5G-Netzes die Möglichkeiten für Smartphone-Hersteller eingeschränkt hat. Denn 5G ist ein fragmentierter Markt, viel stärker in China vorangeschritten als etwa in Nordamerika und Europa. Auch wenn der Netzausbau in Deutschland schneller läuft als bei der Vorgängergeneration LTE, ist die Erfahrung mit 5G durchwachsen. „Ich höre von enttäuschten Konsumenten, die vereinzelt ihren 5G-Dienst wieder abbestellen, weil sich das Geld dafür nicht lohnt“, sagt etwa Annette Zimmermann.  Von den sogenannten Killer-Apps, die 5G beflügeln sollen, hört sie derzeit auch wenig. Immerhin in einigen Märkten gebe es schon Anzeichen einer Erholung, sagte Gartner-Analyst Anshul Gupta. Dazu gehören Teile des asiatisch-pazifischen Raums und Lateinamerikas. „Nahezu normale Bedingungen in China verbesserten die Smartphone-Produktion, um die Angebotslücke im dritten Quartal zu schließen, was den Verkäufen bis zu einem gewissen Grad zugute kam“, sagte Gupta. Apple Apple wie Gartner am Montag unter Berufung auf eigene Erhebungen bekanntgab. Samsung Huawei Experten der Boston Consulting Group (BCG) haben erst kürzlich in einer Studie, die der WirtschaftsWoche exklusiv vorliegt Apple Samsung Die Absatzrekorde für Apples neues Flaggschiff iPhone 12 werden vermutlich noch kommen. Google",wirtschaftswoche
Ex-Fed-Chefin.  Biden nominiert Yellen als US-Finanzministerin ,no_author,30. November 2020,https://www.wiwo.de/politik/ausland/ex-fed-chefin-biden-nominiert-yellen-als-us-finanzministerin/26673370.html,"Die ehemalige Notenbankchefin Janet Yellen soll als erste Frau die Führung des US-Finanzministeriums übernehmen. Der künftige Präsident Joe Biden will die 74-Jährige zur Schlüsselfigur im Kampf gegen die wirtschaftlichen Folgen der Corona-Pandemie machen. Außerdem dürfte ihr eine zentrale Rolle bei den Verhandlungen mit China nach der Strafzoll-Politik von Donald Trump zufallen. Yellen müsste als Ministerin vom US-Senat bestätigt werden. Erst Anfang Januar wird sich bei zwei Stichwahlen in Georgia entscheiden, ob Bidens   die Mehrheit im Senat bekommen und ihm damit freie Hand bei der Regierungsbildung geben können - oder ob die   die Kontrolle in der Kongresskammer behalten. Yellen stand von 2014 bis 2018 an der Spitze der Federal Reserve. Als ihre Amtszeit ablief, nominierte Präsident Donald Trump sie nicht erneut, sondern entschied sich für Jerome Powell, der die Notenbank aktuell führt. Biden steht vor der großen Herausforderung, nach seinem Amtsantritt am 20. Januar die US-Wirtschaft durch die gerade wieder eskalierende Coronakrise zu bringen. Yellen gilt als eine Anhängerin der Theorien des Ökonomen John Maynard Keynes, nach denen Regierungen eine wichtige Rolle bei der Bewältigung wirtschaftlicher Krisen zukommt. Vor der Wahl hatten sich   und   nicht auf ein zweites Konjunkturpaket für die US-Wirtschaft einigen können - das wäre eine weitere Aufgabe für Yellen. Nach ihrer Nominierung schrieb sie am Montag bei Twitter, man müsse „den amerikanischen Traum wiederherstellen - eine Gesellschaft, in der jeder sein Potenzial erfüllen und von noch mehr für seine Kinder träumen kann“. Bereits am Sonntag hatte Biden sein Kommunikationsteam für das Weiße Haus vorgestellt, das aus erfahrenen Frauen besteht. Die prominente Rolle der Regierungssprecherin geht demnach an Jen Psaki. Psaki war unter dem früheren demokratischen Präsidenten Barack Obama unter anderem Kommunikationsdirektorin des Weißen Hauses und Sprecherin des Außenministeriums gewesen. Seit der Wahl hatte Psaki für Biden bereits mehrere Briefings mit Journalisten geleitet. Dabei trat sie klar und professionell auf. Ihre Stellvertreterin im Weißen Haus soll Karine Jean-Pierre werden, die zuletzt für die gewählte Vizepräsidentin Kamala Harris gearbeitet hatte, wie Biden erklärte. Bidens bisherige stellvertretende Wahlkampfmanagerin Kate Bedingfield soll Kommunikationsdirektorin des Weißen Hauses werden. Damit kommt ihr eine weniger öffentliche Rolle zu, die aber für das Festlegen der gesamten Kommunikationsstrategie der Regierung wichtig ist. Pili Tobar wiederum soll Bedingfields Stellvertreterin werden. Eine Beraterin von Bidens Wahlkampfteam, Symone Sanders, soll Sprecherin der künftigen Vizepräsidentin Harris werden; Ashley Etienne soll für sie als Kommunikationsdirektorin arbeiten. Fast gleichzeitig zu Bidens Personalentscheidungen wurde bekannt, dass sich der 78-Jährige beim Spielen mit einem seiner beiden Schäferhunde den rechten Knöchel verstaucht und sich kleine Stressfrakturen im Fuß zugezogen hat. Es sei daher davon auszugehen, dass Biden „mehrere Wochen lang“ einen stiefelartigen orthopädischen Stützschuh tragen müsse, erklärte der Arzt Kevin O'Connor in einer von Bidens Büro verbreiteten Stellungnahme. Womöglich könnte Biden den Stützschuh auch noch bei seiner geplanten feierlichen Amtseinführung am 20. Januar tragen müssen. Von den „Haarriss-Brüchen“ waren zwei kleine Fußknochen betroffen, sogenannte Keilbeine (Os cuneiforme), wie der Arzt weiter erklärte. Biden hatte am späten Sonntagnachmittag (Ortszeit) einen Orthopäden im Ort Newark im Bundesstaat Delaware aufgesucht. Röntgenaufnahmen hatten zunächst keinen Bruch gezeigt. Die kleinen Brüche wurden dann mit Hilfe eines Kernspintomografen erkannt. Biden hatte sich die Verletzung demnach am Samstag beim Spielen mit seinem Deutschen Schäferhund „Major“ zugezogen. Ein Vertreter von Bidens Büro erklärte, der gewählte Präsident habe die Verletzung am Sonntag untersuchen lassen, damit für Montag geplante Termine nicht in Mitleidenschaft gezogen würden. Der Demokrat und seine Frau Jill haben zwei Schäferhunde, die im Januar mit ihnen ins Weiße Haus einziehen sollen. Die Bidens wollen sich Medienberichten zufolge auch eine Katze zulegen. Biden wurde nach der Wahl vom 3. November von US-Medien zum Sieger erklärt. Er soll am 20. Januar als neuer Präsident vereidigt werden. Der amtierende Präsident Donald Trump (74) weigert sich weiter, Bidens Sieg anzuerkennen. Er spricht seit Wochen von „massivem Wahlbetrug“, hat dafür aber keine belastbaren Beweise vorgelegt. US-Gerichte haben bereits zahlreiche Klagen abgeschmettert, mit denen er und seine republikanischen Verbündeten das Wahlergebnis anfechten wollten. Demokraten Republikaner Republikaner Demokraten",wirtschaftswoche
Milliardendeal.  Bertelsmann erhält Zuschlag für US-Verlag von Stephen King ,no_author,25. November 2020,https://www.wiwo.de/milliardendeal-bertelsmann-erhaelt-zuschlag-fuer-us-verlag-von-stephen-king/26657820.html,"Mit dem Kauf des US-Verlags Simon & Schuster mit Erfolgsautoren wie Stephen King baut der  -Konzern seine Position auf dem internationalen Buchmarkt aus. Die zum Konzern gehörende Publikumsverlagsgruppe Penguin Random House übernimmt den Buchverlag vom Medienunternehmen ViacomCBS für umgerechnet 1,83 Milliarden Euro (2,175 Milliarden US-Dollar), wie der Medien-, Dienstleistungs- und Bildungskonzern am Mittwoch in Gütersloh mitteilte. Das Verlagshaus mit Sitz in New York veröffentlicht neben Stephen King auch Werke unter anderem von Hillary Clinton und John Irving. Bei Simon & Schuster sind weltweit rund 1500 Mitarbeiter tätig, der Umsatz lag den Angaben zufolge im Jahr 2019 bei 814 Millionen US-Dollar (Ende 2019 rund 725,8 Mio Euro). 85 Prozent der Umsätze des Verlags entfallen auf die  . Der Deal steht noch unter dem Vorbehalt von regulatorischen Genehmigungen. Den Abschluss erwartet   im Laufe des nächsten Jahres. Simon & Schuster soll unter das Dach von Penguin Random House schlüpfen, aber dort eine eigene Verlagseinheit bilden. Personelle Änderungen an der Führungsspitze sind nicht geplant. Bertelsmann will den Kaufpreis in bar aus liquiden Finanzmitteln zahlen. Mit dem Kauf stärkt Bertelsmann seine Präsenz in seinem zweitgrößten Markt USA und wichtigstem Auslandsmarkt. Seit Frühjahr ist der Konzern, zu dem unter anderem auch die   und der Zeitschriftenverlag Gruner + Jahr sowie der Dienstleister Arvato zählen, bereits alleiniger Eigentümer von Penguin Random House in New York als größtem Publikumsverlag der Welt. Die Verlagsgeschichte von Bertelsmann reicht bis ins 19. Jahrhundert zurück. Bertelsmann-Chef Thomas Rabe sieht Wachstumschancen im weltweiten Buchmarkt weiterhin in den USA, aber auch in China, Indien und Brasilien. Was die Segmente anbetrifft, gebe es großes Wachstum im Bereich Kinder- und Jugendbücher. Aber auch beim Hörbuch sieht der Konzern Potenziale. Bertelsmann USA Bertelsmann RTL Group",wirtschaftswoche
