title,author,date_published,url,article_text,source
Bilanzbetrug.  FDP nimmt im Fall Wirecard die EZB ins Visier ,Benedikt Becker,06. November 2020,https://www.wiwo.de/politik/deutschland/bilanzbetrug-fdp-nimmt-im-fall-wirecard-die-ezb-ins-visier/26597648.html,"Im Bundestag spielt seit einigen Wochen eine neue Boygroup. Drei Abgeordnete aus der Opposition, von  , Grünen und Linke, haben sich zusammengetan, in kurzer Zeit die politische Verantwortung eines großen Finanzbetrugs aufzuklären: Wie konnte der Zahlungsdienstleister   jahrelang Bilanzen fälschen – ohne dass die Aufsichtsbehörden eingriffen? Welche Rolle spielten dabei das Finanz- und Wirtschaftsministerium? Warum warb die Bundeskanzlerin auf einer China-Reise für den Konzern, obwohl Vorwürfe von Geldwäsche und Unregelmäßigkeit in den Bilanzen längst bekannt waren? Florian Toncar (FDP), Danyal Bayaz (Grüne) und Fabio De Masi (Linke) vertreten ihre Fraktionen im  -Untersuchungsausschuss, der inzwischen seine Arbeit aufgenommen hat und vor Ende der Wahlperiode im kommenden Jahr einen Bericht vorlegen muss. Die drei Oppositionspolitiker wollen durch gute, orchestrierte Zusammenarbeit ein Gegengewicht schaffen zur Mehrheit von Union und   im Ausschuss. Vor der Sitzung an diesem Donnerstag organisierten sie daher etwa ein Pressegespräch mit dem Journalisten Dan McCrum, bevor der als Sachverständiger seine Aussage machte. Denn die Große Koalition hatte sich geweigert, den Reporter der „Financial Times“ zu diesem Zeitpunkt als Zeuge in öffentlicher Sitzung zu befragen. Dabei war er es, der den Bilanzbetrug durch seine Recherchen maßgeblich aufgedeckt hat.   Zur   wird der Untersuchungsausschuss aber auch so – und zwar bereits in den kommenden Wochen. Dann soll der frühere Verteidigungsminister Karl-Theodor zu Guttenberg (CSU) aussagen,  . Auch die Geheimdienstkontakte des untergetauchten Ex-Wirecard-Vorstands Jan Marsalek sollen aufgearbeitet werden. „Ich fürchte, wir sehen gerade erst die Spitze des Eisberges“, sagt Grünen-Politiker Bayaz. Inzwischen werden auch immer mehr Details über die Abläufe innerhalb der Finanzaufsicht BaFin bekannt. Es erinnert ein wenig an das Häuten einer Zwiebel, bei der man langsam Schicht für Schicht abnimmt. Denn nicht nur die Boygroup im Untersuchungsausschuss ist in diesem Wahljahr hochmotiviert, auch andere Finanzpolitiker der Opposition lassen nicht locker, die Bundesregierung mit Anfragen zu Wirecard zu beschäftigen – so auch Markus Herbrand,  -Obmann im Finanzausschuss. Herbrand hat dabei vor allem die   ins Auge gefasst. Es geht um eine Art Ablenkungsmanöver, bei dem die   eine entscheidende Rolle spielte. Hintergrund: Die BaFin sah in der Wirecard AG stets eine Technologiefirma, stufte nur den Tochterkonzern Wirecard Bank als Bank ein. 2017 jedoch sollen die Finanzaufseher mit Wirecard darüber diskutiert haben, mehrere Tochtergesellschaften in einer Finanzholding zu bündeln. Das hätte Aufsichtsmöglichkeiten der BaFin für mehr Teile des Wirecard-Konzerngeflechts bedeutet. Doch daraus wurde nichts.   Stattdessen gab die Wirecard AG bekannt, ihre Bank-Tochter direkt an den Mutterkonzern angliedern zu wollen, und löste damit bei der BaFin ein sogenanntes Inhaberkontrollverfahren aus. Denn bei solchen Umstrukturierungen prüft die Aufsicht unter anderem, ob der neue Eigentümer als zuverlässig gilt. Das soll den Gläubigerschutz stärken. Die BaFin prüfte das Vorhaben und leitete es mit positivem Bescheid an die EZB weiter, die sich, wie sie später betonte, schlicht dem Urteil der BaFin anschloss. Wirecard hingegen setzte das Vorhaben innerhalb der gesetzten Frist nicht um. Um all diese Fragen ging es bereits, als BaFin Präsident Felix Hufeld im Juli vor dem Finanzausschuss des Bundestags aussagte. FDP-Politiker Herbrand jedoch wollte von der EZB mehr Details erfahren, warum genau sie im Rahmen des Inhaberkontrollverfahrens keinerlei Auffälligkeiten entdeckte. Er schickte seine Fragen nach Frankfurt – und bekam nur nichtssagende Antworten zurück. Also versuchte er sein Glück mit einer Anfrage bei der Bundesregierung. Nun sieht er sich mit Kenntnis der Antworten in seinem Verdacht bestätigt, dass sich die Aufseher von den Wirecard-Chefs mit einem Ablenkungsmanöver täuschen ließen. Demnach sei „die angezeigte Reorganisation nach Einschätzung der BaFin auf die Vermeidung der ansonsten bestehenden Konsolidierungspflicht gerichtet“ gewesen, wie es in dem Schreiben aus dem Finanzministerium heißt. „Die EZB ist den Verschleierungstaktiken des Wirecard-Konzerns ebenso auf den Leim gegangen wie die deutschen Aufseher“, kritisiert Herbrand. Offensichtlich habe auch die EZB nicht mit der „enormen kriminellen Energie“ des Wirecard-Konzerns gerechnet. „Man kommt nicht umhin, die wertlosen Prüfergebnisse von EZB und BaFin als eine schallende Ohrfeige für den Gläubigerschutz zu betrachten.“ Die Zentralbank widerspricht den Vorwürfen des FDP-Politikers. „Die EZB ist und war zu keiner Zeit für die direkte Aufsicht der Wirecard AG zuständig und hat die Bank nie geprüft“, sagte eine Sprecherin. Die EZB sei im Zusammenhang mit Wirecard nur bei jenem Inhaberkontrollverfahren involviert gewesen, „bei dem die EZB im Januar 2019 einer internen Reorganisation der Wirecard Gruppe zustimmte, die letzten Endes aber nie stattfand“, so die Sprecherin weiter.  FDP Wirecard Wirecard SPD politischen Showbühne der im Kanzleramt für Wirecard lobbyierte FDP Europäische Zentralbank (EZB) EZB",wirtschaftswoche
Außenhandel.  Altmaier will Handelskonflikte entschärfen – Neue Strafzölle gegen USA möglich ,no_author,07. November 2020,https://www.wiwo.de/politik/ausland/aussenhandel-altmaier-will-handelskonflikte-entschaerfen-neue-strafzoelle-gegen-usa-moeglich/26600880.html,"Bundeswirtschaftsminister   will die Handelsstreitigkeiten mit den   und China nach Möglichkeit entschärfen. „Die Aufgabe Europas ist es daher, geeint für offene Märkte und gleiche Spielregeln einzutreten“, sagte der  -Politiker am Samstag der Nachrichtenagentur Reuters. „Gleichzeitig müssen wir unsere europäischen Volkswirtschaften so aufstellen, dass wir im Wettstreit der größten Volkswirtschaften wettbewerbsfähig bleiben.“ Am Montag beraten unter deutscher Leitung die EU-Handelsminister per Videokonferenz. „Protektionistische Tendenzen und Handelskonflikte haben in den letzten Jahren in der internationalen Handelspolitik leider zugenommen“, so Altmaier. „Die aktuelle Coronakrise macht aber deutlich, dass wir offene Märkte und funktionierende Lieferketten brauchen.“ In der deutschen Wirtschaft besteht die Hoffnung, dass die politischen Verhandlungen mit den Vereinigten Staaten bald wieder zu Ergebnissen führen, sollte US-Präsident   abgewählt werden. Nach der Wahl am Dienstag steht zwar immer noch kein Ergebnis fest, Trumps Herausforderer   von den Demokraten liegt aber in mehreren Schlüsselstaaten vorne und ist selbst auch bereits siegessicher. Ob sich die US-Handelspolitik unter Biden ändern würde, ist allerdings offen. Denn momentan rüstet auch die EU nicht ab. Diplomaten zufolge könnte sie im jahrelangen Streit um staatliche Beihilfen für die Flugzeugbauer Boeing und Airbus die nächste Runde einläuten – mit Strafzöllen auf US-Waren im Volumen von vier Milliarden Dollar. Der Schritt wird womöglich schon bei den Beratungen der EU-Handelsminister verkündet. Zudem warnen einige Experten vor einer zunehmenden Abhängigkeit der deutschen Industrie von China, weil die Volksrepublik vergleichsweise gut durch die Coronavirus-Krise kommt und der Handel mit dem Riesenreich deswegen rund läuft. Altmaier hatte deutsche Firmen zuletzt aufgerufen, sich in Asien auch nach Alternativen umzuschauen. Die politischen Verhandlungen über ein Investitionsschutzabkommen gehen unterdessen kaum voran. Deutsche Politiker beklagen, dass China seine Märkte zu wenig zu öffnen bereit ist.  Peter Altmaier USA CDU Donald Trump Joe Biden",wirtschaftswoche
"Nikkei, Topix und Co.  Bidens Sieg versetzt asiatische Anleger in Kauflaune ",no_author,09. November 2020,https://www.wiwo.de/finanzen/boerse/nikkei-topix-und-co-bidens-sieg-versetzt-asiatische-anleger-in-kauflaune/26603828.html,"In Erwartung weniger regulatorischer Änderungen aber weiterer fiskalischen Anreize unter dem zukünftigen US-Präsidenten   sind die asiatischen Anleger in Kauflaune. „Während Trump gegen Biden viel Aufmerksamkeit geschenkt wurde, haben die Märkte stark auf den – wahrscheinlich – gespaltenen Kongress reagiert, was mehr Vertrauen bedeutet, dass die Zinssätze länger niedriger sein werden“, sagte Dave Wang, Portfoliomanager bei Nuveen Capital in Singapur am Montag. Der 225 Werte umfassende Nikkei-Index lag im Verlauf 2,6 Prozent höher bei 24.959 Punkten. Der breiter gefasste Topix-Index stieg um 1,4 Prozent und lag bei 1682 Punkten. Die Börse in Shanghai lag 1,9 Prozent im Plus. Der Index der wichtigsten Unternehmen in Shanghai und Shenzen legte in der Hoffnung auf bessere Handelsbeziehungen zwischen China und den   unter Biden um 2,2 Prozent zu. Der MSCI-Index für asiatische Aktien außerhalb Japans stieg um 0,8 Prozent. Im asiatischen Devisenhandel gewann der Dollar 0,1 Prozent auf 103,41 Yen und gab 0,5 Prozent auf 6,5760 Yuan nach. Zur Schweizer Währung notierte er 0,2 Prozent niedriger bei 0,8988 Franken. Parallel dazu stieg der Euro um 0,2 Prozent auf 1,1893 Dollar und zog um 0,1 Prozent auf 1,0694 Franken an. Das Pfund Sterling gewann 0,2 Prozent auf 1,3184 Dollar. Joe Biden USA",wirtschaftswoche
Coronakrise.  Toyota will Gewinnprognose mehr als verdoppeln ,no_author,06. November 2020,https://www.wiwo.de/unternehmen/industrie/coronakrise-toyota-will-gewinnprognose-mehr-als-verdoppeln/26597066.html,"Toyota profitiert einem Medienbericht zufolge von einer Erholung der Fahrzeugmärkte in China und in den USA. Der größte japanische Autobauer wolle deswegen bei der Vorlage der Quartalszahlen am Freitag seine Gewinnprognose für das bis Ende März laufende Geschäftsjahr mehr als verdoppeln, berichtet die Zeitung „Mainichi“. Er werde nun wohl ein Betriebsergebnis von über einer Billion Yen (rund 8,2 Milliarden Euro) anpeilen. Wegen des globalen Absatzeinbruchs in der Branche in der Coronakrise hatte   im August lediglich einen operativen Gewinn von 500 Milliarden Yen prognostiziert und damit das schwächste Ergebnis seit neun Jahren. Allerdings liegt auch die neue Prognose noch deutlich unter dem Gewinn des vorherigen Geschäftsjahres, als es rund 2,5 Billionen Yen waren. Analysten rechnen diesmal im Schnitt mit einem operativen Gewinn von 1,25 Billionen Yen. Toyota wollte sich nicht zu dem Bericht äußern. :  Toyota Der Autoabsatz in China ist im Oktober vorläufigen Berechnungen zufolge deutlich gestiegen. Im September war der Absatz aber noch höher ausgefallen.",wirtschaftswoche
 Rückenwind aus USA hilft der Börse gegen das Corona-Tief ,no_author,06. November 2020,https://www.wiwo.de/finanzen/boerse/riedls-dax-radar-rueckenwind-aus-usa-hilft-der-boerse-gegen-das-corona-tief-/26597670.html,"Bei der Vorwegnahme wichtiger Ereignisse ist die Börse meist ein erstaunlich treffsicherer Indikator. Mit der robusten Entwicklung, die Dow Jones, S&P und Nasdaq in den vergangenen Tagen genommen haben, setzt die Börse ziemlich eindeutig auf einen Sieg Joe Bidens bei den amerikanischen Präsidentschaftswahlen. Dollar und Gold laufen entsprechend: Sieht es für Biden gut aus, ziehen Aktien und Gold kurzfristig an, der Dollar gibt nach. Kommen Zweifel am Sieg des   auf, gehen Aktien und Edelmetalle in die Knie, der Dollar erholt sich.  Dass die Börse nun doch so offensichtlich für Joe Biden votiert, mag überraschen. Dabei geht es zuallererst weniger um mögliche Differenzen in der Programmatik, sondern um Sicherheit und klare Verhältnisse – und da ist Donald Trump mit seinen medialen Hakenschlägen für die Börse mittlerweile in rotes Tuch. Natürlich sind die Märkte in den vergangenen vier Jahren mit einem Präsidenten Trump gut gefahren. Dennoch sieht es im Augenblick (am Freitag, 6. November, vormittags) eher danach aus, dass es zu einem Kursrutsch käme, wenn Trump doch noch das Rennen machen würde.  Beim wirtschaftlichen und politischen Programm unterscheiden sich   und   oft nur in Nuancen. Natürlich gibt es die typischen Profiteure: Rüstungsaktien wie   Martin,   Grumman oder   liefen unter Trump besonders gut. Doch auch unter den Demokraten wird die Rivalität mit China weitergehen. Langfristige Rüstungsausgaben wie der Bau des Kampfflugzeugs F 35, das teuerste Rüstungsprojekt aller Zeiten, werden von den Demokraten genauso getragen wie von den  . In der Gesundheitspolitik dürften die Demokraten zwar mehr für die allgemeine Absicherung des einzelnen in die Wege leiten. Für Börsenunternehmen wie  ,   oder die deutsche   KGaA wichtiger ist aber die Frage, auf welche Weise teure Medikationen gedeckelt werden können. Das Thema werden sich beide Parteien vorknöpfen.  Zwei Aktienbereiche allerdings gibt es, bei denen sich Unterschiede herauskristallisieren: Die führenden High-Tech-Unternehmen, von   bis  , von   bis Twitter, stehen überwiegend im demokratischen Lager. Das zeigt sich besonders gut an der starken Entwicklung an der Nasdaq-Börse, immer dann, wenn Biden bei der Stimmauszählung einen Lauf hat. Zum zweiten betrifft es die Unternehmen für Solar, Windkraft und neue Energien. Die profitieren ganz besonders von der Hoffnung, dass ein Präsident Biden sich wieder den internationalen Klimaschutzbemühungen anschließen dürfte – wenn er hier nicht sogar eine führende Rolle übernehmen will.  Praktisch keine Differenzen spürbar sind bei einem für die Börsen besonders wichtigen Thema, der Notenbankpolitik. An der extrem großzügigen Geldversorgung dürfte sich weder in einer zweiten Amtszeit Trumps noch unter Biden etwas ändern. An den Anleihemärkten ist die Entwicklung deshalb auch vergleichsweise ruhig, die Renditen für zehnjährige US-Bonds pendeln seit zwei Monaten zwischen 0,7 und 0,9 Prozent.  Die Börse setzt natürlich auch auf Biden, weil sie sich dann endlich die Entscheidung über neue, umfangreiche Konjunkturhilfen erhofft. Auch wenn weitere Hilfen unter Trump ebenso möglich wären, dürften die Demokraten dabei weniger auf Steuererleichterungen setzen. Das weckt dann nicht nur indirekt wieder Zinshoffnungen, das setzt vor allem auch den Dollar unter Druck. Deshalb hat sich seit einigen Tagen der Euro vom Tief bei 1,16 auf über 1,18 Dollar erholt. Ein weiterer Anstieg, über das jüngste Hoch bei 1,20 hinaus, ist bei einem Sieg Bidens durchaus möglich.  Das Ringen um die US-Politik überlagert hierzulande sogar das Dauerthema Corona. Durch die Verschärfung der Pandemie und die neuen Lockdown-Maßnahmen ist   binnen zwei Wochen von 13.000 auf 11.500 Punkte abgestürzt; durch Rückenwind aus den   hat er innerhalb nur einer Woche wieder 1000 Punkte gutgemacht. Ein Vorteil waren auch gute Zahlen wichtiger Unternehmen – so zeigen etwa die jüngsten Ergebnisse von  , wie flott die gebeutelte Autoindustrie wieder in Fahrt gekommen ist. Der jüngste Lockdown ist in solchen Zahlen natürlich noch nicht enthalten. Indikationen, die nach vorne weisen, wie etwa vom   veröffentlichte Erwartungen und Hochrechnungen, sehen deshalb deutlich trüber aus und sprechen für ein Abknicken der wirtschaftlichen Erholung.  Wie diese widerstreitenden Kräfte den Dax im Griff haben, lässt sich direkt an der Entwicklung der Einzelwerte ablesen. Neuling  , der typische Coronagewinner, ist die einzige Aktie im Dax, die derzeit auf ein neues Hoch vorgedrungen ist. Aus analytischer Sicht ist das Verlustunternehmen zwar völlig überteuert. Doch smarte Geschäftsmodelle und Marktanteile um jeden Preis zählen in dieser New Economy mehr als Ebit-Margen oder Eigenkapitalquoten. Der Aufwärtstrend von Delivery ist von enormer Stärke geprägt, ein baldiger Abbruch ist nicht in Sicht.  Eine Hilfe für den Dax ist die substanzielle Erholung von zwei Schwergewichten.   wird im operativen Geschäft weniger von Corona getroffen als befürchtet. Dabei hilft auch die führende Stellung, die der Industriegasekonzern mittlerweile auf den asiatischen Märkten hat. Corona spielt hier eine wesentlich geringere Rolle als in Europa. Die Aktie dürfte vorerst im Bereich 185 bis 215 Euro konsolidieren. Langfristig ist ein Anstieg darüber hinaus wahrscheinlicher als ein Ende des großen Trends.  Besser als erwartet schlägt sich auch die  . Die Belastungen durch Corona dürften im zweiten Halbjahr wesentlich geringer ausfallen als in der ersten Hälfte des Jahres. Wie andere große Versicherer auch, etwa die französische  , haben die Assekuranzen vor allem beim Thema Ausfallversicherungen und Stornierungen mittlerweile gelernt, mit Corona zu leben. Nach dem jüngsten Absturz konnten Allianz-Aktien wieder deutlich zulegen. Mittelfristig stehen die Chancen gut, dass zwischen 150 und 180 Euro die Stabilisierung gelingt und Allianz dann im nächsten Jahr wieder deutlich über 200 Euro hinauskommt.  : Ein Sieg Joe Bidens und eine Erleichterungsrally in den USA wären für den Dax eine wichtige Hilfe beim Kampf gegen Corona. Der zweite Grund für stabilere Kurse ist die Entwicklung in den Unternehmen, die eben nicht mehr so hilflos dem Virus gegenüberstehen wie im Frühjahr. Der Dax hat zuletzt nicht nur bei 11.500 Punkten seine überfällige Erholung eingeleitet; er hat sogar den Rutsch unter die 200-Tagelinie (bei 12.070 Punkten) wieder ausgeglichen.  Wenn jetzt keine unerwartete Überraschung aus Amerika kommt, sollte der Dax weiterhin das Niveau um 12.000 Punkte verteidigen können. Dann wäre sogar etwas möglich, an das Anleger in dem ganzen Rummel um Corona und Trump derzeit kaum noch denken – eine gesegnete Jahresendrally.  Demokraten Demokraten Republikaner Lockheed Northrop Raytheon Republikanern Pfizer Novartis Merck Apple Amazon Facebook der Dax USA BMW Ifo-Institut Delivery Hero Linde Allianz Axa",wirtschaftswoche
US-Präsidentschaftswahl.  „Die USA bleiben in ihrer inneren Blockade gefangen“ ,Max Haerder,05. November 2020,https://www.wiwo.de/politik/ausland/us-praesidentschaftswahl-die-usa-bleiben-in-ihrer-inneren-blockade-gefangen/26594482.html,"Die Wahl ist zu allererst ein sehr eindrücklicher Beleg für die tiefe Spaltung der Vereinigten Staaten. Diese Spaltung existierte schon vor Donald Trump, aber er hat sie noch einmal nach Kräften vertieft. Ich halte einen Sieg von Joe Biden zwar für sehr wahrscheinlich, aber es ist alles andere als ein Triumph. Leider waren in den vergangenen Jahren viel zu viele Hobby-Freuds unterwegs, die sich lieber mit der Psyche des Präsidenten auseinandergesetzt haben als mit den Motiven seiner Unterstützer. Donald Trump hat eine bemerkenswerte Koalition geschmiedet. Sie besteht eben nicht nur aus älteren weißen Männern aus der Provinz mit eher unterdurchschnittlicher Bildung. Dazu gehören auch Latinos, Afroamerikaner, eine prosperierende Mittelschicht. …und damit hat er durchaus recht, ob uns das passt oder nicht. Vergessen wir nicht, dass sein härtestes Argument im Wahlkampf in Richtung Biden folgendes war: Mich gibt es nur, weil es vorher Dich und Obama gab. Diesen Satz müssen die   lernen ernst zu nehmen. Auch viele ihrer Anhänger fühlen sich zurückgesetzt, nicht gehört von den Eliten an den Küsten. Dieses Gefühl verschwindet nicht. Die Trump-Koalition ist auch noch da, wenn Donald Trump nicht mehr im Weißen Haus sitzt. Die Vereinigten Staaten werden mit sich sehr beschäftigt sein. Sie fallen daher als internationale Ordnungsmacht in vielen Bereichen aus. Donald Trump will diese Rolle gar nicht übernehmen und Joe Biden wird es nicht in dem Maße können, wie er vielleicht wollte. Denn er ist – wie schon Obama - mit einer Mehrheit der   im Senat konfrontiert, die ganz wesentlich die radikale Trump-Koalition repräsentiert. Weil ihm, selbst im Falle eines hart errungenen Sieges, die Senatsmehrheit fehlt. Die Amerikaner haben ihn nicht mit dem „landslide victory“ ausgestattet, den er benötigt hätte, um sowohl die Legitimation als auch die Mehrheiten zum Durchregieren zu haben. Deshalb: Auch er wird auf den Umweg der Executive Orders angewiesen sein. Den großen Green New Deal beispielsweise wird es also nicht geben. Die USA bleiben in innerer Blockade gefangen. Auch wenn sie als Ordnungsmacht ausfallen: Biden weiß um den Wert von internationalen Allianzen. Und er wird sie wieder stärken. Auch die USA brauchen Partner – gerade diese Fähigkeit zu Partnerschaften ist schließlich immer ihr großer Machtverstärker gewesen. Genau das ist es ja, was Staaten wie Russland und China nicht vermögen: Allianzen schmieden. Und er wird alles dafür tun, internationale Institutionen zu erhalten und die Erosion anzuhalten, den es unter Trump massiv gab. Das ist für uns Europäer eine große Chance zur Zusammenarbeit. Dass Themen, die Politikern wichtig sind, nicht zwingend jene sind, die auch die Bürger umtreiben. Die US-Wähler haben sich nachweislich der Nachwahl-Umfragen nur unter ferner liefen für Corona interessiert, viel mehr für die Wirtschaft und Law & Order. Auch Bidens Steuererhöhungspläne kamen nicht an. Die Progressiven, auch deutsche Sozialdemokraten, sollten erkennen, dass Bill Clintons Erklärung immer noch stimmt: „It’s the economy, stupid!“ Die materiellen und sozialen Interessen der Mehrheit zu vertreten ist die Voraussetzung, damit gesellschaftliche Einzelthemen – um es nicht Minderheitenthemen zu nennen – auch breite Zustimmung erhalten. Die Summe einer Politik für Einzelthemen und Minderheiten ergibt noch keine Mehrheiten. Demokraten Republikaner",wirtschaftswoche
