title,author,date_published,url,article_text,source
US-Wahlen.  So abenteuerlich begründen Trumps Anwälte dessen Wahlniederlage ,no_author,20. November 2020,https://www.wiwo.de/politik/ausland/us-wahlen-so-abenteuerlich-begruenden-trumps-anwaelte-dessen-wahlniederlage/26642862.html,"Die Anwälte von   tauchen in ihren Attacken gegen den Ausgang der verlorenen Präsidentenwahl immer tiefer in Verschwörungstheorien ab: Sie behaupten unter anderem, die Demokraten hätten die Wahl mit Hilfe von Kommunisten aus Venezuela manipuliert. Außerdem beharren sie auf den mehrfach widerlegten Vorwürfen, bei der Auszählung verwendete Software habe Stimmen für Präsident Trump zugunsten seines siegreichen Herausforderers Joe Biden umgewandelt. Zugleich verlor die Trump-Seite allein am Donnerstag in Verfahren vor Gerichten in den Bundesstaaten Georgia, Pennsylvania und Arizona. Bisher sammelte die Trump-Seite mehr als 30 Schlappen vor Gericht ein, mit einem kleinen Erfolg. Trumps langjähriger Anwalt und Vertrauter Rudy Giuliani, stellte weitere Klagen in Aussicht.  nannte Trumps Blockadehaltung „völlig unverantwortlich“. Seine Weigerung, das Ergebnis der Wahl vom 3. November anzuerkennen, schade dem Ansehen der Demokratie. Mit Blick auf Trumps Bemühungen, das Wahlergebnis zu untergraben, sagte Biden, dieser komme als der „unverantwortlichste Präsident“ Amerikas in die Geschichtsbücher. Trumps Anwaltsteam erklärte bei einer Pressekonferenz am Donnerstag zugleich, man könne Journalisten angesichts anstehender Verfahren keine Beweise für die Behauptungen präsentieren. Außerdem wollten wichtige Zeugen nicht vor die breite Öffentlichkeit treten. Das hinderte Giuliani nicht daran, zu sagen: „Wir können nicht zulassen, dass diese Gauner die Wahl von den Amerikanern stehlen. Sie haben Donald Trump gewählt. Sie haben nicht Joe Biden gewählt.“ Alle Wahlbehörden bestätigten bisher, dass es keine Wahlfälschung gab – oder größere Fehler, die das Wahlergebnis in Frage stellen könnten. Giuliani behauptete dennoch, er könne beweisen, dass Trump den wichtigen Bundesstaat Pennsylvania in Wirklichkeit nicht verloren, sondern mit einem Vorsprung von 300.000 Stimmen gewonnen habe, und Michigan mit 50.000 Stimmen. Unter anderem seien Stimmzettel mehrfach eingescannt worden. Giulianis Erklärung: „Ich denke, es ist eine logische Schlussfolgerung, dass es einen gemeinsamen Plan gab, der direkt von der Demokratischen Parten und ihrem Kandidaten ausging.“ Auch dazu gab es keine Beweise. Giuliani war einst selbst Staatsanwalt und später Bürgermeister von New York. Anwältin Sidney Powell ging noch weiter: „Womit wir es hier wirklich zu tun haben, ist ein massiver Einfluss kommunistischen Geldes über Venezuela, Kuba und vermutlich China für die Einmischung in unsere Wahl.“ Sie behauptete auch, der 2013 verstorbene venezolanische Präsident Hugo Chavez habe Hintertüren in die Software einbauen lassen, die bei der Auszählung der Stimmen verwendet wurde. Angeblich sei es dadurch möglich gewesen, dass eine für Biden abgegebene Stimme 1,25 Stimmen wert gewesen sei. Die Software wurde nur beim Einscannen von Stimmzetteln verwendet. Die Wahlbehörden betonen, dass es für jede abgegebene Stimme einen Papierbeleg gebe. Der von Trump jüngst gefeuerte Christopher Krebs, der als ranghoher Regierungsbeamter für die Absicherung der Wahlen zuständig war, bezeichnete die Pressekonferenz bei Twitter als „die gefährlichsten 1:45 Stunden TV in der Geschichte Amerikas“. „Und vermutlich die verrücktesten“, fügte er hinzu. Die Ergebnisse in einzelnen Bundesstaaten sind der Schlüssel zum Sieg bei einer Präsidentenwahl. Das Staatsoberhaupt wird nicht vom Volk direkt gewählt, sondern von Wahlleuten, die ihre Stimmen gemäß den Ergebnissen in ihrem Bundesstaat abgeben. Der Demokrat Biden hat nach Berechnungen von US-Medien 306 Wahlleute hinter sich, für die Wahl zum Präsidenten benötigt er 270. Trump kommt auf 232 Wahlleute. Pennsylvania ist ein besonders wertvoller Bundesstaat mit 20 Wahlleuten, Georgia bringt 16 Stimmen und Wisconsin zehn. In Pennsylvania fordert die Trump-Seite unter der Regie seines langjährigen persönlichen Anwalts und Vertrauten Rudy Giuliani in einer schon zum zweiten Mal überarbeiteten Klage, das Wahlergebnis in dem Bundesstaat komplett nicht zu bestätigen. Stattdessen solle das örtliche Parlament – in dem   die Mehrheit haben – die Wahlleute ernennen. Das Ziel: Diese ernannten Wahlleute sollen am 14. Dezember nicht für den Wahlsieger Biden, sondern für Trump stimmen. In Michigan hat Trump einen ähnlichen Plan. Er lud republikanische Mitglieder des Parlaments des Bundesstaates zu sich ins Weiße Haus ein. Der Rechtsexperte Lawrence Tribe warnte im TV-Sender CNN, dass ein solches Treffen widerrechtlich sein könnte. Abgeschlossen ist inzwischen die manuelle Überprüfung der Stimmen in Georgia. Dort lag Biden vor Beginn der Neuauszählung mit rund 14.000 Stimmen vorn. Nun schrumpfte das Plus auf 12.284 Stimmen. Das war bereits erwartet worden: Schon vor einigen Tagen wurde festgestellt, dass Wahlkommissionen in zwei von   beherrschten Bezirken vergessen hatten, mehrere tausend ausgezählte Stimmen in die Rechnung aufzunehmen. Der zuständige Staatssekretär Brad Raffensperger betonte, dass keine Anzeichen für Wahlbetrug gefunden worden seien. Trump kann allerdings immer noch eine Neuauszählung beantragen, weil der Abstand zwischen den Kandidaten unter 0,5 Prozentpunkten liegt. Donald Trump Biden Republikaner Republikanern",wirtschaftswoche
Nach den US-Wahlen.  „Auch unter Joe Biden bleibt es für Huawei schwierig“ ,Nele Husmann,19. November 2020,https://www.wiwo.de/unternehmen/it/nach-den-us-wahlen-auch-unter-joe-biden-bleibt-es-fuer-huawei-schwierig/26635576.html,"Roger Entner: Der Ton in Amerika wird sich ändern, nicht aber die Grundlagen des Streits. Auch unter der Präsidentschaft von Joe Biden bleibt es für Huawei schwierig. Man ist sich in den   parteiübergreifend einig, dass der chinesische Staat die chinesischen Unternehmen kontrolliert. Es ist ein beängstigendes Gedankenspiel, dass plötzlich alle technischen Herzschrittmacher in Amerika oder in Deutschland nicht mehr funktionieren könnten. Die Vorstellung wird viel bedrohlicher, wenn man sich vorstellt, dass die Telekommunikationsnetzwerke von solch einem Angriff betroffen wären, ohne die das moderne Leben nicht möglich ist.  Mit der Einführung von 5G gibt man die Kontrolle ein Stück weiter ab, weil die Vernetzung zwischen Anbieter und Lieferant enger wird. Gab es bei 4G jedes halbe Jahr oder jedes Jahr ein Update, werden die 5G-Netze wöchentlich in Echtzeit optimiert, so ähnlich wie ein iPhone. Keine Regulierungsbehörde kann diese Updates rund um die Uhr kontrollieren – insbesondere, wenn ein Problem oder Hintertürchen nur eine Woche lang auftauchen könnte, um dann wieder zu verschwinden. Es ist extrem schwierig, zwischen schlampigem Programmieren und böswillig eingebauten Hintertüren zu unterscheiden. 5G ist schlichtweg Vertrauenssache. China hat sich das Vertrauen verspielt: Die Konzentrationslager in Xianjiang, die Unterdrückung der Demokratie in Hongkong, das expansive Inselbauen im Südchinesische Meer. Dass Kanadier ohne Grund inhaftiert werden. Huawei ist als Spielball zwischen die Politik geraten und wird zwischen den Fronten aufgerieben. In Sachen Chips hat Trump ja mit dem Säbel gerasselt und dann doch weiter nach China verkauft.   hat bereits eine Ausnahmegenehmigung erhalten, so dass sie weiter an Huawei verkaufen dürfen. Der entsprechende Antrag von   wird aktuell bearbeitet. Die Chipwirtschaft spielt eine zu entscheidende Rolle für die US-Wirtschaft, als dass die Regierung Verkäufe ernsthaft unterbinden könnte. Rund ein Viertel aller US-Chips werden nach China verkauft. Das entspricht 30 Milliarden Dollar von einem Gesamtumsatz von 132 Milliarden Dollar. Die Kurse an der Börse würden entsprechend einbrechen.  Bei   und ihrem Android-Betriebssystem hat die Trump-Regierung wirklich Zähne gezeigt. Ohne das amerikanische Betriebssystem und Googles App-Store ist der Verkauf von Huawei-Smartphones außerhalb von China völlig zusammengebrochen. Innerhalb Chinas hatte es keinen Einfluss, da Googles Dienste dort ohnehin verboten sind. Huawei beteuert ja immer, kein Staatsbetrieb zu sein, aber Honor wird an einen Staatsbetrieb in Shenzen, wo Huawei beheimatet ist, verkauft. Das liegt ja alles nicht so weit auseinander. Die Lieferbeschränkungen setzten Huawei sicherlich unter Druck. Huawei wird das überleben – aber wohl als Unternehmen, das einen viel schärferen Fokus auf China legt, einen Markt mit 1,4 Milliarden Kunden, wo sie Marktführer sind und bleiben. Europa fällt weg mit einem Drittel der Kunden. Die Entwicklungs- und Schwellenländer müssen wiederaufgebaut werden – aber anstatt mit Android mit Huaweis Harmony OS und Applikationen, die Google,   und andere ersetzen. Mit viel Arbeit und niedrigen Kosten kann das alles sogar eine große Chance für Huawei und andere chinesische Softwareanbieter wie WeChat werden. Denn so sind sie viel unabhängiger. China steht das Wasser bis am Hals – die wollen eigene Chips herstellen können. China hat sein Projekt „Made in China 2025“ noch mehr beschleunigt, das die Technologie-Unabhängigkeit vom Westen herbeiführen soll. Ohne den  -Chip X86 gibt es keine PCs. Aktuell können nur drei Unternehmen weltweit ihn herstellen – Intel,   und die taiwanesische VIA. Noch deutlicher sind  -Chips betroffen, die in allen führenden Smartphones verbaut sind. Noch gehört das in Großbritannien ansässige ARM zum japanischen  -Konzern, aber die wollen das Unternehmen an den US-Chipkonzern NVIDIA verkaufen. Dazu allerdings brauchen sie kartellrechtliche Genehmigungen von der EU, Großbritannien, Japan, den USA und auch China. Und China wird diesen Zusammenschluss nicht erlauben: Durch den Verkauf würde ARM noch stärker unter die Kontrolle des US-Gesetzgebers rücken. China hat ein Kartell-Gesetz, dass auch alle Unternehmen umfasst, die nach China liefern. Bei heimischen Firmen ist Chinas Kartellbehörde noch nie aktiv geworden. Insgesamt sieht es so aus, als das sie 100 Prozent aller Anträge abnicken würde. Doch de facto ist das anders: Als Qualcomm den niederländische Hersteller,  , der wichtige Prozessoren für die Elektronik im Auto herstellt, kaufen wollte, hat die chinesische Kartellbehörde diesen Zusammenschluss einfach zwei Jahre lang weder erlaubt, noch abgelehnt. Die saßen das so lange aus, bis Qualcomm aufgegeben hat. Dasselbe Schicksal droht jetzt dem  -ARM-Deal. USA Intel Qualcomm Google Facebook Intel AMD ARM Softbank NXP Nvidia",wirtschaftswoche
"Umfrage.  Deutsche wollen, dass europäische Unternehmen die 5G-Netze ausbauen ",Silke Wettach,18. November 2020,https://www.wiwo.de/politik/europa/umfrage-deutsche-wollen-dass-europaeische-unternehmen-die-5g-netze-ausbauen/26633538.html,"Noch hat die Politik nicht abschließend entschieden, welche Unternehmen in   am Ausbau der 5G-Netze beteiligt sein dürfen. Die Bevölkerung hat jedoch eine klare Präferenz für europäische Unternehmen. 70,5 Prozent der Deutschen sagen, dass sich europäische Unternehmen beteiligen sollen. Für eine Einbindung chinesischer Unternehmen sprechen sich dagegen nur 30,8 Prozent aus. Dies geht aus einer repräsentativen Umfrage in 13 europäischen Ländern hervor, die der WirtschaftsWoche exklusiv vorliegt. Die „Sinophone Borderland“-Umfrage, erstellt von einem Verbund europäischer Hochschulforscher unter Federführung der tschechischen Palacky Universität Olomouc, zeigt, dass die Deutschen generell China skeptisch gegenüber stehen. Eine Mehrheit von 62,5 Prozent gab an, dass bei ihnen das Misstrauen gegenüber China überwiege. Bei 46,7 Prozent der Deutschen hat sich die Meinung zu China in den vergangenen drei Jahren nach eigener Aussage verschlechtert. Gleichzeitig ist den Deutschen die Bedeutung der chinesischen Wirtschaft bewusst. 61,4 Prozent der Befragten halten China für wichtig für die Entwicklung der deutschen Wirtschaft. Nur die Wirtschaft der EU-Länder kommt hier noch auf einen höheren Wert (74,4 Prozent).  Befragt nach einzelnen Problembereichen nennen die Deutschen am häufigsten gefürchtete Wirtschaftsspionage, gefolgt von Cyberattacken aus China. Auch die Seidenstraßeninitiative und chinesische Investitionen im Ausland werden kritisch gesehen. Als Prioritäten der deutschen Beziehungen mit China nennen die Deutschen Klimawandel sowie Epidemie- und Terrorbekämpfung. Das Bestreben, Chinas geopolitischem Aufstieg Einhalt zu gebieten, landet dagegen auf dem letzten Platz. „Für eine Industrienation erscheint die Präferenz für Handel und Investitionen erstaunlich gering zu sein“, beobachtet Tim Rühlig vom Swedish Institute of International Affairs, zuständig für den deutschen Teil der Meinungsumfrage. Für die Umfrage, die von der EU finanziert wurde, wurden auch Menschen in Frankreich, Großbritannien, Italien, Lettland, Polen, Russland Schweden, Serbien, der Slowakei, Spanien, Tschechien und Ungarn befragt.   Deutschland",wirtschaftswoche
Die spannendsten neuen Tech-Unternehmen.  Wetten? Einer dieser Tech-Konzerne wird das nächste Apple ,Andreas Menn,18. November 2020,https://www.wiwo.de/finanzen/boerse/die-spannendsten-neuen-tech-unternehmen-wetten-einer-dieser-tech-konzerne-wird-das-naechste-apple/26637386.html,"Die Keynote des Tech-Gründers vergangene Woche läuft schon seit 40 Minuten, da kommt die Überraschung, das „One More Thing“: Stolz präsentiert der Manager vor versammeltem Publikum eine Augmented-Reality-Brille, fast so schlank wie eine Sonnenbrille, die digitale 3-D-Modelle täuschend echt darstellen soll. „Wir wollen das   des Erlebens möglich machen“, sagt der Tech-Guru. Wohnzimmer etwa sollen damit zum begehbaren Computerspiel werden. Bisher waren es amerikanische Konzerne wie  , von denen die Welt solche disruptiven Innovationen erwartet hat. Doch diesmal fand die bemerkenswerte Tech-Keynote nicht in Cupertino statt, sondern in Shenzhen, und auf der Bühne stand nicht Tim Cook, sondern Tony Chen, Gründer des chinesischen Elektronikkonzerns Oppo. Westlichen Konsumenten ist das Unternehmen noch weitgehend unbekannt. Dabei war Oppo im dritten Quartal des Jahres schon der sechstgrößte Smartphone-Hersteller weltweit.  Oppo ist damit eines von 100 Technologie-Unternehmen jenseits des Silicon Valley, die das Potential haben, zum nächsten   zu werden – und die wir an dieser Stelle erstmals vorstellen. Experten der Boston Consulting Group (BCG) haben in einer Studie, die der WirtschaftsWoche exklusiv vorliegt, aus tausenden Kandidaten die vielversprechendsten Unternehmen gekürt. Viele davon sind auch für Aktienanleger, die auf die möglichen Technologie-Stars von morgen möchten, einen Blick wert. Das Ranking klammert bewusst Technologie-Unternehmen aus den führenden Industrieländern aus - und nimmt stattdessen die Start-ups und Konzerne aus Wachstumsmärkten und Schwellenländern in Asien, Südamerika oder Afrika in den Blick. Mehr als 10.000 Tech-Unternehmen sind seit 2014 in diesen Emerging Markets gegründet worden, so die Boston-Consulting-Studie. Die neuen Tech-Herausforderer kommen aus China, Indien , Singapur, Israel oder Brasilien. Sie heißen ByteDance oder RootCloud, Lenskart oder Nubank Sie haben oft schon viele Millionen Kunden, im Schnitt machen die Unternehmen zwei Milliarden Dollar Umsatz im Jahr. Und mit großer Wahrscheinlichkeit ist unter den Top 100 auch das nächste Apple dabei – ein möglicher neuer weltumspannender Techkonzern. Denn eines haben die Tech-Newcomer gemeinsam: Sie wachsen überdurchschnittlich schnell. Im Vergleich zum Aktienindex S&P 500, der die 500 größten börsennotierten US-Unternehmen abbildet, steigt ihr Umsatz sechs mal schneller. Im Bereich Gaming schießen die Einnahmen der Start-ups sogar dreißigmal schneller in die Höhe als bei den Etablierten Computerspiele-Schmieden im S&P 500. Unsere Tabelle verrät, welche Unternehmen es in die Top-100 der Tech-Herausforderer geschafft haben. Um in das Ranking zu kommen, müssen die Unternehmen mindestens mit 500 Millionen Dollar bewertet sein. Sie müssen ein vielversprechendes Geschäftsmodell haben – und die Ambition, ihre gesamte Branche auf den Kopf zu stellen. Sie müssen zu den führenden drei Unternehmen in ihrer Branche und ihrer Region zählen und schon nennenswerte Umsätze und Kundenzahlen vorweisen können. Diese Kennzahlen machen es natürlich auch für Privatanleger attraktiv, sich zu beteiligen. Viele der Start-ups und Konzerne, die die BCG-Experten für aussichtsreich halten, sind jedoch noch in privater Hand oder planen gerade einen Börsengang. In ein paar von ihnen aber kann man heute schon investieren, zum Teil sind sie grad in Deutschland handelbar. Unsere Tabelle zeigt Ihnen die Top 100 der Tech-Aufsteiger – und diejenigen, deren Aktien in Deutschland zu kaufen sind. Die Top 100 profitieren vom schnellen Wirtschaftswachstum in ihren Regionen – und von Mega-Trends rund um   und künstliche Intelligenz, die weltweit disruptive Geschäftsmodelle entstehen lassen.     Der Online-Handel boomt, vor allem in China. 2006 gab es ihn dort praktisch noch nicht – heute werden in China schon gut 36 Prozent der Einzelhandelsumsätze online abgewickelt. In den   sind es nur 16 Prozent. 1900 Milliarden Dollar setzten Online-Händler in China pro Jahr um: Dreimal so viel wie in den USA. Ein gewaltiges Geschäft, von dem neue Anbieter wie Meituan, Pinduoduo oder Baozun profitieren. In Europa mag einem als erstes YouTube einfallen, wenn es um Videos im Internet geht. Doch der Markt ist weiter größer und in Schwellenländern streben neben   längst auch andere Akteure  an die Spitze. Die App   vom chinesischen Anbieter ByteDance hat mehr als 800 monatlich aktive Nutzer, 100 Millionen davon in den USA. Aktuell soll das Start-up mit 90 bis 100 Milliarden Dollar bewertet sein. Großes Potenzial sehen die BCG-Experten auch bei der Plattform Bilibili, die sich auf Videos rund um Comics und Spiele spezialisiert hat, dem chinesischen Inhalte-Aggregaten Qutoutiao und der Videoplattform JOYY, die  der Internetkonzern Baidu gerade aufgekauft hat. Bisher zählten Apple und   zu den führenden Smartphone-Herstellern - doch die Konkurrenz vor allem aus Asien holt massiv auf. Im dritten Quartal 2020 löste der chinesische Hersteller Xiaomi Apple als drittgrößten Hersteller der Welt ab. Das starke Smartphone-Geschäft trieb in den vergangenen zwölf Monaten auch den Börsenkurs von   Electronic, einem chinesischen Fertiger von Smartphone-Komponenten. Zu den Top 100 zählt zudem der Laptop-Hersteller Razor, der vom boomenden Gaming-Geschäft profitiert. Die Beispiele zeigen: Vor allem Asien entwickelt sich zum neuen Zentrum der Techindustrie. War China bisher vor allem Zulieferer für das Silicon Valley, so entstehen dort jetzt eigene Elektronik-Marken, die ihre Produkte mit neusten Komponenten und künstlicher Intelligenz ausstatten. Internet-Plattformen wiederum können in China und in Indien, gemessen an der Zahl der Bevölkerung, die größten Märkte der Welt erobern. Smartphone-Manager Chen zeigte vergangene Woche der westlichen Konkurrenz schon einmal, wie weit vorne sein Konzern Oppo im Technologie-Rennen ist: Auf seinem Innovation Day präsentierte er ein Smartphone mit rollbarem Display. Bei Bedarf kann das Handy auf Tablet-Größe wachsen. Wenn es nach Chen geht, soll das weltweite Geschäft von Oppo sich jetzt ähnlich schnell ausdehnen. Internet Apple Apple Digitalisierung USA Google TikTok Samsung BYD",wirtschaftswoche
Darmstädter Konzern.  Merck-Chef Oschmann lehnt Staatsbeteiligungen an Pharmafirmen ab ,no_author,18. November 2020,https://www.wiwo.de/unternehmen/industrie/darmstaedter-konzern-merck-chef-oschmann-lehnt-staatsbeteiligungen-an-pharmafirmen-ab/26635638.html,"Der Chef des Darmstädter Pharma- und Chemiekonzerns Merck,  , lehnt Staatsbeteiligungen in der Pharmaindustrie ab. Er glaube nicht, „dass staatliche Unternehmensbeteiligungen in dieser Branche notwendig sind“, sagte er dem Wirtschaftsmagazin Capital. Mitten in Corona-Pandemie war der Bund im Juni mit 300 Millionen Euro beim Tübinger Impfstoffentwickler Curevac eingestiegen. Das hatte eine Debatte um die Rolle des Staates ausgelöst. So hatte etwa der Industrieverband   transparente und geordnete Verfahren gefordert. Nach Ansicht von Oschmann hat die Pandemie auch zu einer Renaissance protektionistischer Ideen geführt. „Wenn ich Protektionist bin, egal ob von rechts oder von links, dann werde ich natürlich diese Krise auch nutzen, um meine Thesen weiter zu pushen“, sagte der Merck-Vorstandschef. Er halte Versuche, die komplette Wertschöpfung in der Medikamentenentwicklung nach   zurückzuholen, für unrealistisch. „In der Medikamentenproduktion gibt es viel Basischemie, die ganzen Hilfsstoffe, die häufig in China und Indien hergestellt werden – das wieder nach Europa zurückholen zu wollen, ist illusorisch und würde ein großes Problem schaffen.“ Gewerkschaften und Apotheker hatten in Coronakrise gefordert, die Medikamentenproduktion nach Europa zurück zu verlagern, um die Abhängigkeit von Fernost bei wichtigen Wirkstoffen zu senken und Arzneiengpässe zu bekämpfen. Das würde aber die Produktion verteuern. Oschmann wandte sich auch gegen hohe Hürden für ausländische Kapitalgeber in der Branche. Es sei „vollkommener Unsinn“ zu glauben, „dass wir sehr hohe Schutzmechanismen gegen ausländische Investments aufbauen müssen“. Im Gegenteil sei es sinnvoll, um ausländisches Kapital und die Beteiligung von Wagniskapital-Fonds zu werben. Stefan Oschmann BDI Europa",wirtschaftswoche
Motorenbau in China.  Daimler-Mitarbeiter zerknirscht: „Diese Chance haben wir jetzt verpasst“ ,no_author,17. November 2020,https://www.wiwo.de/unternehmen/auto/motorenbau-in-china-daimler-mitarbeiter-zerknirscht-diese-chance-haben-wir-jetzt-verpasst/26632580.html,"Daimlers Plan einer gemeinsamen Motorenproduktion mit dem Partner   in China ist auf Protest des Betriebsrats und der Arbeitnehmer in   gestoßen. „Die Unternehmen planen die Entwicklung eines hocheffizienten modularen Motors, der Hybridfahrzeuganwendungen der nächsten Generation ermöglicht, die in Europa und China hergestellt werden“, sagte ein  -Sprecher am Dienstag. Es würden aber weiterhin Motoren auch in Deutschland hergestellt. Die Aufteilung des Produktionsvolumens zwischen China und Europa stehe noch nicht fest. Der Betriebsrat des führenden Antriebswerks in Stuttgart-Untertürkheim kritisierte das Projekt scharf: „Wir sind fassungslos. Nicht einmal Diskussionen über alternative Fertigungsstandorte waren möglich“, erklärte Betriebsratschef Michael Häberle auf Anfrage der Nachrichtenagentur Reuters. Der Standort könne ebenfalls Vierzylindermotoren fertigen. „Es gab nicht einmal Gespräche dazu.“ Auch die Arbeitnehmer bei Daimler sind verstimmt. Zwar kommen die Geely-Umfänge vom bisherigen Motoren-Partner Renault. Doch auch das Daimler-Werk in Untertürkheim hätte noch Kapazitäten frei und die Motoren gerne gefertigt. „Diese Chance haben wir jetzt verpasst“, zeigt sich ein Mitarbeiter zerknirscht. Themen wie diese würden den Betriebsrat „sauer machen“, sagte ein Insider. Gleichwohl wisse man aber auch, dass man in der jetzigen Situation sowas nicht aufhalten könne, schließlich könne Daimler mit Geely Millionen sparen. Eine gute Botschaft für die deutschen Standorte ist es freilich nicht. Nachrichten wie diese seien derzeit „gefährlich“, heißt es in Arbeitnehmerkreisen. Die Stimmung unter den Mitarbeitern sei am Boden.  Als erstes hatte das „Handelsblatt“ über die Zusammenarbeit mit   berichtet, die nicht nur die Arbeitnehmervertreter erzürnt, sondern womöglich auch die Partnerschaft beim Bau kleinerer Motoren mit   in Frage stellt. Der Zeitung zufolge wollen die beiden Fahrzeughersteller ab 2024 gemeinsam einige hunderttausend Motoren im Jahr produzieren. Die Aggregate, die neben Benzin auch mit   oder   betrieben werden können, würden von   in Deutschland entwickelt. Die Fertigung in China übernehme Geely mit seinen kostengünstigen Strukturen. In Europa könne Mercedes die Produktion selbst übernehmen. Ziel seien jährliche Einsparungen im dreistelligen Millionenbereich allein bei Daimler. Um die Wettbewerbsfähigkeit zu verbessern und Skaleneffekte zu erzielen, würden die Unternehmen dazu ihre Fachkenntnisse in den Bereichen Entwicklung, Einkauf und Industrialisierung bündeln, zitierte das Blatt einen Sprecher. Das Projekt, in das die Motoreneinheit von Geelys Europa-Tochter Volvo Cars eingebunden ist, sei Teil der Transformation von  , hieß es in dem „Handelsblatt""-Bericht. Die Motoren sollten Autos von allen drei Partnern antreiben. Der Deal habe weitreichende Konsequenzen: So bedeute er das Ende einer Kooperation mit   bei Motoren für Kompaktautos. Außerdem sähen die Arbeitnehmervertreter den Plan kritisch, weil durch neue Produktionskapazitäten in China der Druck auf die Belegschaft steige. Die Antriebs- und Komponentenwerke in Deutschland stehen wegen des Umbruchs zu Elektromobilität vor dem Abbau Tausender Arbeitsplätze. Der Betriebsrat Untertürkheim will vom Management Zusagen für künftige Produkte aushandeln, um den mit der Transformation unvermeidlichen Stellenabbau so gering wie möglich zu halten. Geely Deutschland Daimler Geely Renault E-Fuels grünem Wasserstoff Daimler Mercedes-Benz Renault",wirtschaftswoche
