Dokument-ID,Datum,Quelle,Titel
89,01.07.2020,"sueddeutsche, DPA",Recht. Proteste gegen Sicherheitsgesetz für Hongkong
123,11.07.2020,"sueddeutsche, DPA",Konflikte. Altmaier verteidigt Wirtschaftsbeziehungen zu China
263,14.07.2021,"sueddeutsche, DPA",Fischerei. Fischfangflotten: Ringen um Stopp schädlicher Subventionen
305,01.07.2021,"sueddeutsche, DPA","Geschichte. 100. Parteijubiläum: Xi warnt Ausland vor ""Kollisionskurs"""
308,02.07.2021,"sueddeutsche, DPA",Agrar - Mainz. VDP-Prädikatsweingüter gut durch Corona-Krise gekommen
406,28.07.2021,"sueddeutsche, DPA","Tischtennis. ""Grandioses Comeback"": Ovtcharov kämpft um Medaille"
484,28.01.2020,"sueddeutsche, DPA",Krankheiten. Chinesen sollen jetzt auch nicht mehr ins Ausland reisen
513,25.01.2020,"sueddeutsche, DPA",Wissenschaft. Coronavirus erreicht Europa
514,26.01.2020,"sueddeutsche, DPA",Krankheiten. Zahl der Virus-Toten in China steigt weiter
518,26.01.2020,"sueddeutsche, DPA",Krankheiten. Zahl der Virus-Toten steigt - China verschärft Maßnahmen
521,26.01.2020,"sueddeutsche, DPA",Fußball. Chinesische Sportverbände reagieren auf Coronavirus
549,21.01.2020,"sueddeutsche, DPA",Krankheiten. Neues Virus in China: Erster Fall in USA nachgewiesen
570,18.01.2020,"sueddeutsche, DPA",Krankheiten. Vier neue Fälle der rätselhaften Lungenkrankheit in China
608,09.01.2020,"sueddeutsche, DPA",Wahlen. Taiwan trotzt Peking: Wahlsieg von Präsidentin Tsai erwartet
642,08.01.2020,"sueddeutsche, DPA",Luftverkehr. Nahost-Krise zwingt Airlines zum Umplanen
654,11.01.2020,"sueddeutsche, DPA",Wahlen. Taiwan: Präsidentin Tsai führt bei Wahl mit klarer Mehrheit
655,11.01.2020,"sueddeutsche, DPA",Wahlen. Taiwans Präsidentin Tsai erklärt Sieg - und dankt Wählern
656,11.01.2020,"sueddeutsche, DPA",Wahlen. Taiwans Präsidentin Tsai gewinnt Wiederwahl
657,12.01.2020,"sueddeutsche, DPA","Wahlen. Präsidentenwahl in Taiwan: Tsai gewinnt, Peking verliert"
661,11.01.2020,"sueddeutsche, DPA","Wahlen. ""Signal an Peking"": Taiwans Präsidentin Tsai wiedergewählt"
665,08.01.2020,"sueddeutsche, DPA",Tourismus. Airlines meiden Luftraum über Iran und Irak
720,19.01.2020,"sueddeutsche, DPA",Krankheiten. China: Ausmaß mysteriöser Lungenkrankheit größer als gedacht
735,21.01.2020,"sueddeutsche, DPA",Krankheiten. Lungenkrankheit: Zahl der Nachweise und Todesfälle steigt
738,21.01.2020,"sueddeutsche, DPA",Krankheiten. Droht eine neue Pandemie?
753,22.01.2020,"sueddeutsche, DPA",Krankheiten. Lungenkrankheit in China: Droht ein zweites Sars?
754,22.01.2020,"sueddeutsche, DPA",Krankheiten. Einwohner sollen Wuhan ohne wichtigen Grund nicht verlassen
794,24.01.2020,"sueddeutsche, DPA",Wissenschaft - Marburg. Marburger Forscher suchen Impfstoff gegen Coronavirus
799,24.01.2020,"sueddeutsche, DPA",Krankheiten. Coronavirus erreicht Europa: Zwei Fälle in Frankreich
806,25.01.2020,"sueddeutsche, DPA",Wissenschaft. Coronavirus breitet sich immer weiter aus
829,27.01.2020,"sueddeutsche, DPA",Krankheiten. Etwa 90 Deutsche im Raum Wuhan - Berlin prüft Evakuierung
882,28.01.2020,"sueddeutsche, DPA",Krankheiten. Vier Coronavirusfälle in Deutschland
886,28.01.2020,"sueddeutsche, DPA",Geschichte. Kalenderblatt 2020: 29. Januar
889,28.01.2020,"sueddeutsche, DPA",Krankheiten. Von Wuhan nach Stockdorf: Coronavirus erreicht Deutschland
918,29.01.2020,"sueddeutsche, DPA",Krankheiten. Coronavirus breitet sich weiter aus
931,29.01.2020,"sueddeutsche, DPA",Ski alpin. Angst geht um: Coronavirus-Auswirkungen auf den Sport
953,30.01.2020,"sueddeutsche, DPA",Krankheiten. Wie die Welt das Sars-Virus erfolgreich bekämpfte
956,30.01.2020,"sueddeutsche, DPA",Tischtennis. Boll bereit für Nummer eins der Welt - Ovtcharov souverän
1019,14.06.2021,"sueddeutsche, DPA",G7. China wirft G7-Staaten Faktenverdrehung und Einmischung vor
1032,08.06.2021,"sueddeutsche, DPA",Nato. Stoltenberg will transatlantische Einheit demonstrieren
1129,29.06.2021,"sueddeutsche, DPA",Brauchtum - Großrosseln. Kinder schreiben viel: Schon 2000 Briefe an den Nikolaus
1133,29.06.2021,"sueddeutsche, DPA",Brauchtum. Kinder schreiben viel: Schon 2000 Briefe an den Nikolaus
1262,12.06.2020,"sueddeutsche, DPA",Internet. Zoom blockiert auf Pekings Wunsch - und erntet Kritik
1295,19.06.2020,"sueddeutsche, DPA",Lebensmittel - Anklam. Polnischer Lebensmittelproduzent will Werk in Anklam bauen
1313,28.06.2020,"sueddeutsche, DPA",Geschichte. Kalenderblatt 2020: 29. Juni
1324,25.01.2021,"sueddeutsche, DPA",Konflikte. USA schicken Flugzeugträger ins Südchinesische Meer
1338,23.01.2021,"sueddeutsche, DPA",Auto. Bericht: Altmaier setzt sich in Chip-Krise für Autobauer ein
1339,24.01.2021,"sueddeutsche, DPA",Elektronik - München. Siltronic begrüßt höheres Kaufgebot von Globalwafers
1350,28.01.2021,"sueddeutsche, DPA",Auto. Britische Autoindustrie erlebt schlechtestes Jahr seit 1984
1437,13.01.2021,"sueddeutsche, DPA",Diplomatie. US-Außenminister Pompeo sagt Europa-Reise ab
1445,14.01.2021,"sueddeutsche, DPA",Justiz. Nach gescheitertem Fluchtversuch: Festnahmen in Hongkong
1539,09.02.2021,"sueddeutsche, DPA","Olympia. Hörmann: Tokio-Entscheidung ""allerspätestens im April"""
1543,10.02.2021,"sueddeutsche, DPA","Bevölkerung. Geburten in China fallen: ""Niemand will noch Kinder haben"""
1557,02.02.2021,"sueddeutsche, DPA","Olympia. Optimismus vor Winterspielen 2022: Das ""Wunder"" von Peking?"
1560,04.02.2021,"sueddeutsche, DPA",Menschenrechte. Winterspiele in Peking: Boykottaufrufe werden lauter
1565,04.02.2021,"sueddeutsche, DPA",Menschenrechte. Winterspiele in Peking: Boykottaufrufe werden lauter
1579,11.02.2021,"sueddeutsche, DPA",Konflikte. Erstes Telefonat mit Xi: Biden kritisiert China
1682,24.02.2020,"sueddeutsche, DPA",Radsport - Berlin. Keine Einschränkungen bei Bahnrad-WM wegen Coronavirus
1724,18.02.2020,"sueddeutsche, DPA",Elektronik. Apple nimmt Umsatzprognose wegen Coronavirus-Folgen zurück
1749,13.02.2020,"sueddeutsche, DPA","Wissenschaft. Ende der Odyssee? Kreuzfahrtschiff ""Westerdam"" in Kambodscha"
1859,01.02.2020,"sueddeutsche, DPA",Tischtennis - Magdeburg. Ovtcharov als letzter Deutscher bei German Open
1954,04.02.2020,"sueddeutsche, DPA","Wissenschaft. Coronavirus: China räumt ""Unzulänglichkeiten"" ein"
1996,07.02.2020,"sueddeutsche, DPA",Wohnen. Messe Ambiente: Einige Stände bleiben wegen Coronavirus leer
2003,07.02.2020,"sueddeutsche, DPA",Wohnen - Berlin. Messe Ambiente: Einige Stände bleiben wegen Coronavirus leer
2067,11.02.2020,"sueddeutsche, DPA",Krankheiten. Wegen Coronavirus: Antibiotika-Engpässe möglich
2069,12.02.2020,"sueddeutsche, DPA",Wissenschaft. Fast 100 weitere Tote durch Covid-19 in China
2109,13.02.2020,"sueddeutsche, DPA","Krankheiten - Thành phố Hạ Long. Kreuzfahrtschiff ""Aidavita"" darf nicht in Vietnam andocken"
2111,14.02.2020,"sueddeutsche, DPA",Krankheiten - Kaiserslautern. Coronavirus erschwert Beziehungen der Unis zu China
2112,14.02.2020,"sueddeutsche, DPA",Wissenschaft. Erste Kreuzfahrt-Passagiere gehen in Kambodscha von Bord
2120,14.02.2020,"sueddeutsche, DPA",Luftverkehr. Coronavirus: Luftverkehr mit Umsatzverlust in Milliardenhöhe
2204,19.02.2020,"sueddeutsche, DPA","Wissenschaft. Erste Passagiere verlassen die ""Diamond Princess"""
2317,28.02.2020,"sueddeutsche, DPA",Tourismus. Berliner Reisemesse ITB wegen Coronavirus abgesagt
2327,22.05.2020,"sueddeutsche, DPA",Parlament. Peking will in Hongkong eigene Sicherheitsorgane einsetzen
2353,15.05.2020,"sueddeutsche, DPA",Tourismus - Wiesbaden. Tourismus bricht im März um mehr als die Hälfte ein
2358,17.05.2020,"sueddeutsche, DPA",Krankheiten. Studie bestätigt Sars-CoV-2-Übertragung vor ersten Symptomen
2370,17.05.2020,"sueddeutsche, DPA",Krankheiten - München. Studie bestätigt Sars-CoV-2-Übertragung vor ersten Symptomen
2372,18.05.2020,"sueddeutsche, DPA",Gesundheit. Studie bestätigt Corona-Übertragung vor ersten Symptomen
2373,18.05.2020,"sueddeutsche, DPA",Gesundheit. Auch UN-Chef für Pandemie-Untersuchung - aber nicht jetzt
2499,28.05.2020,"sueddeutsche, DPA",Museen. Bürgermeister von Florenz: Kunststädte am Abgrund
2516,19.05.2021,"sueddeutsche, DPA",Geschichte. Kalenderblatt 2021: 20. Mai
2583,06.05.2021,"sueddeutsche, DPA","Auto - Wolfsburg. ""Das werden wir spüren"": VW kämpft trotz Gewinn um Chips"
2587,06.05.2021,"sueddeutsche, DPA","Auto. VW kämpft um Chips, Gewinn sprudelt trotzdem"
2664,23.12.2021,"sueddeutsche, DPA","Olympia. Neureuther sorgt sich ""um die olympische Idee"""
2665,23.12.2021,"sueddeutsche, DPA",Olympia. Putin kritisiert politischen Boykott der Winterspiele
2666,24.12.2021,"sueddeutsche, DPA",Olympia. Olympia: Japan will keine hochrangigen Politiker entsenden
2697,16.12.2021,"sueddeutsche, DPA",Olympia. Athleten Deutschland lehnen sportlichen Olympia-Boykott ab
2702,14.12.2021,"sueddeutsche, DPA",Olympia. Keine hochrangigen Politiker aus Österreich zu Olympia
2711,09.12.2021,"sueddeutsche, DPA",Olympia. China zu diplomatischem Boykott: Länder werden Preis zahlen
2713,09.12.2021,"sueddeutsche, DPA",Bundesregierung. Baerbock will in der Olympia-Frage eine europäische Antwort
2756,08.12.2021,"sueddeutsche, DPA",Brauchtum - Kirchhain. Weihnachtspostamt hat bereits 2300 Briefe beantwortet
2761,08.12.2021,"sueddeutsche, DPA",Brauchtum. Weihnachtspostamt hat bereits 2300 Briefe beantwortet
2763,08.12.2021,"sueddeutsche, DPA","Olympia. EU-Politikerin Beer: ""Gänzlicher Boykott"" der Peking-Spiele"
2769,08.12.2021,"sueddeutsche, DPA",EU. EU soll Sanktionsinstrument gegen Druck von Außen bekommen
2778,08.12.2021,"sueddeutsche, DPA",Olympia. Der diplomatische Boykott der Spiele in Peking wird größer
2780,10.12.2021,"sueddeutsche, DPA","Diplomatie. Bidens ""Gipfel für Demokratie"" - Gemeinsam gegen Autokraten?"
2782,09.12.2021,"sueddeutsche, DPA",Diplomatie. Online-Gipfel: Biden ruft Demokratien zum Zusammenhalt auf
2787,10.12.2021,"sueddeutsche, DPA",Bundesregierung. Macron und Scholz beschwören Partnerschaft Paris-Berlin
2791,10.12.2021,"sueddeutsche, DPA",Olympia. Iran verurteilt diplomatischen Boykott der Spiele in Peking
2792,10.12.2021,"sueddeutsche, DPA",Diplomatie. Seitenwechsel zu China: Nicaragua bricht mit Taiwan
2799,14.12.2021,"sueddeutsche, DPA",Maschinenbau. Roboterdichte in deutscher Industrie auf Rekordhoch
2801,12.12.2021,"sueddeutsche, DPA","Olympia. Baerbock: Olympia nicht für ""politische Dinge"" nutzen"
2824,18.12.2021,"sueddeutsche, DPA",Olympia. Human Rights Watch fordert diplomatischen Olympia-Boykott
2838,21.12.2021,"sueddeutsche, DPA","Diplomatie. China hofft auf Fortsetzung des ""ranghohen Führungsstils"""
2852,28.12.2021,"sueddeutsche, DPA",Biathlon. Biathleten Doll und Lesser gegen Olympia-Boykott
2857,29.12.2021,"sueddeutsche, DPA",Jahreswechsel. Baerbock und Faeser reisen nicht zu Spielen nach Peking
2858,27.12.2021,"sueddeutsche, DPA",Brauchtum - Großrosseln. Rekord: Nikolauspostamt beantwortet mehr als 30.000 Briefe
2860,29.12.2021,"sueddeutsche, DPA",Olympia. Baerbock und Faeser reisen nicht zu Olympia nach Peking
2880,23.11.2021,"sueddeutsche, DPA",Kunst - Hamburg. Kunsthandwerker-Messe in Hamburg: Mehr als 70 Aussteller
2888,24.11.2021,"sueddeutsche, DPA",Gipfel. US-Regierung lädt Taiwan zu Gipfel für Demokratie ein
2899,16.11.2021,"sueddeutsche, DPA",Konflikte. Biden und Xi warnen vor offener Konfrontation
2922,08.11.2021,"sueddeutsche, DPA",Militär. Chinas Militär baut Attrappen von US-Kriegsschiffen
2961,10.11.2021,"sueddeutsche, DPA",Geschichte. Kalenderblatt 2021: 11. November
2987,12.11.2021,"sueddeutsche, DPA",Konflikte. Xi und Biden kommen zu virtuellem Treffen zusammen
3125,02.12.2020,"sueddeutsche, DPA",Urteile. Joshua Wong muss mehr als ein Jahr ins Gefängnis
3188,30.12.2020,"sueddeutsche, DPA",Brauchtum - Großrosseln. Rekord: Nikolauspostamt beantwortet knapp 30 000 Briefe
3190,29.12.2020,"sueddeutsche, DPA",Steuern - Berlin. Fast 50 000 Händler aus Fernost bei Finanzamt registriert
3191,30.12.2020,"sueddeutsche, DPA",Tourismus. So feiert die Welt 2020 Silvester
3209,20.11.2020,"sueddeutsche, DPA",Tischtennis. Aus für Ovtcharov und Solja bei ITTF Finals
3241,13.11.2020,"sueddeutsche, DPA",Tischtennis. Tischtennis-World-Cup: Patrick Franziska holt Gruppensieg
3273,06.11.2020,"sueddeutsche, DPA",Geschichte. Kalenderblatt 2020: 7. November
3282,08.11.2020,"sueddeutsche, DPA",Tischtennis. Tischtennis-World-Cup: Aus für Solja - Han Ying weiter
3287,09.11.2020,"sueddeutsche, DPA",Tischtennis. Han Ying erreicht Halbfinale beim Tischtennis-World-Cup
3300,14.11.2020,"sueddeutsche, DPA",Tischtennis. Ovtcharov bei Tischtennis-World-Cup ausgeschieden
3313,15.11.2020,"sueddeutsche, DPA",Gesundheit. Innenminister regt Datenschutz-Debatte in Corona-Pandemie an
3327,19.11.2020,"sueddeutsche, DPA",Tischtennis. Franziska scheitert bei ITTF Finals - Solja weiter
3355,25.10.2021,"sueddeutsche, DPA",Konflikte. Neuer Streit zum Jahrestag der UN-Aufnahme Chinas
3367,24.10.2021,"sueddeutsche, DPA",Geschichte. Kalenderblatt 2021: 25. Oktober
3377,27.10.2021,"sueddeutsche, DPA",Literatur - Duisburg. Nach Absage-Streit großer Andrang bei Lesung über Xi Jinping
3378,28.10.2021,"sueddeutsche, DPA","Militär. Taiwans Präsidentin: Bedrohung durch China ""nimmt zu"""
3394,08.10.2021,"sueddeutsche, DPA",Konflikte. Kollision von amerikanischem Atom-U-Boot erzürnt Peking
3396,09.10.2021,"sueddeutsche, DPA","Konflikte. Xi fordert ""Wiedervereinigung"" mit Taiwan"
3407,03.10.2021,"sueddeutsche, DPA",Konflikte. Rekordzahl chinesischer Militärjets provoziert Taiwan
3421,05.10.2021,"sueddeutsche, DPA","Konflikte. Taiwan wirft China ""zunehmend aggressive Haltung"" vor"
3457,13.10.2021,"sueddeutsche, DPA",Konflikte. China: Manöver sollen Druck auf Taiwan und USA verstärken
3479,20.10.2021,"sueddeutsche, DPA",Außenhandel - Friedrichshafen. Ex-Ministerpräsident sieht Versäumnisse in China-Politik
3520,28.10.2021,"sueddeutsche, DPA",Ausstellungen - Leipzig. Leipziger Grassimesse: Drei Tage Design und Kunsthandwerk
3580,03.10.2020,"sueddeutsche, DPA",Sport. Hauptrunde der LoL Worlds beginnt – Wie weit kommt Europa?
3584,16.10.2020,"sueddeutsche, DPA",Auto. Sportwagenbauer Porsche holt bei Verkaufszahlen auf
3614,08.10.2020,"sueddeutsche, DPA",Sport. G2 geht als Gruppenzweiter ins Viertelfinale der LoL-WM
3638,10.10.2020,"sueddeutsche, DPA",Wahlen. Opposition gewinnt Senatswahl in Tschechien deutlich
3774,07.04.2021,"sueddeutsche, DPA",Olympia. Streit zwischen USA und China über Winterspiele-Boykott
3794,13.04.2021,"sueddeutsche, DPA",Atomkraft. Japan: Radioaktives Wasser soll gefiltert ins Meer
3826,21.04.2021,"sueddeutsche, DPA",Justiz. Zahl der Hinrichtungen sinkt deutlich - aber nicht überall
3846,28.04.2021,"sueddeutsche, DPA",Diplomatie. Berlin und Peking wollen Kooperation vertiefen
4050,16.04.2020,"sueddeutsche, DPA",Geschichte. Kalenderblatt 2020: 17. April
4163,07.03.2021,"sueddeutsche, DPA","Diplomatie. Taiwan: Peking kritisiert ""Einmischung"" Washingtons"
4172,05.03.2021,"sueddeutsche, DPA",Tischtennis. Endspiel erreicht: Ovtcharov schlägt auch Japaner Harimoto
4180,07.03.2021,"sueddeutsche, DPA",Tischtennis. Wunderkinder geschlagen: Ovtcharov gewinnt WTT-Turnier
4198,05.03.2021,"sueddeutsche, DPA","Parlament. China will ""mehr als sechs Prozent"" wachsen"
4223,10.03.2021,"sueddeutsche, DPA","Parlament. Xi Jinping ruft Chinas Militär zur ""Kampfbereitschaft"" auf"
4270,19.03.2021,"sueddeutsche, DPA",Diplomatie. Diplomatentreffen USA - China: Konfrontation mit Ansage
4300,22.09.2021,"sueddeutsche, DPA",Telekommunikation. Litauen warnt vor unsicheren chinesischen 5G-Smartphones
4319,15.09.2021,"sueddeutsche, DPA","Verteidigung - Berlin. China lehnt Besuch von deutscher Fregatte ""Bayern"" ab"
4411,10.09.2021,"sueddeutsche, DPA",Konflikte. Sorge vor Konfrontation: Biden telefoniert mit Xi
4521,01.08.2021,"sueddeutsche, DPA",Tischtennis. Deutsche Tischtennis-Teams ohne Mühe im Viertelfinale
4546,04.08.2021,"sueddeutsche, DPA","Olympia. ""Sind noch nicht fertig"": Tischtennis-Männer spielen um Gold"
4642,26.08.2020,"sueddeutsche, DPA",Konflikte. China schießt Raketen ins Südchinesische Meer
4727,09.08.2020,"sueddeutsche, DPA",Diplomatie. Besuch von US-Minister in Taiwan empört Peking
4845,01.09.2020,"sueddeutsche, DPA",International. Maas und chinesischer Außenminister auf Konfrontationskurs
4911,14.09.2020,"sueddeutsche, DPA",EU. Gipfel im Kleinformat: EU will Zugeständnisse von China
4935,21.09.2020,"sueddeutsche, DPA",Tourismus. Rosa Delfine kehren nach Hongkong zurück
5069,08.03.2020,"sueddeutsche, DPA",Notfälle. Zehn Tote nach Einsturz von Quarantäne-Hotel in China
5278,13.03.2020,"sueddeutsche, DPA",Geschichte. Kalenderblatt 2020: 14. März
5354,21.03.2020,"sueddeutsche, DPA",Krankheiten. Schließungen und Verbote: Coronavirus hat die Welt im Griff
5380,25.03.2020,"sueddeutsche, DPA",Gesundheit. 17-Jähriger betreibt Website zum Coronavirus
5424,26.10.2021,wirtschaftswoche,Chip-Zulieferer.  Verkauf von Siltronic muss bis Ende Januar in trockenen Tüchern sein 
5459,20.10.2021,wirtschaftswoche,Uiguren.  Designierter US-Botschafter wirft China Völkermord in Xinjiang vor 
5461,22.10.2021,wirtschaftswoche,US-Präsident.  Biden warnt China: USA würden Taiwan bei Angriff verteidigen 
5476,18.10.2021,wirtschaftswoche,E-Mobilität.  Smartphone-Hersteller Foxconn will auch Elektroautos bauen 
5480,17.10.2021,wirtschaftswoche,Taiwan-Konflikt.  China kritisiert US-Marine-Einsatz durch Taiwan-Straße als Gefahr für den Frieden 
5503,10.10.2021,wirtschaftswoche,Konflikt.  Taiwan will Verteidigung angesichts steigenden Drucks von China verstärken 
5506,08.10.2021,wirtschaftswoche,Spannungen im Pazifik.  US-Atom-U-Boot kollidiert mit unbekanntem Objekt – China zeigt sich „besorgt“ 
5511,06.10.2021,wirtschaftswoche,Konflikt mit China.  Taiwan: Spannung mit China so groß wie seit 40 Jahren nicht mehr
5515,06.10.2021,wirtschaftswoche,USA und China.  Prinzipielle Einigung auf weiteres Gespräch Biden und Xi 
5518,05.10.2021,wirtschaftswoche,Handelskonflikt.  Annäherung im Handelsstreit? USA und China planen angeblich Spitzentreffen in der Schweiz 
5525,04.10.2021,wirtschaftswoche,China.  Taiwan meldet 52 chinesische Militärjets in seiner Luftverteidigungszone
5545,27.10.2020,wirtschaftswoche,Neuer Trend Travel-Bubble.  Die Zweiklassengesellschaft des Reisens 
5556,26.10.2020,wirtschaftswoche,"Dow Jones, Nasdaq, S&P 500.  Corona und Zweifel an Hilfspaket lasten auf Wall Street"
5608,11.10.2020,wirtschaftswoche,80 Prozent aller Notebooks von dort.  Taiwan ist das Schlachtfeld des Chip-Kriegs
5610,10.10.2020,wirtschaftswoche,Stichwahlen.  Opposition gewinnt Senatswahl in Tschechien deutlich 
5619,09.10.2020,wirtschaftswoche,"Kaufgespräche mit Xilinx.  AMD will Milliarden ausgeben, um es mit Intel aufzunehmen "
5631,04.10.2020,wirtschaftswoche,Bill Ray.  „Unsere größte Sorge ist eine technologische Zweiteilung der Welt“ 
5640,03.10.2020,wirtschaftswoche,EU-China-Beziehungen.  Gipfel zur China-Politik soll ohne den chinesischen Staatschef stattfinden 
5655,30.11.2020,wirtschaftswoche,Siltronic.  Chipzulieferer steht vor Milliardendeal mit Taiwan 
5742,02.11.2020,wirtschaftswoche, Dieser Milliardenmarkt gibt den Deutschen Rätsel auf
5770,24.11.2021,wirtschaftswoche,Diese Top-Themen werden die Börse 2022 bewegen
5778,21.11.2021,wirtschaftswoche,Konflikt.  Kein Botschafter mehr: China straft Litauen wegen Taiwan-Streits ab 
5794,16.11.2021,wirtschaftswoche,China und USA.  Biden: Wettbewerb mit China darf nicht in Konflikt ausarten 
5803,15.11.2021,wirtschaftswoche,Videokonferenz.  US-Präsident Biden kündigt vor Gespräch mit Xi „harten Wettbewerb“ mit China an 
5840,08.11.2021,wirtschaftswoche,"US-Großbank.  Ende von Privatkundengeschäft in Südkorea kostet Citi bis zu 1,5 Milliarden Dollar"
5851,05.11.2021,wirtschaftswoche,Drakonische Maßnahmen.  Kampf gegen Corona: China macht dicht 
5897,25.03.2021,wirtschaftswoche,"EU-Sanktionen.  China straft nach Xinjiang-Sanktionen Mode- und Sportfirmen wie Adidas, Nike und Zara ab "
5916,21.03.2021,wirtschaftswoche, Berliner Ampel(alb)träume 
5956,07.03.2021,wirtschaftswoche,Warnung vor „roter Linie“.  China kritisiert „Einmischung“ der USA 
5968,05.03.2021,wirtschaftswoche,Trotz Coronakrise.  China will „mehr als sechs Prozent“ wachsen 
5974,04.03.2021,wirtschaftswoche,Volkskongress.  „Patrioten“ für Hongkong – Militäretat steigt stark 
5976,05.03.2021,wirtschaftswoche,Volkskongress.  China will „mehr als sechs Prozent“ wachsen 
5997,25.09.2021,wirtschaftswoche,Gemeinsame Erklärung.  USA und Partner wollen Einfluss im Indopazifik ausbauen 
6040,20.09.2021,wirtschaftswoche,Asiatische Märkte.  Aktienkurse in Asien schwächeln 
6079,10.09.2021,wirtschaftswoche,USA-China-Beziehung .  Erstmals seit sieben Monaten: Biden und Xi telefonieren wieder 
6100,06.09.2021,wirtschaftswoche,Autoindustrie.  PwC: Erholung bei Halbleiter-Versorgung dauert 
6222,31.08.2020,wirtschaftswoche,Außenpolitik.  China bezeichnet Besuch von tschechischer Delegation in Taiwan als „Provokation“ 
6318,08.08.2020,wirtschaftswoche, Jetzt hilft nur noch – der Neoliberalismus!
6388,18.09.2020,wirtschaftswoche,China-Taiwan-Konflikt.  China reagiert mit Militärübung auf Taiwan-Besuch von US-Politiker 
6431,09.09.2020,wirtschaftswoche,"Joschka Fischer.  „Dringend nötig, jetzt die Frage nach Nord Stream 2 neu aufzuwerfen“"
6447,07.09.2020,wirtschaftswoche,Handelskrieg.  China kritisiert mögliche US-Sanktionen gegen Chipfirma 
6487,27.03.2020,wirtschaftswoche,Coronavirus.  Wie es nach der Kontaktsperre weitergehen kann 
6504,23.03.2020,wirtschaftswoche,Corona-Krise.  Airlines in Asien und Nahost stellen Flugbetrieb weitgehend ein 
6526,13.03.2020,wirtschaftswoche,"Vorbilder Taiwan, Hongkong, Südkorea.  So bekämpfen Chinas Nachbarn erfolgreich Corona "
6602,28.04.2021,wirtschaftswoche,Regierungskonsultationen.  Spannungen überschatten Merkels Gespräche mit China 
6623,24.04.2021,wirtschaftswoche,Geopolitik.  Wie wollen wir es mit Peking halten? 
6695,07.04.2021,wirtschaftswoche,China.  Taiwan meldet Eintritt von chinesischen Kampfjets in Luftraum 
6761,18.04.2020,wirtschaftswoche, Die Corona-Schlafwandler
6797,06.04.2020,wirtschaftswoche,"Die andere Seite der Coronakrise.  Nachrichten, die wieder Mut machen "
6845,28.01.2020,wirtschaftswoche, Was uns das Coronavirus über die globalisierte Welt lehrt
6867,23.01.2020,wirtschaftswoche,Coronavirus.  Was die neue Lungenkrankheit für Chinas Wirtschaft bedeutet 
6909,19.01.2020,wirtschaftswoche,Coronavirus.  Mysteriöse Lungenkrankheit in China: Ausmaß wohl deutlich größer als bisher angenommen 
6931,15.01.2020,wirtschaftswoche, Taiwans Wahlergebnis ist eine gute Nachricht für die Wirtschaft
6946,14.01.2020,wirtschaftswoche,Handelskrieg.  China – die große Illusion des Westens 
6963,11.01.2020,wirtschaftswoche,Unabhängigkeit von China.  Amtsinhaberin Tsai siegt bei Wahl in Taiwan 
6996,02.01.2020,wirtschaftswoche,Shen Yi-ming.  Taiwans Generalstabschef stirbt bei Helikopterunglück 
7053,21.06.2021,wirtschaftswoche,Umsatzsteuer.  Chinesen stehen Schlange bei Berliner Finanzamt 
7143,01.06.2021,wirtschaftswoche,Terry Gou.  Foxconn-Milliardär will Impfstoff von Biontech für Taiwan kaufen 
7246,04.06.2020,wirtschaftswoche,Sportartikel.  Adidas-Geschäft erholt sich in China schneller als erwartet 
7264,01.06.2020,wirtschaftswoche, Asiens Tigerstaaten bleiben dynamisch
7296,24.01.2021,wirtschaftswoche,Verletzung des Luftraums.  Spannungen zwischen China und Taiwan rufen USA auf den Plan 
7298,25.01.2021,wirtschaftswoche,Automobilindustrie.  Chipmangel: Jetzt schaltet sich offenbar Peter Altmaier ein 
7350,11.01.2021,wirtschaftswoche,Taiwan.  China warnt USA: Keine offiziellen Kontakte mit Taiwan pflegen 
7357,10.01.2021,wirtschaftswoche,Konflikt mit China.  Mike Pompeo: Beschränkungen für US-Diplomaten zu Taiwan aufgehoben 
7375,05.01.2021,wirtschaftswoche,Zurück auf die Bühne?.  Foxconn will Elektroauto-Firma Byton helfen 
7457,19.07.2020,wirtschaftswoche,"Die Tanker-Chroniken (III).  „Vergiss den Tanker, kauf Dir eine Ölbohrinsel!“ "
7476,16.07.2020,wirtschaftswoche,Biotechunternehmen.  Biontech erhält in China grünes Licht für Corona-Impfstoff-Studie 
7492,14.07.2020,wirtschaftswoche,"Dow Jones, Nasdaq, S&P 500.  Spannungen mit China belasten Wall Street – Banken im Fokus"
7524,06.07.2020,wirtschaftswoche,Militärübung.  Machtdemonstration: US-Flugzeugträger fahren Manöver in Sichtweite chinesischer Kriegsschiffe 
7536,03.07.2020,wirtschaftswoche,Sicherheitsgesetz.  Hongkonger Aktivist Joshua Wong bittet deutsche Regierung um Hilfe 
7601,14.07.2021,wirtschaftswoche,Big Tech.  Apple will Produktion neuer iPhones deutlich steigern 
7616,12.07.2021,wirtschaftswoche,Impfstoff.  Taiwan: Foxconn und TSMC kaufen Biontech-Dosen für 300 Millionen Euro
7633,07.07.2021,wirtschaftswoche, USA-China: Droht eine Teilung der Welt?
7647,01.07.2021,wirtschaftswoche,China feiert 100. Geburtstag der KP.  Xi warnt vor „großer Mauer aus Stahl“
7654,31.12.2021,wirtschaftswoche,Wie wird 2022 werden?
7686,22.12.2021,wirtschaftswoche,Börsenjahr 2022: Es kommt immer anders als man denkt
7702,17.12.2021,wirtschaftswoche,Autozulieferer.  Continental gerät in Chinas Streit mit Litauen offenbar zwischen die Fronten 
7718,11.12.2021,wirtschaftswoche,"Menschenrechte.  USA verhängen Sanktionen gegen China, Myanmar und Nordkorea "
7720,10.12.2021,wirtschaftswoche,Demokratie-Gipfel.  Biden will Stärkung unabhängiger Medien thematisieren 
7726,09.12.2021,wirtschaftswoche, Litauen geht uns alle an – auch Olaf Scholz
7729,09.12.2021,wirtschaftswoche,China.  Baerbock zu diplomatischem Olympia-Boykott: Europäische Antwort finden 
