Dokument-ID,Datum,Quelle,Titel
2220,22.02.2020,"sueddeutsche, DPA",Gesundheit - Berlin. Coronavirus: Sechs Deutsche von Quarantäne-Schiff zuhause
2221,22.02.2020,"sueddeutsche, DPA",Krankheiten. Italien will mit Coronavirus betroffene Städte abriegeln
2222,22.02.2020,"sueddeutsche, DPA",Fußball. Coronavirus stürzt Chinas Fußball in Krise
2226,23.02.2020,"sueddeutsche, DPA",Gesundheit - Berlin. China-Rückkehrer aus Quarantäne in Berlin entlassen
2227,23.02.2020,"sueddeutsche, DPA",Finanzen. IWF senkt wegen Coronavirus die Wachstumsprognose für China
2228,22.02.2020,"sueddeutsche, DPA",Gesundheit - Berlin. Coronavirus: Emsländer von Quarantäne-Schiff wieder zuhause
2232,23.02.2020,"sueddeutsche, DPA",Medizin. Coronavirus: Wieder fast 100 Tote in China
2233,23.02.2020,"sueddeutsche, DPA",Konjunktur. Coronavirus könnte Aufschwung bei Konjunktur verzögern
2234,24.02.2020,"sueddeutsche, DPA",Börsen. Dax sackt ab - Anleger ziehen wegen Virus-Krise Notbremse
2235,23.02.2020,"sueddeutsche, DPA",Krankheiten - Codogno. Unilever: Kein Deutscher in italienischer Einrichtung
2237,24.02.2020,"sueddeutsche, DPA",Konjunktur. Ifo-Geschäftsklima hellt sich überraschend etwas auf
2240,23.02.2020,"sueddeutsche, DPA",Krankheiten - Berlin. Senat rät zu Abklärung bei Rückkehrern aus Norditalien
2241,23.02.2020,"sueddeutsche, DPA",Krankheiten. Coronavirus-Verdacht: Züge aus Italien am Brenner angehalten
2242,25.02.2020,"sueddeutsche, DPA",Gesundheit - Erfurt. Coronavirus: Ministerium sieht aktuell geringes Risiko
2243,24.02.2020,"sueddeutsche, DPA",Krankheiten. Wegen Coronavirus sind kaum Schutzmasken mehr auf Lager
2245,25.02.2020,"sueddeutsche, DPA",Unternehmen - Kamenz. Sachsens Firmen verkaufen mehr Elektrotechnik ins Ausland
2247,25.02.2020,"sueddeutsche, DPA",Krankheiten - München. Politischer Streit um Folgen des Coronavirus-Ausbruchs
2248,25.02.2020,"sueddeutsche, DPA",Tischtennis. Tischtennis-Team-WM wegen Coronavirus verschoben
2250,25.02.2020,"sueddeutsche, DPA",Konjunktur - Bremen. Handelskammer erwartet schwache Wirtschaftsentwicklung
2251,25.02.2020,"sueddeutsche, DPA",Luftverkehr - Frankfurt am Main. Lufthansa will wegen Virusfolgen Kosten sparen
2252,25.02.2020,"sueddeutsche, DPA",Konjunktur. Deutsche Wirtschaft kraftlos - Coronavirus dämpft
2253,25.02.2020,"sueddeutsche, DPA",Gesundheit - Hamburg. Menschen in Hamburg auf Sars-CoV-2 getestet: Kein Fall
2254,25.02.2020,"sueddeutsche, DPA",Krankheiten - München. Coronavirus-Aufklärung für Italien-Reisende aus Bayern
2255,25.02.2020,"sueddeutsche, DPA",Banken - Frankfurt am Main. Deutsche Bank schränkt wegen Coronavirus Dienstreisen ein
2260,25.02.2020,"sueddeutsche, DPA",Gesundheit. Italien-Rückkehrer dürfen vier Wochen kein Blut spenden
2262,26.02.2020,"sueddeutsche, DPA",Konjunktur. Stürzt das Coronavirus Italien in die Rezession?
2263,25.02.2020,"sueddeutsche, DPA",Fußball. Coronavirus: Tischtennis-WM verschoben - Fußball ohne Fans
2264,26.02.2020,"sueddeutsche, DPA",Konjunktur - München. vbw: Coronavirus bremst Wirtschaftswachstum 2020 deutlich
2265,25.02.2020,"sueddeutsche, DPA",Krankheiten. Italien-Rückkehrer in Deutschland mit Coronavirus infiziert
2266,26.02.2020,"sueddeutsche, DPA",Krankheiten - Stuttgart. Kliniken zu Coronavirus: Erkranktes Personal wäre Problem
2268,26.02.2020,"sueddeutsche, DPA","Wissenschaft - Düsseldorf. Coronavirus erreicht NRW: ""Nicht in Panik verfallen"""
2269,26.02.2020,"sueddeutsche, DPA",Krankheiten - Stuttgart. Coronavirus-Patient in Göppingen stabil: Weltweit Kranke
2274,26.02.2020,"sueddeutsche, DPA",Krankheiten - Düsseldorf. Neue Coronavirus-Fälle in Deutschland: Behörden beraten sich
2275,26.02.2020,"sueddeutsche, DPA",Gesundheit - Schwerin. Gesundheitsminister sieht MV für Coronavirus gerüstet
2279,26.02.2020,"sueddeutsche, DPA",Krankheiten. Hannover Messe: Noch zu früh für mögliche Verschiebung
2280,26.02.2020,"sueddeutsche, DPA",Krankheiten. Coronavirus: Hannover Messe wartet erst ab
2282,26.02.2020,"sueddeutsche, DPA","Krankheiten - Tübingen. ""Patient Null"" aus Göppingen: Weitere Coronavirus-Fälle"
2284,26.02.2020,"sueddeutsche, DPA",Gesundheit - Wiesbaden. Gesundheitsminister: Täglich Verdachtsfälle auf Coronavirus
2286,26.02.2020,"sueddeutsche, DPA",Fußball. Shorttrack-WM abgesagt - Kein Training im Amateurfußball
2287,26.02.2020,"sueddeutsche, DPA",Gesundheit - Koblenz. Coronavirus-Infektion erstmals in Rheinland-Pfalz
2296,27.02.2020,"sueddeutsche, DPA",Luftverkehr - Frankfurt am Main. Lufthansa-Crews: Schutzmasken auch auf Italienflügen erlaubt
2298,27.02.2020,"sueddeutsche, DPA",Krankheiten. Trump: USA auf Coronavirus vorbereitet
2299,27.02.2020,"sueddeutsche, DPA",Krankheiten - Hannover. Landesregierung informiert im Internet über Coronavirus
2300,28.02.2020,"sueddeutsche, DPA",Bundesbank. Coronavirus: Bundesbank sieht zusätzliches Konjunkturrisiko
2304,27.02.2020,"sueddeutsche, DPA",Krankheiten - Berlin. Coronavirus-Prävention: Lübecker Spezialteam hilft Mongolei
2305,27.02.2020,"sueddeutsche, DPA",Gesundheit - Hannover. Coronavirus: Autozulieferer Conti begrenzt Reisen
2306,28.02.2020,"sueddeutsche, DPA","Gesundheit - Hannover. Hausärzte zu Coronavirus: ""Schutzmaterialien werden knapp"""
2311,28.02.2020,"sueddeutsche, DPA",Gesundheit.  Bei Coronainfektion: Isolation mit Hausmitteln
2312,28.02.2020,"sueddeutsche, DPA",Bob. Coronavirus: Landratsamt befragt Teilnehmer der Bob-WM
2314,28.02.2020,"sueddeutsche, DPA","Fußball - München. Coronavirus: FC Bayern stimmt ""Vorkehrungen"" mit Teamarzt ab"
2315,28.02.2020,"sueddeutsche, DPA",Krankheiten - München. Bayern plant Zukunft mit Coronavirus
2316,28.02.2020,"sueddeutsche, DPA",Tourismus. Reiserücktrittversicherung zahlt nicht bei Coronavirus-Angst
2317,28.02.2020,"sueddeutsche, DPA",Tourismus. Berliner Reisemesse ITB wegen Coronavirus abgesagt
2318,28.02.2020,"sueddeutsche, DPA",Krankheiten - Saarbrücken. Nach Coronavirus-Fall 17 Menschen in Quarantäne
2319,28.02.2020,"sueddeutsche, DPA","Gesundheit - Wetzlar. Corona-Fall in Wetzlar bestätigt: ""Kein Grund zur Panik"""
2320,28.02.2020,"sueddeutsche, DPA",Reisen. Virus-Folgen für die Wirtschaft werden deutlicher
2321,30.05.2020,"sueddeutsche, DPA",Gesundheit. USA beenden Zusammenarbeit mit WHO
2326,23.05.2020,"sueddeutsche, DPA",Wissenschaft. An Menschen getesteter Corona-Impfstoff zeigt kleine Erfolge
2327,22.05.2020,"sueddeutsche, DPA",Parlament. Peking will in Hongkong eigene Sicherheitsorgane einsetzen
2328,24.05.2020,"sueddeutsche, DPA","Konflikte. China warnt vor ""neuem Kalten Krieg"" mit USA"
2340,26.05.2020,"sueddeutsche, DPA",Gesundheit. Die Rolle der Kinder bei der Übertragung des Virus
2342,26.05.2020,"sueddeutsche, DPA",Gesundheit. Die Rolle der Kinder bei der Übertragung des Virus
2347,17.05.2020,"sueddeutsche, DPA",Gesundheit. Brasilianischer Bundesstaat hat mehr Corona-Tote als China
2354,21.05.2020,"sueddeutsche, DPA",Gesundheit. Corona-Verschwörungstheorien weltweit oft nur Randphänomen
2362,17.05.2020,"sueddeutsche, DPA",Gesundheit. Über 174.700 Nachweise in Deutschland - Aufatmen in Spanien
2367,07.05.2020,"sueddeutsche, DPA",Konjunktur. Chinas Exporte legen trotz Corona-Pandemie wieder zu
2368,08.05.2020,"sueddeutsche, DPA",Auto. Corona-Krise brockt Taxischreck Uber Milliardenverlust ein
2373,18.05.2020,"sueddeutsche, DPA",Gesundheit. Auch UN-Chef für Pandemie-Untersuchung - aber nicht jetzt
2375,07.05.2020,"sueddeutsche, DPA",Gesundheit. Corona-Krise verschärft Spannungen zwischen USA und China
2379,08.05.2020,"sueddeutsche, DPA",Außenhandel. Exporteinbruch von historischem Ausmaß
2384,08.05.2020,"sueddeutsche, DPA","Regierung - Wiesbaden. Regierungschef Bouffier sieht wieder ""Stunde Null"" gekommen"
2390,08.05.2020,"sueddeutsche, DPA",Gesundheit. Trump stimmt Amerikaner auf Wiedereröffnung des Landes ein
2396,03.05.2020,"sueddeutsche, DPA",Regierung. Wahlkampf: Trumps Irrlichtern in Zeiten von Corona
2400,01.05.2020,"sueddeutsche, DPA",Geheimdienste. Trump: Hinweise auf Corona-Ursprung in Labor in China
2407,04.05.2020,"sueddeutsche, DPA",Geheimdienste. Vorwurf Vertuschung: China sieht Ablenkungsmanöver der USA
2408,03.05.2020,"sueddeutsche, DPA",Geheimdienste. Schwere Vorwürfe gegen China wegen Corona-Krise
2409,04.05.2020,"sueddeutsche, DPA",Gesundheit. Trump rechnet mit Coronavirus-Impfstoff bis Jahresende
2416,04.05.2020,"sueddeutsche, DPA",EU. Die Welt verbündet sich gegen das Virus - nur die USA fehlen
2419,05.05.2020,"sueddeutsche, DPA",Krankheiten. Erster Corona-Fall in Frankreich wohl schon Ende Dezember
2424,06.05.2020,"sueddeutsche, DPA",Krankheiten. Wie verteilt sich das Virus?
2429,06.05.2020,"sueddeutsche, DPA",Gesundheit. Das Rätsel um die Corona-Wolke: Wie verteilt sich das Virus?
2440,13.05.2020,"sueddeutsche, DPA",Krankheiten. China verhängt erneut Corona-Beschränkungen für Großstadt
2453,14.05.2020,"sueddeutsche, DPA",Krankheiten. Trump will Schulen öffnen - entgegen Warnungen von Experten
2461,15.05.2020,"sueddeutsche, DPA",Krankheiten. Trump will USA für künftige Epidemien wappnen
2465,18.05.2020,"sueddeutsche, DPA",Krankheiten. Corona in Lateinamerika: Der neue Krisenherd
2466,19.05.2020,"sueddeutsche, DPA",Regierung. Trump nimmt Malaria-Medikament als Corona-Prophylaxe
2469,19.05.2020,"sueddeutsche, DPA",Gesundheit. Politiker-Fehltritte in der Corona-Krise
2478,19.05.2020,"sueddeutsche, DPA",EU. Auto-Anmeldungen in EU fallen wegen Corona auf ein Viertel
2479,19.05.2020,"sueddeutsche, DPA","Auto - Gauting. Autozulieferer Webasto erwartet ""zwei schwierige Jahre"""
2486,19.05.2020,"sueddeutsche, DPA",Krankheiten. Trump attackiert WHO - Länder für fairen Zugang zu Impfstoff
2496,21.05.2020,"sueddeutsche, DPA",Parlament. Peking plant eigenes Sicherheitsgesetz für Hongkong
2589,07.05.2021,"sueddeutsche, DPA",Welthandel. Chinas Außenhandel wächst im April überraschend stark
2609,12.05.2021,"sueddeutsche, DPA",Gesundheit. Experten: WHO und Länder waren bei Corona zu langsam
2628,16.05.2021,"sueddeutsche, DPA",Wissenschaft. Mangel an Versuchsaffen in Forschungseinrichtungen
2634,19.05.2021,"sueddeutsche, DPA",Parlament. USA verschärfen Kampf gegen anti-asiatische Hassverbrechen
2657,27.05.2021,"sueddeutsche, DPA",Gesundheit. Biden will Corona-Ursprung neu aufklären - China empört
2661,23.12.2021,"sueddeutsche, DPA","Olympia. Omikron: Pekings Olympia-Macher spüren ""gewaltigen Druck"""
2663,23.12.2021,"sueddeutsche, DPA",Gesundheit. Impfstoffe gegen Omikron: Was planen die Pharmaunternehmen?
2673,23.12.2021,"sueddeutsche, DPA",Jahreswechsel. Nach heftiger Peking-Kritik der Rodler: IOC will nachbessern
2678,23.12.2021,"sueddeutsche, DPA",Gesundheit. Impfstoffe gegen Omikron: Was planen die Pharmafirmen?
2683,23.12.2021,"sueddeutsche, DPA",Gesundheit. China: Lockdown für 13-Millionen-Stadt Xi'an
2688,27.12.2021,"sueddeutsche, DPA",Wissenschaft. China meldet höchste Coronazahl des Jahres
2714,09.12.2021,"sueddeutsche, DPA",Olympia. Problemspiele in Peking: Corona-Kampf und Boykott-Debatten
2736,01.12.2021,"sueddeutsche, DPA",Jahreswechsel. Wie lange noch von der Pandemie zur Endemie?
2757,07.12.2021,"sueddeutsche, DPA",Welthandel. China schraubt Wachstumsziel herunter - Außenhandel boomt
2855,29.12.2021,"sueddeutsche, DPA",Gesundheit. Eine einzige Touristin im Königreich Bhutan seit Corona
2876,29.11.2021,"sueddeutsche, DPA",Gesundheit. G7: Zugang zu Impfstoffen für Kampf gegen Omikron zentral
2906,16.11.2021,"sueddeutsche, DPA",Agrar - Malchin. Afrikanische Schweinepest: 4000 Schweine werden getötet
3003,19.11.2021,"sueddeutsche, DPA",Wissenschaft. Coronavirus kommt wahrscheinlich vom Tiermarkt in Wuhan
3047,28.11.2021,"sueddeutsche, DPA",Gesundheit. Immer mehr Nachweise: Was wir bislang über Omikron wissen
3051,28.11.2021,"sueddeutsche, DPA",Gesundheit. Omikron - Warum die WHO zwei Buchstaben übersprang
3054,20.12.2020,"sueddeutsche, DPA",Agrar - Teltow. Bauernverband: Hilfe für Schweinehalter in ASP-Risikogebiet
3058,22.12.2020,"sueddeutsche, DPA",Gesundheit - Rottweil. Landkreis Rottweil knapp unter 400er-Inzidenz: Lage diffus
3076,24.12.2020,"sueddeutsche, DPA",Geschichte. Kalenderblatt 2020: 25. Dezember
3090,08.12.2020,"sueddeutsche, DPA",Informationstechnologie - Mainz. Lewentz warnt vor Zunahme von Cyberangriffen auf Unternehmen
3092,28.12.2020,"sueddeutsche, DPA",Kriminalität. Aus Wuhan berichtet: Chinesin muss für vier Jahre in Haft
3096,09.12.2020,"sueddeutsche, DPA",Dienstleistungen - Frankfurt am Main. Frankfurter Messe macht dreistelligen Millionenverlust
3104,01.12.2020,"sueddeutsche, DPA",Tourismus. Rückblick auf ein außergewöhnliches Reisejahr
3132,02.12.2020,"sueddeutsche, DPA",Wissenschaft. Großbritannien will in wenigen Tagen mit Impfungen beginnen
3142,04.12.2020,"sueddeutsche, DPA",Gesundheit. Pfizer vermeldet Verzögerungen beim Ausbau der Lieferkette
3150,07.12.2020,"sueddeutsche, DPA","Welthandel. China erlebt Exportboom: Plus 21,1 Prozent"
3159,15.12.2020,"sueddeutsche, DPA",Konjunktur. Chinas Wirtschaftsaufschwung setzt sich fort
3191,30.12.2020,"sueddeutsche, DPA",Tourismus. So feiert die Welt 2020 Silvester
3198,20.11.2020,"sueddeutsche, DPA","Parteien. ""Wir können Wunder bewirken"": Grüne versprühen Optimismus"
3199,20.11.2020,"sueddeutsche, DPA",APEC. Asien-Pazifik-Gipfel: Trump trifft erstmals wieder Xi
3202,20.11.2020,"sueddeutsche, DPA",Wissenschaft. Zulassungsantrag für Corona-Impfstoff in den USA eingereicht
3204,21.11.2020,"sueddeutsche, DPA","International. Merkel ruft G20 zu ""globaler Kraftanstrengung"" auf"
3208,20.11.2020,"sueddeutsche, DPA",Wissenschaft - Mainz. Zulassungsantrag für Corona-Impfstoff in den USA eingereicht
3211,19.11.2020,"sueddeutsche, DPA","International. Chinas Präsident will ""Entkoppelung"" vermeiden"
3235,24.11.2020,"sueddeutsche, DPA",Brauchtum. Trump begnadigt Truthähne am Weißen Haus
3252,02.11.2020,"sueddeutsche, DPA",Konjunktur. Stimmung in Chinas Wirtschaft auf Zehn-Jahres-Hoch
3258,02.11.2020,"sueddeutsche, DPA",Agrar - Berlin. Schweinepest: Bauernverband fordert einheitliche Strategie
3262,03.11.2020,"sueddeutsche, DPA",EU. Eurozone fürchtet Rückschlag durch zweite Corona-Welle
3279,07.11.2020,"sueddeutsche, DPA",Konjunktur. Chinas Exporte legen überraschend stark zu
3290,09.11.2020,"sueddeutsche, DPA",Wissenschaft - Bremen. China: Deutsche Schweinshaxe als Grund für neuen Corona-Fall
3291,09.11.2020,"sueddeutsche, DPA",Wissenschaft. Neuer Corona-Fall in China durch deutsche Schweinshaxe?
3297,13.11.2020,"sueddeutsche, DPA",Wahlen. Biden gewinnt US-Wahl mit deutlichem Vorsprung
3299,09.11.2020,"sueddeutsche, DPA",Wissenschaft - Mainz. Biontech veröffentlicht Daten zu Corona-Impfstoff
3302,10.11.2020,"sueddeutsche, DPA",Industrie. Deutsche Industrie besorgt über Chinas neue Regeln
3306,14.11.2020,"sueddeutsche, DPA",Wahlen. Biden siegt auch in Georgia und baut Vorsprung aus
3310,16.11.2020,"sueddeutsche, DPA",Krankheiten. Fast ein Jahr Corona - In China kehrt die Normalität zurück
3478,15.10.2021,"sueddeutsche, DPA",International. Corona wirft Kampf gegen Tuberkulose um Jahre zurück
3529,30.10.2021,"sueddeutsche, DPA",G20. G20-Gipfel wird von zwei Topthemen dominiert
3531,22.10.2020,"sueddeutsche, DPA",Wissenschaft. Drei Haupttreiber für Corona-Pandemie
3535,23.10.2020,"sueddeutsche, DPA",Wahlen. Trumps und Bidens finales TV-Duell im Faktencheck
3538,22.10.2020,"sueddeutsche, DPA","Wahlen. Obama greift Trump an: ""Inkompetenz"" im Kampf gegen Pandemie"
3540,23.10.2020,"sueddeutsche, DPA",Wissenschaft. Forscher sehen drei Haupttreiber für Corona-Pandemie an
3551,20.10.2020,"sueddeutsche, DPA",Wahlen. Trump ruft zu Korruptionsermittlungen gegen Biden auf
3552,20.10.2020,"sueddeutsche, DPA",Gesundheit. Kampf gegen Corona führt zu massiven Einschränkungen
3560,26.10.2020,"sueddeutsche, DPA",Parteien. China will unabhängiger vom Rest der Welt werden
3563,13.10.2020,"sueddeutsche, DPA",Konjunktur. Chinas Außenhandel legt im September erneut deutlich zu 
3571,15.10.2020,"sueddeutsche, DPA",Gesundheit - Mannheim. Kretschmann mahnt nach VGH-Entscheidung Reiseverzicht an
3585,12.10.2020,"sueddeutsche, DPA",Landtag - Dresden. Experte empfiehlt mehr medizinisches Personal für Pandemien
3593,05.10.2020,"sueddeutsche, DPA",Tourismus. Luxus-Quarantäne für Langzeiturlauber in Thailand
3597,06.10.2020,"sueddeutsche, DPA",Agrar - Erfurt. Suchhund Nelli hilft bei Eindämmung der Schweinepest
3605,08.10.2020,"sueddeutsche, DPA",Regierung. Trump verspricht Covid-Behandlung mit Antikörper-Mitteln
3612,08.10.2020,"sueddeutsche, DPA",Außenhandel. Export-Erholung in kleinen Schritten
3620,01.10.2020,"sueddeutsche, DPA","Pharma - Ingelheim am Rhein. Boehringer Ingelheim hat ""Kandidaten"" im Kampf gegen Corona"
3622,02.10.2020,"sueddeutsche, DPA",Tennis. Kaum Turniere: Saison für Tennis-Damen fast zu Ende
3631,02.10.2020,"sueddeutsche, DPA",Regierung. Trumps Corona-Infektion und die möglichen Folgen
3634,10.10.2020,"sueddeutsche, DPA","Agrar - Berlin. Nach vier Wochen Schweinepest weiter ""kritische Phase"""
3640,10.10.2020,"sueddeutsche, DPA","Agrar. Bauern: Weiter ""kritische Phase"" bei Schweinepest"
3641,10.10.2020,"sueddeutsche, DPA",Regierung. Erster Auftritt seit Covid-Erkrankung: Trump warnt vor Biden
3645,11.10.2020,"sueddeutsche, DPA","Regierung. Trump will nun gegen Coronavirus ""immun"" sein"
3647,12.10.2020,"sueddeutsche, DPA",Agrar - Schwerin. Minister beruft Konferenz zur Afrikanischen Schweinepest ein
3668,19.10.2020,"sueddeutsche, DPA",Konjunktur. Chinas Wirtschaft legt weiter zu
3688,29.10.2020,"sueddeutsche, DPA",Konjunktur. Fünf-Jahres-Plan soll China unabhängiger machen
3689,30.10.2020,"sueddeutsche, DPA",Auto. Der Conti-Chef geht - wer kommt?
3738,17.04.2021,"sueddeutsche, DPA",Auto. Experten rechnen mit robustem Wachstum auf Chinas Automarkt
3739,17.04.2021,"sueddeutsche, DPA","Auto. Dudenhöffer: China ""große Lokomotive"" für deutsche Autobauer"
3785,12.04.2021,"sueddeutsche, DPA",Industrie - Berlin. Industrie sieht Aufwärtstrend zum Start der Hannover Messe
3789,12.04.2021,"sueddeutsche, DPA",Industrie. Industrie sieht Aufwärtstrend zum Start der Hannover Messe
3846,28.04.2021,"sueddeutsche, DPA",Diplomatie. Berlin und Peking wollen Kooperation vertiefen
3858,26.04.2020,"sueddeutsche, DPA",Gesundheit. Richtungsstreit über Vorgehen in Corona-Krise in den USA
3863,26.04.2020,"sueddeutsche, DPA",Gesundheit - Dresden. Weitere Corona-Lockerungen in Sachsen in Sicht
3865,26.04.2020,"sueddeutsche, DPA",Gesundheit - Langenhagen. Lieferung mit Schutzmasken am Flughafen Hannover angekommen
3868,27.04.2020,"sueddeutsche, DPA",Klima. Ruf nach Klimaschutz trotz Corona
3869,24.04.2020,"sueddeutsche, DPA","Gesundheit. Beweisen RKI-Zahlen, dass das Kontaktverbot überflüssig ist?"
3870,26.04.2020,"sueddeutsche, DPA",EU. EU wirft Russland und China Fake-News-Kampagnen vor
3881,27.04.2020,"sueddeutsche, DPA",Krankheiten - Zwickau. Professor in Südkorea: Ende der Corona-Pandemie in Sicht
3889,27.04.2020,"sueddeutsche, DPA",Klima. Klimaschutz in Corona-Zeiten - jetzt erst recht?
3891,18.04.2020,"sueddeutsche, DPA",Demonstrationen. Demokratiebewegung in Hongkong: Kritiker festgenommen
3892,19.04.2020,"sueddeutsche, DPA",Gesundheit - Erfurt. Mehr Corona-Tests in Altenpflege gefordert
3897,19.04.2020,"sueddeutsche, DPA",Gesundheit - Erfurt. Mehr Corona-Tests in Altenpflege gefordert
3898,19.04.2020,"sueddeutsche, DPA",Auto - Düsseldorf. Laschet will mehr Staatshilfen für die Autobranche
3899,19.04.2020,"sueddeutsche, DPA",Krankheiten. Laborleiter: Institut in Wuhan ist nicht Ursprung des Virus
3901,20.04.2020,"sueddeutsche, DPA",Öl. Ölpreise sinken weiter deutlich
3904,19.04.2020,"sueddeutsche, DPA",Fußball. Nach dreimonatiger Odyssee: Wuhan-Spieler zurück in Heimat
3905,19.04.2020,"sueddeutsche, DPA",Regierung. Trump greift China in Corona-Krise an
3911,15.04.2020,"sueddeutsche, DPA",Gesundheit. Trump dreht WHO mitten in Corona-Pandemie Geldhahn zu
3912,15.04.2020,"sueddeutsche, DPA","Gesundheit. Coronavirus: Hat es die WHO ""vermasselt""?"
3917,14.04.2020,"sueddeutsche, DPA",Börsen. Dax profitiert von Konjunkturdaten aus China
3919,14.04.2020,"sueddeutsche, DPA",Gesundheit. Die Welt im Corona-Dilemma: Vorsicht oder Normalbetrieb?
3924,14.04.2020,"sueddeutsche, DPA",Krankheiten. Corona global: Wie ein Virus die Welt verändert
3931,07.04.2020,"sueddeutsche, DPA","Krankheiten. Autos, Bier und Zigarren - Wer ""Corona"" alles im Namen trägt"
3939,08.04.2020,"sueddeutsche, DPA",Gesundheit - Stuttgart. FDP-Landeschef: Demokratie und Marktwirtschaft in Gefahr
3940,07.04.2020,"sueddeutsche, DPA",Krankheiten - Hamburg. Kontroverse Ausstiegsdebatte in Corona-Krise
3942,03.04.2020,"sueddeutsche, DPA",Sportartikel - Herzogenaurach. Puma will Dividende aussetzen und frisches Geld besorgen
3943,08.04.2020,"sueddeutsche, DPA",Wissenschaft. Therapie bringt Hoffnung für Covid-19-Patienten
3946,08.04.2020,"sueddeutsche, DPA",Wissenschaft - Erlangen. Therapie bringt Hoffnung für Corona-Patienten
3947,02.04.2020,"sueddeutsche, DPA",Gesundheit. Mehr als eine Million Coronavirus-Infektionen weltweit
3949,03.04.2020,"sueddeutsche, DPA",Gesundheit. Mehr als eine Million Coronavirus-Infektionen weltweit
3955,03.04.2020,"sueddeutsche, DPA",Börsen. Dax schwächelt nach US-Jobdaten
3956,03.04.2020,"sueddeutsche, DPA",Fußball. Premier League stoppt für unbestimmte Zeit
3958,03.04.2020,"sueddeutsche, DPA",Fußball. Premier-League-Fortsetzung in China?
3959,03.04.2020,"sueddeutsche, DPA",Sportartikel. Puma will Dividende aussetzen und frisches Geld besorgen
3967,02.04.2020,"sueddeutsche, DPA","Gesundheit. Trump: ""Greifen Virus an jeder Front an"""
3968,01.04.2020,"sueddeutsche, DPA",Krankheiten - Hoppstädten-Weiersbach. Bislang kein Corona-Fall in Klein-China im Hunsrück
3970,02.04.2020,"sueddeutsche, DPA",Konjunktur. Coronavirus: Deutsche Firmen in China kommen kaum in Schwung
3974,04.04.2020,"sueddeutsche, DPA",Transport. Zurück zu alter Stärke? Warenverkehr aus China legt zu
3976,04.04.2020,"sueddeutsche, DPA",Gesellschaft. China gedenkt der Coronavirus-Opfer mit drei Schweigeminuten
3984,06.04.2020,"sueddeutsche, DPA",Konjunktur. 2020 wie 2008? Was Corona- und Finanzkrise unterscheidet
4004,07.04.2020,"sueddeutsche, DPA",Krankheiten. UN-Sicherheitsrat soll erstmals zu Corona beraten
4005,06.04.2020,"sueddeutsche, DPA",Gesundheit. Weltweit bereits mehr als 70.000 Coronavirus-Tote
4007,08.04.2020,"sueddeutsche, DPA",Welthandel. Welthandel: WTO befürchtet Rückgang um bis zu 32 Prozent
4008,08.04.2020,"sueddeutsche, DPA",Gesundheit - Stuttgart. Autobauer Daimler verlängert Kurzarbeit bis Ende April
4013,08.04.2020,"sueddeutsche, DPA",Krankheiten. Donald Trump droht WHO mit Stopp von Beitragszahlungen
4015,08.04.2020,"sueddeutsche, DPA",Gesundheit. Weltweit bereits mehr als 82.000 Coronavirus-Tote
4016,08.04.2020,"sueddeutsche, DPA",Gesundheit. Mehr als 2000 Corona-Tote in Deutschland
4023,09.04.2020,"sueddeutsche, DPA",Krankheiten. Hinweise auf Übertragung von Coronavirus im Mutterleib
4025,10.04.2020,"sueddeutsche, DPA",Krankheiten. UN: Viren könnten als Terrorwaffe eingesetzt werden
4027,09.04.2020,"sueddeutsche, DPA",Außenhandel. Export im Februar noch leicht gestiegen
4029,10.04.2020,"sueddeutsche, DPA",Fußball. Stielike will Trainer-Karriere nach China-Engagement beenden
4031,10.04.2020,"sueddeutsche, DPA",Krankheiten - Mainz. Zwei Millionen Mund-Nasen-Schutzmasken geliefert
4032,11.04.2020,"sueddeutsche, DPA",Gesundheit. Raucher haben höheres Risiko für schweren Corona-Verlauf
4033,11.04.2020,"sueddeutsche, DPA",Wissenschaft. Studie: Coronavirus könnte auch das Nervensystem schädigen
4035,15.04.2020,"sueddeutsche, DPA",Auto - Emden. VW nimmt Autoproduktion noch im April wieder auf
4036,11.04.2020,"sueddeutsche, DPA",Gesundheit - Heidelberg. Expertin: Raucher haben Risiko für schweren Corona-Verlauf
4037,15.04.2020,"sueddeutsche, DPA",Fußball. Wie riskant sind Fußball-Geisterspiele in der Corona-Krise?
4042,16.04.2020,"sueddeutsche, DPA",Regierung. Trump droht Kongress in Corona-Krise mit Zwangspause
4046,15.04.2020,"sueddeutsche, DPA",Auto. VW nimmt Autoproduktion noch im April wieder auf
4051,17.04.2020,"sueddeutsche, DPA",Krankheiten. Wuhan korrigiert Zahlen: Rund 50 Prozent mehr Corona-Tote
4055,16.04.2020,"sueddeutsche, DPA",Krankheiten. Drosten: Virus wird sich gleichmäßiger im Land verteilen
4068,17.04.2020,"sueddeutsche, DPA","Konjunktur. Chinas Wirtschaft bricht um 6,8 Prozent ein"
4069,21.04.2020,"sueddeutsche, DPA",Auto. Opel-Mutterkonzern PSA mit Umsatzeinbruch
4070,21.04.2020,"sueddeutsche, DPA",Auto - Eisenach. Opel-Mutterkonzern PSA: Umsatzeinbruch und düstere Prognose
4072,20.04.2020,"sueddeutsche, DPA",Regierung. Trump lobt Corona-Demonstranten
4078,20.04.2020,"sueddeutsche, DPA",Krankheiten - Erlangen. Corona in der Schwangerschaft: Vereinzelt Komplikationen
4080,21.04.2020,"sueddeutsche, DPA",Migration. Trump will Einwanderung in die USA zeitweise aussetzen
4081,21.04.2020,"sueddeutsche, DPA",Regierung. Trump: Ausreichend Tests für Lockerung von Corona-Maßnahmen
4084,22.04.2020,"sueddeutsche, DPA",Regierung. Wegen Corona-Ausbreitung: US-Staat Missouri verklagt China
4092,22.04.2020,"sueddeutsche, DPA",Forschung - Heidelberg. Forscher untersuchen Corona-Infektionen bei Kindern
4097,23.04.2020,"sueddeutsche, DPA",Krankheiten. Luftverschmutzung und Corona-Verlauf: Ein Zusammenhang?
4099,28.04.2020,"sueddeutsche, DPA",Maschinenbau - Frankfurt am Main. Kion mit deutlichem Gewinnrückgang wegen Corona
4101,28.04.2020,"sueddeutsche, DPA","Gesundheit. Trump hofft auf ""spektakuläre"" Erholung der US-Wirtschaft"
