Dokument-ID,Datum,Quelle,Titel
7,24.07.2020,"sueddeutsche, DPA",Börsen. Dax nach Gewinnmitnahmen vor neuer Belastungsprobe
14,26.07.2020,"sueddeutsche, DPA",Krankheiten - München. Impfung stärkste Waffe gegen Corona
21,27.07.2020,"sueddeutsche, DPA",Gesundheit. Corona-Spätfolgen alarmieren Ärzte
23,27.07.2020,"sueddeutsche, DPA","Gesundheit. ""Milchglasmuster"": Corona-Spätfolgen alarmieren Ärzte"
26,23.07.2020,"sueddeutsche, DPA",Gesundheit - Magdeburg. Unimedizin Magdeburg sucht Coronaantikörper bei Blutspendern
30,29.07.2020,"sueddeutsche, DPA",Krankheiten. Corona-Fälle in China steigen wieder
31,27.07.2020,"sueddeutsche, DPA",Fußball. Stielike-Club Tianjin unterliegt Shanghai
39,29.07.2020,"sueddeutsche, DPA",Wirtschaftspolitik. Corona-Krise: Deutsche Firmen in China leiden
62,13.07.2020,"sueddeutsche, DPA",Maschinenbau - Frankfurt am Main. Kion profitiert vom Online-Boom - aber weniger Gabelstapler
67,14.07.2020,"sueddeutsche, DPA",Gesundheit. Spahn warnt vor zweiter Corona-Welle
74,12.07.2020,"sueddeutsche, DPA",Gesundheit. Höchstwert bei Infektionen: 230.000 neue Corona-Fälle
78,03.07.2020,"sueddeutsche, DPA",Tiere. Wenn der Kater Corona hat: Meldepflicht für Haustiere kommt
79,03.07.2020,"sueddeutsche, DPA",Tourismus. Deutsche müssen in England bald nicht mehr in Quarantäne
96,07.07.2020,"sueddeutsche, DPA",EU. Großteil gefährlicher Produkte sind Spielsachen für Kinder
104,09.07.2020,"sueddeutsche, DPA",Außenhandel. Viel Schatten und ein wenig Licht für deutschen Export
113,08.07.2020,"sueddeutsche, DPA",Gesundheit. USA treten aus Weltgesundheitsorganisation aus
122,10.07.2020,"sueddeutsche, DPA","Kriminalität. Elfenbein, Schuppen, Tropenholz: Der Schmuggel boomt"
131,14.07.2020,"sueddeutsche, DPA",Konjunktur. Chinas Außenhandel wächst unerwartet stark
156,21.07.2020,"sueddeutsche, DPA",Krankheiten - Essen. Antikörper gegen Coronaviren sorgen vermutlich für Immunität
161,21.07.2020,"sueddeutsche, DPA",Gesellschaft - Hamburg. Corona-Krise: Brosda hofft auf positive Veränderungen
162,21.07.2020,"sueddeutsche, DPA",Krankheiten. Antikörper bieten vermutlich längerfristig Corona-Immunität
163,18.07.2020,"sueddeutsche, DPA",Sportpolitik. Olympische Sorgenfälle: IOC klammert sich an Tokio-Hoffnung
166,21.07.2020,"sueddeutsche, DPA",Gesundheit. Antikörper bieten vermutlich längerfristig Immunität
173,22.07.2020,"sueddeutsche, DPA","Krankheiten - München. Lehren aus Corona: Gesundheitssystem benötigt ""Resilenz"""
176,21.07.2020,"sueddeutsche, DPA",Gesundheit. Nach schlechten Umfragewerten: Trump wirbt für Mundschutz
181,22.07.2020,"sueddeutsche, DPA",Regierung. Trump schlägt in Corona-Pandemie pessimistischere Töne an
213,30.07.2021,"sueddeutsche, DPA",Krankheiten. Über 200 Infizierte nach Ausbruch an chinesischem Flughafen
243,22.07.2021,"sueddeutsche, DPA",Wissenschaft. China lehnt WHO-Pläne für Laborinspektionen ab
278,15.07.2021,"sueddeutsche, DPA",Gesundheit. Corona-Impfungen: Deutschland setzt auf mehr Tempo
279,16.07.2021,"sueddeutsche, DPA","Olympia. Virologin zu sicheren Spielen: ""Davon gehe ich absolut aus"""
297,06.07.2021,"sueddeutsche, DPA",Tiere. Mäuse und Menschenaffen: Tiere und das Corona-Risiko
306,05.07.2021,"sueddeutsche, DPA","Tiere. Mäuse, Affen, Pelztierzucht? - Tiere und das Corona-Risiko"
334,09.07.2021,"sueddeutsche, DPA",Olympia. Japan will mit Olympia Stärke beweisen
355,18.07.2021,"sueddeutsche, DPA",Agrar - Berlin. Afrikanische Schweinepest befällt noch mehr Hausschweine
357,17.07.2021,"sueddeutsche, DPA",Agrar - Letschin. Vier weitere Hausschweine in Brandenburg mit Schweinepest
362,17.07.2021,"sueddeutsche, DPA",Tiere - Greifswald. Expertin: Impfstoff gegen Schweinepest dauert noch Jahre
364,18.07.2021,"sueddeutsche, DPA",Tiere. Afrikanische Schweinepest befällt noch mehr Hausschweine
387,25.07.2021,"sueddeutsche, DPA",Krankheiten. Über das Delta-Ansteckungsrisiko im Freien
434,30.01.2020,"sueddeutsche, DPA",Tischtennis. Chinas Tischtennis-Stars vor Deutschland-Reise untersucht
437,30.01.2020,"sueddeutsche, DPA",Krankheiten - Waldachtal. Fischer schickt gegen Corona-Virus Schutzmasken nach China
438,30.01.2020,"sueddeutsche, DPA",Tourismus. Bei ausgefallenen China-Reisen bekommen Kunden Geld zurück
444,30.01.2020,"sueddeutsche, DPA",Krankheiten - München. Bayerns Ärzte: auf weitere Coronavirus-Fälle vorbereiten
451,30.01.2020,"sueddeutsche, DPA",Wissenschaft - Erfurt. Neues Coronavirus sorgt für erste Verdachtsfälle
454,30.01.2020,"sueddeutsche, DPA",Gesundheit - Potsdam. Coronavirus: Keine Infektion in Brandenburg bekannt
456,30.01.2020,"sueddeutsche, DPA",Börsen. Dax schließt im Minus
461,30.01.2020,"sueddeutsche, DPA",Wissenschaft - Stuttgart. Behörden zum Coronavirus: Eine Panik ist total unangebracht
467,29.01.2020,"sueddeutsche, DPA",Krankheiten - Trier. Wegen Ausreisestopp: Weniger Chinesen im Karl-Marx-Haus
469,29.01.2020,"sueddeutsche, DPA",Krankheiten - München. Kontaktpersonen-Liste der Coronavirus-Patienten erweitert
473,28.01.2020,"sueddeutsche, DPA","Krankheiten - Frankfurt am Main. Messe ""Ambiente"": Bisher keinen Einbruch wegen Coronavirus"
478,28.01.2020,"sueddeutsche, DPA",Börsen. Dax erholt sich
479,28.01.2020,"sueddeutsche, DPA",Börsen. Dax erholt sich - Skepsis bleibt
480,28.01.2020,"sueddeutsche, DPA",Krankheiten - Kiel. Bislang in Schleswig-Holstein keine Coronavirus-Fälle
481,28.01.2020,"sueddeutsche, DPA",Krankheiten - Stuttgart. Bislang kein Nachweis des Coronavirus aus China
482,28.01.2020,"sueddeutsche, DPA",Krankheiten - Gauting. Gemeinde Gauting: Keine weiteren Schritte wegen Coronavirus
484,28.01.2020,"sueddeutsche, DPA",Krankheiten. Chinesen sollen jetzt auch nicht mehr ins Ausland reisen
487,28.01.2020,"sueddeutsche, DPA",Krankheiten - Hamburg. Coronavirus: Uni Hamburg untersagt Dienstreisen nach China
489,28.01.2020,"sueddeutsche, DPA","Krankheiten. Labortests, Isolierung, Flughäfen: So reagiert Deutschland"
490,28.01.2020,"sueddeutsche, DPA",Krankheiten - München. Coronavirus in Deutschland: 33-Jähriger in Bayern infiziert
491,28.01.2020,"sueddeutsche, DPA",Börsen. Virus-Angst vergrault Anleger in New York
493,28.01.2020,"sueddeutsche, DPA",Krankheiten. Coronavirus-Fall in Deutschland - mehr als 100 Tote in China
496,28.01.2020,"sueddeutsche, DPA",Krankheiten - München. Kreise: Coronavirus-Patient bei chinesischem Gast angesteckt
498,28.01.2020,"sueddeutsche, DPA",Wissenschaft. Coronavirus 2019-nCoV: Was man darüber weiß - und was nicht
499,28.01.2020,"sueddeutsche, DPA",Krankheiten. Coronavirus-Patient steckte sich bei chinesischem Gast an
500,28.01.2020,"sueddeutsche, DPA",Krankheiten. USA raten wegen Coronavirus von Reisen nach China ab
503,28.01.2020,"sueddeutsche, DPA",Krankheiten - Berlin. Spahn nach Coronavirus-Fall in Bayern: Sind gut vorbereitet
504,25.01.2020,"sueddeutsche, DPA",Krankheiten. Chinas Präsident Xi sieht ernste Herausforderung durch Virus
505,28.01.2020,"sueddeutsche, DPA",Krankheiten. Erster Coronavirus-Fall in Deutschland bestätigt
511,26.01.2020,"sueddeutsche, DPA",Krankheiten. Zahl der Virus-Toten in China steigt auf 56
512,26.01.2020,"sueddeutsche, DPA",Krankheiten. China zieht die Notbremse
513,25.01.2020,"sueddeutsche, DPA",Wissenschaft. Coronavirus erreicht Europa
514,26.01.2020,"sueddeutsche, DPA",Krankheiten. Zahl der Virus-Toten in China steigt weiter
516,26.01.2020,"sueddeutsche, DPA",Krankheiten. Bürgermeister Wuhan: Infektionszahl könnte um 1000 steigen
517,26.01.2020,"sueddeutsche, DPA",Krankheiten. Coronavirus: Schulen und Unis in Peking bleiben geschlossen
518,26.01.2020,"sueddeutsche, DPA",Krankheiten. Zahl der Virus-Toten steigt - China verschärft Maßnahmen
521,26.01.2020,"sueddeutsche, DPA",Fußball. Chinesische Sportverbände reagieren auf Coronavirus
522,26.01.2020,"sueddeutsche, DPA",Krankheiten. Entwarnung nach Corona-Test: Mann aus Peine nicht infiziert
527,23.01.2020,"sueddeutsche, DPA",Krankheiten. Chinesische Städte wegen Virus abgeriegelt
528,25.01.2020,"sueddeutsche, DPA",Krankheiten - Freising. Schutzmaßnahmen gegen Coronavirus in Bayern unverändert
530,24.01.2020,"sueddeutsche, DPA",Krankheiten. Lungenkrankheit: Sieben neue Todesopfer in China
531,26.01.2020,"sueddeutsche, DPA",Krankheiten. WHO Europa: Jedes Land muss auf Coronavirus vorbereitet sein
540,24.01.2020,"sueddeutsche, DPA",Krankheiten. Erstmals Fälle von neuer Lungenkrankheit in Vietnam
541,23.01.2020,"sueddeutsche, DPA","Krankheiten. WHO: Keine ""internationale Notlage"" wegen Virus in China"
544,21.01.2020,"sueddeutsche, DPA",Krankheiten - Stuttgart. Land sieht sich für Coronavirus gewappnet
545,22.01.2020,"sueddeutsche, DPA",Krankheiten. Lungenkrankheit: Zahl der Infektionen in China steigt
549,21.01.2020,"sueddeutsche, DPA",Krankheiten. Neues Virus in China: Erster Fall in USA nachgewiesen
553,22.01.2020,"sueddeutsche, DPA",Krankheiten. Zwei weitere Fälle von neuer Lungenkrankheit in Thailand
556,22.01.2020,"sueddeutsche, DPA",Krankheiten. Lungenkrankheit: Zahl der Fälle in China steigt auf 473
560,22.01.2020,"sueddeutsche, DPA",Krankheiten - Rostock. Coronavirus: Rostocker Mediziner fordert Umsicht
561,22.01.2020,"sueddeutsche, DPA",Krankheiten - Freising. Bayerns Behörden beobachten Lungenkrankheit in China
569,19.01.2020,"sueddeutsche, DPA",Krankheiten. Immer mehr Fälle mit mysteriöser Lungenkrankheit in China
570,18.01.2020,"sueddeutsche, DPA",Krankheiten. Vier neue Fälle der rätselhaften Lungenkrankheit in China
610,09.01.2020,"sueddeutsche, DPA",Gesundheit. Neues Virus hinter Lungenkrankheit in China
611,09.01.2020,"sueddeutsche, DPA",Gesundheit. Neuer Virustyp hinter Lungenkrankheit in China entdeckt
638,06.01.2020,"sueddeutsche, DPA",Gesundheit. WHO beobachtet mysteriöse Lungenkrankheit in China
639,06.01.2020,"sueddeutsche, DPA",Gesundheit. Bereits 59 Fälle von rätselhafter Lungenkrankheit in China
706,16.01.2020,"sueddeutsche, DPA",Gesundheit. Chinesisches Coronavirus auch in Japan nachgewiesen
711,17.01.2020,"sueddeutsche, DPA",Krankheiten. Zweiter Todesfall durch Lungenkrankheit in China
713,20.01.2020,"sueddeutsche, DPA",Krankheiten. Lungenkrankheit in China: Sprunghafter Anstieg der Fälle
720,19.01.2020,"sueddeutsche, DPA",Krankheiten. China: Ausmaß mysteriöser Lungenkrankheit größer als gedacht
725,21.01.2020,"sueddeutsche, DPA",Krankheiten. Lungenkrankheit - weiterer Todesfall in China 
726,20.01.2020,"sueddeutsche, DPA",Krankheiten. Neues Virus in China wird von Mensch zu Mensch übertragen
731,20.01.2020,"sueddeutsche, DPA",Krankheiten. Virus in China verbreitet sich von Mensch zu Mensch
738,21.01.2020,"sueddeutsche, DPA",Krankheiten. Droht eine neue Pandemie?
742,21.01.2020,"sueddeutsche, DPA",Börsen. Dax schließt knapp im Plus
743,21.01.2020,"sueddeutsche, DPA",Börsen. Dax im Plus trotz Sorgen um Lungenvirus in China
747,22.01.2020,"sueddeutsche, DPA",Krankheiten. Neues Virus: Deutlich mehr Tote in China - Erster Fall in USA
748,22.01.2020,"sueddeutsche, DPA",Krankheiten. Neues Virus: Mehr Tote in China - Erster Fall in USA
753,22.01.2020,"sueddeutsche, DPA",Krankheiten. Lungenkrankheit in China: Droht ein zweites Sars?
754,22.01.2020,"sueddeutsche, DPA",Krankheiten. Einwohner sollen Wuhan ohne wichtigen Grund nicht verlassen
755,21.01.2020,"sueddeutsche, DPA",Krankheiten - Wuhan. Lungenkrankheit in China: Reisende werden aufgeklärt
756,23.01.2020,"sueddeutsche, DPA",Brauchtum. China begrüßt das Jahr der Ratte im Krisenmodus
757,23.01.2020,"sueddeutsche, DPA",Krankheiten. Lungenkrankheit: China kappt Verkehr aus Wuhan
761,23.01.2020,"sueddeutsche, DPA",Krankheiten. Impfstoff gegen Coronavirus wohl frühestens in einem Jahr
762,23.01.2020,"sueddeutsche, DPA",Wissenschaft. Coronavirus: Experten vermuten 4000 Infizierte in Wuhan
763,22.01.2020,"sueddeutsche, DPA","Krankheiten. Vorerst keine ""internationale Notlage"" wegen Virus in China"
764,23.01.2020,"sueddeutsche, DPA",Krankheiten. Coronavirus aus China: Fieberkontrollen am Flughafen Rom
766,23.01.2020,"sueddeutsche, DPA",Krankheiten. Zahl der Fälle der Lungenkrankheit in China steigt auf 620
771,23.01.2020,"sueddeutsche, DPA",Krankenhäuser. Was über das Corona-Virus bislang bekannt ist
772,23.01.2020,"sueddeutsche, DPA","Krankheiten. Lungenkrankheit macht Wuhan zur ""Geisterstadt"""
777,23.01.2020,"sueddeutsche, DPA",Krankheiten. Lungenkrankheit: Kaiserpalast in Peking schließt für Besucher
779,24.01.2020,"sueddeutsche, DPA",Gesundheit. Experte: Kein Grund zur Corona-Panik - auch auf Reisen
782,24.01.2020,"sueddeutsche, DPA",Tourismus. Lungenkrankheit in China: Was Reisende wissen müssen
785,24.01.2020,"sueddeutsche, DPA",Krankheiten - Hamburg. Hamburg fühlt sich für Coronavirus gewappnet
786,24.01.2020,"sueddeutsche, DPA","Krankheiten. Virus vermasselt Neujahrsfest: ""Die Stimmung ist schlecht"""
788,24.01.2020,"sueddeutsche, DPA",Börsen. Dax tütet Wochenplus ein - Rekordhoch im Blick
790,24.01.2020,"sueddeutsche, DPA","Krankheiten - Würzburg. Tropenmediziner zu besorgten Bürgern: ""sind gut gerüstet"""
794,24.01.2020,"sueddeutsche, DPA",Wissenschaft - Marburg. Marburger Forscher suchen Impfstoff gegen Coronavirus
799,24.01.2020,"sueddeutsche, DPA",Krankheiten. Coronavirus erreicht Europa: Zwei Fälle in Frankreich
802,25.01.2020,"sueddeutsche, DPA",Krankheiten. Neue Lungenkrankheit: Wie wird in Deutschland geprüft?
804,25.01.2020,"sueddeutsche, DPA",Krankheiten. Der Test auf das neue Coronavirus
806,25.01.2020,"sueddeutsche, DPA",Wissenschaft. Coronavirus breitet sich immer weiter aus
817,27.01.2020,"sueddeutsche, DPA",Krankheiten - Freising. Coronavirus: Bislang ein unbestätigter Fall in Bayern
818,27.01.2020,"sueddeutsche, DPA","Krankheiten. RKI zu neuem Coronavirus: Gefahr in Deutschland ""sehr gering"""
823,27.01.2020,"sueddeutsche, DPA",Krankheiten - Frankfurt am Main. Uni-Kliniken: Kein Coronavirus bei getesteten Patienten
826,27.01.2020,"sueddeutsche, DPA",Krankheiten - Frankfurt am Main. Sozialminister: Erhöhte Aufmerksamkeit für Coronavirus
828,27.01.2020,"sueddeutsche, DPA",Krankheiten - Stuttgart. Bisher keine Fälle des Coronavirus im Südwesten
829,27.01.2020,"sueddeutsche, DPA",Krankheiten. Etwa 90 Deutsche im Raum Wuhan - Berlin prüft Evakuierung
830,27.01.2020,"sueddeutsche, DPA",Gesundheit - Potsdam. Nonnemacher zu Coronavirus: Brandenburg vorbereitet
832,27.01.2020,"sueddeutsche, DPA",Tourismus. China kappt zahlreiche Überlandverbindungen
834,27.01.2020,"sueddeutsche, DPA",Tourismus. Veranstalter: China-Reisende können umbuchen oder stornieren
835,27.01.2020,"sueddeutsche, DPA",Börsen. Dax rutscht wegen Virus und Ifo-Daten deutlich ab
841,27.01.2020,"sueddeutsche, DPA",Krankheiten - Iserlohn. Polizei riegelt Schule wegen Coronavirus-Verdacht ab
843,27.01.2020,"sueddeutsche, DPA",Industrie - Gauting. Auch Webasto verhängt Reiseverbot nach China
849,28.01.2020,"sueddeutsche, DPA",Luftverkehr - Frankfurt am Main. Coronavirus: Leichter Buchungsrückgang bei Lufthansa
850,28.01.2020,"sueddeutsche, DPA",Krankheiten - Schwerin. Krankenkasse schaltet Hotline zu Corona-Virus
853,28.01.2020,"sueddeutsche, DPA",Software - Walldorf. Coronavirus: Chinesische SAP-Mitarbeiter bleiben zu Hause
857,28.01.2020,"sueddeutsche, DPA",Krankheiten. Ungewissheit bei Deutschen in Wuhan
858,28.01.2020,"sueddeutsche, DPA",Wissenschaft. Coronavirus in Deutschland: Muss ich mich schützen?
862,28.01.2020,"sueddeutsche, DPA",Gesundheit - Erfurt. Gesundheitsministerin: Geringe Gefahr durch Coronavirus
865,28.01.2020,"sueddeutsche, DPA",Gesundheit - Heidelberg. Rückkehrer aus China in Heidelberg auf Coronavirus geprüft
866,28.01.2020,"sueddeutsche, DPA",Krankheiten - Gauting. Coronavirus: Keine Gäste aus China mehr bei Webasto
868,28.01.2020,"sueddeutsche, DPA",Krankheiten - Hamburg. Coronavirus: Hamburg sieht sich gut aufgestellt
875,28.01.2020,"sueddeutsche, DPA",Krankheiten - Greifswald. Coronavirus: MV-Kliniken bereiten sich auf Krankheit vor
877,28.01.2020,"sueddeutsche, DPA",Konjunktur. Coronavirus belastet Wirtschaft
878,28.01.2020,"sueddeutsche, DPA",Krankheiten. Hilft Mundschutz gegen das Coronavirus? Das sagen Experten
879,28.01.2020,"sueddeutsche, DPA",Krankheiten - München. Coronavirus in Deutschland: Vier Leute in Bayern infiziert
880,28.01.2020,"sueddeutsche, DPA",Gesundheit - Hannover. Coronavirus-Verdachtsfälle werden in Hannover geprüft
882,28.01.2020,"sueddeutsche, DPA",Krankheiten. Vier Coronavirusfälle in Deutschland
883,28.01.2020,"sueddeutsche, DPA",Senat - Berlin. Gesundheitssenatorin: Wir sind in Berlin gut aufgestellt
889,28.01.2020,"sueddeutsche, DPA",Krankheiten. Von Wuhan nach Stockdorf: Coronavirus erreicht Deutschland
892,29.01.2020,"sueddeutsche, DPA",Krankheiten - Bremerhaven. Coronavirus: Verdachtsfall in Bremerhaven
893,29.01.2020,"sueddeutsche, DPA","Krankheiten - Berlin. Spahn: ""Wachsame Gelassenheit"" wegen Coronavirus"
895,29.01.2020,"sueddeutsche, DPA",Krankheiten. Corona-Virus im Labor in Australien nachgezüchtet
896,29.01.2020,"sueddeutsche, DPA",Konjunktur - Nürnberg. GfK: Konsumklima zieht nach Herbstflaute wieder an
898,29.01.2020,"sueddeutsche, DPA",Krankheiten - Siegen. Coronavirus-Verdachtsfall im Kreis Siegen-Wittgenstein
901,29.01.2020,"sueddeutsche, DPA",Krankheiten. Was passiert bei einem Virus-Verdachtsfall in Deutschland?
903,29.01.2020,"sueddeutsche, DPA",Motorsport. Formel 1 beobachtet Lage in China wegen Coronavirus
905,29.01.2020,"sueddeutsche, DPA",Krankheiten - Kiel. China-Besuche: Schleswig-Holsteiner in häuslicher Isolation
907,29.01.2020,"sueddeutsche, DPA",Ski alpin. Wegen Coronavirus: Ski-Olympia-Test in China abgesagt
908,29.01.2020,"sueddeutsche, DPA","Gesundheit - Frankfurt am Main. Hessen ""gut aufgestellt"" für Coronavirus"
912,29.01.2020,"sueddeutsche, DPA","Krankheiten - Dresden. Köpping rechnet mit Coronavirus-Fällen: ""Sind vorbereitet"""
915,29.01.2020,"sueddeutsche, DPA",Gesundheit - Hannover. Coronavirus-Verdachtsfälle in Niedersachsen werden abgeklärt
918,29.01.2020,"sueddeutsche, DPA",Krankheiten. Coronavirus breitet sich weiter aus
919,29.01.2020,"sueddeutsche, DPA",Tourismus - Schwangau. Schloss Neuschwanstein: Weniger Tourismus wegen Coronavirus
920,29.01.2020,"sueddeutsche, DPA",Krankheiten - München. Huml: Zurückgeflogene aus Wuhan sollen in Quarantäne
921,29.01.2020,"sueddeutsche, DPA",Gesundheit - Hannover. Coronavirus-Verdachtsfälle in Niedersachsen werden abgeklärt
923,29.01.2020,"sueddeutsche, DPA",Gesundheit - Wiesbaden. Coronavirus: Frankfurt erwartet Evakuierungsflug aus China
931,29.01.2020,"sueddeutsche, DPA",Ski alpin. Angst geht um: Coronavirus-Auswirkungen auf den Sport
940,30.01.2020,"sueddeutsche, DPA",Krankheiten - Potsdam. Coronavirus: Zweiter Verdachtsfall wird geprüft
941,30.01.2020,"sueddeutsche, DPA",Wissenschaft. Coronavirus: Thailändische Forscher überprüfen Fledermäuse
944,30.01.2020,"sueddeutsche, DPA",Krankheiten - München. Bayern wappnet sich für weitere Coronavirus-Fälle
949,30.01.2020,"sueddeutsche, DPA",Krankheiten. Coronavirus in China: WHO erklärt internationale Notlage
950,30.01.2020,"sueddeutsche, DPA",Krankheiten. Coronavirus und Bill Gates: Falschbehauptungen im Umlauf
953,30.01.2020,"sueddeutsche, DPA",Krankheiten. Wie die Welt das Sars-Virus erfolgreich bekämpfte
955,30.01.2020,"sueddeutsche, DPA",Krankheiten. Mehr Infektionen durch neues Coronavirus als bei Sars
957,30.01.2020,"sueddeutsche, DPA",Krankheiten - München. Fünfter Coronavirus-Fall: Bayern wappnet sich für weitere
961,30.01.2020,"sueddeutsche, DPA",Forschung - Marburg. Marburger Forscher suchen Impfstoff gegen Coronavirus
962,30.01.2020,"sueddeutsche, DPA",Krankheiten. WHO erklärt Gesundheitsnotstand wegen Coronavirus
1001,25.06.2021,"sueddeutsche, DPA",Gesundheit. Corona-Infektionen schon weit vor erstem Nachweis
1014,12.06.2021,"sueddeutsche, DPA","G7. G7 will ärmeren Ländern mit 2,3 Milliarden Impfdosen helfen"
1022,05.06.2021,"sueddeutsche, DPA",Wissenschaft. Drosten: Plausibelste Quelle für Corona ist Pelzindustrie
1038,01.06.2021,"sueddeutsche, DPA",Gesundheit. Keine Diskriminierung: Neutrale Namen für Corona-Varianten
1062,09.06.2021,"sueddeutsche, DPA",Krankheiten. Drosten befürchtet nachlassende Impfbereitschaft
1067,08.06.2021,"sueddeutsche, DPA","Olympia. Tokio-Spiele: ""Fackel der Hoffnung"" oder ""nicht normal"""
1072,09.06.2021,"sueddeutsche, DPA",Krankheiten. Drosten befürchtet nachlassende Impfbereitschaft
1080,10.06.2021,"sueddeutsche, DPA",G7. Johnson schlägt Spende von einer Milliarde Impfdosen vor
1089,11.06.2021,"sueddeutsche, DPA",G7. G7 rückt zusammen: Impfstoffspende als Aufbruchssignal
1102,16.06.2021,"sueddeutsche, DPA",Messen - München. Messen zuversichtlich für Neustart: IAA wohl mit FFP2-Masken
1129,29.06.2021,"sueddeutsche, DPA",Brauchtum - Großrosseln. Kinder schreiben viel: Schon 2000 Briefe an den Nikolaus
1133,29.06.2021,"sueddeutsche, DPA",Brauchtum. Kinder schreiben viel: Schon 2000 Briefe an den Nikolaus
1142,23.06.2020,"sueddeutsche, DPA",Krankheiten - Berlin. Männer sterben häufiger als Frauen an Covid-19
1151,23.06.2020,"sueddeutsche, DPA",Gesundheit. Covid-19: Rätsel um höheres Sterberisiko für Männer
1157,24.06.2020,"sueddeutsche, DPA",Gesundheit. Machen Mutationen Sars-CoV-2 gefährlicher?
1168,15.06.2020,"sueddeutsche, DPA",Gesundheit. Drei Beamte nach neuem Corona-Ausbruch in China entlassen
1173,15.06.2020,"sueddeutsche, DPA",Motorsport. Funktionär: Formel 1 erwägt China-Doppelpack im Herbst
1177,15.06.2020,"sueddeutsche, DPA",Wissenschaft. Corona-Hotspots mit ähnlicher Spanne bei Klimaelementen
1178,16.06.2020,"sueddeutsche, DPA","Kabinett - München. Kontakte, Feiern, Katastrophenfall: Lockerungen in Bayern"
1188,17.06.2020,"sueddeutsche, DPA",Krankheiten. Corona-Ausbruch: Peking wird teilweise abgeriegelt
1189,07.06.2020,"sueddeutsche, DPA",Konjunktur. Corona-Krise lässt Chinas Außenhandel einbrechen
1192,16.06.2020,"sueddeutsche, DPA",Tiere. Wenn der Kater Corona hat: Meldepflicht für Haustiere kommt
1195,01.06.2020,"sueddeutsche, DPA",Wirtschaft. Flug der deutschen Wirtschaft nach China: Infektionsfall
1200,07.06.2020,"sueddeutsche, DPA","Gesundheit. Gesundheitsminister Spahn für ""Gesundheits-Nato"""
1208,01.06.2020,"sueddeutsche, DPA",Krankheiten. Trotz Sorgen vor zweiter Corona-Welle: Lockerungen weltweit
1209,02.06.2020,"sueddeutsche, DPA",Krankheiten. Zehn Millionen Menschen in Wuhan getestet - Kaum Infizierte
1232,09.06.2020,"sueddeutsche, DPA",Außenhandel. Beispielloser Exporteinbruch von mehr als 30 Prozent
1243,10.06.2020,"sueddeutsche, DPA",Wirtschaft. Düstere Aussichten für EU-Unternehmen in China
1250,09.06.2020,"sueddeutsche, DPA","Literatur. ""Wuhan Diary"": Tagebuch aus einer abgeriegelten Stadt"
1259,11.06.2020,"sueddeutsche, DPA",Bundesregierung. Merkel pocht auf mehr Marktzugang in China
1261,13.06.2020,"sueddeutsche, DPA",Krankheiten. Corona-Ausbruch auf Großmarkt in Peking
1268,17.06.2020,"sueddeutsche, DPA",Gesundheit. Wie groß ist die Corona-Gefahr auf öffentlichen Toiletten?
1269,17.06.2020,"sueddeutsche, DPA",Olympia. Mailand und Peking hoffen auf Winterspiele ohne Rückschläge
1271,13.06.2020,"sueddeutsche, DPA",Wissenschaft. Masken haben Zehntausende Corona-Ansteckungen verhindert
1273,14.06.2020,"sueddeutsche, DPA",Krankheiten. China meldet 57 neue Corona-Infizierte
1277,17.06.2020,"sueddeutsche, DPA",Wissenschaft. Coronavirus: Wie gefährlich sind öffentliche Toiletten?
1286,18.06.2020,"sueddeutsche, DPA",Wissenschaft. Studie: Blutgruppe beeinflusst Schwere von Covid-19-Verlauf
1287,18.06.2020,"sueddeutsche, DPA",Wissenschaft - Kiel. Studie: Blutgruppe beeinflusst Schwere von Covid-19-Verlauf
1294,18.06.2020,"sueddeutsche, DPA",Konflikte. China droht USA wegen Sanktionsgesetz mit Widerstand
1306,19.06.2020,"sueddeutsche, DPA",Forschung - Rostock. Rostocker Studie belegt geringeres Corona-Risiko bei Kindern
1309,26.06.2020,"sueddeutsche, DPA",EU. EU-Staaten beraten Einreisestopp
1312,24.06.2020,"sueddeutsche, DPA","Parteien. Trump bezeichnet Coronavirus als ""Kung Flu"""
1322,29.06.2020,"sueddeutsche, DPA",Gesundheit - Rostock. Tropenmediziner: Auf Großveranstaltungen weiter verzichten
1327,25.01.2021,"sueddeutsche, DPA",Weltwirtschaft. UN-Chef warnt vor Mutation - Chinas Parteichef vor Spaltung
1333,26.01.2021,"sueddeutsche, DPA",Konjunktur. IWF hebt Prognose zur Entwicklung der Weltwirtschaft an
1340,27.01.2021,"sueddeutsche, DPA",Skispringen - Willingen (Upland). Skispringer Leyhe: Peking 2022 auch Grund für lange Pause
1347,27.01.2021,"sueddeutsche, DPA",Landtag - Düsseldorf. Warnung vor der dritten Welle
1349,27.01.2021,"sueddeutsche, DPA",Agrar. Experte: Tierseuchen gelangen zunehmend nach Deutschland
1358,28.01.2021,"sueddeutsche, DPA",Gesundheit. Heikle Suche nach Ursprung des Coronavirus beginnt
1366,14.01.2021,"sueddeutsche, DPA",Krankheiten. Fehlstart für WHO-Mission: China blockt Einreise
1371,15.01.2021,"sueddeutsche, DPA",Gesundheit. Wie lange hält die Corona-Immunität nach einer Infektion?
1378,15.01.2021,"sueddeutsche, DPA",Gesundheit. Ist man nach einer Corona-Infektion immun gegen das Virus?
1382,07.01.2021,"sueddeutsche, DPA",Krankheiten. China fürchtet größten Virus-Ausbruch seit Monaten
1383,06.01.2021,"sueddeutsche, DPA",Innenpolitik. Nordkoreas Machthaber räumt bei Parteitreffen Fehler ein
1416,12.01.2021,"sueddeutsche, DPA",Wissenschaft. Größter Corona-Ausbruch seit Monaten in China
1419,12.01.2021,"sueddeutsche, DPA",Gesundheit. Wo passieren die Corona-Ansteckungen?
1427,12.01.2021,"sueddeutsche, DPA",Auto. Tiefe Corona-Spuren im Autojahr 2020
1442,18.01.2021,"sueddeutsche, DPA","Gesundheit - Leipzig. Epidemiologe hält Ziel von ""Zero Covid"" für nicht machbar"
