Dokument-ID,Datum,Quelle,Titel
5478,18.10.2021,wirtschaftswoche, Findet Australiens Börse schnell wieder in die Spur?
5516,06.10.2021,wirtschaftswoche,China.  Xi Jinping reist möglicherweise nicht zum G20-Gipfel nach Rom
5544,31.10.2020,wirtschaftswoche, Entpört Euch!
5545,27.10.2020,wirtschaftswoche,Neuer Trend Travel-Bubble.  Die Zweiklassengesellschaft des Reisens 
5561,23.10.2020,wirtschaftswoche,Zweites TV-Duell .  Trumps und Bidens Aussagen im Faktencheck 
5574,22.10.2020,wirtschaftswoche,Wahlkampf.  Obama greift Trump frontal an: „Inkompetenz“ im Kampf gegen Pandemie 
5580,19.10.2020,wirtschaftswoche,Devisen.  Warum die Schwellenländer keine Alternative für Anleger sind 
5584,19.10.2020,wirtschaftswoche,Gewinner der wirtschaftlichen Erholung.  In China heißt es Wirtschaftsboom statt Lockdown 
5601,13.10.2020,wirtschaftswoche,Export.  Chinas Außenhandel legt im September erneut deutlich zu 
5614,10.10.2020,wirtschaftswoche,US-Präsident.  Trump warnt bei erstem Auftritt seit Covid-Erkrankung vor Biden 
5622,08.10.2020,wirtschaftswoche, Donald Trump hat Häme wirklich verdient
5623,08.10.2020,wirtschaftswoche,Schlagabtausch in den USA.  Trump sagt TV-Duell mit Biden ab 
5638,04.10.2020,wirtschaftswoche,"Corona-Behandlung.  Remdesivir, Antikörper, Säureblocker: So wird Donald Trump behandelt "
5658,25.11.2020,wirtschaftswoche,Corona und Economics 2021: China First
5667,21.11.2020,wirtschaftswoche,G20-Gastgeber.  Saudi-Arabien mahnt bei G20-Gipfel gemeinsamen Kampf gegen Corona an
5670,22.11.2020,wirtschaftswoche,Gipfel in Saudi-Arabien.  Entwurf der Abschlusserklärung liegt vor: G20 will faire Verteilung von Impfstoffen
5689,17.11.2020,wirtschaftswoche,"Großbritannien ringt um Handelsabkommen.  Global Britain, nur ein bisschen kleiner? "
5710,09.11.2020,wirtschaftswoche,Impfstoff gegen Corona.  Wie Ugur Sahin die Welt verändert 
5714,09.11.2020,wirtschaftswoche,Mainzer Pharma-Unternehmen.  Biontech veröffentlicht vielversprechende Daten zu Corona-Impfstoff 
5721,06.11.2020,wirtschaftswoche, Rückenwind aus USA hilft der Börse gegen das Corona-Tief 
5723,05.11.2020,wirtschaftswoche,US-Präsidentschaftswahl.  „Die US-Wirtschaft könnte 2021 durchaus um vier Prozent wachsen“
5733,03.11.2020,wirtschaftswoche,Nach Milliardenverlust.  Wie die Medikamenten-Sparte Bayer neuen Schwung geben soll 
5738,02.11.2020,wirtschaftswoche,"Nikkei, Topix und Co.  Asia-Börsen – Erholung dank starker Wirtschaftsdaten aus China "
5740,02.11.2020,wirtschaftswoche,Konjunkturbarometer .  Wirtschaftsstimmung in China steigt auf Zehn-Jahres-Hoch 
5746,30.11.2021,wirtschaftswoche,Covid-Medikament.  Chinas Suche nach der Anti-Corona-Pille 
5760,26.11.2021,wirtschaftswoche,"Dow Jones, S&P 500, Nasdaq.  Virusangst an der Wall Street: US-Börsen rutschen ab – Hausse bei den Impfstoffaktien"
5771,21.11.2021,wirtschaftswoche,Corona.  Das Millionengeschäft mit den Schnelltests 
5790,17.11.2021,wirtschaftswoche,Asien.  Japans Exportwachstum fällt wegen Lieferengpässen auf acht-Monats-Tief 
5794,16.11.2021,wirtschaftswoche,China und USA.  Biden: Wettbewerb mit China darf nicht in Konflikt ausarten 
5804,15.11.2021,wirtschaftswoche,"Nikkei, Topix und Co..  Asien-Börsen zu Wochenauftakt ohne gemeinsame Richtung "
5851,05.11.2021,wirtschaftswoche,Drakonische Maßnahmen.  Kampf gegen Corona: China macht dicht 
5876,31.03.2021,wirtschaftswoche,Pandemie.  China weist WHO-Vorwurf zur Corona-Studie zurück 
5881,29.03.2021,wirtschaftswoche,Vor Altmaiers Wirtschaftsgipfel.  An Corona könnten sie alle scheitern 
5914,18.03.2021,wirtschaftswoche,Coronapandemie.  Das Öffnungs-Jo-Jo ist ein Scheitern mit Ansage 
5954,07.03.2021,wirtschaftswoche,Corona überwunden.  Chinas Exporte machen Sprung um 60 Prozent
5957,07.03.2021,wirtschaftswoche,Corona überwunden .  Chinas Exporte machen Sprung um 60 Prozent
5960,08.03.2021,wirtschaftswoche, Gut versichert und mit Energie in die Post-Corona-Zeit
5968,05.03.2021,wirtschaftswoche,Trotz Coronakrise.  China will „mehr als sechs Prozent“ wachsen 
5974,04.03.2021,wirtschaftswoche,Volkskongress.  „Patrioten“ für Hongkong – Militäretat steigt stark 
5976,05.03.2021,wirtschaftswoche,Volkskongress.  China will „mehr als sechs Prozent“ wachsen 
5979,04.03.2021,wirtschaftswoche,US-Konjunktur.  „Die Gefahr einer harten Landung für die Finanzmärkte steigt“ 
5984,30.09.2021,wirtschaftswoche,"Nikkei, Topix und Co.  Stromkrise und Wirtschaftsdaten aus China drücken Asien-Börsen "
6054,15.09.2021,wirtschaftswoche,"Nikkei, Topix und Co..  Schwache China-Daten schüren globale Wachstumssorgen "
6056,15.09.2021,wirtschaftswoche,Internationale Rivalitäten.  Von der Leyen spricht sich für handlungs- und widerstandsfähigere EU aus 
6116,01.09.2021,wirtschaftswoche, Corona und die Börse: Es ist noch nicht vorbei
6117,02.09.2021,wirtschaftswoche,"Nikkei, Topix und Co..  Asien-Börsen fehlt nach China-Daten gemeinsame Richtung "
6118,02.09.2021,wirtschaftswoche,Klima.  China: Bilaterale Spannungen gefährden Klimakooperation mit den USA 
6124,01.09.2021,wirtschaftswoche,"Nikkei, Topix und Co..  Schrumpfende chinesische Industrie belastet Asien-Börsen "
6125,01.09.2021,wirtschaftswoche,"Milliardenprojekt.  Harry Potter, Transformers, Kung Fu Panda: Weltgrößter Themenpark von Universal Studios öffnet in China "
6132,31.08.2021,wirtschaftswoche,"Nikkei, Topix und Co..  Schwache Konjunkturdaten aus China drücken Asien-Börsen "
6140,27.08.2021,wirtschaftswoche, Jetzt bloß keine geldpolitische Verschärfung!
6150,23.08.2021,wirtschaftswoche,"Nikkei, Topix und Co..  Asien Börsen nach positiven Virus-Nachrichten stärker "
6164,19.08.2021,wirtschaftswoche,Ningbo-Zhoushan.  Der größte Hafen der Welt hat Corona 
6167,19.08.2021,wirtschaftswoche,Konjunktur.  Trotz Unsicherheiten kräftiges Exportplus 2021 erwartet
6174,16.08.2021,wirtschaftswoche,"Nikkei, Topix und Co..  Enttäuschende China-Daten drücken Asien-Börsen "
6180,13.08.2021,wirtschaftswoche,Pandemie.  Ursprung des Coronavirus: WHO-Experte schließt Labor-Theorie offenbar nicht mehr aus 
6181,15.08.2021,wirtschaftswoche, Das Virus ist (zurück) im Wahlkampf
6182,16.08.2021,wirtschaftswoche,Industrie.  Chinas Industrie und Konsum verfehlen im Juli Erwartungen 
6193,09.08.2021,wirtschaftswoche,Geldpolitik.  Chinas Notenbank stellt flexible Geldpolitik in Aussicht 
6215,03.08.2021,wirtschaftswoche,Rohstoffe.  Ölpreise kaum verändert nach deutlichen Vortagesverlusten 
6218,31.08.2020,wirtschaftswoche,Weltweite Rangliste .  Diese Firmen sind die größten Aufsteiger unter den Innovationsführern 
6227,28.08.2020,wirtschaftswoche,"Krisenkanzlerin Angela Merkel .  „Wir können uns alles leisten, was wir entschieden haben“ "
6248,24.08.2020,wirtschaftswoche,"Dow Jones, Nasdaq, S&P 500.  Hoffnung auf Corona-Mittel treiben US-Börsen auf Rekord"
6249,24.08.2020,wirtschaftswoche,Währungspolitik.  „Der Euro ist keine Alternative zum Dollar“ 
6255,23.08.2020,wirtschaftswoche,USA.  Trump erhält viel Kritik für politischen Druck bei Corona-Impfstoff 
6257,20.08.2020,wirtschaftswoche,Bilaterale Beziehungen.  Peking: USA und China wollen wegen Handelsstreit telefonieren 
6275,18.08.2020,wirtschaftswoche,Schlechte Bilanz und nun die Briefwahl-Debatte.  US-Post droht Privatisierung nach Vorbild der Deutschen Post 
6278,17.08.2020,wirtschaftswoche,Corona-Auswirkungen.  Maschinenbau streicht in der Krise 32.000 Jobs
6293,11.08.2020,wirtschaftswoche,"Dow Jones, Nasdaq, S&P 500.  Hoffnung auf zusätzliche Konjunkturhilfen stützt die US-Börsen"
6367,25.09.2020,wirtschaftswoche,"Pekinger Automesse gestartet.  „China ist enorm wichtig, besonders in diesem Jahr“ "
6372,22.09.2020,wirtschaftswoche,Pandemie.  Covid-19: Donald Trump will China zur Verantwortung ziehen
6377,22.09.2020,wirtschaftswoche,Quarantäne in China.  „Der Aufenthalt war ein Selbsterfahrungs-Trip“ 
6378,18.09.2020,wirtschaftswoche,Mack Rides.  Europapark-Betreiber droht Auftrag für weltgrößte Achterbahn zu verlieren 
6405,16.09.2020,wirtschaftswoche, Gute Aussichten für britische und deutsche Aktienmärkte
6408,14.09.2020,wirtschaftswoche,EU-China-Gipfel.  „China wird zum Westen aufschließen“ 
6422,11.09.2020,wirtschaftswoche,Afrikanische Schweinepest.  Landwirtschaftsministerium stoppt Schweinefleisch-Exporte ins EU-Ausland 
6436,09.09.2020,wirtschaftswoche,Im Interview mit Bob Woodward.  Trump: Wollte Corona-Gefahr immer herunterspielen 
6475,31.03.2020,wirtschaftswoche,Shiller-Theorie im Corona-Crash.  Wie der Kampf der Narrative die Börsen antreibt 
6476,31.03.2020,wirtschaftswoche,Kommt eine zweite Virus-Welle?.  In China bricht die Zeit „nach“ Corona an – aber die Angst bleibt 
6483,28.03.2020,wirtschaftswoche,Auktionen trotz Kontaktverbot .  „Momentan sind die Tresore noch voll“ 
6486,27.03.2020,wirtschaftswoche,Öl.  Ölpreise legen zu – doch Preiskrieg hält an 
6487,27.03.2020,wirtschaftswoche,Coronavirus.  Wie es nach der Kontaktsperre weitergehen kann 
6490,26.03.2020,wirtschaftswoche,Staatsschulden nach der Krise.  Eine Reform des Euro sollte nicht ausgeschlossen werden 
6493,24.03.2020,wirtschaftswoche,Coronakrise.  Puma meldet Kurzarbeit an – Vorstand verzichtet auf Gehalt 
6494,23.03.2020,wirtschaftswoche,Helden Contra Corona – Erfahrungsbericht #3.  „Wir könnten ein Jahr lang ohne Einnahmen überleben“
6495,24.03.2020,wirtschaftswoche, Corona macht der Digitalisierung Beine
6496,24.03.2020,wirtschaftswoche,Coronavirus.  Chinesische Provinz Hubei hebt Blockade weitgehend auf 
6497,25.03.2020,wirtschaftswoche,Hotels in Hongkong .  Geschäftsmodell Quarantäne-Gast 
6499,25.03.2020,wirtschaftswoche,Corona-Pandemie.  „Auch Wirtschaftskrisen können die Sterberate erhöhen“ 
6500,25.03.2020,wirtschaftswoche,USA in der Coronakrise.  Trumps Angst um die US-Wirtschaft – und seine Wiederwahl 
6501,22.03.2020,wirtschaftswoche,Die bitteren Folgen des Coronaschocks.  In diesen vier Branchen wird es eng 
6504,23.03.2020,wirtschaftswoche,Corona-Krise.  Airlines in Asien und Nahost stellen Flugbetrieb weitgehend ein 
6506,20.03.2020,wirtschaftswoche,People's Bank of China.  Chinas Zentralbank verzichtet überraschend auf Zinssenkung 
6508,19.03.2020,wirtschaftswoche,Coronavirus.  China meldet erstmals keine inländischen Corona-Neuinfektionen 
6509,19.03.2020,wirtschaftswoche,Coronakrise.  Siemens Healthineers: Nachfrage nach CT- und Röntgengeräten steigt 
6511,19.03.2020,wirtschaftswoche,Corona-Hilfsmaterial.  China wirft die Propaganda-Maschine an 
6513,18.03.2020,wirtschaftswoche, Kapitalsicherung hat jetzt oberste Priorität
6515,17.03.2020,wirtschaftswoche,„Das wird zu einer Delle führen“.  Chinas Wirtschaft „nach“ Corona 
6516,17.03.2020,wirtschaftswoche, Corona-Crash: Fakten sind besser als Panik
6517,17.03.2020,wirtschaftswoche,Corona-Krise.  VW-Konzern stellt die Produktion ein 
6521,16.03.2020,wirtschaftswoche,Corona-Pandemie.  „Es droht ein neuer Klassenkampf“ 
6526,13.03.2020,wirtschaftswoche,"Vorbilder Taiwan, Hongkong, Südkorea.  So bekämpfen Chinas Nachbarn erfolgreich Corona "
6527,13.03.2020,wirtschaftswoche,Kurseinbruch bei Kryptowährungen.  Bitcoin: Das Gegenteil von einem sicheren Hafen 
6528,13.03.2020,wirtschaftswoche,"Goldpreis unter Druck.  Geht die Liquidität, dann kommt der Crash "
6529,15.03.2020,wirtschaftswoche,Export-Weltmeister unter Druck.  Wird Deutschlands Stärke zur Schwäche? 
6530,12.03.2020,wirtschaftswoche,Webasto nach Corona-Vorfällen.  „Der Krisenstab muss einen kühlen Kopf bewahren“ 
6531,12.03.2020,wirtschaftswoche,Coronavirus.  Trump verkündet Einreisestopp aus Europa in die USA 
6533,12.03.2020,wirtschaftswoche,Drastische Maßnahme.  USA schließen wegen Coronavirus Grenzen für Reisende aus Europa 
6534,11.03.2020,wirtschaftswoche,Coronavirus in China.  Adidas verliert bis zu einer Milliarde Euro Umsatz 
6535,11.03.2020,wirtschaftswoche,Wirtschaft von oben #40 – Venedig.  So leergefegt ist Venedig durch das Coronavirus
6536,12.03.2020,wirtschaftswoche,US-Einreisestopp wegen Corona.  Lufthansa am Abgrund 
6540,10.03.2020,wirtschaftswoche, Selbst die schlimmste Krise hat Gewinner
6542,09.03.2020,wirtschaftswoche,Riedls Dax-Radar.  Die fünf Väter des Börsen-Crashs 
6543,09.03.2020,wirtschaftswoche,Coronavirus.  „Eine vergleichbare Situation hat es noch nie gegeben“ 
6545,08.03.2020,wirtschaftswoche,Post aus Harvard.  Warum das Coronavirus die De-Globalisierung fördert 
6546,09.03.2020,wirtschaftswoche,"Folgen des Coronavirus.  Wenn China hustet, kränkelt das Auto-Geschäft der ganzen Welt "
6548,07.03.2020,wirtschaftswoche,Minus elf Prozent.  Chinas Außenhandel bricht wegen Coronavirus ein 
6550,08.03.2020,wirtschaftswoche,Gesundheitsminister rät.  Spahn: Wegen Coronavirus Großveranstaltungen absagen 
6551,07.03.2020,wirtschaftswoche,Coronavirus – Die aktuelle Lage.  795 Fälle in Deutschland – Spahn rät von Reisen nach Italien und NRW ab
6552,06.03.2020,wirtschaftswoche,"Lufthansa-Konzern streicht bis zur Hälfte der Flüge.  „Leere Flugzeuge zu fliegen, wäre wirtschaftlich unverantwortbar“ "
6554,05.03.2020,wirtschaftswoche,Geldpolitik.  EZB ruft Banken wegen Corona zur Prüfung von Notfallplänen auf 
6560,06.03.2020,wirtschaftswoche, Die Wirtschaftsbilanz des Donald Trump
6561,04.03.2020,wirtschaftswoche,Corona-Krise.  Lufthansa-Konzern streicht Flugplan um 150 Jets zusammen
6565,04.03.2020,wirtschaftswoche,Insolvenzen.  „Das Virus kann wie ein Brandbeschleuniger wirken“ 
6567,03.03.2020,wirtschaftswoche,"Lieferketten im Corona-Stress.  Samsung Hui, Apple Pfui "
6570,04.03.2020,wirtschaftswoche," Drei Möglichkeiten für Anleger, auf das Coronavirus zu reagieren"
6572,03.03.2020,wirtschaftswoche,Biotech-Urgestein.  Thermo Fisher übernimmt Qiagen wohl doch 
6573,03.03.2020,wirtschaftswoche,"Nikkei, Topix & Co.  Asiatische Börsen erholen sich durch Hoffnungen auf G7-Unterstützung"
6574,02.03.2020,wirtschaftswoche,"Lufthansa, British Airways, Ryanair.  Airlines streichen ihre Flugpläne zusammen "
6575,02.03.2020,wirtschaftswoche,Coronavirus.  Notenbanken wollen Finanzmärkte beruhigen 
6578,02.03.2020,wirtschaftswoche,OECD warnt.  Coronavirus könnte Wirtschaftswachstum 2020 halbieren
6579,01.03.2020,wirtschaftswoche,Marcel Fratzscher.  Hamsterkäufe in Supermärkten – Ökonom warnt vor „Herdenverhalten“ 
6583,02.03.2020,wirtschaftswoche,"Nikkei, Topix & Co.  Börsen in Asien stabilisieren sich vor möglichem globalen Zinsentscheid "
6594,29.04.2021,wirtschaftswoche,Nach 100 Tagen als US-Präsident.  Das progressivste Programm eines US-Präsidenten seit Jahrzehnten
6605,28.04.2021,wirtschaftswoche,Ugur Sahin.  Biontech-Chef lehnt Verzicht auf geistige Eigentumsrechte bei Impfstoffen ab 
6649,19.04.2021,wirtschaftswoche,Internationale Automesse.  BMW sieht Aussichten in China „optimistisch“ – Zwölf neue E-Autos bis 2023
6651,19.04.2021,wirtschaftswoche," Große Probleme, riesige Chancen"
6659,17.04.2021,wirtschaftswoche,Autoindustrie.  Experten rechnen mit robustem Wachstum auf Chinas Automarkt 
6663,15.04.2021,wirtschaftswoche,Frühjahrsprognose.  Führende Institute warnen: „Die Pandemie bleibt ein Risiko“ 
6667,15.04.2021,wirtschaftswoche,Konjunkturprognosen.  Wirtschaftsforscher warnen vor „beträchtlichem Risiko“ für Banken 
6676,14.04.2021,wirtschaftswoche,Lockdown.  In diesen Bundesländern ist die wirtschaftliche Not am größten 
6724,27.04.2020,wirtschaftswoche,Wegen Corona-Pandemie.  Adidas verliert 97 Prozent seines Gewinns
6727,30.04.2020,wirtschaftswoche,„Kein normales Quartal“.  BASF verzeichnet Gewinnrückgang wegen Corona 
6735,22.04.2020,wirtschaftswoche,Impfstoff gegen Covid-19.  Börsianer feiern Biontech
6736,21.04.2020,wirtschaftswoche,Autobauer.  Opel-Mutterkonzern PSA gibt düstere Prognose für 2020 ab
6743,21.04.2020,wirtschaftswoche,Verkäufer hinter Glas.  Autohandel in Corona-Zeiten 
6744,21.04.2020,wirtschaftswoche, Die Corona-App ist eine große Illusion
6745,21.04.2020,wirtschaftswoche,Gewinnprognosen an der Börse.  „Gar nichts sagen ist die schlechteste Lösung“ 
6748,20.04.2020,wirtschaftswoche,Fremdwort Kurzarbeit.  Corona lässt den Frachtverkehr brummen 
6752,20.04.2020,wirtschaftswoche,"Britische Regierung unter Druck.  Boris Johnson, der ahnungslose Superheld "
6755,17.04.2020,wirtschaftswoche,"Minus 6,8 Prozent.  Chinas Wirtschaft bricht ein: Wie geht es jetzt weiter?"
6757,16.04.2020,wirtschaftswoche,Corona und Kooperation.  Deutschland darf sich nicht nur selbst retten 
6761,18.04.2020,wirtschaftswoche, Die Corona-Schlafwandler
6762,15.04.2020,wirtschaftswoche,Abstand halten.  Rückkehr aus dem Homeoffice: Büros müssen sich verändern 
6767,16.04.2020,wirtschaftswoche, Nach Silvester sind ja auch nicht alle schlank
6769,13.04.2020,wirtschaftswoche,Folgen der Pandemie.  Warum der Euro abwerten und Gold gewinnen wird 
6771,16.04.2020,wirtschaftswoche,Anlagenbauer SMS in der Coronakrise.  „Da quatscht nicht mehr ständig einer dazwischen“ 
6773,14.04.2020,wirtschaftswoche,"Corona-Pandemie.  Chinas Exporte schrumpfen im März um 6,6 Prozent"
6775,15.04.2020,wirtschaftswoche,Drastische Maßnahme.  Trump dreht der WHO den Geldhahn zu 
6779,11.04.2020,wirtschaftswoche,Verkehrsdaten.  Diese zwei Städte scheinen immun gegen Corona 
6780,10.04.2020,wirtschaftswoche, Wie stellt man die Versorgung mit lebenswichtigen Gütern sicher?
6783,13.04.2020,wirtschaftswoche,Coronakrise.  Die Welt im Corona-Dilemma: Vorsicht oder Rückkehr zum Alltag? 
6785,08.04.2020,wirtschaftswoche,Autobauer.  Daimler verlängert Kurzarbeit – Neustart der Produktion wird vorbereitet 
6786,09.04.2020,wirtschaftswoche,"Außenhandel.  Exporte legten im Februar zu, Coronakrise bremst aber Handel mit China "
6788,09.04.2020,wirtschaftswoche,Markus Söder.  Bayerns Krisen-Kanzler 
6789,08.04.2020,wirtschaftswoche,"Weniger Arbeit, weniger Lohn.  Tesla macht Zwangsurlaub "
6792,08.04.2020,wirtschaftswoche,„Die größten Herausforderungen in der Geschichte“.  Wie hart trifft die Krise die Autobranche wirklich? 
6793,06.04.2020,wirtschaftswoche,"Coronavirus.  Wie man plant, wenn nichts planbar ist "
6794,08.04.2020,wirtschaftswoche, Du glückliches Österreich
6796,07.04.2020,wirtschaftswoche,Corona und 5G.  Sturm der Aluhüte
6797,06.04.2020,wirtschaftswoche,"Die andere Seite der Coronakrise.  Nachrichten, die wieder Mut machen "
6801,03.04.2020,wirtschaftswoche,Außenhandelskammer.  Deutsche Firmen in Japan: „Trotz Einbruchs keine Panik“ 
6804,04.04.2020,wirtschaftswoche,Helden Contra Corona – Erfahrungsbericht #14.  „Alle Mitarbeiter müssen sich vor der Arbeit die Haare waschen“
6809,02.04.2020,wirtschaftswoche, Die Wirtschaft muss wieder hochgefahren werden
6812,01.04.2020,wirtschaftswoche,Öffentliches Leben mit digitaler Kontrolle.  Was eine Corona-App leisten muss 
6814,02.04.2020,wirtschaftswoche,Unternehmen produzieren wieder.  Für deutsche Firmen geht es in China nur langsam aufwärts 
6815,02.04.2020,wirtschaftswoche,Gemeinschaftshaftung.  Darum würden Coronabonds nichts nützen 
6824,30.01.2020,wirtschaftswoche,Luftfahrt.  Warum Airlines kaum unter dem Corona-Virus leiden 
6825,30.01.2020,wirtschaftswoche,Tesla-Aktie erreicht neue Rekorde.  Musk: „Wachstums-Unternehmen zahlen keine Schulden zurück“ 
6827,31.01.2020,wirtschaftswoche,Riedls Dax-Radar.  Coronavirus schwächt die Börsen: mögliche Zitterpartie bis März 
6837,29.01.2020,wirtschaftswoche,Betriebsärztin zu Coronavirus.  Was in China tätige Unternehmen jetzt tun sollten 
6840,29.01.2020,wirtschaftswoche,Apple-Zahlen.  Zurück in der Erfolgsspur: Apple kann wieder glänzen 
6842,28.01.2020,wirtschaftswoche,Katastrophen und die Konjunktur.  Bitte keine Wirtschaftshysterie! 
6845,28.01.2020,wirtschaftswoche, Was uns das Coronavirus über die globalisierte Welt lehrt
6846,28.01.2020,wirtschaftswoche,"Coronavirus.  „Wenn sich die Lage verschärft, sind wir weg hier“ "
6849,28.01.2020,wirtschaftswoche,Lungenkrankheit.  33-jähriger Deutscher erkrankt an Coronavirus – Gefahr bleibt hierzulande weiter gering
6850,28.01.2020,wirtschaftswoche,"SAP, Honda, McDonald's, Starbucks.  Coronavirus: So reagieren internationale Firmen in China "
6851,27.01.2020,wirtschaftswoche,Coronavirus in China.  Deutsche Firmen in Wuhan setzen auf Prävention 
6852,27.01.2020,wirtschaftswoche,"Asiens Börsen fallen weiter.  „Alles, was die Anleger sehen, sind Coronavirus-Schlagzeilen“ "
6856,28.01.2020,wirtschaftswoche,"Nikkei, Topix & Co.  Furcht vor Folgen des Coronavirus lässt asiatische Börsen weiter fallen "
6867,23.01.2020,wirtschaftswoche,Coronavirus.  Was die neue Lungenkrankheit für Chinas Wirtschaft bedeutet 
6869,24.01.2020,wirtschaftswoche,"Nikkei, Topix & Co.  Anleger in Asien wegen Coronavirus zögerlich "
6874,22.01.2020,wirtschaftswoche,Coronavirus und Dienstreisen.  Müssen Angestellte trotz Virusgefahr nach China reisen? 
6877,23.01.2020,wirtschaftswoche,"Nikkei, Topix und Co.  Coronavirus verunsichert asiatische Anleger "
6878,23.01.2020,wirtschaftswoche,Viren-Infektion.  Impfstoff gegen Coronavirus wohl frühestens in einem Jahr verfügbar 
6883,21.01.2020,wirtschaftswoche,"Nikkei, Topix & Co.  Sorgen vor steigendem Virus-Risiko belasten asiatische Börsen "
6884,21.01.2020,wirtschaftswoche,Virus.  USA bestätigen ersten Fall des Coronavirus 
6888,22.01.2020,wirtschaftswoche,"Nikkei, Topix & Co.  Virusausbruch bremst Hoch der asiatische Börsen "
6894,20.01.2020,wirtschaftswoche,Coronavirus.  Mysteriöse Lungenkrankheit breitet sich aus – Erste Erkrankungen außerhalb Chinas 
6909,19.01.2020,wirtschaftswoche,Coronavirus.  Mysteriöse Lungenkrankheit in China: Ausmaß wohl deutlich größer als bisher angenommen 
6930,15.01.2020,wirtschaftswoche,Gastbeitrag.  Antibiotika ohne Wirkung: Die neue globale Gefahr 
6934,15.01.2020,wirtschaftswoche,Tierseuche.  Wie Lanxess von der Schweinepest profitiert 
6973,09.01.2020,wirtschaftswoche,Geldpolitik.  Inflationsrate in China liegt unter der Vorgabe der Regierung 
7010,30.06.2021,wirtschaftswoche,"Biontech, Moderna, AstraZeneca, Johnson & Johnson.  Corona-Impfungen in Deutschland: Eine Chronik der Ereignisse "
7029,27.06.2021,wirtschaftswoche,"Deglobalisierung, Insolvenzen, Digitalisierung.  Diese Corona-Thesen haben sich so nicht bewahrheitet "
7035,24.06.2021,wirtschaftswoche,Europa.  EU-Gipfel diskutiert über neue Russland-Strategie 
7057,19.06.2021,wirtschaftswoche,Wirtschaft von oben #111 – Yantian.  Dieser chinesische Hafen legt weltweit die Schifffahrt lahm
7081,13.06.2021,wirtschaftswoche,Corona.  Impfkampagne in China: Ärmel hoch für die Kinder 
7084,13.06.2021,wirtschaftswoche,"China, Russland, Corona.  Kollektives Aufatmen nach Trump: Das sind die Beschlüsse der G7"
7092,11.06.2021,wirtschaftswoche,Außenpolitik.  Scharfe Töne von Chinas Top-Außenpolitiker in Telefonat mit Blinken 
7093,13.06.2021,wirtschaftswoche,Gipfeltreffen.  G7 sollen jährlich 100 Milliarden Dollar für Klimaschutz in Entwicklungsländern aufbringen
7122,07.06.2021,wirtschaftswoche,Rohstoffe.  Ölpreise sinken nach mehrjährigen Höchstständen 
7131,06.06.2021,wirtschaftswoche,USA.  Donald Trump deutet erneute Präsidentschaftskandidatur an 
7135,04.06.2021,wirtschaftswoche,Rohstoffe.  Ölpreise steigen nur leicht – Der stärkere Dollar-Kurs belastet 
7141,01.06.2021,wirtschaftswoche,Fieber und andere Symptome.  China weist erstmals Infektion mit Vogelgrippe-Variante H10N3 nach
7146,02.06.2021,wirtschaftswoche,Rätsel um Ursprung von Sars-CoV-2.  Wie sicher sind Laborexperimente mit Viren?
7149,30.06.2020,wirtschaftswoche,Pandemie-Potenzial.  Chinesische Forscher warnen vor neuem Schweinegrippe-Virus 
7160,25.06.2020,wirtschaftswoche,"Nikkei, Topix & Co..  Furcht vor zweiter Virus-Welle verschreckt asiatische Anleger "
7185,21.06.2020,wirtschaftswoche,Oklahoma.  Trump hält Wahlkampfveranstaltung in Tulsa ab 
7189,18.06.2020,wirtschaftswoche,Rohstoffe.  Ölpreise geben leicht nach – Brent nahe 40-Dollar-Marke
7193,18.06.2020,wirtschaftswoche,Coronavirus.  Studie: Blutgruppe beeinflusst Schwere von Covid-19-Verlauf
7202,18.06.2020,wirtschaftswoche,Wegen Uiguren-Verfolgung.  US-Präsident Trump unterzeichnet Sanktionsgesetz gegen China 
7210,16.06.2020,wirtschaftswoche,Corona-Ausbruch in Peking.  Warum deutsche Firmen jetzt ganz genau hinschauen 
7214,17.06.2020,wirtschaftswoche,Coronakrise.  Corona-Ausbruch auf Großmarkt: Peking wird teilweise abgeriegelt 
7217,14.06.2020,wirtschaftswoche,Coronakrise.  China fürchtet zweite Welle nach Corona-Ausbruch auf Großmarkt 
7222,13.06.2020,wirtschaftswoche,Zweite Welle befürchtet.  Corona-Ausbruch auf Großmarkt in Peking 
7223,15.06.2020,wirtschaftswoche,Einstieg bei Impfstoff-Hersteller.  Der Staat und Curevac: Eine nur scheinbar gute Idee 
7228,12.06.2020,wirtschaftswoche,Autobranche.  Absatz von Volkswagen bricht im Mai um ein Drittel ein 
7235,10.06.2020,wirtschaftswoche,"Virus, Handelskrieg, Staatsbetriebe.  EU-Firmen erleben „beunruhigenden Trend“ auf chinesischem Markt "
7243,09.06.2020,wirtschaftswoche,Corona-Folgen.  Deutscher Export bricht um mehr als 30 Prozent ein
7248,07.06.2020,wirtschaftswoche,"Coronakrise.  Chinas Außenhandel um 9,3 Prozent eingebrochen"
7250,08.06.2020,wirtschaftswoche,Medienbericht.  Pharma-Riese AstraZeneca soll Fusion mit Gilead ausloten 
7252,04.06.2020,wirtschaftswoche,Luftfahrt.  China lässt wieder mehr Passagierflüge aus dem Ausland zu 
7256,03.06.2020,wirtschaftswoche,Vergeltungsmaßnahme.  USA wollen chinesische Passagierflugzeuge nicht mehr landen lassen 
7261,03.06.2020,wirtschaftswoche,Coronavirus.  China hielt Daten zu Coronavirus tagelang zurück 
