title,author,date_published,url,article_text,source
Demonstrationen. Angespannte Lage in Belarus: Lukaschenko greift zur Waffe,no_author,2020-08-23 23:23:49,https://www.sueddeutsche.de/politik/demonstrationen-angespannte-lage-in-belarus-lukaschenko-greift-zur-waffe-dpa.urn-newsml-dpa-com-20090101-200823-99-270872,"Minsk (dpa) - Trotz der erneuten Massenproteste in der belarussischen Hauptstadt Minsk setzt Machthaber   weiter auf Härte und zeigt keinerlei Kompromissbereitschaft. Er ließ sich am Abend bewaffnet und in schusssicherer Weste von einem Hubschrauber in seinen Präsidentenpalast bringen, wie Staatsmedien zeigten. Lukaschenko bezeichnete die Demonstranten als ""Ratten"". Das Staatsfernsehen zeigte auch, wie Lukaschenko mit einer Kalaschnikow-Maschinenpistole in der Hand in schwarzer Montur den Hubschrauber verließ und zum Palast ging. Oppositionsnahe Quellen im Nachrichtenkanal Telegram hoben hervor, dass in der Waffe kein Magazin gewesen sei. Der Palast der Unabhängigkeit, wie er offiziell heißt, glich einer Festung. An den Zufahrten waren gepanzerte Fahrzeuge zu sehen und Einheiten mit Sicherheitskräften. Sie sollten verhindern, dass die wütende Menge den Palast stürmt. Dort hatten sich auch Menschen versammelt. Lukaschenko dankte den Sicherheitskräften für ihren Einsatz und für seinen Schutz vor den Demonstranten. ""Danke, Ihr seid tolle Typen!"", sagte er bei einem Besuch an den Absperrungen seines Präsidentenpalastes. ""Wir stehen an Ihrer Seite bis zum Ende"", riefen die Uniformierten und applaudierten dem 65-Jährigen. Lukaschenkos Sprecherin Natalja Eismont wies im Staatsfernsehen mit Blick auf einen Flug des Präsidentenhubschraubers Spekulationen in sozialen Netzwerken zurück, wonach Lukaschenko habe fliehen wollen. ""Er hat den ganzen Tag im Lagezentrum des Palastes der Unabhängigkeit gearbeitet und die Lage kontrolliert"", sagte sie. ""Wie der Präsident versprochen hat, wird der nirgendwohin gehen."" Lukaschenko arbeite nach einem Hubschrauber-Rundflug über der Stadt weiter im Palast. Mehr als 100.000 Menschen hatten zuvor trotz Warnungen von Polizei und Militär vor einem Demonstrationsverbot in Minsk bei einer Großkundgebung den Rücktritt von ""Europas letztem Diktator"" gefordert. ""Hau ab!"", skandierten die Menschen in Sprechchören auf dem Unabhängigkeitsplatz in Minsk. Anschließend gab es einen friedlichen Protestzug durch Minsk - und scharfer Beobachtung von Uniformierten. Die Polizei warnte in Lautsprecherdurchsagen immer wieder vor der Teilnahme an der ungenehmigten Kundgebung. Staatschef Lukaschenko hatte mit ""hartem Durchgreifen"" gedroht, um die Ex-Sowjetrepublik wieder zur Ruhe zu bringen. Allerdings war die Menge auf den Straßen so groß, dass die Polizei dem nichts entgegensetzen konnte. Einige oppositionelle Plattformen im Internet schätzten die Zahl auf 200.000 Menschen - etwa so viele wie am Sonntag vor einer Woche, als es zum ersten Mal überhaupt   in dieser Größenordnung gab. Sie gelten als historisch. Lukaschenko hatte immer wieder damit gedroht, notfalls auch die Armee zur Sicherung seiner Macht einzusetzen. Viele Bürger in   betonen aber seit Wochen, dass sie keine Angst mehr hätten vor ""Europas letztem Diktator"". Auch in anderen Städten kommt es seit der umstrittenen Präsidentenwahl am 9. August täglich zu Protesten und Streiks in den Staatsbetrieben. Die von Vorwürfen beispiellosen Betrugs begleitete Präsidentenwahl hat die größte innenpolitische Krise des Landes ausgelöst. Lukaschenko hatte sich nach 26 Jahren an der Macht mit 80 Prozent der Stimmen zum sechsten Mal in Folge zum Sieger der Präsidentenwahl erklären lassen. Die Opposition beansprucht den Wahlsieg für die 37 Jahre alte Fremdsprachenlehrerin Swetlana Tichanowskaja. Sie ist aus Angst um ihre Sicherheit und die ihrer Kinder in das EU-Nachbarland   geflohen. Von dort aus versucht sie, die Bewegung mit Videobotschaften zu steuern. Die EU hat die Wahl nach den Fälschungsvorwürfen und der anschließenden Polizeigewalt gegen friedliche Demonstranten nicht anerkannt. Länder wie Russland und China hingegen haben Lukaschenko zum Sieg gratuliert. In den ersten Tagen der Proteste hatte es massive Polizeigewalt gegen die friedlichen Demonstranten gegeben. Hunderte Menschen wurden verletzt. Die Zahl der Toten stieg am Samstag von drei auf vier. Die Opposition hat den Machtapparat mit Unterstützung der EU und Russlands zum Dialog für einen Ausweg aus der Krise aufgerufen. Lukaschenko hat dies abgelehnt. Er machte bei einem Besuch bei den Streitkräften im Gebiet Grodno im Westen des Landes am Samstag einmal mehr deutlich, dass er die Proteste vom Ausland - und zwar von den EU- und Nato-Nachbarländern   und Litauen - aus gesteuert sieht. Beweise lieferte er nicht. Der Staatschef versetzte die Streitkräfte in volle Gefechtsbereitschaft - zum ersten Mal in seinem Vierteljahrhundert an der Macht, wie er sagte. Lukaschenko trat in Grodno auch bei einer Kundgebung vor Unterstützern auf. Er warnte vor einer Revolution und sagte, dass die Nato zur Unterstützung Tichanowskajas bereit sei, in das Land einzumarschieren. Verteidigungsminister Viktor Chrenin warnte, dass für einen solchen Fall der Nachbar Russland militärisch zur Stelle sein werde. Polen und Litauen wiesen die Vorwürfe kategorisch als unbegründete Stimmungsmache zurück. In Litauen zeigten sich Zehntausende Menschen bei einer Protestaktion solidarisch mit den Demonstranten in Belarus. Nach Vorbild des ""Baltischen Wegs"" von 1989 bildeten sie eine Menschenkette von der Hauptstadt Vilnius bis zum Ort Medininkai an der litauisch-belarussischen Grenze. Rund 50.000 Menschen fassten sich nach Angaben der Veranstalter über die gut 30 Kilometer lange Strecke an den Händen - mit Mundschutz und meist auch mit Handschuhen. Viele Menschen waren weiß gekleidet, hielten litauische oder historische belarussische Flaggen in den Händen und hatten Blumen dabei. © dpa-infocom, dpa:200823-99-270872/12 Alexander Lukaschenko Proteste Belarus Litauen Polen","sueddeutsche, DPA"
Handel - Düsseldorf. Metro-Chef Olaf Koch darf zum Jahresende gehen,no_author,2020-08-23 16:06:00,https://www.sueddeutsche.de/wirtschaft/handel-duesseldorf-metro-chef-olaf-koch-darf-zum-jahresende-gehen-dpa.urn-newsml-dpa-com-20090101-200823-99-275851," (dpa) - Der Vorstandsvorsitzende des Handelskonzerns Metro kann sein Amt wie gewünscht zum Jahresende aufgeben. Der Aufsichtsrat habe der einvernehmlichen Aufhebung des Vertrags mit Olaf Koch zum 31. Dezember 2020 zugestimmt, teilte das Unternehmen am Sonntag in Düsseldorf mit. Am Freitag war der Wunsch des Managers bekannt geworden. Der Aufsichtsrat danke Koch für seine ""großen Verdienste"" und habe ein geordnetes Verfahren zur Auswahl einer neuen Unternehmensspitze beschlossen, hieß es weiter. Dieses werde am Montag gestartet. Kochs Vertrag lief ursprünglich bis Ende Februar 2022. Eine Begründung für das vorzeitige Ausscheiden wurde nicht genannt. Koch ist seit 2012 der Chef des MDax-Konzerns. Er hat Metro nach und nach zum reinen Großhändler umgebaut. Die Einzelhändler Mediamarkt, Saturn und Real wurden vom Konzern abgespalten. Zuletzt hat Metro sein China-Geschäft verkauft. Die Corona-Krise setzt das Unternehmen allerdings unter Druck, wie an der Entwicklung des Aktienkurses seit Anfang des Jahres abzulesen ist. Düsseldorf","sueddeutsche, DPA"
Geschichte. Kalenderblatt 2020: 31. August,no_author,2020-08-30 23:55:00,https://www.sueddeutsche.de/wissen/geschichte-kalenderblatt-2020-31-august-dpa.urn-newsml-dpa-com-20090101-200824-99-280328,"Berlin (dpa) - Das aktuelle Kalenderblatt für den 31. August 2020: 36. Kalenderwoche, 244. Tag des Jahres Noch 122 Tage bis zum Jahresende Sternzeichen: Jungfrau Namenstag: Paulin, Raimund HISTORISCHE DATEN 2019 - Im Berliner Zoo werden zwei Panda-Babys geboren. Es ist die erste Panda-Geburt in  . Panda-Mutter Meng Meng und der Vater Jiao Qing sind Leihgaben aus China. 2018 - Die EU-Kommission will die Abschaffung der Zeitumstellung von Sommer- auf Winterzeit vorschlagen. Bei einer EU-weiten Online-Umfrage hatten sich 84 Prozent der 4,6 Millionen Teilnehmer für ein Ende ausgesprochen. 2015 - Bundeskanzlerin Angela Merkel (CDU) nennt die Bewältigung des Flüchtlingszustroms nach Deutschland eine ""große nationale Aufgabe"" und beteuert: ""Wir schaffen das"". 2010 - Volker Bouffier (CDU) wird zum hessischen Ministerpräsidenten gewählt. Er ist Nachfolger von Roland Koch (CDU), der im Mai nach elf Jahren an der Spitze der Landesregierung seinen Rückzug aus der Politik angekündigt hatte. 2005 - Ein Gerücht über einen drohenden Terroranschlag auf eine schiitische Wallfahrt in Bagdad löst eine Massenpanik aus, bei der mehr als 1000 Pilger zu Tode kommen. 1990 - In Ost-Berlin unterzeichnen die Verhandlungsführer, DDR-Staatssekretär Günther Krause und Bundesinnenminister Wolfgang Schäuble, den deutsch-deutschen Einigungsvertrag. 1980 - In Danzig schließen das von Lech Walesa geführte überregionale Streikkomitee und die polnische Regierung einen Vertrag, der unter anderem die Gründung freier Gewerkschaften erlaubt. 1950 - In der DDR werden die Zeugen Jehovas verboten. Das Ministerium für Staatssicherheit startet eine Verhaftungsaktion gegen 500 Angehörige der Religionsgemeinschaft. In Schauprozessen wird ihnen ""Spionage, Kriegs- und Boykotthetze"" vorgeworfen. 1945 - Auf einer Kirchenversammlung im hessischen Treysa schließen sich 28 selbstständige lutherische, reformierte und unierte Kirchen zum ""Rat der Evangelischen Kirche in Deutschland (EKD)"" zusammen. GEBURTSTAGE 1970 - Königin Rania (50), jordanische Königin, Ehefrau von König Abdullah II. 1955 - Edwin Moses (65), amerikanischer Leichtathlet, Olympiasieger 1976 und 1984 beim 400-Meter-Hürdenlauf 1945 - Itzhak Perlman (75), israelisch-amerikanischer Geiger 1945 - Van Morrison (75), britischer Sänger, Sänger der Band Them (""Baby please don't go""), dann solo (""Browneyed Girl"") 1870 - Maria Montessori, italienische Pädagogin und Ärztin, ""Montessori-Schulen"", gest. 1952 TODESTAGE 2005 - Joseph Rotblat, britischer Atomphysiker, Friedensnobelpreis 1995 zusammen mit der von ihm mitbegründeten Pugwash-Bewegung für ihren Einsatz zur Abschaffung von Atomwaffen aller Art, geb. 1908 1995 - Horst Janssen, deutscher Zeichner, Grafiker und Maler, geb. 1929 © dpa-infocom, dpa:200824-99-280328/2 Deutschland","sueddeutsche, DPA"
Konflikte. Streit um Iran-Sanktionen stürzt UN-Sicherheitsrat in Krise,no_author,2020-08-21 18:23:01,https://www.sueddeutsche.de/politik/konflikte-streit-um-iran-sanktionen-stuerzt-un-sicherheitsrat-in-krise-dpa.urn-newsml-dpa-com-20090101-200821-99-247924,"New York (dpa) - Im Streit um das Schicksal des Atomabkommens mit dem   stellen sich Berlin, Paris und London gegen die Trump-Regierung. US-Außenminister Mike Pompeo drohte am Donnerstag (Ortszeit) allen Ländern indirekt mit Konsequenzen, die nicht der Lesart der   zur Rückkehr aller UN-Sanktionen gegen den Iran folgten. Die Außenminister Deutschlands, Frankreichs und Großbritanniens hielten dagegen, sie könnten den Schritt der weitgehend isolierten USA ""nicht unterstützen"". Der Vorgehen Washingtons gegen die Mehrheit des UN-Sicherheitsrates stürzt das mächtigste UN-Gremium dabei in eine Krise und sorgt für transatlantische Spannungen. Hintergrund ist der nach Ansicht vieler Beobachter unverhohlene Versuch der USA, das von Präsident Donald Trump verschmähte Atomabkommen mit dem Iran vor der Wahl im November unwiederbringlich zu zerstören. Die Vereinigten Staaten hatten am Donnerstag wie angekündigt versucht, den sogenannten Snapback-Mechanismus zur Wiedereinsetzung aller Sanktionen gegen den Iran in den UN-Sicherheitsrat einzubringen. Bei diesem Snapback (deutsch: Zurückschnappen) handelt es sich um eine Möglichkeit für die Staaten des Atomabkommens von 2015, iranische Regelverstöße vor dem Sicherheitsrat anzuprangern. Damit kann innerhalb von 30 Tagen die Wiedereinsetzung aller UN-Sanktionen aus der Zeit vor der Einigung erzwungen werden - ohne, dass andere Mitglieder dies mit einem Veto verhindern könnten. Doch es ist heftig umstritten, ob die USA dazu überhaupt berechtigt sind, weil die Trump-Regierung 2018 aus dem internationalen Atomabkommen mit dem Iran ausgestiegen war. Das betonten auch die europäischen Außenminister in ihrer Stellungnahme, weshalb sie das Gesuch der USA Kreisen zufolge praktisch ignorieren wollen. Dies könnte auch die Gräben zwischen den USA und Europa vertiefen. Der EU-Außenbeauftragte Josep Borell sprach den USA ebenfalls die Berechtigung zum Snapback ab. , Frankreich und Großbritannien sind Mitglieder des Atomdeals und wollen das Regelwerk genauso wie China, Russland und die EU erhalten. Die Europäer sehen es trotz vieler Probleme als den einzigen Weg, um den Dialog mit Teheran aufrecht zu erhalten. Der russische UN-Botschafter Wassili Nebensja sagte, dass Moskau das US-Vorgehen ""anfechten"" wolle. Auch China ist der Ansicht, dass das Vorgehen der USA illegitim sei. Borrell kündigte am Freitagabend ein Treffen der an dem Abkommen beteiligten Staaten am 1. September in Wien an. Geleitet werde das Treffen in seinem Namen von der Generalsekretärin des Europäischen Auswärtigen Diensts, Helga Schmid. Borrell fungiert als Koordinator des Abkommens. Trumps UN-Botschafterin Kelly Craft nannte die Haltung der Europäer ""sehr enttäuschend"". ""Von allen Ländern auf der Welt sollte Deutschland am besten wissen, wie wichtig es ist, Israel zu schützen"", sagte sie der ""Süddeutschen Zeitung"" (Wochenendausgabe und sz.de). Deutschlands Entscheidung, die libanesische Hisbollah als Terrororganisation zu ächten, sei ""nutzlos"", wenn Deutschland dem Iran ""Zugang zu Waffensystemen"" aus Russland und China gewähre. Man könne ""entweder für internationalen Frieden und Sicherheit einstehen oder sich auf die Seite eines Unterstützers des internationalen Terrorismus stellen - und damit letztlich zum Mitunterstützer werden"". Unterstützung erhielten die USA von Israel, das den Schritt begrüßte. Ministerpräsident Benjamin Netanjahu sprach von einer richtigen Entscheidung. Das ""Zurückschnappen"" der Sanktionen wäre nach Angaben von Diplomaten das faktische Ende des Abkommens. Die Amerikaner sind der Auffassung, dass für den Snapback die Nennung der USA in der UN-Resolution ausreicht, die das Atomabkommen in internationales Recht übersetzt. Bei seinem Besuch in New York machte Pompeo dabei klar, dass die USA bereit seien, gegen Länder mit anderer Auffassung durchzugreifen. ""Als die US-Sanktionen verletzt wurden, haben wir sie durchgesetzt. Wenn die UN-Sanktionen verletzt werden, werden wir alles tun, um auch sie durchzusetzen."" Washington geht es dabei auch darum, ein im Oktober auslaufendes UN-Waffenembargo gegen Teheran aufrecht zu erhalten. Das festgelegte Prozedere besagt nun, dass der Sicherheitsrat nach dem Auslösen des Snapback-Mechanismus eine Frist von 30 Tagen hat, um das ""Zurückschnappen"" der Sanktionen zu verhindern - dies wiederum könnte von einer Vetomacht wie den USA aber verhindert werden. Mit Ablauf der 30-Tage-Frist würden die Sanktionen dann theoretisch wieder eingesetzt. Dies würde aber nur geschehen, wenn der Prozess im Sicherheitsrat anerkannt ist. Es wird erwartet, dass Washington gehörigen Druck auf die Mitglieder ausüben wird. Kein Diplomat in New York wagt es derzeit, die Entwicklung der nächsten Tage und Wochen vorauszusagen. Zu vielschichtig sind die möglichen diplomatischen Spitzfindigkeiten. Der chaotische Zustand mit zwei verschiedenen Lesarten über den Zustand der Iran-Sanktionen könnte länger, womöglich sogar Monate, anhalten. Die UN-Vetomächte USA, China, Russland, Frankreich und   sowie Deutschland und der Iran hatten sich 2015 in Wien auf das Abkommen geeinigt, das Teheran eine friedliche Nutzung der Kernkraft gestattet, aber die Entwicklung von Atomwaffen verwehrt. Es stellte die iranische Atomindustrie unter Kontrolle und sagte den Abbau westlicher Wirtschaftssanktionen zu. Trump ist seit Jahren gegen den Atomdeal. Ihm dürfte der Snapback für seine Kampagne des ""maximalen Drucks"" auf Teheran vor der Präsidentenwahl im November gut passen. Teheran droht für den Fall der Wiedereinsetzung der Sanktionen mit einem Rückzug. Berlin, Paris und London riefen den Iran derweil ""dringend auf, alle Maßnahmen, die mit seinen nuklearen Verpflichtungen unvereinbar sind, zurückzunehmen"", um die Vereinbarung zu erhalten. © dpa-infocom, dpa:200821-99-247924/7 Iran USA Deutschland Großbritannien","sueddeutsche, DPA"
Internet. Tiktok kündigt Klage gegen Erlass von US-Präsident Trump an,no_author,2020-08-23 08:35:16,https://www.sueddeutsche.de/service/internet-tiktok-kuendigt-klage-gegen-erlass-von-us-praesident-trump-an-dpa.urn-newsml-dpa-com-20090101-200823-99-269993,"Washington (dpa) - Die Betreiber der Video-App Tiktok haben eine Klage gegen den Erlass von US-Präsident   angekündigt, die den chinesischen Eigentümer der App zu einem raschen Verkauf des US-Geschäfts zwingen würde. Das Unternehmen werde die Klage voraussichtlich in der kommenden Woche einreichen, erklärte   am Samstag. Die Regierung ""hat nicht auf Fakten geachtet und versucht, sich in die Verhandlungen privater Unternehmen einzumischen"", hieß es in einer Stellungnahme. Daher sei es trotz anhaltender Bemühungen nicht möglich gewesen, gemeinsam eine konstruktive Lösung zu finden. Tiktok gehört zum chinesischen Unternehmen Bytedance. Trump hatte Anfang August unter Verweis auf die Datensicherheit Geschäfte von US-Amerikanern mit Tiktok untersagt, den Vollzug der Verfügung allerdings bis Mitte September ausgesetzt. Wenn sie greifen sollte, würde das wohl bereits das Ende der App in den   bedeuten. Vergangene Woche ordnete Trump dann noch an, dass Bytedance sich binnen drei Monaten von allen Daten von Nutzern in den Vereinigten Staaten trennen müsse. Auch dürfe Bytedance in den USA danach kein Eigentum mehr besitzen, das für den Betrieb von Tiktok genutzt werde. Tiktok teilte zunächst keine weiteren Einzelheiten zu der geplanten Klage mit. Denkbar wäre aber, dass sich das Unternehmen um eine einstweilige Verfügung bemühen wird, um die von der US-Regierung gesetzten Fristen erstmal auszuhebeln. Im Erfolgsfall bliebe dem Unternehmen dann mehr Zeit, sich in besserer Verhandlungsposition um einen Verkauf des US-Geschäfts zu bemühen. Durch den Verkauf an ein US-Unternehmen könnten die juristischen Probleme gelöst werden. Microsoft verhandelt mit Bytedance über die Übernahme des Tiktok-Geschäfts in den USA und weiteren Ländern. Einem Medienbericht zufolge soll auch Twitter Gespräche geführt haben. Tiktok hat nach eigenen Angaben 100 Millionen Nutzer in den USA. Die Regierung in Washington warnt schon länger, über Tiktok könnten Daten von US-Amerikanern in die Hände chinesischer Behörden geraten. Tiktok hingegen versichert, Chinas Regierung habe keinen Zugriff auf Nutzerdaten und habe dies auch nie verlangt. Die Daten von US-Nutzern würden in den USA gespeichert und verarbeitet. Tiktok verzeichnet rasantes Wachstum und gilt schon länger als angesagteste große Plattform bei jüngeren Leuten. Die internationale Videoplattform hat hunderte Millionen Nutzer weltweit. Sie können dort eigene Clips hochladen oder Videos von anderen ansehen. Das soziale Netzwerk Facebook versucht, mit dem Kurzvideo-Format Reels bei seiner Fotoplattform Instagram mitzuhalten. © dpa-infocom, dpa:200823-99-269993/3 Donald Trump Tiktok USA","sueddeutsche, DPA"
Handel - Düsseldorf. Metro-Chef Olaf Koch will zum Jahresende gehen,no_author,2020-08-21 18:41:03,https://www.sueddeutsche.de/wirtschaft/handel-duesseldorf-metro-chef-olaf-koch-will-zum-jahresende-gehen-dpa.urn-newsml-dpa-com-20090101-200821-99-258677," (dpa) - Der Vorstandsvorsitzende des Handelskonzerns Metro will sein Amt vorzeitig aufgeben. Olaf Koch habe den Aufsichtsrat informiert, dass er zum Ende des Jahres aus dem Vorstand ausscheiden möchte, teilte das Unternehmen am Freitagabend mit. Der Vertrag des 50-Jährigen läuft eigentlich noch bis Ende Februar 2022. Der Aufsichtsrat werde sich kurzfristig mit der Angelegenheit befassen, hieß es. Koch ist seit 2012 der Chef des MDax-Konzerns. Er hat Metro nach und nach zum reinen Großhändler umgebaut. Die Einzelhändler Mediamarkt, Saturn und Real hat er vom Konzern abgespalten. Zuletzt hat Metro sein China-Geschäft verkauft. Die Corona-Krise setzt das Unternehmen allerdings unter Druck, wie an der Entwicklung des Aktienkurses seit Anfang des Jahres abzulesen ist. Düsseldorf","sueddeutsche, DPA"
Internet. Finanzarm von Alibaba beantragt Mega-Börsengang,no_author,2020-08-25 14:00:38,https://www.sueddeutsche.de/service/internet-finanzarm-von-alibaba-beantragt-mega-boersengang-dpa.urn-newsml-dpa-com-20090101-200825-99-300245,"/Shanghai (dpa) - Der Finanzarm der weltgrößten chinesischen Online-Handelsplattform Alibaba plant einen der größten Börsengänge der Geschichte. Die Ant Gruppe des Milliardärs Jack Ma beantragte am Dienstag ein Doppellisting in Hongkong und Shanghai. Das Doppellisting soll weit mehr als 20 Milliarden US-Dollar (16,9 Mrd Euro) an frischem Kapital bringen und könnte zu einer Bewertung von mehr als 200 Milliarden US-Dollar führen. Kein anderes Fintech-Unternehmen wird derart hoch bewertet. Der Börsengang wird schon mit dem Rekord-Debüt des saudi-arabischen Ölkonzerns Saudi Aramco verglichen, das 29 Milliarden US-Dollar einbrachte. Mit Alipay betreibt der Finanzdienstleister den in   weit verbreiteten, größten mobilen Bezahldienst Alipay. Angeboten werden auch Kredite, Versicherungen und Vermögensverwaltung. Den Markt teilt sich Alipay mit der Konkurrenz von Wechat-Pay des chinesischen Internetkonzerns Tencent. Das Milliardenvolk bezahlt heute in Geschäften meist nur noch mit dem Handy, indem ein Code eingescannt wird - sei es ""Weixin"" für Wechat oder ""Zhifubao"" für Alipay. Auch in Europa wird Alipay von Tausenden Einzelhändlern akzeptiert, um chinesische Touristen anzulocken. In Deutschland bieten die Drogerieketten dm und Rossmann sowie die WMF-Gruppe, der Kaufhof oder der Flughafen München die Zahlung mit Alipay auf dem Handy an. Mit Hongkong und Shanghai umgeht die Ant Gruppe die großen amerikanischen   - eine Neuerung für ein derart großes chinesisches Technologie-Unternehmen. Das Vorgehen wird auch vor dem Hintergrund der wachsenden Spannungen zwischen China und den USA gesehen. Nach einigen Skandalen wollen die US-Aufsichtsbehörden chinesischen Unternehmen künftig auch tiefer in die Bücher schauen als bisher. Alibaba selbst war 2014 in New York an die Börse gegangen. 2019 erfolgte die Zweitnotierung in Hongkong. ""Die Börsengänge werden dem Unternehmen helfen, sein Ziel der Digitalisierung der Dienstleistungsindustrie in China und der wachsenden heimischen Nachfrage zu beschleunigen"", teilte die Ant Gruppe zu ihrem Börsengang mit. Auch wolle sich das Unternehmen besser für die Entwicklung globaler Märkte positionieren und mehr in Technologie und Innovation investieren. Allerdings werden keine weiteren Details genannt - weder zur Preisspanne noch dazu, was das Unternehmen mit dem Gang aufs Parkett erlösen will. Bei der letzten Finanzierungsrunde 2018 wurde der Wert der wie Alibaba ebenfalls in Hangzhou in der Provinz Zhejiang angesiedelten Ant Gruppe auf 150 Milliarden US-Dollar geschätzt. Das Unternehmen wurde 2011 aus dem Alibaba-Konzern herausgelöst. Hinter dem Börsengang in Hongkong stehen die Investmentbank China International Capital Corporation (CICC) sowie die Großbanken Citigroup, JPMorgan Chase und Morgan Stanley. In Shanghai geht Ant Group an die neue Technologiebörse Star, das chinesische Gegenstück zur Nasdaq in den USA. Der Umsatz des mobilen Bezahldienstes Alipay wurde in dem Antrag an die   in Hongkong nach Angaben der Finanzagentur Bloomberg mit 118 Billionen Yuan (14,4 Bio Euro) in den zwölf Monaten bis Juni angegeben. Die App hat demnach 711 Millionen monatliche Nutzer - eine Milliarde insgesamt. Mehr als 80 Millionen Händler benutzten die Alipay-App zudem, um Geschäfte zu tätigen, hieß es weiter. Die Ant Gruppe stehe in Partnerschaft mit mehr als 2000 Finanzinstituten. Aramco hatte durch den Verkauf von lediglich 1,5 Prozent seiner Anteile zunächst 25,6 Milliarden Dollar eingenommen. Damit brach das Unternehmen im Dezember 2019 den Rekord von Alibaba aus dem Jahr 2014 für den größten Börsengang mit seinerzeit 25,03 Milliarden Dollar. © dpa-infocom, dpa:200825-99-300245/4 Hongkong China Börsen Börse","sueddeutsche, DPA"
