title,author,date_published,url,article_text,source
Menschenrechte. Verleger Jimmy Lai in Hongkong festgenommen,no_author,2020-08-10 22:42:08,https://www.sueddeutsche.de/politik/menschenrechte-verleger-jimmy-lai-in-hongkong-festgenommen-dpa.urn-newsml-dpa-com-20090101-200810-99-105897," (dpa) - In einer großen Polizeioperation sind in Hongkong der bekannte Medienmogul Jimmy Lai und andere Aktivisten festgenommen worden. Es ist der bislang größte Schlag gegen die Hongkonger Demokratiebewegung seit Einführung eines umstrittenen Sicherheitsgesetzes durch China. Der Multimillionär gilt als einer der schärfsten Kritiker der Führung in Peking. Über seine Festnahme berichteten die zum Unternehmen des 71-Jährigen gehörende Zeitung ""Apple Daily"" und andere Hongkonger Medien übereinstimmend. Lai werden demnach geheime Absprachen mit Kräften im Ausland, Betrug und andere Verstöße vorgeworfen. Die Hongkonger Opposition kritisierte das Vorgehen der Polizei. Razzien wie diese seien darauf angelegt, unter dem Deckmantel des nationalen Sicherheitsgesetzes die Pressefreiheit und Stimmen von Dissidenten zu unterdrücken, teilte die Partei Civic mit. Mehrere Hongkonger Journalistenverbände äußerten sich in einer gemeinsamen Mitteilung ""schockiert"" über das Vorgehen der Polizei. Neben Lai wurden auch seine beiden Söhne Timothy und Ian sowie mehrere Mitglieder der Geschäftsführung in Gewahrsam genommen. Ein Großaufgebot von Beamten durchsuchte die Büros von Lais Firma Next Digital sowie die Räume der ""Apple Daily"". Die Polizei nahm auch die bekannte Aktivistin Agnes Chow sowie ihre Mitstreiter Wilson Li und Andy Li fest. Insgesamt war am Montag von mindestens zehn Festnahmen die Rede. Die Verhaftungswelle sowie die Durchsuchung des Hongkonger Medienunternehmens durch mehr als 200 Polizisten sind die bisher schärfsten und sichtbarsten Maßnahmen gegen die Hongkonger Demokratiebewegung, seit Peking Ende Juni das Gesetz zum Schutz der nationalen Sicherheit in seiner Sonderverwaltungszone in Kraft setzte.  steht wegen seiner Hongkong-Politik massiv in der Kritik. Das Gesetz richtet sich gegen Aktivitäten, die China als subversiv, separatistisch oder terroristisch ansieht. Es ist der bisher weitestgehende Eingriff in Hongkongs Autonomie, und er gibt Chinas Staatssicherheit weitreichende Vollmachten. Hongkongs demokratische Opposition geht davon aus, dass das Gesetz auf sie abzielt. Seit der Rückgabe der früheren britischen Kronkolonie 1997 an China wurde Hongkong autonom mit eigenen Freiheitsrechten regiert. Aus Sicht von Kritikern bedeutet das Staatssicherheitsgesetz das Ende des seither verfolgten Grundsatzes ""ein Land, zwei Systeme"". Auch wird es als Verstoß gegen die völkerrechtlichen Verpflichtungen Chinas bei der Rückgabe Hongkongs betrachtet. Die Festnahme Lai sorgt in der EU für Besorgnis. Das Vorgehen verstärke die Befürchtung, dass das von China eingeführte Sicherheitsgesetz zur Einschränkung der Meinungsfreiheit und der Medien genutzt werde, teilte ein Sprecher des EU-Außenbeauftragten Josep Borrell am Montag mit. Die Europäische Union erinnere daran, dass die Achtung der   und Grundfreiheiten ein zentrales Element des Grundgesetzes und des Grundsatzes ""Ein Land, zwei Systeme"" sei. Medienfreiheit und Pluralismus seien zudem Säulen der Demokratie, da sie wesentliche Bestandteile einer offenen und freien Gesellschaft seien. Die Festnahme des Verlegers und seiner Mitarbeiter sei eine ""beunruhigende Demonstration dessen, wie die Behörden von Hongkong beabsichtigen, das neue nationale Sicherheitsgesetz zur Bedrohung der Pressefreiheit einzusetzen"", sagte Nicholas Bequelin, Regionaldirektor für Asien-Pazifik-Raum bei der Menschenrechtsorganisation Amnesty International: ""Es scheint, dass Jimmy Lai und ""Apple Daily"" aufgrund der Kritik der Zeitung an der chinesischen und der Hongkonger Regierung ins Visier genommen wurden"". Vor den Festnahmen hatten die USA am Freitag Sanktionen gegen Hongkongs Regierungschefin Carrie Lam und weitere Politiker in Kraft gesetzt, was in Hongkong auf scharfe Kritik stieß. Als Reaktion auf Sanktionen verkündete die Führung in Peking am Montag eigene Strafmaßnahmen gegen elf US-Bürger. Wie Chinas Außenministerium mitteilte, wurden Sanktionen gegen die US-Senatoren Marco Rubio, Ted Cruz, Pat Toomey, Josh Hawley und Tom Cotton sowie dem Kongressabgeordneten Chris Smith verhängt. Auf der Liste stehen auch Kenneth Roth von der Menschenrechtsorganisation Human Rights Watch und Michael Abramowitz, Präsident der von der US-Regierung finanzierten Organisation Freedom House. Es gab keine Informationen dazu, wie die Sanktionen konkret aussehen. Hongkongs Regierungschefin Lam war zuletzt wegen der umstrittenen Verschiebung der Wahl in Hongkong um ein Jahr kritisiert worden. Sie hatte politische Motive bestritten und den Wahlaufschub mit dem Coronavirus-Risiko nach dem Anstieg an Neuinfektionen begründet. Die Außenminister der USA, Großbritanniens, Kanadas, Neuseelands und Australiens fordern die Regierung in Hongkong dazu auf, die Wahl baldmöglichst durchzuführen. Dafür müssten auch die disqualifizierten Kandidaten wieder zugelassen werden, forderten sie am Sonntag in einer gemeinsamen Stellungnahme. Nur so könne es eine Wahl geben, die ""die demokratischen Rechte und Freiheiten"" der Bürger Hongkongs respektiere. Die jüngste Einmischung Pekings in Hongkong durch das Sicherheitsgesetz sei ""sehr besorgniserregend"". Dadurch würden die Grundrechte und Freiheiten der Bürger Hongkongs unterhöhlt, hieß es. © dpa-infocom, dpa:200810-99-105897/7 Hongkong China Menschenrechte","sueddeutsche, DPA"
Internet. Tiktok-Chef tritt nach wenigen Monaten zurück,no_author,2020-08-27 10:49:09,https://www.sueddeutsche.de/service/internet-tiktok-chef-tritt-nach-wenigen-monaten-zurueck-dpa.urn-newsml-dpa-com-20090101-200827-99-327055,"Washington (dpa) - Tiktok-Chef Kevin Mayer wirft nach nur wenigen Monaten das Handtuch bei der populären Video-App, die unter politischen Druck aus dem Weißen Haus geraten ist. Die jüngste Entwicklung habe dazu geführt, dass der Chefposten eine andere Bedeutung haben würde als bei Mayers Verpflichtung geplant gewesen sei, teilte   am Donnerstag mit. Derzeit verhandelt der Software-Riese Microsoft über einen Kauf des Geschäfts von Tiktok in den USA und mehreren anderen Ländern. Die Video-App gehört zum chinesischen Bytedance-Konzern. US-Präsident Donald Trump hatte amerikanischen Firmen und Bürgern Geschäfte mit Tiktok untersagt, das Verbot soll Mitte September greifen. Ohne einen Verkauf droht Tiktok damit das Aus in den  . Trump bezeichnet Tiktok als Sicherheitsrisiko, weil über die App chinesische Behörden Zugriff auf Daten von Amerikanern bekommen könnten. Tiktok und Bytedance weisen den Vorwurf zurück und zogen diese Woche vor Gericht. Dass Mayer ein in den USA arbeitender Amerikaner ist, betonten sie oft als Beweis dafür, dass Tiktok unabhängig von China agiere. Mayer trat den Chefposten bei Tiktok erst vor wenigen Monaten an. Er kam vom Unterhaltungsriesen Disney. Dort war er für das Streaming-Geschäft verantwortlich - und galt insbesondere nach dem erfolgreichen Start des Dienstes Disney+ als Kronprinz. Doch zum neuen Konzernchef wurde überraschend für viele Branchenbeobachter der zuvor für die Freizeitparks zuständige Manager Bob Chapek berufen. Mayer wechselte daraufhin im Mai zu Tiktok, wo er die globale Expansion anführen sollte. Als erste hatte die ""Financial Times"" über Mayers Rückzug berichtet. Die Zeitung zitierte aus einer E-Mail Mayers an die Mitarbeiter. Dort verwies er unter anderem auf die drohende Aufspaltung des Tiktok-Geschäfts. Die Führung solle kommissarisch Top-Managerin Vanessa Pappas übernehmen, hieß es weiter. Tiktok ist die erste global erfolgreiche Online-Plattform eines chinesischen Konzerns, die in der Liga von Facebook und Co spielt. Nach jüngsten Angaben hat Tiktok weltweit knapp 690 Millionen mindestens einmal im Monat aktive Nutzer. In den USA seien es rund 100 Millionen - von denen rund 50 Millionen täglich auf Tiktok zugreifen. Trump ordnete Mitte August zusätzlich an, dass Bytedance sich binnen drei Monaten von allen Daten von Nutzern in den Vereinigten Staaten trennen müsse. Auch dürfe Bytedance in den USA danach kein Eigentum mehr besitzen, das für den Betrieb von Tiktok genutzt werde. © dpa-infocom, dpa:200827-99-327055/2 Tiktok USA","sueddeutsche, DPA"
Konjunktur. Chinas Automarkt legt zu - Deutliches Plus im Juli,no_author,2020-08-11 15:09:15,https://www.sueddeutsche.de/wirtschaft/konjunktur-chinas-automarkt-legt-zu-deutliches-plus-im-juli-dpa.urn-newsml-dpa-com-20090101-200811-99-124452,"Peking (dpa) - Der für die deutschen Autobauer so wichtige chinesische Markt ist auf Erholungskurs. Das zeigen auch die neuesten Daten des Branchenverbandes PCA (  Passenger Car Association) - nach den bereits positiven Zahlen des Herstellerverbandes CAAM in der vergangenen Woche. Im Juli seien 1,63 Millionen Pkw, SUVs und kleinere Nutzfahrzeuge an die Kunden gegangen, meldete der Branchenverband PCA in Peking. Das sei ein Plus von 7,9 Prozent gegenüber dem Vorjahr. Der PCA zählt den Verkauf von Autos an die Endkunden. Der Herstellerverband CAAM (China Association of Automobile Manufacturers) hingegen misst den Absatz der Hersteller an die Händler. Vor einer Woche hatte der CAAM erste Juli-Zahlen vorgelegt. Danach stieg der Absatz von Pkw und Nutzfahrzeugen von den Herstellern an die Händler im Jahresvergleich um 14,9 Prozent auf 2,08 Millionen Fahrzeuge. China ist der mit Abstand wichtigste Einzelmarkt der deutschen Autokonzerne Volkswagen (inklusive Audi und Porsche),   und BMW. Die Covid-19-Pandemie hatte in China früh im Jahr das Wirtschaftsleben lahmgelegt, allerdings fuhren die Autofabriken auch früher als in Europa und Nordamerika wieder hoch. © dpa-infocom, dpa:200811-99-124452/2 China Daimler","sueddeutsche, DPA"
Börsen. Dax schließt klar im Plus,no_author,2020-08-11 18:20:25,https://www.sueddeutsche.de/wirtschaft/boersen-dax-schliesst-klar-im-plus-dpa.urn-newsml-dpa-com-20090101-200811-99-122181,"Frankfurt/Main (dpa) - Die Hoffnungen auf ein weiteres US-Konjunkturpaket und stark steigende Automobilwerte haben den   am Dienstag kräftig angeschoben. Der deutsche Leitindex hatte im Handelsverlauf zum ersten Mal seit fast drei Wochen wieder die Marke von 13.000 Punkten übersprungen und schloss noch 2,04 Prozent höher bei 12.946,89 Punkten. Der MDax der mittelgroßen Werte gewann 1,60 Prozent auf 27.609,69 Punkte. Der Automarkt in China erholt sich weiter. Davon profitierten die Aktien aus dem europäischen Automobilsektor. Hierzulande waren Volkswagen (VW), BMW und Continental die Favoriten im Dax mit Kursgewinnen von zwischen gut fünf und rund neun Prozent. Die Aktien von Fraport zogen unter den besten Werten im MDax um fast sieben Prozent an. Warburg Research zufolge ist in den Papieren des Flughafenbetreibers zu viel Pessimismus eingepreist. Die Anteilscheine von Zalando schlossen nach der Bekanntgabe von detaillierten Quartalszahlen knapp zwei Prozent höher. Zuvor hatten sie erstmals die Marke von 69 Euro geknackt. Der Kochboxenversender Hellofresh hatte am Vorabend erneut seine Prognose erhöht und entwickelt sich immer mehr zu einem der größten Gewinner der Corona-Krise. Die in diesem Jahr bereits sehr gut gelaufen Anteilscheine waren im frühen Handel in der Spitze um mehr als acht Prozent in die Höhe geschnellt, bevor die Anleger Gewinne mitnahmen. Am Ende gaben die Aktien um 0,35 Prozent nach. Für die Anteilsscheine von Uniper ging es als Schlusslicht im MDax um fast fünf Prozent nach unten. Ein Händler nannte den Halbjahresbericht des Energiekonzerns durchwachsen. Im Nebenwerteindex SDax kamen den Papieren von 1&1 Drillisch bei einem Plus von rund vier Prozent konkretisierte Prognosen zugute. Der Mobilfunkanbieter rechnet im laufenden Geschäftsjahr mit mehr Umsatz. Der EuroStoxx endete mit einem Plus von 2,22 Prozent auf 3332,12 Punkte. In Paris zog der Cac 40 noch deutlicher an, wohingegen der FTSE 100 in London um 1,7 Prozent stieg. Der New Yorker Dow Jones Industrial stand zum europäischen Handelsschluss knapp 1 Prozent im Plus. Am Rentenmarkt stagnierte die Umlaufrendite bei minus 0,53 Prozent. Der Rentenindex Rex stieg um 0,01 Prozent auf 145,71 Punkte. Der Bund Future sank um 0,39 Prozent auf 176,70 Punkte. Der Kurs des Euro stieg. Die Europäische Zentralbank setzte den Referenzkurs auf 1,1783 (Montag: 1,1763) US-Dollar fest. Der Dollar kostete damit 0,8487 (0,8501) Euro. © dpa-infocom, dpa:200811-99-122181/7 Dax","sueddeutsche, DPA"
Industrie - München. IW Köln: Bayern hinter USA zweitbester Industriestandort,no_author,2020-08-11 08:43:30,https://www.sueddeutsche.de/wirtschaft/industrie-muenchen-iw-koeln-bayern-hinter-usa-zweitbester-industriestandort-dpa.urn-newsml-dpa-com-20090101-200811-99-121686," (dpa/lby) - Bayern ist nach einer neuen Studie nach den USA international zweitbester Standort für Industrieunternehmen. Das schreiben die Ökonomen des Wirtschaftsforschungsinstituts IW Köln in ihrem Vergleich von 45 Industrieländern. Auf Platz drei landete die Schweiz, auf Platz fünf Deutschland als Ganzes. Andere Bundesländer sind in der am Dienstag in München veröffentlichten Studie nicht berücksichtigt. Auftraggeber war die Vereinigung der bayerischen Wirtschaft (vbw), der Dachverband der Arbeitgeber im Freistaat. Das IW untersuchte 61 Indikatoren in sechs Themengebieten von der Qualität der öffentlichen Verwaltung über das Bildungssystem und den Kapitalmarkt bis zu den Lohnkosten. Unter den Top Ten finden sich außer den USA,   und Deutschland vier weitere europäische Länder sowie Japan, Neuseeland und Australien, aber kein Schwellenland. Die Großmacht China liegt auf Platz 24 noch hinter Malaysia. Die Auswertung basiert auf Daten des Jahres 2018, die Auswirkungen der Corona-Pandemie sind noch nicht eingeflossen. ""Die traditionellen Industrieländer weisen im Durchschnitt eine wesentlich bessere Standortqualität auf als die Schwellenländer"", heißt es in der Untersuchung. ""Hohe Kosten - vor allem für Arbeit sowie Treibstoffe oder Energie und in vielen Fällen auch Steuern - sind die größten Nachteile der Industrieländer gegenüber den Schwellenländern."" Bayern zeichnet sich unter anderem dadurch aus, dass der Anteil der Industrie an der Wirtschaftsleistung seit 2005 sogar gestiegen ist - in den meisten traditionellen Industriestaaten hat die Bedeutung der Industrie in den vergangenen Jahrzehnten ab- und nicht zugenommen. Die Stärken des Freistaats bestehen nach Einschätzung der Kölner Wirtschaftswissenschaftler unter anderem in guten staatlichen Rahmenbedingungen, einem sehr guten Umfeld für Innovationen und guter Infrastruktur. Die USA schneiden aber in einigen Bereichen noch besser ab, etwa bei den Kosten, Rohstoffen und beim Kapitalmarkt. Denn bei den Kosten liegen sowohl   als auch andere europäische Länder auf den hinteren Plätzen. Das beinhaltet sowohl die Löhne als auch Energiepreise und Steuern. In dieser Hinsicht rangiert Bayern auf Platz 43 fast am Tabellenende, Deutschland auf Platz 40. ""Nach wie vor ist die Kostenentwicklung ein massiver Nachteil"", kritisierte vbw-Hauptgeschäftsführer Bertram Brossardt. Die Wettbewerbsfähigkeit müsse dringend gestärkt werden. ""Das gelingt durch eine Verringerung der Steuerbelastung, eine maßvolle Tarifpolitik und einen konsequenten Bürokratieabbau."" München Bayern Deutschland","sueddeutsche, DPA"
Freizeit. Erfolgschancen bei Everest-Expedition verdoppelt,no_author,2020-08-27 11:51:46,https://www.sueddeutsche.de/leben/freizeit-erfolgschancen-bei-everest-expedition-verdoppelt-dpa.urn-newsml-dpa-com-20090101-200827-99-325000,"Kathmandu (dpa) - Wer zum ersten Mal den   in der Hauptsaison im Frühling besteigen will, hat heutzutage doppelt so hohe Erfolgschancen wie noch vor etwa 20 Jahren. Gleichzeitig blieb die Sterberate nahezu unverändert, wie US-Forscher im Fachjournal ""PLOS One"" berichten. Wie aus den Daten des Expeditionsarchivs ""Himalayan Database"" hervorgeht, schaffte es zwischen 1990 und 2005 knapp ein Drittel der Bergsteiger in der Hauptsaison beim ersten Versuch auf den höchsten Gipfel der Welt. Zwischen 2006 und 2019 waren es dagegen etwa zwei Drittel. Die Todesrate blieb in beiden Zeitperioden ähnlich und lag um etwa ein Prozent. Mögliche Gründe für die höhere Wahrscheinlichkeit, den Gipfel des 8848 Meter hohen Bergs an der Grenze von   zu China zu erklimmen, sind laut Ko-Autor Raymond Huey von der University of Washington in Seattle unter anderem bessere Wettervorhersagen, die es Bergsteigern erlaubten, gute Zeitfenster für den Gipfelvorstoß zu finden. Zudem nutzten Bergsteiger mehr Sauerstoff aus Flaschen - und zwar auch bereits ab geringerer Höhe. Ferner gebe es auf den gängigen Routen vermehrt verankerte Seile. Den größeren Erfolg erklären könnte demnach auch die größere Erfahrung der Helferteams, die die Alpinisten den Berg hinaufführen und ihr Gepäck tragen. All dies könnte dazu beitragen, dass die Erfahrung von Bergsteigern an Bedeutung verliere. Der Studie zufolge hatten jene Bergsteiger, die den Gipfel zwischen 2006 und 2019 in Angriff nahmen, tendenziell weniger Erfahrung als die, die es zwischen 1990 und 2005 versuchten. Inzwischen kamen schon ein 80-Jähriger, ein 13-Jähriger und ein Blinder auf den Everest. Auch das Alter spielt eine Rolle: Generell schaffen es jüngere Bergsteiger zwar eher als ältere auf den Gipfel und wieder zurück. Doch ältere Bergsteiger haben deutlich bessere Chancen als früher: Ein 60-Jähriger etwa hat den Berechnungen der Forscher zufolge heute eine ähnlich hohe Erfolgschance wie ein 40-Jähriger in der früheren Zeitperiode - konkret rund 40 Prozent. Die große Mehrheit der Everest-Bergsteiger sind Männer. Aber in den vergangen 30 Jahren haben zunehmend auch Frauen den Gipfel erklommen. Zwischen 1990 und 2005 waren es gut 9 Prozent, zwischen 2006 und 2019 rund 15 Prozent. Die Chance, den Gipfel zu erreichen, lag für Frauen sogar noch etwas höher als für Männer: Von den Frauen schafften dies im Zeitraum von 2006 bis 2019 gut 68 Prozent, von den Männern gut 64 Prozent. © dpa-infocom, dpa:200827-99-325000/2 Mount Everest Nepal","sueddeutsche, DPA"
Medien. Verleger Jimmy Lai in Hongkong gegen Kaution wieder frei,no_author,2020-08-11 20:13:12,https://www.sueddeutsche.de/wirtschaft/medien-verleger-jimmy-lai-in-hongkong-gegen-kaution-wieder-frei-dpa.urn-newsml-dpa-com-20090101-200811-99-130846," (dpa) - Nach mehr als 40 Stunden Polizeigewahrsam ist der Medienunternehmer Jimmy Lai in Hongkong gegen Kaution wieder freigelassen worden. Beim Verlassen eines Polizeireviers wurde der Verleger von mehreren Dutzend Anhängern der Demokratiebewegung bejubelt. Der Zeitung ""South   Morning Post"" zufolge musste Lai umgerechnet rund 32.000 Euro Kaution sowie eine zusätzliche Sicherheitszahlung hinterlegen. Auch mehrere andere Aktivisten kamen gegen Kaution frei. Lai, dem unter anderem die pro-demokratische Zeitung ""Apple Daily"" gehört, war zusammen mit Mitstreitern am Montag bei einem großen Polizeieinsatz festgenommen worden. Dem 71-Jährigen wurden geheime Absprachen mit Kräften im Ausland, Betrug und andere Verstöße zur Last gelegt. Kurz nach Mitternacht kam er wieder auf freien Fuß. Im vergangenen Jahr hatte Lai mehrfach zur Teilnahme an Protestmärschen gegen Peking aufgerufen, wozu Hunderttausende auf den Straßen waren. Die Festnahmen waren der bislang größte Schlag gegen die Demokratiebewegung seit Einführung eines umstrittenen Sicherheitsgesetzes durch China Ende Juni. Peking steht wegen seiner Politik in der 7,5-Millionen-Einwohner-Stadt massiv in der Kritik. Aus Protest gegen die Festnahmen wurde ""Apple Daily"" am Dienstag von Hongkongern massenhaft gekauft. Das Gesetz richtet sich gegen Aktivitäten, die die kommunistische Führung in Peking als subversiv, separatistisch oder terroristisch ansieht. Seit Rückgabe der früheren britischen Kronkolonie 1997 an China wurde Hongkong autonom mit eigenen Freiheitsrechten regiert. Aus Sicht von Kritikern bedeutet das Gesetz nun das Ende des seither verfolgten Grundsatzes ""ein Land, zwei Systeme"". Auch wird es als Verstoß gegen die völkerrechtlichen Verpflichtungen Chinas bei der Rückgabe Hongkongs betrachtet. ""Apple Daily"" war am Dienstag in einigen Geschäften früh ausverkauft. Vor anderen Läden bildeten sich lange Schlangen. Die Zeitung berichtete in ihrer aktuellen Ausgabe ausführlich über die Verhaftungswelle und die Durchsuchung ihrer Räume. Daran waren am Vortag mehr als 200 Polizisten beteiligt. Auf dem Titel stand in großen Lettern: ""Apple Daily muss weiter kämpfen"". Rückenwind erlebte der Konzern Lais auch an der Börse. Der Kurs von Next Digital, der Muttergesellschaft der ""Apple Daily"", legte zeitweise um mehr als 300 Prozent zu. © dpa-infocom, dpa:200811-99-130846/3 Hongkong China","sueddeutsche, DPA"
Wirtschaftspolitik - Stuttgart. Baden-Württemberg eröffnet Wirtschaftsrepräsentanz in Israel,no_author,2020-08-10 16:00:29,https://www.sueddeutsche.de/politik/wirtschaftspolitik-stuttgart-baden-wuerttemberg-eroeffnet-wirtschaftsrepraesentanz-in-israel-dpa.urn-newsml-dpa-com-20090101-200810-99-114950," (dpa/lsw) - Baden-Württemberg will im Oktober eine neue Wirtschaftsrepräsentanz in Israel eröffnen. Das bestätigte eine Sprecherin des Landeswirtschaftsministeriums am Montag auf Anfrage. Wirtschaftsministerin Nicole Hoffmeister-Kraut (CDU) sagte der ""Heilbronner Stimme"" und dem ""Mannheimer Morgen"" (Dienstag) zu den Plänen, die neue Außenstelle solle einerseits als Kontaktstelle für Unternehmen dienen, andererseits auch Trends und Innovationen in Israel identifizieren. Die Wirtschaft des kleinen Mittelmeerstaates mit seinen etwa neun Millionen Einwohnern ist stark auf den Export ausgelegt. Der deutsch-israelischen Handelskammer zufolge gilt dies seit knapp 20 Jahren auch für die Hightech-Produktion. Das Land wirbt für seine Innovationskraft mit dem Slogan ""  Start-up Nation"". Dies lockt aus Baden-Württemberg Unternehmen wie den Autobauer Daimler an. Die Wirtschaftsrepräsentanz ist zunächst für zwei Jahre angelegt und kostet nach Angaben der beiden Zeitungen für diesen Zeitraum 174 400 Euro. Baden-Württemberg betreibt bisher bereits solche Anlaufstellen in Brasilien, China, Japan, Südkorea, Indien und den USA. Stuttgart Israel","sueddeutsche, DPA"
Agrar - Pähl. Kornkreis am Ammersee soll erst mal stehen bleiben,no_author,2020-08-12 16:07:22,https://www.sueddeutsche.de/wirtschaft/agrar-paehl-kornkreis-am-ammersee-soll-erst-mal-stehen-bleiben-dpa.urn-newsml-dpa-com-20090101-200812-99-142324," (dpa/lby) - Der Kornkreis am oberbayerischen Ammersee soll erst einmal stehen bleiben. Am Mittwoch erntete zwar ein Mähdrescher das Getreide um den Kornkreis herum. Doch ""die Leute sollen ihn noch ein paar Tage haben können"", sagte der Landwirt und Pächter des Feldes, Georg Steingruber, am Mittwoch. Menschen aus aller Welt seien schon vorbei gekommen, etwa aus den USA, China, Senegal und vielen Ländern Europas - bis zu 150 täglich. Spirituell werde es auf dem Feld in Pähl (Landkreis Weilheim-Schongau), wenn es dunkel wird: ""Das sind am Abend noch mal Hundert, die da mit Kerzen drinhocken und singen"", sagte Steingruber. ""Manche nutzen das, um ihre spirituellen Erfahrungen zu machen und zu meditieren"". Wenn sich ein Bäcker findet, dann will Steingruber ""Energie-Brot"" aus dem Kornkreis-Weizen für Esoteriker backen lassen - und sich ein bisschen was dazu verdienen. Denn durch den Kornkreis selbst sei ihm ein Schaden bei der Ernte entstanden und weil die vielen Schaulustigen teilweise das Getreide niedertrampelten. Wie viel Geld in die Spendenkasse, die Steingruber aufgehangen hatte, geworfen wurde, weiß der 35-Jährige indes noch nicht. Es sei noch nicht gezählt und dürfe nicht all zu viel sein. Pähl","sueddeutsche, DPA"
Maschinenbau - Wiesloch. Heidelberger Druckmaschinen sieht Effekte der Neuausrichtung,no_author,2020-08-13 07:59:47,https://www.sueddeutsche.de/wirtschaft/maschinenbau-wiesloch-heidelberger-druckmaschinen-sieht-effekte-der-neuausrichtung-dpa.urn-newsml-dpa-com-20090101-200813-99-149089,"Wiesloch (dpa) - Die im Frühjahr angestoßene Neuausrichtung der Heidelberger Druckmaschinen AG zeigt nach Unternehmensangaben erste Ergebnisse. Zwar schlug sich die Corona-Krise im ersten Quartal des Geschäftsjahres, das immer am 1. April beginnt, heftig auf den Umsatz nieder, und auch der Auftragseingang fiel deutlich geringer aus als im Vorjahresquartal. Die Erlöse gingen um rund ein Drittel auf etwa 330 Millionen Euro zurück, der Auftragseingang um 44 Prozent auf 346 Millionen Euro zurück. Trotzdem sei es gelungen, das Quartal mit einem Gewinn nach Steuern von fünf Millionen Euro abzuschließen, teilte das Unternehmen am Donnerstag mit. Im ersten Quartal des Vorjahres hatte Heidelberg noch 31 Millionen Euro Verlust gemacht. Der Druckmaschinenhersteller hatte im Frühjahr angekündigt, sich neu aufzustellen, Strukturen zu straffen, Verlustbringer und ""Randaktivitäten"" loszuwerden. Außerdem sollen rund 1600 Stellen gestrichen werden. Mittelfristig soll das rund 100 Millionen Euro einsparen und damit die Profitabilität verbessern. Für die kommenden Monate ließen sich inzwischen verschiedene positive Tendenzen erkennen, hieß es. Vor allem im größten Markt China nehme das Geschäft wieder Fahrt auf. Dennoch bleibe eine erhebliche Unsicherheit bestehen. Wie bereits angekündigt werde der Umsatz im Gesamtjahr deutlich unter dem Vorjahresniveau von gut 2,3 Milliarden Euro bleiben. Beim Ergebnis geht die Heidelberger Druckmaschinen AG zwar davon aus, sich im Vergleich zum Vorjahr deutlich zu verbessern. Trotzdem seien unter dem Strich erneut rote Zahlen zu erwarten.","sueddeutsche, DPA"
