title,author,date_published,url,article_text,source
Konflikte. Sicherheitsrat schmettert US-Vorschlag zu Iran ab,no_author,2020-08-15 10:52:12,https://www.sueddeutsche.de/politik/konflikte-sicherheitsrat-schmettert-us-vorschlag-zu-iran-ab-dpa.urn-newsml-dpa-com-20090101-200815-99-177723,"New York (dpa) – Nach der deutlichen Ablehnung eines US-Vorschlags zur Verlängerung des Waffen-Embargos gegen den   steuert der UN-Sicherheitsrat auf eine Krise zu. Nur zwei der 15 Mitglieder des Sicherheitsrates stimmten dem Text zu, wie bei einer Sitzung des mächtigsten UN-Gremiums am Freitag verkündet wurde. Elf Staaten, darunter dem Vernehmen nach auch Deutschland, Frankreich und Großbritannien, enthielten sicht. Russland und   stimmten gegen den Entwurf. Die  , die im Sicherheitsrat beim Thema Iran weitgehend isoliert sind, drohten nach dem Scheitern ihrer Resolution erneut damit, das Atomabkommen mit dem Iran komplett aus den Angeln zu heben. ""In den kommenden Tagen werden die Vereinigten Staaten das Versprechen einhalten, vor nichts Halt zu machen, um das Waffenembargo zu verlängern"", teilte die amerikanische UN-Botschafterin Kelly Craft mit. US-Außenminister Mike Pompeo nannte das Ergebnis vom Freitag ""unentschuldbar"". Hintergrund ist das Auslaufen des aktuellen Embargos im Oktober. Seine Verlängerung befürworten neben den USA im Prinzip auch  , Frankreich und Großbritannien - doch den vorgelegten Entwurf der Amerikaner lehnen eine Reihe von Mitgliedern des UN-Sicherheitsrats auch wegen der darin festgeschriebenen unbegrenzten Dauer des Embargos ab. Der US-Vorstoß wird dabei nur als Vorgeplänkel der Trump-Regierung gesehen. Denn wenn der Entwurf zum Waffen-Embargo scheitere, so die Drohung, könnten die Amerikaner den sogenannten Snapback-Mechanismus auslösen: Eine Möglichkeit für die Staaten des Atomdeals, iranische Verstöße anzuprangern und damit schließlich die Wiedereinsetzung aller internationalen Sanktionen aus der Zeit vor dem Abkommen zu erreichen - ohne, dass dies durch ein Veto anderer Mitglieder verhindert werden könnte. Kremlchef Wladimir Putin hatte am Freitag einen Videogipfel des UN-Sicherheitsrats gefordert. Daran sollten auch Deutschlands Bundeskanzlerin Angela Merkel sowie Irans Präsident Hassan Ruhani teilnehmen. US-Außenminister Pompeo sagte in Wien, die USA würden keinen Millimeter von ihrer Forderung abweichen. Teheran wiederum droht mit dem Ausstieg aus dem Atomabkommen, falls der Sicherheitsrat das Embargo verlängern sollte. Deutschland setzt dabei weiter auf Verhandlungen bis zum Auslaufen der Resolution in mehr als zwei Monaten. Es ist dabei umstritten, ob die USA zum Auslösen des Mechanismus berechtigt sind, denn die Trump-Regierung war 2018 aus dem Deal ausgestiegen. Die Amerikaner sind der Auffassung, dass ihre Nennung in der UN-Resolution ausreicht, die das Atomabkommen in internationales Recht übersetzt - die anderen Länder des Atomabkommens sehen das anders. Die USA hatten zuletzt ihren Ton in Richtung Deutschlands, Frankreichs und Großbritanniens deutlich verschärft: ""Verletzte Gefühle über den Rückzug der USA aus dem Atomabkommen sind für mich keine Entschuldigung für die Bewaffnung von Terroristen"", sagte die amerikanische UN-Botschafterin Kelly Craft im Interview der Deutschen Presse-Agentur. Sie deutete dabei aber auch weitere Gesprächsbereitschaft an: ""Ich hoffe, dass wir - bevor wir uns der Auslösung des Snapbacks bedienen müssen - zu einer Art Kompromiss kommen können"". Der diplomatische Streit im mächtigsten UN-Gremium könnte im schlimmsten Fall zu einer Spaltung des Sicherheitsrates bei der Frage führen, ob die alten Sanktionen gegen den Iran nun wieder gelten oder nicht. Westliche Diplomaten kündigten an, dass die meisten Länder einen von den USA ausgelösten Snapback faktisch ignorieren könnten. Dies könnte zu Verwerfungen auch zwischen Europa und den USA führen. Die UN-Vetomächte USA, China, Russland,   und Großbritannien sowie Deutschland und der Iran hatten sich 2015 in Wien auf das Abkommen geeinigt, das Teheran eine friedliche Nutzung der Kernkraft gestattet, aber die Entwicklung von Atomwaffen verwehrt. Es stellte die iranische Atomindustrie unter Kontrolle und sagte den Abbau westlicher Wirtschaftssanktionen zu. US-Präsident Donald Trump ist seit Jahren gegen den Atomdeal - ihm dürfte der Snapback für seine Kampagne des maximalen Drucks auf Teheran gut passen. © dpa-infocom, dpa:200815-99-177723/3 Iran China USA Deutschland Frankreich","sueddeutsche, DPA"
Börsen. Corona-Sorgen drücken Dax ins Minus,no_author,2020-08-14 18:21:11,https://www.sueddeutsche.de/wirtschaft/boersen-corona-sorgen-druecken-dax-ins-minus-dpa.urn-newsml-dpa-com-20090101-200814-99-163960,"Frankfurt/Main (dpa) - Der deutsche Aktienmarkt hat den Handelstag am Freitag mit Verlusten beendet. Die Anleger scheuten angesichts steigender Corona-Neuinfektionen vor dem Wochenende das Risiko. Auch fehlten dem   weiterhin die Impulse, sagten Marktbeobachter. Der deutsche Leitindex schloss mit einem Abschlag von 0,71 Prozent auf 12.901,34 Punkte. Die runde 13.000-Punkte-Marke, die das Börsenbarometer am Dienstag nach fast drei Wochen übersprungen hatte, rückte damit wieder etwas in die Ferne. Auf Wochensicht war die Bilanz aber positiv mit rund 1,8 Prozent Kursplus. Für den MDax der mittelgroßen Werte ging es noch deutlicher als für den Dax nach unten - er verlor 1,42 Prozent auf 27.313,16 Zähler. ""Steigende Corona-Zahlen in Europa haben die schwelenden Probleme den Investoren wieder vor Augen geführt und das Virus realer und damit greifbarer gemacht"", sagte Marktbeobachter Timo Emden von Emden Research. Abseits der steigenden Corona-Neuinfektionen war die Handelswoche in Frankfurt abermals durch die politischen Geschehnisse auf der internationalen Bühne geprägt. Die weiteren Verschärfungen der amerikanisch-chinesischen Spannungen und das Geschachere im US-Kongress zwischen Demokraten und Republikanern um ein neues Corona-Hilfspaket hatten die Marktteilnehmer in ihrer Risikofreude ausgebremst und für einen eher lustlosen Handel gesorgt. Laut Marktexperten bleibt die Stimmung an der Börse grundsätzlich zwar gut, allerdings wird künftig für die Märkte mit einem verlangsamten Aufwärtstempo gerechnet. Am Freitag hatten zunächst enttäuschende Wirtschaftsdaten aus China belastet gefolgt von neuen Quarantäne-Maßnahmen, vor allem in Großbritannien. Dies ging vor allem zulasten der Kurse in der Flug- und Touristikbranche. Im Dax gab es fast nur Verlierer. Besonders unter Druck mit mehr als zwei Prozent Minus gerieten Aktien des Halbleiterkonzerns Infineon, sie verloren im Einklang mit dem negativen Trend in Europa und im Gefolge der nach ihrer Rekordjagd etwas schwächeren US-Technologiebörse Nasdaq. Unternehmenszahlen lieferten zum Wochenschluss weniger Impulse als an den Tagen zuvor. Varta-Papiere litten nach ihrem Rekordhoch mit rund zehn Prozent Kursabschlag unter Gewinnmitnahmen. Der Batteriehersteller hatte am Vorabend seine Prognose erhöht. Der EuroStoxx ging mit einem Abschlag von 1,13 Prozent auf 3305,05 Zähler aus dem Handel. Der Cac 40 in Paris und der Londoner Londoner FTSE 100 verloren jeweils rund eineinhalb Prozent. Der New Yorker Dow Jones Industrial stand hingegen zum europäischen Handelsschluss moderat im Plus. Am Rentenmarkt stieg die Umlaufrendite von minus 0,47 Prozent am Vortag auf minus 0,43 Prozent. Der Rentenindex Rex fiel um 0,21 Prozent auf 145,07 Punkte. Der Bund Future gewann 0,21 Prozent auf 175,71 Punkte. Der Euro legte zu und kostete zuletzt 1,1832 US-Dollar. Die Europäische Zentralbank (EZB) hatte den Referenzkurs zuvor auf 1,1813 (Donnerstag: 1,1833) US-Dollar festgesetzt. Der Dollar kostete damit 0,8465 (0,8451) Euro. © dpa-infocom, dpa:200814-99-163960/8 Dax","sueddeutsche, DPA"
Auto - Duisburg. Dudenhöffer: Verluste der Autobauer zeigen Anpassungsbedarf,no_author,2020-08-16 09:42:37,https://www.sueddeutsche.de/wirtschaft/auto-duisburg-dudenhoeffer-verluste-der-autobauer-zeigen-anpassungsbedarf-dpa.urn-newsml-dpa-com-20090101-200816-99-184567,"München (dpa) - Die sehr unterschiedlichen Ergebnisse der Autobauer im ersten Halbjahr haben nach Einschätzung des Branchenexperten Ferdinand Dudenhöffer ""verdeckte Probleme offengelegt"". Der Autoabsatz des VW-Konzerns sei um 28 Prozent, von Toyota um 29 Prozent eingeknickt. Aber Volkswagen habe pro Auto 415 Euro Verlust gemacht, während Toyota 533 Euro und die französische Opel-Mutter PSA sogar 707 Euro Gewinn je Auto erwirtschaftet hätten. Das zeige, ""dass im VW-Konzern sicher stärkere Anpassungen als bei Toyota erfolgen müssen"", schrieb Dudenhöffer in einer Studie. Die Zeit dränge, denn VW habe vom China-Geschäft profitiert, das bei PSA noch kaum vorhanden sei. Und mit der Fusion von PSA und Fiat Chrysler würden auch die Größenvorteile von VW geringer. Ebenso überraschend sei der Vergleich in der Oberklasse. Der Verlust pro verkauftem Auto betrage bei BMW rund 1100 Euro, bei Mercedes und Audi weniger als 600 und bei Volvo nur 343 Euro, obwohl sie ähnliche Absatzeinbrüche hatten. Hohe Verluste in der Corona-Krise seien ""ein Indikator für den Anpassungsbedarf der einzelnen Unternehmen"", schrieb der Branchenkenner. Denn die Erholung der Automärkte in Europa und Amerika werde sehr lange dauern. ""Kapazitäten müssen daher abgebaut werden."" Trotz Krise verdiente Porsche fast 10 000 Euro an jedem Auto, Tesla fast 3000 Euro. Den Gewinn des US-Elektropioniers durch den Verkauf von CO2-Zertifikaten an andere Autobauer rechnete Dudenhöffer dabei mit ein. Im Gegensatz zu allen anderen investiere Tesla in neue Werke. GM habe sich auf die Märkte in Amerika und China konzentriert und mache Gewinn - Ford schreibe tiefrote Zahlen. Der neue Ford-Chef Jim Farley dürfte in den nächsten Monaten abwägen, ob und wie das Europa-Geschäft nachhaltig restrukturiert werden könne, erwartet Dudenhöffer.","sueddeutsche, DPA"
Konjunktur. Japans Wirtschaft mit Rekordeinbruch,no_author,2020-08-17 10:12:40,https://www.sueddeutsche.de/wirtschaft/konjunktur-japans-wirtschaft-mit-rekordeinbruch-dpa.urn-newsml-dpa-com-20090101-200817-99-191971,"Tokio (dpa) - Japans Wirtschaft hat im Zuge der Corona-Krise einen Rekordeinbruch erlitten. Das Bruttoinlandsprodukt (BIP) der vor Deutschland drittgrößten Volkswirtschaft der Welt sank im zweiten Quartal dieses Jahres - auf das Jahr hochgerechnet - um real 27,8 Prozent, wie die Regierung in Tokio am Montag auf vorläufiger Basis bekanntgab.   war bereits in den beiden Vorquartalen geschrumpft und steckt damit in einer Rezession. Dass der Einbruch diesmal noch viel heftiger ausfallen würde, hatten Ökonomen erwartet. Im laufenden Quartal rechnen sie zwar wieder mit einem Aufschwung, doch trübt die Sorge über eine neue Infektionswelle im Land die Erholungsaussichten. Experten rechnen damit, dass es noch Jahre dauert, bis sich Japan vollständig von den Auswirkungen der globalen Pandemie erholen wird. Der Rückgang der wirtschaftlichen Leistung im zweiten Quartal ist der stärkste, den das Land seit 1980, dem Beginn der Aufzeichnung vergleichbarer Daten, verzeichnet hat. Im Vergleich zum vorangegangenen Quartal ergab sich nach den vorläufigen Berechnungen ein Minus von 7,8 Prozent. Japan war bereits vor Ausbruch der Corona-Pandemie infolge des Handelskonflikts zwischen den beiden größten Volkswirtschaften der Welt - USA und China - geschwächt. Hinzu kamen die Folgen einer Mehrwertsteueranhebung im vergangenen Jahr. Dann kam die Corona-Krise; die zwischen April und Ende Mai erlassenen Einschränkungen trafen die schwache Wirtschaft mit Wucht. Der Privatkonsum, der in Japan zu rund 60 Prozent zur Wirtschaftsleistung des Landes beiträgt, sank im Vergleich zum Vorquartal um 8,2 Prozent. Dennoch: Da Japan anders als andere Länder keinen harten Lockdown verhängte, fiel der Einbruch noch relativ milde aus. Hätte Japan die gleichen harten Ausgangsbeschränkungen wie in Europa oder den USA erlassen, wäre der wirtschaftliche Einbruch noch schlimmer ausgefallen, ist sich Taro Saito vom NLI Research Institute sicher. Doch werde die geschwächte Einkommenssituation der Privathaushalte und Firmen die Wirtschaft weiter belasten. ""Wir können nicht sagen, dass die Lage der japanischen Wirtschaft besser ist als die anderer"", sagte Saito der Nachrichtenagentur Kyodo. Sein Kollege Martin Schulz, Chefökonom beim Technologiekonzern Fujitsu in Tokio, sieht jedoch vergleichsweise positive Aspekte in Bezug auf Japans wichtigen Exportmotor. Zwar gingen die Ausfuhren um 18,5 Prozent zurück, doch hätten sie sich nicht so stark auf den Rückgang der Wirtschaftsleistung ausgewirkt wie befürchtet, so Schulz. Ein Grund dafür sei, dass Japans Lieferketten ""erstaunlich stabil"" geblieben seien. So habe die Halbleiterindustrie diesmal praktisch keine großen Probleme gehabt, sagte der Ökonom der Deutschen Presse-Agentur in Tokio. Ähnlich sei es der japanischen Pharmaindustrie ergangen. ""Die Unternehmen haben sich recht gut vorbereitet"", so Schulz. Schließlich seien Japans Ausfuhren schon im ersten Quartal zurückgegangen. Viele Unternehmen hätten sich darauf eingestellt und zum Beispiel verstärkt auf Lager produziert. So verzeichneten Japans Importe denn auch im Berichtsquartal nur einen relativ geringen Rückgang von 0,5 Prozent. Solide Einfuhren aus dem benachbarten China, dessen Wirtschaft wieder in Gang kommt, halfen Japan, den Rückgang der Importe aus den USA und Europa auszugleichen. Hinzu komme, dass der wirtschaftliche Absturz in Asien infolge der Pandemie generell geringer ausgefallen sei als andernorts, sagte Schulz. Wegen der Pandemie mussten auch die Olympischen Sommerspiele in Tokio auf 2021 verlegt werden. Auch an dem Termin gibt es jedoch Zweifel. Um die wirtschaftlichen Folgen der Corona-Krise abzufedern, verabschiedete die japanische Regierung von Ministerpräsident Shinzo Abe gigantische Konjunkturprogramme. ""Wir werden die Wirtschaft zurück auf den Wachstumspfad bringen"", sagte der Minister für wirtschaftliche Wiederbelebung, Yasutoshi Nishimura, mit Blick auf die aktuellen BIP-Zahlen. Nach Durchschreiten der Talsohle werde Japan aufholen, angeführt von der Binnennachfrage. Doch Ökonomen in Tokio bleiben vorsichtig. Abzuwarten bleibe, wie sich die in jüngster Zeit wieder steigenden Infektionsfälle im Land auf die heimische Wirtschaft auswirken werden. Eine kürzlich von der Regierung gestartete Förderkampagne zur Ankurbelung der schwer getroffenen Tourismusindustrie wird jedenfalls von vielen als viel zu verfrüht kritisiert. Doch es gibt auch Positives: Japan erlebt laut Ökonomen als Lehre aus der Corona-Krise derzeit einen Riesensprung in Richtung Digitalisierung und neue Arbeitsstile. Ökonomen rechnen im laufenden Quartal wieder mit einem deutlichen Aufschwung von mehr als zehn Prozent, nachdem Japans Wirtschaft nach Aufhebung des Notstands schrittweise geöffnet worden war. Doch bis die Wirtschaft das Niveau von vor der Krise wiedererlangt, werden laut Experten Jahre vergehen. © dpa-infocom, dpa:200817-99-191971/3 Japan","sueddeutsche, DPA"
Währung - München. Banknotenhersteller G+D: Das Digitalgeld kommt,no_author,2020-08-14 06:27:54,https://www.sueddeutsche.de/wirtschaft/waehrung-muenchen-banknotenhersteller-g-d-das-digitalgeld-kommt-dpa.urn-newsml-dpa-com-20090101-200814-99-162553," (dpa) - Der Chef des Münchner Banknotenherstellers Giesecke+Devrient rechnet damit, dass es in absehbarer Zukunft von Zentralbanken ausgegebenes digitales Geld geben könnte. Damit bekämen private Kryptowährungen wie der Bitcoin staatliche Konkurrenz. Einem ersten chinesischen Versuch zu den Olympischen Winterspielen würden voraussichtlich andere Länder folgen, erwartet G+D-Chef Ralf Wintergerst. ""Die People’s Bank of China hat angekündigt, zu den Olympischen Winterspielen 2022 eine sogenannte ""digital currency electronic payment"" einzuführen"", sagte Wintergerst. ""Das ist neu."" Er betrachte die chinesische Ankündigung als ersten Live-Versuch. ""China und Schweden sind die zwei Länder, die am weitesten fortgeschritten sind, wobei China mit dem angekündigten Launch zu den Winterspielen ein Zeichen gesetzt hat. Wir stehen als Europa gerade erst am Anfang der Entwicklung."" Technisch würde ein digitaler Euro dem Bitcoin ähneln. Aber im Gegensatz zu der berühmten Kryptowährung stünde er unter Aufsicht einer Zentralbank. Digitale Währungen funktionieren auf Basis einer sogenannten Blockchain - also über eine Kette von Datenblöcken, die sich mit jeder Transaktion ausbaut. Ein solcher Euro würde dabei als digitale Einheit existieren und für Online-Geschäfte verfügbar sein. Man bräuchte, wie beim Bitcoin, eine eigene Wallet, in der das digitale Geld abgelegt wird. Moderne Smartphone-Banken haben diese schon standardmäßig an die Girokonten angedockt. G+D hat international mehr als 100   als Kunden. Neben dem Banknotendruck ist das Unternehmen mittlerweile auch auf digitale Sicherheitstechnologien wie die Verschlüsselung spezialisiert. München Zentralbanken","sueddeutsche, DPA"
Konjunktur. Chinas Wirtschaftsdaten enttäuschen - Nachlassende Dynamik,no_author,2020-08-14 10:12:57,https://www.sueddeutsche.de/wirtschaft/konjunktur-chinas-wirtschaftsdaten-enttaeuschen-nachlassende-dynamik-dpa.urn-newsml-dpa-com-20090101-200814-99-164531,"Peking (dpa) - In China haben enttäuschende Daten zur Industrieproduktion und zur Umsatzentwicklung im   Hinweise auf eine nachlassende Konjunkturdynamik geliefert. Im Juli sei die Industrieproduktion zwar gestiegen, wie das nationale Statistikamt mitteilte. Der Zuwachs habe aber im Jahresvergleich 4,8 Prozent betragen, während Analysten mit einem stärkeren Anstieg um 5,2 Prozent gerechnet hatten. Noch deutlicher fiel der Dämpfer im Einzelhandel aus. Hier meldete die Statistikbehörde für Juli einen Umsatzrückgang von 1,1 Prozent im Jahresvergleich. Analysten hatten hingegen mit einem leichten Zuwachs um 0,1 Prozent gerechnet und damit erstmals in diesem Jahr eine Rückkehr des Einzelhandels in die Wachstumszone erwartet. Nach Einschätzung des Experten Hao Zhou von der Commerzbank zeigen die Daten eine ""nachlassende Wirtschaftsdynamik"" in der zweitgrößten Volkswirtschaft der Welt. Chinas Wirtschaft habe sich mittlerweile weitgehend von den Folgen der Corona-Pandemie erholt. Die Führung in Peking habe daher ihre Konjunkturmaßnahmen ein Stück weit zurückgefahren, weil mittlerweile zunehmend die Folgen einer hohen Verschuldung in den Vordergrund rücken. Chinas Wirtschaft konnte sich zuletzt vom Corona-Einbruch erholen, weil das Land die Pandemie weitgehend unter Kontrolle gebracht hat. Deutlich machen sich auch die Stützungsmaßnahmen bemerkbar, die die Regierung wegen des Corona-Ausbruchs auf den Weg gebracht hatte. Belastend wirken hingegen die Handelsstreitigkeiten zwischen den USA und  . Der Experte Hao Zhou erwartet, dass die chinesischen Behörden weitere Konjunkturmaßnahmen in den kommenden Monaten nur vorsichtig umsetzen werden. Daher sei damit zu rechnen, ""dass sich Chinas Wachstumsdynamik ab dem dritten Quartal spürbar verlangsamen wird"". © dpa-infocom, dpa:200814-99-164531/3 Einzelhandel China","sueddeutsche, DPA"
Außenhandel - Fürth. Bayerns Außenhandel kommt wieder besser in Fahrt,no_author,2020-08-17 17:04:46,https://www.sueddeutsche.de/wirtschaft/aussenhandel-fuerth-bayerns-aussenhandel-kommt-wieder-besser-in-fahrt-dpa.urn-newsml-dpa-com-20090101-200817-99-197734,"München (dpa/lby) - Die Exporte der bayerischen Wirtschaft sind im ersten Halbjahr um 18 Prozent eingebrochen. Die Talsohle sei aber nun durchschritten: Im Juni habe der Rückstand auf den Vorjahresmonat nur noch 12 Prozent betragen, teilte das Bayerische Landesamt für Statistik am Montag mit. Demnach exportierten die Unternehmen im ersten Halbjahr für 78,8 Milliarden Euro Maschinen, Autos und andere Waren. Hauptabnehmer waren die USA, gefolgt von China und Österreich. Die Einfuhren sanken im ersten Halbjahr weniger stark als die Ausfuhren: Sie gingen um knapp 13 Prozent zurück auf 83,9 Milliarden Euro. Die bedeutendsten Importländer waren China, Österreich und Tschechien. Nach der wochenlangen coronabedingten Schließung von Fabriken und Handel hat sich der bayerische   aber bis Juni schrittweise etwas erholt. Zwar lagen die Exporte im Juni immer noch 12 Prozent unter Vorjahr, aber gegenüber dem Tiefstand im April nahmen die Exporte im Juni um 38 Prozent zu und gegenüber Mai um 26 Prozent, wie das Landesamt mitteilte. Die Importe lagen im Juni ebenfalls 12 Prozent unter Vorjahr, aber mit 13,8 Milliarden Euro waren sie 25 Prozent höher als im April und 17 Prozent höher als im Mai. Sorgen macht der Vereinigung der Bayerischen Wirtschaft (vbw) die Autobranche - ihre Exporte brachen im ersten Halbjahr um 40 Prozent ein, und sie hinkten auch im Juni hinterher mit einem Minus von 19 Prozent im Vergleich zum Vorjahr. ""Wir haben im Automobilsektor noch einen sehr langen Aufholprozess vor uns, der durch eine Verlängerung der Kurzarbeiterregelung unterstützt werden sollte"", sagte vbw-Hauptgeschäftsführer Bertram Brossardt. Außenhandel","sueddeutsche, DPA"
