title,author,date_published,url,article_text,source
Motorsport. Mick Schumacher bei Formel-2-Rennen in Silverstone Neunter,no_author,2020-08-01 17:58:08,https://www.sueddeutsche.de/sport/motorsport-mick-schumacher-bei-formel-2-rennen-in-silverstone-neunter-dpa.urn-newsml-dpa-com-20090101-200801-99-07883,"Silverstone (dpa) - Mick Schumacher hat seinen dritten Podestplatz nacheinander in der   klar verpasst. Der 21-Jährige musste sich im Hauptrennen der Nachwuchs-Rennserie in Silverstone mit dem neunten Platz begnügen. Schumacher war als Dritter gestartet und ging noch vor der ersten Kurve in Führung. Allerdings wählte sein Prema-Team offenbar die falsche Strategie, und er fiel am Ende von Rang drei noch weit zurück. Bei den beiden vorherigen Rennen auf dem Hungaroring bei Budapest war der Sohn von Formel-1-Rekordweltmeister Michael Schumacher vor zwei Wochen noch jeweils Dritter geworden. Nach 29 Runden auf dem knapp 5,9 Kilometer langen Kurs in Mittelengland setzte sich Nikita Masepin aus Russland vor Guanyu Zhou aus China durch. Am Sonntag steht an gleicher Stelle noch ein Sprintrennen auf dem Programm. © dpa-infocom, dpa:200801-99-07883/2 Formel 2","sueddeutsche, DPA"
Wahlen. Aussetzung des Auslieferungsabkommens verärgert China,no_author,2020-08-01 20:01:28,https://www.sueddeutsche.de/politik/wahlen-aussetzung-des-auslieferungsabkommens-veraergert-china-dpa.urn-newsml-dpa-com-20090101-200801-99-03416,"Hongkong/Peking/Berlin (dpa) - China hat verärgert auf die Aussetzung des Auslieferungsabkommens mit Hongkong durch   reagiert. In einer Stellungnahme der chinesischen Botschaft in Berlin wurden Deutschland am Samstag ein ""ernster Verstoß gegen internationales Recht"" und eine schwere Einmischung in innere Angelegenheiten Chinas vorgeworfen. ""Wir lehnen das entschieden ab und behalten uns das Recht zu weiteren Reaktionen vor."" Auch wurde Verärgerung über die ""irrigen Äußerungen"" von Außenminister   (SPD) geäußert. Nach der umstrittenen Verschiebung der Wahl in der chinesischen Sonderverwaltungsregion um ein Jahr hatte Außenminister Maas am Freitagabend die Suspendierung des Auslieferungsabkommens verkündet. Deutschland habe wiederholt die Erwartung klargestellt, ""dass China seine völkerrechtlichen Verpflichtungen einhält"", sagte Maas. Hierzu gehöre gerade auch das Recht auf freie und faire Wahlen, das den Menschen in   zustehe. Die Verschiebung stieß in Hongkong und international auf scharfe Kritik. Regierungschefin Carrie Lam hatte die Verlegung am Freitag mit dem Risiko durch das Coronavirus begründet, da die Anzahl der Neuinfektionen in Hongkong jüngst wieder gestiegen ist. Kritiker sahen hingegen den Versuch, eine Blamage zu verhindern, da der Unmut über das pekingtreue Regierungslager und das neue Staatssicherheitsgesetz groß ist. Peking wolle verhindern, ""dass der Oppositionsblock die Mehrheit im Legislativrat übernimmt"", meinte der Demokratie-Aktivist Joshua Wong. ""Unser Widerstand wird weitergehen und wir hoffen, dass die Welt in dem bevorstehenden harten Kampf an unserer Seite stehen wird"", sagte Wong vor Journalisten. Regierungschefin Lam bestritt politische Motive. Die Pandemie sei eine große Gefahr. Bei einer Wahl gebe es große Versammlungen und soziale Kontakte, die ein ernstes Risiko darstellten. Es habe mehr Länder gegeben, die Wahlen abgesagt oder verschoben hätten, als solche, die sie abgehalten hätten. Zuvor hatte die Opposition argumentiert, dass in anderen Ländern auch gewählt worden sei und angemessene Vorsichtsmaßnahmen getroffen werden könnten. Die Vorsitzende des Menschenrechtsausschusses des Bundestages, Gyde Jensen (FDP), forderte die Bundesregierung und die EU auf, sich für die Demokratiebewegung einzusetzen. ""Der Druck auf   muss deutlich erhöht werden, wenn sich etwas an der Situation ändern soll."" Die Bundesregierung solle die deutsche EU-Ratspräsidentschaft dafür nutzen, um personenbezogene Sanktionen gegen chinesische Parteifunktionäre auf EU-Ebene zu prüfen. Zum anderen müsse Maas den bisher nur aufgeschobenen EU-China-Gipfel ganz absagen. ""Peking darf hier keine weitere Plattform geboten werden."" China steht wegen seiner Hongkong-Politik schwer in der Kritik. Das neue Sicherheitsgesetz war Ende Juni verabschiedet worden. Es richtet sich gegen Aktivitäten, die China als subversiv, separatistisch oder terroristisch ansieht. Auch soll es ""heimliche Absprachen"" mit Kräften im Ausland bestrafen. Es ist der bisher weitestgehende Eingriff in Hongkongs Autonomie und gibt Chinas Staatssicherheit weitreichende Vollmachten. Hongkongs demokratische Opposition geht davon aus, dass das Gesetz auf sie abzielt. Seit der Rückgabe der früheren britischen Kronkolonie 1997 an China wurde Hongkong autonom mit eigenen Freiheitsrechten regiert. Aus Sicht von Kritikern bedeutet das Staatssicherheitsgesetz das Ende des seither verfolgten Grundsatzes ""ein Land, zwei Systeme"". Auch wird es als Verstoß gegen die völkerrechtlichen Verpflichtungen Chinas bei der Rückgabe Hongkongs betrachtet. Als Reaktion hatte die EU Anfang der Woche ein vergleichsweise moderates Maßnahmenpaket beschlossen, bei dem jedem Mitgliedstaat selbst überlassen ist, was er davon umsetzt. Deutschland hat bereits einen Exportstopp für bestimmte Güter verhängt, die zur Überwachung der Bevölkerung genutzt werden können oder von Militär oder Polizei etwa bei Demonstrationen gegen die Zivilbevölkerung eingesetzt werden können. Außerdem wurden erste Schritte für eine Ausweitung von Stipendien für Wissenschaftler oder Studenten aus Hongkong eingeleitet. Auch sollen Visa leichter erteilt werden. Die Aussetzung des Auslieferungsabkommens ist unter anderem eine Reaktion darauf, dass das neue Sicherheitsgesetz auch die Überstellung von Verdächtigten an Chinas Justiz ermöglicht, die nicht unabhängig ist und eine Verurteilungsquote von rund 99 Prozent hat. Kritiker warnen vor Misshandlungen und erzwungenen Geständnissen in China. Das Gesetz wendet sich auch gegen Personen im Ausland und sieht als Höchststrafe lebenslange Haft vor. © dpa-infocom, dpa:200801-99-03416/4 Deutschland Heiko Maas Hongkong China","sueddeutsche, DPA"
Optik - Jena. Behandlungen verschoben: Krise setzt Zeiss Meditec zu,no_author,2020-08-05 13:09:04,https://www.sueddeutsche.de/wirtschaft/optik-jena-behandlungen-verschoben-krise-setzt-zeiss-meditec-zu-dpa.urn-newsml-dpa-com-20090101-200804-99-41281,"Jena (dpa/th) - Die Corona-Krise sorgt für einen Umsatz- und Gewinneinbruch beim Jenaer Medizintechnik-Konzern Carl Zeiss Meditec AG. Im dritten Quartal des im Oktober 2019 begonnenen Geschäftsjahres sei der Absatz vor allem in Europa und Amerika deutlich zurückgegangen, während sich Asien vor allem dank China und Südkorea wieder stabilisiert habe, teilte der Vorstand des im MDax notierten Unternehmens am Mittwoch in Jena mit. ""Das dritte Quartal ist deutlich von der Pandemie beeinflusst"", sagte Vorstandschef Ludwin Monz. ""In der Krise wurden viele Augenoperation verschoben - mit Ausnahme von Notfällen."" Carl Zeiss Meditec ist auf Ausrüstungen zur Diagnose und Behandlung von Augenerkrankungen sowie für die Mikrochirurgie spezialisiert. Das zum baden-württembergischen Optik-Konzern Carl Zeiss AG (Oberkochen) gehörende Unternehmen beschäftigt rund 3400 Mitarbeiter, davon 1450 in  . Ein Teil der Mitarbeiter war vor allem in Mai und Juni in Kurzarbeit. Die Zahl der Kurzarbeiter sei aber inzwischen nur noch gering, sagte Monz. Der Konzernumsatz nach drei Quartalen verringerte sich um 5,8 Prozent auf 967,9 Millionen Euro. Zeiss Meditec erwirtschaftet nach eigenen Angaben etwa 90 Prozent des Umsatzes im Ausland. Der Gewinn vor Zinsen und Steuern (Ebit) lag bei 111,9 Millionen Euro nach 184,2 Millionen Euro im Vorjahreszeitraum. Unter dem Strich stand ein Gewinn von 68,6 Millionen Euro. Im Vorjahreszeitraum waren es am Ende des dritten Quartals noch 109,7 Millionen Euro Gewinn. Der Vorstand hatte bereits Mitte Juli die Erwartungen gedämpft. Er geht davon aus, dass der Jahresumsatz auf etwa 1,3 Milliarden Euro sinkt. Im Vorjahr hatte der auf Augenheilkunde und Mikrochirurgie spezialisierte Thüringer Konzern noch einen Umsatz von fast 1,5 Milliarden Euro erzielt. Eine Gewinnprognose gab Monz nicht ab. ""In Europa haben wir den Tiefpunkt erreicht. Wir sehen einen Aufwärtstrend"", sagte der Vorstandschef. Für Amerika und besonders die USA seien die Prognosen jedoch sehr ungewiss. ""Eine Markterholung könnte dort länger dauern."" Monz rechnet deshalb mit einem eher schwachen vierten Quartal. Das Geschäftsjahr von Zeiss Meditec läuft bis Ende September. Deutschland","sueddeutsche, DPA"
Sport. Plan für LoL-Weltmeisterschaft steht bis 2022,no_author,2020-08-01 10:11:26,https://www.sueddeutsche.de/sport/sport-plan-fuer-lol-weltmeisterschaft-steht-bis-2022-dpa.urn-newsml-dpa-com-20090101-200801-99-04423,"Los Angeles (dpa) - Die diesjährigen Weltmeisterschaften in League of Legends werden komplett in   ausgetragen. Wie Entwickler Riot Games mitteilte, wird das normalerweise geplante Tour-Format durch China auf das kommende Jahr verschoben. ""Indem wir das Event nur in einer einzigen Stadt veranstalten, können wir den Reiseaufwand während des Turniers verringern und die Umgebung der Show besser kontrollieren"", hieß es in der Mitteilung. Das Finale werde außerdem das erste Event im neuen Pudong Football Stadium sein. ""Wenn es uns die lokalen Richtlinien für Events erlauben, die Spiele vor Zuschauern auszutragen, werden wir im Laufe des Sommers Informationen bekanntgeben"", hieß es. Die frühen Phasen des Turniers würden ohne Publikum gespielt. Insgesamt läuft die WM vom 25. September bis 31. Oktober. Bis zuletzt war unklar, in welchem Format die WM in diesem Jahr stattfinden soll. Das sonst übliche Format mit verschiedenen Spielstätten war durch die Corona-Pandemie zunehmend unwahrscheinlich geworden. Diese Tour soll nun in   erst 2021 stattfinden. 2022 ist die WM dann in Nordamerika zu Gast. © dpa-infocom, dpa:200801-99-04423/5 Shanghai China","sueddeutsche, DPA"
Internet. Trump will Videoplattform TikTok in den USA verbieten,no_author,2020-08-01 20:00:42,https://www.sueddeutsche.de/service/internet-trump-will-videoplattform-tiktok-in-den-usa-verbieten-dpa.urn-newsml-dpa-com-20090101-200801-99-04050,"Washington (dpa) - US-Präsident   will die internationale Videoplattform TikTok in seinem Land verbieten. ""Was TikTok betrifft, so verbannen wir sie aus den USA"", sagte Trump mitreisenden Journalisten zufolge am Freitagabend (Ortszeit) in seinem Dienstflugzeug Air Force One. ""Nun, ich habe diese Macht. Ich kann es mit einer Präsidentenverfügung"" oder mit einer wirtschaftlichen Notstandsermächtigung machen, sagte er. TikTok ist eine international sehr erfolgreiche Videoplattform des chinesischen Unternehmens ByteDance, die in 65 Sprachen auf 175 Märkten angeboten wird. Nutzer können dort selbsterstellte Video-Clips hochladen oder die von anderen ansehen. In Festland-China gibt es nur die zensierte Version Douyin. Bereits mehrfach hatten Vertreter der US-Regierung gewarnt, über Tiktok könnten Daten von US-Bürgern in die Hände der chinesischen Kommunistischen Partei geraten. TikTok versichert, es gehe der Plattform um kreative Inhalte, bei der ""Privatsphäre und Sicherheit"" geschützt würden. ""TikTok wird nicht in China angeboten"", erklärte eine TikTok-Sprecherin der Deutschen Presse-Agentur am Samstag. Die chinesische Regierung habe keinen Zugriff auf Nutzerdaten und habe dies auch nie verlangt. Die Nutzerdaten würden in den   gespeichert und verarbeitet. Wegen des Argwohns im Ausland bemüht sich ByteDance, seine internationale Plattform von der chinesischen Version zu trennen. Nur in Hongkong war TikTok selbst aktiv, doch wurde die Plattform nach der Verkündung des umstrittenen neuen Sicherheitsgesetzes aus der Sonderverwaltungszone zurückgezogen. Bereits Ende 2019 hatte Washington US-Militärangehörigen untersagt, die TikTok-App auf Dienst-Smartphones zu nutzen. US-Außenminister Mike Pompeo hatte Anfang Juli eine Sperre von TikTok und anderen Apps aus   nicht ausgeschlossen. Am Mittwoch gab Finanzminister Steven Mnuchin im Beisein von Trump bekannt, dass die US-Regierung die Plattform durch den ressortübergreifenden Ausschuss zur Kontrolle von Auslandsinvestitionen in den USA (CFIUS) begutachte und dem Präsidenten darauf basierend eine Empfehlung gegeben werde. Doch nicht nur in den USA spürt TikTok Gegenwind. In Indien, das sich mit China jüngst Grenzscharmützel lieferte, wurde die Plattform schon verboten. Das Nachbarland Pakistan sperrte die Videoplattform Bigo und warnte TikTok vor dem Angebot unmoralischer oder vulgärer Inhalte. TikTok zeigte sich am Samstag bemüht, öffentlich deutlich zu machen, was ein Verbot der Plattform in den USA bedeuten würde. In einer Videobotschaft nannte die US-Verantwortliche für die Plattform, Vanessa Pappas, sie sei stolz auf die 1500 Mitarbeiter in den USA, die jeden Tag an der App arbeiteten, und auf die zusätzlichen 10 000 Arbeitsplätze, die TikTok in den kommenden drei Tagen in das Land bringen würde. In den USA hat TikTok nach eigenen Angaben 100 Millionen Nutzer. Die größten TikTok-Investoren kämen aus den USA, erklärt das  . Am Freitag berichtete die Nachrichtenagentur Bloomberg, der US-Softwarekonzern Microsoft verhandele über den Kauf des US-Geschäfts von TikTok. Trump machte allerdings den mit ihm reisenden Journalisten zufolge deutlich, dass er dagegen sei. Nutzer des sozialen Netzwerks hatten vor einem Wahlkampfauftritt Trumps im Juni möglicherweise zu den hohen erwarteten Besucherzahlen beigetragen - bei dem am Ende zahlreiche Plätze leer blieben. Medien hatten berichtet, dass es bei TikTok koordinierte Bemühungen gegeben haben soll, sich kostenlos für ein Ticket zu registrieren, dann aber nicht zu der Veranstaltung im Bundesstaat Oklahoma zu erscheinen. Die chinesische Regierung kritisiert das Vorgehen Washingtons. ""Die USA stellen eine Schuldvermutung auf und drohen chinesischen Unternehmen ohne Grund"", hatte Außenamtssprecher Wang Wenbin am Donnerstag in Peking erklärt. Die USA sollten allen Marktteilnehmern ein ""offenes, gerechtes und nicht diskriminierendes Umfeld"" bieten. Die Stimmung zwischen den beiden Großmächten ist extrem angespannt. Das Verhältnis ist aus chinesischer Sicht so schlecht wie seit Aufnahme der diplomatischen Beziehungen 1979 nicht mehr. Zuletzt ordneten die USA die Schließung des chinesischen Konsulats in Houston (Texas) an, woraufhin Peking eine amerikanische Vertretung in Chengdu dichtmachte. Die Länder liegen schon wegen Chinas Umgang mit dem Ausbruch des Coronavirus, der Handelspolitik und dem harten chinesischen Vorgehen in Hongkong und in Xinjiang im Streit. © dpa-infocom, dpa:200801-99-04050/8 Donald Trump USA China Unternehmen","sueddeutsche, DPA"
Gesundheit. Johns-Hopkins-Uni: Mehr als 700.000 Corona-Tote weltweit,no_author,2020-08-05 10:12:35,https://www.sueddeutsche.de/gesundheit/gesundheit-johns-hopkins-uni-mehr-als-700-000-corona-tote-weltweit-dpa.urn-newsml-dpa-com-20090101-200805-99-47976,"Washington (dpa) - Seit Beginn der Corona-Pandemie sind US-Wissenschaftlern zufolge weltweit bereits mehr als 700 000 Menschen nach einer Infektion mit dem Virus gestorben. Das geht aus Daten der Universität Johns Hopkins in Baltimore hervor. Inzwischen gibt es demnach bereits mehr als 18,5 Millionen bestätigte Infektionen mit dem Erreger Sars-CoV-2. Erst vor rund zweieinhalb Wochen war die Schwelle von 600.000 Toten und 14 Millionen bestätigten Infektionen überschritten worden. Seither hat sich die Pandemie unter anderem in den  , Brasilien, Peru, Mexiko, Indien und Südafrika weiter ausgebreitet. Weltweit entfallen die meisten Infektionen und Todesfälle auf die USA, ein Land mit rund 330 Millionen Einwohnern. Dort gibt es bislang Johns Hopkins zufolge etwa 4,8 Millionen bestätigte Infektionen und rund 157.000 Todesfälle. An zweiter Stelle steht Brasilien mit etwa 2,8 Millionen bekannten Infektionen und rund 96.000 Todesfällen. Relativ zur Einwohnerzahl ist die Zahl der Toten jedoch in einigen europäischen Ländern höher. In den USA etwa starben der Hopkins-Uni zufolge 47,5 Menschen pro 100.000 Einwohner, in Brasilien 45. In Großbritannien liegt dieser Wert jedoch bei 70, in Italien bei 58 und in Schweden bei 56 - in Deutschland bei 11. Die Webseite der Hopkins-Uni wird regelmäßig mit eingehenden Daten aktualisiert und zeigt daher einen höheren Stand als die offiziellen Zahlen der Weltgesundheitsorganisation (WHO). In manchen Fällen wurden die Zahlen zuletzt aber auch wieder nach unten korrigiert. Experten gehen in jedem Fall von einer höheren Dunkelziffer aus. Die WHO sprach in ihrem Lagebericht vom Dienstag von bislang 18,1 Millionen bestätigten Infektionen und 691.000 Todesfällen. Die Corona-Pandemie begann um den Jahreswechsel in China. Das Coroanvirus Sars-CoV-2 kann die Lungenerkrankung Covid-19 auslösen, die vor allem bei älteren oder immungeschwächten Patienten tödlich verlaufen kann. © dpa-infocom, dpa:200805-99-47976/2 USA","sueddeutsche, DPA"
Auto - Stuttgart. Mercedes entwickelt Batterietechnologie zusammen mit CATL,no_author,2020-08-05 15:22:29,https://www.sueddeutsche.de/wirtschaft/auto-stuttgart-mercedes-entwickelt-batterietechnologie-zusammen-mit-catl-dpa.urn-newsml-dpa-com-20090101-200805-99-53342," (dpa) - Daimlers Kernmarke Mercedes-Benz will künftig auch mit dem chinesischen Batteriehersteller CATL enger zusammenarbeiten. Die strategische Partnerschaft werde ausgebaut, kündigten die Unternehmen am Mittwoch an. ""CATL wird in den kommenden Jahren ein wichtiger Lieferant sein, der Kapazitäten für die nächsten Generationen unserer EQ-Produkte sichert"", sagte Daimler-Vorstand Markus Schäfer. Unter dem Namen EQ bringt Mercedes-Benz seine Elektromodelle auf den Markt. Die Zusammenarbeit umfasse die gesamte Technologie-Palette von der einzelnen Zelle über Batteriemodule unter anderem für das 2021 erscheinende Flaggschiff EQS bis hin zu Komplettbatterien, die in den Vans von Mercedes-Benz zum Einsatz kommen sollen. Bei der Produktion sollen ausschließlich erneuerbare Energien verwendet werden, hieß es. Liefern wird CATL künftig aus seinem Werk in Thüringen, das sich derzeit noch im Aufbau befindet. Daimler baut die Batterien für die Mercedes-Benz-Autos zwar selbst und zieht dafür gerade ein weltweites Netz von Fabriken hoch. Die Zellen, die in den Batterien stecken, kauft der Konzern aber zu und arbeitet dazu in der Entwicklung auch mit den Herstellern zusammen. Erst kürzlich hatte Daimler eine weitreichende strategische Partnerschaft mit dem chinesischen Hersteller Farasis verkündet. Die Lastwagensparte des Konzerns arbeitet ebenfalls schon eng mit CATL zusammen. Stuttgart","sueddeutsche, DPA"
"Auto - München. BMW fährt Verlust ein: ""zuversichtlich"" fürs zweite Halbjahr",no_author,2020-08-05 13:31:52,https://www.sueddeutsche.de/wirtschaft/auto-muenchen-bmw-faehrt-verlust-ein-zuversichtlich-fuers-zweite-halbjahr-dpa.urn-newsml-dpa-com-20090101-200804-99-40927," (dpa) - Zum ersten Mal seit elf Jahren schreibt BMW wieder rote Zahlen. ""Wie erwartet haben die weltweiten Maßnahmen zur Eindämmung der Pandemie im zweiten Quartal voll auf unser Geschäft durchgeschlagen"", sagte Vorstandschef Oliver Zipse am Mittwoch in München. Unter dem Strich stand ein Quartalsverlust von 212 Millionen Euro. Trotz des schwachen zweiten Quartals sei im ersten Halbjahr noch ein Gewinn erwirtschaftet worden, betonte Zipse - und zeigte sich für das zweite Halbjahr ""durchaus zuversichtlich"". ""Einen klaren Lichtblick signalisiert der Monat Juli: Unser Absatz Automobile auf Group-Ebene lag hier deutlich über Vorjahr"", sagte Zipse. ""In China verläuft die Marktentwicklung positiver als erwartet"", ergänzte Finanzvorstand Nicolas Peter. ""Auch in anderen wichtigen Märkten wie   oder den USA ist inzwischen eine leichte Erholung spürbar. Wie geplant sind wir somit auf Kurs, unsere Jahresziele zu erreichen."" Allerdings bleibt die Unsicherheit laut Peter groß: Eine mögliche zweite Infektionswelle klammern die Münchner in ihren Prognosen weiter aus. Für das Gesamtjahr erwartet BMW sowohl den Autoabsatz als auch den Vorsteuergewinn deutlich unter Vorjahr. Mit 21,7 Milliarden Euro Liquidität sei der Konzern aber sehr gut aufgestellt und habe genügend Reserven, sagte der Finanzchef. Im zweiten Quartal verkaufte BMW ein Viertel weniger Autos als vor einem Jahr. Die Werke und die Autohäuser in Europa und in den USA waren lange geschlossen. In China dagegen lagen die Verkäufe bereits wieder deutlich über Vorjahr. Weltweit fiel der Umsatz im zweiten Quartal um 22 Prozent auf knapp 20 Milliarden Euro. BMW schloss auch entsprechend weniger Kredit- und Leasingverträge ab und verdiente mit Finanzdiensten nur noch einen Bruchteil des Vorjahresergebnisses. Vor einem Jahr hatte BMW unterm Strich noch 1,5 Milliarden Euro Gewinn gemacht - und nun eben 212 Millionen Verlust. Mit den Rückschlägen steht BMW nicht allein da. Auch VW, Audi und Mercedes-Benz schrieben zwischen April und Ende Juni rote Zahlen, weil Nachfrage und Produktion in der Pandemie über Wochen fast komplett zum Erliegen kamen. Aufs erste Halbjahr gesehen stand BMW allerdings insgesamt etwas besser da: Während den   noch 362 Millionen Euro Gewinn blieben, verzeichneten der Volkswagen-Konzern 1,0 Milliarde und der Daimler-Konzern 1,9 Milliarden Euro Verlust. Sowohl Daimler als auch VW haben im Gegensatz zu BMW noch schwere Nutzfahrzeuge im Angebot, die es in der Krise besonders traf. Die BMW-Stammaktie gab nach Vorlage der Zahlen als einer der schwächsten Dax-Werte deutlich nach. Einige Analysten und Anleger hatten sich ein etwas besseres Abschneiden erhofft. Seit Ende Juni laufen alle BMW-Werke wieder im regulären Schichtbetrieb. ""Wir richten unsere Produktion weiterhin an der Nachfrage aus und wappnen uns für verschiedene Szenarien"", sagte Zipse. So laufe das amerikanische SUV-Werk in Spartanburg - das größte Werk im Konzern - sozusagen ""unter Volldampf"". Der Anteil Chinas am weltweiten Absatz sei im ersten Halbjahr stark gestiegen, dürfte sich aber im Jahresverlauf wieder reduzieren. Sparen will BMW bei den Investitionen und beim Personal. Bis Ende nächsten Jahres soll die Zahl der Mitarbeiter um 6000 auf 120 000 sinken, vor allem durch altersbedingte und freiwillige Abgänge mit Abfindungen. In Deutschland beschäftigt BMW derzeit etwa 90 000 Mitarbeiter. Viele Projekte würden verschoben oder stünden auf dem Prüfstand, sagte Finanzchef Peter. Die Investitionen in Sachanlagen würden dieses Jahr um ein Drittel auf unter vier Milliarden Euro gekürzt. Dagegen stiegen die Forschungs- und Entwicklungsleistungen im zweiten Quartal sogar leicht auf 1,5 Milliarden Euro, hier will BMW mit Blick auf die Zukunft auch nur mit Bedacht den Rotstift ansetzen. In zwei Jahren will BMW 25 Elektro- und Hybridmodelle auf der Straße haben. Zuletzt präsentierte der Konzern mit dem iX3 den ersten vollelektrischen SUV, der aber in China produziert und auch dort zuerst verkauft wird. ""Bei der Elektrifizierung kommen wir bestens voran"", sagte Zipse. Im Juli seien 50 Prozent mehr Hybrid- und E-Autos verkauft worden, der Auftragseingang sei sehr hoch, die ""Förderprogramme helfen enorm"". Auch die Mehrwertsteuersenkung in Deutschland wirke. München Deutschland Bayern","sueddeutsche, DPA"
"Handel - Düsseldorf. Metro profitiert von China-Verkauf, aber Pandemie belastet",no_author,2020-08-05 19:21:37,https://www.sueddeutsche.de/wirtschaft/handel-duesseldorf-metro-profitiert-von-china-verkauf-aber-pandemie-belastet-dpa.urn-newsml-dpa-com-20090101-200805-99-56261," (dpa) - Der Handelskonzern Metro hat seinen Gewinn im dritten Geschäftsquartal dank des Verkaufs seiner chinesischen Aktivitäten deutlich gesteigert. So legte das Periodenergebnis in den drei Monaten bis Ende Juni im Vergleich zum Vorjahreszeitraum von 115 Millionen auf 512 Millionen Euro zu, wie das Unternehmen am Mittwoch in Düsseldorf mitteilte. Für den Verkauf des China-Geschäfts verbuchte Metro dabei 943 Millionen Euro. Der ebenfalls in dem Quartal abgeschlossene Verkauf der Supermarktkette Real dämpfte den Gewinnanstieg jedoch. Für die Veräußerung fiel ein Verlust von 401 Millionen Euro an, der vor allem auf Abschreibungen zurückzuführen sei, erläuterte Metro. Damit hat Metro den Umbau zu einem reinen Großhändler abgeschlossen. Im fortgeführten Geschäft fiel im dritten Geschäftsquartal allerdings ein Verlust von 140 Millionen Euro an, nach einem Gewinn von 90 Millionen Euro im Vorjahreszeitraum. Hier belasteten der Nachfrageeinbruch im Zusammenhang mit der Corona-Pandemie sowie Restrukturierungskosten. Düsseldorf","sueddeutsche, DPA"
