title,author,date_published,url,article_text,source
Fußball. Magath verteidigt Trainer-Trennungen in Würzburg,no_author,2020-11-10 12:53:00,https://www.sueddeutsche.de/sport/fussball-magath-verteidigt-trainer-trennungen-in-wuerzburg-dpa.urn-newsml-dpa-com-20090101-201110-99-277162,"Würzburg (dpa) -   bringen Trainer-Beurlaubungen vermutlich nicht mehr besonders aus der Ruhe. Die hat der frühere Profi-Coach des Hamburger SV, 1. FC Nürnberg, VfB Stuttgart, FC   München, VfL Wolfsburg, FC Schalke 04, FC Fulham sowie von Werder Bremen, Eintracht Frankfurt und Shandong Luneng FC in China schließlich oft genug am eigenen Leib erfahren. Der ehemalige Fußball-Nationalspieler konnte Freistellungen mit der Gelassenheit des Älterwerdens sogar mit Humor nehmen. Jetzt, wo Magath schon lange kein ""Feuerwehrmann"" für Notlagen ist und auch nicht mehr selbst an der Seitenlinie arbeitet, muss er nach einem Trainer-K.o. die Fragen beantworten, die früher seinen Bossen gestellt wurden. Der 67-Jährige ist seit Anfang dieses Jahres ""Head of Flyeralarm Global Soccer"", also der Fußball-Chefstratege des Hauptsponsors der  . Und in dieser Funktion sah sich Magath, Meistercoach mit dem VfL Wolfsburg und FC Bayern, in dieser Saison beim Schlusslicht der 2. Bundesliga schon zweimal zum Handeln gezwungen. Gerade mal 3,5 Spiele hat ein Trainer 2020/21 beim Aufsteiger im Schnitt durchgehalten: Erst zwei Partien Michael Schiele, dann fünf Partien Marco Antwerpen. Nun soll Bernhard Trares für Erfolg sorgen. Zwei Trainerwechsel nach sieben Spieltagen gab es in der seit 1981 eingleisigen 2. Liga noch nie. ""Dazu muss man wissen: Michael Schiele war vorher drei Jahre hier. Das ist außergewöhnlich lange"", sagte Magath der ""Bild"" und räumte ein: ""Die zweite Trainerwahl - ja, die ging in die Hose."" Bevor sich Magath von Antwerpen trennte, sagte er etwas, was man in diesem nicht selten irrationalen Geschäft als Funktionär öffentlich wohl so sagt. ""Selbstverständlich"", habe Magath der ""Main-Post"" zufolge am Freitagabend nach der vierten Niederlage am Stück in Heidenheim auf die Frage geantwortet, ob Antwerpen in Ruhe weiterarbeiten könne. Nach der Trennung befand Magath am Montag laut ""Main-Post"": ""Er kann ja in Ruhe weiterarbeiten - halt woanders. Ich sehe da kein Problem."" Man kann so eine Aussage unterhaltsam finden, muss man aber nicht. Zynisch ist sie zweifellos. Magath hat nach eigenem Befinden aus der Freistellung seines 41-Tage-Coaches sogar schon etwas gelernt. Öfter wolle er nun vor Ort sein. Dabei habe er stets vermeiden wollen, dass Beobachter denken könnten, er kontrolliere das Training. ""Der Bernhard Trares hat keine Angst, der wünscht sich, dass ich komme"", meinte Magath. Als Trainer-Rausschmeißer wird Magath nun teils tituliert. Das ist ziemlich alte Schule, aber Konstanz sieht eben anders aus. Auch beim zweiten Verein aus dem kleinen Fußball-Imperium von Flyeralarm läuft es in Sachen Trainer nicht reibungslos. Kurz nach Saisonbeginn entschied sich beim österreichischen FC Admira Wacker Mödling Zvonimir Soldo aus privaten Gründen zum Abschied, Assistent Patrick Helmes übernahm vorübergehend. Nun versucht Damir Buric sein Glück beim Schlusslicht. © dpa-infocom, dpa:201110-99-277162/4 Felix Magath Bayern Würzburger Kickers","sueddeutsche, DPA"
Industrie. Deutsche Industrie besorgt über Chinas neue Regeln,no_author,2020-11-10 11:23:51,https://www.sueddeutsche.de/wirtschaft/industrie-deutsche-industrie-besorgt-ueber-chinas-neue-regeln-dpa.urn-newsml-dpa-com-20090101-201110-99-279611,"Berlin/Peking (dpa) - Die deutsche Industrie befürchtet wegen verschärfter Einreise-Regelungen in   negative Folgen für ihre Geschäfte. Der Hauptgeschäftsführer des Bundesverbands der Deutschen Industrie (BDI), Joachim Lang, sagte in Berlin. ""Es besteht das Risiko, dass die neue Verpflichtung, mehrfach, vor allem auch bei Flügen mit Transit-Stationen, zu testen, wichtige Geschäftsreisen gänzlich unmöglich macht."" In der Praxis bedeuteten die Einschränkungen für viele   einen faktischen Einreisestopp. China ist einer der wichtigsten Handelspartner Deutschlands. Angesichts steigender Corona-Infektionen in vielen Ländern hat China seine Einreisebestimmungen auch für   verschärft. Das chinesische Außenministerium sprach von einer vorübergehenden Maßnahme. Seit Freitag müssen Reisende aus Deutschland und aus weiteren, von der Pandemie besonders betroffenen Ländern vor einem Flugantritt nach China einen negativen Corona- sowie Antikörper-Test vorweisen, die nicht älter als 48 Stunden sein dürfen. Die Testergebnisse müssen vor dem Abflug zusätzlich von chinesischen Botschaften oder Konsulaten verifiziert werden. Und wird ein Zwischenstopp in einem anderen Land eingelegt, können Reisende nicht einfach umsteigen, sondern müssen das Prozedere dort wiederholen. Ohnehin müssen sich alle Einreisenden nach der Ankunft in China erneut testen lassen und 14 Tage in ein Quarantäne-Hotel Lang sagte, die neuen Bestimmungen belasteten die Geschäftstätigkeit der deutschen Industrie in dem wichtigen chinesischen Markt sehr. ""Ingenieure können Anlagen nicht in Betrieb nehmen, Service-Techniker nicht deren reibungslose Funktion gewährleisten, Vertriebsmitarbeiter nicht ihre chinesischen Kunden vor Ort beraten und bedienen"", sagte der BDI-Hauptgeschäftsführer. ""Die Folgen der mittel- und langfristigen Einschränkungen gehen zulasten unserer Unternehmen."" Regierungen müssten sich dafür einsetzen, die rasante Ausbreitung des Coronavirus zu stoppen, forderte Lang. ""Unsere globalisierte und integrierte Welt ist allerdings auch in Pandemiezeiten auf einen möglichst uneingeschränkten Personenverkehr angewiesen."" Auch die europäische Handelskammer in China kritisierte die verschärften Regeln. ""Während technisch die Tür offenbleibt, bedeuten diese Veränderungen unglücklicherweise ein de-facto-Einreiseverbot für jeden, der versucht, zu seinem Leben, seiner Arbeit und seinen Familien in China zurückzukehren"", hieß es in einer Erklärung. In vielen Ländern könnten Testergebnisse nicht innerhalb von 48 Stunden vorliegen, und Antikörpertests seien nicht weit verbreitet. Dass die Ergebnisse in der Frist von Botschaftspersonal verifiziert werden müssen, ""verstärkt noch die Ungewissheit"", so die EU-Kammer. Erschwerend komme hinzu, dass wegen der Beschränkungen beim Umsteigen jetzt ein direkter Flug gebucht werden müsse, während die Airlines aber die meisten Strecken gestrichen hätten. China hatte mit strengen Maßnahmen wie Massentests, strikter Quarantäne, genauer Nachverfolgung von Kontaktpersonen und Einreisebeschränkungen das Virus weitgehend unter Kontrolle gebracht. Seit Monaten verzeichnet das bevölkerungsreichste Land der Erde, wo die ersten Infektionen mit dem Coronavirus im Dezember vergangenen Jahres bekannt wurden, nur noch wenige, lokale Ausbrüche. © dpa-infocom, dpa:201110-99-279611/3 China Unternehmen Deutschland","sueddeutsche, DPA"
Tischtennis. Halbfinal-Aus gegen die Nummer eins: Han Ying wird Vierte,no_author,2020-11-10 14:03:41,https://www.sueddeutsche.de/sport/tischtennis-halbfinal-aus-gegen-die-nummer-eins-han-ying-wird-vierte-dpa.urn-newsml-dpa-com-20090101-201110-99-277787,"Weihai (dpa) - Die deutsche Nationalspielerin Han Ying hat das erste internationale Tischtennis-Turnier nach einer achtmonatigen Corona-Pause auf dem vierten Platz abgeschlossen. Beim World Cup im chinesischen Weihai verlor die 37-Jährige im Halbfinale erst im entscheidenden siebten Satz gegen die Weltranglisten-Erste Chen Meng aus  . Danach unterlag die für den polnischen Champions-League-Sieger KTS Tarnobrzeg spielende Han im Spiel um Platz drei der Japanerin Mima Ito in 0:4 Sätzen. Im Endspiel setzte sich Chen Meng mit 4:1 gegen ihre Teamkollegin Sun Yingsha durch. Der World Cup ist der erste internationale Wettbewerb im   nach einer fast achtmonatigen Pause. Wegen der Corona-Pandemie findet er nach dem Vorbild der nordamerikanischen Basketball-Liga NBA in einer Turnier-Blase statt, in der die Spielerinnen und Spieler in Hotel und Halle von der Außenwelt abgeschottet werden. Der World Cup der Männer mit den beiden deutschen Nationalspielern Patrick Franziska und Dimitrij Ovtcharov beginnt an diesem Freitag. © dpa-infocom, dpa:201110-99-277787/4 China Tischtennis","sueddeutsche, DPA"
ASEAN. Weltgrößter Freihandelspakt mit China vereinbart,no_author,2020-11-15 11:26:29,https://www.sueddeutsche.de/politik/asean-weltgroesster-freihandelspakt-mit-china-vereinbart-dpa.urn-newsml-dpa-com-20090101-201115-99-336727,"Hanoi (dpa) - Mitten im Handelskrieg mit den USA hat   mit 14 asiatisch-pazifischen Staaten das größte Freihandelsabkommen der Welt abgeschlossen. Nach achtjährigen Verhandlungen erfolgte die Unterzeichnung am Sonntag zum Abschluss des virtuellen Gipfels der südostasiatischen Staatengemeinschaft Asean in Vietnams Hauptstadt Hanoi. Die ""regionale, umfassende Wirtschaftspartnerschaft"" oder RCEP, wie der Pakt abgekürzt wird, umfasst 2,2 Milliarden Menschen und rund ein Drittel der weltweiten Wirtschaftsleistung. Das Abkommen verringert Zölle, legt einheitliche Regeln fest und erleichtert damit Lieferketten. Es umfasst Handel, Dienstleistungen, Investitionen, Online-Handel, Telekommunikation und Urheberrechte. Neben China und den zehn Asean-Staaten  , Singapur, Indonesien, Malaysia, Thailand, Philippinen, Myanmar, Brunei, Laos und Kambodscha beteiligen sich auch große Volkswirtschaften und US-Bündnispartner wie Japan, Australien, Südkorea sowie Neuseeland. RCEP steht für ""Regional Comprehensive Economic Partnership"". Gerade vor dem Hintergrund des laufenden Handelskrieges mit den USA ist der Freihandelspakt ein großer Erfolg für die kommunistische Führung in Peking. Das Abkommen wird nach Ansicht von Experten die wirtschaftliche Integration in der Asien-Pazifik-Region voranbringen und protektionistischen Tendenzen entgegenwirken. Die RCEP-Staaten standen vor der Corona-Krise für 29 Prozent des weltweiten Handelsvolumens - etwas weniger als die EU mit 33 Prozent. Der Anteil der RCEP-Gemeinschaft dürfte jetzt steigen, wie Experten erwarten. ""RCEP wird die wirtschaftliche und strategische Landkarte des Indo-Pazifiks neu zeichnen"", sagte Jeffrey Wilson vom Australischen Strategischen Politik-Institut (ASPI). Der Pakt kann auch als Absage an die von US-Präsident Donald Trump verfolgte ""Entkopplung"" von China gewertet werden. Zwar gibt es in der Region auch Besorgnis über eine zu große Abhängigkeit von China, doch setzen die RCEP-Mitglieder ihre Hoffnung auf die Kooperation mit der zweitgrößten Volkswirtschaft, die den Corona-Einbruch bereits überwunden hat. Der Freihandelspakt wird nach Ansicht von Chinas Regierungschef Li Keqiang zu ""Erholung und Wachstum der Weltwirtschaft"" beitragen. Er sei nicht nur eine ""monumentale Errungenschaft"" für die regionale Integration, sondern auch ""ein Sieg für Multilateralismus und freien Handel"". Nach einer Studie des US-Wirtschaftsinstituts Peterson wird China bis 2030 mit 85 Milliarden US-Dollar von dem Abkommen profitieren - Japan mit 48 Milliarden und Südkorea mit 23 Milliarden. Die RCEP-Staaten gewinnen demnach je rund 0,2 Prozentpunkte Wachstum. Der Einigung waren 31 Verhandlungsrunden und 18 Ministertreffen vorausgegangen. Sechs Mal waren selbst auferlegte Fristen nicht eingehalten worden. Am Ende hing das Abkommen an Indien, das sich nicht weiter öffnen wollte. Indem sich Neu Delhi aber Ende 2019 aus den Verhandlungen zurückgezogen hatte, war der Weg frei. Mit dem Bündnis bildet sich neben der Gemeinschaft des anderen asiatisch-pazifischen Freihandelsabkommens, der CPTPP abgekürzten ""Umfassenden und fortschrittlichen Vereinbarung für eine Trans-Pazifische Partnerschaft"", eine weitere Freihandelszone. CPTPP repräsentiert aber nur 13 Prozent der globalen Wirtschaftsleistung. Es ist von dem ehrgeizigeren Vorgänger einer Transpazifischen Partnerschaft (TPP) übrig geblieben, von dem sich US-Präsident Trump sofort nach dem Amtsantritt 2017 zurückgezogen hatte. Obwohl die Asean-Gespräche nur virtuell geführt wurden, nahm Trump auch das dritte Jahr in Folge nicht an dem Gipfel teil. So haben die USA unter ihm in der Region an Gewicht verloren, während China mit dem neuen Freihandelspakt seinen Einfluss noch ausweiten kann. RCEP ist weitreichender als CPTPP, geht allerdings nicht so tief und beinhaltet auch keine Arbeiter- und Umweltrechte. CPTPP umfasst 480 Millionen Menschen in Australien, Brunei, Kanada, Chile, Japan, Malaysia, Mexiko, Neuseeland, Peru, Singapur und Vietnam. Ob sich die USA unter dem neuen Präsidenten Joe Biden wieder der trans-pazifischen Partnerschaft anschließen werden, muss sich zeigen. Experten wiesen darauf hin, dass beide Freihandelspakte nicht in Konkurrenz zueinander stehen und sich eine Mitgliedschaft nicht gegenseitig ausschließt. Vielmehr funktioniert das neue RCEP-Abkommen mit China ergänzend. So gehören Japan, Vietnam, Singapur, Brunei, Malaysia, Australien und Neuseeland beiden Bündnissen an. Der neue Freihandelspakt bedeutet auch nicht, dass alle Probleme zwischen den Handelspartnern beseitigt wären oder einzelne Länder nicht ihre Abhängigkeiten von China abbauen wollen. So überprüft Japan gerade seine Lieferketten in China. Auch gibt es Konflikte zwischen Australien und China, weil Peking wegen politischer Spannungen mit Canberra einfach Importe aus Australien beschränkt. So gibt es Sorgen, dass China seinen gewonnenen wirtschaftlichen Einfluss auch politisch als Druckmittel nutzen könnte. Ausgerechnet das derart drangsalierte Australien hofft jetzt aber darauf, dass sich China durch eine bessere multilaterale Einbindung stärker an Regeln hält. ""Es ist ein hoch symbolisches Abkommen in einer Zeit von Ungewissheit für den globalen Handel"", sagte Australiens Handelsminister Simon Birmingham der Zeitung ""Sun-Herald"". ""Es ist entscheidend, dass Partner wie China, wenn sie sich solchen Abkommen anschließen, nicht nur dem Wortlaut der Vereinbarung folgen, sondern auch ihrem Geiste treu bleiben."" © dpa-infocom, dpa:201115-99-336727/3 China Vietnam","sueddeutsche, DPA"
ASEAN. China und Asien-Pazifik-Staaten schließen weltgrößten Freihandelspakt,no_author,2020-11-15 05:48:53,https://www.sueddeutsche.de/politik/asean-china-und-asien-pazifik-staaten-schliessen-weltgroessten-freihandelspakt-dpa.urn-newsml-dpa-com-20090101-201115-99-336701,"Hanoi (dpa) - Nach achtjährigen Verhandlungen haben   und 14 andere asiatisch-pazifische Staaten das größte Freihandelsabkommen der Welt abgeschlossen. Die Unterzeichnung erfolgte am Sonntag auf dem virtuellen Gipfel der südostasiatischen Staatengemeinschaft Asean in der vietnamesischen Hauptstadt Hanoi. © dpa-infocom, dpa:201115-99-336701/1 China","sueddeutsche, DPA"
Wahlen. Biden siegt auch in Georgia und baut Vorsprung aus,no_author,2020-11-14 02:31:57,https://www.sueddeutsche.de/politik/wahlen-biden-siegt-auch-in-georgia-und-baut-vorsprung-aus-dpa.urn-newsml-dpa-com-20090101-201114-99-328962,"Washington (dpa) - Der neu gewählte US-Präsident Joe Biden hat nach jüngsten Prognosen auch den Bundesstaat Georgia gewonnen - und seinen Vorsprung auf den unterlegenen Amtsinhaber Donald Trump damit weiter ausgebaut. Den Berechnungen von CNN, NBC, ABC und CBS zufolge kommt der Demokrat Biden bei der US-Wahl nun auf 306 Wahlleute, exakt so viele wie der Republikaner Trump vor vier Jahren hatte - und deutlich mehr als die für einen Sieg erforderlichen 270. Trump hatte bei seinem Überraschungserfolg 2016 von einem ""Erdrutschsieg"" gesprochen. ZWEIFELT TRUMP? Trump ließ am Freitag erstmals Zweifel an der bisher von ihm demonstrierten Siegesgewissheit erkennen. ""Diese Regierung wird keinen Lockdown machen"", sagte er bei einem Auftritt im Rosengarten des Weißen Hauses, bei dem es um einen Impfstoff gegen das Coronavirus ging. Er fuhr fort mit den Worten: ""Hoffentlich wird die"", hielt kurz inne - und begann seinen Satz dann noch einmal neu: ""Was immer in der Zukunft passiert, wer weiß, welche Regierung es sein wird, ich denke, das wird sich zeigen. Aber ich kann Ihnen versichern, diese Regierung wird keinen Lockdown machen."" BIDEN BEI LANDESWEITEN STIMMEN WEIT VORNE US-Sender prognostizierten am Freitag, dass Biden Georgia (16 Wahlleute) gewonnen habe und Trump den Bundesstaat North Carolina (15). Das waren die letzten beiden Bundesstaaten, in denen noch kein Sieger der Wahl vom 3. November ausgerufen worden war. Damit käme Biden auf 306 Wahlleute, Trump auf 232. Bei der Wahl vor vier Jahren hatte Trump 306 Wahlleute hinter sich gebracht, seine Herausfordererin Hillary Clinton kam auf 232. Trump hatte damals die meisten Wahlleute in den Bundesstaaten gewonnen, landesweit aber knapp drei Millionen Wählerstimmen weniger als Clinton bekommen. Bei dieser Wahl liegt Biden auch bei den landesweiten Stimmen mehr als fünf Millionen vor Trump: Der Demokrat kommt auf knapp 78 Millionen Stimmen (50,8 Prozent), der Republikaner auf 72,7 Millionen (47,5 Prozent). Der US-Präsident wird nur indirekt vom Volk gewählt. Die Stimmen der Wähler entscheiden über die Zusammensetzung des Wahlkollegiums, das den Präsidenten dann im Dezember wählt. Für einen Sieg braucht ein Kandidat die Mehrheit der 538 Wahlleute. TRUMP NIMMT KEINE FRAGEN AN Trumps Äußerungen am Freitag waren die ersten bei einem öffentlichen Auftritt seit Donnerstag vergangener Woche, als er im Weißen Haus vor Reporter getreten war und erneut den Wahlsieg für sich reklamiert hatte. Der amtierende Präsident nahm auch diesmal keine Fragen von Journalisten an. In den   ist es üblich, dass die Präsidentenwahl auf der Basis von Prognosen großer Medienhäuser als entschieden gilt - normalerweise noch in der Wahlnacht. Die amtlichen Ergebnisse kommen teils erst viel später. Wegen der Corona-Pandemie hatten Millionen Amerikaner dieses Jahr aber per Brief abgestimmt, weshalb sich die Auszählung der Stimmen hinzog. TRUMP-ANHÄNGER WOLLEN DEMONSTRIEREN Trump hofft jetzt auf verstärkte Unterstützung seiner Anhänger. Vor geplanten Demonstrationen an diesem Samstag in der Hauptstadt Washington gegen vermeintlichen Wahlbetrug kündigte Trump auf Twitter an, er überlege, ob er ""vorbeikommt und Hallo sagt"". Er fühle sich ermutigt von ""all der enormen Unterstützung da draußen, besonders auf Kundgebungen, die ganz natürlich überall im Land aufkommen"". Trump wiederholte seinen Vorwurf, die Wahl sei manipuliert gewesen, blieb Belege dafür aber auch diesmal schuldig. Unter dem Motto ""Stop the Steal"" (Beendet den Diebstahl) haben mehrere Gruppen für diesen Samstag im Zentrum von Washington zu einem ""Marsch für Trump"" aufgerufen. Ein Demonstrationszug soll zum Sitz des Obersten Gerichtshofs der USA führen, von dem sich manche Trump-Anhänger juristische Hilfe bei der Anfechtung des Wahlergebnisses versprechen. Antifa-Gruppen haben zum Protest gegen die Kundgebung aufgerufen. WEISSES HAUS HÄLT AN SIEGESTHESE FEST Trumps Handelsberater Peter Navarro sagte am Freitag im TV-Sender Fox News: ""Wir im Weißen Haus agieren weiterhin in der Annahme, dass es eine zweite Amtszeit von Präsident Trump geben wird."" Auch die Sprecherin des Weißen Hauses, Kayleigh McEnany, sagte am Freitag im Sender Fox Business: ""Ich denke, dass der Präsident bei seiner eigenen Amtseinführung anwesend sein wird."" Die Frage war, ob Trump zu der Amtseinführungsfeier am 20. Januar 2021 kommen werde - also zur Zeremonie für den Wahlsieger Joe Biden. CORONA-ZAHLEN STEIGEN ALARMIEREND Die Corona-Pandemie gerät in den USA indes immer mehr außer Kontrolle. Die USA verzeichnen täglich neue Höchststände an Neuinfektionen mit dem Coronavirus. Am Donnerstag wurden 153 496 Fälle registriert, wie aus Daten der Johns-Hopkins-Universität (JHU) vom Freitag hervorging. Das waren rund 10 000 mehr als am Vortag. Damit verzeichneten die USA die höchste Fallzahl für Ansteckungen mit dem Virus binnen 24 Stunden seit Beginn der Pandemie. CHINA GRATULIERT BIDEN Erstmals gratulierte nun auch Chinas Staatsführung Biden und der künftigen Vizepräsidentin Kamala Harris zum Wahlsieg. Die Regierung in Peking hatte sich zuvor mit offiziellen Glückwünschen zurückgehalten. ""Wir respektieren die Wahl der Menschen in Amerika und übermitteln Herrn Biden und Frau Harris unsere Glückwünsche"", erklärte ein Sprecher des Außenministeriums am Freitag. Man verstehe, dass das Ergebnis der US-Wahlen gemäß der US-Gesetze und der dortigen Verfahren festgelegt werde. Das Verhältnis zwischen China und den USA hatte sich während der Präsidentschaft Trumps stark verschlechtert. © dpa-infocom, dpa:201114-99-328962/2 USA","sueddeutsche, DPA"
Handel - Burgwedel. Roßmann hat sich Handlung seines ersten Romans erträumt,no_author,2020-11-16 08:41:33,https://www.sueddeutsche.de/wirtschaft/handel-burgwedel-rossmann-hat-sich-handlung-seines-ersten-romans-ertraeumt-dpa.urn-newsml-dpa-com-20090101-201116-99-347019,"Burgwedel (dpa/lni) - Drogeriekettenchef Dirk Roßmann (74) ist gewissermaßen im Schlaf auf die Handlung seines ersten Romans, eines Klimawandel-Thrillers, gekommen. ""Im Dezember 2019 bin ich 14 Tage lang immer nachts um vier Uhr wach geworden, in einem Zustand zwischen Schlaf und Wachsein hat sich mir die Handlung des Romans förmlich aufgedrängt - im Kern habe ich sie geträumt"", sagte er der ""Neuen Presse"" (Montag) in Hannover. In dem Thriller ""Der neunte Arm des Oktopus"" verbünden sich Russland, China und die USA im Kampf gegen den Klimawandel. ""Die Kernfrage ist: Was passiert, wenn die Politik alles richtig macht - aber die Menschen das gar nicht wollen, weil dadurch ihr gewohntes Leben gefährdet ist?"", fragte Roßmann. Anlass genug für schlaflose Nächte sieht er jedenfalls - ""man muss nur Nachrichten sehen oder hören: Gletscher schmelzen, Permafrostböden tauen auf - das ist wie ein dunkler Schleier, der über uns, unseren Kindern und Enkelkindern liegt"". Zuvor hatte er der ""Hannoverschen Allgemeinen Zeitung"" gesagt, er sei ""nicht daran interessiert, lange über etwas zu reden, sondern daran, Lösungen zu finden"". Mit dem Buch habe er Großes vor: ""Ja, ich will die Welt verändern, und ich hoffe, dass mir das mit einem Buch gelingen kann. Auf jeden Fall habe ich ein Exemplar mit einer besonderen Widmung an Putin auf den Weg gebracht."" Mit seiner 2018 veröffentlichten Autobiografie ""...dann bin ich auf den Baum geklettert"" war der Unternehmer auf den Spitzenplatz der ""Spiegel""-Bestsellerliste gekommen.","sueddeutsche, DPA"
Konjunktur. Japan befreit sich aus der Rezession,no_author,2020-11-16 08:14:54,https://www.sueddeutsche.de/wirtschaft/konjunktur-japan-befreit-sich-aus-der-rezession-dpa.urn-newsml-dpa-com-20090101-201116-99-346461,"Tokio (dpa) - Japans Wirtschaft erholt sich vom Rekordeinbruch im Zuge der Corona-Krise. Es ist das erste Mal nach drei Quartalen, dass Japans Wirtschaft wieder wächst, nachdem die Wirtschaftsmacht zuvor in eine schwere Rezession gerutscht war. Das Bruttoinlandsprodukt ( ) der vor Deutschland drittgrößten Volkswirtschaft der Welt zog im dritten Quartal dieses Jahres - auf das Jahr hochgerechnet - um 21,4 Prozent an, wie die Regierung in Tokio am Montag auf vorläufiger Basis bekanntgab. Dass Japans Konjunkturmotor nach diesem Einbruch jetzt wieder anspringen würde, hatten Ökonomen erwartet. Der Anstieg des BIP - der stärkste seit vier Jahrzehnten - fiel aber noch deutlicher aus als viele Experten gedacht hatten. Die asiatische Leitbörse in Tokio legte in Reaktion auf die starken BIP-Zahlen deutlich zu. Der Nikkei-Index für 225 führende Werte kletterte um 521,06 Punkte oder 2,05 Prozent und beendete den Handel mit 25 906,93 Punkten auf dem höchsten Stand seit rund 29 Jahren.  war bereits vor dem Ausbruch der Corona-Pandemie infolge des Handelskonflikts zwischen den beiden größten Volkswirtschaften der Welt - USA und China - stark geschwächt gewesen. Hinzu kamen die Folgen einer Mehrwertsteueranhebung im vergangenen Jahr. Dann kam die Corona-Krise; die zwischen April und Ende Mai erlassenen Einschränkungen trafen die schwache Wirtschaft mit Wucht. Da Japan jedoch anders als andere Länder keinen harten Lockdown verhängte, war der wirtschaftliche Einbruch noch relativ milde ausgefallen. Im Vergleich zu den vorangegangenen drei Monaten wuchs Japans Wirtschaft im dritten Quartal um 5,0 Prozent. Der private Konsum, der in Japan zu rund 60 Prozent zur Wirtschaftsleistung beiträgt, zog auf das Jahr hochgerechnet um 4,7 Prozent und im Vergleich zum Vorquartal um 7,0 Prozent an. Die Kapitalausgaben der Unternehmen sanken jedoch um 3,4 Prozent, wie aus den vorläufigen Daten weiter hervorgeht. Zwar rechnen viele Ökonomen in Japan mit einer weiteren Erholung der Wirtschaft im Schlussquartal, allerdings viel langsamer als im dritten Quartal. Ein erneuter Anstieg der Corona-Infektionsfälle sowohl in Übersee wie auch im eigenen Land trübt die Geschäftsaussichten. Experten in Tokio rechnen denn auch damit, dass es noch Jahre dauern wird, bis sich Japans Wirtschaft vollständig von den Auswirkungen der globalen Pandemie erholen wird. © dpa-infocom, dpa:201116-99-346461/2 BIP Japan","sueddeutsche, DPA"
