title,author,date_published,url,article_text,source
Auto - Wolfsburg. VW-Chef Diess: Pandemie weiter größte kurzfristige Bedrohung,no_author,2020-11-05 17:48:55,https://www.sueddeutsche.de/wirtschaft/auto-wolfsburg-vw-chef-diess-pandemie-weiter-groesste-kurzfristige-bedrohung-dpa.urn-newsml-dpa-com-20090101-201105-99-226478,"Frankfurt/  (dpa) - Volkswagen-Konzernchef Herbert Diess sieht die Covid-19-Pandemie in der nächsten Zeit als größte Herausforderung für den weltgrößten Autobauer. ""Eine zweite Welle, die einen weitergehenden Lockdown auslösen würde, wäre wirklich schwer zu handhaben"", sagte er am Donnerstag in einer von der Nachrichtenagentur Bloomberg online ausgerichteten Gesprächsrunde. Vom aktuellen Teil-Lockdown in   und vielen anderen Ländern ist die Industrie nicht wie im Frühjahr unmittelbar betroffen, als Autohäuser wochenlang geschlossen waren und die Werke runterfahren mussten. Nicht nur die Wolfsburger machten im zweiten Quartal hohe Verluste. Im dritten Quartal sah es bei VW, Daimler und BMW dann allerdings schon wieder bedeutend besser aus - unter anderem, weil der Markt in China wieder deutlich mehr Schwung bekam. Für die kommenden Wochen bleibt Diess wegen einer ""gesunden Auftragslage"" zuversichtlich. Dennoch hänge die weitere Entwicklung maßgeblich auch davon ab, dass große Volkswirtschaften die Krankheit unter Kontrolle bekommen und Beschränkungen vermeiden, welche die Nachfrage beschädigen würden. Langfristig bleibe der Klimawandel die größte Herausforderung, der sich die Menschheit ausgesetzt sieht. Derzeit steckt die Branche im Umbruch zur Elektrifizierung der Antriebe. In vielen der zwölf Fahrzeugmarken des VW-Konzerns ist das schon auf den Weg gebracht: Die Kernmarke etwa brachte kürzlich den ID.3 aus der Golf-Klasse auf den Markt, um die Jahreswende soll der Kompakt-SUV ID.4 folgen. Laut Diess soll der britische Luxusableger Bentley in den nächsten vier bis fünf Jahren zur Elektromarke werden. Die Umstellung läuft nicht ohne Einschnitte ab. ""Der Wandel wird dazu führen, dass an bestimmten Stellen Arbeitsplätze verlorengehen, aber auch an anderen Stellen neu entstehen"", erklärte Diess bei einer Konferenz der Stiftung 2°, einer Unternehmer-Initiative. Insgesamt sei er zuversichtlich: ""Ich glaube, der Wandel ist bewältigbar."" Es zeige sich durch steigende Zulassungen, dass E-Autos ""nicht mehr ein reines Nischenprodukt"" seien. ""In den nächsten Jahren wird es ganz natürlich sein, dass wir elektrisch fahren."" Kritischer Punkt bleibe die Ladeinfrastruktur: ""In Deutschland wächst sie schnell, aber man muss natürlich auch quer durch Europa kommen."" Europa könne beim Klimaschutz eine Vorreiterrolle übernehmen. ""Wir würden einen großen Fehler machen, wenn wir den Klimawandel nicht ernst nehmen."" Wolfsburg Deutschland","sueddeutsche, DPA"
Verkehr. Bayerische Boxer und China-News: Motorrad-Trends 2021,no_author,2020-11-06 04:25:00,https://www.sueddeutsche.de/wirtschaft/verkehr-bayerische-boxer-und-china-news-motorrad-trends-2021-dpa.urn-newsml-dpa-com-20090101-201105-99-225313,"Stuttgart (dpa/tmn) - Draußen sein, die Freiheit genießen. Motorradfahren wird immer beliebter. Auch für 2021 haben sich die Zweiradhersteller viel vorgenommen. Mit neuen Modellen und Techniken wollen sie weitere Kunden locken, auch wenn dieses Jahr alles andere als normal war. Da im Herbst die beiden Leitmessen Intermot in Köln und Eicma in Mailand coronabedingt ausfielen, zeigen manche ihre Neuheiten deutlich später. So will etwa Harley-Davidson seine Modellpalette erst Anfang 2021 vorstellen. Retromaschinen und Neues aus China Michael Lenzen hält mehrere Neuheiten für 2021 für interessant, darunter Maschinen der Mittelklasse zwischen 500 und 1000 Kubikzentimeter. ""Die neue Triumph Trident mit Dreizylindermotor und rund 100 PS zählt für mich zu den Höhepunkten 2021, aber auch die vielen Kooperationen zwischen chinesischen und europäischen Herstellern"", sagt der Vorsitzende beim Bundesverband der Motorradfahrer (BVDM). Dazu zählt die Benelli TRK 800, eine Reiseenduro der italienischen Marke Benelli, die zum chinesischen Konzern Qianjiang gehört. Auch die hier bislang noch unbekannte chinesische Marke Voge verkauft nun Modelle in Europa. Eine Nummer größer ist die CF Moto 1250 TR-G. Die große Reisemaschine wurde in China als Polizeimotorrad vorgestellt und soll in Europa der   R 1200 RT Konkurrenz machen. Angetrieben wird sie von einem 1,3 Liter großen V2 von KTM. Die französische Firma Mash verkauft mit der X-Ride 650 nun ein Retro-Motorrad im Stil der Yamaha XT 500, lässt es in China produzieren. Ganz modern: das Super-Bike Bimota Tesi H2 mit 231 PS und Achselschenkellenkung. Einen Trend zur Elektromobilität wie bei Autos sieht Lenzen für 2021 nicht: ""Harley-Davidson bietet mit der Live Wire zwar ein E-Motorrad an, Zero nun die neue SR/S. Aber einen Durchbruch sehe ich noch nicht."" Was gibt es Neues in der Mittelklasse? Viele interessante Neuvorstellungen finden sich in der Mittelklasse, meint auch Jörg Lohse: ""Der Bereich zwischen 650 und 1000 Kubikzentimeter mit einer Leistung zwischen 75 und knapp über 100 PS wird nächstes Jahr zulegen, wenn neue Maschinen und neue Konzepte auf den Markt kommen"", sagt der stellvertretende Chefredakteur der Zeitschrift  . ""Hier tummeln sich viele Hersteller mit vielen Modellvarianten, umfangreichen Ausstattungen zu attraktiven Preisen"", sagt Lohse. Dazu zählen unter anderem Modelle wie KTM 890 Adventure R und das Sondermodell Rally, Aprilia RS 660, von der noch Naked- und Enduro-Ableger zu erwarten sind sowie die neue Triumph Trident. Günstige Modelle in der Klasse fangen bei rund 7500 Euro an. ""Interessant werden auch die Maschinen chinesischer Kooperationen sein, wie Mash oder Brixton, die nun auch Modelle in größeren Hubraumklassen als bisher Modelle anbieten werden"", sagt Lohse. Voge will mit zwei 500er-Allroundermodellen Aufmerksamkeit auf sich lenken. Dazu entdeckt   wieder den 350er-Kubikzentimeter-Bereich für sich und präsentiert mit der H'ness CB 350 sehr klassisch gestylte neue Modelle. Bei den stärkeren und teureren Maschinen sieht Lohse einen Trend zu mehr Assistenzsystemen, die größere Sicherheit bieten. Bei der neuen Ducati Multistrada 1200 V4 arbeitet erstmals ein radargestütztes Assistenzsystem für einen Abstandswarner, Tempomat und Totwinkel-Warner. BMW hat ein ähnliches System angekündigt, KTM wird wahrscheinlich nachziehen. Boxer und schwere Brummer aus Bayern BMW hat mit dem Cruiser R 18 eine Maschine mit einem luftgekühlten 1,8-Liter-Zweizylinder-Boxer vorgestellt. Das 2021er Modell ist bereits ausverkauft. Daneben gibt es die Touring-Variante R 18 Classic im nostalgischen Look mit Windschild, Satteltaschen und Zusatzscheinwerfen. Weitere Individualisierungen sind möglich. Daneben steht ein anderes Extrem: Mit der M 1000 RR stellte BMW das erste Motorrad mit M-Logo vor. Die straßentaugliche, extreme Maschine mit Renntechnik leistet 212 PS, kann bis zu 315 km/h schnell werden und kostet rund 32.000 Euro. Die erfolgreiche GS-Reihe von BMW bekommt zum 40-jährigen Jubiläum der Baureihe noch etliche Sondermodelle spendiert, angefangen bei der kleinen Einsteiger-GS mit 310 Kubik bis zum Topseller R 1250 GS. Infokasten: Ausgiebige Probefahrten nicht vergessen        Egal, für welche Maschine Sie sich entscheiden: Die favorisierte Maschine sollte man vor dem Kauf unbedingt ausgiebig testen rät Matthias Haasper vom Institut für Zweiradsicherheit (ifz). ""Ein sicherer Stand, mit beiden Füßen gleichzeitig auf dem Boden, bequemes Sitzen und gute Handlichkeit sind dabei wichtig.""       Dies sei gerade bei Fahranfängern von Bedeutung, um Unsicherheiten vorzubeugen. ""Je mehr Assistenzsysteme an Bord sind, desto mehr Sicherheit bietet die Maschine. Das gilt für Fahranfänger ebenso wie für routinierte Fahrer"", erläutert Haasper. © dpa-infocom, dpa:201105-99-225313/2 BMW ""Motorrad"" Honda","sueddeutsche, DPA"
Sport. Koreanisches Team Damwon Gaming ist LoL-Weltmeister,no_author,2020-11-01 14:04:27,https://www.sueddeutsche.de/sport/sport-koreanisches-team-damwon-gaming-ist-lol-weltmeister-dpa.urn-newsml-dpa-com-20090101-201031-99-158199,"Shanghai (dpa) - Damwon Gaming ist neuer Weltmeister in League of Legends. Das Team der koreanischen Liga LCK besiegte am Samstag die chinesischen Kontrahenten von Suning mit 3:1. In vier aufregenden Spielen der Best-of-Five-Serie begegneten sich die Teams auf Augenhöhe. ""Letztes Jahr sind wir schon nach dem Viertelfinale ausgeschieden. Also habe ich hart trainiert, um hilfreich für meine Teamkameraden zu sein. Und ich bin froh, dass es so gut geklappt hat und wir diese Trophäe in den Händen halten können"", sagte Damwons Midlaner Heo ""Showmaker"" Su laut Übersetzung im Interview nach dem Sieg. In den ersten drei Spielen gewannen beide Teams abwechselnd die Oberhand. So wurde das erste Spiel mit etwa 45 Minuten zum längsten Spiel der diesjährigen WM. Gegnerische Fehler nutzten beide Mannschaften gekonnt aus, Damwon aber gewann den entscheidenden letzten Teamkampf und ging mit 1:0 in Führung. Im zweiten Spiel dann der Ausgleich: Suning gewann langsam, aber sicher die Kontrolle über den Spielverlauf und nutzte kleinere Fehler seitens Damwon. Nach einem finalen Teamkampf schlug das chinesische Team zurück und es stand 1:1. Auch im dritten Spiel blieben beide Teams bis zum Ende stark und setzten sich abwechselnd durch. Schon im frühen Spielverlauf sicherte sich Damwon sämtliche Drachen und die damit verbundenen Verstärkungen, Suning holte aber in der 24. Minute mit dem Baron einen enormen Vorteil. Ein Fehler im späteren Spielverlauf kostete Suning jedoch nicht nur den nächsten Baron, sondern auch das Spiel. Erst mit einem Matchpunkt im vierten Spiel dominierte Damwon deutlich und Suning kapitulierte nach nur 27 Minuten. ""Es ist schade, dass wir das Spiel verloren haben. Wenn ich besser gespielt hätte, hätten wir es vielleicht gewonnen"", sagte Sunings Midlane-Spieler Xiang ""Angel"" Tao laut Übersetzung nach dem Spiel. ""Aber obwohl wir verloren haben, glaube ich, dass wir nächstes Jahr wiederkommen können."" Seit 2017 ist mit Damwon erstmals wieder ein koreanisches Team Weltmeister. Das Finale fand im neu erbauten Pudong Fußball-Stadion in Shanghai statt. Nach Angaben des Veranstalters haben etwa 6000 Menschen vor Ort das Finale verfolgt. Dabei galten strenge Hygiene-Vorgaben. © dpa-infocom, dpa:201031-99-158199/3","sueddeutsche, DPA"
Geschichte. Kalenderblatt 2020: 7. November,no_author,2020-11-06 23:55:00,https://www.sueddeutsche.de/wissen/geschichte-kalenderblatt-2020-7-november-dpa.urn-newsml-dpa-com-20090101-201026-99-81040,"Berlin (dpa) - Das aktuelle Kalenderblatt für den 7. November 2020: 45. Kalenderwoche, 312. Tag des Jahres Noch 54 Tage bis zum Jahresende Sternzeichen: Skorpion Namenstag: Engelbert, Ernst, Willibrord HISTORISCHE DATEN 2019 - In der britischen Zeitung ""Economist"" nennt der französische Präsident Emmanuel Macron die Nato ""hirntot"". Man könne sich nicht länger auf die USA verlassen. Bundeskanzlerin Angela Merkel (CDU) kritisiert den ""Rundumschlag"". 2018 - US-Präsident Donald Trump erzwingt den Rücktritt seines Justizministers Jeff Sessions. Er kritisiert die mangelnde Unterstützung des Ministers im Streit über russische Einmischung in die US-Wahlen 2016. 2015 - Die Staatsspitzen von China und Taiwan treffen sich erstmals seit 60 Jahren in Singapur. Chinas Präsident Xi Jinping betrachtet Taiwan als abtrünnige Provinz. Präsident Ma Ying-jeou geht es um wirtschaftliche Zusammenarbeit. 2010 - Papst Benedikt XVI. weiht bei seinem Spanien-Besuch den weltbekannten Sakralbau Sagrada Família in Barcelona und erhebt das Gotteshaus des Architekten Antoni Gaudí zur Basilika. Der bisher unvollendete Bau wurde vor 128 Jahren begonnen. 2005 - Das Militärregime in Birma verlegt seinen Regierungssitz von der Hauptstadt Rangun in die 320 Kilometer entfernt gelegene Provinzstadt Pyinmana im Norden des Landes. Dort entsteht neue Hauptstadt Naypyidaw. 2000 - Der Republikaner George W. Bush wird zum 43. US-Präsidenten gewählt. Erst nach mehrwöchigem Streit um das Wahlergebnis in Florida entscheidet der Oberste Gerichtshof zu seinen Gunsten. Bush erhält zwar weniger Stimmen als sein Kontrahent Al Gore, dennoch hat er mit 271 zu 266 Wahlmännern die Nase knapp vorn. 1995 - Das Bundesverfassungsgericht bestätigt sein Urteil von 1994 zum Tucholsky-Zitat ""Soldaten sind Mörder"". Demnach ist die Äußerung nicht strafbar, wenn sie als Kritik am Kriegshandwerk zu verstehen ist. 1968 - Die Journalistin Beate Klarsfeld ohrfeigt während eines CDU-Parteitages in Berlin den damaligen Bundeskanzler Kurt Georg Kiesinger (CDU), um gegen dessen frühere Mitgliedschaft in der NSDAP zu protestieren. 1963 - Bei dem ""Wunder von Lengede"" können vierzehn Tage nach einem Bergwerksunglück in der niedersächsischen Eisenerzgrube elf schon tot geglaubte Kumpel lebend geborgen werden. GEBURTSTAGE 1955 - Detlef Ultsch (65), deutscher Judoka, erster deutscher Judo-Weltmeister 1979 in Paris 1955 - Harald Wohlfahrt (65), deutscher Spitzenkoch, wurde 25 Jahre lang ununterbrochen vom Guide Michelin mit drei Sternen benotet 1955 - Norbert Eder, deutscher Fußballspieler (1. FC Nürnberg, FC Bayern München), gest. 2019 1940 - Antonio Skármeta (80), chilenischer Schriftsteller (""Mit brennender Geduld"") und Diplomat, chilenischer Botschafter in   2000-03 1925 - Ernst Mosch, deutscher Musiker, langjähriger Leiter des Blasorchesters Original Egerländer Musikanten, gest. 1999 TODESTAGE 2017 - Hans Schäfer, deutscher Fußballspieler (1. FC Köln), Fußball-Weltmeister 1954, ""Fußballer der Jahres"" 1963, geb. 1927 1980 - Steve McQueen, amerikanischer Schauspieler (""Papillon""), geb. 1930 © dpa-infocom, dpa:201026-99-81040/2 Deutschland","sueddeutsche, DPA"
Börsen. Rekord-Börsengang von Alibabas Ant Group geplatzt,no_author,2020-11-03 17:58:44,https://www.sueddeutsche.de/wirtschaft/boersen-rekord-boersengang-von-alibabas-ant-group-geplatzt-dpa.urn-newsml-dpa-com-20090101-201103-99-196330,"Shanghai (dpa) - Nur zwei Tage vor dem geplanten Rekord-Börsengang des Finanzablegers der weltgrößten Online-Handelsplattform Alibaba ist das Debüt in Shanghai und   geplatzt. Das mit Spannung erwartete Doppellisting der Ant Group sollte den Erwartungen nach mit 34,5 Milliarden US-Dollar (29,2 Mrd Euro) der größte Börsengang aller Zeiten werden. Der Fintech-Riese betreibt den populären mobilen Bezahldienst Alipay. Die Aufsichtsgremien der   in Shanghai und Hongkong setzten die Börseneinführung aber überraschend vorerst aus. Die Shanghaier Börse begründete den Schritt am Dienstagabend Ortszeit damit, dass sich das ""aufsichtsrechtliche Umfeld"" bedeutend geändert habe. Das könnte dazu führen, dass Ant Group die Bedingungen für den Börsengang und die Offenlegungspflichten nicht erfüllen könnte. Ant Group teilte nach Angaben der Finanzagentur Bloomberg mit, dass auch das Debüt in Hongkong gestoppt worden sei. Am Vortag waren der Alibaba-Gründer Jack Ma und andere Führungskräfte des Unternehmens von Chinas Zentralbank und anderen Aufsichtsbehörden vorgeladen worden. Es sei um ""die Gesundheit und Stabilität des Finanzsektor"" gegangen, hieß es hinterher. Ant Group wolle die dabei ausgetauschten Meinungen umsetzen, teilte das Unternehmen danach mit. Es blieb aber unklar, was die Anweisungen gewesen sind. In dem Treffen wurde Milliardär Ma und seinen Managern nach Angaben der Finanzagentur Bloomberg mitgeteilt, dass sich Ant Group bei seiner Expansion den gleichen Beschränkungen hinsichtlich Kapital und Verschuldung unterwerfen müsse wie chinesische Banken. Es ferner zudem spekuliert, dass sich der Milliardär Ma, Chinas zweitreichster Unternehmer, den Zorn der Finanzhüter auf sich gezogen haben könnte. Die ungewöhnliche Vorladung folgte auf scharfe Kritik von Ma, der lokalen und globalen Regulierungsbehörden kürzlich in einer Rede vorgeworfen hatte, Innovation zu bremsen und neuen Entwicklungen nicht genug Aufmerksamkeit zu schenken. ""Gute Innovation hat keine Angst vor Regulierung, aber sie hat Angst vor veralteten Vorschriften"", wurde Ma zitiert. Die Zukunft dürfe nicht ""mit Methoden von gestern"" reguliert werden. Das geplante Aktiendebüt hätte mit 34,5 Milliarden US-Dollar den bislang größten Börsengang von Saudi Aramco in Höhe von 29 Milliarden Dollar übertreffen können. Der saudische Ölriese hatte im Dezember 2019 allerdings nur 1,5 Prozent seiner Anteile verkauft. Die Ant Group wäre mit dem Börsengang mehr als 200 Milliarden US-Dollar wert gewesen. Kein anderes Fintech-Unternehmen wird derart hoch bewertet. Ant Group betreibt in   nicht nur den mobilen Bezahldienst Alipay, sondern bietet auch Kredite, Versicherungen und Vermögensverwaltung an. Den mobilen Bezahlmarkt teilt sich Alipay mit der Konkurrenz von Wechat-Pay des chinesischen Internetkonzerns Tencent. Das Milliardenvolk bezahlt heute in Geschäften meist nur noch mit dem Handy, indem ein Code eingescannt wird - sei es ""Weixin"" für Wechat oder ""Zhifubao"" für Alipay. Die Alipay-App hat 711 Millionen monatliche Nutzer - eine Milliarde insgesamt. Auch in Europa wird Alipay von Tausenden Einzelhändlern akzeptiert, um chinesische Touristen anzulocken. In Deutschland bieten die Drogerieketten dm und Rossmann sowie die WMF-Gruppe, der Kaufhof oder der Flughafen München die Zahlung mit Alipay an. Mit Hongkong und Shanghai hatte die Ant Group die amerikanischen Börsen umgehen wollen - eine Neuerung für ein derart großes chinesisches Technologie-Unternehmen. Das Vorgehen wurde vor dem Hintergrund der Spannungen zwischen China und den USA gesehen. Nach einigen Skandalen wollen die US-Aufsichtsbehörden chinesischen Unternehmen künftig auch tiefer in die Bücher schauen als bisher. Alibaba selbst war 2014 in New York an die Börse gegangen. 2019 erfolgte die Zweitnotierung in Hongkong. Die Verschiebung des Börsengangs ist auch ein Rückschlag für die neue Technologiebörse Star in Shanghai, die als das chinesische Gegenstück zur Nasdaq in den USA gegründet worden war. © dpa-infocom, dpa:201103-99-196330/2 Hongkong Börsen China","sueddeutsche, DPA"
Luftverkehr. Erste Landung auf Südbahn: BER nun vollständig in Betrieb,no_author,2020-11-04 15:46:58,https://www.sueddeutsche.de/wirtschaft/luftverkehr-erste-landung-auf-suedbahn-ber-nun-vollstaendig-in-betrieb-dpa.urn-newsml-dpa-com-20090101-201104-99-205292,"Berlin/Schönefeld (dpa) - Der Hauptstadtflughafen   hat vollständig den Betrieb aufgenommen: Erstmals ist eine reguläre Linienmaschine auf der neu gebauten Südbahn gelandet. Es handelte sich um einen Langstreckenflug der Fluggesellschaft Qatar Airways aus der katarischen Hauptstadt Doha. Damit ist der Willy-Brandt-Flughafen auch genehmigungsrechtlich offiziell in Betrieb gegangen. Die Flughafenfeuerwehr begrüßte das Flugzeug mit einer Wasserfontäne. Bereits am Wochenende waren das BER-Hauptterminal T1 mit neun Jahren Verspätung eröffnet und die ersten Passagiere dort abgefertigt worden. Flughafen-Chef Engelbert Lütke Daldrup nutzte den Anlass, um sich erneut für mehr Langstreckenflüge am BER auszusprechen. ""Wir haben endlich einen Airport nach internationalen Standards"", sagte er am Mittwoch nach der Landung. Neben den existierenden Langstreckenverbindungen unter anderem in die USA, nach Singapur, China und Iran verspreche er sich weitere Optionen. ""Das ist auf der einen Seite eine Aufgabe, die der Flughafen wahrnehmen muss."" Gleichzeitig brauche es aber auch Unterstützung seitens der Politik. ""Der Flughafen wird eine wichtige Basis bieten für die Zeit nach der Pandemie"", sagte Lütke Daldrup. Der Chef der Lufthansa-Gruppe, Carsten Spohr, hatte sich am Wochenende allerdings mit Blick auf Langstrecken skeptisch geäußert, ob der neue Flughafen für den eigenen Konzern dabei eine größere Rolle spielen werde. ""Es gibt historische Gründe, warum in   der Langstreckenverkehr nicht von den beiden größten Städten aus stattfindet, sondern von den beiden Drehkreuzen München und Frankfurt"", sagte Lufthansa-Vorstandschef Carsten Spohr am Samstag. ""Und ich glaube, daran wird auch der BER in der Tat nichts ändern."" Mit der offiziellen Inbetriebnahme des Flughafens zogen zur Mitte der Woche weitere Luftfahrtgesellschaften vom bisherigen Standort Tegel zum BER um. Bereits am Dienstag wechselte die Eurowings als einer der größeren Anbieter den Standort. Weitere Umzüge vor allem der Lufthansa-Gruppe sind für den letzten Betriebstag des Flughafens Tegel am Samstag geplant. Damit rückt die Schließung des alten Standorts im Norden Berlins näher. Ein letzter Sonderflug von Tegel ist für Sonntag geplant - eine Air-France-Maschine zum Pariser Flughafen Charles de Gaulle. Am zuletzt für jährlich rund zehn Millionen Fluggäste ausgelegten Flughafen Tegel waren im vergangenen Jahr laut Lütke Daldrup mehr als 24 Millionen Passagiere abgefertigt worden. In der Corona-Krise waren die Zahlen wie an allen Flughäfen aber massiv eingebrochen. ""Wir haben sicherlich alle ein bisschen Wehmut, viele Emotionen mit diesem Flughafen verbunden. Er hat eine lange Geschichte und hat immer performt"", sagte Lütke Daldrup. Tegel wird nach der Schließung ein halbes Jahr lang betriebsbereit bleiben. Erst am 4. Mai 2021 soll er dann endgültig vom Netz gehen und die Flughafenlizenz verlieren. Die Flüge am BER wurden bislang ausschließlich über die Nordbahn abgewickelt, die bereits zum alten Flughafen Schönefeld gehörte. Die neu gebaute zweite Start- und Landebahn südlich des Hauptgebäudes blieb bis Mittwoch gesperrt. Am frühen Mittwochmorgen entfernten Mitarbeiter die entsprechenden Markierungen für die Piloten in der Luft. Schönefeld dient dem BER inzwischen als Terminal 5. © dpa-infocom, dpa:201104-99-205292/5 BER Deutschland","sueddeutsche, DPA"
