title,author,date_published,url,article_text,source
Medien. Hanns-Joachim-Friedrichs-Preis an Ulf Röller,no_author,2020-11-11 13:12:49,https://www.sueddeutsche.de/wirtschaft/medien-hanns-joachim-friedrichs-preis-an-ulf-roeller-dpa.urn-newsml-dpa-com-20090101-201111-99-294785,"Hamburg/Mainz (dpa) - Der renommierte Hanns-Joachim-Friedrichs-Preis geht dieses Jahr an den Leiter des ZDF-Studios in Peking, Ulf Röller. Der Korrespondent und sein Team werden für die Berichte aus   in Zeiten der Corona-Krise und aus Hongkong während der Massenproteste ausgezeichnet. Der Preis für Fernsehjournalismus wird seit 1995 von einem Verein aus Hamburg vergeben. Die Jury lobte in einer Mitteilung vom Mittwoch die Preisträger ""für deren höchst präzise, umsichtig und unter schwierigsten Umständen erarbeiteten"" Filme und Analysen. ""Ulf-Jensen Röller berichtete als eine der ersten ausländischen Fernsehjournalisten aus der wegen Covid-19 kaum zugänglichen Stadt Wuhan. Die Bilder seines Teams und seine Beobachtungen gaben abseits der offiziellen Informationspolitik der chinesischen Regierung erste realitätsnahe Einschätzungen über die Auswirkungen der Pandemie auf das Leben der Bevölkerung"", so die Jury. Röller lasse sich als Reporter ""nie verführen, weder von den regierungsamtlichen Verlautbarungen noch von nicht nachprüfbaren Darstellungen der Opposition"". Die Jury ehrte dieses Jahr auch eine Journalistin der britischen BBC: Emily Maitlis (""BBC-Newsnight""). ""Ihre Fragen und Nachfragen - wie im Interview mit Prince Andrew - forschen nach den Hintergründen von Ereignissen und leuchten hinter das Gesicht ihrer Gesprächspartner"", hieß es zur Begründung. Ein Sonderpreis ging an die beiden NDR-Reporter Nadia Kaiouli und Jonas Schreijäg ""für ihre außergewöhnlichen und eindrücklichen Dokumentarfilmaufnahmen"" von dem Seenotrettungsschiff ""Sea-Watch3"". Frühere Träger des Preises sind etwa Anne Will, Anja Reschke sowie Oliver Welke und Denis Scheck. © dpa-infocom, dpa:201111-99-294785/2 China","sueddeutsche, DPA"
Parlament. Hongkong schließt vier Abgeordnete aus,no_author,2020-11-11 19:22:00,https://www.sueddeutsche.de/politik/parlament-hongkong-schliesst-vier-abgeordnete-aus-dpa.urn-newsml-dpa-com-20090101-201111-99-292797," (dpa) - Aus Protest gegen den Rauswurf von vier Abgeordneten aus dem Hongkonger Parlament haben die Mitglieder des demokratischen Lagers nahezu geschlossen ihren Rücktritt angekündigt. Die 15 Abgeordneten des demokratischen Parteienbündnisses gaben ihre Entscheidung am Mittwoch bekannt. Kurz zuvor hatte die Regierung der chinesischen Sonderverwaltungsregion ihren Mitstreitern Alvin Yeung, Kwok Ka-ki, Dennis Kwok und Kenneth Leung die Mandate aberkannt. Hongkong war bis 1997 eine britische Kronkolonie und hat eigentlich besondere Rechte garantiert. Wenige Minuten vor dem Rauswurf hatte Chinas staatliche Nachrichtenagentur Xinhua eine Entscheidung des Ständigen Ausschusses des Nationalen Volkskongresses veröffentlicht. Demnach kann Abgeordneten in Hongkong nun unter bestimmten Bedingungen ihr Sitz ohne Gerichtsbeschluss entzogen werden - wenn sie die Unabhängigkeit Hongkongs befürworten, sich an Handlungen beteiligen, die die nationale Sicherheit gefährden oder ausländischen Kräften helfen, sich in innere Angelegenheiten einzumischen. Die vier betroffenen Politiker waren bereits von der Parlamentswahl ausgeschlossen worden, die eigentlich im September stattfinden sollte. Die Wahl wurde dann aber auf nächstes Jahr verschoben. Die vier gehörten im sogenannten Legislativrat - dem offiziellen Namen von Hongkongs Parlament - ebenfalls dem demokratischen Parteienbündnis an. Daneben gab es bislang nur wenige Abgeordnete, die   gegenüber ebenfalls kritisch eingestellt sind. Hongkongs pro-chinesische Regierungschefin Carrie Lam verteidigte das Vorgehen: ""Wir brauchen ein politisches Gremium, das sich aus Patrioten zusammensetzt."" Der Vorsitzende des demokratischen Lagers, Wu Chi-wai, sagte dagegen: ""Heute geben wir bekannt, dass wir von unseren Posten zurücktreten werden, da unsere Kollegen durch den rabiaten Schritt der Zentralregierung ausgeschlossen wurden."" Auch international gab es Kritik. Ein Sprecher des Auswärtigen Amtes erklärte, die Entscheidung setze ""einen Trend zur Aushöhlung des Pluralismus und der Meinungsfreiheit fort, der uns insbesondere seit der Einführung des Nationalen Sicherheitsgesetzes zutiefst besorgt"". Der britische Außenminister Dominic Raab nannte ""Chinas Entscheidung, gewählte pro-demokratische Abgeordnete willkürlich aus ihren Positionen zu entfernen"", einen weiteren ""Angriff auf Hongkongs hohen Grad an Unabhängigkeit."" Diese Offensive gegen die demokratische Opposition trübe Chinas internationales Ansehen und untergrabe Hongkongs Stabilität. Die Vorsitzende des Menschenrechtsausschusses im Bundestags, Gyde Jensen (FDP), kritisierte, mit einem solchen ""Blankoscheck-Gesetz"" könnten künftig auch andere unliebsame Abgeordnete ausgeschlossen werden.   breche damit endgültig Völkerrecht. Die Bundesregierung müsse ""endlich deutliche Konsequenzen ziehen"". Ähnlich äußerte sich der Grünen-Politiker Jürgen Trittin. ""Wer die Zusammensetzung der frei gewählten Teile des Parlaments gewaltsam verändert, hat sich von der Demokratie verabschiedet"", sagte das Mitglied im Auswärtigen Ausschuss. Er forderte ""Konsequenzen für die Verhandlungen zum Investitionsabkommen zwischen der EU und China"". Der Legislativrat war bislang schon nur teilweise demokratisch besetzt, da Peking keine komplett freien Wahlen in der Sonderverwaltungsregion zulässt. Nur ein Teil der Abgeordneten werden nach allgemeinem freien Wahlrecht gewählt. Die anderen werden von Hongkonger Interessensgruppen bestimmt, die in der Mehrzahl dem Pro-Peking-Lager angehören. Wie die Hongkonger Zeitung ""South China Morning Post"" berichtete, hatten sich die vier Abgeordneten an so genannten Filibustern beteiligt. Dabei wird durch andauernde Nachfragen eine Abstimmung über Gesetzesvorhaben verhindert. Regierungschefin Lam bestritt, dass der Ausschluss damit zu tun habe. Man nehme Abgeordneten nicht die Sitze, ""weil sie bestimmte parlamentarische Taktiken anwenden"". Nicht zulässig seien aber Verstöße gegen die Verfassung und das Gesetz zum Schutz der nationalen Sicherheit. China hatte das umstrittene Gesetz im Juni verabschiedet. Es richtet sich gegen Aktivitäten, die Peking als subversiv, separatistisch oder terroristisch ansieht. Kritiker halten dies für den bislang weitestgehenden Eingriff in Hongkongs Autonomie. Seit dem 1. Juli 1997 gehört Hongkong wieder zu China, wird aber nach dem Grundsatz ""Ein Land, zwei Systeme"" regiert. Diese Vereinbarung sieht eigentlich vor, dass Hongkonger für 50 Jahre bis 2047 ""ein hohes Maß an Autonomie"" und viele Freiheiten genießen. Seit der Verabschiedung des Sicherheitsgesetzes reden viele jedoch nur noch von ""Ein Land, ein System"". © dpa-infocom, dpa:201111-99-292797/8 Hongkong China Peking","sueddeutsche, DPA"
"Olympia. ""Muss für die Menschheit"": Tokio-Macher ringen um Olympia",no_author,2020-11-11 18:36:08,https://www.sueddeutsche.de/sport/olympia-muss-fuer-die-menschheit-tokio-macher-ringen-um-olympia-dpa.urn-newsml-dpa-com-20090101-201111-99-299873,"Tokio (dpa) - Die älteste Frau der Welt soll den Olympia-Machern von Tokio als Zeichen der Hoffnung dienen. Im Alter von dann 118 Jahren ist Kane Tanaka am 11. Mai 2021 als Trägerin der olympischen Fackel auf dem Weg zu den Sommerspielen in Japans Hauptstadt vorgesehen. So weit reicht in diesen Tagen also der Optimismus der Planer für das um ein Jahr verlegte Ringe-Spektakel. Trotz der in vielen Ländern wieder sprunghaft gestiegenen Corona-Infektionszahlen, den Zweifeln an der Durchführbarkeit ausstehender Qualifikationswettkämpfe und der Kostenrisiken treiben Gastgeber und IOC unbeirrt die Vorbereitungen auf die Olympischen Spiele voran. ""Ich möchte bekräftigen, dass die Ausrichtung der Spiele im nächsten Jahr mehr denn je ein Muss für die Menschheit ist"", sagt der Chef des Organisationskomitees, Yoshiro Mori. Die Formel von Tokio als ""Leuchtfeuer der Hoffnung"" hat der 83 Jahre alte frühere Ministerpräsident von IOC-Chef Thomas Bach kopiert, der ebenfalls unermüdlich die Anstrengungen der Japaner zur Rettung der Spiele lobt. ""Seien Sie sicher, dass wir einen Werkzeugkasten von Maßnahmen gegen Corona für alle erdenklichen Szenarien entwickeln"", beteuert der Präsident des Internationalen Olympischen Komitees. Am Sonntag wird Bach nach Tokio reisen, auch ein Treffen mit dem neuem Regierungschef Yoshihide Suga ist Medien zufolge geplant. ""Dieser Besuch kommt zu einer wichtigen Zeit"", sagte Bach und konterte umgehend die Gerüchte aus  , bei diesem Anlass solle die endgültige Absage der Spiele verkündet werden. ""Die Antwort ist nein"", versicherte der 66-Jährige auf die Frage, ob dieses Szenario bei seiner Stippvisite diskutiert werde. Vielmehr soll der viertägige Trip wohl die hartnäckigen Zweifel der Japaner und vieler anderer am Olympia-Spektakel zerstreuen. Nach dem Besuch werde man ""Athleten und Teilnehmern der Spiele noch mehr Zuversicht über das sichere Umfeld für die Spiele in neun Monaten geben können"", sagte Bach. Auch Ministerpräsident Suga hatte kurz nach seinem Amtsantritt ein Bekenntnis zu den Tokio-Spielen abgelegt. Die Organisatoren setzen wie bei der jüngsten Eröffnung des Tokyo Aquatics Center für die olympischen Schwimmwettbewerbe ebenfalls auf Symbolpolitik. Auftrieb verspürten die Olympia-Macher am vergangenen Wochenende durch einen Turn-Wettkampf, für den erstmals seit Monaten wieder internationale Top-Athleten nach Japan einreisten. ""Das ist eine sehr wichtige Sache für die ganze Sportwelt"", rief Bach den 30 Sportlern aus Russland, China, den USA und Japan via Video-Botschaft zu. Alle ausländischen Teilnehmer hatten sich jedoch vorher in ihrer Heimat zwei Wochen in Quarantäne begeben müssen. Nach Ankunft wurden sie im Hotel nach Nationen strikt auf verschiedenen Etagen getrennt, durften nur zwischen Unterkunft und dem Yoyogi National Gymnasium pendeln. In der Halle wurden Wettkampfgeräte zwischen den Übungen häufig gereinigt und desinfiziert, die 2000 Zuschauer mussten Masken tragen und Abstand einhalten. Ein Vorgeschmack auf die olympischen Wettbewerbe? Seit Wochen ringt eine Taskforce der Organisatoren um das Regelwerk für Spiele unter Corona-Bedingungen. Dabei geht es nicht allein um die 11.000 Sportler, sondern auch tausende Funktionäre, Helfer, Medienvertreter und nicht zuletzt um die Frage der Zuschauer. Derzeit gelten in Japan Einreiseverbote für einen Großteil der Welt. Zumindest für alle direkt Beteiligten dürfte dieser Bann aufgehoben werden. Teams und Athleten könnten in viele einzelne Blasen aufgeteilt werden. Im Umfeld des olympischen Dorfes soll eine ambulante Versorgungseinrichtung für Corona-Fälle gebaut werden, in der Mensa wird es womöglich nur abgepackte Mahlzeiten für die Sportler geben. Ständige Tests und die Nutzung einer Corona-Warn-App könnten Pflicht sein. Viele Details aber sind noch unklar. Für Dezember wird ein Zwischenbericht der Taskforce erwartet. ""Das ist im Moment unmöglich zu sagen, was da im Einzelnen herauskommt"", sagt IOC-Chef Bach. Auf Basis der Notfallpläne soll es von März an Test-Wettkämpfe geben. Internationale Zuschauer aber könnten in Tokio auch im Sommer untersagt bleiben, wie auch Alfons Hörmann als Präsident des Deutschen Olympischen Sportbundes einräumte. Mit Erleichterung reagierten die Verantwortlichen in Tokio auf die jüngsten Nachrichten über erfolgreiche Impfstoff-Tests. Die Zeit aber läuft den Planern davon. Schon vorher hatte Bach gewarnt, für   in Tokio werde ein Impfstoff kein ""Allheilmittel"" sein. © dpa-infocom, dpa:201111-99-299873/2 Japan Olympia","sueddeutsche, DPA"
Luftverkehr. Fracht brummt in Frankfurt - Vorbereitungen für Impfstoff,no_author,2020-11-12 12:18:58,https://www.sueddeutsche.de/wirtschaft/luftverkehr-fracht-brummt-in-frankfurt-vorbereitungen-fuer-impfstoff-dpa.urn-newsml-dpa-com-20090101-201112-99-304373,"Frankfurt/Main (dpa) - Am Frankfurter Flughafen laufen die Vorbereitungen zur Verteilung des Corona-Impfstoffes auf vollen Touren. In den ""Cargo-Cities"" im Norden und Süden des Geländes sind alle Mitarbeiter an Bord, denn auch ohne den Corona-Impfstoff brummt am größten deutschen Flughafen die Fracht. Im Oktober lag die beförderte Menge erstmals seit 15 Monaten mit gut 178.000 Tonnen wieder über dem Wert aus dem entsprechenden Vorjahresmonat, wie der Betreiber   am Donnerstag berichtete. Die Wirtschaftskrise scheint in diesem Teilbereich überwunden. Eine weitere kleine Sonderkonjunktur erwarten sich Fraport wie auch Lufthansa Cargo als größte Airline am Platz durch die kurz vor der Zulassung stehenden Corona-Impfstoffe. ""Wir bereiten uns auf Im- und Export gleichermaßen vor"", sagt Fraport-Manager Max Philipp Conrady. ""Wir wissen ja noch nicht, was kommt und was wo produziert wird."" Von der Menge her sei der Corona-Impfstoff keine übergroße Herausforderung, benötige aber wie alle temperatursensible Fracht besonders hohen Aufwand und Sorgfalt. Besonders wichtig ist bei Medikamenten eine ununterbrochene Kühlkette: Grundsätzlich gibt es drei international definierte Temperaturbereiche zwischen +25 und -20 Grad Celsius, sowie den Ultratiefkühlbereich bis zu -70 Grad. Aktuell stehen am Flughafen rund 13 500 Quadratmeter ""temperaturgeführte"" Umschlagkapazitäten zur Verfügung, weitere 500 Quadratmeter seien kurz vor der Inbetriebnahme. Für den Transport über das Vorfeld könnten 20 moderne Thermotransporter eingesetzt werden. Im vergangenen Jahr wurden an dem größten deutschen Frachtflughafen rund 120.000 Tonnen Impfstoffe, Arzneimittel und andere Pharma-Produkte umgeschlagen. Den Löwenanteil hat die Lufthansa Cargo geflogen, die an ihrem Drehkreuz Europas größtes Pharma-Umschlagzentrum installiert hat. Dazu kommen weltweit rund 200 Stationen, die auf den Transport von Medikamenten vorbereitet und zertifiziert sind, weil Lufthansa sich frühzeitig auf den lukrativen Pharma-Teilmarkt spezialisiert hat, der rund 10 Prozent zum Umsatz beiträgt. Im vergangenen Jahr kamen fast 100 000 Tonnen Fracht zusammen. Die Lufthansa-Frachtsparte hat nach Angaben einer Sprecherin zur anstehenden Verteilung der Corona-Impfstoffe eine Task Force errichtet, die sich mit Spediteuren, Pharmaherstellern, weiteren Partnern und den Behörden abstimmt. ""Mit unserer Frachterflotte können wir bei Nachfrageverschiebungen grundsätzlich flexibel nachsteuern und gegebenenfalls mit Passagiermaschinen nochmals Kapazität ergänzen"", sagt sie. Der Impfstoff der Mainzer Biontech beispielsweise muss dauerhaft bei einer Temperatur von minus 80 Grad gelagert werden. ""Very deep frozen"" nennen das die Logistiker. Und das bedeutet Lagerung im flüssigen Stickstoff - ein Gefahrgut, das nur abseits der Passagierströme in reinen Frachtmaschinen geflogen werden darf. Dass Frankfurt eine zentrale Rolle bei der Verteilung des Impfstoffes spielen wird, steht für Fraport-Mann Conrady außer Frage. Die zentrale Lage, die einschlägige Infrastruktur auch für größere Mengen einschließlich Sicherheitsreserven und schließlich die Expertise der beteiligten Partner - am Frankfurter Flughafen führe in Sachen Impfstoff kein Weg vorbei. ""Der Oktober ist sehr gut gelaufen, und der November lässt sich mindestens genauso gut an"", sagt Fraport-Manager Conrady zur allgemeinen Entwicklung. Dass die Vorjahresmengen übertroffen wurden, obwohl zahlreiche Zuladungsmöglichkeiten in Passagierflugzeugen entfallen sind, zeige den Wandel am größten deutschen Drehkreuz. Reine Frachtflüge haben um mehr als 50 Prozent im Vergleich zum Vorjahreszeitraum zugelegt. Nach dem Platzhirsch Lufthansa Cargo und der russischen AirBridgeCargo sind aktuell China Southern und Air China die größten Kunden. Wie bereits im Frühjahr sind auch die ""Prachter"" zurück, provisorisch zu Frachtern umfunktionierte Passagierflugzeuge. Kurzarbeit sei in der Fracht ein Fremdwort - egal ob beim Flughafenbetreiber, den Fluggesellschaften, den Speditionen oder Abwicklern, sagt Conrady. ""Wir haben alle Hände an Deck."" Der Flughafen fährt frachtseitig unter Volllast, vor allem an den Wochenenden passt kaum noch was rein. Zeitlich manchmal flexiblere Charterflüge werden in der Folge gezielt auf andere Tage oder Tageszeiten gelegt. © dpa-infocom, dpa:201112-99-304373/6 Fraport","sueddeutsche, DPA"
Auto - Wolfsburg. VW-Konzern verkauft im Oktober wieder weniger,no_author,2020-11-13 11:21:03,https://www.sueddeutsche.de/wirtschaft/auto-wolfsburg-vw-konzern-verkauft-im-oktober-wieder-weniger-dpa.urn-newsml-dpa-com-20090101-201112-99-312917," (dpa) - Nach der leichten Stabilisierung im September verbucht der Volkswagen-Konzern wieder sinkende Verkaufszahlen. Die Auslieferungen des weltgrößten Autoherstellers nahmen im Oktober um 4,9 Prozent ab im Vergleich zum Vorjahresmonat. Wie VW am Freitag mitteilte, konnten insgesamt 903 200 Fahrzeuge an die Kunden gebracht werden. Zuvor hatte sich das von der Corona-Krise belastete Geschäft im September zunächst etwas gefangen, als die VW-Gruppe zwischenzeitlich 3,3 Prozent mehr Autos absetzte. Auch der besonders wichtige Markt China schwächelt erneut, hier wurde der Konzern im Oktober 3,3 Prozent weniger Fahrzeuge los. In Nordamerika lag das Minus bei 9,8, in der Heimatregion Westeuropa bei 6,4 Prozent. Der Asien-Pazifik-Raum ohne China und Hongkong entwickelte sich dagegen mit plus 3,3 Prozent solider. Seit dem Jahresbeginn liegen die Konzernverkäufe 17,3 Prozent unter dem Niveau des Vorjahres, in den westeuropäischen Märkten mehr als ein Viertel. Unter den einzelnen Marken konnte Audi seinen Aufwärtstrend fortsetzen, die Ingolstädter lieferten 9,8 Prozent mehr Wagen aus als im Oktober 2019. Auf Jahressicht sah es aber auch hier eher düster aus (minus 10,3 Prozent). Außer den Luxusablegern Bentley, Bugatti und Lamborghini rutschten alle anderen Marken im abgelaufenen Monat ab - so etwa die Kernmarke Volkswagen Pkw um 7,4, Porsche um 8,8 und Seat um 11,4 Prozent. Die leichten Nutzfahrzeuge lieferten über ein Zehntel weniger Exemplare aus als vor einem Jahr. Wolfsburg","sueddeutsche, DPA"
Tischtennis. Tischtennis-World-Cup: Patrick Franziska holt Gruppensieg,no_author,2020-11-13 15:53:39,https://www.sueddeutsche.de/sport/tischtennis-tischtennis-world-cup-patrick-franziska-holt-gruppensieg-dpa.urn-newsml-dpa-com-20090101-201113-99-319576,"Weihai (dpa) - Der deutsche Nationalspieler Patrick Franziska hat sich als Sieger seiner Vorrunden-Gruppe souverän für das Achtelfinale des Tischtennis-World-Cups qualifiziert. Im chinesischen Weihai gewann der Weltranglisten-16. gegen Darko Jorgic aus Slowenien in 4:0 Sätzen und gegen Quadri Aruna aus Nigeria in 4:1 Sätzen. Der 28 Jahre alte Franziska und der 22 Jahre alte Jorgic spielen in der Bundesliga gemeinsam für den 1. FC Saarbrücken. Im Achtelfinale trifft Franziska nun am Samstagmittag (Ortszeit) auf das 19-jährige Supertalent Lin Yun-Ju aus Taiwan. Der zweite deutsche Teilnehmer Dimitrij Ovtcharov spielt gegen den Engländer Liam Pitchford. Der frühere Weltranglisten-Erste gehört zu den acht topgesetzten Spielern, die die Gruppenphase überspringen durften. ""Wenn Dimitrij Ovtcharov seine Form aus dem Training an den Tisch bringt, dann bin ich mir sicher, dass es für ihn gegen Pitchford weiter geht"", sagte Bundestrainer Jörg Roßkopf. ""Patrick Franziska hat mit Lin Yun-Ju, der auf dem besten Weg ganz nach oben ist, den wohl schwersten Gegner, den man im Achtelfinale bekommen kann."" An dem World Cup nehmen die bestplatzierten Spieler der europäischen, asiatischen, afrikanischen und amerikanischen Ranglisten-Turniere teil. Im   hat dieser Wettbewerb aus seiner langen Tradition heraus eine große Bedeutung. Wegen der Corona-Pandemie werden die Spieler in diesem Jahr in der Halle und dem angrenzenden Hotel komplett von der Außenwelt abgeschottet. © dpa-infocom, dpa:201113-99-319576/3 Tischtennis","sueddeutsche, DPA"
Auto - Wolfsburg. Milliardeninvestitionen für deutsche VW-Werke,no_author,2020-11-13 14:46:07,https://www.sueddeutsche.de/wirtschaft/auto-wolfsburg-milliardeninvestitionen-fuer-deutsche-vw-werke-dpa.urn-newsml-dpa-com-20090101-201113-99-322578," (dpa) - Volkswagen steckt in den kommenden fünf Jahren rund 20 Milliarden Euro in seine deutschen Werke und siedelt die Produktion mehrerer neuer Modelle im Heimatland an. Dies geht aus der Investitionsplanung hervor, die der Aufsichtsrat am Freitag beschloss. Nach Angaben des Betriebsrats fließen allein in das Stammwerk Wolfsburg Sachinvestitionen von mehr als drei Milliarden Euro. Hier sollen unter anderem ein Nachfolger für den kleinen SUV Tiguan sowie ein neuer Groß-SUV ähnlich dem in China hergestellten Modell Tayron angesiedelt werden. Volkswagen zieht auch sämtliche Varianten des Kernmodells Golf in der Konzernzentrale zusammen. Auf die leichten Nutzfahrzeuge entfallen insgesamt knapp 4,5 Milliarden Euro. Dabei geht es aber nicht nur um den Hauptsitz Hannover, sondern auch um die polnischen Standorte oder den Ausbau der Kooperation mit Ford. Viel Geld fließt in die Vorbereitung für den Elektro-Bus ID.Buzz. Zur Fertigung eines neuen, markenübergreifenden Elektro-Oberklassewagens (D-SUV) in drei verschiedenen Varianten werden am Standort Hannover rund 680 Millionen Euro reserviert. Das Werk  , das den Passat demnächst an Bratislava in der Slowakei abgeben muss, erhält etwa eine Milliarde Euro. Dort sind ab Anfang 2022 - ergänzend zu Zwickau - der kleine Elektro-SUV ID.4 und ab 2023 der Aero als Elektronachfolger des Passat geplant. Für die sächsischen Standorte in Zwickau, Dresden und Chemnitz sind 1,2 Milliarden Euro vorgesehen, vor allem zur Ausweitung der Kapazitäten für E-Modelle sowie den einheitlichen Elektrobaukasten (MEB). Auch die internen Zulieferwerke bekommen viel Geld für neue Investitionen. So wurden dem Getriebewerk in Kassel 1,3 Milliarden Euro zugeteilt, hier geht es ebenfalls vor allem um Komponenten für die E-Mobilität sowie Hybridantriebe. In Braunschweig, wo etwa Batteriesysteme, Achsen und Lenkungen produziert werden, sollen mehr als 870 Millionen Euro ausgegeben werden. Das Motorenwerk Salzgitter, auf dessen Areal derzeit auch eine eigene Batteriezellfabrik entsteht, erhält rund 800 Millionen Euro - in Batterietechnologien fließen dort nach Unternehmensangaben rund eine Milliarde Euro. Neben den Sachinvestitionen gibt es vielerorts neue Mittel für Entwicklung und Verwaltung. Die Gesamtsumme für den Konzern bleibt trotz der Corona-Unsicherheiten über die kommenden fünf Jahre bei 150 Milliarden Euro. An mehreren VW-Standorten in   wird nicht nur für die Kernmarke selbst, sondern auch für Töchter produziert. Wolfsburg Emden Deutschland","sueddeutsche, DPA"
