title,author,date_published,url,article_text,source
Bundespräsident. Steinmeier: Nürnberger Prozesse schufen neue Rechtsordnung,no_author,2020-11-20 19:32:52,https://www.sueddeutsche.de/politik/bundespraesident-steinmeier-nuernberger-prozesse-schufen-neue-rechtsordnung-dpa.urn-newsml-dpa-com-20090101-201120-99-409172,"Nürnberg (dpa) -   Frank-Walter Steinmeier hat die Nürnberger Prozesse gegen führende Nazis als konstitutiv für die heutige internationale Strafgerichtsbarkeit gewürdigt. Ohne diese vor 75 Jahren begonnenen Verfahren gäbe es den Internationalen Strafgerichtshof in Den Haag nicht, sagte er in Nürnberg bei einem Festakt. Zugleich äußerte er laut vorab veröffentlichtem Redemanuskript die Hoffnung, dass die neue US-Regierung von Joe Biden ""zurückkehrt zu einer Zusammenarbeit, die auch den Wert internationaler Strafgerichtsbarkeit anerkennt"". Vom 20. November 1945 an mussten sich führende Nationalsozialisten und damit erstmals in der   Vertreter eines Unrechtsregimes vor Gericht verantworten. Die alliierten Siegermächte stellten 21 ranghohe Kriegsverbrecher wie Adolf Hitlers Stellvertreter Rudolf Heß und Reichsmarschall Hermann Göring vor ein internationales Gericht. Der Prozess endete nach fast einem Jahr mit zwölf Todesurteilen. Heute sei der Internationale Strafgerichtshof eine Institution, sagte Steinmeier. ""Schwerste Verbrechen nicht zu bestrafen, wäre fatal - diese Botschaft von Nürnberg ist nicht folgenlos geblieben, betonte er. ""Ohne Nürnberg wären Kriegsherren aus Serbien, Kroatien oder aus Ruanda wegen Massenmord, Folter und Vergewaltigung nicht bestraft worden, würde auch Völkermord heute nicht als Straftat geahndet."" Ohne Nürnberg gäbe es kein Weltrechtsprinzip und könnten nationale Gerichte nicht gegen Völkerrechtsverbrechen vorgehen. In den vergangenen zwei Jahrzehnten hätten sich die Hoffnungen auf eine weitergehende Verrechtlichung der internationalen Beziehungen nicht erfüllt, sagte Steinmeier. ""Alte und neue Mächte treten in Konkurrenz zueinander. Weltweit verpflichtende Normen werden als Einschränkung der eigenen Macht empfunden. Die internationale Strafgerichtsbarkeit ist immer häufiger Anfechtungen ausgesetzt, auch bei uns in Europa."" Der Bundespräsident erinnerte daran, dass die USA, Russland, China, Indien und einige Dutzend andere Staaten dem Internationalen Strafgerichtshof nicht beigetreten sind. ""Die USA, die maßgeblich zur Einrichtung des Internationalen Militärgerichtshofes in Nürnberg beigetragen hatten, und deren Völkerrechtler damit auch Ideengeber für den Internationalen Strafgerichtshof waren, arbeiteten unter der noch amtierenden Administration aktiv gegen das Haager Gericht"", kritisierte Steinmeier. Zugleich äußerte er die Hoffnung, ""dass der Strafgerichtshof durch sein Wirken das Vertrauen in seine Unparteilichkeit und völkerrechtliche Unbestechlichkeit stärken kann, die er braucht, um die Skeptiker zu überzeugen"". Wegen der Corona-Krise war die Veranstaltung am Freitagabend in Nürnberg nicht öffentlich, sondern wurde im Internet übertragen. Neben dem Bundespräsidenten war auch Bayerns Ministerpräsident Markus Söder (CSU) zu Gast. Der frühere Chefankläger eines der Nachfolgeprozesse, Benjamin Ferencz, sowie die Außenminister der USA, Großbritanniens, Frankreichs und Russlands schickten Videobotschaften. © dpa-infocom, dpa:201120-99-409172/2 Bundespräsident Geschichte","sueddeutsche, DPA"
Außenhandel - Stuttgart. Exporte erholen sich leicht: Minus wird kleiner,no_author,2020-11-20 11:14:27,https://www.sueddeutsche.de/wirtschaft/aussenhandel-stuttgart-exporte-erholen-sich-leicht-minus-wird-kleiner-dpa.urn-newsml-dpa-com-20090101-201120-99-401469," (dpa/lsw) - Nach dem heftigen Einbruch im Frühjahr haben sich die Exporte der Südwest-Wirtschaft zuletzt wieder etwas erholt. Im dritten Quartal blieben die Ausfuhren mit gut 48 Milliarden Euro zwar immer noch mehr als acht Prozent unter dem Vorjahreswert, wie das Statistische Landesamt am Freitag mitteilte. Im zweiten Quartal war das Minus aber knapp dreimal so groß gewesen. Von Januar bis Ende September insgesamt liegen die Exporte aus dem Südwesten ins Ausland nun mit 138,6 Milliarden Euro noch um gut zehn Prozent unter dem Niveau des Vorjahres. Importiert wurden im gleichen Zeitraum Waren im Wert von 129,7 Milliarden Euro - ein Minus von 6,7 Prozent. Den Zahlen zufolge hat das Geschäft mit dem nach wie vor wichtigsten Handelspartner USA deutlich stärker gelitten als mit dem zweitplatzierten China. Während die Ausfuhren in die USA nach drei Quartalen um 13 Prozent unter Vorjahresniveau liegen, beträgt das Minus beim China-Export nur 1,1 Prozent. Zweistellige Rückgänge verzeichnete Baden-Württembergs Wirtschaft auch im Handel mit Frankreich (-14,2 Prozent), dem Vereinigten Königreich (-20,0) und Italien (-18,2). Stuttgart","sueddeutsche, DPA"
"Parteien. ""Wir können Wunder bewirken"": Grüne versprühen Optimismus",no_author,2020-11-20 20:42:07,https://www.sueddeutsche.de/politik/parteien-wir-koennen-wunder-bewirken-gruene-verspruehen-optimismus-dpa.urn-newsml-dpa-com-20090101-201120-99-398122,"Berlin (dpa) - Das Land hat einen düsteren Corona-Winter vor Augen, doch   setzt auf Hoffnung. ""In diesem schlimmen Jahr zeigt sich, auf welch rauer See wir leben, was alles passieren kann"", führt die Grünen-Chefin aus, als sie am Freitagabend den Parteitag der Grünen eröffnete. ""Doch was das Virus kann, das können wir schon lange!"" Schnell finde die Menschheit einen Impfstoff. ""Wir können Wunder bewirken."" Damit ist der Ton gesetzt für eine Rede, die Mut machen soll zum ""sozial-ökologischen"" Umbau einer ganzen Gesellschaft. Dazu braucht die Partei Verbündete. ""Wir müssen ehrlich sein: Wir Grünen können eine sozial-ökologische Marktwirtschaft nicht alleine bauen - nicht mit 20 Prozent, auch nicht mit 30"", erklärt Baerbock, deren Partei auf eine Regierungsbeteiligung nach der Bundestagswahl im kommenden Herbst hofft. ""Dazu braucht man in einer Demokratie Mehrheiten, eine grundsätzliche Akzeptanz und die Bereitschaft der Menschen mitzumachen."" Was auch ein offenes Ohr für jene bedeute, sie könnten bei diesem Umschwung den Kürzeren ziehen. Zum Versprechen des Klimaabkommens von Paris gehöre: ""Dieser Wandel muss für alle funktionieren: Für den Kumpel ebenso wie für die Handwerkerin."" Das zielt auf einen Vorwurf, den die Grünen vom politischen Gegner oft zu hören bekommen - sie hätten vor allem gut gebildete, relativ wohlhabende Städter im Blick. Aber 2021 wollen die Grünen mit der Union um den Sieg in der Bundestagswahl-Konkurrieren, dafür müssen sie sich breit aufstellen. Die Corona-Krise könne zum Augenblick des Aufbruchs werden, sagte Baerbock. ""Wir können uns neu sortieren, uns neu entscheiden - grundsätzlich. Machen wir 2021 zum Beginn einer neuen Epoche."" Das wäre so ein Satz, bei dem die Halle jubelt bei jedem normalen Parteitag. Doch Baerbock liest ihre Rede getragen in die Stille. Vor ihr stehen in der Berliner Veranstaltungshalle Tempodrom nur Kameras. Neben dem Parteivorstand und dem Präsidium sind vor allem technische Mitarbeiter und Journalisten vor Ort. Die 800 Delegierten sitzen zuhause. Wer von ihnen oder den übrigen Parteimitgliedern jubeln will, tut es geräuschlos: Wer einen ""Applaus geben""-Button in Form einer Sonnenblume drückt, kann vom heimischen Schreibtisch, Sofa oder aus der Küche kleine Sonnenblumen oder Herzchen auf den Bildschirm des Livestreams schicken. Abstimmen, im Chatroom plaudern, auch das geht. Optimismus allein hält die Erderwärmung aber nicht auf, und so drängt Baerbock zum Handeln. Für einen Schwenk hin zur Klimaneutralität, also einer Lebensweise, bei der nicht mehr klimaschädliches CO2 entsteht als wieder abgebaut wird, blieben weniger als 30 Jahre. ""Kritisch ist nicht 2040 oder 2050. Kritisch sind die 20er - die kommenden 10 Jahre. Jetzt beginnt das entscheidende Jahrzehnt. Wir müssen jetzt ins Machen kommen."" Abwegig sei das alles aber nicht, so Baerbocks Botschaft nach außen: ""Fürchtet euch nicht, diese Klima-Revolution ist in etwa so verrückt wie ein Bausparvertrag. Das Wirtschaftssystem neu aufzustellen bedeutet keinen Klima-Umsturz, sondern ist purer Selbstschutz."" Die eigenen Reihen warnte Baerbock vor übergroßem Klimaschutz-Ehrgeiz. ""Am Pariser Vertrag zu rütteln - und sei es noch so gut gemeint, verhindert doch gerade, dass wir ihn gemeinsam endlich mit Leben füllen"", mahnte sie. Das zielt auf eine Abstimmung, die für den kommenden Tag auf dem Programm stand - es gab einige Änderungsanträge der Basis, die ihre Partei in Richtung einer radikaleren Klimaschutz-Politik drängen wollen. Teile der Klimaschutzbewegung sind der Meinung, die Grünen müssten beim Klimaschutz ehrgeiziger werden. Dazu kommt Konkurrenz bei Landtagswahlen durch eine neue Klimaliste. Das Pariser Klimaabkommen sieht eine Begrenzung des Klimawandels auf ""deutlich unter zwei Grad"" und möglichst 1,5 Grad vor und schreibt den einzelnen Staaten keine Treibhausgas-Budgets vor. Die Parteispitze hält an diesem Ziel fest, weil sie es als Messlatte für realistische Politik betrachtet. ""Die politische Aufgabe ist, die faktische Notwendigkeit von möglichst 1,5 Grad in parlamentarische Mehrheiten zu übersetzen"", sagt Baerbock. Union und SPD warf sie vor, nach dem Motto zu handeln ""im Prinzip dafür, im Konkreten dagegen"" habe wertvolle Zeit gekostet. Neben ""ökologisch"" stellen die Grünen das Wort ""sozial"" und schlagen so den Bogen etwa zum Gesundheitssystem. ""Wir müssen Vorsorge betreiben, statt alles zu kapitalisieren"", verlangt Baerbock. Auch um die Wirtschaft wirbt sie: ""Der Mittelstand und der Maschinenbau sind die weltweit führenden Treiber von Umwelttechnologie. Wir wollen, dass das so bleibt."" Dafür müssten in Europa etwa Förderinstrumente für klimaneutralen Stahl sorgen. Investitionen in Schulen müssten massiv steigen, forderte Baerbock - wie wichtig diese seien, habe die Pandemie gezeigt. ""Mit unserem Grundsatzprogramm wollen wir Bildungsausgaben im Primarbereich verdoppeln."" Beim Blick über die Grenzen würdigte Baerbock die Freiheitsbewegung in Belarus. ""Sie sind es, die uns daran erinnern, was wir in Europa an unserer Freiheit und an unseren Rechten haben. Belarus, wir stehen an eurer Seite."" Europa müsse unabhängiger werden bei Gesundheit, Klimapolitik, Handel, Sicherheit und Digitalisierung. Obwohl die Wahl von Joe Biden zum neuen US-Präsidenten und seiner Vizepräsidentin Kamala Harris ein Hoffnungsschimmer sei, gelte: ""Europa muss sich als eigenständige Playerin in der Welt behaupten.""   und Europa seien außenpolitisch zu wenig engagiert in der Welt während China die Lücke fülle. Es geht noch nichts ums Programm für die Bundestagswahl 2021, aber Baerbock und Mit-Parteichef   lenken die Grünen schon lange auf einen Kurs, für den sie zuletzt das Wort ""Führungsanspruch"" geprägt haben. Etwas deutlicher sagt es Bundesgeschäftsführer Michael Kellner gleich nach Baerbocks Rede: Es gehe darum, die Union aus dem Kanzleramt hinaus zu befördern. ""Das ist der Weg, auf geht’s."" © dpa-infocom, dpa:201120-99-398122/4 Annalena Baerbock Deutschland Robert Habeck","sueddeutsche, DPA"
APEC. Asien-Pazifik-Gipfel: Trump trifft erstmals wieder Xi,no_author,2020-11-20 16:13:45,https://www.sueddeutsche.de/wirtschaft/apec-asien-pazifik-gipfel-trump-trifft-erstmals-wieder-xi-dpa.urn-newsml-dpa-com-20090101-201120-99-397841,"Kuala Lumpur (dpa) - Der Kontrast war auffällig: Während Chinas Präsident Xi Jinping auf dem Asien-Pazifik-Gipfel über den Kampf gegen die Pandemie sprach, spuckte das Twitter-Konto von US-Präsident   eine Mitteilung nach der anderen über angeblichen Betrug bei seiner Wahlniederlage aus. Schon zum Auftakt der Videokonferenz der 21 Staats- und Regierungschefs der Asiatisch-Pazifischen Wirtschaftsgemeinschaft (Apec) wirkte der vom Weißen Haus zugeschaltete Trump auffällig abgelenkt, fast desinteressiert. Es war nicht der große Auftritt, den sich der abgewählte, amtierende US-Präsident auf dem wichtigsten Gipfel der Pazifik-Anrainer am Freitag vielleicht gewünscht hätte. Gastgeber Malaysia unterbrach die Live-TV-Übertragung nach dem Auftakt - noch bevor Trump seine Rede hielt. Das Treffen der Apec-Wirtschaftsgemeinschaft war aber der erste, wenn auch virtuelle Kontakt mit seinem Rivalen, Chinas Staats- und Parteichef  , seit acht Monaten. Zuletzt hatten Trump und Xi Jinping am 27. März am Telefon miteinander gesprochen - bevor die Corona-Pandemie so richtig losging. Danach war Trump noch voll des Lobes für Xi Jinping gewesen: ""Großen Respekt!"" ""  hat viel durchgemacht und ein gutes Verständnis von dem Virus entwickelt. Wir arbeiten eng zusammen"", schrieb Trump damals auf Twitter über das ""sehr gute Gespräch"". Seither herrschte aber Funkstille. Es gibt schwere Spannungen über den Handelskrieg, den harten Kurs Pekings in Hongkong, die Verfolgung der Uiguren und amerikanische Sanktionen. Es ist von einem ""neuen Kalten Krieg"" die Rede. Trump versucht, den wirtschaftlichen und technologischen Aufstieg Chinas und seinen Einfluss einzugrenzen. Er verfolgt eine ""Entkoppelung"" der US-Wirtschaft. Das Verhältnis zwischen den beiden größten Volkswirtschaften ist auf den tiefsten Stand seit Aufnahme der diplomatischen Beziehungen 1979 gefallen. Heute lässt Trump keine Gelegenheit aus, China die Schuld für die ""Pest"", das ""China-Virus"", zuzuschieben - auch um von seinen eigenen Versäumnissen abzulenken, wie Kritiker sagen. Er wirft China vor, nicht schnell genug und unzureichend gegen den massiven Ausbruch vor gut einem Jahr in der zentralchinesischen Metropole Wuhan vorgegangen zu sein. ""Wir müssen die Nation zur Rechenschaft ziehen, die diese Seuche auf die Welt losgelassen hat - China"", sagte Trump im September vor der UN-Vollversammlung. Dagegen trat Xi Jinping sehr selbstbewusst auf, wohlwissend, dass Trump bald weg ist. Das bevölkerungsreichste Land hat das Virus seit dem Sommer weitgehend unter Kontrolle und zählt heute kaum noch Infektionen. Chinas Behörden bedienen sich strenger Maßnahmen, Quarantäne, Kontaktverfolgung und Einreisebeschränkungen. ""Wir haben einen großen strategischen Erfolg im Kampf gegen das Virus erzielt"", sagte Xi Jinping am Vortag per Videoschalte vor Wirtschaftsführern. Auch sei es China gelungen, die Produktion wieder in Gang zu bringen und somit in den ersten drei Quartalen wieder Wachstum zu erzielen, hob Xi Jinping hervor. Während die Welt in einer tiefen Rezession steckt, wird China als einzige große Volkswirtschaft in diesem Jahr wachsen - voraussichtlich um zwei Prozent. ""Diese schwer gewonnenen Errungenschaften sprechen Bände über die Widerstandsfähigkeit und die Vitalität der chinesischen Wirtschaft"", meinte Xi Jinping. An dem Video-Gipfel nehmen auch Russlands Präsident Wladimir Putin und der neue japanische Ministerpräsident Yoshihide Suga teil. Vor zwei Jahren hatte Trump nur Vizepräsident Mike Pence geschickt, was als Zeichen mangelnden Interesses an der Region gewertet worden war. 2019 musste Chile das Treffen wegen Unruhen im Land absagen. Die 1989 gebildete Apec-Gemeinschaft repräsentiert mehr als die Hälfte der globalen Wirtschaftsleistung und 39 Prozent der Weltbevölkerung. Der Gipfel folgt weniger als eine Woche auf den Abschluss des weltgrößten Freihandelsabkommens zwischen China und 14 anderen asiatisch-pazifischen Volkswirtschaften. Die ""regionale, umfassende Wirtschaftspartnerschaft"" (RCEP) umfasst 2,2 Milliarden Menschen und ein Drittel der weltweiten Wirtschaftsleistung. Neben China und den zehn Staaten der südostasiatischen Gemeinschaft Asean beteiligen sich auch US-Bündnispartner wie Japan, Australien und Südkorea. Der Freihandelspakt wurde als Erfolg Chinas gewertet, das damit seinen Einfluss in der Region weiter ausbauen konnte. Am Samstag begegnen sich Trump und Xi Jinping schon wieder - auf dem ebenfalls virtuellen Gipfel der Gruppe großer Industrienationen (G20) unter Vorsitz von Saudi-Arabien. Es ist das erste Treffen der Staats- und Regierungschefs seit Beginn der Pandemie. Auch Kanzlerin Angela Merkel (CDU) wird an den zweitägigen Beratungen teilnehmen. © dpa-infocom, dpa:201120-99-397841/5 Donald Trump Xi Jinping China","sueddeutsche, DPA"
Skeleton. Skeleton: Keisinger und Gassner Zweite - Hermann nur Siebte,no_author,2020-11-20 20:34:58,https://www.sueddeutsche.de/sport/skeleton-skeleton-keisinger-und-gassner-zweite-hermann-nur-siebte-dpa.urn-newsml-dpa-com-20090101-201120-99-402131,"Sigulda (dpa) - Felix Keisinger aus Königssee und der Winterberger Alexander Gassner sind beim Skeleton-Weltcupauftakt gemeinsam auf Rang zwei gefahren. Die deutschen Skeleton-Pilotinnen hingegen haben einen Fehlstart in die Weltcup-Saison hingelegt. Nach zwei Läufen hatte das Duo 0,79 Sekunden Rückstand auf den sechsfachen Weltmeister Martins Dukurs, der auf seiner Heimbahn im lettischen Sigulda nicht zu schlagen war. Weltmeister Christopher Grotheer musste sich mit Rang elf zufrieden geben. Der zweimalige Junioren-Weltmeister Keisinger überzeugte auf der Bahn, wo er vor zwei Jahren sein Weltcup-Debüt feierte, mit zwei Startbestzeiten. Gassner hingegen startete als Achter im ersten Durchgang eine furiose Aufholjagd. Dreifach-Weltmeisterin Tina Hermann vom WSV Königssee kam im lettischen Sigulda nur auf Rang sieben. Auf die siegreiche Janine Flock hatte sie nach zwei Läufen 1,69 Sekunden Rückstand. Die Österreicherin stellte in 51,49 Sekunden im ersten Durchgang einen Bahnrekord auf. Auf Rang zwei kam Kimberley Bos aus den Niederlanden vor der Lettin Endija Terauda. Die Olympia-Zweite Jacqueline Lölling von der RSG Hochsauerland landete auf Rang acht. Weltcup-Debütantin Hannah Neise vom BRC Winterberg kam auf Rang 13. Ins Risikogebiet   durften nur Sportler mit negativen Corona-Tests, der Zutritt zum Bahngelände in Sigulda erfolgte ebenfalls nur mit bestandenem Test. Zuschauer sind bei den Veranstaltungen des Weltverbandes IBSF nicht zugelassen. Nicht teilgenommen haben Sportler aus den USA, Kanada, China, Neuseeland, Australien und Südkorea. © dpa-infocom, dpa:201120-99-402131/4 Lettland","sueddeutsche, DPA"
Wahlen. Trumps Anwälte verstricken sich in Verschwörungstheorien,no_author,2020-11-20 15:26:23,https://www.sueddeutsche.de/politik/wahlen-trumps-anwaelte-verstricken-sich-in-verschwoerungstheorien-dpa.urn-newsml-dpa-com-20090101-201120-99-397596,"Washington (dpa) - Die Anwälte von   tauchen in ihren Attacken gegen den Ausgang der verlorenen Präsidentenwahl immer tiefer in Verschwörungstheorien ab. Sie behaupten unter anderem, die Demokraten hätten die Wahl mit Hilfe von Kommunisten aus Venezuela manipuliert - weiterhin ohne Beweise. Anwältin Sidney Powell machte in einem TV-Interview keinen Hehl daraus, was Trump erreichen will: Mehrere Bundesstaaten sollen die Ergebnisse der Abstimmung schlicht nicht anerkennen und stattdessen Wahlleute ernennen, die für ihn statt für Wahlsieger Joe Biden stimmen. US-Rechtsexperten geben solchen Plänen keine Erfolgsaussichten. Den Trump-Anwälten läuft die Zeit davon: In mehreren Bundesstaaten nähern sich die Termine zur amtlichen Bestätigung der Wahlergebnisse. So steht das am Montag in Pennsylvania und Michigan an. Unterdessen verlor die Trump-Seite allein am Donnerstag vor Gerichten in den Bundesstaaten Georgia, Pennsylvania und Arizona. Bisher sammelten die Anwaälte mehr als 30 Schlappen vor Gericht ein, mit nur einem kleinen Erfolg. Trumps langjähriger Anwalt und Vertrauter Rudy Giuliani, stellt dennoch weitere Klagen in Aussicht. Biden nannte Trumps Blockadehaltung ""völlig unverantwortlich"". Seine Weigerung, das Ergebnis der Wahl vom 3. November anzuerkennen, schade dem Ansehen der Demokratie. Mit Blick auf Trumps Bemühungen, das Wahlergebnis zu untergraben, sagte Biden, dieser komme als der ""unverantwortlichste Präsident"" Amerikas in die Geschichtsbücher. Trumps Anwaltsteam erklärte bei einer Pressekonferenz am Donnerstag zugleich, man könne Journalisten angesichts anstehender Verfahren keine Beweise für die Behauptungen präsentieren. Außerdem wollten wichtige Zeugen nicht vor die breite Öffentlichkeit treten. Das hinderte Giuliani nicht daran, zu sagen: ""Wir können nicht zulassen, dass diese Gauner die Wahl von den Amerikanern stehlen. Sie haben Donald Trump gewählt. Sie haben nicht Joe Biden gewählt."" Alle Wahlbehörden bestätigten bisher, dass es keine Wahlfälschung gab - oder größere Fehler, die das Wahlergebnis in Frage stellen könnten. Giuliani behauptete dennoch, er könne beweisen, dass Trump den wichtigen Bundesstaat Pennsylvania in Wirklichkeit nicht verloren, sondern mit einem Vorsprung von 300.000 Stimmen gewonnen habe, und Michigan mit 50.000 Stimmen. Unter anderem seien Stimmzettel mehrfach eingescannt worden. Giulianis Erklärung: ""Ich denke, es ist eine logische Schlussfolgerung, dass es einen gemeinsamen Plan gab, der direkt von der Demokratischen Parten und ihrem Kandidaten ausging."" Auch dazu gab es keine Beweise. Giuliani war einst selbst Staatsanwalt und später Bürgermeister von New York. Anwältin Powell ging noch weiter: ""Womit wir es hier wirklich zu tun haben, ist ein massiver Einfluss kommunistischen Geldes über Venezuela, Kuba und vermutlich China für die Einmischung in unsere Wahl."" Sie behauptete auch, der 2013 verstorbene venezolanische Präsident Hugo Chavez habe Hintertüren in die Software einbauen lassen, die bei der Auszählung der Stimmen verwendet wurde. Angeblich sei es dadurch möglich gewesen, dass eine für Biden abgegebene Stimme 1,25 Stimmen wert gewesen sei. Die Software wurde nur beim Einscannen von Stimmzetteln verwendet. Die Wahlbehörden betonen, dass es für jede abgegebene Stimme einen Papierbeleg gebe. Der von Trump jüngst gefeuerte Christopher Krebs, der als ranghoher Regierungsbeamter für die Absicherung der Wahlen zuständig war, bezeichnete die Pressekonferenz bei Twitter als ""die gefährlichsten 1:45 Stunden TV in der Geschichte Amerikas"". ""Und vermutlich die verrücktesten"", fügte er hinzu. Zugleich gibt es nur von wenigen prominenten Republikanern offene Kritik an Trump, der bei der Präsidentenwahl rund 72 Millionen Stimmen bekam. Bisher traten vor allem diejenigen hervor, die ohnehin als Kritiker des Präsidenten bekannt sind, etwa die Senatoren Mitt Romney und Ben Sasse. Die Ergebnisse in einzelnen Bundesstaaten sind der Schlüssel zum Sieg bei einer Präsidentenwahl. Das Staatsoberhaupt wird nicht vom Volk direkt gewählt, sondern von Wahlleuten, die ihre Stimmen gemäß den Ergebnissen in ihrem Bundesstaat abgeben. Der Demokrat Biden hat nach Berechnungen von US-Medien 306 Wahlleute hinter sich, für die Wahl zum Präsidenten benötigt er 270. Trump kommt auf 232 Wahlleute. Pennsylvania ist ein besonders wertvoller Bundesstaat mit 20 Wahlleuten, Georgia bringt 16 Stimmen und Wisconsin 10. In Pennsylvania fordert die Trump-Seite in einer schon zum zweiten Mal überarbeiteten Klage, das Wahlergebnis in dem Bundesstaat komplett nicht zu bestätigen. Stattdessen solle das örtliche Parlament - in dem Republikaner die Mehrheit haben - die Wahlleute ernennen. Das Ziel: Diese ernannten Wahlleute sollen am 14. Dezember nicht für den Wahlsieger Biden, sondern für Trump stimmen. In Michigan hat Trump einen ähnlichen Plan. Er lud republikanische Mitglieder des Parlaments des Bundesstaates zu sich ins Weiße Haus ein. Der Rechtsexperte Lawrence Tribe warnte im TV-Sender CNN, dass ein solches Treffen widerrechtlich sein könnte. Abgeschlossen ist inzwischen die manuelle Überprüfung der Stimmen in Georgia. Dort lag Biden vor Beginn der Neuauszählung mit rund 14.000 Stimmen vorn. Nun schrumpfte das Plus auf 12.284 Stimmen. Das war bereits erwartet worden: Schon vor einigen Tagen wurde festgestellt, dass Wahlkommissionen in zwei von Republikanern beherrschten Bezirken vergessen hatten, mehrere tausend ausgezählte Stimmen in die Rechnung aufzunehmen. Der zuständige Staatssekretär Brad Raffensperger betonte, dass keine Anzeichen für Wahlbetrug gefunden worden seien. Trump kann allerdings immer noch eine Neuauszählung beantragen, weil der Abstand zwischen den Kandidaten unter 0,5 Prozentpunkten liegt. © dpa-infocom, dpa:201120-99-397596/5 Donald Trump","sueddeutsche, DPA"
