title,author,date_published,url,article_text,source
Gesundheit. Lieferengpässe für Medikamente möglich,no_author,2020-09-07 11:56:34,https://www.sueddeutsche.de/gesundheit/gesundheit-lieferengpaesse-fuer-medikamente-moeglich-dpa.urn-newsml-dpa-com-20090101-200907-99-459572,"Bonn (dpa) - Verunsicherte Patienten, die in der Apotheke ihr Medikament nicht erhalten. Besorgte Ärzte, die von bestimmten Impfstoffen zu wenig zur Verfügung haben: Die Corona-Pandemie wirkt sich auch auf die Gesundheitsversorgung aus. Sie habe Lieferengpässe für einige - auch wichtige - Arzneimittel und Impfstoffe verschärft, beobachten manche Experten. So sagte Ärztepräsident Klaus Reinhardt, das Problem habe durch die Pandemie mit ihren Handelsbeschränkungen ""extrem zugenommen"". Die Herstellung von Arzneimitteln und Wirkstoffen ist spezialisiert und globalisiert, aus Kostengründen wird immer mehr etwa in China oder Indien produziert - das erweist sich nun als Problem. Sorge um ausreichende Menge bei Grippe-Impfstoff Im Frühjahr sei man in Sorge gewesen, dass zentrale Substanzen wie Propofol für künstliche Beatmung oder das in der Intensivmedizin nötige Adrenalin knapp werden, schilderte Reinhardt von der Bundesärztekammer (BÄK) kürzlich im ""Tagesspiegel"". Und warnte: ""Wenn uns diese Mittel ausgehen, wäre das eine wirklich hochgefährliche Situation."" Auch die Impfung gegen Pneumokokken, die Lungenentzündung verursachen können, sei vorübergehend kaum möglich gewesen. ""Die Lieferengpässe bei Impfstoffen beunruhigen mich sehr."" Die Nachfrage sei in der Pandemie stark gestiegen - und das wird auch für Grippe-Impfungen im Herbst erwartet. Vor allem zu Beginn des Lockdowns war ungewiss, wie sich Lieferengpässe entwickeln würden, berichtet der Bundesverband der Arzneimittel-Hersteller. Inzwischen habe sich die Versorgungslage in Apotheken und Kliniken entspannt. ""Dennoch besteht weiterhin die Möglichkeit, dass es auch in Zukunft zu versorgungsrelevanten Lieferengpässen von Arzneimitteln kommen kann"", sagt BAH-Hauptgeschäftsführer Hubertus Cranz. Abhängigkeit von einzelnen Herstellern Grundsätzlich sind Lieferprobleme wahrscheinlicher, wenn nur wenige Anbieter ein bestimmtes Arzneimittel herstellen und vertreiben. Vom Corona-Lockdown waren kurzfristig auch Hersteller in Norditalien und Spanien betroffen, zudem waren die Importe von Wirkstoffen aus Indien und China eingeschränkt. Planung, Herstellung und Auslieferung brauchen im Schnitt rund sechs Monate, erklärt Cranz. ""Die Produktion von Arzneimitteln kann nicht einfach und quasi auf Zuruf umgestellt werden."" Fällt ein Hersteller aus, ist das nicht fix zu kompensieren. ""Wenn wir für einen wichtigen Wirkstoff nur einen Produzenten haben und der sitzt irgendwo, wo es zum Lockdown kommt, kann das schwerwiegende Folgen auch für die Versorgung hier in   haben"", erläutert Martin Schulz von der ABDA - Bundesvereinigung Deutscher Apothekerverbände. Ein Lieferengpass bedeute aber keineswegs immer, dass man Patienten nicht mehr versorgen könne. ""Zum Problem wird es, wenn etwa bei manchen Krebsindikationen ein bestimmtes Mittel nicht bereitsteht, dann kann sich die Prognose des Patienten durch verzögerte Behandlung verschlechtern"", nennt der Experte ein Beispiel. 317 Lieferengpassmeldungen derzeit Laut Bundesinstitut für Arzneimittel und Medizinprodukte (BfArM) liegen aktuell 317 Lieferengpassmeldungen vor (Stand 30.8.). Sie betreffen 138 Wirkstoffe, 87 von ihnen sind versorgungsrelevant, wie ein Sprecher mitteilt. Schulz zufolge werden immer weniger versorgungskritische Arzneimittel in der EU produziert. So spiele sich die Antibiotika-Herstellung seit einigen Jahren zu gut 90 Prozent in Ostasien ab. In einem neuen Gremium sollen nun auch Wirkstoffe bestimmt werden, bei denen die Industrie auch zu einer erhöhten Lagerhaltung verpflichtet werden kann, berichtet Schulz, der für die ABDA in dem neuen Beirat vertreten ist. Das gelte vor allem für Mittel, für die es kaum Alternativen gebe und die in der Intensiv- und Notfallmedizin gebraucht würden. Es gehe auch darum, zumindest die Hersteller, die noch in Europa sind, möglichst zu halten. Medikamentenvergabe im Ernstfall reglementieren Auch für Impfstoffe birgt die Konzentration auf wenige Produzenten Risiken. Beim Paul-Ehrlich-Institut (PEI) heißt es: ""Bleibt die Anzahl der Impfstoffhersteller weiterhin begrenzt und greifen diese bei einzelnen Impfkomponenten auf wenige Lieferanten zurück, ist zu vermuten, dass weiterhin immer wieder Lieferengpässe auftreten werden."" Die gute Nachricht: Bei den Grippe-Impfstoffen sollen für die Saison 2020/21 größere Mengen bereitstehen als in den Vorjahren - und laut PEI-Prognose wird das auch bei größerem Andrang ausreichen. Um trotz Lieferengpässen ein Problem bei der Versorgung zu verhindern, kann man knappe Mittel kontingentieren - also in begrenzten Mengen abgeben. Wie beim fiebersenkenden Schmerzmittel Paracetamol, wo es vorübergehend - ähnlich wie beim Klopapier - eng wurde, weil sich manche übermäßig eindeckten. In manchen Fällen könnten Ärzte ihre Patienten auch mit einem alternativen Medikament behandeln, sagt Schulz. ""Aber das kann auch mit neuen beziehungsweise anderen Risiken verbunden sein, zu denen der Patient dann vom Arzt oder Apotheker beraten werden muss."" © dpa-infocom, dpa:200907-99-459572/3 Deutschland","sueddeutsche, DPA"
"Film. Boykottaufrufe überschatten Start von ""Mulan""",no_author,2020-09-08 11:38:51,https://www.sueddeutsche.de/kultur/film-boykottaufrufe-ueberschatten-start-von-mulan-dpa.urn-newsml-dpa-com-20090101-200908-99-472808,"Peking (dpa) - Zum Start seines Films über die chinesische Kämpferin Mulan sieht sich Disney mit Boykottaufrufen konfrontiert. Grund für die Empörung ist der Abspann des Films, von dem Screenshots in sozialen Medien geteilt wurden.  Dort ist zu sehen, dass sich die Filmemacher bei Sicherheitsbehörden in der westchinesischen Region Xinjiang bedanken, wo nach Angaben von Menschenrechtlern seit Jahren Hunderttausende Mitglieder der muslimischen Minderheit der Uiguren in Umerziehungslagern festgehalten werden und anderen Repressalien ausgesetzt sind.  Disney machte zunächst keine Angaben dazu, was genau die Kooperation beinhaltete und ob in Xinjiang gedreht wurde. Allein die Danksagung sorgte jedoch für eine Welle wütender Reaktionen.  Es sei ""kapitalistische Ausbeutung von ihrer besten Seite"", wenn ein Blockbuster in Teilen in der Nähe von Dörfern gedreht wird, wo die Polizei mit Masseninternierungen beschäftigt ist, schrieb der China-Forscher und Xinjiang-Experte Adrian Zenz auf Twitter.  ""Es wird immer schlimmer!"", kommentierte der bekannte Hongkonger Demokratie-Aktivist Joshua Wong unter dem Hashtag #BoykottMulan. Disney beteilige sich mit seinem Vorgehen an der Masseneinkerkerung muslimischer Uiguren.  Wie in der Vorlage des Zeichentrickfilms von 1998 erzählt ""Mulan"" die Geschichte einer mutigen, selbstbewussten jungen Frau, die heimlich in Männerkleider schlüpft, um statt ihres gebrechlichen Vaters für den Kaiser zu kämpfen. Der  , der wegen der Corona-Pandemie am vergangenen Freitag nicht im Kino, sondern auf Disneys Streaming-Portal angelaufen war, hatte schon vorher scharfe Kritik auf sich gezogen. So gab es bereits Boykott-Aufrufe, nachdem die Hauptdarstellerin Liu Yifei vor dem Hintergrund der Demokratieproteste in Hongkong Verständnis für die Polizei geäußert hatte.  © dpa-infocom, dpa:200908-99-472808/2 Film","sueddeutsche, DPA"
Unternehmen - München. Staatsregierung will Start-up-Förderung stark ausbauen,no_author,2020-09-07 17:19:13,https://www.sueddeutsche.de/wirtschaft/unternehmen-muenchen-staatsregierung-will-start-up-foerderung-stark-ausbauen-dpa.urn-newsml-dpa-com-20090101-200907-99-466078," (dpa/lby) - Die Staatsregierung will angesichts von Corona-Krise und Technologieabwanderung ins Ausland ihre Zuschüsse für Start-ups stark erhöhen. ""Zum Einen wollen wir einen Start-up-Fonds haben, der am Ende auf bis zu 250 Millionen hoch gerechnet wird"", sagte Ministerpräsident Markus Söder (CSU) am Montag in München. Anstelle von bisher maximal zehn Millionen soll ein Unternehmen künftig bis zu 25 Millionen Euro Zuschuss bekommen können. Neben der Gründung neuer Technologieunternehmen will die Staatsregierung auch die Anschlussfinanzierung für bereits existierende Start-ups verbessern, die Geld für Wachstum brauchen - daran hapert es nach Einschätzung von Fachleuten in   am meisten. Damit soll verhindert werden, dass Technologie ins Ausland abwandert. ""Damit erfolgreiche Start-ups nicht am Ende gekauft oder finanziell so strukturiert werden, dass aus einem bayerischen Start-up ein chinesisches oder amerikanisches wird"", sagte Söder nach einem Treffen mit Start-up-Unternehmern dazu. So überlegt die Staatsregierung, den eigentlich für die Rettung existenzbedrohter Unternehmen gedachten Bayernfonds auch für eine bessere Eigenkapitalausstattung von Start-ups zu nutzen. Ebenfalls in Planung sind Start-up-Zentren und internationale Start-up-Netzwerke. ""Wir wollen die schlausten, die jüngsten und die kreativsten Köpfe bei uns versammeln, und zwar egal, ob sie in   geboren sind, ob sie aus Deutschland oder anderen Teilen der Welt kommen"", sagte Söder dazu. Der Wettbewerb um die besten Köpfe und Ideen werde immer härter, sagte Wirtschaftsminister Hubert Aiwanger (Freie Wähler). Das werde von ""Mitbewerbern"" - gemeint sind unter anderem China und die USA - gezielter und strategischer angegangen als in Deutschland. Gute Geschäftsideen wanderten häufig aus Deutschland ab - ""und wenn die Dinge dann Geld abwerfen, kaufen wir die erfundenen Ideen wieder teuer zurück, weil wir nicht in er Lage sind, diese Wachstumsschritte ordentlich durchzufinanzieren"", sagte Aiwanger. München Deutschland Bayern","sueddeutsche, DPA"
Weltwirtschaft. Chinas Exporte steigen trotz Corona um fast zehn Prozent,no_author,2020-09-07 13:14:59,https://www.sueddeutsche.de/wirtschaft/weltwirtschaft-chinas-exporte-steigen-trotz-corona-um-fast-zehn-prozent-dpa.urn-newsml-dpa-com-20090101-200907-99-457572,"Peking (dpa) - Trotz der anhaltenden Corona-Pandemie haben sich Chinas Exporte im August erneut deutlich erholt. Die Ausfuhren der zweitgrößten Volkswirtschaft legten im Vorjahresvergleich stärker als erwartet um 9,5 Prozent zu, wie die Pekinger Zollverwaltung am Montag mitteilte. Wie schon im Vormonat fielen die chinesischen Importe allerdings erneut geringer aus. Sie gingen um 2,1 Prozent zurück. Unterm Strich verzeichnete der Außenhandel damit ein Plus um 4,2 Prozent auf einen Wert von rund 412 Milliarden US-Dollar. Im Dezember waren die ersten Infektionen mit dem Coronavirus in   entdeckt worden. Die Behörden dämmten die Pandemie mit strikten Maßnahmen ein. Nach offizieller Darstellung gibt es heute kaum noch neue Infektionen, so dass sich das Leben und die Wirtschaftstätigkeit wieder normalisieren. Trotz des spürbaren Aufschwungs in den vergangenen Monaten müssen sich Chinas Exporteure laut Beobachtern weiter auf schwer kalkulierbare Risiken einstellen. Experten nennen die Ungewissheiten durch den Streit zwischen den USA und China im Handel und im Technologiesektor sowie einen möglichen weiteren Rückgang der Weltwirtschaftsleistung. Ausgeschlossen ist auch nicht, dass China im Herbst, wenn das Wetter abkühlt, erneut mit einem Corona-Ausbruch zu kämpfen haben wird. Die Aussichten für die chinesische Wirtschaft bleiben durchwachsen. Dem robusten Außenhandel standen zuletzt enttäuschende Daten zur Industrieproduktion und zur Umsatzentwicklung im Einzelhandel gegenüber, was als Hinweis auf eine nachlassende Konjunkturdynamik gesehen wurde. Im Juli war die Industrieproduktion laut Daten des nationalen Statistikamtes zwar gestiegen. Der Zuwachs habe aber im Jahresvergleich 4,8 Prozent betragen, während Analysten mit einem stärkeren Anstieg um 5,2 Prozent gerechnet hatten. Noch deutlicher fiel der Dämpfer im Einzelhandel aus. Hier meldete die Statistikbehörde für Juli einen Umsatzrückgang von 1,1 Prozent im Jahresvergleich. Analysten hatten hingegen mit einem leichten Zuwachs um 0,1 Prozent gerechnet und damit erstmals in diesem Jahr eine Rückkehr des Einzelhandels in die Wachstumszone erwartet. Wegen der Corona-Pandemie hatte China im ersten Quartal einen historischen Einbruch erlebt. Zum ersten Mal seit Beginn der offiziellen Aufzeichnungen im Jahr 1992 hatte das Land einen Rückgang der Wirtschaftsleistung verzeichnet - um 6,8 Prozent. Bereits im zweiten Quartal meldete das Statistikamt jedoch wieder einen Zuwachs um 3,2 Prozent, was für chinesische Verhältnisse noch immer ein zartes Wachstum ist. Im vergangenen Jahr war die Wirtschaft des bevölkerungsreichsten Landes um 6,1 Prozent gewachsen. Die Entwicklung der Wirtschaft in China hat auch für Deutschland spürbare Folgen. Die Volksrepublik ist ein wichtiger Absatzmarkt für deutsche Firmen. Im vergangenen Jahr lag das Exportvolumen bei 96 Milliarden Euro. Die zweitgrößte Volkswirtschaft der Welt ist seit 2015 auch das Land, aus dem die meisten Importe nach Deutschland kommen. © dpa-infocom, dpa:200907-99-457572/4 China","sueddeutsche, DPA"
Transport - Duisburg. Neue Zugverbindung zwischen China und Duisburg,no_author,2020-09-08 11:58:58,https://www.sueddeutsche.de/wirtschaft/transport-duisburg-neue-zugverbindung-zwischen-china-und-duisburg-dpa.urn-newsml-dpa-com-20090101-200908-99-474377," (dpa/lnw) - Das Netz der Zugverbindungen zwischen China und dem Duisburger Hafen wächst weiter. Das chinesische Logistikunternehmen Sinotrans habe eine Verbindung zwischen Shenzhen und Duisburg gestartet, teilte die Duisburger Hafen AG am Dienstag mit. Die südchinesische Metropole gegenüber von Hongkong sei eine der wirtschaftlich erfolgreichsten Regionen in China. Durch die neue Verbindung stärke der Duisburger Hafen sein Netzwerk in China, sagte Duisport-Chef Erich Staake. Inzwischen verkehrten wöchentlich bis zu 60 Züge zwischen Duisburg und verschiedenen Zielen in China. Duisburg","sueddeutsche, DPA"
Tischtennis. Boll und Ovtcharov auf Teilnehmerliste für World Cup,no_author,2020-09-07 15:18:54,https://www.sueddeutsche.de/sport/tischtennis-boll-und-ovtcharov-auf-teilnehmerliste-fuer-world-cup-dpa.urn-newsml-dpa-com-20090101-200907-99-464369,"Hannover (dpa) - Die beiden deutschen Topspieler   und Dimitrij Ovtcharov stehen auf der Teilnehmerliste des Tischtennis-World-Cups vom 13. bis 15. November. Das gab der Weltverband ITTF kurz nach der Verlegung des prestigeträchtigen Turniers von Düsseldorf in eine noch nicht benannte Stadt in   bekannt. Rekord-Europameister Boll qualifizierte sich bereits im Februar als Gewinner des europäischen Top-12-Turniers für diesen Wettbewerb. Ovtcharov erhielt von der ITTF als World-Cup-Sieger von 2017 sowie früherer Weltranglisten-Erster eine Wildcard. Nach einer monatelangen Turnierpause wegen der Corona-Pandemie hatte der Weltverband am Freitag beschlossen, den World Cup der Männer, den World Cup der Frauen sowie die ""ITTF Finals"" ab November gebündelt an einem Ort in China auszutragen. An dem World Cup nehmen ähnlich wie beim früheren Confed Cup im Fußball die bestplatzierten Spieler der kontinentalen Ranglistenturniere teil. Im   hat dieser Wettbewerb traditionell eine sehr große Bedeutung. © dpa-infocom, dpa:200907-99-464369/2 Timo Boll China Tischtennis","sueddeutsche, DPA"
Wirtschaftspolitik. Altmaier: EU braucht effizientes Wettbewerbsrecht,no_author,2020-09-07 17:05:48,https://www.sueddeutsche.de/politik/wirtschaftspolitik-altmaier-eu-braucht-effizientes-wettbewerbsrecht-dpa.urn-newsml-dpa-com-20090101-200907-99-465867,"Berlin (dpa) - Bundeswirtschaftsminister   (CDU) hat sich mit Blick auf zunehmende Konkurrenz etwa aus China für ein starkes und effizientes EU-Wettbewerbsrecht ausgesprochen. Dieses müsse sich besser und praktikabler anwenden lassen, sagte Altmaier in Berlin zum Auftakt einer wettbewerbspolitischen Konferenz im Rahmen der deutschen EU-Ratspräsidentschaft. Die Pandemie verstärke die bestehenden Herausforderungen durch Digitalisierung und Globalisierung, so Altmaier. ""Wir brauchen faire Wettbewerbsbedingungen in der Plattformökonomie und im Systemwettbewerb mit Unternehmen, die durch Drittstaaten unterstützt werden und insoweit nicht den EU-Beihilferegeln unterliegen."" Die EU-Kommission hatte im Juni ein Strategiepapier vorgelegt. Staatlich subventionierte Unternehmen aus China und anderen Ländern sollen es bei Einkaufstouren in der EU künftig schwerer haben. Ins Visier geraten sind vor allem Verzerrungen im Wettbewerb, ausgelöst durch Konzerne etwa aus China, die staatlich subventioniert werden. Altmaier hatte bereits vor einem ""Ausverkauf"" deutscher Wirtschaftsinteressen gewarnt. Die Bundesregierung hatte in der Corona-Krise bereits die Außenwirtschaftsverordnung verschärft. Chinesische Investoren haben immer wieder Hightech-Firmen aus   und anderen EU-Staaten übernommen. Prominentestes Beispiel: der Roboterhersteller Kuka, der 2016 von einem chinesischen Konzern übernommen wurde. Altmaier hatte zuletzt der deutschen Stahlindustrie Unterstützung zugesagt. Diese leide auch durch Überkapazitäten auf dem weltweiten Stahlmarkt, getrieben vor allem etwa von China. Der Wirtschaftsminister sagte weiter, staatliche Hilfsprogramme in der Corona-Krise seien zeitlich begrenzt. Die EU muss für viele Maßnahmen grünes Licht geben. Danach wolle man zu Marktbedingungen zurückzukehren. Es gehe aber um faire Wettbewerbsbedingungen. Auch EU-Vizekommissionschefin Margrethe Vestager betonte die Bedeutung des Wettbewerbsrechts. Mit Blick auf die Corona-Krise und den geplanten EU-Wiederaufbaufond sagte sie, es komme darauf an, dass die gesamte europäische Wirtschaft sich wieder erhole. Altmaier hatte sich gemeinsam mit seinem französischen Amtskollegen Bruno Le Maire schon vor längerer Zeit für eine Reform des EU-Wettbewerbsrechts stark gemacht. Hintergrund der Pläne war auch die gescheiterte Fusion der Zugsparten von Siemens und dem französischen Konkurrenten Alstom wegen Bedenken der EU-Wettbewerbshüter. Die Kommission hatte dann später die Erlaubnis für die Fusion von Alstom mit der Zugsparte des kanadischen Konzerns Bombardier gegeben. © dpa-infocom, dpa:200907-99-465867/2 Peter Altmaier Deutschland","sueddeutsche, DPA"
Demonstrationen - Dresden. Was kommt trotz Absage des EU-China-Gipfels auf Leipzig zu?,no_author,2020-09-08 14:17:57,https://www.sueddeutsche.de/politik/demonstrationen-dresden-was-kommt-trotz-absage-des-eu-china-gipfels-auf-leipzig-zu-dpa.urn-newsml-dpa-com-20090101-200908-99-476768,"Leipzig (dpa) - Nach den Krawallen in Leipzig blicken Polizei und Stadtspitze mit Anspannung auf das nächste Wochenende. Zu dem Zeitpunkt hätte in der Stadt der EU-China-Gipfel veranstaltet werden sollen. Er wurde wegen Corona abgesagt. Es lägen jedoch Erkenntnisse vor, dass der Gipfel trotz der Absage ""Thema sein kann für die Versammlungslage am Wochenende"", sagte Ordnungsdezernent Heiko Rosenthal am Dienstag. Allerdings sei es noch zu früh, die Lage für das Wochenende abschließend einzuschätzen, sagte Polizeipräsident Torsten Schultze. Eine Demonstration mit dem Motto ""Storm the fortress - Break all borders"" ist offiziell angemeldet worden. Dafür seien 800 Teilnehmer angekündigt, sagte Rosenthal. Das sogenannte Kooperationsgespräch mit den Anmeldern und der Polizei stehe noch aus. Bei dem Gespräch werde die Stadt noch einmal die Motivation des Aufzugs hinterfragen. Die Veranstalter hatten auf Twitter betont, dass von ihrer Demo keine Eskalation ausgehen werde. Am vorigen Donnerstag, Freitag und Samstag waren in Leipzig jeweils Demonstrationen eskaliert. Vermummte hatten die Polizei mit Steinen, Flaschen und Böllern beworfen. Elf Beamte seien leicht verletzt worden. Auslöser der Krawalle waren Hausbesetzungen, die von der Polizei beendet worden waren. Zwei der drei Demonstrationen waren nicht angemeldet gewesen. ""Wir müssen aktuell zur Kenntnis nehmen, dass wir in Leipzig ein Problem mit linksextremistisch motivierter Gewalt haben"", sagte Polizeipräsident Schultze. Um das Problem in den Griff zu bekommen, brauche die Polizei die Unterstützung der Gesellschaft. Die Polizei plane Infoveranstaltungen, um mit den Menschen in Kontakt zu kommen. Oberbürgermeister Burkhard Jung (SPD kündigte ein Stadtteilgespräch mit dem Polizeichef in Connewitz an. Zwei der drei Gewaltausbrüche hatte es dort gegeben. ""Wir müssen miteinander ganz klar eine Haltung finden zu dem Thema Gewalt. Und das kann nur eine Ächtung sein"", sagte Jung.","sueddeutsche, DPA"
International - Schwerin. Sellering: EU braucht eigene Politik gegenüber Russland,no_author,2020-09-08 15:11:07,https://www.sueddeutsche.de/politik/international-schwerin-sellering-eu-braucht-eigene-politik-gegenueber-russland-dpa.urn-newsml-dpa-com-20090101-200908-99-477770," (dpa/mv) - Der Vorsitzende des Vereins Deutsch-Russische Partnerschaft, Mecklenburg-Vorpommerns Ex-Ministerpräsident Erwin Sellering (SPD), wirbt für eine eigenständige Politik der EU gegenüber Russland. ""Deutschland sollte sich in der zunehmend aggressiver ausgetragenen Rivalität der drei großen Weltmächte USA, China und Russland nicht von einer dieser Weltmächte vereinnahmen und gegen eine andere in Stellung bringen lassen"", erklärte Sellering am Dienstag in Schwerin. Deutschland solle vielmehr sein Gewicht in Europa dazu nutzen, eine eigenständige Politik der EU in Wahrnehmung der eigenen europäischen Interessen auf den Weg zu bringen. Damit könne den drei Weltmächten auf Augenhöhe begegnet werden. Dazu gehöre, sich nicht vorschreiben zu lassen, von wem   Gas kaufen dürfe. ""Ob Nord Stream 2 in deutschem Interesse liegt, entscheidet Deutschland"", so Sellering. Wirtschaftliche Interessen der USA könnten kein Grund sein, sich über die souveräne Entscheidung Deutschlands hinwegzusetzen. Seit zwei Jahren organisiert die Deutsch-Russische Partnerschaft den Austausch zwischen Deutschen und Russen, vor allem auch Jugendlichen - im Sport, in der Kultur, Umwelt, Denkmalschutz, Feuerwehr und anderen sozialen Bereichen. Für die weitere Arbeit des Vereins sei klar: Misstrauen, Aggressivität, Strafandrohungen schafften kein Klima, in dem die Arbeit gedeihen könne, sagte Sellering. Dafür brauche es eine Basis des gegenseitigen Vertrauens. Seit Tagen wird wegen der Vergiftung des russischen Oppositionellen Alexej Nawalny ein möglicher Baustopp von Nord Stream 2 diskutiert. Die Bundesregierung lässt die Zukunft des Projekts bislang offen. Schwerin Deutschland","sueddeutsche, DPA"
Tischtennis. Tischtennis-Profis gegen Turnierserie in China,no_author,2020-09-07 19:32:58,https://www.sueddeutsche.de/sport/tischtennis-tischtennis-profis-gegen-turnierserie-in-china-dpa.urn-newsml-dpa-com-20090101-200907-99-467312,"Hannover (dpa) - Mehrere Tischtennis-Profis um den deutschen Spitzenspieler   haben beim Weltverband ITTF gegen die geplante Austragung von drei Topturnieren während der Corona-Pandemie in China protestiert. Das Vorgehen der ITTF sei ""inakzeptabel und ein Verstoß gegen alle Prinzipien des Fair Play"", heißt es in einem Schreiben, das der Deutschen Presse-Agentur vorliegt. Konkret werfen die Unterzeichner dem Weltverband vor, dass er sie mit seinen Turnierplänen ""in vielen Fällen Reisebeschränkungen, einem höheren Infektionsrisiko und Visa-Problemen"" aussetzen würde. Außerdem würde eine mehrwöchige und nicht vorher abgestimmte China-Reise im November für die Spieler bedeuten, dass sie Verträge mit ihren Vereinen und Sponsoren brechen müssten. Diese Umstände würden die Profis daran hindern, ""in der ""Bubble"" in   zu spielen"". Sie werfen der ITTF in ihrem Brief auch vor, Spieler unter Druck zu setzen und im Falle einer Nicht-Teilnahme mit dem Abzug von Weltranglisten-Punkten zu drohen. Die Unterzeichner kommen aus mehreren Ländern mit Ausnahme des Turnier-Gastgebers China. Der Weltverband ITTF hatte am 4. September verkündet, den World Cup der Männer, den World Cup der Frauen sowie den Saisonabschluss ""ITTF Finals"" ab dem 13. November gebündelt an einem Ort in China austragen zu wollen. Wegen der Corona-Pandemie finden im   seit März keine internationalen Turniere statt. Nach Angaben der ITTF soll diese Bündelung an einem Ort gerade verhindern, dass die Spielerinnen und Spieler viel reisen und sich unterschiedlichen Corona-Bestimmungen unterwerfen müssen. Eigentlich sollte der World Cup der Männer im Oktober in Düsseldorf stattfinden. © dpa-infocom, dpa:200907-99-467312/2 Timo Boll China Tischtennis","sueddeutsche, DPA"
