title,author,date_published,url,article_text,source
Agrar - Kirchlinteln. Ehlers fordert festen Zaun zur Abwehr der Schweinepest,no_author,2020-09-20 09:18:09,https://www.sueddeutsche.de/wirtschaft/agrar-kirchlinteln-ehlers-fordert-festen-zaun-zur-abwehr-der-schweinepest-dpa.urn-newsml-dpa-com-20090101-200920-99-633973,"Kirchlinteln (dpa) - Ohne einen festen Zaun gegen Wildschweine aus Polen wird   nach Ansicht des niedersächsischen Landvolk-Vizes Jörn Ehlers die Afrikanische Schweinepest nicht besiegen können. Alle Abwehrmaßnahmen seien unvollständig, solange neue Infektionen aus dem stärker von der Tierseuche betroffenen Nachbarland drohten, sagte Ehlers der Deutschen Presse-Agentur. Vermutlich hätte eine Zaunanlage weniger gekostet als die Einbußen, die deutsche Schweinehalter jetzt schon erlitten haben, sagte der Vizepräsident des Bauernverbandes Niedersachsen. Die ersten an der Afrikanischen Schweinepest (ASP) verendeten Wildschweine in Deutschland sind in Brandenburg nahe der Grenze zu   gefunden worden. Die genauen Übertragungswege sind noch nicht geklärt. Für Menschen ist die Tierseuche ungefährlich. Ein mobiler Elektrozaun von 120 Kilometer Länge existiert in Brandenburg an der Grenze zu Polen im Bereich der Stadt Frankfurt (Oder) und den Landkreisen Oder-Spree und Spree-Neiße - also südlich bis zur brandenburgisch-sächsischen Grenze. Im Bereich des Kreises Spree-Neiße soll er durch einen festen Zaun ersetzt werden - wann der gebaut wird, ist bisher offen. Mecklenburg-Vorpommern hatte im Juli mit dem Bau eines temporären Wildschutzzauns an seiner Grenze zu Polen begonnen, der etwa fünf Jahre stehen bleiben soll. Sachsen errichtete im März einen rund 130 Kilometer langen mobilen Schutzzaun an der Grenze zu Polen, der Wildschweine abhalten soll. Zusätzlich wird nun ein 50 Kilometer langer fester Zaun angeschafft, der im Seuchenfall um die Gefahrenzone errichtet werden kann. Wegen der ersten ASP-Fälle in Deutschland sind die Schweinepreise gesunken. Der Großabnehmer China hat den Import von Schweinefleisch aus Deutschland gestoppt. Ehlers betreibt selbst eine Schweinemast mit 2000 Tieren. ""Auf einen Schlag waren meine Schweine 40 000 Euro weniger wert"", sagte er. Noch stärker betroffen als die Mäster sind die Schweinezüchter, die ihre Ferkelproduktion nicht so schnell herunterfahren können. Mit 8,08 Millionen Tieren hat   in Deutschland den größten Bestand an Schweinen. In ganz Deutschland gab es nach Zählung des Statistischen Bundesamtes Anfang Mai 25,4 Millionen Schweine. Deutschland Polen Niedersachsen","sueddeutsche, DPA"
Internet. Trump billigt Tiktok-Deal,no_author,2020-09-20 19:04:14,https://www.sueddeutsche.de/service/internet-trump-billigt-tiktok-deal-dpa.urn-newsml-dpa-com-20090101-200920-99-632731,"Washington (dpa) - Die Zukunft der Video-App Tiktok in den USA scheint gesichert, nachdem Präsident   einen Deal zwischen dem chinesischen Eigentümer Bytedance und US-Unternehmen gebilligt hat. Das weltweite Geschäft von Tiktok komme in eine neue Firma mit Sitz in den  , ""wahrscheinlich in Texas"", sagte Trump in der Nacht zum Sonntag. ""Ich habe den Deal abgesegnet."" Eine formelle Aufhebung der US-Maßnahmen gegen Tiktok steht noch aus. Das Handelsministerium schob den Download-Stopp für die App in den USA, der für Nutzer ab Montag greifen sollte, um eine Woche auf. Trump hatte Tiktok als Sicherheitsrisiko bezeichnet, weil die App dem chinesischen Bytedance-Konzern gehört. Aus seiner Sicht hätten chinesische Behörden über die App an Daten von Amerikanern kommen können. Dieser Begründung folgend legte er mit zwei Anordnungen die Basis für das Aus der App in den USA. Tiktok und Bytedance entgegneten vergeblich, dass Daten von US-Nutzern in den USA gespeichert würden und nicht nach   gingen. Tiktok hat rund 100 Millionen Nutzer in den USA. Die US-Regierung wollte auch gegen die chinesische Kommunikations-App WeChat vorgehen, die in den USA einige Millionen Menschen nutzen, vor allem um mit Freunden und Verwandten in China in Kontakt zu bleiben. WeChat sollte am Montag ebenfalls aus den App Stores in den USA verschwinden - und auch den Großteil der Funktion für US-Nutzer verlieren. Eine Richterin in Kalifornien setzte diese Sanktionen am Sonntag mit einer einstweiligen Verfügung aber aus. Nach dem nun abgenickten Tiktok-Deal soll der Software-Konzern Oracle alle Daten von US-Nutzern verarbeiten und sich um die dazugehörigen technischen Systeme kümmern. In den USA würden 25 000 Jobs entstehen, kündigten Trump und Tiktok an. Eine zentrale Forderung Trumps war auch, dass US-Investoren eine Mehrheit an Tiktok halten. Dazu wurde bisher nur offiziell bekannt, dass Oracle vor einem Börsengang von Tiktok Global einen Anteil von 12,5 Prozent an der Firma übernehmen soll und der Supermarkt-Riese Walmart 7,5 Prozent. Bytedance strebe dabei eine Gesamtbewertung von 60 Milliarden Dollar für Tiktok an, schrieb der Finanzdienst Bloomberg. Oracle und Walmart müssten demnach zusammen zwölf Milliarden Dollar bezahlen. Über den Preis werde aber noch verhandelt, schränkte Bloomberg unter Berufung auf informierte Personen ein. Das US-Finanzministerium erklärte am Sonntag, die Transaktion müsse nun zunächst einmal unter Dach und Fach gebracht werden, bevor die Regierung weiter handeln könne. Zugleich berichtete das ""Wall Street Journal"", dass Bytedance die restlichen 80 Prozent von Tiktok Global behalten werde. Aber: Da amerikanische Investoren wie die Start-up-Finanzierer Sequoia und General Atlantic wiederum rund 40 Prozent an Bytedance hielten, könne man von einer US-Mehrheit bei Tiktok sprechen, erklärten informierte Personen der Zeitung. Trump hatte zuvor verkündet: ""Es wird eine ganz neue Firma sein. Sie wird nichts mit China zu tun haben."" Das neue Konstrukt könnte den Vorteil haben, dass die chinesische Regierung dem Deal keine Steine in den Weg legen wird. Die Führung in Peking hatte zuvor einen direkten Verkauf des US-Geschäfts von Tiktok an den Software-Konzern Microsoft torpediert. Sie führte eine neue Regel ein, nach der Software-Algorithmen nur mit Erlaubnis der Behörden ins Ausland verkauft werden dürfen. Trump seinerseits hatte einen Deal, bei dem Oracle mit einem Minderheitsanteil als Technologie-Partner von Tiktok agieren sollte, vor wenigen Tagen noch abgelehnt. Das Handelsministerium leitete daraufhin den Countdown für den Rauswurf von Tiktok aus den amerikanischen App Stores ein. Ab Mitte November sollte die App in den USA nicht mehr funktionieren. Tiktok und Bytedance reichten dagegen Klage in Washington ein. Neu ist, dass Tiktok nun fünf Milliarden Dollar an einen Bildungsfonds in Texas überweisen werde, wie Trump bei einem Wahlkampfauftritt in Fayetteville im Bundesstaat North Carolina sagte. Er hatte zuvor verlangt, dass die US-Regierung eine Art Kommission bekommen müsse, weil sie den Deal herbeigeführt habe. Der Bildungsfonds solle dafür sorgen, ""dass die echte Geschichte unseres Landes unterrichtet wird"", sagte Trump. Er hatte vor einigen Tagen die Bildung einer Kommission zur Förderung patriotischer Bildung angekündigt - der Republikaner begründete dies unter anderem damit, dass die historische Bedeutung der Sklaverei aktuell zu stark hervorgehoben werde. Bytedance teilte am Sonntag mit, von der Milliardenspende ""erstmals in den Nachrichten erfahren"" zu haben. Bloomberg berichtete, Trump habe sie am Freitag in einem Telefonat mit Oracle-Gründer Larry Ellison und Walmart-Chef Doug McMillon ausgehandelt. Tiktok hatte bereits einen Cloud-Deal mit einem anderen US-Unternehmen - Amazons IT-Tochter AWS. Trump ist in der Vergangenheit häufiger mit Attacken gegen den Gründer und Chef des Online-Händlers, Jeff Bezos, aufgefallen. Bezos gehört privat die Zeitung ""Washington Post"", in der Trump oft kritisiert wird. Oracle-Gründer Ellison ist dagegen einer der prominentesten Unterstützer Trumps im Silicon Valley. Walmart wiederum ist ein Amazon-Konkurrent. Die Richterin entschied nach einer Klage von WeChat-Nutzern gegen das Vorgehen der US-Regierung. Sie argumentierte vor allem, dass der WeChat-Stopp den Nutzern eine zentrale Kommunikationsplattform nehmen und damit ihr Verfassungsrecht auf Redefreiheit verletzen würde. Die Kläger hätten dargelegt, dass es keine angemessene Alternative gebe. Eine einstweilige Verfügung sei gerechtfertigt, weil der sofortige Schaden zu groß wäre, selbst wenn das Hauptverfahren zu Gunsten von WeChat und der Nutzer ausgehen würde. Die Regierung habe sie hingegen nicht davon überzeugen können, dass ein Komplett-Verbot der einzige Weg sei, um die Sicherheitsbedenken auszuräumen. © dpa-infocom, dpa:200920-99-632731/8 Donald Trump USA China","sueddeutsche, DPA"
Internet. Richterin stoppt Vorgehen der US-Regierung gegen WeChat,no_author,2020-09-20 18:40:47,https://www.sueddeutsche.de/service/internet-richterin-stoppt-vorgehen-der-us-regierung-gegen-wechat-dpa.urn-newsml-dpa-com-20090101-200920-99-638496,"San Francisco (dpa) - Die chinesische Kommunikations-App WeChat wird vorerst für amerikanische Nutzer verfügbar bleiben. Eine Richterin in Kalifornien setzte die Sanktionen der US-Regierung am Sonntag mit einer einstweiligen Verfügung aus. Die App sollte ab Montag aus den Download-Plattformen in den   verschwinden und auch den Großteil ihrer Funktionalität verlieren. Einige Millionen Nutzer in den USA greifen zu WeChat, vor allem um mit Verwandten und Freunden in   in Kontakt zu bleiben. Die US-Regierung warnt, dass chinesische Behörden über WeChat Zugriff auf Daten von Amerikanern bekommen könnten. Der Betreiber WeChat weist dies zurück. Die Richterin entschied nach einer Klage von WeChat-Nutzern gegen das Vorgehen der US-Regierung. Sie argumentierte vor allem, dass der WeChat-Stopp den Nutzern eine zentrale Kommunikationsplattform nehmen und damit ihr Verfassungsrecht auf Redefreiheit verletzen würde. Die Kläger hätten dargelegt, dass es keine angemessene Alternative gebe. Eine einstweilige Verfügung sei gerechtfertigt, weil der sofortige Schaden zu groß wäre, selbst wenn das Hauptverfahren zu Gunsten von WeChat und der Nutzer ausgehen würde. Die Regierung habe sie hingegen nicht davon überzeugen können, dass ein Komplett-Verbot der einzige Weg sei, um die Sicherheitsbedenken auszuräumen. © dpa-infocom, dpa:200920-99-638496/3 USA China","sueddeutsche, DPA"
EU. Heftiger Streit über Lage in Belarus im UN-Menschenrechtsrat,no_author,2020-09-18 19:22:13,https://www.sueddeutsche.de/politik/eu-heftiger-streit-ueber-lage-in-belarus-im-un-menschenrechtsrat-dpa.urn-newsml-dpa-com-20090101-200917-99-604234,"Minsk/Genf (dpa) - Gegen den massiven Widerstand Russlands und anderer Länder hat die belarussische Oppositionsführerin   auf internationaler Bühne die Gewalt in ihrer Heimat angeprangert. Das Ausmaß der Brutalität, die das ""Regime"" in Belarus (Weißrussland) unter Staatschef   anwende, sei beispiellos und ein Verstoß gegen internationales Recht. Das sagte die 38-Jährige am Freitag in einem Video bei einer Dringlichkeitsdebatte des UN-Menschenrechtsrats. Diplomaten aus Russland,  , Venezuela und China versuchten in der Sitzung zur Lage der Ex-Sowjetrepublik, die Vorführung des Videos zu verhindern. Tichanowskajas Botschaft wurde trotzdem gezeigt. UN-Experten erklärten, Tausende Demonstranten seien festgenommen worden, und es gebe Hunderte Berichte über Folter. Es sei entscheidend für die Zukunft des Landes, diese Spirale wachsender Unterdrückung und Gewalt zu beenden, sagte die stellvertretende UN-Hochkommissarin für Menschenrechte, Nada Al-Nashif, in Genf. ""Die Zivilgesellschaft ist ein wertvoller Partner und keine Bedrohung."" Der Botschafter von Belarus wies die Vorwürfe zurück. Das Gremium beschloss auf Initiative europäischer Staaten eine Resolution, in der Minsk aufgefordert wird, einer UN-Kommission freien Zugang unter anderem zu Gefängnissen zu gewähren. 23 Staaten stimmten dafür, Eritrea und Venezuela dagegen, 22 Länder enthielten sich. In der Resolution wird die Regierung in Minsk außerdem aufgefordert, einen Dialog mit der Opposition und der Zivilgesellschaft zu beginnen. Der belarussische Außenminister Wladimir Makej kritisierte die Resolution als Einmischung in die inneren Angelegenheiten des Landes. Der Chefdiplomat kündigte Gegenmaßnahmen an, sollten die EU-Außenminister am Montag Sanktionen beschließen. Mögliche Reaktionen seien eine Sanktionsliste gegen europäische Amtsträger sowie der Entzug der Akkreditierung für ausländische Korrespondenten. Der 66-jährige Lukaschenko strebt nach der umstrittenen Präsidentenwahl vom 9. August nach 26 Jahren an der Macht seine sechste Amtszeit an. Er wies in Minsk bei einem Auftritt am Donnerstagabend vor einem Frauenforum erneut zurück, dass das Wahlergebnis von 80,1 Prozent der Stimmen gefälscht sei. Lukaschenko sieht sich als Opfer einer internationalen Kampagne. Er verkündete deshalb bei der Veranstaltung, dass Belarus die Grenzen zu den EU-Nachbarn Polen und Litauen schließe. Litauen äußerte sich irritiert ob der erklärten Grenzschließung und wies darauf hin, dass der Verkehr weiter laufe. ""Ich denke, es ist eine Provokation ohne besonderen Grund"", sagte Präsident Gitanas Nauseda. ""Die Behörden in einigen Ländern vergessen einfach, dass es ein Prinzip der Gegenseitigkeit in den internationalen Beziehungen gibt und Grenzen auf beiden Seiten geschlossen werden können."" Auch der belarussische Grenzschutz sprach nur von einer verschärften Kontrolle an den Übergängen. Tichanowskaja warf Lukaschenko mit Blick auf die Erklärung zur Grenzschließung ""Realitätsverlust"" vor. Sie forderte ihre Landsleute auf, ihm kein Wort mehr zu glauben. Im Nachbarland Ukraine meinte Innenminister Arsen Awakow: ""Lukaschenko dreht offenbar total durch."" Er rede ""Unsinn"" und leide unter ""Verfolgungswahn"". ""Seine Texte bekommt er wahrscheinlich von Putin"", schrieb Awakow bei Facebook mit Blick auf die Unterstützung durch Kremlchef Wladimir Putin für Lukaschenko. Der Machthaber solle Wodka trinken und sich beruhigen. Die Demokratiebewegung in Minsk wurde am Freitag für den renommierten Sacharow-Preis des Europaparlaments nominiert. Neben anderen Kandidaten findet sie sich gleich zweimal auf der Vorschlagsliste - einmal auf Antrag der großen Fraktionen Christdemokraten, Sozialdemokraten und Liberale und einmal, mit etwas anderer Begründung, nominiert von der EU-kritischen EKR-Fraktion. Der Sacharow-Preis wird seit 1988 vom Europäischen Parlament an Persönlichkeiten oder Organisationen verliehen, die sich für die Verteidigung der Menschenrechte und der Meinungsfreiheit einsetzen. Am 22. Oktober soll bekannt gegeben werden, wer die diesjährige Auszeichnung erhält. Die Preisverleihung ist im Dezember. Bereits in der Plenardebatte am Dienstag zur Lage in Belarus hatten mehrere Abgeordnete die Nominierung der belarussischen Opposition ins Spiel gebracht. Neben Tichanowskaja, die sich als Siegerin der Präsidentenwahl sieht, nannten sie dabei die Aktivistinnen Maria Kolesnikowa und Veronika Zepkalo. Die drei Frauen hatten sich im Wahlkampf zusammengeschlossen, nachdem Lukaschenko zwei Bewerber um das Präsidentenamt hatte einsperren lassen. Tichanowskaja war als Vertreterin der Opposition zur Wahl angetreten. Sie verließ nach der Abstimmung ihre Heimat auf Druck der Behörden und lebt Litauen. In ihrem Video bei der UN-Menschenrechtsdebatte forderte Tichanowskaja mit Nachdruck die Freilassung aller politischen Gefangenen sowie Neuwahlen. Aus Protest gegen Behördenwillkür trat der inhaftierte Oppositionsanwalt Maxim Snak am Freitag in den Hungerstreik. Der 39-jährige Jurist erhielt seine Anklage wegen Gefährdung der nationalen Sicherheit, wie ein Sprecher der Demokratiebewegung mitteilte. Es handele sich um eine inszenierte Anschuldigung, um die freie Meinungsäußerung zu unterdrücken, sagte Snaks Anwalt Dmitri Lajewski. Im Fall einer Verurteilung drohen Snak - wie der wegen der gleichen Vorwürfe inhaftierten Kolesnikowa - bis zu fünf Jahre Gefängnis. Der Jurist Snak gehört zum Präsidium des Koordinierungsrats der belarussischen Zivilgesellschaft für einen friedlichen Machtwechsel. Lukaschenkos Machtapparat geht seit Wochen mit Festnahmen und Razzien gegen das Gremium vor. Die meisten Präsidiumsmitglieder sind entweder in Haft oder im Ausland. In Freiheit in Minsk sind nur noch die Literaturnobelpreisträgerin Swetlana Alexijewitsch und seit Freitag auch wieder der Gewerkschafter Sergej Dylewski. © dpa-infocom, dpa:200917-99-604234/10 Swetlana Tichanowskaja Alexander Lukaschenko Belarus","sueddeutsche, DPA"
Hochschulen - Schwerin. Jeder zehnte Student in MV kommt aus dem Ausland,no_author,2020-09-21 07:26:28,https://www.sueddeutsche.de/bildung/hochschulen-schwerin-jeder-zehnte-student-in-mv-kommt-aus-dem-ausland-dpa.urn-newsml-dpa-com-20090101-200921-99-644835," (dpa/mv) - Jeder zehnte Student in Mecklenburg-Vorpommern kommt aus dem Ausland. Im Wintersemester 2019/20 waren 4003 junge Frauen und Männer ohne deutschen Pass an den Universitäten und Hochschulen des Landes für ein Studium eingeschrieben. Das waren 10,4 Prozent der insgesamt 38 393 Studierenden, wie aus einem aktuellen Bericht des Statistischen Landesamtes hervorgeht. Mehr als die Hälfte der ausländischen Studenten kam aus Asien (2331), wobei das Hauptherkunftsland Indien mit 432 Studenten war, gefolgt von Syrien (416) und China (321). Auch 206 Iraner, 194 Indonesier und 166 Pakistaner studierten in Mecklenburg-Vorpommern. Aus dem Nachbarland Polen stammten indes nur 119 Studierende. An Mecklenburg-Vorpommerns Universitäten und Hochschulen ging es nicht immer so international zu. Im Wintersemester 2014/15 waren zum Beispiel nur 2582 Ausländer eingeschrieben, was einem Anteil von 6,6 Prozent entsprach. Im Wintersemester 2017/18 lag der Ausländeranteil unter den Studenten schon bei 9,1 Prozent. Schwerin","sueddeutsche, DPA"
"Film. US-Drama ""Nomadland"" gewinnt beim Filmfest in Toronto",no_author,2020-09-20 23:18:34,https://www.sueddeutsche.de/kultur/film-us-drama-nomadland-gewinnt-beim-filmfest-in-toronto-dpa.urn-newsml-dpa-com-20090101-200920-99-642362,"Toronto (dpa) – Das Roadtrip-Drama ""Nomadland"" von Regisseurin Chloé Zhao ist der Siegerfilm beim 45. Toronto International   Festival (TIFF). Das gaben die Leiter des Festivals, Joana Vicente und Cameron Bailey, bekannt. Der US-Film mit Frances McDormand in der Hauptrolle begeisterte das Publikum der kanadischen Metropole, das traditionell an Stelle einer Jury den Gewinner wählt. ""Nomadland"" erzählt die Geschichte einer Frau, die nach dem wirtschaftlichen Kollaps einer Kleinstadt allein in ihrem Van durch den amerikanischen Westen reist. Das Drama der in China geborenen Regisseurin Zhao wurde Mitte September bereits mit dem Goldenen Löwen des Filmfestivals Venedig ausgezeichnet. TIFF-Co-Chef Bailey lobte ""Nomadland"" als ""wunderschön erzählte Geschichte, mit einem großartigen Gefühl für Charaktere und Landschaft"". Zhao zeige ""ein Stück Amerika, das wir so nicht oft sehen. Es geht um Menschen, die ohne Zuhause leben, die wie Nomaden durch das Land reisen und dort arbeiten, wo sie einen Job bekommen"", sagte Bailey. Regisseurin Zhao bedankte sich in einer Videonachricht beim Publikum: ""Ohne euch könnten wir das alles nicht tun. Danke, dass ihr auch dieses Jahr zum Festival gekommen seid und die Filme in euren Autos oder zu Hause angesehen habt. Bitte, bitte macht das weiterhin."" Regina Kings Regiedebüt ""One Night in Miami"", das ein Treffen von Malcolm X, Muhammad Ali, Sam Cooke und Jim Brown aus dem Jahr 1964 neu interpretiert, landete auf dem zweiten Platz. Rang drei belegte das Drama ""Beans"" der kanadischen Regisseurin Tracey Deers. Zum besten Dokumentarfilm wählte das Publikum Michelle Latimers ""Inconvenient Indian"". Latimers Adaption von Thomas Kings Bestseller wurde zudem auch mit dem TIFF-Award für den besten kanadischen Spielfilm ausgezeichnet. ""Die Filme und Talente des diesjährigen Festivals haben uns inspiriert und bewegt"", sagte TIFF-Co-Chefin Vicente in einem Statement zum Abschluss des Festivals. ""In einer Zeit, in der die Zukunft dieser Kunstform aufgrund von Film- und Produktionsstillständen sowie Absagen von Filmfestivals in Frage gestellt wurde, haben Filmschaffende, Publikum und Fans eine inspirierende Hartnäckigkeit bewiesen"", sagte Vicente. Wegen der Corona-Krise fand das zehntägige Filmfest in   in diesem Jahr ohne Staraufgebot und mit einem deutlich dezimierten Programm statt: Während in den Vorjahren regelmäßig mehr als 300 Beiträge in der Auswahl standen, konkurrierten in diesem Jahr nur 50 Filme um die Gunst der Zuschauer. Wegen der Pandemie wurden die Filme unter starken Sicherheitsauflagen in einem Kino gezeigt und ansonsten in Drive-Ins, Open-Air-Kinos sowie virtuell über eine Online-Plattform präsentiert. © dpa-infocom, dpa:200920-99-642362/3 Film Toronto","sueddeutsche, DPA"
Buntes - Hameln. Niedersachse will eine Million Glückskekse im Jahr verkaufen,no_author,2020-09-21 07:58:02,https://www.sueddeutsche.de/leben/buntes-hameln-niedersachse-will-eine-million-glueckskekse-im-jahr-verkaufen-dpa.urn-newsml-dpa-com-20090101-200921-99-644271,"Hameln (dpa/lni) - Die besten Fragen stellen ohnehin immer die Kinder: ""Papa, warum gibt's keine Glückskekse für Kinder?"", fragt die zehnjährige Lina ihren Vater, den Start-up-Gründer Michael Rohrdrommel. Der kann nur feststellen: Stimmt, die gibt es nicht. Also führt man sie ein, etwa 100 Grundschüler denken sich Wissens- und Motivationssprüche für die Zettel im Keks aus. ""Das funktioniert bei Kindern wie verrückt"", meint der 54-Jährige. Zu den Fragen, die sich die Kinder ausgedacht haben, gehört beispielsweise: ""Wusstest Du, dass der größte Hund der Welt eine deutsche Dogge war?"" Rohrdrommel, viele Jahre im Eventmanagement, gründete in Hameln das Start-up Effects Marketing GmbH, um ganz eigene Glückskekse herzustellen - mit Schokoladengeschmack, lactosefrei und vegan. Dazu sollten Botschaften kommen, die die Menschen inspirieren. Warum? Immer habe er sich auf Glückskekse gefreut, jedes Mal sei er enttäuscht worden - vom Geschmack wie von den eher belanglosen Botschaften auf den Zetteln. Die Folge: Am 4. April 2018 entstand der erste eigene Schokoglückskeks. Etwa 500 Botschaften, viele selbst verfasst, hat er im Programm, ständig kommen neue hinzu. Denn inzwischen schicken Menschen eigene Botschaften für die Glückskekse, die auch verwendet werden - samt Namen des Autors. Und auch der 54-Jährige ist um Botschaften nicht verlegen. Einer seiner Lieblingstexte aus den Keksen lautet - in Kurzfassung: ""Sei jeden Tag begeistert von allem, was Du machst"". Auch dabei: ""Das Wichtigste ist, Dich selbst glücklich zu machen"". Die Herausforderung für den Gründer, seine acht Beschäftigten und drei Azubis: Die Kekse an den Mann und die Frau bringen, Partner in Handel und Wirtschaft finden. Und die Corona-Krise zu überstehen: ""Ordentliche Ohrfeigen"" habe die Zeit des Lockdowns ihm eingebracht, Aufträge seien verringert oder ganz storniert worden, erzählte der 54-Jährige. Dabei kamen auf der Kölner Süßwarenmesse im Februar Anfragen aus zahlreichen Ländern und von großen Unternehmen. ""Es ist für alle schwer"", sagte Rohrdrommel. Dabei sind die Pläne immer noch ambitioniert, eine Million Kekse will das kleine Unternehmen im laufenden Jahr schaffen - nach 550 000 im vergangenen. Mit seinen Keksen hat er 2019 rund 290 000 Euro umgesetzt, 500 000 Euro sollen es nun werden. Gebacken wird in Karlsruhe, Konfektionierung und Verpackung sind in Hameln und in der Nähe in Hessisch Oldendorf angesiedelt - teils im eigenen Hochregallager, teils in paritätischen Werkstätten. Die Schwierigkeit aber bleibt: ""Es ist ein langer, harter Weg, in   ein Lebensmittelprodukt an den Markt zu bringen"", erklärte Rohrdrommel. Und der Markt dafür? Ist ""definitiv eine Nische"", sagt Solveig Schneider, Sprecherin des Bundesverbandes der Deutschen Süßwarenindustrie. Glückskekse, die eigentlich vermutlich aus den USA stammen - nicht aus China, wie viele glauben - werden schon länger auch in Deutschland produziert. Größter Hersteller in Deutschland ist nach eigenen Angaben die Sweet & Lucky GmbH im baden-württembergischen Gondelsheim. Das Patent für den Schoko-Glückskeks aber hat: Michael Rohrdrommel. Am Unternehmenssitz in Hameln ist auch die Handkonfektionierung. Wenn viel zu tun ist, muss das ganze Team ran und Kekse verpacken, erzählt Marketingchefin Julia Weinert. ""Anfangs war man sehr langsam und vorsichtig, inzwischen kann jeder alles."" Die teils recht persönlichen Botschaften aus den Keksen gehen den Menschen manchmal nahe, sagte Rohrdrommel. ""Einmal hat eine Frau vor mir gestanden und geweint."" Und ein 85-Jähriger, dessen Frau gerade gestorben war, bekam in seinem Keks den Rat, sich auf sich selbst zu konzentrieren und etwas Neues anzufangen. Da hat er sich einen Hund angeschafft. Deutschland","sueddeutsche, DPA"
