title,author,date_published,url,article_text,source
Sport. MAD Lions bei League-of-Legends-WM ausgeschieden,no_author,2020-09-29 19:27:40,https://www.sueddeutsche.de/sport/sport-mad-lions-bei-league-of-legends-wm-ausgeschieden-dpa.urn-newsml-dpa-com-20090101-200929-99-758061,"Shanghai (dpa) - Das spanische Team MAD Lions hat die Erwartungen nicht erfüllt und ist in der Vorrunde der League-of-Legends-Weltmeisterschaft ausgeschieden. Der Repräsentant der europäischen Liga LEC unterlag dem türkischen Team Papara SuperMassive mit 2:3. ""Ich weiß nicht, was ich anderes sagen soll, außer, dass es mir Leid tut"", twitterte MADs Support-Spieler Norman ""Kaiser"" Kaiser nach der Niederlage. MAD kam bereits in der Gruppenphase der Play-Ins nicht in den Tritt. Nur knapp rettete sich das Team in einem Tie-Breaker gegen INTZ in die Knockout-Stage, in der sie weiter um den Erhalt im Turnier kämpfen konnten. An das Team, das mit vier Neulingen in das Jahr gestartet war, wurden nach einer überraschend starken Sommersaison hohe Erwartungen bei der WM gestellt. SuperMassive hingegen ist das erste Team der türkischen Liga, das einen Vertreter der LEC in einer Best-of-Five-Serie schlagen konnte. Im Spiel gegen MAD konnten vor allem Midlaner Onur Can ""Bolulu"" Demirol und Lee ""KaKAO"" Byung-kwon überzeugen. Am Mittwoch kämpft die Mannschaft gegen Unicorns of Love um das Vorrücken in die Hauptrunde der WM. Das Team mit Sitz in Deutschland, das sonst in der osteuropäischen Liga LCL antritt, hatte zuvor Platz Zwei in Gruppe B errungen. © dpa-infocom, dpa:200929-99-758061/4","sueddeutsche, DPA"
Auto. Tesla klagt gegen US-Strafzölle auf Importe aus China,no_author,2020-09-24 09:55:09,https://www.sueddeutsche.de/wirtschaft/auto-tesla-klagt-gegen-us-strafzoelle-auf-importe-aus-china-dpa.urn-newsml-dpa-com-20090101-200924-99-688624,"New York (dpa) - Der Elektroautobauer   will auf dem Rechtsweg eine Befreiung von US-Strafzöllen auf Importe aus China durchsetzen. Der Konzern von Starunternehmer Elon Musk wehrt sich beim US-Gericht für Internationalen Handel in New York gegen die ""ungesetzliche Auferlegung"" von Abgaben auf aus   eingeführte Waren. Die Klage wurde bereits am Montag eingereicht, erstmals berichtete am Mittwoch (Ortszeit) der Finanznachrichtendienst Bloomberg darüber. Angeklagte in dem Fall sind neben der US-Regierung deren Handelsbeauftragter Robert Lighthizer sowie der Chef der Zoll- und Grenzbehörde Mark Morgan, wie aus der Klageschrift hervorgeht. Tesla will mit dem Verfahren nicht nur bestehende Einfuhrzölle abwenden, sondern auch Kompensation für bereits geleistete Abgaben erstreiten. Lighthizers Behörde hatte zuvor einen Antrag Teslas abgewiesen, von 25-prozentigen Importzöllen befreit zu werden, die unter anderem auf Displays für das Model 3 aus China anfallen. Tesla ist allerdings bei Weitem nicht das einzige Unternehmen, das gegen die von US-Präsident Donald Trumps Regierung verhängten Zölle auf Einfuhren aus China vorgeht. Beim Gericht für Internationalen Handel laufen laut Bloomberg Hunderte solcher Verfahren. Eine Stellungnahme der US-Regierung lag zunächst nicht vor. © dpa-infocom, dpa:200924-99-688624/2 Tesla China","sueddeutsche, DPA"
Sport. League of Legends Worlds starten mit Play-In-Phase,no_author,2020-09-24 12:10:49,https://www.sueddeutsche.de/sport/sport-league-of-legends-worlds-starten-mit-play-in-phase-dpa.urn-newsml-dpa-com-20090101-200924-99-690480,"Shanghai (dpa) - Mit dem Duell MAD Lions gegen INTZ startet die diesjährige Weltmeisterschaft in League of Legends. Der Teilnehmer der europäischen Liga, MAD, trifft am Freitag in Shanghai auf das brasilianische Team in der Play-In-Phase des Turniers. Darin kämpfen zehn Teams um vier verbliebene Plätze in der Gruppenphase, die am 3. Oktober beginnt. Dafür sind bereits drei weitere europäische Teams qualifiziert: G2 Esports, Fnatic und Rogue. Am ersten Tag der Play-Ins muss MAD gleich zwei Matches bestreiten. Neben dem Eröffnungsspiel um 10.00 Uhr wartet am Nachmittag noch das nordamerikanische Team Liquid. Mit weiteren Kontrahenten aus den Regionen Ozeanien und Türkei scheint Gruppe A eine lösbare Aufgabe für das spanische Team zu werden. Unicorns of Love, deren Organisation in Deutschland sitzt, aber ein Team in der osteuropäischen Liga LCL betreibt, hat in Gruppe B deutlich schwerere Aufgaben vor sich. Dort ist unter anderem das chinesische Team LGD Gaming vertreten, das wohl schon fest mit dem Gruppensieg und damit der direkten Qualifikation für die Hauptrunde rechnen kann. Nicht bei der WM dabei ist übrigens der größte Star der Disziplin, der Koreaner Lee ""Faker"" Sang-hyeok. Sein Team T1 schaffte es nicht, sich für die Play-In-Phase zu qualifizieren. Auch der Sieger der letztjährigen WM, FunPlus Phoenix, verpasste die Qualifikation. Die Weltmeisterschaft findet wegen der Corona-Pandemie in diesem Jahr unter besonderen Bedingungen statt. Angereiste Teams mussten 14 Tage in Einzelquarantäne verbringen und sich dabei unter erschwerten Bedingungen auf das Turnier vorbereiten. Eigentlich sollte es auch verschiedene Spielstätten in   geben - nun wird alles bis zum Finale aus einem Studio in Shanghai produziert. Auch das Finale wird in der größten Stadt Chinas gespielt, allerdings im brandneuen Pudong Fußballstadion. Es soll das erste Event in der auf knapp 34.000 Menschen ausgelegten Arena werden. Ob am 31. Oktober auch Live-Publikum vor Ort sein wird, blieb zunächst unklar. © dpa-infocom, dpa:200924-99-690480/4 China","sueddeutsche, DPA"
Sport. LoL-Profis bereiten sich in Quarantäne auf WM vor,no_author,2020-09-23 19:21:03,https://www.sueddeutsche.de/sport/sport-lol-profis-bereiten-sich-in-quarantaene-auf-wm-vor-dpa.urn-newsml-dpa-com-20090101-200923-99-682257,"Shanghai (dpa) - Ungewohntes Equipment, kein direkter Kontakt zu anderen Menschen und immer dieselben vier Wände: Unter diesen Bedingungen mussten sich alle zur League-of-Legends-Weltmeisterschaft nach   gereisten Teams zwei Wochen lang auf die wichtigsten Spiele des Jahres vorbereiten. Insgesamt vier Mannschaften der europäischen Liga LEC befanden sich nach Ankunft in Shanghai in einem Hotel in Einzelisolation. G2, Fnatic, Rogue und MAD Lions mussten sich so auf die WM vorbereiten. Für Mihael ""MikyX"" Mehle, Support-Spieler bei G2, war das ziemlich hart: ""Ich habe noch nie länger als einen Tag nur Zeit mit mir selbst verbracht"", sagte er im Gespräch mit der Deutschen Presse-Agentur. Die Trainingsspiele liefen für das Team G2 zuletzt auch nicht so erfolgreich wie erhofft. ""Ich denke, dafür kann man die Umstände verantwortlich machen, weil wir nicht einmal richtige Tische haben. Nur sehr kleine"", so MikyX. Auch die Stühle seien keine ergonomischen Gaming-Stühle, sondern gehörten zur Standard-Einrichtung des Hotels und sind für das stundenlange Spielen nicht optimal. Teambesprechungen gestalteten sich ebenfalls umständlich. ""Ich denke, es ist schwieriger, bestimmte Punkte mit dem Team zu besprechen"", sagte MikyX. Zwar könnten Bildschirmübertragungen bei der Analyse helfen, gemeinsam in einem Raum zu sitzen und den gleichen Bildschirm zu benutzen, sei aber um einiges entspannter. Anna Baumann, Geschäftsführerin von Rogue, erzählte während der Einzelquarantäne auf Twitter von ihren Erfahrungen. In einem Video zeigte sie am zehnten Quarantäne-Tag, wie sie sich auf die weite Reise vorbereitet hatte und motiviert blieb. Die Zeitverschiebung von sechs Stunden wirkte sich dabei ebenfalls auf ihre Arbeit aus. ""Das bedeutet, dass meine Arbeitstage umso länger sind, weil viele Telefongespräche früh morgens oder spät abends stattfinden."" Baumann sei sehr stolz auf ihr Team, das trotz der Umstände die Stimmung aufrechterhält. ""Es ist wirklich hart, für 14 Tage allein mit sich selbst zu sein."" Nach den zwei Wochen Quarantäne wechseln die Teams nun in ein normales Hotel und können gemeinsam in einem Raum trainieren. Für diese Zeit hat MikyX noch keine besonderen Pläne. ""Es gibt die Möglichkeit für Teamaktivitäten, die unser Manager vorgeschlagen hat. Und ich denke, wir werden zum Essen viel in Restaurants gehen."" Am meisten freue er sich aber darauf, wieder gemeinsam trainieren zu können, bevor am 25. September die WM startet. © dpa-infocom, dpa:200923-99-682257/2 China","sueddeutsche, DPA"
Finanzen. Die wichtigsten Kryptowährungen der Welt,no_author,2020-09-24 11:58:44,https://www.sueddeutsche.de/wirtschaft/finanzen-die-wichtigsten-kryptowaehrungen-der-welt-dpa.urn-newsml-dpa-com-20090101-200924-99-690323,"Frankfurt/Main (dpa) - Krypto- oder Digitalwährungen gibt es noch nicht besonders lange. Entstanden sind sie mit der großen Finanzkrise vor etwas mehr als zehn Jahren. Die neuartigen Anlageformen haben viele Fans, aber auch zahlreiche Gegner. Befürworter schätzen vor allem die Freiheit vor staatlichem Zugriff, Kritiker sehen genau darin ein Einfallstor für Missbrauch. Das soll sich ändern: Die EU-Kommission will das bisher weitgehend ungeregelte Digitalgeld regulieren. Welche Kryptowährungen wären betroffen? Ein Überblick: - BITCOIN: Der Bitcoin ist die bei weitem älteste und bekannteste Digitalwährung. Er hat zudem mit aktuell etwa 60 Prozent den größten Marktanteil unter den derzeit rund 7000 Kryptowährungen. Entstanden ist der Bitcoin zu Zeiten der Finanzkrise 2008. Sein Erfinder ist bis heute nur unter einem Decknamen bekannt. Wichtigste Merkmale des Bitcoin sind seine dezentrale Organisation und die Verwendung der Datenbanktechnik ""Blockchain"". Beides zusammen sichert den Bitcoin-Nutzern ein hohes Maß an Anonymität: Zahlungen in Bitcoin sind praktisch nicht nachzuverfolgen. - ETHER: Ether ist nach Bitcoin die zweitgrößte Digitalwährung der Welt. Ihr Marktanteil beträgt etwas mehr als zehn Prozent. Kennzeichnend für Ether ist zum einen die ebenfalls dezentrale Organisation des zugrundeliegenden Netzwerks Etherum. Zum anderen - und das ist ein wichtiger Unterschied zum Bitcoin - liegt ein Schwerpunkt von Ether auf ""intelligenten Verträgen"". Bei diesen sogenannten Smart Contracts handelt es sich im Grunde um kleine Computerprogramme, die Verträge nach der Zahlungsabwicklung quasi automatisch ausführen können. Ähnlich wie der Datenbanktechnik Blockchain wird Smart Contracts eine große Zukunft vorhergesagt. - TETHER: Tether gehört zu den ""Stable Coins"", deren Wert durch die Unterlegung mit klassischen Anlagen garantiert wird. Im Fall von Tether ist es die weltgrößte Währung US-Dollar. Dadurch wird jedoch eine wichtige Idee des Kryptowährungskonzepts verletzt, nämlich die Unabhängigkeit von staatlichen Institutionen. Dennoch - oder vielleicht gerade deshalb - erfreut sich Tether großer Beliebtheit. Ein Vorteil der Anbindung an den US-Dollar ist nämlich, dass der Kurs im Vergleich zu anderen Digitalwährungen weniger stark schwankt. Allerdings gab es in den vergangenen Jahren immer wieder Zweifel, ob die behauptete Deckung mit US-Dollar den Tatsachen entspricht. - LIBRA: Ähnlich wie Tether ist Libra eine Digitalwährung nach dem Prinzip ""Stable Coins"", jedoch mit zwei gewaltigen Unterschieden. Erstens: Es gibt sie noch gar nicht. Zweitens: Hinter Libra steht mit Facebook eines der mächtigsten Technologieunternehmen der Welt. Die Idee von Libra ist, einer Digitalwährung auf breiter Front den kommerziellen Durchbruch zu verschaffen. Das Problem: Staatliche Institutionen sind davon überhaupt nicht begeistert. Zwar untersuchen auch Staaten und Zentralbanken seit längerem, wie sie sich das Konzept digitaler Währungen nutzbar machen können. Sie lassen sich dabei aber nicht gerne das Zepter aus der Hand nehmen. Auf entsprechend großen Widerstand stößt daher die von Facebook initiierte ""Libra Association"" mit ihrem Vorhaben. - DIGITAL-YUAN: Schon länger arbeitet China an der digitalen Variante seiner Währung Yuan oder Renminbi. Das Vorhaben steht im klaren Gegensatz zu den freiheitlichen Ideen, die die Vordenker digitaler Währungen einst hatten. Denn eine staatlich unkontrollierte, dezentrale Währung mit anonymisierten Zahlungsvorgängen ist sicherlich nicht das, was die politische Führung der Volksrepublik im Sinn hat. Im Gegenteil dürfte ihr eher daran gelegen sein, Zahlungsvorgänge und damit verbundene Geschäfte möglichst engmaschig zu kontrollieren. Der Digital-Yuan kann damit als eine Art Gegenentwurf zur Ur-Kryptowährung Bitcoin angesehen werden. © dpa-infocom, dpa:200924-99-690323/2","sueddeutsche, DPA"
Agrar. Klöckner: Zaun keine Garantie gegen Schweinepest,no_author,2020-09-23 17:20:05,https://www.sueddeutsche.de/wirtschaft/agrar-kloeckner-zaun-keine-garantie-gegen-schweinepest-dpa.urn-newsml-dpa-com-20090101-200923-99-680778,"Berlin/Potsdam (dpa) - Im Kampf gegen die Afrikanische Schweinepest in   unterstützt Bundesagrarministerin Julia Klöckner einen geplanten festen Zaun zu Polen, warnt aber vor zu hohen Erwartungen. ""Ein Zaun kann helfen"", sagte die CDU-Politikerin. Er sei ein Baustein der Vorbeugung, aber keine Garantie. ""Deshalb ist es so wichtig, dass die Länder weitere wirksame Maßnahmen ergreifen"". Dazu gehörten die verstärkte Suche nach Wildschwein-Kadavern und gezieltes Jagen. Im Krisengebiet in Brandenburg gibt es nun 29 bestätigte Fälle bei Wildschweinen. Hausschweine sind weiterhin nicht betroffen. Die für Menschen ungefährliche Tierseuche ist auch Thema beim Treffen der Länder-Agrarminister an diesem Donnerstag und Freitag im Saarland. In Brandenburg laufen Vorbereitungen für einen festen Zaun an der Grenze zu Polen, wo die Schweinepest seit Monaten kursiert. Darauf dringen auch Landwirte und Jäger, die mobile Zäune für unzureichend halten. Klöckner begrüßte die Pläne und sagte generelle Unterstützung zu. Für die Finanzierung und Sicherung von Zäunen seien die Länder zuständig - möglich sei auch eine solidarischen Finanzierung durch die Gesamtheit der Länder gemäß einem bestehenden Schlüssel. Die Ministerin wandte sich aber gegen die Vorstellung, feste Zaunanlagen könnten die Ausbreitung Schweinepest sicher verhindern. So gebe es Tausende Pendler und Lastwagen, die täglich aus Polen und anderen Ländern mit der Tierseuche die Grenzen passierten. ""Zäune sind niemals völlig dicht, und urbanes Gebiet nicht vollständig in den Zaun integriert."" Zudem könne die Schweinepest jederzeit auch durch Menschen in nicht betroffene Gebiet eingeschleppt werden. Der Vorsitzende der Länder-Agrarminister, Saar-Ressortchef Reinhold Jost (SPD), sagte der Deutschen Presse-Agentur: ""Wichtig ist, dass wir uns über die nationale Tragweite dieser Herausforderung klar werden."" Weitere feste Wildschweinschutzzäune entlang der Grenze zu Polen seien sinnvoll. ""Es wäre wünschenswert, wenn sich diese Geschichte möglichst lückenlos umsetzen lässt."" Das sei aber teils schwierig, weil auch Privatgrundstücke betroffen seien. Jost forderte zudem eine intensive Wildschweinjagd, auch nachts. Am 10. September war der bundesweit erste Fall bei einem toten Wildschwein in Brandenburg bestätigt worden. Hausschweine sind bisher in   nicht betroffen. Die Länderminister unterstützen von Klöckner angesprochene mögliche Hilfen - etwa für Lagerhaltung bei Landwirten oder Liquiditätsprogramme. Es gehe jetzt um ""schnelle und zielgerichtete"" Schadensbegrenzung, sagte Jost. Unter anderem China als wichtiger Absatzmarkt hat einen Importstopp für Schweinefleisch aus Deutschland verhängt. Jost betonte zugleich, es sei wichtig, die Exportabhängigkeit und möglichst auch den Tierbestand in Deutschland zu senken. Die regionale Wirtschaft müsse in der Fleischerzeugung zugunsten von mehr kleineren und mittleren Betrieben gestärkt werden. © dpa-infocom, dpa:200923-99-680778/2 Brandenburg Deutschland","sueddeutsche, DPA"
Agrar - Saarbrücken. Agrarminister zu Schweinepest: Signal der Entschlossenheit,no_author,2020-09-24 16:11:11,https://www.sueddeutsche.de/wirtschaft/agrar-saarbruecken-agrarminister-zu-schweinepest-signal-der-entschlossenheit-dpa.urn-newsml-dpa-com-20090101-200924-99-694521,"Weiskirchen (dpa/lrs) - Im Kampf gegen die Afrikanische Schweinepest (ASP) in Brandenburg müssen Bund und Länder nach Ansicht des Vorsitzenden der Agrarministerkonferenz, Reinhold Jost (SPD), an einem Strang ziehen. ""Es muss jedem klar sein, dass es sich hier um eine nationale Herausforderung allerersten Ranges handelt"", sagte der saarländische Agrarminister am Donnerstag zum Auftakt des Ministertreffens im saarländischen Weiskirchen. Man könne es sich nicht erlauben, Streitereien über Zuständigkeiten oder Finanzierungen zu führen. ""Wir sind alle in der Verantwortung"": Bund, Land, Kommunen und Organisationen."" Die ASP, die vor zwei Wochen in Brandenburg ausgebrochen ist, muss nach Angaben von Bundesagrarministerin Julia Klöckner (CDU) so rasch wie möglich wieder eliminiert werden. ""Unser Ziel muss es sein, mit einer nationalen gemeinsamen Kraftanstrengung die Ausbreitung der ASP in andere Bundesländer und in den Haustierbestand zu verhindern und sie aus unserem Land wieder rauszubekommen"", sagte Klöckner der Deutschen Presse-Agentur. Zur Bekämpfung der ASP gebe es bereits einen Bund-Länder-Krisenstab, ein EU-Team mit Veterinärexperten vor Ort, eine Taskforce auf Arbeitsebene - ""und wir forschen parallel an einem Impfstoff"", sagte Klöckner. Aber auch die Bundesländer müssten ""ihre Hausaufgaben"" machen, betonte sie. Wichtig sei, dass ein Land wie Brandenburg, ""eine Koordinierungsfunktion"" übernehme: für seine Kommunen und Verbände, beispielsweise die Jäger. ""Die unterschiedlichen Zuständigkeiten müssen gebündelt sein"", sagte Klöckner.   werde frühestens dann wieder als ASP-frei gelten, wenn mindestens ein Jahr lang keine positiven Funde gemacht wurden. Das sehen Jäger und die Bauern genauso: Es brauche ""ein koordiniertes Vorgehen"" in einem zentralen Krisenstab, der die Aktivitäten über Ländergrenzen hinaus steuere, forderten die Verbände der deutschen Bauern und Jäger am Donnerstag. Insbesondere die Grenze zu Polen müsse ""wildschweinsicher"" werden. Dazu gehörten entsprechende Zäune um die Kernzone der Tierseuche: ""Hier besteht noch erheblicher Handlungsbedarf."" Ortskundige Jäger und Bauern müssten bei der Suche nach toten Wildschweinen mehr eingebunden werden, heißt es in der Erklärung des Deutschen Bauernverbandes (DBV) und des Deutschen Jagdverbandes (DJV). Die Entfernung der hochinfektiösen Kadaver ist entscheidend, um eine Ausbreitung der ASP einzudämmen. Um die Jagd auf die Schwarzkittel zu intensivieren, seien zudem eine Erlaubnis für Nachtzieltechnik mit Infrarot-Aufhellern und Entschädigungen für Landwirte wegen einer intensiveren Wildschweinjagd nötig. Mit Blick auf mögliche wirtschaftliche Folgen des ASP-Ausbruchs rief Klöckner dazu auf, einen ""klugen, besonnenen Kopf zu bewahren"": ""Wir dürfen auch nicht die Lage schlechter reden als sie ist."" Lange habe man die Tierseuche, trotz erheblichen Drucks aus Polen, von Deutschland fernhalten können. ""Glücklicherweise sind die Funde bei Wildschweinen bisher nicht weit verstreut. Und wir sind bei Hausschweinen ASP-frei."" Innerhalb Europas könnten Schweine außerhalb des Restriktionsgebietes nach wie vor verkauft werden - rund 70 Prozent der Menge des Exports gingen auf den europäischen Markt. Ein für deutsches Schweinefleisch wichtiges Exportland außerhalb der EU, China, hat dagegen einen Importstopp für deutsches Schweinefleisch verhängt. Bisher sei es weder der EU noch einem europäischen Land gelungen, dass sie mit China eine Regionalisierung (nur auf die Ausbruchsregion beschränkt) vereinbaren konnten. ""Wir sind in sehr intensiven Gesprächen"", sagte Klöckner. Aber jetzt müsse man ""den Markt beobachten und dann urteilen"": Denkbar seien Hilfen für Bauern bei privater Lagerhaltung und Liquiditätsprogramme der EU oder Entschädigungen der Länder. Preisverluste bei Schweinefleisch seien bereits deutlich, mittlerweile habe sich das Niveau aber stabilisiert. Zuvor seien die Preise zudem ""ungewöhnlich hoch"" gewesen, sagte die Ministerin. Zum Teil sei der Preisverfall zu Beginn aber zu schnell gegangen. ""Dass mancher im Handel prophylaktisch schon mal die Preise gesenkt hat, das schauen wir uns genau an."" ""Wir müssen uns jetzt unterhaken: Es geht darum, dass man entsprechende Möglichkeiten untereinander erkennt und sie auch nutzt"", sagte Jost. ""Wir müssen auch darüber reden, ob und inwieweit aufgrund der nationalen Tragweite auch eine nationale, unter Beteiligung des Bundes, vorgenommene Finanzierung von festen Zäunen"" entlang der Grenze derzeit zu Polen und möglicherweise später auch anderen Ländern möglich sei, sagte Jost. Die Tierseuche wurde inzwischen bei 32 toten Wildschweinen in Brandenburg nachgewiesen. Zum Beginn des Ministertreffens waren protestierende Bauern gekommen. Die Polizei sprach von rund 150 Traktoren und 200 bis 300 Teilnehmern. Mit der Aktion sollte unter anderem gegen die Reform der gemeinsamen Agrarpolitik der EU demonstriert werden, sagte Alexander Welsch vom Bauernverband Saar. ""Wir wollen keine weiteren Auflagen, ohne dass es frisches Geld gibt."" Zudem sei das geplante Insektenschutzgesetz den Landwirten ein Dorn im Auge. ""Wenn das Gesetz so kommt, dann werden wir Probleme bekommen, die Betriebe hier noch bei der Stange halten zu können"", sagte er. Im   gibt es gut 1200 landwirtschaftliche Betriebe. Deutschland Saarland","sueddeutsche, DPA"
Geschichte. Kalenderblatt 2020: 24. September,no_author,2020-09-23 23:55:00,https://www.sueddeutsche.de/wissen/geschichte-kalenderblatt-2020-24-september-dpa.urn-newsml-dpa-com-20090101-200914-99-550435,"Berlin (dpa) - Das aktuelle Kalenderblatt für den 24. September 2020: 39. Kalenderwoche, 268. Tag des Jahres Noch 98 Tage bis zum Jahresende Sternzeichen: Waage Namenstag: Gerhard, Rupert, Virgil HISTORISCHE DATEN 2019 - Die SPD-Bundestagsfraktion wählt Rolf Mützenich mit großer Mehrheit zu ihrem Vorsitzenden. Seit dem Rücktritt von Andrea Nahles hatte er kommissarisch amtiert. 2018 - Der Handelskrieg zwischen den USA und China eskaliert. Die USA belegen die Hälfte aller Waren aus China mit Extrazöllen von zunächst zehn Prozent. Ab 2019 sollen es 25 Prozent sein. Im Gegenzug weitet China Strafzölle von fünf bis zehn Prozent auf US-Einfuhren im Wert von 60 Milliarden US-Dollar aus. 2015 - Während der islamischen Wallfahrt nach Mekka (Saudi-Arabien) kommt es in dem nahe gelegenen Ort Mina zu einer Massenpanik. Dabei sterben nach Angaben der saudischen Regierung 769 Menschen, inoffizielle Berechnungen gehen von rund 2000 Todesopfern aus. 2010 - Unter dem Druck finanzieller Probleme erlaubt das sozialistische Kuba mehr privatwirtschaftliche Freiheiten in 178 Bereichen. Rund 500.000 Angestellte aus staatlichen Betrieben sollen entlassen werden und künftig selbstständig arbeiten. 2005 - Mit meterhohen Flutwellen und stundenlangen Regenfällen löst Hurrikan ""Rita"" an der US-Golfküste in den Bundesstaaten Texas und Louisiana schwere Überschwemmungen aus. Mindestens 119 Menschen sterben. 2002 - Die CDU-Vorsitzende Angela Merkel wird zur Vorsitzenden der Unionsfraktion gewählt. Damit steht erstmals in der Bundesrepublik eine Frau an der Spitze der größten Oppositionspartei im Parlament. 2000 - Die Amtszeit des französischen Präsidenten wird vom Jahr 2002 an von sieben auf fünf Jahre verkürzt. Für eine entsprechende Verfassungsänderung stimmen in einer Volksabstimmung 73 Prozent der Wähler. 1990 - Der Austritt der DDR aus dem Warschauer Pakt zum 3. Oktober 1990 wird besiegelt. Ein entsprechendes Protokoll unterzeichnen DDR-Abrüstungsminister Rainer Eppelmann und der Oberkommandierende des Warschauer Pakts, General Pjotr Luschew, in Ost-Berlin. 1960 - Die USA lassen in Newport News/Virginia ihren ersten atomgetriebenen Flugzeugträger, die USS Enterprise, vom Stapel. GEBURTSTAGE 1980 - Petri Pasanen (40), finnischer Fußballspieler, Werder Bremen 2004-2011 1970 - Bernd Kroschewski (50), deutscher Snowboarder, Weltmeister im Slalom 1997 1932 - Hannah Green (88), amerikanische Schriftstellerin (""Ich hab dir nie einen Rosengarten versprochen"") 1930 - Horst Sachtleben (90), deutscher Schauspieler (""Jenseits der Stille"") 1930 - Ingrid Bachér (90), deutsche Schriftstellerin (""Die Grube"") TODESTAGE 2015 - Ellis Kaut, deutsche Hörspiel- und Buchautorin, Erfinderin von ""Pumuckl"", geb. 1920 1920 - Peter Carl Fabergé, russischer Juwelier und Goldschmied, Schöpfer der Fabergé-Eier, geb. 1846 © dpa-infocom, dpa:200914-99-550435/2","sueddeutsche, DPA"
Prozesse - Regensburg. Handel mit gefälschten Produkten: Prozess vertagt,no_author,2020-09-24 10:49:59,https://www.sueddeutsche.de/panorama/prozesse-regensburg-handel-mit-gefaelschten-produkten-prozess-vertagt-dpa.urn-newsml-dpa-com-20090101-200923-99-681026," (dpa/lby) - Weil der Verteidiger erkrankt ist, ist ein Prozess um den Handel mit gefälschten Handy-Zubehörteilen vor dem Landgericht Regensburg verschoben worden. Der Prozess hätte am Donnerstag beginnen sollen. Ein neuer Termin stand noch nicht fest. Die Staatsanwaltschaft wirft dem angeklagten Unternehmer vor, entweder selbst oder durch einen von ihm beauftragten Mitarbeiter Tausende Produkte aus China und Australien bestellt und in Deutschland verkauft zu haben. Die Waren, darunter Kopfhörer und Ladekabel, waren entweder gefälscht oder für den deutschen Markt nicht zugelassen. Der Gesamtwert hätte bei Originalprodukten gut 1,2 Millionen Euro betragen. Der Tatvorwurf lautet Kennzeichenverletzung. Regensburg","sueddeutsche, DPA"
