title,author,date_published,url,article_text,source
Börsen. Dax vor Fed-Sitzung moderat im Plus,no_author,2020-09-16 18:17:12,https://www.sueddeutsche.de/wirtschaft/boersen-dax-vor-fed-sitzung-moderat-im-plus-dpa.urn-newsml-dpa-com-20090101-200916-99-582471,"Frankfurt/Main (dpa) - Vor dem am Abend erwarteten Zinsentscheid der US-Notenbank Fed haben sich die Dax-Anleger am Mittwoch weiter nur zögerlich aus der Deckung gewagt. Wie schon am Vortag hielt sich der Leitindex den Tag über nahe den 13.200 Punkten auf. Letztlich schaffte er aber ein positives Vorzeichen, indem er 0,29 Prozent höher bei 13.255,37 Punkten schloss. Der MDax gewann sogar 0,70 Prozent auf 27.691,99 Punkte. Als Stütze für die Kurse galten aktuelle Konjunktursignale. Die Industriestaatenorganisation OECD schätzt den coronabedingten Wirtschaftseinbruch in Europa und in den USA in diesem Jahr weniger dramatisch ein als zunächst erwartet. In China rechnet die Organisation nun sogar mit Wachstum statt schrumpfender Wirtschaftsleistung. Laut Analyst Pierre Veyret vom Broker ActivTrades machten sich die Anleger in Europa mit ihrem dennoch zögerlichen Auftreten bereits auf die US-Notenbank gefasst. Von der Fed wird erwartet, dass sie am Abend an ihrem Corona-Krisenkurs mit unverändertem Leitzins und bestätigten Maßnahmen festhält. Mit Spannung erwartet werden aber Aussagen zur neuen Strategie und ihren Prognosen. Im Dax gehörten die Aktien der Deutschen Post mit 1,9 Prozent zu den größten Gewinnern. Sie profitierten damit von starken Quartalszahlen des US-Kontrahenten Fedex vom Vorabend. Laut Analyst Neil Glynn von der Credit Suisse zeichneten die Amerikaner ein optimistisches Bild vom globalen Express-Verkehr. Für den größten Gesprächsstoff sorgten aber weiter die Aktien von Grenke. Nachdem sie am Vortag schon um fast 20 Prozent abgesackt waren, verschärften sie ihre Talfahrt mit einem Einbruch um nochmals 40 Prozent. Sie leiden neuerdings unter einer sogenannten Short-Attacke. Da half auch eine Stellungnahme vom Vorabend nicht, mit der sich der Leasinganbieter gegen Vorwürfe der Bilanzfälschung wehrte. Der Chemikalienhändler Brenntag, der wie Grenke im MDax notiert ist, stand mit einem Plus von 3,6 Prozent auf der anderen Seite des Index mittelgroßer Werte. Er will in diesem Jahr einen operativen Gewinn von mindestens einer Milliarde Euro erzielen. Der Kurs erreichte den höchsten Stand seit mehr als fünf Jahren. Zum 2015 aufgestellten Rekord fehlen nur noch etwas mehr als zwei Euro. Der Lichtkonzern Osram hat sich kurz vor Ende des Geschäftsjahrs wegen zuletzt besser laufender Geschäfte in China und den USA etwas optimistischer gezeigt. Die Aktien stiegen um 1,5 Prozent. Ein ähnlich hohes Plus gab es auch für Freenet nach einem positiven Kommentar der Berenberg Bank. Gesprächsstoff lieferte außerdem noch, dass Volkswagen laut einem Kreise-Bericht im ""Manager Magazin"" wieder mit einer Beteiligung an Sixt liebäugele. Die Papiere des Autozulieferers profitierten am Nachmittag davon und schlossen 4,6 Prozent höher. Dies bescherte ihnen ein Hoch seit drei Monaten. Im SDax wurden sie damit aber übertrumpft von Borussia Dortmund mit einem Kurssprung um 7,4 Prozent auf ein Hoch seit Juni. Hier sorgte die beschlossene Rückkehr von Fans in die Stadien für gute Stimmung. Auf europäischer Bühne ging der EuroStoxx 0,20 Prozent höher bei 3338,84 Punkten aus dem Handel. Der französische Cac 40 schloss knapp im Plus, der britische FTSE 100 aber verlor 0,4 Prozent. In New York wiederum lag der Dow Jones Industrial zuletzt mit 0,8 Prozent im Plus. Der Euro gab vor der US-Zinsentscheidung etwas nach. Zuletzt kostete die Gemeinschaftswährung 1,1835 US-Dollar. Die Europäische Zentralbank (EZB) setzte den Referenzkurs auf 1,1869 (Dienstag: 1,1892) Dollar fest. Der Dollar kostete damit 0,8425 (0,8409) Euro. Am Rentenmarkt gab die Umlaufrendite von minus 0,48 Prozent am Dienstag auf minus 0,49 Prozent nach. Der Rentenindex Rex stieg um 0,04 Prozent auf 145,57 Punkte. Der Bund-Future legte um 0,02 Prozent auf 174,05 Zähler zu. © dpa-infocom, dpa:200916-99-582471/6","sueddeutsche, DPA"
Tiere - Dresden. Schweinepest: Bauernverband sorgt sich um Exporte,no_author,2020-09-17 08:35:09,https://www.sueddeutsche.de/leben/tiere-dresden-schweinepest-bauernverband-sorgt-sich-um-exporte-dpa.urn-newsml-dpa-com-20090101-200917-99-596330," (dpa/sn) - Nach dem Nachweis der Afrikanischen Schweinepest in Brandenburg bangt der sächsische Landesbauernverband um das Exportgeschäft. Der Importstopp für deutsches Schweinefleisch in Länder wie China, Südkorea oder Japan stelle auch Sachsens Schweinezüchter vor Probleme, sagte Juliane Streubel, Referentin für tierische Erzeugung. In Sachsen gebe es kaum eigene Schlachthöfe, die meisten Tiere würden in andere Bundesländer wie Bayern oder Hessen geliefert. ""Und die Betriebe hängen fast alle am Export"", so Streubel. Der Landesbauernverband fordert daher, die Warenströme möglichst schnell umzulenken, so dass andere, nicht betroffene EU-Länder den Export an Drittstaaten übernehmen und deutsches Schweinefleisch innerhalb der EU vermarktet werden kann. Dort gelte das Prinzip der Regionalisierung, also ein Exportstopp nur für betroffene Regionen und nicht für das gesamte Land. ""Die Vermarktungsketten für Schweinefleisch müssen schnellstmöglich neu organisiert werden"", so Verbandspräsident Torsten Krawczyk. Zudem sorgt sich der Landesbauernverband um den Preis. Dieser sei in der vergangenen Woche - nach Bekanntwerden des ersten Falles von Schweinepest in   - auf 1,27 Euro pro Kilogramm Schlachtgewicht gesunken. Das sind den Angaben zufolge 20 Cent weniger als zuvor, zu Beginn des Jahres erzielten die Landwirte noch knapp zwei Euro pro Kilogramm. Mehr als 3000 Landwirte halten rund 669 000 Schweine im Freistaat. ""Die Sorge vor der Schweinepest ist schon seit geraumer Zeit groß"", sagte Streubel. Die Landwirte sieht der Verband gerüstet. ""Die Betriebe kennen die Sicherheitsmaßnahmen und halten sie ein."" Dazu gehören etwa eine Seuchenschutzmatte, der Wechsel von Kleidung im Stall und die Reinigung von Technik. Viele Futterfahrzeuge werden zudem außerhalb des Betriebsgeländes abgeladen, um eine Einschleppung zu verhindern. Zudem begrüßte der Landesbauernverband die Ankündigung der Landesregierung, eine Abschussprämie für Wildschweine in den grenznahen Kreisen Görlitz und Bautzen einzuführen. Sachsens Verbraucherschutzministerin Petra Köpping (SPD) hatte am Dienstag Vorsichtsmaßnahmen vorgestellt, um eine Ausbreitung der Afrikanischen Schweinepest (ASP) möglichst zu verhindern. Dazu zählt etwa die Anschaffung von etwa 30 Fanganlagen für Schwarzwild, ein 50 Kilometer langer stabiler Zaun für Seuchengebiete und die Beprobung von Wildschweinkadavern. Dresden Deutschland","sueddeutsche, DPA"
Forstwirtschaft - Düsseldorf. Holz aus Nordrhein-Westfalen ist begehrt in China,no_author,2020-09-18 12:41:27,https://www.sueddeutsche.de/wirtschaft/forstwirtschaft-duesseldorf-holz-aus-nordrhein-westfalen-ist-begehrt-in-china-dpa.urn-newsml-dpa-com-20090101-200918-99-614677," (dpa/lnw) - Nordrhein-Westfalens Forstwirtschaft hat im ersten Halbjahr 2020 die Exporte von Holz ins Ausland deutlich gesteigert. Wie das NRW-Statistikamt am Freitag mitteilte, lag der Wert des versandten Rohholzes - also der Baumstämme und grob zugerichteten Schnitthölzer - bei 65,6 Millionen Euro und damit ein Drittel höher als im Vorjahreszeitraum. Das Gewicht lag bei 903 000 Tonnen - pro Tonne wurden im Schnitt also 72,60 Euro gezahlt und damit weniger als zuvor. Die Hälfte der Exportmenge ging nach China, die andere Hälfte großteils in die Nachbarstaaten Belgien und Niederlande. Exportiert wurden vor allem Fichten- und Tannenhölzer. Düsseldorf","sueddeutsche, DPA"
Fußball. Zeitung: Real will Bale für 25 Millionen abgeben,no_author,2020-09-09 22:30:41,https://www.sueddeutsche.de/sport/fussball-zeitung-real-will-bale-fuer-25-millionen-abgeben-dpa.urn-newsml-dpa-com-20090101-200909-99-497587,"Madrid (dpa) - Zwischen dem walisischen Fußball-Nationalspieler Gareth Bale und   stehen die Zeichen auf Trennung. Eine Woche, nachdem Bale geäußert hatte, dass er sich eine Rückkehr in die   vorstellen könne, hat nun sein Verein Real Madrid laut der Tageszeitung ""Mundo Deportivo"" eine Ablösesumme von 25 Millionen für der 31 Jahre alten Bale ausgerufen. Einst hatte Bale die Königlichen noch 100 Millionen Euro Ablöse gekostet, nun will man ihn - da er von Trainer Zinedine Zidane nur selten in der Stammformation aufgeboten wurde und kaum noch eine Rolle spielte - von der Gehaltsliste streichen. ""Die Zeit wird zeigen, was passiert, aber ich glaube, die Entscheidung liegt vor allem in den Händen von Real Madrid"", hatte Bale zuvor dem Sender Sky Sport News gesagt. Er hatte den Club schon vor einem Jahr in Richtung China verlassen wollen. Real habe ihn aber nicht gehen lassen, berichtete der Waliser. © dpa-infocom, dpa:200909-99-497587/2 Real Madrid Premier League","sueddeutsche, DPA"
Auto - Leinfelden-Echterdingen. Studie: Corona-Krise kostet Autobranche weltweit Milliarden,no_author,2020-09-09 08:19:17,https://www.sueddeutsche.de/wirtschaft/auto-leinfelden-echterdingen-studie-corona-krise-kostet-autobranche-weltweit-milliarden-dpa.urn-newsml-dpa-com-20090101-200909-99-486045,"Stuttgart (dpa) - Die Corona-Krise hat die Autobranche weltweit Milliarden gekostet und tief in die roten Zahlen gedrückt. Einer Analyse des Beratungsunternehmens EY zufolge summierten sich die operativen Verluste der 17 größten Autokonzerne im zweiten Quartal auf fast elf Milliarden Euro - nach knapp 22 Milliarden Euro Gewinn im zweiten Quartal des Vorjahres. Nur sechs Hersteller mussten keine roten Zahlen verbuchen, einzig Tesla schnitt im Zeitraum April bis Juni sogar besser ab als im Vorjahr und sprang laut EY auch gleich an die Spitze der Rangliste der profitabelsten Autokonzerne. Vor sinkenden Umsätzen konnte sich der Analyse zufolge keiner der Hersteller im zweiten Quartal retten. Zusammen büßten sie fast 177 Milliarden Euro ein, das ist ein Rückgang um 41 Prozent im Vergleich zum Vorjahresquartal. Auch hier ist die Bandbreite allerdings groß und reicht von 5 Prozent Umsatzminus bei Tesla bis zu minus 57 Prozent bei Mitsubishi. Die drei deutschen Hersteller Volkswagen (-37 Prozent), Daimler (-29) und BMW (-22) lagen im Mittelfeld. ""Einen derartigen Einbruch bei Umsatz, Gewinn und Absatz hat es noch nie gegeben"", sagte der Leiter des Bereichs Automotive & Transportation bei EY, Constantin M. Gall, am Mittwoch. ""Die Pandemie hat die weltweite Automobilindustrie zeitweise fast zum Stillstand gebracht - mit entsprechend katastrophalen Folgen für die Umsatz- und Gewinnentwicklung."" Was den Absatz angeht, habe sich China im zweiten Quartal als wichtigster Stützpfeiler gerade auch für die deutschen Hersteller erwiesen. ""Alle drei deutschen Autokonzerne konnten im zweiten Quartal in China zulegen, während der Absatz in den anderen Regionen massiv einbrach. Der Anteil Chinas am weltweiten Absatz der deutschen Autobauer kletterte dadurch von 33 auf 51 Prozent"", sagte Gall. Zwar werde das dritte Quartal wieder deutlich besser ausfallen als das zweite, eine Rückkehr der Absatzzahlen auf das Vorkrisenniveau erwarten die EY-Experten aber frühestens 2022. An Werksschließungen und Arbeitsplatzverlusten führe kein Weg vorbei - allerdings noch nicht jetzt. ""Das große Erwachen wird wohl erst im nächsten Jahr kommen"", sagte EY-Autoexperte Peter Fuß. ""Dann wird es eine brutale Auslese geben.""","sueddeutsche, DPA"
Auto - Wolfsburg. Verkäufe des VW-Konzerns im August stärker abgerutscht,no_author,2020-09-18 11:24:51,https://www.sueddeutsche.de/wirtschaft/auto-wolfsburg-verkaeufe-des-vw-konzerns-im-august-staerker-abgerutscht-dpa.urn-newsml-dpa-com-20090101-200918-99-613497," (dpa) - Der Volkswagen-Konzern hat im August nach der zwischenzeitlichen Erholung im Juli wieder deutlich weniger Neuwagen verkaufen können. Im Vergleich zum Vorjahresmonat rutschten die weltweiten Auslieferungen um 6,6 Prozent auf 792 200 Fahrzeuge ab, wie das Unternehmen am Freitag in Wolfsburg mitteilte. Ein Grund dafür dürfte auch ein Sondereffekt sein: Der August 2019 war wegen vorgezogener Autokäufe vor der nächsten Stufe verschärfter Regeln für Abgastests in Europa zum September-Beginn stark verlaufen. Im Juli dieses Jahres hatten die Auslieferungen des größten Autokonzerns verglichen mit dem Vorjahr nur noch um 0,2 Prozent im Minus gelegen. Insgesamt brach der Absatz wegen der Corona-Krise seit dem Frühjahr stark ein. Besonders in China, dem Ursprungsland der Pandemie, lief es zuletzt aber wieder deutlich besser. Hier meldete Volkswagen ein Verkaufsplus von 3,5 Prozent zum August 2019, auf Jahressicht ist der Rückgang mit 11,6 Prozent aber immer noch beträchtlich. Konzernweit liegen die Auslieferungen seit dem Jahresbeginn um mehr als ein Fünftel (-21,5 Prozent) unter dem Wert für 2019. Bezogen auf den Monat August ist das Minus besonders groß in Nordamerika (-18,7), Westeuropa (-16,6) und Südamerika (-15,5). Im Nahen Osten und in Afrika waren die Werte mit plus 11,6 Prozent klar besser - hier sind die verkauften Stückzahlen aber vergleichsweise gering. Innerhalb des Konzerns schnitt die Kernmarke   Pkw um 6,5 Prozent schlechter ab als im August 2019. Besonders stark waren die Rückgänge bei Seat (-24,5) und dem Lkw-Hersteller Scania (-32,4). Audi lag 2,4 Prozent im Minus, Skoda 6,8 Prozent. Deutlich besser lief es bei Porsche, wo ein Zuwachs um 7,9 Prozent gelang. Auch die übrigen Luxusmarken Bentley, Bugatti und Lamborghini verkauften mehr Autos. Wolfsburg VW","sueddeutsche, DPA"
Auto. Studie: Corona-Krise kostet Autobranche weltweit Milliarden,no_author,2020-09-09 09:29:17,https://www.sueddeutsche.de/wirtschaft/auto-studie-corona-krise-kostet-autobranche-weltweit-milliarden-dpa.urn-newsml-dpa-com-20090101-200909-99-486179,"Stuttgart (dpa) - Die Corona-Krise hat die Autobranche weltweit Milliarden gekostet und tief in die roten Zahlen gedrückt. Einer Analyse des Beratungsunternehmens EY zufolge summierten sich die operativen Verluste der 17 größten Autokonzerne im zweiten Quartal auf fast elf Milliarden Euro - nach knapp 22 Milliarden Euro Gewinn im zweiten Quartal des Vorjahres. Nur sechs Hersteller mussten keine roten Zahlen verbuchen, einzig Tesla schnitt im Zeitraum April bis Juni sogar besser ab als im Vorjahr und sprang laut EY auch gleich an die Spitze der Rangliste der profitabelsten Autokonzerne. Vor sinkenden Umsätzen konnte sich der Analyse zufolge keiner der Hersteller im zweiten Quartal retten. Zusammen büßten sie fast 177 Milliarden Euro ein, das ist ein Rückgang um 41 Prozent im Vergleich zum Vorjahresquartal. Auch hier ist die Bandbreite allerdings groß und reicht von 5 Prozent Umsatzminus bei Tesla bis zu minus 57 Prozent bei Mitsubishi. Die drei deutschen Hersteller Volkswagen (-37 Prozent), Daimler (-29) und BMW (-22) lagen im Mittelfeld. ""Einen derartigen Einbruch bei Umsatz, Gewinn und Absatz hat es noch nie gegeben"", sagte der Leiter des Bereichs Automotive & Transportation bei EY, Constantin M. Gall, am Mittwoch. ""Die Pandemie hat die weltweite Automobilindustrie zeitweise fast zum Stillstand gebracht – mit entsprechend katastrophalen Folgen für die Umsatz- und Gewinnentwicklung."" Was den Absatz angeht, habe sich China im zweiten Quartal als wichtigster Stützpfeiler gerade auch für die deutschen Hersteller erwiesen. ""Alle drei deutschen Autokonzerne konnten im zweiten Quartal in China zulegen, während der Absatz in den anderen Regionen massiv einbrach. Der Anteil Chinas am weltweiten Absatz der deutschen Autobauer kletterte dadurch von 33 auf 51 Prozent"", sagte Gall. Zwar werde das dritte Quartal wieder deutlich besser ausfallen als das zweite, eine Rückkehr der Absatzzahlen auf das Vorkrisenniveau erwarten die EY-Experten aber frühestens 2022. An Werksschließungen und Arbeitsplatzverlusten führe kein Weg vorbei - allerdings noch nicht jetzt. ""Das große Erwachen wird wohl erst im nächsten Jahr kommen"", sagte EY-Autoexperte Peter Fuß. ""Dann wird es eine brutale Auslese geben."" © dpa-infocom, dpa:200909-99-486179/2","sueddeutsche, DPA"
"Außenhandel. Investitionen: EU-Firmen fordern ""großen Sprung"" von China",no_author,2020-09-10 10:50:34,https://www.sueddeutsche.de/wirtschaft/aussenhandel-investitionen-eu-firmen-fordern-grossen-sprung-von-china-dpa.urn-newsml-dpa-com-20090101-200910-99-498993,"Peking (dpa) - Für eine Einigung auf ein Investitionsabkommens mit der EU muss   nach Ansicht europäischer Firmen einen großen Sprung nach vorn machen. ""Die europäische Seite hat sehr deutlich gemacht, dass es China nicht in der Mitte treffen kann"", sagte Jörg Wuttke, Präsident der EU-Handelskammer, vor dem am Montag geplanten virtuellen EU-China-Gipfel mit Kanzlerin Angela Merkel als amtierende EU-Ratspräsidentin und Chinas Staats- und Parteichef Xi Jinping. Nach Darstellung Wuttkes gelten in   bereits faire Wettbewerbsbedingungen - sowohl für heimische als auch chinesische Firmen. In China sei dies dagegen noch immer nicht der Fall. ""Wir sind eine offene Marktwirtschaft, aber China ist verschlossen"", sagte Wuttke bei der Vorlage des jährlichen Positionspapiers der Kammer am Donnerstag in Peking. Deshalb sei es an Peking, ""die Lücke zu schließen"". Zu den Gesprächen wollen sich Merkel, der Präsident des Europäischen Rates, Charles Michel, und Kommissionspräsidentin Ursula von der Leyen per Videokonferenz mit Chinas Präsident Xi Jinping zusammenschalten. Eines der großen Themen wird - neben dem Streit um Chinas hartes Vorgehen in Hongkong und gegen die Uiguren - das Investitionsabkommen sein, über das bereits seit sechs Jahren vergeblich verhandelt wird. Es soll Chinas Markt weiter öffnen. Zwar hatte sich China zuletzt vor dem Hintergrund der zunehmenden Spannungen mit den USA optimistisch gezeigt, ein Abkommen mit der EU auf den Weg bringen zu können. Auch sehen die Europäer so etwas wie eine ""Charmeoffensive"" von chinesischer Seite. Kammer-Präsident Wuttke zeigte sich jedoch wenig zuversichtlich, dass ein wirklich umfassender Deal, der EU-Firmen zufrieden stelle, zu machen sei. Er sieht noch ""eine ziemlich große Kluft"". Eins sei klar: ""Wenn es kein robustes, umfassendes Abkommen ist, dann haben wir besser keins."" Wuttke zufolge schließt sich auch das Zeitfenster für eine Vereinbarung mit China. Es müsse eine Einigung in diesem Jahr geben. Dies begründete Wuttke damit, dass Peking nicht nur in den USA, sondern auch in EU-Ländern immer mehr politischer Gegenwind entgegenschlage - etwa wegen Menschenrechtsverletzungen. Ein Abkommen werde so immer schwieriger. Aus Sicht von Wuttke würde China selbst davon profitieren, sich weiter zu öffnen. Das Wirtschaftswachstum der Volksrepublik könne so einen deutlichen Schub erleben - und die Einkommen der 1,3 Milliarden Menschen stärker steigen. China würde es ""mit einem großen Sprung"" besser gehen. Die chinesische Wirtschaft bleibe bislang hinter ihren Möglichkeiten zurück. ""China könnte besser fahren."" China profitiere von ausländischen Investitionen, betonte Wuttke und verwies auf das Beispiel Shanghai. In der 24-Millionen-Metropole gebe es 60 000 ausländisch investierte Unternehmen, die ein Viertel der Wirtschaftsleistung ausmachten. Die Stadt beziehe ein Drittel seiner Steuereinnahmen von diesen Unternehmen, die jeden fünften Arbeitsplatz in Shanghai stellten. Trotz der zahlreichen Probleme durch die voranschreitende Entkopplung der USA und Chinas ist es laut Wuttke für ausländische Unternehmen kein realistisches Szenario, sich aus China zurückzuziehen. Schließlich trage die zweitgrößte Volkswirtschaft rund 30 Prozent zum globalen Wachstum bei. So profitierten europäische Firmen auch davon, dass China früher als andere Staaten die Corona-Pandemie unter Kontrolle gebracht habe. Die derzeitige Dynamik auf dem chinesischen Markt sei beeindruckend. Europäische Autobauer und auch zahlreiche Luxusmarken machten wieder gute Geschäfte. Chinas erfolgreicher Kampf gegen Corona bringe aber auch Probleme für europäische Firmen mit sich, sagte Wuttke. Wegen weiter bestehender Einreisebeschränkungen sei es für Unternehmen noch immer schwierig, Mitarbeiter zurück nach China zu bringen. Tausende steckten noch im Ausland fest. Auch Geschäftsreisen seien kaum möglich. So kämpften EU-Firmen mit Problemen bei der Visavergabe. Auch müssen sich Reisende, die nach China kommen, für 14 Tage in einem Hotelzimmer in Quarantäne begeben. Erst dann dürfen sie sich frei bewegen. © dpa-infocom, dpa:200910-99-498993/3 China Europa","sueddeutsche, DPA"
Gesundheit. Trump in Interview: Habe Corona-Gefahr heruntergespielt,no_author,2020-09-09 23:03:26,https://www.sueddeutsche.de/gesundheit/gesundheit-trump-in-interview-habe-corona-gefahr-heruntergespielt-dpa.urn-newsml-dpa-com-20090101-200909-99-497014,"Washington (dpa) - US-Präsident   hat nach eigenen Worten die Coronavirus-Gefahr absichtlich heruntergespielt, um keine Panik auszulösen. Zugleich geht aus Auszügen aus Interviews mit dem Journalisten Bob Woodward hervor, dass Trump bereits Anfang Februar informiert war, dass das Virus sich über Luft überträgt und eine höhere Sterberate als eine Grippe aufweist. Öffentlich verwies er in dieser Zeit dagegen auf niedrige Fallzahlen in den   und behauptete mehrfach, das Virus werde mit der Zeit einfach verschwinden. In den USA starben rund 190.000 Menschen nach einer Ansteckung mit dem Coronavirus - zum Teil auch weil sie Warnungen von Experten und Vorsichtsmaßnahmen wie Masken nicht ernst nahmen. Trump verteidigte seine Vorgehensweise. ""Das Letzte, was man will, ist, Panik im Land auszulösen"", sagte er. ""Wir wollen Zuversicht zeigen, wir wollen Stärke zeigen."" Zugleich verwies er darauf, Maßnahmen wie eine Einschränkung des Reiseverkehrs mit China ergriffen zu haben. Woodward genießt im US-Journalismus den Status einer Legende, seit er und sein Kollege Carl Bernstein eine entscheidende Rolle im Watergate-Skandal spielten, der Präsident Richard Nixon 1974 den Job kostete. Sein neues Buch ""Rage"" (etwa: Wut) erscheint erst kommende Woche. Der Sender CNN berichtete aber über das Buch vorab und veröffentlichte auch kurze Audio-Mitschnitte aus den Interviews. Darauf ist unter anderem zu hören, wie Trump am 19. März nach der Einleitung ""Um ehrlich mit Ihnen zu sein, Bob"" sagt: ""Ich wollte es immer herunterspielen. Ich spiele es auch immer noch gern herunter, weil ich keine Panik erzeugen will."" In einem Gespräch am 7. Februar sagte Trump den Aufnahmen zufolge: ""Das ist tödliches Zeug."" Menschen müssten nicht erst Kontaktflächen anfassen, um sich anzustecken: ""Man atmet einfach Luft ein, und das ist, wie es sich überträgt."" Die Krankheit sei auch ""tödlicher"" als die Grippe, die pro Jahr 25.000 bis 30.000 Amerikaner das Leben koste. ""Wer hätte das jemals gedacht, richtig?"", bemerkte der Präsident dazu. Ende Februar sprach Trump unterdessen bei einer Pressekonferenz im Weißen Haus davon, wie wichtig es sei, sich oft die Hände zu waschen und nicht jeden Griff anzufassen - und dass man sich der Krankheit gegenüber genauso wie bei einer Grippe verhalten sollte. Zugleich behauptete er öffentlich, dass die Sterberate niedriger als bei einer Grippe sei. Schon vor Trumps Äußerungen sagte seine Sprecherin Kayleigh McEnany: ""Der Präsident hat die amerikanische Öffentlichkeit nie über Covid belogen."" Es gehöre aber zu seinen Aufgaben, dafür zu sorgen, dass die Bevölkerung die Ruhe behalte. ""Der Präsident hat das Virus nie heruntergespielt. Der Präsident hat Ruhe ausgestrahlt. Er war hoffnungsvoll"", sagte McEnany. Trumps Herausforderer im Rennen ums Weiße Haus, Joe Biden, griff den Präsidenten unterdessen scharf an. ""Er wusste, wie tödlich es ist und hat es gezielt heruntergespielt. Schlimmer noch, er hat das amerikanische Volk angelogen."" Zehntausende Menschenleben hätten gerettet werden können, wenn Trump schneller gehandelt hätte, sagte Biden. © dpa-infocom, dpa:200909-99-497014/3 Donald Trump USA","sueddeutsche, DPA"
