title,author,date_published,url,article_text,source
USA haben wohl 200.000 Schutzmasken abgefangen . Berlins Innensenator spricht von „moderner Piraterie“,Alexander Fröhlich,"03.04.2020, 20:45 Uhr",https://www.tagesspiegel.de/wissen/usa-haben-wohl-200-000-schutzmasken-abgefangen-berlins-innensenator-spricht-von-moderner-piraterie/25712976.html,"Eine vom Land Berlin  soll von den USA abgefangen und in die Vereinigten Staaten umgeleitet worden sein. Das erfuhr der Tagesspiegel aus Berliner Sicherheitskreisen. Berlin hatte bei dem Hersteller Atemschutzmasken mit den Schutzklassen FFP2 und FFP3 bestellt, die Einsatzkräfte und Pflegepersonal vor Ansteckung mit dem Coronavirus schützen. Es soll sich um eine Lieferung von 200.000 Schutzmasken handeln.  Berlins Innensenator Andreas Geisel (SPD) bestätigte am Nachmittag, dass die Masken in Bangkok „konfisziert“ worden seien und deshalb nicht ihr eigentlich Ziel - Berlin - erreicht hätten. „Wir betrachten das als Akt moderner Piraterie. So geht man mit transatlantischen Partnern nicht um“, sagte der Innensenator. Auch in globalen Krisenzeiten sollten „keine Wildwest-Methoden“ herrschen, sagte Geisel: „Ich fordere die Bundesregierung auf, bei den USA auf die Einhaltung internationaler Regeln zu drängen.“ Auch Berlins Regierender Bürgermeister Michael Müller (SPD) äußerte sich: „Das Handeln des US-Präsidenten ist alles andere als solidarisch und verantwortungsvoll“, sagte Müller. „Es ist unmenschlich und inakzeptabel.“ Nach Tagesspiegel-Informationen wurden die Masken von der Berliner Polizei beim Hersteller 3M bestellt. Produziert wurden die bestellten Masken in einem 3M-Werk der US-Firma in China. Auf dem Flughafen in Bangkok sollte die Ware umgeladen werden und per Luftfracht nach Deutschland geflogen werden. Stattdessen wurde die Lieferung von Bangkok direkt in die USA gebracht. Polizeipräsidentin Barbara Slowik sagte dem Tagesspiegel: „Wir haben eine Bestellung über 400 000 FFP2-Masken eines amerikanischen Herstellers aufgegeben.“ Eine Teillieferung über 200 000 FFP2-Masken seit auf dem Flughafen in Bangkok konfisziert worden. „Wir gehen davon aus, dass dies im Zusammenhang mit dem Ausfuhrverbot der US-Amerikanischen Regierung steht.“ Das Unternehmen selbst widersprach auf Anfrage des Tagesspiegel dieser Darstellung. Ein für Europa zuständiger Sprecher sagte: „Wir wissen nichts von einer Bestellung der Berliner Polizei für 3M-Masken, die aus China kommen.“ Und das Weiße Haus erklärte dem Online-Portal T-Online, die  , die in ein anderes Land geliefert werden sollten. Aber die Feuerwehr musste bereits abgelaufene Atemschutzmasken aus dem Lager holen. Die Ausgabe der Masken und von Desinfektionsmitteln ist streng limitiert. Auch Deutschland hat strenge Regeln über An- und Verkauf von Masken erlassen. Der Krisenstab aus Gesundheits- und Innenministerium hat ein Exportverbot für Schutzkleidung – darunter OP- und FFP-Masken – verhängt.  Mindestens ein Lkw mit entsprechender Ladung wurde bereits an der Grenze zur Schweiz gestoppt. Die NZZ  , dass in dem Laster rund 240.000 Schutzmasken geladen waren. Zuvor hatte auch Frankreich die USA beschuldigt, Schutzmasken aus China weggekauft zu haben. ""Die US-Regierung hat keine einzige Maske gekauft, die von China an Frankreich geliefert werden sollte"", sagte ein US-Regierungsvertreter der Nachrichtenagentur AFP. Die Präsidenten von drei französischen Regionen hatten den USA unsolidarisches Verhalten vorgeworfen, auch Kanada lässt solche Berichte prüfen. Eine Regierungssprecherin in Paris sagte am Freitag, es gebe ""weltweite Spannungen"" auf dem Markt für Schutzbekleidung. Der US-Regierungsvertreter, der anonym bleiben wollte, nannte die Vorwürfe aus Frankreich ""komplett falsch"". Sie kommen unter anderem aus den beiden am meisten betroffenen Regionen im Grenzgebiet zu Deutschland und dem Pariser Großraum. Frankreich zählt inzwischen fast 5400 Corona-Tote, die USA mit ihrer rund fünf Mal so großen Bevölkerung mehr als 5900. ""Wir haben uns von Amerikanern, die uns überboten haben, eine Lieferung wegschnappen lassen"", sagte etwa die Präsidentin der französischen Hauptstadtregion Ile-de-France, Valérie Pécresse, im Fernsehsender LCI. Der Präsident der an Deutschland angrenzenden Region Grand Est, Jean Rottner, betonte, die Amerikaner würden von Frankreich bestellte Masken ""auf dem Rollfeld"" in China aufkaufen: ""Sie zücken Bargeld und zahlen drei oder vier Mal so viel wie unseren Bestellpreis."" Auch die südliche Provinz Provence-Alpes-Côte d'Azur bestätigte, von solchen Vorfällen gehört zu haben. Der französische Premierminister Edouard Philippe sprach von ""echten Schwierigkeiten"" beim Beschaffen von Schutzmasken und einer ""beträchtlichen Nachfrage der Vereinigten Staaten in China"". Französische Bestellungen würden ""nicht immer geliefert"", sagte er, ohne weitere Details zu nennen. Frankreich hat mehr als eine Milliarde Schutzmasken in China bestellt. Vorwürfe an die USA sind inzwischen auch in kanadischen Medien laut geworden. Premierminister Justin Trudeau ordnete an, die ""besorgniserregenden"" Berichte zu überprüfen. Er könne die riesige Nachfrage aus den USA verstehen, sagte Trudeau mit Blick auf die mehr als 5900 Todesfälle im Nachbarland. Aber auch in Kanada sei die Lage ernst. ""Wir müssen sicherstellen, dass für Kanada bestimmte Ausrüstung nach Kanada kommt und dort bleibt"", betonte er. Wegen der Coronavirus-Krise gibt es in vielen Ländern Engpässe bei medizinischer Ausrüstung. Es mangelt vor allem an Profi-Schutzmasken, wie sie von Ärzten und Krankenschwestern sowie Altenpflegern benötigt werden. Zunehmend werden auch in der Bevölkerung Schutzmasken nachgefragt  Als erstes Land in Europa hatte Österreich eine Pflicht zum Tragen eines Mund-Nase-Schutzes für Supermärkte angekündigt, die Auflage gilt ab Montag. Einzelne deutsche Gemeinden wie Jena in Thüringen zogen nach. In Deutschland hatte das Robert-Koch-Institut (RKI) am Donnerstag seine Einschätzung für das Tragen von Mundschutz geändert.   Wissenschaftlich belegt sei das aber nicht. Zuvor hatte das RKI den Mundschutz nur Menschen mit akuten Atemwegserkrankungen empfohlen. Nicht jeder, der mit Sars-CoV-2 infiziert ist, bemerke das auch, hieß es vom RKI. Manche Infizierte erkrankten gar nicht, könnten den Erreger aber trotzdem weitergeben. Regeln zum Husten- und Niesen, zur Händehygiene und zum Mindestabstand sollten auch mit Masken weiterhin eingehalten werden. Mit Verweis auf eine neue Studie empfiehlt nun der Virologe Christian Drosten ebenfalls allen, auch einfache Masken zu tragen.  in China wegen des Coronavirus bestellte Lieferung von Schutzausrüstung  USA hätten keine Masken beschlagnahmt Zwar versichern die Berliner Behörden, noch reiche die Schutzausrüstung.  am Sonntag hatte berichtet . Wenn Menschen - auch ohne Symptome - vorsorglich eine Maske tragen, könnte das das Risiko einer Übertragung von Viren auf andere mindern, hieß es auf der Internetseite der Bundesbehörde.",tagesspiegel
Coronavirus in Berlin . Blog-Archiv vom 24.03. bis 06.04.,no_author,"06.04.2020, 18:54 Uhr",https://www.tagesspiegel.de/berlin/coronavirus-in-berlin-blog-archiv-vom-24-03-bis-06-04-/25720482.html,Dies ist ein archivierter Blog. Die aktuellen Entwicklungen zur Coronavirus-Pandemie in Berlin finden Sie  in diesem Newsblog.,tagesspiegel
200.000 Atemschutzmasken doch nicht konfisziert . Lieferung für Berliner Polizei wurde in Thailand zu besserem Preis aufgekauft,Alexander Fröhlich,"04.04.2020, 18:06 Uhr",https://www.tagesspiegel.de/berlin/200-000-atemschutzmasken-doch-nicht-konfisziert-lieferung-fuer-berliner-polizei-wurde-in-thailand-zu-besserem-preis-aufgekauft/25715448.html,"Die von der Berliner Polizei bestellten Atemschutzmasken sind nicht von den USA sichergestellt worden, sondern sollen einfach zu einem besseren Preis aufgekauft worden sein - von wem genau, ist noch unklar. Offiziell hieß es von der Polizei, es sei noch unklar, wie es dazu kommen konnte und was genau abgelaufen in Thailand. Zugleich korrigierte eine Sprecherin der Polizei am Samstag auf Anfrage die Angaben von Innensenator Andreas Geisel (SPD). Am Freitag hatte Geisel noch erklärt, eine   sei konfisziert worden. Zugleich warf Geisel den USA „Wildwest-Methoden“ und einen „Akt moderner Piraterie“ vor. „Wir gehen im Augenblick davon aus, dass dies im Zusammenhang mit dem Ausfuhrverbot für Masken der US- amerikanischen Regierung steht“, sagte der Innensenator. Am Samstag erklärte die Polizei auf Anfrage, dass es wohl doch anders gewesen sein könnte. Von „Konfiszieren“, also von Staats wegen beschlagnahmen oder einziehen, war keine Rede mehr. Die Polizeisprecherin sagte, bei dem langjährigen deutschen Vertragspartner der Polizei seien 400.000 Masken der Schutzklasse FFP2 eines amerikanischen Herstellers bestellt worden. Dabei handelt es sich nach Tagesspiegel-Informationen um den US-Hersteller 3M, der auch in China produziert. Die neue Sprachregelung der Behörde lautet nun; „Die Lieferung ist nach Aussage unseres Vertragspartners in Thailand zurückgehalten und umgeleitet worden.“ Und die Sprecherin sagte: „Unser Vertragspartner sorgt für Ersatz.“ Geisels Sprecher sagte: ""Der Händler hat die Polizei informiert, dass die Lieferung aufgrund einer US-Direktive storniert und das Frachtflugzeug mit der Lieferung nicht nach Deutschland, sondern in die USA geflogen ist."" Nach Tagesspiegel-Informationen ist die interne Sprachregelung der Polizei, dass die für die Berliner Polizei bestimmte Ware in Thailand aufgekauft wurde. Die verbindlich zugesagte   sei „im letzten Moment an einen anderen Käufer umgeleitet worden“. Intern ist unter Berufung auf den deutschen Händler und Vertragspartner auch die Rede davon, dass die Ware an die USA ging - ob an eine Firma oder an staatliche Stellen, blieb unklar. Thailand könnte aber auch selbst den Verkauf an Berlin gestoppt haben. Oder ein gewiefter Zwischenhändler könnte auf einen größeren Profit aus gewesen sein. Die Polizei versucht nun, den genauen Hergang aufzuarbeiten. „Wir sind dabei, die Details zu klären“, sagte der Sprecher der Innenverwaltung. Momentan lägen noch keine Informationen vor, was genau auf dem Flughafen in der thailändischen Hauptstadt Bangkok passiert ist. „Wir versuchen jetzt herauszufinden, wie die Kette von Bestellung, Produktion und Lieferung gelaufen und was genau auf dem Flughafen in Thailand passiert ist“, sagte Geisels Sprecher. Es sei eine Herausforderung, vertrauenswürdige Anbieter zu identifizieren und von den vielen unseriösen Akteuren zu unterscheiden, heißt es intern bei der Berliner Polizei. Der Ausfall der Lieferung führt nun zu Engpässen. Die Polizeiführung mahnte die Beamten, „die uns noch zur Verfügung stehenden Schutzmasken verantwortungsbewusst und gezielt“ einzusetzen.    Momentan kostet eine Maske, für die früher etwa 50 Euro-Cent fällig wurden, um die 6 Euro. Bei 400 000 Masken kommen so rund 2,4 Millionen Euro zusammen statt vor der Corona-Pandemie 200 000 Euro. Die Berliner Opposition kritisierte den Innensenator hart. CDU-Fraktionschef Burkard Dregger warf Geisel eine „bewusste Irreführung der Berliner“ vor. „Die USA haben keine Möglichkeiten, Schutzausstattung auf fremden Territorium zu beschlagnahmen“, sagte Dregger. Der Senat suche nur einen Schuldigen, „um seine eigene Unfähigkeit bei der Beschaffung von Schutzausrüstungen zu verschleiern“. Der Senat habe für die Krise nicht vorgesorgt. „Und jetzt zeigt er sich nicht in der Lage, in der Krise Material zu beschaffen“, sagte Dregger. Der Senat müsse sich das Geschäftsgebaren anderer einstellen und direkt vor Ort die Beschaffungen durchführen. FDP-Innenexperte Marcel Luthe sagte, der Senat versage bei der Beschaffung – und „ Größen der internationalen Politik wie Berlins Innensenator Geisel schieben anderen die Schuld zu und fabulieren von Piraterie durch die USA, um antiamerikanische Klischees zu bedienen“. Auch das Unternehmen 3M wies die Darstellung des Innensenators bereits am Freitagabend zurück. „Wir wissen nichts von einer Bestellung der Berliner Polizei für 3M-Masken, die aus China kommen“, sagte ein Sprecher dem Tagesspiegel. „3M hat keine Beweise, die darauf hindeuten, dass 3M-Produkte beschlagnahmt worden sind“, hieß es. „3M hat keine Unterlagen über eine Bestellung von Atemschutzmasken aus China für die Berliner Polizei.“ Und das Weiße Haus  , die USA hätten keine Masken beschlagnahmt, die in ein anderes Land geliefert werden sollten. US-Präsident Donald Trump kündigte am Freitagabend (Ortszeit) in Washington an, seine Regierung wolle den Export knapper medizinischer Schutzausrüstung wegen der Ausbreitung des Coronavirus verbieten. Verhindert werden solle etwa der Export von Atemschutzmasken, von Operationshandschuhen und anderen Produkten. Zudem soll 3M Bestellungen der US-Behörden für Schutzmasken, die in China hergestellt werden, mit Priorität bearbeiten. von der Berliner Polizei bestellte Lieferung von 200.000 Atemschutzmasken Lieferung von 200.000 von insgesamt 400.000 FFP 2-Masken erklärte dem Portal T-Online",tagesspiegel
Eng an Chinas Seite . Weltgesundheitsorganisation in der Kritik,Hinnerk Feldwisch-Drentrup,"11.04.2020, 12:08 Uhr",https://www.tagesspiegel.de/politik/eng-an-chinas-seite-weltgesundheitsorganisation-in-der-kritik/25733518.html,"In dieser Woche hat der Generalsekretär der Weltgesundheitsorganisation (WHO) eine überraschende Anschuldigung gemacht. Seit Beginn der Coronavirus-Pandemie, sagte der Äthiopier Tedros Adhanom Ghebreyesus, sei er Beleidigungen und rassistischen Verunglimpfungen aus Taiwan ausgesetzt. „Vor drei Monaten kamen diese Attacken“, sagte er, das dortige Außenministerium wüsste Bescheid. Beweise legte er nicht vor.  protestierte und forderte eine Entschuldigung wegen „Verleumdung“. Hintergrund von Tedros’ Behauptung dürften die Angriffe von US-Präsident Donald Trump sein, die WHO sei in der Coronakrise zu „chinazentriert“. Sie vertrete zu sehr die Interessen  . Mit Taiwan, das von China als eigener Landesteil angesehen wird und auf chinesisches Betreiben hin  , hätte Tedros einen Schuldigen ausgemacht für die fortwährende Kritik an der Weltgesundheitsorganisation. Dabei ist diese alles andere als unbegründet. Frühzeitig hatte sich seine Organisation hinter Chinas Führung gestellt. Als einige Staaten begannen, Einreiseverbote für Menschen aus China auszusprechen, bezeichnete die WHO diese Maßnahmen als unnötig.  Mehrfach lobte Generaldirektor Tedros China regelrecht für seine „totale“ Offenheit, „exzellente Leistung“ und sprach sogar davon, dass „die Welt in der Schuld Pekings“ stünde.  Nach Medienberichten stammt die erste bekannte Infizierung mit Sars-CoV-2 von Mitte November. Bereits im Dezember gab es offenbar Hunderte nun bestätigte Infektionen, um die Weihnachtstage wurde das Erbgut analysiert. Doch lange beschwichtigte die Weltgesundheitsorganisation unter Berufung auf Stellungnahmen des chinesischen Regimes: Mitte Januar erklärte sie noch, das Virus sei vermutlich nicht von Mensch zu Mensch übertragbar – erst Ende Januar korrigierte sie dies.  Dabei lagen chinesischen Behörden offenbar schon im Dezember Informationen vor, dass medizinisches Personal infiziert war – Experten aus Taiwan haben die WHO hierüber bereits im Dezember informiert. Doch vielfach verschloss die UN-Organisation ihre Augen vor der echten Lage in China – und lobte die Maßnahmen Pekings, obwohl viele Experten diese kritisch sahen. Ein Teil des Lobes dürfte dem Zweck gedient haben, dass Peking WHO-Experten ins Land reisen lässt, was zuvor nicht gelang.  Doch auch sonst gibt es enge Beziehungen: Tedros wurde 2017 mit Unterstützung Chinas gewählt. China ist einer der wichtigsten Partner seines Heimatlands Äthiopien, in dessen Regierung er zuvor über viele Jahre Minister war – mit Milliardenkrediten aus Fernost. „Angesichts eines vorher unbekannten Virus hat China die vielleicht ehrgeizigsten, agilsten und aggressiven Eindämmungsstrategien der Geschichte ausgerollt“, erklärte das Team der WHO-Experten im Februar nach ihrer Reise. Es handele sich um einen Ansatz „der ganzen Regierung und der ganzen Gesellschaft“, der eine stärkere Verteidigungslinie gegen die internationale Ausbreitung geschaffen habe. Dabei hatte sich das Virus bereits im Januar in mehreren Ländern ausgebreitet – als die WHO noch behauptete, es sei nicht übertragbar. Nach Medienberichten soll Peking außerdem von fünfzig Prozent mehr Infektionen wissen, als gemeldet wurden – die WHO jedoch behauptet, China habe alle Fälle gemeldet.  Vermutet wird auch, dass in Wuhan viel mehr Menschen gestorben sind. Auf die Frage, ob China Informationen verheimliche, erklärte WHO-Experte Bruce Aylward hingegen: „Nein, das machen sie nicht.“ Peking zeige, wie die Welt auf das Virus reagieren sollte – und dass eine Eindämmung möglich sei, erklärten WHO-Fachleute. „Es ist nicht überraschend, dass so etwas wirkt“, sagt hingegen Richard Neher, Virologe an der Uni Basel. Was die WHO ignorierte und wozu sie keine Daten sammelte, ist entscheidend: die Nebenwirkungen der Schritte.  Es gebe „erhebliche Menschenrechtsbedenken“, sagt Lawrence O. Gostin, der ein WHO-Kollaborationszentrum für globales Gesundheitsrecht an der Georgetown-Universität in Washington leitet. Die WHO erklärte auf Anfrage, sie habe „nicht genug Daten“, um dies einzuordnen.  „Indem die WHO Chinas Schritte in positivem Licht präsentiert, kann die chinesische Regierung ihre Propagandakampagne zur Vertuschung ihrer früheren Fehler als glaubwürdig erscheinen lassen“, sagt Steve Tsang, Direktor des China-Instituts an der SOAS Universität in London. Gleichzeitig würden so die menschlichen, gesellschaftlichen und ökonomischen Kosten der Maßnahmen ignoriert. Peking setzt ohnehin viel auf Zwang: Wenn infizierte Personen die Quarantäneregeln brechen, müssen sie für mindestens drei Jahre ins Gefängnis – in schweren Fällen droht die Todesstrafe, stellte der Oberste Volksgerichtshof klar.  Die WHO wollte hiervon offenbar nichts wissen. Die Bevölkerung habe „mit Mut und Hingabe“ reagiert, hieß es. „In China wurden keine Maßnahmen ergriffen, die nicht auch anderswo umgesetzt werden könnten“, behauptete Aylward sogar in einem Interview. Er berichtete auch, dass Menschen in China ihm immer gesagt haben, dass sie sich der gemeinsamen Sache hingäben. „Da schrillen bei mir die Alarmglocken“, sagt Mareike Ohlberg vom Mercator-Institut für Chinastudien.  Die Aussagen der WHO sieht sie als stark von den Interessen der Kommunistischen Partei beeinflusst. „Die offiziellen Aussagen der chinesischen Regierung und die von ihr stark gefilterten Aussagen unkritisch zu wiederholen, ist aus meiner Sicht respektlos gegenüber den Menschen in Wuhan und denen, die versuchen, die Krise zu dokumentieren“, sagt Ohlberg. Länder wie Südkorea oder Taiwan zeigen derzeit, dass man mit humaneren Methoden die Ausbreitung kontrollieren kann – andere wie  , welche dramatischen Auswirkungen unzureichendes Krisenmanagement hat.  Fragen zu Taiwan – das nicht Teil der WHO ist – wollte WHO-Mitarbeiter Aylward in einem Interview nicht beantworten. Später behandelte er Taiwan wie eine Provinz Pekings. Dies „verdeutlicht noch einmal, unter welchem Druck die WHO in der Taiwan-Frage stehen muss“, sagt Ohlberg. „Wir kümmern uns um die Armen“, erklärte Tedros – Politik würde die WHO nicht machen. Doch ihr Agieren zeigt das Gegenteil.  Dies nutzen Populisten wie US-Präsident Donald Trump aus. „Die WHO hat wirklich versagt“, erklärte er in einem Tweet und drohte, die Millionenzahlungen einzustellen. Die Bundesregierung hingegen sieht auf Nachfrage kein Problem: Der Austausch mit der WHO sei „gut eingespielt und vertrauensvoll“, erklärt eine Sprecherin dem Tagesspiegel. „Wir werden vielleicht nie ein klares Bild haben, wie das Virus sich ausgebreitet hat“, sagt Sophie Richardson von der Menschenrechtsorganisation Human Rights Watch. Wer starb, wer warum keine Behandlung erhalten hat. Die Welt lebe mit den Konsequenzen der Zensur des chinesischen Staates – Ähnliches könne sich in Zukunft wiederholen. „Aus Menschenrechtsperspektive ist Autoritarismus schlecht für die Gesundheit.“ Taiwan der Volksrepublik kein Mitglied der WHO sein darf die USA hingegen",tagesspiegel
Automarkt in der Coronakrise . VW-China-Chef warnt: „Müssen Geduld haben“,Henrik Mortsiefer,"01.04.2020, 13:15 Uhr",https://www.tagesspiegel.de/wirtschaft/automarkt-in-der-coronakrise-vw-china-chef-warnt-muessen-geduld-haben/25703792.html,"Volkswagen warnt vor einer zu schnellen Beendigung des Lockdowns in Deutschland und verweist auf die Erfahrungen in China. „Nach allem, was wir hier seit Ende Januar erlebt haben, muss man diese Geduld wahrscheinlich aufbringen. Sonst riskiert man einen zweiten Knock-out“, sagte Stephan Wöllenstein, Vorstandsvorsitzender der Volkswagen Group China,  . Gleichwohl könne er die wirtschaftliche und persönliche Ungeduld gut verstehen. „Wir haben acht bis zehn harte Wochen hinter uns – und gehen nun einen Weg zu einer kontrollierten Normalität“, sagte Wöllenstein.  Eine Lehre aus der Krise sei, „dass sich Länder früh auf eine Strategie festlegen und an dieser auch strikt festhalten sollten“, sagte der Manager. Die politischen Systeme seien zwar nicht vergleichbar, in China sei gleichwohl viel geleistet worden, um die Coronakrise wirksam zu bekämpfen.   Volkswagen verkauft 40 Prozent seiner Fahrzeuge in der Volksrepublik und blickt inzwischen optimistischer auf das laufende Jahr. Schon im Sommer sei damit zu rechnen, dass die Produktion wieder ein normales Vorkrisenniveau erreiche, sagte Wöllenstein „Tagesspiegel Background“. „Der Patient von gestern ist der Pfleger von heute“, sagte er mit Blick auf den massiven   im Januar und Februar. Die Prognose gelte aber unter Vorbehalt. Corona dürfe in China nicht erneut ausbrechen und die Weltwirtschaft dürfe die Erholung der chinesischen Wirtschaft nicht drosseln. Wöllenstein: „Außerdem dürfte ein Konjunkturprogramm der Regierung nötig sein, um die Binnennachfrage anzutreiben.“     „Tagesspiegel Background Mobilität & Transport“ Markteinbruch in China",tagesspiegel
