title,author,date_published,url,article_text,source
Berliner Firma feilscht mit Bundesregierung . Poker um acht Sattelschlepper voller Schutzmasken aus China,Kevin P. Hoffmann,"24.04.2020, 10:48 Uhr",https://www.tagesspiegel.de/berlin/berliner-firma-feilscht-mit-bundesregierung-poker-um-acht-sattelschlepper-voller-schutzmasken-aus-china/25768240.html,"Michael Sperling könnte verzweifeln. Denn eigentlich scheint der Geschäftsführer beim Maschinen- und Anlagenbauer Karl Rabofsky GmbH aus Marienfelde im Berliner Süden bisher alles richtig gemacht zu haben in der Coronakrise. Nun aber schienen starre Regeln der Behörden bei der Beschaffung von Ausrüstung den Erfolg zu vereiteln.  Die   ist ein bereits 1896 gegründeter Hersteller von Faltmaschinen und anderen Spezialanlagen für die Nahrungsmittel-, Auto- und Textilindustrie. Unter Sperlings Führung hat das Unternehmen mit Sitz im Gewerbegebiet an der Motzener Straße sehr flexibel reagiert und die Produktion schon vor Wochen umgestellt auf Schutzmasken, die nun alle Welt eher haben will als die Anlagen.  Weil die Firma nur 50 Mitarbeiter beschäftigt, kann sie allein aber unmöglich die gigantische Nachfrage stillen. Sie profitiert aber von ihren ausgezeichnet guten Kontakten zu Kunden in China. Das sind nämlich große Schutzmaskenhersteller, die Maschinen der Karl Rabofsky GmbH gekauft haben. Über diese Kontakte konnte das relativ kleine Unternehmen kürzlich schnell und zuverlässig 1,7 Millionen   aus China für die Kassenärztliche Vereinigung (KV) beschaffen – gegen Vorkasse bei den Lieferanten. Die KV bezahlte den Berlinern ein Mehrfaches der Summe für jede Maske, die in Vor-Corona-Zeiten für rund 50 Cent erhältlich gewesen wäre, noch am Tag der Lieferung. Dieser Großauftrag  .  Beflügelt von dem Erfolg, beteiligte sich der Mittelständler nun auch an einer noch größeren Ausschreibung des Bundesgesundheitsministeriums. Das will jetzt offenbar ein Vielfaches des ursprünglichen Preises aus Vor-Corona-Zeiten zahlen. Bedingung ist aber: Lieferanten können fünf Millionen Masken liefern und das schnell, bis zum kommenden Donnerstag, den 30. April. „Das können wir leider so nicht garantieren, weil wir beim Hersteller den kompletten Kaufpreis vorstrecken müssen. Banken helfen uns zwar, aber hier kommen wir an unsere Grenzen“, sagt Sperling. Sein Angebot an das Ministerium: Drei der fünf Millionen Masken gibt es bis Donnerstag, die verbleibenden zwei Millionen zwei Wochen später. Dann könne man womöglich auch über den Preis der Beschaffung sprechen. Doch darauf will sich das Ministerium in diesem „Open-House-Verfahren“ offenbar nicht einlassen, klagt Sperling. Der Auftrag wäre eine logistische Herausforderung. Eine Million verpackte Masken im Schutzstandard FFP2 benötigen etwa anderthalb große Lkw-Ladungen. ""Insgesamt bräuchten wir also Sattelschlepper für diesen Auftrag"", rechnet sich Sperling aus. Er hofft, dass er doch noch irgendwie mit der Regierung ins Geschäft kommt. Dieser 25-Millionen-Auftrag würde seiner kleinen Firma – das will der Mann nicht verhehlen – in der Krise helfen, Jobs zu sichern. Man darf also davon ausgehen, dass die Berliner die Masken zu einem geringeren Preis in China einkaufen können. Das Gesundheitsministerium teilte dem Tagesspiegel auf Anfrage mit: „Alle Angebote, die eingehen, werden sorgfältig geprüft und bearbeitet.“ Man bitte um Verständnis dafür, dass man zu einzelnen Angeboten keine Auskunft geben könne. Das Ministerium ist mittlerweile in einer etwas besseren Verhandlungsposition als noch Anfang März bis Anfang April, als für Deutschland bestimmte Schutzmasken beim Umladen   - wie Masken für die Berliner Polizei am Flughafen Bangkok. Seit März importierte das Ministerium rund 108 Millionen Masken. Und es noch weitere Millionen folgen - wenn wohl auch nicht mehr zu jedem Preis. Etwas mühsamer - aber sicher möglich - wäre es für das Unternehmen, die Masken in China einzukaufen, die Lieferung dann aber zu zerstückeln und an mehrere Kunden auszuliefern. Möglich wäre das zum Beispiel über die erst am Donnerstag eingerichtete Plattform   die die landeseigene Wirtschaftsagentur Berlin Partner in Zusammenarbeit mit mehreren Senatsverwaltungen entwickelt hat, um Händler und Käufer schneller zusammenzubringen. Hintergrund der Aktion ist die neue - wenn auch umstrittene - Pflicht zur Nutzung einer Schutzmaske im öffentlichen Personennahverkehr in Berlin ab Montag (27. April). Andere Länder haben ähnliche Regelungen, die auf unbestimmte Zeit gelten dürften. Das Portal richtet sich weniger an Privatpersonen als an Firmen und Einrichtungen, die große Stückzahlen benötigen – oder anbieten können, teilte Berlin Partner mit. Anbieter und Interessenten können auf diesem Wege in Verbindung treten und Liefer- sowie Zahlungsbedingungen aushandeln. Der eigentliche Verkauf werde nicht auf der Website abgewickelt. Karl Rabofsky GmbH Masken ging auch durch die Medien einfach weggekauft worden sind www.alltagsmasken.berlin,",tagesspiegel
Coronavirus in Deutschland und der Welt . Blog-Archiv vom 08. April bis 17. April,no_author,"17.04.2020, 14:48 Uhr",https://www.tagesspiegel.de/wissen/coronavirus-in-deutschland-und-der-welt-blog-archiv-vom-08-april-bis-17-april/25750534.html,Dies ist ein archivierter Blog. Die aktuellen Entwicklungen zur Coronavirus-Pandemie finden Sie  in diesem Newsblog.,tagesspiegel
Ranking der Pressefreiheit weltweit . Reporter ohne Grenzen kritisiert Chinas Zensur in Coronazeiten,no_author,"21.04.2020, 08:17 Uhr",https://www.tagesspiegel.de/gesellschaft/medien/ranking-der-pressefreiheit-weltweit-reporter-ohne-grenzen-kritisiert-chinas-zensur-in-coronazeiten/25758240.html,"Die Organisation Reporter ohne Grenzen (ROG) hat China in der   massive Verletzungen der Pressefreiheit mit fatalen Konsequenzen vorgeworfen. „Die Auswirkungen der fast totalen chinesischen Nachrichtenkontrolle, die im Zweifelsfall die Durchsetzung von Zensuranordnungen über den Gesundheitsschutz stellt, hat in der Coronakrise die ganze Welt zu spüren bekommen“, teilte die Organisation in Berlin mit. ROG nahm das Erscheinen der neuen „Rangliste der Pressefreiheit“ zum Anlass für seine Kritik. , vor Eritrea (178), Turkmenistan (179) und Nordkorea (180). Da die Corona-Pandemie erst unmittelbar nach Ende der Umfrage unter Medienschaffenden ausgebrochen ist, ist das Verhalten von Staaten in der Krise in die aktuelle Platzierung noch nicht eingeflossen. Immer dreister auftretende autoritäre Regime, repressive Gesetze gegen vermeintliche Falschmeldungen, populistische Stimmungsmache und die Erosion traditioneller Medien-Geschäftsmodelle stellen ROG zufolge die Pressefreiheit weltweit infrage. „Die Corona-Pandemie bündelt bestehende repressive Tendenzen weltweit wie ein Brennglas“, sagte Vorstandssprecherin Katja Gloger. Schon vor der aktuellen Krise seien „erschreckend viele Regierungen und politische Kräfte in ganz unterschiedlichen Ländern“ bereit gewesen, die Pressefreiheit ihrem Machtstreben unterzuordnen, kritisierte Gloger. Zu den wichtigsten Beispielen dafür gehörten neben China Saudi-Arabien und Ägypten: In diesen drei Staaten säßen derzeit weltweit die meisten Medienschaffenden wegen ihrer Arbeit im Gefängnis.  In der aktuellen Rangliste habe sich Deutschland um zwei Plätze vom 13. auf den 11. Platz verbessert. Im vergangenen Jahr habe es keine rechtspopulistischen Proteste von vergleichbarer Dimension wie im Spätsommer 2018 in Chemnitz (Sachsen) und Köthen (Sachsen-Anhalt) gegeben. Deswegen sei auch die Zahl der tätlichen Angriffe gegen Journalisten gesunken. 2019 zählte ROG mindestens 13 tätliche Angriffe auf Medienschaffende, 2018 waren es noch mindestens 22. Populistische und autoritäre Machthaber missbrauchen nach den Worten der Organisation Reporter ohne Grenzen (ROG) die Corona-Pandemie in vielen Ländern für eine weitere Einschränkung der Pressefreiheit. „Die Corona-Pandemie bündelt bestehende repressive Tendenzen weltweit wie ein Brennglas“, sagte die ROG-Vorstandssprecherin Katja Gloger. Immer unverhohlener versuchten Diktaturen, autoritäre und populistische Regime, unabhängige Informationen zu unterdrücken und eine undemokratische Weltsicht durchzusetzen. Als Beispiele nennt die Organisation in ihrem Bericht außer China auch Saudi-Arabien und Ägypten. In diesen drei Staaten ist die Zahl der Medienschaffenden, die im Gefängnis sitzen, laut ROG am höchsten. China versuche mit großem Aufwand, selbst jenseits seiner Grenzen eine „neue Weltordnung der Medien“ durchzusetzen. Unter dem Vorwand, „Fake News“ bekämpfen zu wollen, schränkten Länder wie Singapur und Benin die Medienfreiheit ein. In Russland, Indien, den Philippinen und Vietnam setzen demnach Troll-Armeen im Dienste der Regierenden selbst auf Desinformation, um die öffentliche Meinung zu lenken und kritische Medienleute zu diskreditieren. In den USA und Brasilien schürten demokratisch gewählte Präsidenten Feindseligkeit und Hass. Ob im Irak, im Libanon, in Chile, in Bolivien oder Ecuador - das von Populisten betriebene Misstrauen gegenüber Nachrichtenmedien habe sich 2019 vielerorts in Gewalt gegen Reporter entladen. Auch in Ländern wie Spanien, Italien und Griechenland schreckten nationalistische und rechtsextremistische Gruppen nicht vor direkten Drohungen zurück. Die Lage werde von schwindenden Vertriebs- und Anzeigenerlösen sowie steigenden Produktionskosten noch verschärft. Folge seien immer kleinere Redaktionen und eine zunehmende Medienkonzentration. Wer freien Zugang zu unabhängigen Informationen sicherstellen wolle, müsse sich gerade in schwierigen Zeiten dafür starkmachen, dass Journalisten ungehindert recherchieren und berichten könnten. Die Rangliste beruht laut ROG auf Befragungen und der Zahl registrierter Angriffe auf Journalisten. An oberster Stelle unter 180 Staaten stehen Norwegen, Finnland und Dänemark. Die Rangliste der Pressefreiheit vergleicht die Situation für Journalisten und Medien in 180 Staaten und Territorien auf der Grundlage eines Fragebogens sowie den von ROG ermittelten Zahlen von Übergriffen, Gewalttaten und Haftstrafen. Daraus ergeben sich für jedes Land Punktwerte, die im Verhältnis zu den Werten der übrigen Länder die Platzierung bestimmen. Die Befragung fand zwischen November 2019 und Januar 2020 statt, die Auswirkungen der Corona-Pandemie konnten im Wesentlichen nicht berücksichtigt werden. Tsp/dpa/KNA Corona-Krise China steht im weltweiten Länderranking auf dem viertletzten von 180 Plätzen",tagesspiegel
Exekutionen weltweit . Amnesty verzeichnet weniger Hinrichtungen,Andrea Dernbach,"21.04.2020, 05:59 Uhr",https://www.tagesspiegel.de/politik/exekutionen-weltweit-amnesty-verzeichnet-weniger-hinrichtungen/25757972.html,"Die Zahl der Hinrichtungen ist im vergangenen Jahr weltweit erneut kleiner geworden. Die Menschenrechtsorganisation Amnesty International,  , verzeichnete für 2019 einen erneuten Rückgang der Exekutionen um fünf Prozent in einem Jahr. 657 Hinrichtungen statt der noch 690 ein Jahr zuvor, so der am Dienstag veröffentlichte Bericht, sei nicht nur die geringste Zahl in einem Jahrzehnt, es setze sich auch ein seit 2015 anhaltender Trend fort.  Die Organisation weist allerdings darauf hin, dass das nur die Zahl ist, die sie aus offiziellen Quellen, Berichten von Angehörigen oder anderen Zeugen und Zeitungsberichten gewinnen konnte.  Man nehme nur Fälle in die Zählung auf, für die es eine nachvollziehbare Bestätigung gebe. Insofern läge die tatsächliche Zahl sicher höher als jene 657, die der Bericht verzeichnet.  Für China, das seine Hinrichtungspraxis als Staatsgeheimnis - das tun auch Weißrussland und Vietnam - unter Verschluss hält, veröffentlicht Amnesty bereits seit zehn Jahren keine Zahl mehr. Die Organisation vermutet aber,  . Amnesty zeigte sich über diesen Teil des Zahlen zufrieden. Er belege, ""dass die Bewegung anhält, die grausame, inhumane und entwürdigende Höchststrafe weltweit abzuschaffen"", heißt es im Bericht. Allerdings stünden einige Länder dagegen.  Im Irak zum Beispiel habe sich die Zahl der vollstreckten Todesurteile fast verdoppelt, in Saudi-Arabien sei sie um ein knappes Viertel gestiegen. Überhaupt sind Länder des Nahen Ostens und Nordafrikas 2019 für 88 Prozent der bekannt gewordenen Hinrichtungen verantwortlich - China wieder ausgenommen.  In Iran sank die Zahl der Hinrichtungen leicht, was Amnesty auf eine Ergänzung des Anti-Drogen-Gesetzes zurückführt, allerdings auf einem sehr hohen Niveau: Amnesty verzeichnete im letzten Jahr mindestens 251 Menschen, an denen die Todesstrafe im Iran vollstreckt wurde, zwei weniger als im Jahr zuvor.  Vier sollen noch minderjährig gewesen sein, darunter zwei Cousins, beide bei ihrer Verhaftung 15 Jahre alt, die in einem unfairen Verfahren wegen mehrfacher Vergewaltigung verurteilt wurden und in der Haft Peitschenhiebe erleiden mussten. Amnesty spricht von Iran als dem ""Top-Henker der Region"". In Saudi-Arabien verzeichnete Amnesty im vergangenen Jahr 184 vollstreckte Todesurteile, die höchste jemals festgestellte Zahl. Mehr als die Hälfte der Opfer hatte einen nichtsaudischen Pass, sechs der Hingerichteten waren Frauen.  84 Menschen wurden wegen Drogendelikten geköpft - die übliche Form der Vollstreckung -, 55 wegen Mordes und 37 wegen Vorwürfen des Terrorismus. Die Todesstrafe werde jedoch auch gezielt gegen  , bemerkt Amnesty. In Europa außerhalb der EU verzeichnet der Bericht nur noch die früheren Sowjetrepubliken Russland, Weißrussland, Kasachstan und Tadschikistan als Länder, die die Todesstrafe verhängen; nur Weißrussland vollstreckt sie allerdings.   erwerben sich mit 35 Hinrichtungen im vergangenen Jahr nicht nur den traurigen Ruhm, dies als einziges Land der Organisation amerikanischer Staaten (OAS) zu tun.  In den USA sitzen auch weltweit die meisten Menschen in Erwartung ihrer Hinrichtung in Todeszellen. Amnesty wirft den Vereinigten Staaten zudem vor, dass unter den Opfern auch im vergangenen Jahr wieder geistig Behinderte waren. Aber auch dort sind Fortschritte zu verzeichnen. New Hampshire schaffte im 2019 als 21. Bundesstaat der USA die Todesstrafe komplett ab;   setzte ihre Vollstreckung aus.  Das Bekenntnis von Gouverneur Gavin Newsom hat Amnesty seinem diesjährigen Bericht sogar vorangestellt: “Es ist falsch, einen Menschen absichtlich zu töten und als Gouverneur werde ich die Hinrichtung keines einzigen erlauben"", sagte Newsom am 13. März 2019 und bekannte zugleich, dass das US-Strafsystem ""in jeder Hinsicht ein Fehlschlag war"". Es diskriminiere Angeklagte, ""die geisteskrank, schwarz oder braun waren oder sich keine teuren Anwälte leisten konnten"". Ein weiterer souveräner Staat, der die Todesstrafe abgeschafft hätte, ist 2019 nicht hinzugekommen - auch dies vermerkt der Bericht. Bisher sei sie in 106 Ländern komplett verboten, in 142 Ländern werde sie nicht angewandt.  Der Generalsekretär von Amnesty in Deutschland, Markus N. Beeko, forderte weiteren ""entschlossenen Druck der internationalen Staatengemeinschaft auf diese letzten Staaten, die weiterhin an dieser grausamen unmenschlichen Praxis festhalten“. Dass sie ""mit den grundlegenden Menschenrechten unvereinbar"" sei, werde von den weitaus meisten anerkannt. ""Wir müssen die internationale Aufmerksamkeit verstärkt auf die kleine Gruppe von Staaten lenken, die Jahr für Jahr Menschen hinrichten."" die darüber jährliche Berichte verfasst dass jährlich Tausende Menschen in China exekutiert werden Dissidenten aus der schiitischen Minderheit Saudi-Arabiens eingesetzt Und die USA Kaliforniens Gouverneur",tagesspiegel
Coronavirus versehentlich freigesetzt? . China weist Labor-Theorie zurück,Julia Weiss,"16.04.2020, 17:53 Uhr",https://www.tagesspiegel.de/wissen/coronavirus-versehentlich-freigesetzt-china-weist-labor-theorie-zurueck/25746250.html,"Über die Entstehung des Coronavirus kursieren immer wieder Gerüchte in der Öffentlichkeit. Vom absichtlich von Menschen gezüchteten Virus bis hin zur Vermutung,  sei eine biochemische Waffe: Solch krude Theorien wurden mittlerweile von Wissenschaftlern widerlegt. Das Genom des Virus enthalte keine Hinweise darauf, dass es konstruiert oder manipuliert wurde, schreibt etwa die Fachzeitschrift  . Nun hat ein neues Gerücht eine Diskussion in den USA ausgelöst, an der sich auch seriöse Medien und die US-Regierung beteiligen: Der Erreger soll demnach nicht auf einem Fleischmarkt in Wuhan von Tieren übertragen worden sein, sondern aus einem chinesischen Labor in der Nähe stammen. Dort sei es erforscht und versehentlich durch ein Sicherheitsleck freigesetzt worden. Als US-Präsident Donald Trump bei einer Pressekonferenz im Weißen Haus nach der Glaubhaftigkeit dieser Theorie gefragt wurde, sagte er: „Das will ich nicht sagen, John. Aber ich werde Ihnen sagen, dass wir diese Geschichte immer öfter hören.“ Seine Regierung untersuche sehr genau, was passiert sei.  US-Außenminister Mike Pompeo sagte unmittelbar nach der Pressekonferenz im Sender Fox News auf eine entsprechende Frage, China sei Antworten in dieser Hinsicht schuldig geblieben. Der Sender verbreitet diese Theorie unter Verweis auf ungenannte Quellen. China wies den Verdacht zurück. Der Pekinger Außenamtssprecher Zhao Lijian erklärte, es lägen keine Beweise vor, die dafür sprächen, dass das Virus in einem Labor hergestellt wurde oder von dort ausgetreten ist. Der Ursprung des Virus müsse von der Wissenschaft aufgeklärt werden. „Die Weltgesundheitsorganisation hat gesagt, dass es keine Beweise dafür gibt, dass es in einem Labor hergestellt wurde“, so der Sprecher am Donnerstag: „Viele renommierte medizinische Experten haben auch bestätigt, dass die Behauptung, dass das Virus aus einem Labor ausgetreten ist, keine wissenschaftliche Grundlage hat.“ Ein Bericht der  erklärt, wie der Verdacht aufkam: Richtig sei, dass Forscher am „Wuhan Institut für Virologie“ Coronaviren bei Fledermäusen erforscht hätten. Der Zeitung zufolge hätten US-Diplomaten in China das amerikanische Außenministerium bereits zwei Jahre vor Ausbruch der Pandemie gewarnt, dass sie diese Forschung für zu riskant hielten.  In einem Bericht aus dem Jahr 2018 kritisieren sie einen „schweren Mangel an geschulten Technikern und Forschern, die gebraucht werden, um in diesem Hochsicherheits-Labor zu arbeiten“.  Einen Beweis für einen tatsächlichen Ausbruch des neuartigen Coronavirus aus dem   in Wuhan gibt es aber nicht, schreibt die   . Auch die Fachzeitschrift   warnt davor, die Theorie leichtfertig zu glauben. Bisher gebe es dafür keinen Beweis. Experten gehen davon aus, dass das Virus von einem Tiermarkt in Wuhan stammt, wo auch die ersten Erkrankungen aufgetreten waren.  Brisant ist allerdings, dass der amerikanische Bericht über die Sicherheitsrisiken nun von der Webseite des „Wuhan Institut für Virologie“ gelöscht wurde. Auch das berichtet die „Post“. Schon bei Ausbruch der Epidemie im Dezember hatte die chinesische Regierung Informationen zurückgehalten und die Epidemie anfänglich sogar gänzlich verschwiegen.  Das „Wuhan Institut für Virologie“ ist für China ein Statussymbol im Feld der Mikrobiologie. Erst im Januar wurde das Labor von chinesischen Behörden mit der höchsten Sicherheitsstufe BSL-4 zertifiziert. Ziel sei die Erforschung der gefährlichsten  , schreibt die Fachzeitschrift „Nature“. Die chinesische Akademie der Wissenschaften habe den Bau 2003 genehmigt, fertiggestellt wurde er 2014. Frankreich sei an Planung und Bau beteiligt gewesen.  SARS-CoV-2  „Nature Medicine“ „Washington Post“  Forschungslabor „Washington Post“ „Nature“ Krankheitserreger der Welt",tagesspiegel
Wuhan hebt Beschränkungen auf . Das Epizentrum der Corona-Pandemie will zurück zur Normalität,no_author,"07.04.2020, 15:27 Uhr",https://www.tagesspiegel.de/politik/wuhan-hebt-beschraenkungen-auf-das-epizentrum-der-corona-pandemie-will-zurueck-zur-normalitaet/25723222.html,"„In einer großen Epidemie müssen die Menschen Opfer bringen“, findet Frau Sun. Mehr als zwei Monate haben die 65-Jährige und ihr Mann nicht ihre Wohnung in Wuhan verlassen. „Es war absolut notwendig“, sagt die 65-Jährige zu den weltweit wohl striktesten Ausgangssperren in der Metropole, dem Ursprungsort der Pandemie in Zentralchina.  Elf Wochen nachdem Wuhan weitgehend von der Außenwelt abgeschottet worden war, fallen an diesem Mittwoch auch   für die elf Millionen Bewohner. Der innerstädtische Verkehr wird wieder normalisiert. Der Flughafen nimmt seine Flüge wieder auf. Autos dürfen die Stadt wieder verlassen und die Menschen mit dem Zug auch wieder wegreisen. Voraussetzung ist aber, dass sie gesund sind und in einer jetzt überall in China eingesetzten Corona-Gesundheits-App auf ihrem Handy einen grünen Code nachweisen können. Wer aber irgendwie Kontakt zu Infizierten hatte, wird darin automatisch auf Rot gesetzt und darf nicht reisen. Die Öffnung von Wuhan, wo das später Sars-CoV-2 genannte neue Coronavirus im November oder Anfang Dezember seinen Ausgang genommen und sich weltweit verbreitet hat, ist für China ein wichtiges Signal, das Schlimmste überwunden zu haben. Von den mehr als 81.000 offiziell gemeldeten Infektionen waren 50.000 allein in Wuhan.  Auch waren von den mehr als 3300 aufgelisteten Toten durch die   in China mehr als 2500 allein in der Metropole zu beklagen - auch wenn wohl bei Weitem nicht alle Fälle mitgezählt wurden. Jetzt werden in Wuhan die Barrikaden weggeräumt, die Bewohner in ihren Häusern gehalten hatten. Nachdem schon seit Tagen in China kaum noch neue Infektionen und nur noch „importierte Fälle“ gemeldet wurden, weist die Statistik am Dienstag erstmals keinen neuen Toten mehr auf. Passend zur Öffnung von Wuhan - vorausgesetzt, die Statistik stimmt auch, woran es eben berechtigte Zweifel gibt. Frau Sun hat es auch gar nicht eilig. „Ich werde noch eine Weile zu Hause bleiben und nur nach draußen gehen, wenn es unbedingt sein muss“, sagt die pensionierte Finanzexpertin. „Seid vorsichtig“, lautet ihr Rat an ihre Landsleute und auch an die Menschen in Deutschland und anderen Ländern. „Eine ansteckende Krankheit ist nicht das Problem einer einzelnen Person, sondern der ganzen Familie.“  Nach Aufhebung der Ausgangssperren werde sie erstmal nur draußen in ihrer Wohnanlage oder mal im nahe gelegenen Park spazieren gehen. Jetzt sorgt sich Frau Sun vor allem um eine   die keine Symptome zeigen oder von außerhalb Wuhans kommen. Gerade die Risikogruppe über 60 Jahre wie sie solle weiter vorsichtig sein und zu Hause bleiben, „um keine Belastung für die Familie und Gesellschaft zu werden“.  Die 65-Jährige erzählt, dass sie sich in der Isolation in ihrer Wohnung mit Yoga fit gehalten habe - dreimal am Tag. Auch habe sie gesungen, Gedichte rezitiert und Nachrichten aus China und dem Rest der Welt verfolgt. Gemüse und Fleisch zum Kochen sei ihnen an die Haustür geliefert worden. Ihre Tochter lebt in Australien. „Als die Epidemie in Wuhan so schlimm war, hat sie sich Sorgen gemacht. Jetzt mache ich mir Sorgen um sie“, sagt Frau Sun, weil sich die Pandemie in anderen Ländern so rasant ausbreitet. „Vieles ist besser dort, aber deren Prävention ist nicht so gut wie bei uns.“  Anfangs sei in Wuhan einiges nicht so gut gelaufen. Es habe viel Unwissenheit gegeben, sagt Frau Sun. Aus ihrer Sicht reagieren aber andere Länder zu zögerlich. „Selbst jetzt, wo die Leute in der Welt die Krankheit kennen, sind ihre Präventionsmaßnahmen verspätet.“ Die in Wuhan und der umliegenden Provinz Hubei für rund 56 Millionen Menschen verhängten strengen Ausgangssperren wurden allgemein als notwendig und keineswegs übertrieben betrachtet.  „Die Entscheidung, die Stadt schnell abzuschotten, hat das Problem wirklich lösen können“, sagt auch eine 25-jährige Studentin namens Zhu, die in den USA studiert, aber bei einem kurzen Besuch in Wuhan gestrandet war.    „Ich hoffe, dass die unsichtbaren Gefahren durch das Virus beseitigt werden und das Leben in Wuhan zur Normalität zurückkehren kann.“ Das Trauma der Krise quält die Schriftstellerin Fang Fang. „Am traurigsten war der Tod“, sagt die 64-jährige Bloggerin, die mit ihrem Tagebuch aus Wuhan zu einer der meist gelesenen Autorinnen Chinas aufstieg. Ähnlich die Verzweiflung der Menschen, die medizinische Hilfe suchten, aber nicht fanden, sagt Fang Fang dem Magazin „Caixin“.  Mit Blick auf die anfängliche Vertuschung und die langsame Reaktion der Behörden sagt Fang Fang, die eine einflussreiche Stimme geworden ist: „Was mich am meisten verärgert hat, war die Verzögerung von fast 20 Tagen am Anfang des Ausbruchs, der diese ernste und chaotische Lage entstehen ließ - eine Katastrophe von Menschenhand.“  die letzten Bewegungsbeschränkungen Lungenkrankheit Covid-19 Ansteckung durch Infizierte,",tagesspiegel
