title,author,date_published,url,article_text,source
Desinformation in der Coronakrise . Chinas verdeckte Einflussnahme in Deutschland,Claudia von Salzen,"26.04.2020, 16:57 Uhr",https://www.tagesspiegel.de/politik/desinformation-in-der-coronakrise-chinas-verdeckte-einflussnahme-in-deutschland/25775008.html,"Für ausländische Diplomaten gehören Kontakte zu Regierungsvertretern ihres Gastlandes zum Alltagsgeschäft. Doch die Bemühungen Chinas in der Coronakrise gingen offenbar weit über die üblichen Gepflogenheiten hinaus: Die Vertreter der Volksrepublik versuchten, über Kontakte zu Beamten verschiedener Bundesministerien Einfluss auf die deutsche Bewertung des chinesischen Umgangs mit der Pandemie zu nehmen.  Die Bundesregierung habe „Kenntnis von einzelnen Kontaktaufnahmen chinesischer Diplomaten mit dem Zweck, öffentliche positive Äußerungen über das   zu bewirken“, heißt es in einer Antwort des Innenministeriums auf eine parlamentarische Frage der Grünen-Bundestagsabgeordneten Margarete Bause.  Damit bestätigte die Bundesregierung einen  , die auch über die Antwort zuerst berichtet hatte. Demnach hatte das Auswärtige Amt im März andere Ministerien darüber informiert, dass chinesische Diplomaten Beamte und Mitarbeiter von Bundesministerien kontaktiert hätten, um die deutsche Position zu beeinflussen. Zugleich soll das Amt dringend davon abgeraten haben, auf diese Anfragen einzugehen. Die chinesische Botschaft dementierte den Bericht über die versuchte Einflussnahme.  In seiner Antwort auf die parlamentarische Frage betonte Günter Krings (CDU), parlamentarischer Staatssekretär im Bundesinnenministerium, die Erfolglosigkeit der chinesischen Versuche: „Diesen Aufforderungen ist die Bundesregierung nicht nachgekommen.“  Allerdings enthält die Regierungsantwort kein Wort der Kritik an China – Krings hebt sogar die Leistungen der Volksrepublik im Kampf gegen das Coronavirus positiv hervor. Es gebe einen regelmäßigen Austausch mit chinesischen Diplomaten. „Die Bundesregierung hat dabei – nicht auf Aufforderung – die Anstrengungen gewürdigt, die die chinesische Regierung insbesondere seit dem 23.Januar zur Eindämmung von Covid-19 unternommen hat.“ Transparenz spiele bei der erfolgreichen Bekämpfung der Pandemie eine zentrale Rolle, dies habe die Bundesregierung gegenüber der chinesischen Regierung deutlich gemacht.  Die Grünen-Abgeordnete Bause nannte die Antwort des Innenministeriums „enttäuschend“ und warf der Bundesregierung „Leisetreterei gegenüber China“ vor. „Es wäre angemessen, den chinesischen Botschafter einzubestellen, sich gegen die versuchte Einflussnahme zu verwahren und auf die sofortige Beendigung dieser Vorgehensweise zu bestehen“, sagte die menschenrechtspolitische Sprecherin der Grünen dem Tagesspiegel.  Der Botschafter wurde allerdings nicht ins Auswärtige Amt einbestellt. Nach Tagesspiegel-Informationen ist dies auch nicht geplant.  Auf die Frage, was die Regierung unternehme, um der chinesischen Propagandapolitik entgegenzuwirken, antwortete Staatssekretär Krings lediglich: „Zur Stärkung von Resilienzen gegenüber Einflussaktivitäten jeglicher Art wird seitens der Bundesregierung u.a. der Ansatz verfolgt, ein größeres Bewusstsein für das Thema Einflussnahme zu schaffen.“ Auch an dieser Stelle fiel kein kritisches Wort über das chinesische Vorgehen.  Nach Einschätzung des Auswärtigen Dienstes der EU setzt  . In einem   heißt es, verschiedene Regierungen, „  und – in geringerem Ausmaß – China“, zielten weiterhin mit Verschwörungstheorien und Desinformationen auf die Öffentlichkeit in der EU.“ Es gibt auch Beweise für einen koordinierten Vorstoß offizieller chinesischer Quellen, von jeglicher Schuld am Ausbruch der Pandemie abzulenken.“ Teil dieser Kampagne sei auch die Veröffentlichung von Berichten über Hilfslieferungen.  Ursprünglich hatten Europas Diplomaten noch klarere Worte für das Vorgehen der Volksrepublik gefunden. In einem Entwurf des Berichts hieß es: „China hat die globale Desinformationskampagne fortgesetzt, um von der Schuld am Ausbruch der Pandemie abzulenken und sein internationales Image zu verbessern.“ Dabei würden sowohl offene als auch verdeckte Taktiken eingesetzt.  Diese Passage fehlt jedoch in dem  . China habe Druck ausgeübt, und daraufhin hätten Vertreter der EU den Text abgeschwächt,   am Freitag. Der Sprecher des Europäischen Auswärtigen Dienstes (EAD), Peter Stano, wies dies als „unrichtig“ zurück. Wer den Bericht des EAD mit offenen Augen lese, werde sehen: „Wir beugen uns keinerlei ausländischem Druck und machen unseren Job, Desinformation und deren Akteure aufzudecken.“  Unstrittig ist allerdings offenbar, dass China Druck machte, um auf den Bericht der europäischen Diplomaten Einfluss zu nehmen und den Text in der ursprünglichen Fassung zu verhindern.  Coronavirus-Management der Volksrepublik China Bericht der „Welt am Sonntag“ China in der Coronakrise auf Desinformation am Freitag veröffentlichten Bericht einschließlich Russland nun veröffentlichten Bericht berichtete die „New York Times“",tagesspiegel
Rückkehr in die WHO als Beobachter? . Bundestagsabgeordnete unterstützen Taiwan,no_author,"26.04.2020, 18:19 Uhr",https://www.tagesspiegel.de/politik/rueckkehr-in-die-who-als-beobachter-bundestagsabgeordnete-unterstuetzen-taiwan/25775382.html,"Das kleine Taiwan hat ein großes Problem. Es mag de facto ein Staat sein, aber de jure ist die Insel im ostchinesischen Meer das nicht. Weil die kommunistische   das demokratische Taiwan a  betrachtet und dies auch international mit der „Ein-China-Politik“ – die auch von der Bundesrepublik Deutschland anerkannt wird – durchsetzt, wird Taiwan diplomatisch nur von 15 Staaten anerkannt. Es ist auch in keiner Institution der Vereinten Nationen vertreten. 2017 verlor Taiwan seinen Beobachterstatus in der Weltgesundheitsorganisation (WHO), just nach der Wahl des neuen WHO-Chefs Tedros Adhanom Ghebreyesus, dem nicht nur US-Präsident Donald Trump eine zu große Nähe zu China vorwirft. Doch nun soll sich für Taiwan etwas ändern.  Anfang April hielten die USA und Taiwan ein „virtuelles Forum zur globalen Ausweitung der Beteiligung Taiwans“ ab. Inzwischen wird das Bestreben Taiwans, wieder als Beobachter bei der WHO zugelassen zu werden, auch in Deutschland unterstützt. Bundestagsabgeordnete aus den Bundestagsfraktionen von CDU/CSU, SPD, FDP und Grünen haben eine Petition unterschrieben. „Wir wollen erreichen, dass Taiwan, welches sich sehr erfolgreich bei der Bekämpfung der Coronakrise gezeigt hat, besser eingebunden wird“, sagt die CDU-Abgeordnete Anita Schäfer dem Tagesspiegel. „Viren kennen keine Grenzen und es ist wichtig, dass alle Staaten ihr Wissen untereinander teilen und zusammenarbeiten.“ Die WHO habe sich selbst dem Schutz der Gesundheit aller Menschen auf dem Globus verschrieben, sagt Schäfer, die auch Vorsitzende eines Taiwan-Freundeskreises ist. „Da kann Taiwan nicht außen vor gelassen werden.“  Zumal Taiwan als   gelten kann. Deutschland und Taiwan hatten am selben Tag den ersten registrierten Fall. Seitdem meldete Taipeh nur 429 Fälle von Covid-19-Erkrankungen und sechs Todesfälle. Taiwan zählt 24 Millionen Einwohner. Es wurde gezielt an den Grenzen kontrolliert, basierend auf Datenanalyse Menschen kontaktiert, die sich angesteckt haben könnten, und im Krankheitsfall isoliert. Taiwan hat dabei alles transparent kommuniziert. Der China-Experte Martin Wagener von der Hochschule des Bundes sieht Taiwan als positives Beispiel im Kampf gegen das Virus. „Ich plädiere dafür, die Grundlagen der ,Ein-China-Politik‘ zu überdenken, wenn China sich weiterhin weigert, Taiwan Zugang zur WHO zu gewähren“, sagt der Wissenschaftler, „im Kampf gegen Pandemien darf es keine toten Winkel geben.“  Volksrepublik China ls abtrünnige Provinz Vorbild für die Bekämpfung von Covid-19",tagesspiegel
Hoffnungsträger gegen Covid-19 . Trump drängt auf schnelle Zulassung von Remdesivir,no_author,"30.04.2020, 18:42 Uhr",https://www.tagesspiegel.de/wissen/hoffnungstraeger-gegen-covid-19-trump-draengt-auf-schnelle-zulassung-von-remdesivir/25769784.html,"Der Wirkstoff Remdesivir kann die Behandlungsdauer von Covid-19-Patienten wohl verkürzen. Das legt eine   der USA nahe. Anthony Fauci, Leiter des Instituts und Berater Donald Trumps in der Coronakrise, bewertete die ersten Ergebnisse positiv.  Eine im Fachmagazin ""The Lancet"" vorgestellte  kommt hingegen zu dem Schluss, dass sich der Zustand der Patienten mit Remdesivir nicht wesentlich verbessert. Aus Patientenmangel wurde diese Studie allerdings frühzeitig abgebrochen Fauci sagte am Mittwoch, Remdesivir habe eine „signifikante positive Wirkung bei der Verringerung der Zeit bis zur Genesung“ gezeigt, sagte Fauci am Mittwoch. Es könnte die Standardtherapie gegen die von dem Coronavirus ausgelöste Lungenkrankheit Covid-19 werden. Ethische Fragen hätten ihn zu dem ungewöhnlichen Schritt bewogen, erste Studienergebnisse schon vor der Veröffentlichung in wissenschaftlichen Fachzeitschriften in einer Pressekonferenz vorzustellen, sagte Fauci.  Er wolle sicherstellen, dass mehr Patienten das Mittel bekämen. Trump sagte am Mittwochabend auf die Frage, ob er sich von der Behörde einen beschleunigten Zulassungsprozess für das Mittel wünsche, er wolle, dass man so schnell wie möglich vorangehe. ""Wir wünschen uns sehr schnelle Genehmigungen.""  Die Lebensmittel- und Arzneimittelbehörde (FDA) sei derzeit in Gesprächen mit dem Arzneimittelhersteller Gilead, um Remdesivir rasch für Patienten in Krankenhäusern verfügbar zu machen, sagte Fauci. Laut  ist eine schnelle Notfallzulassung wahrscheinlich.  Eine formelle Zulassung des Medikaments würde jedoch noch wesentlich länger dauern und weitere Studien erfordern. Das ursprünglich gegen das Ebolavirus entwickelte Medikament ist bislang weltweit noch nirgendwo zugelassen.  Das NIAID berichtet  von der klinischen Studie, an der etwa 1063 Menschen teilnahmen. Die vorläufigen Ergebnisse deuten darauf hin, dass Patienten mit Covid-19 und Komplikationen an der Lunge in Krankenhäusern bei einer Behandlung mit Remdesivir 31 Prozent schneller entlassen werden konnten als die Studienteilnehmer, die lediglich ein Placebo erhielten.  Patienten, die in Krankenhäusern an der Lungenkrankheit Covid-19 litten und Remdesivir bekamen, waren laut Fauci nach durchschnittlich 11 Tagen wieder genesen, die Patienten der Kontrollgruppe erst nach 15 Tagen. Auch die Sterblichkeitsrate sei etwas geringer gewesen, dieses Ergebnis sei aber bislang nicht statistisch signifikant. Die endgültigen Daten werden allerdings wohl erst im Laufe des kommenden Monats vorgelegt. Die Studie ist noch nicht von unabhängigen Experten begutachtet worden.     Zuvor hatte   Remdesivir habe die Symptome von Covid-19-Patienten bei einem frühzeitigen Einsatz verbessert. Gilead ging in einer eigenen Untersuchung der Frage nach, wie lange Patienten mit Remdesivir behandelt werden müssen. Dabei habe sich herausgestellt, dass bei schweren Covid-19-Fällen fünf Tagesdosen Remdesivir genauso gut wirkten wie zehn Tagesdosen.  Nach zwei Wochen hätten mehr als die Hälfte der Patienten das Krankenhaus verlassen. Sollte das Medikament letztlich zugelassen werden, könnte das die Kosten der Behandlung senken und die verfügbare Menge erhöhen. Zudem deuteten die Ergebnisse der Studie darauf hin, dass ein früher Beginn der Behandlung mit Remdesivir besser ist: Diese Patienten seien eher entlassen worden als diejenigen, die erst zu einem späteren Zeitpunkt behandelt worden seien. Allerdings wurde die Studie ohne Kontrollgruppe durchgeführt. Deswegen ist unklar, ob es den Studienteilnehmern besser ging als Erkrankten, die kein Remdesivir erhielten. Die Nachrichten über Remdesivir beflügelte die US-Börsen. Aktien des Unternehmens stiegen um sieben Prozent. Dow Jones, Nasdaq und S&P 500 kletterten zur Eröffnung am Mittwoch um jeweils etwa zwei Prozent. Ernüchternde Ergebnisse kommen dagegen aus China: In Wuhan, wo die Pandemie ihren Ausgangspunkt hat, erholten sich die 158 Patienten, die Remdesivir erhielten, nicht schneller als die 79 Erkrankten in der Kontrollgruppe. Das Medikament reduzierte zudem weder die Virenbelastung im Körper noch die Gefahr, an der Lungenkrankheit zu sterben. Allerdings ist das Coronavirus in Wuhan inzwischen unter Kontrolle, seit Wochen infizieren sich kaum noch Menschen mit dem Virus.  Forscher haben daher Schwierigkeiten, ausreichend Teilnehmer für ihre Studien zu rekrutieren. Die Ergebnisse sind statistisch nicht beweiskräftig. Neben dem vorzeitigen Abbruch der Studie weisen sie allerdings auf eine weitere Schwächen der Studie hin: Die meisten ihrer Patienten waren erst recht spät im Krankheitsverlauf mit Remdesivir behandelt worden. Ein früherer Therapiebeginn verbessere die Behandlungsergebnisse womöglich. Anders als die beiden anderen Studien wurde die chinesische Untersuchung vor der Veröffentlichung im  von anderen Wissenschaftlern geprüft. Breits am 24. April waren diese Studienergebnisse  veröffentlicht worden. Die Zeitung berief sich auf eine Zusammenfassung der Studie, die offenbar aus Versehen kurzzeitig auf der Website der Weltgesundheitsorganisation (WHO) zu sehen war.  Gilead wies die Darstellung der Studienergebnisse in den Berichten aber zurück. Der auf der WHO-Website veröffentlichte Beitrag sei eine ""unangemessene"" Zusammenfassung der Experiments. Die Studie sei wegen geringer Beteiligung vorzeitig beendet worden und daher statistisch nicht signifikant. Zudem sei aus den Daten ein ""möglicher Nutzen von Remdesivir"" abzuleiten, insbesondere bei Patienten in einem frühen Krankheitsstadium. Fachleute mahnen angesichts der neuen US-Studie zur Zurückhaltung. Eric Topol, Direktor und Gründer des Forschungsinstituts Scripps Research Translational Institute, verwies darauf, dass Remdesivir nur bescheidene Ergebnisse gezeigt habe. ""Es wurde mit einem überwältigenden Effekt gerechnet. Das hat es eindeutig nicht."" Auch Fauci sagte, die Suche nach einem Corona-Mittel sei nicht beendet.    Er verglich die Studienergebnisse mit den ersten Erfolgen im Kampf gegen HIV: Auch damals sei das Medikament ATZ nicht perfekt gewesen, aber ein erster Schritt. ""Ähnlich wie ATZ ist Remdesivir der erste Tippelschritt hin zu einer hoffentlich größeren Zahl besserer Medikamente, die wir zur Behandlung von Covid-19 haben werden."" Nach Ansicht einiger deutscher Experten sind die Ergebnisse der US-Studie ausreichend belastbar. Es seien genügend Patienten untersucht worden; unter Therapie mit Remdesivir seien sie früher aus dem Krankenhaus entlassen worden, sagt etwa Clemens Wendtner von der München Klinik Schwabing. ""Somit sind wesentliche Endpunkte der Studie erreicht worden, so dass an einer raschen Zulassung der Substanz aus meiner Sicht wenig Zweifel bestehen dürfte."" Auch Gerd Fätkenheuer von der Uniklinik Köln, Leiter einer klinischen Prüfung von Remdesivir (GS-5734) bei Patienten in Deutschland, rechnet aufgrund der positiven Ergebnisse mit einer baldigen Zulassung. Mitte April hatte die auf Gesundheitsthemen spezialisierte Website Stat berichtet,  . Dem Bericht zufolge könnte es sich bei dem Arzneimittel um das erste schon zugelassene Medikament gegen die Lungenkrankheit handeln. ""Wir haben gesehen, wie Menschen einen Tag nach Beginn der Therapie von den Beatmungsgeräten weg konnten"", zitiert das Medizinportal Kathleen Mullane, Spezialistin für Infektionskrankheiten an der Universität von Chicago, die die Remdesivir-Studien für das Universitätsklinikum in Chicago betreut. Die meisten Patienten hätten die Klinik nach sechs Tagen verlassen. Es seien nur ""sehr wenige"", die bis zu zehn Tage stationär behandelt werden mussten, sagte Mullane. Mullane mahnte trotz der erfreulichen Nachrichten zur Vorsicht, weil die Studie keine Placebo-Gruppe zum Vergleich enthalte. Eines sei aber sicher, sagte sie: ""Wenn wir beginnen, das Arzneimittel zu verabreichen, sehen wir die Fieberkurve fallen"", sagte sie. Auch in Deutschland gab es schon erste Erfolge mit dem Medikament: Am Universitätsklinikum Eppendorf (UKE) etwa wurden Patienten mit Remdesivir behandelt. Die Infektiologin Marylyn Addo sprach von ermutigenden Ergebnissen. ""Was man bisher sagen kann, ist, dass   sehr gut vertragen wurde, und wir sind sehr zufrieden mit den Behandlungsverläufen"", sagte die Oberärztin. Aber es seien Einzelfallbeobachtungen – wie eben auch die anderen Beispiele, bei denen sehr starke Verbesserungen unter Remdesivir eingetreten seien. Auch die WHO testet in einer groß angelegten Studie namens ""Solidarity Trial"" Remdesivir und vergleicht es mit Standardbehandlungen und Virenhemmern aus der Aidstherapie.  Studie des Nationalen Instituts für Allergien und Infektionskrankheiten (NIAID)  chinesische Studie einem Bericht der „New York Times“  in einer Mitteilung  schon Gilead mitgeteilt, renommierten Medizinjournal ""The Lancet""  der ""Financial Times""  dass das Mittel bei Coronavirus-Patienten in einem Krankenhaus in Chicago große Wirkung gezeigt habe die Medikation",tagesspiegel
Pekings Propaganda in der Coronakrise . Wie China die Kritik der EU zum Verstummen bringen wollte,Christoph von Marschall,"27.04.2020, 17:09 Uhr",https://www.tagesspiegel.de/politik/pekings-propaganda-in-der-coronakrise-wie-china-die-kritik-der-eu-zum-verstummen-bringen-wollte/25777530.html,"Peking hat die EU unter Druck gesetzt, einen kritischen Bericht über Chinas Desinformation in der Coronakrise nicht zu veröffentlichen. Der Druck hat zu Verzögerungen und Veränderungen des Berichts geführt. Aber „in der Sache ist die EU nicht eingeknickt“, sagt Reinhard Bütikofer, Vorsitzender der China-Delegation des Europäischen Parlaments dem Tagesspiegel. Er weist damit entsprechende Vorwürfe an den Auswärtigen Dienst der EU und dessen Chef Josep Borrell zurück. „Es stand nie zur Debatte, den Bericht nicht zu publizieren, wie Peking das erreichen wollte.“ Die internationale Berichterstattung über Chinas Druck und die Reaktionen der EU darauf hat dem Bericht umso mehr Aufmerksamkeit verschafft und damit kontraproduktiv für Pekings Ziel gewirkt, die  zum Verstummen zu bringen. „Koordinierte Desinformation gemischt mit intensiver Propaganda und zentral ausgeübter Zensur, das ist in China nichts Neues, aber die Welt hat solche Praktiken aus Peking noch nie so drastisch erlebt wie jetzt in der Corona-Krise“, sagt Bütikofer.  „Doch China tut sich damit keinen Gefallen, denn wo Transparenz nötig wäre, ruft dieses Verhalten Ablehnung und Gegenreaktionen hervor.“ Die Europäische Union wirft China auch in der   eine „koordinierte Aktion“ vor, „um die Verantwortung für den Ausbruch der Pandemie zu verwischen“.  Peking verbreite mit Hilfe „verdeckter Operationen“ falsche Informationen über die sozialen Netzwerke. Es umgehe deren Regeln und betreibe eine globale Propagandakampagne. Unter anderem stelle China die Lage in Europa so dar, als helfe es den EU-Staaten mehr und effektiver bei der Bekämpfung des Coronavirus als die EU-Kommission. In der  , der ursprünglich am vergangenen Dienstag erscheinen sollte, hatte die Formulierung noch gelautet: „China betreibt eine globale Desinformationskampagne, um seine Schuld am Ausbruch der Pandemie zu verwischen und sein internationales Image aufzupolieren.“ Der European External Action Service (EEAS) strich auch eine Passage aus dem Bericht, wonach   habe, sie hätten sich in rassistischer Weise über den Chef der Weltgesundheitsorganisation (WHO), Tedros Adhanom Ghebreyesus, geäußert. Der Äthiopier galt bei seiner Wahl als Wunschkandidat Chinas. Kritiker werfen ihm in der Pandemie eine prochinesische Haltung vor. Die Verzögerung und Veränderung des EU-Berichts fand ein beträchtliches internationales Echo, zum Beispiel  und in der Europa-Ausgabe des  .  Zuvor hatten britische Medien China vorgehalten, es kaufe Werbung auf sozialen Netzwerken, in denen es Chinas Umgang mit dem Coronavirus lobe und westlichen Regierungen wegen Inkompetenz anschwärze und behaupte, sie hätten mit ihren angeblich stümperhaften Reaktionen auf die Pandemie den Schaden vergrößert.  Das Ziel sei, Peking als „globale Führungsmacht“ im Kampf gegen die Pandemie darzustellen und kritische Fragen zur Herkunft des Virus und seiner Verbreitung von China aus in die Welt zum Schweigen zu bringen.     Bart Groothuis, ein liberaler Europaabgeordneter aus den Niederlanden, verlangt vom EU-Außenbeauftragten Borrell eine „formale und umfassende Erklärung“, warum China eine Abschwächung des Berichts erreichte habe, der ursprünglich von einer globalen Desinformationskampagne zur Ausbreitung des Coronavirus gesprochen hatte.  Bütikofer sieht es gelassener. „Der Bericht, den der Auswärtige Dienst EEAS publiziert hat, geht sehr kritisch mit China um“, sagt Bütikofer. „Manche hätten sich eine härtere Wortwahl gewünscht. China hatte aber keinen Erfolg mit Einschüchterungsversuchen. Und das zählt.“ Die harte Reaktion Chinas ist nach Ansicht Brüsseler Insider wohl auch auf Missverständnisse zurückzuführen. Peking habe anfangs geglaubt, der Bericht beschäftige sich nur mit China. Tatsächlich gibt er einen Überblick über Desinformationskampagnen generell, gerade auch die aus Russland. Peking glaubte, es sitze allein auf der Anklagebank, obwohl das nicht der Fall war, und habe wohl auch deshalb so aggressiv reagiert.    Der EEAS habe daraufhin die zentralen Aussagen nochmals überprüft: Können wir alle Vorwürfe zweifelsfrei belegen oder bieten wir mit zu scharfen Formulierungen unnötige Angriffsflächen? Das habe mehrere Tage gedauert. Diese diplomatische Haltung der EU steht in Kontrast zum Vorgehen des US-Präsidenten Donald Trump, der einen harten Propagandakrieg mit China austrägt. Diesen Vergleich lehnt Bütikofer ab. „Es wäre falsch, die China-Politik der EU mit der Elle von Präsident Trumps Hau-drauf-Kurs zu messen. Wir gehen anders vor“, sagt Bütikofer.  „Wir teilen viele Kritikpunkte Washingtons gegenüber China, auch im Umgang mit Corona. Wir teilen auch die Einschätzung der USA, dass China ein systemischer Rivale ist.“ Der China-Experte betont aber zugleich: „Den Kurs der Totalkonfrontation schlagen wir aber nicht ein, sondern bemühen uns um eine Balance, die in bestimmten Feldern Kooperation mit China ermöglicht.“ Kritik an China  neuen Fassung des Berichts vom Freitag Urfassung des Berichts China französischen Politikern fälschlicherweise vorgeworfen  in der „New York Times“ Online-Portals „Politico“",tagesspiegel
Erste Demonstration seit Corona-Beschränkungen . Hunderte Menschen in Hongkong protestieren gegen Regierung,no_author,"26.04.2020, 19:51 Uhr",https://www.tagesspiegel.de/politik/erste-demonstration-seit-corona-beschraenkungen-hunderte-menschen-in-hongkong-protestieren-gegen-regierung/25775508.html,"In Hongkong ist es erstmals seit Beginn der Corona-Krise wieder zu   gekommen. Trotz strikter Abstandsregeln kamen in einem Einkaufszentrum der chinesischen Sonderverwaltungszone am Sonntag Hunderte Menschen zusammen, um Forderungen nach Demokratie zu erneuern. In Hongkong sind wegen der Pandemie derzeit nur Versammlungen von maximal vier Menschen erlaubt. Sie müssen 1,5 Meter Abstand halten. Einer der Anführer der Demonstranten, Avery Ng, sagte: „Wir sind hier, um unseren Ärger und Frust über die Brutalität der Polizei auszudrücken.“ Man habe sich in kleinen Gruppen verteilt und an die Abstandsregeln gehalten. Die Polizei widersprach und drohte mit hohen Geldstrafen.  Die Schutzmaßnahmen gegen den neuen Coronavirus sind in Hongkong noch bis mindestens 7. Mai in Kraft.  . Die Proteste, zu denen zwischenzeitlich Millionen Menschen auf den Straßen waren, hatten im Juni vergangenen Jahres begonnen. Polizei. Sie richten sich gegen die nicht frei gewählte Regierung sowie den wachsenden Einfluss der kommunistischen Führung in Peking. Die Demonstranten fordern insbesondere freie Wahlen, eine unabhängige Untersuchung der Polizeibrutalität bei den Protesten sowie Straffreiheit für die mehr als 7000 Festgenommenen.  Protesten gegen die china-freundliche Regierung und Peking In den vergangenen Tagen gab es in der Millionenmetropole kaum noch neue Infektionen",tagesspiegel
