title,author,date_published,url,article_text,source
USA sprechen von „Genozid“ an Uiguren . Biden unterzeichnet Importverbot für Waren aus Chinas Provinz Xinjiang,no_author,"24.12.2021, 09:33 Uhr",https://www.tagesspiegel.de/politik/usa-sprechen-von-genozid-an-uiguren-biden-unterzeichnet-importverbot-fuer-waren-aus-chinas-provinz-xinjiang/27923216.html,"US-Präsident Joe Biden hat ein Gesetz auf den Weg gebracht, das den Import von zahlreichen Produkten aus der Region Xinjiang in China verbietet. Das am Donnerstag vom US-Präsidenten unterzeichnete Gesetz sieht ein Verbot von Produkten vor, die ganz oder teilweise in dieser chinesischen Provinz hergestellt wurden – es sei denn, die Unternehmen können nachweisen, dass die Produkte nicht mit Zwangsarbeit hergestellt wurden, was als schwierig gilt. Hintergrund des Gesetzes ist der Streit Washingtons mit Peking übe . China bestreitet die Vorwürfe der USA, wonach die Regierung in der Provinz einen ""Genozid"" an der Minderheit verübe.  In China leben schätzungsweise zehn Millionen Uiguren, die meisten in der Provinz Xinjiang im äußersten Westen des Landes.  Nach ihrer Machtübernahme 1949 hatten die Kommunisten das frühere Ostturkestan China einverleibt. Die Regierung in Peking wirft uigurischen Gruppen Separatismus und Terrorismus vor. Das neue US-Gesetz verlangt, dass Importe von drei Produkten besonders kontrolliert werden müssen: Baumwolle, für die Xinjiang einer der größten Produzenten weltweit ist; Tomaten, die ebenfalls in der Region in großen Mengen produziert werden; und Polysilizium, ein Material, das für die Herstellung von Solarmodulen verwendet wird. Es handelt sich um das weltweit erste Importverbot dieser Art. US-Außenminister Antony Blinken erklärte, das Gesetz gebe der Regierung ""neue Instrumente an die Hand, um die Einfuhr von Produkten, die mit Zwangsarbeit in Xinjiang hergestellt wurden, zu verhindern und die Personen und Organisationen, die hinter diesen Missbräuchen stehen, zur Rechenschaft zu ziehen"". Er forderte die chinesische Regierung erneut auf, ""Genozid und Verbrechen gegen die Menschlichkeit"" zu beenden. Das Gesetz geht auf eine Initiative des US-Parlaments zurück. Vergangene Woche hatte der Senat in seltener Einheit einstimmig für das Importverbot gestimmt. Zuvor hatten Lobbyverbände von Unternehmen, die stark von Importen aus China abhängig sind, versucht, die Abstimmung zu verhindern. Auffällig war, dass Biden das Gesetz nicht vor laufender Kamera unterzeichnete, wie sein Vorgänger Donald Trump bei anderen Handelsbeschränkungen gegen China. Stattdessen veröffentlichte sein Büro nur ein Foto auf Twitter. Wie Trump sieht Biden in China den größten Rivalen der USA weltweit. Anders als der Republikaner will der Demokrat jedoch den Gesprächsfaden nicht abreißen lassen und setzt auf eine begrenzte Zusammenarbeit beispielsweise im Kampf gegen den Klimawandel. Das Gesetz könnte für US-Unternehmen, die Teile aus China beziehen, zu einem größeren Problem werden – selbst wenn sie nicht direkt aus Xinjiang importieren. So geriet beispielsweise der Chiphersteller Intel ins Kreuzfeuer, als er seine Zulieferer in einem Schreiben dazu aufforderte, keine Waren mehr aus der Provinz zu beziehen. Dies führte zu einem Aufschrei auf chinesischen Internetplattformen. Intel versuchte, der öffentlichen Empörung durch eine auf der chinesischen Plattform Weibo veröffentlichten Entschuldigung entgegenzuwirken. Darin schrieb das US-Unternehmen: ""Unsere ursprüngliche Absicht war es, die Einhaltung der US-Gesetze sicherzustellen"". Intel entschuldige sich ""für die Probleme, die unseren respektierten chinesischen Kunden, unseren Partnern und der Öffentlichkeit entstanden sind"". Die US-Regierung kritisierte diese Aktion am Donnerstag: ""Wir glauben auch, dass US-Unternehmen niemals das Bedürfnis verspüren sollten, sich dafür zu entschuldigen, dass sie sich für grundlegende Menschenrechte einsetzen oder sich gegen Unterdrückung wehren"", erklärte Bidens Sprecherin Jen Psaki.  r mutmaßliche Menschenrechtsverletzungen gegen die überwiegend muslimische Minderheit der Uiguren im Westen Chinas Unter anderem wird China beschuldigt, hunderttausende Uiguren in Umerziehungslagern zu internieren und zur Arbeit zu zwingen.  Sie gelten als ethnisch mit den Türken verwandt und werden von den herrschenden Han-Chinesen wirtschaftlich, politisch und kulturell unterdrückt.",tagesspiegel
Nach Festnahme mehrerer Mitarbeiter . Prodemokratische Hongkonger „Stand News“ stellen Betrieb ein,no_author,"29.12.2021, 16:49 Uhr",https://www.tagesspiegel.de/politik/nach-festnahme-mehrerer-mitarbeiter-prodemokratische-hongkonger-stand-news-stellen-betrieb-ein/27933578.html,"In Hongkong hat ein weiteres pro-demokratisches Medium auf Druck der Behörden den Betrieb eingestellt. Nachdem am Mittwoch mehrere Mitarbeiter festgenommen wurden, teilte die Online-Publikation „Stand News“ einige Stunden später mit, alle Mitarbeiter entlassen und den Betrieb mit sofortiger Wirkung eingestellt zu haben. „Vielen Dank an die Leser für Ihre anhaltende Unterstützung“, hieß es in einer auf Facebook verbreiteten Mitteilung zur Schließung.  Zuvor hatten Beamte der nationalen Sicherheitspolizei am frühen Mittwochmorgen mindestens sechs Journalisten und ehemalige Mitarbeiter von „Stand News“ festgenommen, darunter auch der derzeitige Chefredakteur Lam Shiu und dessen Vorgänger Chung Pui. Rund 200 Beamte waren an dem Einsatz beteiligt, bei dem auch die Redaktion von „Stand News“ und die Häuser der Festgenommenen durchsucht wurden.  Die Vereinigung der Hongkonger Auslandskorrespondenten FCC äußerte sich bestürzt über die Einstellung der Publikation. Das Vorgehen der Polizei sei „ein weiterer Schlag für die Pressefreiheit in Hongkong“. Der Geschäftsführer des Vereins Reporter ohne Grenzen, Christian Mihr, sagte: „Die Demokratien der Welt müssen nun handeln, bevor Chinas Modell der Informationskontrolle ein weiteres Opfer fordert.“ Bereits im Juni war in Hongkong   zwangsweise eingestellt worden, nachdem das Boulevardblatt wegen angeblicher Verstöße gegen das sogenannte Sicherheitsgesetz ins Visier der Behörden geraten war. Ihr Gründer Jimmy Lai sitzt im Gefängnis. Nach anhaltenden Demonstrationen und dem Ruf nach mehr Demokratie   hatte die kommunistische Führung in Peking vor eineinhalb Jahren das umstrittene Sicherheitsgesetz erlassen. Die vage Formulierung des Gesetzestextes erleichtert das Vorgehen gegen Aktivitäten, die China   einstuft - und zielt damit auf Kritiker der Hongkonger Regierung und der chinesischen Führung. Mehr als 100 Aktivisten wurden festgenommen oder warten auf ihren Prozess. Viele wurden bereits verurteilt. Aus Angst vor Strafverfolgung haben sich   ins Ausland abgesetzt.  die prodemokratische Zeitung „Apple Daily“ in Hongkong als subversiv, separatistisch, terroristisch oder verschwörerisch viele Oppositionsmitglieder",tagesspiegel
Rückschlag für Peking . Die Hongkonger haben gewählt – indem sie der Wahl fernblieben,no_author,"20.12.2021, 14:40 Uhr",https://www.tagesspiegel.de/meinung/rueckschlag-fuer-peking-die-hongkonger-haben-gewaehlt-indem-sie-der-wahl-fernblieben/27909964.html,"Hongkongs Zivilgesellschaft lebt. Die Legislativratswahlen verzeichneten am Sonntag  . Es ist eine Blamage für Regierungschefin Carrie Lam und das hinter ihr stehende Pekinger Regime. Noch bei den Bezirksratswahlen 2019 lag die Beteiligung bei 71 Prozent, das pro-demokratische Lager errang fast 90 Prozent der Sitze. Doch nun durften ausschließlich von der Regierung autorisierte „Patrioten“ antreten, darunter einige Alibi-Moderate (die keinen der 20 zur Wahl stehenden Sitze gewannen) – dies in Hongkongs ohnehin nur teildemokratischem System, in dem bloß die Hälfte vom Volk gewählt war. Die Legislative ist nun vollständig  . Die Bevölkerung ist es nicht. Schon 2020 hatten Hongkonger begonnen, auf Demos unbeschriebene weiße Blätter hochzuhalten, weil pro-demokratische Slogans unter dem „Nationalen Sicherheitsgesetz“ als separatistisch verfolgt werden. Diese Strategie hat nun Ausdruck im Wahlsystem gefunden. Es wurde ein Referendum des Schweigens, der leeren Wahlzettel. Carrie Lam, abermals in Bedrängnis, könnte im März eine zweite Amtszeit anstreben. Ihre von Protesten und Gewalt gezeichnete Regierungsära,  , könnte noch die längste in der Geschichte der Sonderverwaltungszone werden. Legitimiert wäre sie dann noch weniger, als sie es ohnehin schon ist. Zuletzt hatte Lam abenteuerlich argumentiert, eine geringe Wahlbeteiligung signalisiere große Zustimmung für die Regierung. Das Volk, so zufrieden! Wenn man einem Durstigen ein Glas Öl und ein Glas Seife anbietet und er beides ablehnt, heißt das dann auch, dass er offensichtlich keinen Durst hat? Weil auch Peking die Antwort kennt, hatten die Behörden verzweifelt versucht, die Wahlbeteiligung anzukurbeln. Boykott-Aufrufe sind sowieso illegal. An der Grenze zum Festland, naturgemäß eher von Peking-freundlichen Hongkongern bewohnt, wurden eigens drei Wahllokale eingerichtet – Presse und unabhängige Beobachter ausgeschlossen –, in denen bis zu 110.000 Wahlberechtigte abstimmen sollten. Es brachte nichts. In sozialen Medien protestierten Hongkonger unter dem Hashtag #ReleaseMyCandidate.  . Andere, etwa Nathan Law und Ted Hui, wurden ins Exil gedrängt. Die Wahl hat erneut gezeigt: An der Urne scheitert das Regime krachend. Mit ihrer Weigerung, sich an der von Peking inszenierten Farce zu beteiligen, hat eine überwältigende Mehrheit der Hongkonger eindrucksvoll unterstrichen, was ohnehin jeder wusste: Eine Wahl, in der nur Patrioten kandidieren dürfen, ist unpatriotisch. eine historisch niedrige Beteiligung von 30 Prozent in der Hand Pekings bislang das wohl düsterste Kapitel im chinesischen Hongkong Prominente Pro-Demokraten, allen voran Joshua Wong, sitzen im Gefängnis",tagesspiegel
Blockade im UN-Sicherheitsrat . China und Russland lehnen Ausnahmen von Taliban-Sanktionen ab,no_author,"21.12.2021, 09:29 Uhr",https://www.tagesspiegel.de/politik/blockade-im-un-sicherheitsrat-china-und-russland-lehnen-ausnahmen-von-taliban-sanktionen-ab/27912550.html,"China und Russland haben im UN-Sicherheitsrat einen Vorschlag der USA zur Einführung ""humanitärer Ausnahmen"" im Sanktionsregime gegen das von   kontrollierte Afghanistan abgelehnt.  Einen entsprechenden Resolutionsentwurf der USA blockierten die beiden Vetomächte am Montag (Ortszeit). Ein neuer Entwurf sieht nun eine einjährige Übergangsregelung vor, um trotz der Sanktionen gegen die Taliban humanitäre Hilfen zu ermöglichen. Ein Diplomat sagte der Nachrichtenagentur AFP, Peking und Moskau hätten einen Absatz in dem ersten Resolutionsentwurf kritisiert, der es dem für die Afghanistan-Sanktionen verantwortlichen Komitee erlauben sollte, Ausnahmen von den Finanzsanktionen gegen die Taliban zu beschließen, um bei Bedarf ""weitere Unterstützung für Afghanistan"" zu gewährleisten. China sei ""grundsätzlich gegen Sanktionen"" und daher auch gegen Mechanismen, die im Einzelfall Ausnahmeregelungen erlaubten. Der chinesische UN-Botschafter Zhang Jun betonte im Online-Dienst Twitter, ""humanitäre Hilfen und lebensrettende Unterstützung"" müssten ""das afghanische Volk ohne jegliche Behinderung erreichen"" können. ""Künstlich verhängte Bedingungen oder Einschränkungen"" seien ""nicht akzeptabel"". Nach aktuellem Stand sind bei den seit 2015 geltenden Sanktionen gegen die Taliban keine humanitären Ausnahmeregelungen vorgesehen, wie ein Diplomat sagte. Dies bedeute, dass etwa humanitäre Helfer, die Finanztransaktionen mit von Sanktionierten geleiteten Ministerien vornehmen, gegen die Sanktionsauflagen verstoßen. Am späten Montagabend legten die USA einen neuen Resolutionsentwurf vor, der auf den strittigen Absatz verzichtet. Stattdessen sieht er eine Regelung vor, wonach humanitäre Hilfen keine Verletzung der Sanktionen darstellen sollen. . Das Land ist in hohem Maße auf ausländische Hilfen angewiesen, die seit der Machtübernahme der radikalislamischen Taliban-Miliz im August stark zurückgefahren wurden.  Viele Geldgeber hatten ihre Zahlungen damals eingefroren. Die UNO hat bereits wiederholt vor einer humanitären Katastrophe in dem Land gewarnt. Rund 22 Millionen Afghanen und damit  .  den radikalislamischen Taliban Afghanistan steckt in einer schweren wirtschaftlichen und humanitären Krise die Hälfte der Bevölkerung sind demnach von ""akuter"" Nahrungsmittelknappheit betroffen",tagesspiegel
Scholz muss sich vom Modell der Ostpolitik lösen . Berlin gilt schon als „Hauptstadt der Feiglinge“,no_author,"26.12.2021, 12:03 Uhr",https://www.tagesspiegel.de/politik/scholz-muss-sich-vom-modell-der-ostpolitik-loesen-berlin-gilt-schon-als-hauptstadt-der-feiglinge/27913674.html,"Das Erstaunlichste an der deutschen Diskussion über Russland ist, wie oberflächlich bis eskapistisch sie seit Jahren verläuft. Ihr einziges Ziel scheint zu sein, der Wahrheit nicht ins Auge schauen zu müssen. Das ist für die faktische Vormacht der Europäischen Union schon ein ziemlicher Akt der Feigheit.  Will die neue Bundesregierung außenpolitische Wirkung entfalten, sollte sie sich darum bemühen, das neue internationale Synonym für Berlin – „capital of cowards“, also Hauptstadt der Feiglinge – schleunigst loszuwerden.  Auf dem Weg dorthin kommt die deutsche Regierung an einer elementaren Einsicht nicht vorbei: Wladimir Putins Russland ist eine reine Negationsmacht, deren Drohpotenzial sich gerade wieder beim massiven Truppenaufmarsch an der ukrainischen Grenze zeigt. In dieser Erkenntnis lassen sich alle Handlungsstränge russischer Machtausübung auf internationaler Ebene bündeln.  Ob es um die   geht, das Baltikum, die mittlerweile gerichtsfest vom russischen Staatsapparat beauftragten politischen Morde auf deutschem Territorium oder die versuchte Aushöhlung westlicher Demokratien durch Cyberangriffe – die Liste der Moskauer Übergriffe ist lang. Und die russische Reaktion auf entsprechende Kritik immer die gleiche: alles eine Erfindung des Westens. Wie soll Deutschland darauf angemessen reagieren? Bei der Suche nach Antworten muss man sich nicht lange mit der unheiligen Putin-Versteher-Allianz zwischen AfD und Linkspartei aufhalten. Entscheidend ist, ob die SPD sich von ihrem langhaltenden Wunschdenken in Sachen Russland verabschieden kann – also in den bilateralen Beziehungen eine historische Wende vollzieht.  Besonders  . Kurz nach seinem Amtsantritt erklärte er in kaum zu überbietender politische Naivität, sein Handeln gegenüber Moskau werde sich an der Ostpolitik Willy Brandts und Helmut Schmidts orientieren. Was Scholz übersieht: Damals hatte die Sowjetunion eine schrittweise Öffnungspolitik gegenüber dem Westen eingeleitet, nicht zuletzt um ihr zerbröselndes wirtschaftliches Fundament zu stärken.  Von einer Öffnungspolitik jedoch kann bei Putin keine Rede sein, im Gegenteil: Sein Handeln ist von der Vorstellung geleitet, der Zusammenbruch der Sowjetunion im Jahr 1991 sei die größte Katastrophe der Weltgeschichte gewesen. Zugleich hat Putin nichts unternommen, um die Produktivität der russischen Volkswirtschaft zu stärken und ihre Abhängigkeit von Öl und Gas zu verringern. Der Kreml-Herrscher agiert noch weniger aufgeklärt als Kronprinz Mohammed bin Salman in Saudi-Arabien. Der lässt zwar auch im Ausland morden, bemüht sich aber um eine Wachstumsperspektive seines Landes für das post-fossile Zeitalter. Vor diesem Hintergrund ist es wenig erstaunlich: Sämtliche deutsche Bemühungen um eine „Modernisierungspartnerschaft“ mit Russland sind vergebens gewesen. Denn in Putins Umfeld geht es nicht um wirtschaftliche Modernisierung, sondern um die Ausbeutung russischer Rohstoffreserven zum Wohl von Oligarchen.  Scholz sollte sich aus der Kontinuität seiner Vorgängerin Angela Merkel lösen und nicht länger behaupten, Nord Stream 2 sei ein „rein privatwirtschaftliches Projekt“. Offenbar übersehen Scholz und mit ihm weite Teile der SPD immer noch, dass Putin das Geld, das wir ihm für die Erdgaslieferungen zahlen, nicht zuletzt für Milliardenkredite nutzt, mit denen er das Regime des belarussichen Diktators Alexander Lukaschenko am Leben hält.  Das sind Zusammenhänge,   Sie will die deutsche Abhängigkeit zum latent zu Erpressungen neigenden Putin-Regime zu Recht nicht weiter erhöhen. Und deshalb lehnt sie die Inbetriebnahme von Nord Stream 2 aus nüchternem geopolitischem Kalkül ab, aber auch zum Schutz der ukrainischen Gaslieferungen.  Theoretisch ist das Konzept der Deeskalation zwar nach wie vor auch für die deutsch-russischen Beziehungen richtig. Praktisch aber betrachtet Putin westliche Deeskalation als Zeichen der Schwäche, die er für neue Angriffe nutzen kann. Denn Russland ist schon seit vielen Jahren nur noch eine „Negationsmacht“, zu der man keine Brücken mehr bauen kann. Putin geht es allein um das innenpolitische Bedienen des Hungers der Kleptokraten.  Im Fall China übrigens liegen die Verhältnisse anders. Die Volksrepublik ist eine „Schaffensmacht“. Sie hat ihre Volkswirtschaft mit geradezu atemberaubendem Erfolg modernisiert – wobei die kommunistische Führung trotz der Etablierung einer digitalen Überwachungsdiktatur, die Freiheitsrechten im westlichen Sinne Hohn spricht, auf die Unterstützung breiter Bevölkerungskreise zählen kann. Wegen seines Erfolgs kann Peking, ganz anders als Moskau, beispielsweise international auf die Durchsetzung chinesischer Industriestandards pochen. China hat Unternehmen wie den Telekommunikationsausrüster Huawei– Russland hat nichts dergleichen. Dem Westen mag das gigantische chinesische Infrastrukturprojekt „Neue Seidenstraße“ nicht gefallen. Eine gewisse Achtung kann man der geopolitischen Initiative Pekings hingegen kaum absprechen. Putins Regime ist da ganz anders gestrickt und nur darauf aus, die Uhr in Richtung eines neorussichen Imperialismus zurückzudrehen. Zu diesem Zweck setzt der Kreml auf Erpressung und militärische Gewaltandrohung. Damit fordert er Deutschland und Europa unmissverständlich heraus.  Putin zielt auf ein „Rollback“ all dessen, was seit 1990 in Europa in puncto nationaler Befreiung erreicht worden ist.  Soll sich Deutschland mit seiner eigenen Wiedervereinigung begnügen, die Unabhängigkeit der baltischen Nationen im Interesse des Friedens mit Russland aber zur Disposition stellen? Das kann und darf nicht der Fall sein, will Berlin das Prinzip des Rechts auf Selbstbestimmung nicht aufgeben.  Etwas großsprecherisch hatte Scholz im Bundestagswahlkampf wiederholt erklärt, wer bei ihm Führung bestelle, der bekomme sie auch. Ins Außenpolitische gewendet ist der Lackmustest für Scholz' Anspruch eine unmissverständliche Haltung gegenüber Moskau. Bei den geplanten Verhandlungen im sogenannten Nato-Quint-Format hat Deutschland die Chance, etwa Russlands Forderungen, die Nato dürfe ohne Zustimmung Moskaus keine zusätzlichen Soldaten und militärisches Gerät in den osteuropäischen Staaten zu stationieren, eindeutig zurückzuweisen. Scholz sollte schließlich kein Interesse daran haben, als deutscher Neville Chamberlain in die Geschichte einzugehen.  Gaspipeline North Stream 2 für den neuen Bundeskanzler Olaf Scholz scheint der Weg noch lang zu sein die Annalena Baerbock, unsere neue Außenministerin, sehr genau versteht. Appeasement-Politik kann hier nicht die richtige Antwort sein.",tagesspiegel
Jetzt auch noch Omikron . Chinas Olympia-Macher spüren „gewaltigen Druck“,no_author,"23.12.2021, 09:59 Uhr",https://www.tagesspiegel.de/sport/jetzt-auch-noch-omikron-chinas-olympia-macher-spueren-gewaltigen-druck/27920722.html,"Die Pandemie konfrontiert die Organisatoren der Olympischen Winterspiele in sechs Wochen in Peking nach eigenen Worten mit „gewaltigem Druck und Herausforderungen“. Die Ausbreitung der neuen Virus-Variante Omikron bringe „große Unsicherheit für die weltweite Covid-Situation“, sagte Han Zirong, Vizepräsidentin des Organisationskomitees, am Donnerstag der Presse in Peking. Es sei höchst wahrscheinlich, dass „eine bestimmte Zahl von Fällen“ während der Spiele auftrete, da so viele Teilnehmer aus allen Regionen der Welt und aus China zusammenkämen, sagte Han Zirong. Die Anforderungen der chinesischen Behörden zur Vorbeugung gegen Covid-19 müssten „energisch umgesetzt“ werden, um die   zu wahren. Ihr Appell erfolgte, kurz nachdem in China nach langer Zeit wieder ein Lockdown über eine Millionen-Metropole verhängt worden war. Im Rahmen ihrer strikten Null-Covid-Politik erließen die Behörden massive Ausgangssperren für die 13 Millionen Einwohner von Xi'an (Provinz Shaanxi). Seit Mitternacht dürfen sie ihre Wohnungen nicht mehr verlassen - bis auf wenige Ausnahmen. Ein Familienmitglied darf jeden zweiten Tag einkaufen gehen. 63 Infektionen wurden am Donnerstag gemeldet.  Der Ausbruch gehe auf „importierte Fälle“ zurück, hieß es. China verfolge eine „dynamische Null-Covid-Strategie“, betonte Han Zirong, die auch Generalsekretärin des Organisationskomitees ist. Ob neue Maßnahmen vor oder während der Spiele vom 4. bis 20. Februar ergriffen werden müssten, hänge von der Veränderung der Lage weltweit und in China ab - besonders von der Ansteckung und Schädlichkeit der Omikron-Variante.  „Wir schenken den Veränderungen in der Pandemie große Aufmerksamkeit“, sagte Han Zirong. „Nur indem wir flexibel bleiben, können wir die Risiken und Herausforderungen bewältigen, die uns die Corona-Pandemie bringt.“ Für die Spiele, die in Peking sowie in Yanqing und Zhangjiakou in der Hügellandschaft vor den Toren der Hauptstadt stattfinden, werden ohnehin schon strikte Vorsichtsmaßnahmen ergriffen.  Alle Olympia-Teilnehmer können sich nur in „geschlossenen Kreisläufen“ bewegen, müssen sich täglich testen lassen und werden bei einer Infektion sofort isoliert. Ausländische Zuschauer sind auch nicht zugelassen. Ob und unter welchen Umständen inländisches Publikum teilnehmen kann, wird nach Darstellung von Han Zirong noch weiter erkundet. Die Pläne würden „zur rechten Zeit“ verkündet.  Der Vizedirektor des Büros zur Epidemiebekämpfung des Organisationskomitees, Huang Chun, bedauerte die  . Angesichts der Corona-Probleme im US-Sport, steigender Infektionen und Spielabsagen hatte die nordamerikanische Profiliga NHL am Vortag entschieden, ihre besten Spieler nun doch nicht nach China zu schicken. Damit fällt die größte Attraktion der Winterspiele der Pandemie zum Opfer. Huang Chun verteidigte die geplanten strengen Maßnahmen wie Isolation, Quarantäne und längere Krankenhausaufenthalte bei Symptomen, die einer der   waren. Auch lehnte er Änderungen ab. „Wir sind überzeugt, dass diese Vorbeugungs- und Kontrollmaßnahmen definitiv das Risiko einer Verbreitung der Viruskrankheit verringern werden.“ Auch müsse die Sicherheit der Sportler und anderer Teilnehmer, der ganzen Veranstaltung und der chinesischen Bevölkerung gesichert werden.   Mit strikten Maßnahmen wie Ausgangssperren, Massentests, Zwangsquarantäne, Kontaktverfolgung und weitgehenden Reise- und auch Einreisebeschränkungen hat China das Virus weitgehend in den Griff bekommen. Seit mehr als einem Jahr ist es um die Pandemielage im bevölkerungsreichsten Land deutlich besser bestellt als in vielen anderen Nationen. Das tägliche Leben und die Wirtschaft haben sich längst normalisiert. Doch hat die ansteckendere Delta-Variante mehrere Ausbrüche verursacht - und jetzt fürchten Verantwortliche die Omikron-Variante, die sich noch schneller ausbreitet.  Sicherheit der Olympia-Teilnehmer und der chinesischen Öffentlichkeit Absage der Eishockey-Profis aus den USA Gründe für die Absage der Profis",tagesspiegel
