title,author,date_published,url,article_text,source
„Es ist nur eine Frage der Zeit“ . Neuer Virusausbruch in Südostasien jederzeit möglich,no_author,"17.12.2021, 09:53 Uhr",https://www.tagesspiegel.de/wissen/es-ist-nur-eine-frage-der-zeit-neuer-virusausbruch-in-suedostasien-jederzeit-moeglich/27902702.html,"Zwei Jahre nach Beginn der Corona-Pandemie lauert im Umgang mit wilden Tieren in China und Südostasien unverändert die  . Das Risiko steckt in überfüllten Märkten, mangelnder Hygiene auch beim Transport, in Zuchtbetrieben oder bei der Schlachtung.  „Es ist nur eine Frage der Zeit, bis wieder so etwas kommt“, sagte ein europäischer Diplomat und Gesundheitsexperte der Deutschen Presse-Agentur in Peking. „Das ist eine Zeitbombe.“ Die Warnungen werden gestützt durch neue wissenschaftliche Untersuchungen zum Wildtiergeschäft.  Ausländische und chinesische Forscher in   haben 1725 Wildtiere aus fünf Säugetiergruppen untersucht. Dabei wurden 45 zuvor unbekannte Viren entdeckt, davon 18 „für Menschen potenziell hochriskante“ Erreger, heißt es in der Untersuchung, die gerade durch die Begutachtung geht.  Die Studie verdeutliche, warum gehandelte Wildtiere und Märkte mit lebenden Tieren ein Problem seien und irgendwann zu einer Pandemie führen müssen, sagte Mitautor Edward Holmes, Professor für Infektionskrankheiten an der Universität Sydney, der Nachrichtenagentur Bloomberg. Der auf Bäumen lebende Larvenroller (Paguma larvata), der zu den Schleichkatzen gehört und schon mit dem Ausbruch des ersten Sars-Virus 2002/03 in Verbindung gebracht worden war, habe die höchste Zahl potenziell gefährlicher Erreger aufgewiesen, stellten die Wissenschaftler fest. Auch sei die Übertragung eines Alpha-Coronavirus von Fledermäusen, die als Ursprung für Sars-CoV-2 vermutet werden, auf einen Larvenroller entdeckt worden. „Die Zucht und der Handel mit wilden Tieren wie Larvenrollern sind absolut gefährlich“, sagte der beteiligte Professor Shuo Su von der Landwirtschaftsuniversität in Nanjing der dpa. Das Problem müsse angegangen werden. „Anderenfalls können in der Zukunft neue Erreger in der Bevölkerung auftauchen.“ China habe die Zucht von Larvenrollern und anderen Tieren zwar bereits verboten. Die Aufmerksamkeit müsse sich gleichwohl auch auf Südostasien richten, wo es noch viel mehr Wildtierhandel gebe - „legal und illegal“. Die chinesische Seite habe angefangen, den Wirtschaftszweig stärker zu regulieren, bestätigte der europäische Gesundheitsexperte in Peking, der namentlich nicht genannt werden wollte. Doch das Problem in China sei immer die Umsetzung: „Tief in den Provinzen und je weiter man von den Städten wegkommt, gibt es Dinge, die nicht passieren dürften.“ Mit der weit verbreiteten „Vetternwirtschaft“ in China sei es auch schwierig, richtig durchzugreifen. Wo das Virus hinter Covid-19 genau hergekommen ist, wird vielleicht nie geklärt werden. Aber sicher ist, dass die erste massenhafte Verbreitung auf den Huanan-Markt in der zentralchinesischen Stadt Wuhan zurückgeführt werden kann.  Besonders bei den Wildtierständen entdeckten Gesundheitsbehörden viele Spuren des  . Von 585 Proben waren 33 positiv, davon 93 Prozent aus dem westlichen Teil des Marktes, wo wilde Tiere verkauft wurden, wie die Staatsagentur Xinhua im Januar 2020 berichtet hatte. „Es deutet darauf hin, dass das Virus von wilden Tieren stammt, die auf dem Huanan-Markt verkauft wurden.“ Huanan sei ein typisches Beispiel für solche Märkte (Wetmarket) mit frischen Waren und Tieren in Käfigen, erläutern die Forscher der Studie: „Schlechte hygienische Bedingungen und enger Kontakt zwischen Tieren und Menschen sowie eine breite Mischung von Arten innerhalb des Lebendtiermarktes und der zu beliefernden Restaurants machen sie zu einer idealen Brutstätte für neu entstehende Infektionskrankheiten.“ Das Geschäft mit wilden Tieren war in China in den zwei Jahrzehnten zuvor stark ausgebaut worden. 2016 wurde in dem Bereich ein Umsatz von 520 Milliarden Yuan gemacht, heute umgerechnet 71 Milliarden Euro. Mehr als 14 Millionen Menschen fanden Arbeit, meist ungelernte Arbeiter, die in Familienbetrieben tätig sind.  Die Industrie hat viele Menschen aus der Armut geholt. Wilde Tiere werden in China zum Verzehr, für Felle, Medizin und Wissenschaft gezüchtet - darunter Bären, Füchse, Dachse, Nerze, Schuppentiere, Stachelschweine, Makaken, Frettchen, Eichhörnchen, Waschbären, Rehe, Marderhunde und mehr. Nach dem Ausbruch von Covid-19 wurde der Handel 2020 eingeschränkt und der Verzehr von wilden Tieren verboten. Viele Farmen wurden geschlossen, die Betreiber meist auch entschädigt. Die Zucht für Pelze, Wissenschaft, Medizin und Zoos darf allerdings weitergehen. Das stieß selbst in China auf Kritik von Wissenschaftlern, die viel weiter gehende Verbote forderten. Die   macht den größten Teil des Wildtiergeschäfts aus. Dabei ist die Gefahr groß, dass Viren auch einmal vom Menschen auf das Tier und zurück übertragen werden und dabei mutieren, wie es in Nerzfarmen in Dänemark geschah. „Die Zucht und das Schlachten wilder Tiere, egal für welchen Zweck, birgt das Risiko zoonotischer Krankheiten“, warnte eine Oxford-Studie. Doch scheiterten Versuche, im Rahmen der Vereinten Nationen eine globale Politik zu verabschieden. So sollten zumindest in der Wildnis gefangene Tiere auf keinen Fall auf Märkten gehandelt oder überhaupt dorthin gebracht werden. Ziel des Plans war, dass dort ausschließlich Tiere aus geregelter und überwachter Zucht verkauft oder verarbeitet werden. Dem Vorhaben stellte sich aber der Chefökonom der UN-Landwirtschaftsorganisation (FAO) in den Weg - mit Rückendeckung des chinesischen FAO-Chefs Qu Dongyu. (dpa) Gefahr eines neuen Virus-Ausbruchs China Coronavirus Pelztierzucht  ",tagesspiegel
„Nicht als Propaganda-Puppen missbrauchen lassen“ . CDU fordert von Scholz und Baerbock diplomatischen Olympia-Boykott,no_author,"12.12.2021, 19:33 Uhr",https://www.tagesspiegel.de/politik/nicht-als-propaganda-puppen-missbrauchen-lassen-cdu-fordert-von-scholz-und-baerbock-diplomatischen-olympia-boykott/27886840.html,"Der menschenrechtspolitische Sprecher der Unions-Fraktion, Michael Brand (CDU), fordert von Kanzler Olaf Scholz (SPD) und Außenministerin Annalena Baerbock (Grüne), dass sie keine politischen Vertreter aus Deutschland zu den Olympischen Winterspielen nach Peking (4.- 20. Februar 2022) schicken. „  ist das Mindeste, was Deutschland gemeinsam mit anderen in Europa tun kann“, sagte Brand dem Tagesspiegel.  „Selbst kleine Länder haben schon erklärt, dass sie niemanden nach China entsenden, und Deutschland sollte sich nicht kleiner machen als es ist. Es darf keinen Ausverkauf von Menschenrechten gegenüber einem großen Markt geben, denn das würde den Ausverkauf der eigenen Werte gegenüber einem immer aggressiveren und brutaleren Regime bedeuten“, betonte Brand.  , keine Politiker und Diplomaten zu schicken.  mitgeteilt, man arbeite noch an einer gemeinsamen Position der Koalition und der EU-Staaten: „Wir wollen das Gespräch mit vielen anderen suchen wollen, weil wir abgestimmt agieren wollen“, sagte der Bundeskanzler.   solch einen politischen Boykott ausgesprochen. Neben der Unterdrückung der Uiguren, dem Niederschlagen der Demokratiebewegung in Hongkong hatte zuletzt das Verschwinden der chinesischen  weltweit negative Schlagzeilen gemacht.  Brand betonte nun mit Blick auf Chinas Staatspräsident Xi Jinping: „Es gibt überhaupt keine Notwendigkeit bei Olympia, einem Fest des Friedens und der Verständigung, neben einem zu stehen, der foltern und töten lässt.“ Wladimir Putin und andere passten dorthin, „aber keine Demokraten aus dem Westen, die sich dann als Propaganda-Puppen für das kommunistische Regime missbrauchen lassen würden.“ Die neue Regierung mit   werde hier an einem wichtigen Beispiel erstmals unter Beweis stellen müssen,   Und ob sie die Kraft und das Profil haben, „einen Grundsatz deutscher Politik aufrechtzuerhalten oder sich und ihre Grundsätze gegenüber der kommunistischen Führung in China verbiegen lassen.“   Brand betonte, ein genereller Boykott stehe dabei ja nicht zur Debatte, sondern es gehe um ein Zeichen: „Die Sportler sollen Olympia machen, aber die Politik ist etwas ganz anderes.“ Brand betonte, die Menschenrechte zu verkaufen, weil China großer Markt ist, sei „nicht nur ein Verrat an den eigenen Grundsätzen, sondern auch politisch riskant, denn die kommunistische Führung in China hat ein aggressives Programm, das nichts weniger als die Hegemonie in Politik, Wirtschaft und sogar Militär anstrebt“. Dem auch noch das Siegel des demokratischen Westens zu geben, wäre gegen die eigenen nationalen Interessen gerichtet. Der diplomatische Boykott Auch die USA und Kanada haben erklärt Scholz hatte bei einem Treffen mit dem französischen Präsidenten Emmanuel Macron Der neue SPD-Chef Lars Klingbeil hatte sich zuletzt gegen Tennisspielerin Peng Shuai  Scholz und Baerbock „wie wichtig ihnen die Menschenrechte tatsächlich sind“",tagesspiegel
Umstrittene Abstimmung unter Chinas Kontrolle . Wahlbeteiligung in Hongkong so gering wie nie zuvor,no_author,"20.12.2021, 06:21 Uhr",https://www.tagesspiegel.de/politik/umstrittene-abstimmung-unter-chinas-kontrolle-wahlbeteiligung-in-hongkong-so-gering-wie-nie-zuvor/27908456.html,"Negativrekord in Hongkong: An der ersten Parlamentswahl seit der faktischen Ausschaltung der Demokratiebewegung in der chinesischen Sonderverwaltungsregion haben sich weniger Menschen denn je beteiligt. Die Wahlbeteiligung bei dem umstrittenen Votum am Sonntag fiel auf nur noch 30,2 Prozent - nachdem vor fünf Jahren noch 58,3 Prozent abgestimmt hatten. Wegen der mangelnden freien Wahlmöglichkeiten hatten viele Hongkonger die Abstimmung nach dem neuen Wahlsystem boykottiert. Die schlechteste Wahlbeteiligung seit der Rückgabe der früheren britischen Kronkolonie 1997 an China wurde als Rückschlag für die Bemühungen gewertet, das eingeschränkte Verfahren zu legitimieren. Nur 1,35 der 4,5 Millionen Wahlberechtigten gaben dafür ihre Stimme ab, wie die Behörden in der Nacht zum Montag mitteilten. Die weiteren Ergebnisse sollen im Laufe des Montags vorliegen. Zwar waren Wahlen zum Legislativrat in Hongkong niemals völlig frei, allerdings konnte die Bevölkerung diesmal nur noch über 20 der 90 Abgeordnetenmandate bestimmen. 40 weitere wurden von einem handverlesenen und pekingtreuen Wahlkomitee ausgewählt, während weitere 30 von Berufsständen ausgesucht wurden. Es wurden auch nur Kandidaten zugelassen, die als „Patrioten“ eingestuft wurden. Mitglieder der kritischen Demokratiebewegung waren damit ausgeschlossen. Ein Weißbuch der chinesischen Regierung, das am Montag vorgelegt wurde, sprach von Demokratie „mit Hongkonger Besonderheiten“. Trotz der stark eingeschränkten Wahlmöglichkeiten ist in dem Dokument die Rede von einer „freien, fairen, gerechten, sicheren und sauberen“ Abstimmung. Das Wahlsystem in Hongkong sei „weitgehend repräsentativ“, hieß es weiter. Regierungschefin Carrie Lam will noch am Montagabend zu ihrem jährlichen Besuch nach Peking reisen. Im Vorfeld war bereits erwartet worden, dass viele Menschen der Wahl fernbleiben würden, weil sie   in Peking jede Hoffnung auf demokratische Veränderungen aufgegeben haben. Peking hatte vor eineinhalb Jahren ein international heftig kritisiertes Sicherheitsgesetz erlassen. Dessen vage gefasste Formulierungen richten sich gegen Aktivitäten, die China als subversiv, separatistisch, terroristisch oder verschwörerisch ansieht. Die Umsetzung des Gesetzes führte dazu, dass die lange anhaltenden Massendemonstrationen für mehr Demokratie schlagartig ein Ende fanden. Viele   landeten im Gefängnis. Andere setzten sich ins Ausland ab, um der Verfolgung zu entgehen. Seit dem 1. Juli 1997 gehört Hongkong wieder zu China. Eigentlich soll es nach dem Grundsatz „Ein Land, zwei Systeme“ eigenständig regiert werden, wie es damals hieß. Auch bekamen die sieben Millionen Hongkonger seinerzeit die Zusage, bis 2047 ein „hohes Maß an Autonomie“ und viele politische Freiheiten genießen zu können. Seit dem Erlass des Sicherheitsgesetzes reden viele aber nur noch von „Ein Land, ein System“, weil Hongkong damit China immer ähnlicher werde.  nach dem hartem Durchgreifen der Zentralregierung Bürgerrechtler, Protestführer und Politiker des demokratischen Lagers",tagesspiegel
Mahnwache für Tiananmen-Massaker . Hongkonger Gericht spricht China-Kritiker Lai und weitere Aktivisten schuldig,no_author,"09.12.2021, 05:10 Uhr",https://www.tagesspiegel.de/politik/mahnwache-fuer-tiananmen-massaker-hongkonger-gericht-spricht-china-kritiker-lai-und-weitere-aktivisten-schuldig/27876682.html,"Der   sowie zwei weitere Demokratieaktivisten sind wegen ihrer Teilnahme an einer Tiananmen-Mahnwache in Hongkong verurteilt worden.  Ein Bezirksgericht in Hongkong sprach   zusammen mit der ehemaligen Journalistin Gwyneth Ho und dem Anwalt Chow Hang-tung am Donnerstag unter anderem der Anstiftung und Teilnahme an einer nicht genehmigten Versammlung schuldig. Die Strafen werden zu einem späteren Zeitpunkt verkündet. Die drei sind die letzten von mehr als zwei Dutzend pro-demokratischen Politikern und Aktivisten, die wegen der Mahnwache im vergangenen Jahr angeklagt wurden. Bei der alljährlichen Veranstaltung wurde der Opfer der gewaltsamen Niederschlagung der Demokratieproteste in Peking im Jahr 1989 gedacht. Die Behörden hatten die seit Jahrzehnten Anfang Juni stattfindende Gedenkfeier vergangenes Jahr vorgeblich wegen der Corona-Pandemie verboten. Kurz darauf trat das sogenannte Nationale Sicherheitsgesetz in Kraft, das zahlreiche vormals legale Forderungen nach mehr Demokratie und Selbstbestimmung für die chinesische Sonderverwaltungszone unter Strafe stellte. Seitdem wurden zahlreiche Organisatoren und Teilnehmer der Mahnwache wegen angeblicher staatsgefährdender Delikte angeklagt. Ein Mahnwache-Museum wurde von den Behörden geschlossen. Zuletzt hatten Gerichte 16 Politiker und Aktivisten - darunter der prominente Aktivist Joshua Wong - wegen ihrer Teilnahme an der Mahnwache zu Haftstrafen zwischen sechs und 10 Monaten verurteilt worden. Einige davon wurden zur Bewährung ausgesetzt. Auch in diesem Jahr hatte es wieder eine Mahnwache gegeben, die von den Behörden jedoch weitestgehend unterbunden wurde.  inhaftierte Medienunternehmer Jimmy Lai Lai Hongkong gehört seit dem 1. Juli 1997 wieder zu China, wird aber nach dem Grundsatz „Ein Land, zwei Systeme“ regiert. Diese Vereinbarung sieht eigentlich vor, dass Hongkonger für 50 Jahre bis 2047 „ein hohes Maß an Autonomie“ und viele Freiheiten genießen. Seit der Verabschiedung des Sicherheitsgesetzes reden viele jedoch nur noch von „Ein Land, ein System“. ",tagesspiegel
China droht USA mit Vergeltung . Viel Ärger um ein wenig Olympia-Boykott,Albrecht Meier,"07.12.2021, 18:08 Uhr",https://www.tagesspiegel.de/politik/china-droht-usa-mit-vergeltung-viel-aerger-um-ein-wenig-olympia-boykott/27871094.html,"Menschenrechtsaktivisten haben schon lange darauf gedrängt, nun ist die Entscheidung getroffen. Die USA boykottieren die   wegen Menschenrechtsverletzungen der chinesischen Regierung, allerdings nur diplomatisch. US-Athleten dürfen an den Wettbewerben im Februar 2022 teilnehmen, Washington entsendet aber keine Regierungsvertreter, wie das Weiße Haus am Montag ankündigte. China begehe einen „Völkermord und Verbrechen gegen die Menschlichkeit“ an den muslimischen Uiguren in der Region Xinjiang und auch andere Menschenrechtsverletzungen, erklärte die Pressesprecherin des Weißen Hauses, Jen Psaki. Die Sportlerinnen und Sportler seien von dem Boykott nicht betroffen. „Die Athleten des Teams USA haben unsere volle Unterstützung. Wir werden zu 100 Prozent hinter ihnen stehen und sie von zu Hause aus anfeuern.“ China kritisierte den diplomatischen Boykott der USA und drohte mit Vergeltung. „Die USA werden den Preis für ihr Fehlverhalten bezahlen. Warten Sie ab“, sagte Außenamtssprecher Zhao Lijian. Das Internationale Olympische Komitee (IOC) teilte mit, es respektiere die Ankündigung eines diplomatischen Boykotts der Winterspiele durch die USA. Die Anwesenheit von Regierungsvertretern sei eine rein politische Entscheidung für jede Regierung, sagte ein IOC-Sprecher. In der EU waren die Mitgliedstaaten am Dienstag noch dabei, sich angesichts des diplomatischen Boykotts der USA zu sortieren. Ein Sprecher der EU-Kommission unterstrich die Unterstützung der Brüsseler Behörde für die Integrität des Sports und der „weltweiten Achtung der Menschenrechte“. Großereignisse wie die Olympischen Spiele „sollten nicht für politische Propaganda genutzt werden“, fügte er hinzu. Dies kann als deutlicher Fingerzeig an die Adresse Chinas gedeutet werden, die Winterspiele nicht politisch zu missbrauchen. Welche Schlussfolgerungen daraus zu ziehen sind, überlässt die Kommission derweil den Mitgliedstaaten. Sportpolitische Fragen fallen nicht in die Kompetenz der EU. Unter den EU-Staaten ist es vor allem Frankreich, das nach einem abgestimmten Vorgehen angesichts des US-Boykotts ruft. Die Regierung in Paris wolle sich mit den anderen EU-Staaten absprechen, hieß es aus dem Elysée-Palast. Wenn es Kritik an der Lage der Menschenrechte gebe, werde dies gegenüber Peking auch zum Ausdruck gebracht, hieß es weiter. Zudem wurde am Amtssitz von Staatschef Emmanuel Macron darauf verwiesen, dass die EU im vergangenen März bereits Sanktionen gegen Peking verhängte. Wegen der Unterdrückung der Uiguren beschlossen die EU-Außenminister seinerzeit Strafmaßnahmen gegen Verantwortliche für die Unterdrückung der muslimischen Minderheit in Xinjiang. Den verantwortlichen Politikern ist die Einreise in die EU verboten, auch ihre Vermögenswerte wurden eingefroren. Erst am vergangenen Montag wurden die Sanktionen um ein weiteres Jahr verlängert. Allerdings könnte es mit einer einheitlichen Linie der EU mit Blick auf die Winterspiele schwierig werden. Nach Angaben aus Regierungskreisen in Rom will sich Italien nicht an einem diplomatischen Boykott beteiligen. Als einzige große westliche Industrienation hatte sich Italien 2019 dem chinesischen Handelsprojekt der   angeschlossen. Regierungschef Mario Draghi hat die Zusammenarbeit aber inzwischen auf Eis gelegt. , die an diesem Mittwoch vereidigt werden soll, will sich über den Umgang mit China zunächst intern und dann mit den europäischen Partnern beraten, wie der designierte Bundeskanzler Olaf Scholz (SPD) am Dienstag ankündigte. Alle Maßnahmen müssten sorgfältig abgewogen werden. Allerdings ließ er zugleich erkennen, dass sich Deutschland aus seiner Sicht dem diplomatischen Olympia-Boykott der USA nicht anschließen sollte. „In einer Welt, die zusammenarbeiten muss, geht es auch darum, dass man die Signale der Zusammenarbeit nutzt“, sagte der künftige Bundeskanzler. Dagegen hatte die designierte Außenministerin Annalena Baerbock (Grüne) in einem „taz“-Interview einen Boykott der Olympischen Spiele nicht ausgeschlossen und betont, es gebe dabei für Regierungen „unterschiedliche Formen des Umgangs, die in den kommenden Wochen sicherlich diskutiert werden“. Die Grünen und auch die FDP treten für einen deutlich härteren Kurs gegenüber China ein als die SPD. Im Koalitionsvertrag hatten sie sich außerdem auf eine „enge transatlantische Abstimmung“ in der China-Politik geeinigt. Dass US-Präsident Joe Biden das wirtschaftlich und militärisch expandierende China als gefährlichen Rivalen ansieht und den Umgang mit dem autoritären Regime als größte Herausforderung der kommenden Jahrzehnte, macht er immer wieder klar. Menschenrechtsverletzungen, unfaire Handelspraktiken und anderes Fehlverhalten will er offen ansprechen. Gleichzeitig brauchen die USA Zugeständnisse Chinas bei anderen wichtigen Themen wie dem Kampf gegen den Klimawandel. Die China-Politik des Weißen Hauses gleicht daher einem Balanceakt. Den letzten Anstoß für die Entscheidung Washingtons hat wohl die Kontroverse um die chinesische Tennisspielerin Peng Shuai gegeben. Sie hatte einen hohen Vertreter der Kommunistischen Partei beschuldigt, sie vergewaltigt zu haben und war daraufhin fast vollständig aus der Öffentlichkeit verschwunden. Seltenes Lob für die Entscheidung des demokratischen Präsidenten kam von führenden Vertretern der Republikanischen Partei. So erklärten der Senator und ehemalige Präsidentschaftskandidat Mitt Romney, der diplomatische Boykott sende die richtige Botschaft an die Kommunistische Partei, ohne die amerikanischen Sportler zu bestrafen. Die Olympischen Spiele dürften nie wieder an ein Land vergeben werden, das einen Völkermord begehe und die Menschenrechte der eigenen Bürger so unverhohlen verletze. Donald Trumps ehemaliger Außenminister Mike Pompeo forderte dagegen einen kompletten Boykott der Spiele. Olympischen Spiele in Peking „Neuen Seidenstraße“ Die neue Bundesregierung",tagesspiegel
