title,author,date_published,url,article_text,source
Nach USA und Co. . Auch Japan schickt keine hochrangigen Politiker zu Olympia,no_author,"24.12.2021, 08:14 Uhr",https://www.tagesspiegel.de/sport/nach-usa-und-co-auch-japan-schickt-keine-hochrangigen-politiker-zu-olympia/27923212.html,"Japan schickt keine Regierungsdelegation zu den  , will von einem diplomatischen Boykott jedoch nicht sprechen. Man werde Seiko Hashimoto, Präsidentin des Organisationskomitees für die in diesem Jahr im eigenen Land veranstalteten Sommerspiele, sowie zwei weitere Olympia-Vertreter nach Peking schicken, gab der japanische Regierungssprecher Hirokazu Matsuno am Freitag bekannt.  , wollte er die Entscheidung aber nicht nennen. Man habe dafür „keine bestimmte Bezeichnung“. Dennoch wird Japans Entscheidung als in Übereinstimmung mit dem Vorgehen der Schutzmacht USA gesehen.   und schicken keine Regierungsvertreter zu den Spielen, die vom 4. bis 20. Februar 2022 in Peking stattfinden.  China steht wegen Menschenrechtsverletzungen im Umgang mit Uiguren und Tibetern, wegen der Unterdrückung der Demokratiebewegung in Hongkong und Drohungen gegen Taiwan in der Kritik. Man halte es für wichtig, dass „auch in China die universellen Werte der internationalen Gemeinschaft wie Freiheit, Achtung der grundlegenden Menschenrechte und Rechtsstaatlichkeit garantiert werden“, wurde Matsuno zitiert. Dass jedoch Japans Regierungschef Fumio Kishida seinen Sprecher die Entscheidung bekanntgeben ließ, wird als Bemühung Tokios gewertet, die Führung in Peking nicht direkt zu provozieren. Beide asiatischen Nachbarstaaten begehen im kommenden Jahr den 50. Jahrestag der Normalisierung ihrer diplomatischen Beziehungen.  Das Verhältnis beider Länder ist wegen Inselstreitigkeiten und Japans Umgang mit seiner Kriegsvergangenheit seit langem schwierig. Japan ist zudem besorgt über das wachsende Machtstreben Chinas in der Region. Zugleich sind beide Staaten jedoch wirtschaftlich eng verbunden. Neben Hashimoto, die Abgeordnete des japanischen Oberhauses ist, schickt Tokio OK-Chef Yasuhiro Yamashita sowie den Chef des Japanischen Paralympischen Komitees, Kazuyuki Mori, zu den Winterspielen nach Peking, wie der Regierungssprecher erklärte.  Olympischen Winterspielen nach China Einen diplomatischen Boykott, wie ihn Japans Schutzmacht USA angestoßen hat Länder wie Kanada und Großbritannien folgen ebenfalls der Initiative der US-Regierung",tagesspiegel
Wegen angeblicher Steuervergehen . Chinas „Livestream-Königin“ muss 186 Millionen Euro Strafe zahlen,no_author,"21.12.2021, 12:12 Uhr",https://www.tagesspiegel.de/gesellschaft/panorama/wegen-angeblicher-steuervergehen-chinas-livestream-koenigin-muss-186-millionen-euro-strafe-zahlen/27912608.html,"Chinas „Livestream-Königin“ Huang Wei muss wegen Steuervergehen umgerechnet 186 Millionen Euro zahlen. Die drastische Strafe für die Influencerin, die unter dem Namen Viya im Internet für Produkte wirbt, dürfte „Schockwellen“ in der Online-Shopping-Branche auslösen, wie es am Dienstag in Kommentaren hieß.  Bereits kurz nach Bekanntgabe der hohen Geldstrafen waren Huang Weis Seiten aus chinesischen Online-Netzwerken verschwunden. Die populäre Livestream-Seite von Huang Wei, die im Internet als Viya bekannt ist, beim Online-Versandhandel Taobao war am Dienstag nicht mehr aufrufbar. Auch Suchen nach ihren Seiten in den Netzwerken Weibo und Douyin brachten keine Ergebnisse. Das kommunistische Parteiorgan „Volkszeitung“ sprach von einer „Warnung“ für andere berühmte Persönlichkeiten des E-Commerce-Geschäfts, „dass ihre Webauftritte nicht außerhalb des Rechts stattfinden“. Die 35-Jährige habe 643 Millionen Yuan an Steuern hinterzogen, indem sie Einkommen verschwiegen oder über zwei Jahre falsch deklariert habe, teilte das Steueramt in Hangzhou mit. In der ostchinesischen Stadt liegt der Hauptsitz  , der die Handelsplattform Taobao mit 500 Millionen registrierten Nutzern betreibt, auf der Huang Weis Livestream verfolgt werden kann. Die Finanzbehörde kündigte an, auch gegen Steuervergehen anderer Prominenter der Online-Branche vorgehen zu wollen. Huang Weis Steuerbuße und Nachzahlungen in Höhe von insgesamt 1,34 Milliarden Yuan sind die bisher höchsten für einen Livestream-Star. Das Ausmaß übersteigt auch die  . In einem ähnlichen Fall musste die Schauspielerin Zheng Shuang Ende August wegen Steuerdelikten 299 Yuan Millionen (41 Millionen Euro) an den Fiskus abgeben. Das Vorgehen ist Teil einer  . Der ausufernde Rummel um die extrem gut verdienenden Stars und ihre enthusiastischen Fan-Gemeinden ist der kommunistischen Führung ein Dorn im Auge. In der zunehmenden Ideologisierung unter Chinas Staats- und Parteichef Xi Jinping, der die „große Erneuerung der chinesischen Nation“ verfolgt, verstärkt die Partei ihren Griff über Internet, Showgeschäft und Kultur. Mit Zig-Millionen Followern in sozialen Medien ist Huang Wei der Star der Influencer-Gemeinde, da sie bis zu zehn Millionen Zuschauer für eine ihrer Online-Werbeshows mobilisieren kann. Nach Schätzungen von Branchenkennern soll sie 2020 mehr als 31 Milliarden Yuan (4,3 Milliarden Euro) an Umsätzen generiert haben - mehr als jede andere Internetgröße. Bisher hatten sich die modernen Geschäftsfelder ohne große Aufmerksamkeit der Aufsichtsbehörden entwickeln können. „Dieser Vorfall sollte jeden alarmieren, dass er einen hohen Preis zahlen muss, wenn er das Recht herausfordert und Steuern hinterzieht“, kommentierte die „Volkszeitung“. Huang Wei und ihr Ehemann Dong Haifeng akzeptierten die Strafe und entschuldigten sich in einer Mitteilung im Kurznachrichtendienst Weibo auch bei ihren Fans: „Wir haben einen großen Fehler gemacht.“ Mit der Pandemie hat die Livestream-Industrie in China noch zusätzlich an Schwung gewonnen. In diesem Jahr sollen die Umsätze nach Schätzungen von Marktforschern 1,2 Billionen Yuan (166 Milliarden Euro) erreichen - vor vier Jahren waren es erst 19 Milliarden Yuan. Am ersten Tag des in China berühmten Singles-Day-Shopping-Festivals am 20. Oktober hatten Huang Wei und ihr Team in einem 14-stündigen Livestream allein für 8,5 Milliarden Yuan (1,18 Milliarden Euro) an Waren verkauft, wie die „South China Morning Post“ berichtete. Das entspreche dem Umsatz einer der größten chinesischen Kaufhausketten, der Wangfujing-Gruppe, im gesamten vergangenen Jahr.  des Online-Riesen Alibaba 884 Millionen Yuan (heute 122 Millionen Euro), die die berühmte Schauspielerin Fan Bingbing 2018 an die Steuerbehörden zahlen musste „Säuberungskampagne“ gegen Prominente und das Showgeschäft in China",tagesspiegel
Eigentümer ist nach Unglück geflohen . 21 Bergleute sitzen in überfluteter Kohlemine in China fest,no_author,"17.12.2021, 08:15 Uhr",https://www.tagesspiegel.de/gesellschaft/panorama/eigentuemer-ist-nach-unglueck-geflohen-21-bergleute-sitzen-in-ueberfluteter-kohlemine-in-china-fest/27902548.html,"In China sind 21 Bergleute in einer Kohlemine von eindringendem Wasser eingeschlossen worden. Wie die Behörden am Freitag mitteilten, bemühten sich hunderte Rettungskräfte, zu den Eingeschlossenen in der überfluteten Mine in der Stadt Xiaoyi in der nordchinesischen Kohleprovinz Shanxi vorzudringen. Mit Pumpen versuchten sie, das eingedrungene Wasser aus den Schächten zu bekommen. Dem Staatsfernsehen zufolge handelte es sich um eine illegale Mine. Demnach wurden die Rettungsarbeiten durch einen engen Zugang sowie fehlende exakte Karten des Geländes erschwert. Sieben Verdächtige wurden im Zusammenhang mit dem Unfall festgenommen. Die Polizei erklärte, dass sie nach weiteren Verdächtigen fahnde, darunter auch nach dem Eigentümer der Mine, der nach dem Unglück geflohen sein soll. China erzeugt etwa 60 Prozent seiner Energie durch die Verbrennung von Kohle und hatte wegen akuter Stromknappheit in den vergangenen Monaten die Produktion erhöht. Die Behörden hatten am Donnerstag erst erklärt, die hohe Nachfrage nach Kohle habe die Preise in die Höhe getrieben und zu illegalem Bergbau geführt. In China kommt es wegen unzureichender Sicherheitsvorkehrungen  . Bei einem Grubeneinsturz im September waren 19 Bergleute gestorben. Den aktuellsten Zahlen der chinesischen Behörde für die Sicherheit   kam es dieses Jahr bereits zu 336 Bergwerksunfällen. Die Behörde warnte vergangene Woche vor einem erhöhten Risiko von Zwischenfällen im Dezember, da die Bergwerke gegen Ende des Jahres die Sicherheit zugunsten einer erhöhten Produktion opferten. ( ) häufig zu Unfällen im Bergbau im Bergbau",tagesspiegel
Jahresbilanz Reporter ohne Grenzen . So viele inhaftierte Journalisten wie nie,Kurt Sagatz,"16.12.2021, 06:06 Uhr",https://www.tagesspiegel.de/gesellschaft/medien/jahresbilanz-reporter-ohne-grenzen-so-viele-inhaftierte-journalisten-wie-nie/27896566.html,"Die Organisation Reporter ohne Grenzen (RSF) hat weltweit noch nie so viele   gezählt wie in diesem Jahr. Hauptverantwortliche dafür seien die Regierungen in Belarus, Myanmar und China. Aber auch in Vietnam und Saudi-Arabien sitzen viele Journalisten und Medienschaffende in Gefängnissen. 46 Journalisten und andere Medienschaffende wurden laut der Jahresbilanz weltweit getötet – so wenige, wie seit fast zwanzig Jahren nicht mehr.  Mit Stand zum 1. Dezember saßen demnach 488 Medienschaffende im Gefängnis, nur weil sie ihre Arbeit getan haben. Ein Anstieg um 20 Prozent im Jahresvergleich, wie die Organisation in der an diesem Donnerstag erscheinenden Jahresbilanz der Pressefreiheit schreibt. Neben 428 Männern seien auch 60 Frauen   eingesperrt. „Die extrem hohe Zahl willkürlich inhaftierter Journalistinnen und Journalisten ist vor allem das Werk dreier diktatorischer Regime“, sagte RSF-Vorstandssprecherin Katja Gloger. „Die Zahl spiegelt wider, wie skrupellos sich autoritäre Machthaber weltweit verhalten und wie unangreifbar sie sich fühlen. Der sprunghafte Anstieg ist auch die Folge neuer geopolitischer Machtverhältnisse, in denen diese Regime zu wenig Gegenwind und Gegenwehr seitens der Demokratien in der Welt bekommen.“  In Myanmar, wo das Militär am 1. Februar durch einen Putsch die Macht zurückerobert habe, säßen aktuell 53 Journalisten im Gefängnis. Vor einem Jahr waren es noch zwei. Zu den neun inhaftierten Journalistinnen gehört Ma Thuzar, die im berüchtigten Insein-Gefängnis ohne Kontakt zur Außenwelt festgehalten wird. Sie spielte eine führende Rolle bei der Berichterstattung über die Februar-Proteste nach dem Putsch.  In Belarus, wo Präsident Lukaschenko im August 2020 seine umstrittene Wiederwahl erreichte, sitzen 32 Journalisten hinter Gittern, sieben waren es vor einem Jahr. Mehr als die Hälfte der Inhaftierten sind Frauen, darunter neun Journalistinnen und acht Medienmitarbeitende. Diese arbeiten in administrativen Positionen, etwa als Managerinnen, Buchhalterinnen oder Juristinnen. Die beiden Reporterinnen Darja Tschulzowa und Kazjaryna Andrejewa wurden zu zwei Jahren Straflager verurteilt, weil sie von einer nicht genehmigten Demonstration berichtet hatten. Aber auch   hat an der Grenze zu Belarus die Pressefreiheit eingeschränkt.  Die zunehmende Kontrolle Chinas über Hongkong habe zu einer Verschärfung der Lage geführt: Dort sei das nationale Sicherheitsgesetz als Vorwand genutzt worden für die Inhaftierung von mindestens zehn Journalisten. Zuvor war Hongkong durch seinen Sonderstatus noch ein regionales Vorbild für die Achtung der Pressefreiheit.  Kein Journalist, keine Journalistin ist der Organisation zufolge dem Tode derzeit so nah wie die chinesische Bürgerjournalistin Zhang Zhan. Ende Oktober wog sie weniger als 40 Kilogramm bei einer Größe von 1,77 Meter. Zhang ist vor allem durch ihre Berichterstattung über die Frühphase der Covid-19-Pandemie in der Stadt Wuhan bekannt geworden. ( ) inhaftierte Journalisten aus der Medienbranche das Nachbarland Polen",tagesspiegel
Chinesischer Tennisstar spricht von Missverständnissen . Peng Shuai will gar keine Missbrauchsvorwürfe erhoben haben,no_author,"20.12.2021, 05:53 Uhr",https://www.tagesspiegel.de/sport/chinesischer-tennisstar-spricht-von-missverstaendnissen-peng-shuai-will-gar-keine-missbrauchsvorwuerfe-erhoben-haben/27908428.html," hat bestritten, den Vorwurf eines sexuellen Übergriffs gegen einen chinesischen Spitzenpolitiker erhoben zu haben. In einem Video-Interview der Zeitung „Lianhe Zaobao“ aus Singapur sagte die Tennisspielerin: „Ich muss einen Punkt betonen, der äußerst wichtig ist: Ich habe niemals gesagt oder geschrieben, dass mich jemand sexuell angegriffen hat. Das muss ich mit Nachdruck feststellen.“ Sie fühlt sich nach ihren Worten missverstanden. Es war das erste Mal, dass sich Peng Shuai vor laufender Kamera direkt dazu geäußert hat. Das Interview fand am Sonntag am Rande einer Ski-Langlauf-Veranstaltung in Shanghai statt. Die frühere Weltranglistenerste im Doppel hatte Anfang November im sozialen Netzwerk Weibo einen Post veröffentlicht, der als Vorwurf eines sexuellen Übergriffs durch das frühere Politbüromitglied Zhang Gaoli verstanden wurde. Der Post wurde bald danach gelöscht. Auch blockiert die staatliche Zensur seither jede Debatte im chinesischen Internet darüber. In dem Video-Interview beschrieb Peng Shuai ihren Weibo-Post als „private Angelegenheit“. Bei Lesern seien möglicherweise „viele Missverständnisse“ aufgetreten, sagte der Tennisstar. Als Reaktion auf den Post hatten Sportler, Politiker und Menschenrechtler aus aller Welt ihre Sorge um das Wohlergehen der Tennisspielerin geäußert. Weil ihr die Signale aus China zum Schicksal der 35-Jährigen nicht ausreichten, setzte die Damen-Tour WTA Anfang Dezember alle Turniere in China und Hongkong aus, obwohl China ein wichtiger Geldgeber ist. Der Fall überschattet auch die Vorbereitungen für die Olympischen Winterspiele im Februar in Peking. Der deutsche Präsident des Internationalen Olympischen Komitees (IOC), Thomas Bach,  , nachdem er in Videoschalten mit dem Tennisstar gesprochen hatte. Er wiederholte am Samstag in einem „Sportschau“-Interview, dass das IOC in ihrem Fall weiter auf „stille Diplomatie“ setze. Peng Shuai betonte in dem Interview auch, dass sie ungehindert in Peking lebe und nicht unter Aufsicht stehe: „Warum sollte mich jemand überwachen? Ich bin immer frei gewesen.“ Auch ihre E-Mail an WTA-Chef Steve Simon von Mitte November habe sie aus freien Stücken geschrieben. Darin hatte sie schon betont, dass die Berichte über sie, „einschließlich des Vorwurfs der sexuellen Nötigung“, nicht wahr seien und dass es ihr gut gehe. Das Schreiben verstärkte die Besorgnis der WTA allerdings eher noch. Auf die Frage, ob sie ins Ausland reisen wolle, verwies Peng Shuai darauf, dass sie nicht mehr aktiv Tennis spiele und wegen der Pandemie gegenwärtig auch nicht die Absicht habe, China zu verlassen: „Was soll ich jetzt da draußen machen?“  Chinas Tennisstar Peng Shuai geriet unter Druck",tagesspiegel
Menschenrechtsverletzungen gegen Uiguren . USA erlassen weitere Strafmaßnahmen gegen China,no_author,"17.12.2021, 07:20 Uhr",https://www.tagesspiegel.de/wirtschaft/menschenrechtsverletzungen-gegen-uiguren-usa-erlassen-weitere-strafmassnahmen-gegen-china/27902388.html,"Wegen mutmaßlicher Menschenrechtsverletzungen der  gegen die Volksgruppe der   haben die USA eine Reihe weiterer Strafmaßnahmen erlassen. Am Donnerstag verhängte Washington Sanktionen gegen chinesische Biotechnologie- und Hightech-Unternehmen, denen die US-Regierung vorwirft, Peking bei der Unterdrückung der Uiguren zu unterstützen.  Der US-Senat stimmte zudem für ein Importverbot von Gütern aus der westlichen Provinz bei Zwangsarbeitsverdacht. Die Senatoren stimmten am Donnerstag einstimmig für die Vorlage, die nun US-Präsident Joe Biden zur Unterzeichnung vorliegt. Unternehmen sollen künftig nachweisen müssen, dass Produkte, die ganz oder teilweise aus der Region im Westen Chinas kommen, nicht mit Zwangsarbeit hergestellt wurden. Das Gesetz hat bereits die Zustimmung des Repräsentantenhauses. Das Weiße Haus hat wiederum bekanntgegeben, dass Biden den Vorstoß unterstütze. Xinjiang ist ein wichtiger Baumwolllieferant. Schätzungsweise 20 Prozent der jährlich in die USA eingeführten Kleidungsstücke enthalten Material aus der Region. Einige US-Unternehmen hatten sich deshalb besorgt über das Gesetz geäußert. ""Wir wissen, dass der Völkermord, den wir derzeit miterleben, in einem alarmierenden Ausmaß stattfindet"", sagte der republikanische Senator Marco Rubio, einer der Initiatoren des Gesetzes, bei der entscheidenden Abstimmung. Nach langen Verhandlungen gab er auch seine Vorbehalte für die Ernennung von Nicholas Burns als Botschafter in   auf, der daraufhin am Donnerstag vom Parlament bestätigt wurde. Burns ist ein erfahrener Diplomat, der die USA bereits unter anderem in Griechenland und bei der Nato vertreten hat. Er hatte sich gemäß der Linie von Biden kritisch zum ""Genozid"" an den Uiguren in China geäußert, gleichzeitig jedoch seine Bereitschaft betont, mit Peking beim Kampf gegen den Klimawandel zusammenzuarbeiten. Die Republikaner fordern hingegen ein härteres Vorgehen gegen China. In einem Schub neuer Sanktionen setzte das US-Handelsministerium am Donnerstag die chinesische Akademie für militärische Medizinwissenschaften sowie elf ihrer Institute auf eine schwarze Liste für US-Exporte. Den Instituten wird zur Last gelegt, biotechnologische Forschung zu militärischen Zwecken einschließlich der Entwicklung von ""Waffen zur Kontrolle des Gehirns"" zu betreiben. Die Institute beschäftigen sich unter anderem mit Bluttransfusionen und Giftstoffen. Das US-Finanzministerium setzte wiederum acht Hightech-Unternehmen auf die schwarze Liste. Darunter ist SZ DJI Technology, der mit Abstand größte Hersteller von Drohnen für Luftaufnahmen. US-Unternehmen dürfen nun nicht mehr in den Weltmarktführer investieren. Ebenfalls sanktioniert wurden der Entwickler von Gesichtserkennungssoftware, Cloudwalk Technology, sowie Xiamen Meiya Pico Information, das eine Software zum Verfolgen von Daten auf Mobiltelefonen entwickelt hat. Nach Angaben von Menschenrechtsorganisationen und Experten werden Uiguren und andere Muslime in der Provinz Xinjiang mit Hightech-Mitteln überwacht, unter anderem durch DNA-Proben und künstliche Intelligenz zur Gesichtserkennung. Mehr als eine Million Angehörige der Minderheiten werden demnach außerdem in Haftlagern zur Aufgabe ihrer Religion, Kultur und Sprache gezwungen und teilweise auch körperlich misshandelt. Die chinesische Regierung spricht von ""Bildungszentren"", die dem Kampf gegen islamistische Radikalisierung dienten. Die USA haben wegen des Umgangs mit den Uiguren bereits eine Reihe von Sanktionen gegen China verhängt. Die US-Regierung setzte am Donnerstag auch Unternehmen aus China, Georgien, Malaysia und der Türkei auf eine schwarze Liste, weil sie US-Exporte an den Iran weitergeleitet haben sollen. Bereits am Mittwoch wurden chinesische Unternehmen sanktioniert, weil sie Rohstoffe für die Herstellung von Opiaten geliefert haben sollen, die für eine große Suchtmittelkrise in den USA verantwortlich gemacht werden. ( ) chinesischen Regierung  Uiguren in der Provinz Xinjiang China",tagesspiegel
Überraschender Seitenwechsel zu China . Nicaragua beendet diplomatische Beziehungen zu Taiwan,no_author,"10.12.2021, 12:15 Uhr",https://www.tagesspiegel.de/politik/ueberraschender-seitenwechsel-zu-china-nicaragua-beendet-diplomatische-beziehungen-zu-taiwan/27880918.html,"Schwerer Rückschlag  : Die demokratische Inselrepublik verliert einen weiteren Verbündeten. Nicaragua beendete am Freitag überraschend seine diplomatischen Beziehungen zu Taipeh und bekannte sich zu Pekings Ein-China-Doktrin. Chinas Außenamtssprecher Wang Wenbin betonte, es sei „eine politische Entscheidung, kein Handelsgeschäft“. Die Aufnahme diplomatischer Beziehungen eröffne aber „große Aussichten“ für die Kooperation. Nach Gesprächen in der ostchinesischen Hafenstadt Tianjin besiegelten Delegationen beider Länder mit der Unterzeichnung eines Kommuniqués ihre neuen Beziehungen. Nicaragua nannte keinen Grund für seine Entscheidung. Doch versprechen sich Länder meist wirtschaftliche Vorteile von einem guten Verhältnis zu China. Auch setzt Peking Verbündete Taiwans häufig massiv unter Druck. „Ich glaube, dass die Entwicklung der bilateralen Beziehungen beiden Ländern und Völkern nutzen wird“, sagte Chinas Außenminister Wang Yi. Taiwan zeigte sich „bestürzt“. Präsidentin Tsai Ing-wen teilte auf Twitter mit: „Druck von außen, egal wie viel, kann unsere Entschlossenheit nicht erschüttern, Demokratie, Freiheit und Rechtsstaatlichkeit hochzuhalten und uns mit der internationalen Gemeinschaft als Kraft für das Gute zusammenzuschließen.“ Weltweit gibt es damit nur noch 14 Länder, die Taiwan diplomatisch anerkennen - darunter kleine Pazifikländer, Karibikinseln, Staaten in Mittelamerika und der Vatikan. Mit seiner Ein-China-Doktrin erlaubt die kommunistische Führung in Peking keinem Land, Beziehungen sowohl mit der Volksrepublik als auch mit Taiwan zu unterhalten. Auch Deutschland unterhält nur eine inoffizielle Vertretung in Taipeh. Peking betrachtet das heute freiheitliche Taiwan als Teil der Volksrepublik und versucht, es international zu isolieren. Die 23 Millionen Taiwaner sehen sich hingegen als unabhängig an. Der Konflikt geht auf den Bürgerkrieg zurück. Damals unterlag die nationalchinesische Kuomintang-Partei und flüchtete nach Taiwan, während die Kommunisten 1949 die Volksrepublik gründeten. Bis heute droht Peking mit einer Eroberung Taiwans zur „Wiedervereinigung“. Nicaragua hatte Peking 1985 schon einmal anerkannt, wechselte aber 1990 wieder zurück zu Taipeh. In dem mittelamerikanischen Land ist seit 2007 die zunehmend autoritäre Regierung des früheren linken Revolutionärs Daniel Ortega an der Macht. Die USA kritisierten Nicaraguas Regierung und warfen ihr vor, durch fingierte Wahlen im Amt zu sein. „Ohne ein Mandat, das durch freie und faire Wahlen erteilt wird, können Ortegas Maßnahmen nicht den Willen des Volkes von Nicaragua widerspiegeln“, sagte der Sprecher des US-Außenministeriums. Seit dem Amtsantritt der chinakritischen Präsidentin Tsai Ing-wen 2016 in Taiwan hat Peking den Druck auf deren Verbündete noch verstärkt und umwirbt diese mit wirtschaftlichen Versprechen. So hat Taiwan seither acht Partner verloren. 2017 und 2018 hatten Panama, die Dominikanische Republik und El Salvador mit Taiwan gebrochen - zuletzt die Salomon-Inseln and Kiribati im Pazifik. Die Wende der Salomon-Inseln zugunsten Pekings führte allerdings auch wegen Widerstands gegen chinesische Geschäftsleute zu schweren Unruhen.  für Taiwan",tagesspiegel
Olympia in China und Boykott . Wenn Sportler zum Spielball werden,Jörg Leopold,"16.12.2021, 14:52 Uhr",https://www.tagesspiegel.de/sport/olympia-in-china-und-boykott-wenn-sportler-zum-spielball-werden/27900246.html,"Die Olympischen Spiele in Peking beginnen erst in knapp zwei Monaten. Doch längst tobt eine Debatte über den Umgang mit der Sportveranstaltung.   haben sich entschieden, keine politischen Würdenträger nach China zu entsenden.  .  Es gibt allerdings durchaus Forderungen – auch von politischer Seite – die Winterspiele nicht nur diplomatisch, sondern auch sportlich zu boykottieren. Das jedoch haben die Athleten Deutschland am Donnerstag entschieden abgelehnt. „Wir als Sportler hatten keinerlei Teilhabe an der unserer Meinung nach verantwortungslosen Vergabe der Spiele an China. Und nun uns mit diesen Verstößen in Verbindung zu bringen und uns diese Verantwortung aufzuerlegen, dort handeln zu müssen, sehen wir als falsch und unfair an“, sagte Tobias Preuß, der Vizepräsident der Sportlervereinigung im ZDF-Morgenmagazin. Tatsächlich macht es sich die Politik sehr leicht, wenn sie sich ausgerechnet von den Sportlern jene klare Haltung wünscht, die sie sich selbst nicht in der Lage sieht zu zeigen. Menschenrechtsverletzungen in China sind nichts Neues, trotzdem war die Volksrepublik in der jüngeren Vergangenheit eine Art Heilsbringer für die deutsche Wirtschaft. Dass die Regierenden deutsche Unternehmen dazu aufgefordert hätten, keinen Handel mit den Chinesen zu treiben oder vor Ort nicht in neue Standorte zu investieren, ist jedenfalls nicht überliefert. Preuß spricht in diesem Zusammenhang von „Symbolpolitik“, es ist tatsächlich billig, nun den Sport voranschicken zu wollen, um ein Zeichen zu setzen. Dazu hatte die Politik in der Vergangenheit reichlich Gelegenheit und wird sie angesichts der aktuellen Entwicklungen in China auch weiterhin haben. Die Athleten sind in erster Linie für ihre sportlichen Leistungen verantwortlich, was viele nicht davon abhält, sich dennoch Gedanken zu machen. Denn klar ist auch:   und die teilnehmenden Sportler sind nicht mehr als ein Spielball des Regimes.  Möglich, dass die eine oder der andere aufgrund der Bedingungen vor Ort auf eine Olympia-Teilnahme verzichtet. Rodlerin Natalie Geisenberger hat das kürzlich bereits öffentlich in Erwägung gezogen. Es sollte aber eine Entscheidung des Einzelnen bleiben, denn es gibt wirksamere Mittel gegen Unterdrückung und Menschenrechtsverletzungen zu protestieren, als einen kompletten mannschaftlichen Boykott der Spiele. Die allerdings liegen nicht in der Macht der Athleten. Länder wie die Vereinigten Staaten, Großbritannien oder Kanada In Deutschland hat sich die neue Regierung dazu noch nicht abschließend geäußert Für China ist Olympia zuallererst eine große Propaganda-Veranstaltung",tagesspiegel
