title,author,date_published,url,article_text,source
Hatte über Corona-Ausbruch in Wuhan berichtet . Chinesische Bürgerjournalistin zu vier Jahren Haft verurteilt,no_author,"28.12.2020, 11:42 Uhr",https://www.tagesspiegel.de/politik/hatte-ueber-corona-ausbruch-in-wuhan-berichtet-chinesische-buergerjournalistin-zu-vier-jahren-haft-verurteilt/26753054.html,"China hat eine Bürgerjournalistin wegen ihrer kritischen Berichte über den Corona-Ausbruch in Wuhan zu vier Jahren Haft verurteilt. Ein Gericht in Shanghai begründete die Strafe für die Chinesin Zhang Zhan am Montag damit, dass sie „Streit angezettelt und Ärger provoziert“ habe.  Die 37-Jährige hatte im Frühjahr, zum Höhepunkt der Pandemie in China, in Videos unter anderem auf YouTube über die Lage in der zentralchinesischen Stadt Wuhan berichtet,  .  Neben Zhang Zhan waren damals im Mai auch eine Reihe weitere Bürgerjournalisten festgenommen worden, die in sozialen Medien über die frühen Erfahrungen der Menschen in Wuhan berichtet hatten.  Wie die Hongkonger Zeitung „South China Morning Post“ unter Berufung auf ihren Anwalt berichtete, befand sich Zhang Zhan am Montag in einem gesundheitlich schlechten Zustand und musste im Rollstuhl in den Gerichtssaal gebracht werden. Sie saß seit Mai in Untersuchungshaft und hatte laut Berichten aus Protest zeitweise die Nahrungsaufnahme verweigert.  China gehört laut der Organisation Reporter ohne Grenzen zu den Ländern mit den meisten inhaftierten Journalisten und Bloggern. In der Rangliste zur globalen Pressefreiheit liegt das Land auf einem der hintersten Plätze. Immer wieder gab es Fälle, in denen ausländische Journalisten wegen kritischer Berichterstattung ausgewiesen wurden oder um die Verlängerung ihres Visums bangen mussten. In Wuhan war das Coronavirus Ende vergangenen Jahres erstmals bei Menschen festgestellt worden. Innerhalb weniger Wochen verbreitete es sich massiv in der Millionenmetropole. Am 23. Januar wurde Wuhan dann von den Behörden abgeriegelt.  In den folgenden Tagen wurde die Maßnahme auf die gesamte Provinz Hubei ausgedehnt, in der Wuhan liegt. Von China aus verbreitete sich das Virus in die ganze Welt. In China selbst wurde das Virus durch die rigorosen Abschottungs- und Quarantänemaßnahmen jedoch weitgehend zurückgedrängt. Allerdings konnte die chinesische Regierung so auch  . Die Führung des Landes rühmt ihren Kampf gegen das Virus  .  wo das Virus erstmals ausgebrochen war ihr Überwachungssystem weiter ausbauen seit Monaten als große Erfolgsgeschichte",tagesspiegel
Pandemie hilft Peking . China könnte die USA schon 2028 als größte Volkswirtschaft überholen,no_author,"26.12.2020, 10:09 Uhr",https://www.tagesspiegel.de/wirtschaft/pandemie-hilft-peking-china-koennte-die-usa-schon-2028-als-groesste-volkswirtschaft-ueberholen/26750018.html,"China wird britischen Wirtschaftsexperten zufolge die   schon 2028 als weltgrößte Volkswirtschaft ablösen - fünf Jahre früher als bisher erwartet. Wie das Centre for Economics and Business Research (CEBR) in seinem am Samstag veröffentlichten Jahresbericht erläutert, erholt sich China schneller und stärker von der Corona-Krise als die USA.  ""Die Covid-19-Pandemie und die einhergehenden wirtschaftlichen Auswirkungen "", schrieben die Ökonomen. Der Erfolg der eigenen harten Maßnahmen gegen Corona und die Rückschläge für das langfristige Wirtschaftswachstum im Westen habe Chinas relative Wirtschaftskraft verbessert. China lag im vergangenen Jahr mit einem Bruttoinlandsprodukt von 14,4 Billionen Dollar noch deutlich hinter den USA mit 21,4 Billionen Dollar. Das CEBR sagt für die Volksrepublik aber für 2021 bis 2025 ein durchschnittliches jährliches Wachstum von 5,7 Prozent voraus, für die Jahre 2026 bis 2030 von 4,5 Prozent.  Die USA werde sich zwar 2021 von der Pandemie kräftig erholen, zwischen 2022 und 2024 aber nur 1,9 Prozent jährlich wachsen, danach im Durchschnitt um 1,6 Prozent.  Japan bleibt der Einschätzung zufolge vorerst die drittgrößte Volkswirtschaft der Welt, bis es in den frühen 2030er Jahren von Indien überholt wird.  Deutschland rutsche dann auf Platz fünf von derzeit Platz vier. (Reuters) USA  begünstigen China in dieser Rivalität",tagesspiegel
Antarktische Zusammenarbeit . Riskante Rettung,Barbara Barkhausen,"27.12.2020, 17:44 Uhr",https://www.tagesspiegel.de/gesellschaft/panorama/antarktische-zusammenarbeit-riskante-rettung/26752034.html,"Medizinische Notfälle gibt es in   immer mal wieder. Als jetzt aber ein australischer Forscher aus der Polarregion gerettet werden musste, kam es zu einer besonderen Kooperation. Da die medizinische Evakuierung nicht alleine von der australischen Antarktis-Division (AAD) umgesetzt werden konnte, boten die USA, aber auch China Hilfe an. Vor allem die Hilfe der Chinesen fand in australischen Medien Erwähnung, da beide Länder   stecken. China hat horrende Strafzölle auf Wein erhoben und erschwert Australien den Export von Kohle, Gerste, Holz, Rindfleisch, Hummer und Baumwolle. Doch die „helfende Hand“, die China zum Jahresende nun ausgestreckt hat, wird in Australien als positives Zeichen gewertet. Für die Rettung wurde ein logistisches Netz aus Schiffen, Hubschraubern und Flugzeugen geknüpft. Nachdem die Australier die Distanz von der Antarktis bis nach Australien nicht selbst innerhalb kurzer Zeit abdecken konnten, half der chinesische Eisbrecher „MV Xue Long 2“, der auf dem Weg zur chinesischen Station Zhongshan war.  Die Hubschrauber des Schiffs transportierten ein Team von der australischen Forschungsstation Davis an einen Ort 40 Kilometer landeinwärts, das dort eine Landebahn im Eis baute. Das Flugzeug, das dort schließlich landete, war eine US-Maschine vom Typ Basler, die mit Skiern ausgerüstet ist. Der Flieger legte 2200 Kilometer von der amerikanischen Station McMurdo zum Wilkins Aerodrome in der Nähe der zweiten australischen Station in der Antarktis – der Casey-Station – zurück, um dort einen australischen Arzt aufzunehmen.  Weitere 2800 Kilometer später landete das Flugzeug dann auf der neu gebauten Piste im Eis, um den Patienten zum Wilkins Aerodrome zu überführen. Dort nahm ein australischer Airbus A319 den Forscher auf und brachte ihn am Heiligabend nach Hobart auf der australischen Insel Tasmanien. „Wir sind den chinesischen und US-amerikanischen Antarktisprogrammen für die Hilfe außerordentlich dankbar“, sagte AAD-Direktor Kim Ellis. Auch die australische Crew hätte beim Bau der Landebahn im Eis „Mut, Belastbarkeit und Geschicklichkeit“ bewiesen. Ellis sagte, die fünftägige Operation spiegele die gute internationale Zusammenarbeit in der Antarktis wider. Was dem Forscher fehlte, gaben die Behörden nicht bekannt, der Gesundheitszustand des Patienten stehe aber nicht mit Covid-19 in Verbindung.   war lange Zeit der einzige Kontinent ohne eine Infektion. Doch kurz vor Weihnachten meldete die chilenische Forschungsstation 36 Corona-Fälle. Es war nicht die erste multinationale Rettungsoperation in der Antarktis: 2014 eilten ein chinesischer, ein französischer und ein australischer Eisbrecher einem russischen Polarschiff mit Australiern, Briten, Neuseeländern und Russen an Bord zu Hilfe. Das Schiff war damals am Weihnachtstag im Eis stecken geblieben. Sie alle scheiterten jedoch, der chinesische Eisbrecher blieb – nachdem er noch 52 Passagiere des Polarschiffes mit seinem Helikopter zu einem australischen Schiff ausgeflogen hatte – sogar selbst im Eis gefangen. Am Ende wurden jedoch alle Beteiligten gerettet, da die US-amerikanische Küstenwache einen noch mächtigeren Eisbrecher entsandte. der Antarktis seit mehreren Monaten in einem Handelskonflikt Die Antarktis",tagesspiegel
Marktzugang und Wettbewerbsbedingungen . EU und China einigen sich auf Investitionsabkommen,Carla Neuhaus,"30.12.2020, 14:27 Uhr",https://www.tagesspiegel.de/wirtschaft/marktzugang-und-wettbewerbsbedingungen-eu-und-china-einigen-sich-auf-investitionsabkommen/26758778.html,"Für europäische Firmen war China lange eine geschlossene Gesellschaft. Eine Fabrik vor Ort ohne einen lokalen Partner aufzumachen? Undenkbar. Wollte ein deutscher Autobauer in China Wagen für den chinesischen Markt produzieren, ging das nur, wenn er ein Joint Venture mit Chinesen eingegangen ist. Andere Bereiche wie der Finanzsektor waren für Europäer komplett tabu. Seit sieben Jahren haben die EU und China deshalb über ein gemeinsames Investitionsabkommen verhandelt. Am Mittwoch sind sie sich einig geworden. „Heute haben wir die Gespräche mit China im Grundsatz abgeschlossen“, schrieb EU-Kommissionspräsidentin Ursula von der Leyen (CDU) am frühen Nachmittag auf Twitter. Zuvor hatten die EU-Spitze und Kanzlerin Angela Merkel (CDU) über Video mit Chinas Staats- und Parteichef Xi Jinping gesprochen. Die Bundesregierung wertete die Grundsatzeinigung als großen Erfolg  . „Insgesamt kann man sagen, dass hier die europäischen Werte in einem Investitionsabkommen, so weit es überhaupt möglich ist in diesem Investitionsabkommen, verankert worden sind“, hieß es am Mittwoch in Berlin von Regierungsseite.     und soll für gerechtere Wettbewerbsbedingungen sorgen. Die Volksrepublik verpflichtet sich im Gegenzug zu Umwelt- und Sozialstandards. Deutsche Firmen haben auf diese Einigung lange gewartet. Das Abkommen werde „für eine größere Rechtssicherheit und bessere Wettbewerbsbedingungen für europäische Unternehmen sorgen, die in China investieren“, sagt Anton Börner, Präsident des Groß- und Außenhandelsverbands. „Es ist höchste Zeit, dass die Asymmetrie beim Marktzugang für Investitionen zwischen der EU und China beseitigt wird.“ Bislang sind ausländische Firmen in der Volksrepublik häufig im Nachteil, weil Aufträge vorrangig an Staatsbetriebe gehen.  , dass sie ihre Technologie mit einem Partner vor Ort teilen.  Ob all diese Probleme mit dem Abkommen abgestellt sind? In der deutschen Wirtschaft gibt es daran leise Zweifel. „Entscheidend wird natürlich sein, wie das Abkommen in China gelebt, also in Geschäftspraxis umgesetzt wird“, sagt Börner. „Ebenso wird die verdeckte Subventionierung von Geschäften durch Staatsunternehmen weiter eine Herausforderung bleiben.“      Auch Joachim Lang, Hauptgeschäftsführer beim Bundesverband der Deutschen Industrie (BDI), warnt vor zu hohen Erwartungen: „Wir sollten uns keine Illusionen machen: Selbst mit dem Abkommen erhalten Investoren noch keinen wirklich freien Marktzugang in China.“ Das Abkommen sei lediglich ein weiterer Schritt. Der Bundesregierung ist das durchaus bewusst. Sie schreibt selbst: „Es löst nicht alle kritischen Fragen, aber es ist ein großer Fortschritt.“ Es sei ein Dialog- und Umsetzungsprozess definiert worden, „der uns kontinuierlich erlaubt, mit den Chinesen in Kontakt zu bleiben“.  Denn auch wenn europäische Firmen etwa aus dem Automobilsektor, dem Finanzbereich oder dem Gesundheitswesen es künftig leichter haben werden, von einer kompletten Öffnung des Marktes ist China auch mit diesem Abkommen noch weit entfernt. Zudem ist es ein reiner Investitionspakt - kein Freihandelsabkommen, bei dem Zölle und andere Handelsschranken wegfallen. Die Politik sieht das aber pragmatisch. „Bei einem schwierigen Verhandlungspartner wie China durfte man keine Wunder erwarten“, sagt Daniel Caspary, der Vorsitzende der CDU/CSU-Gruppe im Europaparlament. Ein Erfolg ist der Abschluss des Abkommens vor allem für Kanzlerin Angela Merkel (CDU). Sie soll die Verhandlungen mit China zuletzt zur Chefsache erklärt haben. Denn die Gespräche zogen sich zuletzt länger hin als erwartet. Ursprünglich hätte es bereits im September in Leipzig einen großen EU-China-Gipfel geben sollen, dessen Höhepunkt die Unterschrift unter dem Investitionsabkommen hätte werden sollen. Doch wegen Corona fiel das Treffen vor Ort aus. Und die stattdessen anberaumten Videokonferenzen brachten zunächst keinen Durchbruch.  Gehakt hat es lange vor allem bei einem Thema: der Zwangsarbeit. China wird immer wieder vorgeworfen, vor allem Anhänger der muslimischen Minderheit der Uiguren zu verschleppen und auszunutzen. Erst vor Weihnachten hat das Center für Global Policy, eine amerikanische Nichtregierungsorganisation, eine Studie dazu vorgelegt. Demnach sollen mindestens 570.000 Menschen von der Regierung zur Baumwollernte gezwungen worden sein. Mindestens eine Million Uiguren und andere Muslime sollen zudem in Haftlagern eingesperrt sein. Chinas Regierung hingegen spricht von ""Bildungszentren"" und bestreitet, dass es im Land zu Zwangsarbeit kommt.      Kritiker haben deshalb im Zuge der Verhandlungen über das Investitionsprogramm gefordert, China müsse sich offiziell zu einem Verbot von Zwangsarbeit bekennen. Darauf aber wollte sich Peking offenbar nicht einlassen. Stattdessen will China nun ""fortgesetzte und nachhaltige Anstrengungen"" unternehmen, um die Kernkonventionen der Internationalen Arbeitsorganisation (ILO) zu ratifizieren.  Doch reicht eine solche Absichtserklärung, wenn ihr am Ende keine Taten folgen? Mit dieser Frage muss sich das Europaparlament befassen. Denn ohne das Okay der Abgeordneten kann das Investitionsabkommen nicht in Kraft treten. Dass es Diskussionen geben wird, ist schon jetzt absehbar. So dringt zum Beispiel der führende EU-Abgeordnete Bernd Lange (SPD) auf Verbesserungen beim Thema Zwangsarbeit. Für die SPD sei ""besonders wichtig"", dass faire Wettbewerbsbedingungen ""auch beim Thema Arbeitnehmerrechte gelten"". ""Wir werden den Text im Handelsausschuss ausführlich prüfen und - wenn nötig - Nachbesserungen einfordern"", betonte Lange. Seinen Angaben zufolge könnte es noch bis Anfang 2022 dauern, bis der Ministerrat und das Europäische Parlament offiziell im Rahmen des Ratifizierungsprozesses zum Zuge kommen. zum Ende der deutschen EU-Ratspräsidentschaft Das Abkommen sieht einen besseren Marktzugang für europäische Unternehmen in China vor Auch mussten sich die Unternehmen den Zugang zum chinesischen Markt bislang oft dadurch erkaufen",tagesspiegel
Heftiges Wortgefecht im UN-Sicherheitsrat . Russland beschimpft deutsche Syrien-Politik als „heuchlerisch“,no_author,"17.12.2020, 07:19 Uhr",https://www.tagesspiegel.de/politik/heftiges-wortgefecht-im-un-sicherheitsrat-russland-beschimpft-deutsche-syrien-politik-als-heuchlerisch/26727158.html,"Im UN-Sicherheitsrat hat sich Deutschland ein heftiges Wortgefecht mit Russland und China über humanitäre Hilfen für die syrische Bevölkerung geliefert. Im Verlauf der hitzigen Sitzung am Mittwoch stellten die Vertreter Moskaus und Pekings die Eignung Deutschlands für einen ständigen Sitz im Sicherheitsrat in Frage. Der deutsche Weg zu einer ständigen Mitgliedschaft „wird schwierig sein“, sagte der chinesische Vertreter Yao Shaojun. Die Bundesregierung wirft Moskau und Peking vor,   Im Juli hatte sich der UN-Sicherheitsrat zwar nach zähem Ringen auf die eingeschränkte Fortsetzung grenzüberschreitender humanitärer Hilfslieferungen für die syrische Bevölkerung geeinigt. Die Lieferungen dürfen aber nur noch über einen einzigen Grenzübergang erfolgen. Der deutsche Botschafter bei der UNO, Christoph Heusgen, prangerte am Mittwoch in der per Videoschalte abgehaltenen Ratssitzung die Haltung von Russland und China zu den humanitären Syrien-Hilfen scharf an.  Moskau und Peking müssten ihre Positionen überprüfen und die Lieferungen über weitere Grenzübergänge zulassen,   forderte Heusgen. Er beklagte, dass der UN-Sicherheitsrat die Menschen in Syrien „fallen gelassen“ habe. Russland unterstütze nicht nur den syrischen Machthaber Baschar al-Assad im Bürgerkrieg, sondern trage auch selber zum „Leiden und Tod“ der Menschen bei. Der russische Vize-Botschafter Dmitri Poljanskij konterte darauf mit dem Vorwurf, wenn der Sicherheitsrat die syrische Bevölkerung fallen lasse, dann liege dies am „heuchlerischen Verhalten“ Deutschlands und des Westens. Er sagte auch an die Adresse Heusgens: „Sie werden uns nicht fehlen.“ Deutschland scheidet zum Jahresende nach zweijähriger temporärer Mitgliedschaft aus dem mächtigsten Gremium der Vereinten Nationen aus. Der russische Diplomat sagte auch, aufgrund des Auftretens der deutschen Vertreter im Sicherheitsrat stellen sich viele UN-Mitgliedstaaten, die zuvor noch die permanente Mitgliedschaft Deutschlands befürwortet hätten, inzwischen die Frage, ob „so viel Zynismus“ in dem Gremium erlaubt werden solle. Der chinesische Diplomat Yao sagte: „Das Auftreten Deutschlands im Sicherheitsrat hat nicht den Erwartungen der Welt und den Erwartungen des Rats entsprochen.“ Deutschland bemüht sich seit vielen Jahren um eine ständige Mitgliedschaft im Sicherheitsrat und eine generelle Reform der Zusammensetzung des Gremiums, ohne allerdings dabei große Fortschritte zu erzielen. Dem Sicherheitsrat gehören fünf ständige und zehn wechselnde Mitglieder an. Die ständigen Mitglieder sind China, Russland, die USA, Frankreich und Großbritannien. Im Unterschied zu den vorübergehenden Mitgliedern haben sie ein Vetorecht. (AFP) für eine Blockade von UN-Hilfslieferungen nach Syrien verantwortlich zu sein. Es sei „sehr zynisch“, wenn beide Staaten beklagten, dass Hilfslieferungen nicht nach Syrien gelangen könnten. damit Nahrungsmittel und Medikamente wirklich zu den Menschen gelangen könnten,",tagesspiegel
Verschleppt und ausgenutzt . China zwingt Uiguren zur Baumwollernte,Nina Breher,"16.12.2020, 16:51 Uhr",https://www.tagesspiegel.de/politik/verschleppt-und-ausgenutzt-china-zwingt-uiguren-zur-baumwollernte/26725362.html,"Sie werden aus ihren Heimatdörfern abgeholt, in Busse gesetzt und von der Polizei auf Baumwollfelder verbracht: Was dystopisch klingt, ist für Uiguren im Westen Chinas Realität. Mindestens 570.000 Menschen soll die chinesische Regierung bisher unter Zwang zur Baumwollernte eingesetzt haben. Das legt eine   dar.  „Es ist sehr wahrscheinlich, dass ein Großteil der Baumwollproduktion in Xinjiang mit Zwangsarbeit befleckt ist“, heißt es in dem Bericht, der erstmals Rückschlüsse auf das potenzielle   liefert. In Xinjiang leben vor allem Uiguren – eine Minderheit, die systematisch kontrolliert und unterdrückt wird.  Auch Produkte, die in Deutschland verkauft werden, können Baumwolle aus Xinjiang enthalten. China deckt 20 Prozent des globalen Bedarfs ab, auch US-amerikanische und europäische Firmen importieren aus der Volksrepublik. Davon werden wiederum 85 Prozent in Xinjiang produziert.  Das CGP hat Regierungsdokumente und Berichte staatlicher Medien ausgewertet, die zeigen, dass der chinesische Staat immer weniger Saisonkräfte aus anderen Regionen Chinas anwarb, obwohl die Arbeit weiterhin anfiel.  Außerdem enthält die Studie Belege für Zwangsrekrutierungen in Dörfern, zentralisierte Vorbereitungen auf die Arbeit als Baumwollpflücker und für Transporte auf die Farmen. Dass die Arbeit auf den Feldern selbst unter Zwang erfolgt, weist die Studie nicht nach. Die Forscher fanden laut Bericht aber Hinweise darauf. Die Belege für Zwangsversetzungen von Arbeitern und die Hinweise auf Zwangsarbeit hätten „potenziell starke Konsequenzen für globale Lieferketten“, so der Anthropologe und Xinjiang-Experte Adrian Zenz in dem CGP-Bericht. Deutsche Verbände und Politikerinnen zeigen sich angesichts der neuen Erkenntnisse besorgt. Aus Kreisen des Bundesverbands der deutschen Industrie ist zu hören: „Die   und die politische Situation in Hongkong belasten die politischen und wirtschaftlichen Beziehungen.“ China müsse bewusst sein, dass sich „international politischer Widerstand“ formiere.  FDP-Bundestagsabgeordnete und Vorsitzende des Ausschusses für Menschenrechte Gyde Jensen ist da weniger optimistisch. „Mein Eindruck ist leider, dass viele hoffen und wünschen, dass sich das Problem von alleine erledigt.“ Das sei angesichts der „gigantischen Ausmaße“ der Zwangsarbeit auf Baumwollfeldern in Xinjiang aber „vollkommen absurd“. Sie appelliert an Politik und Unternehmen, entschieden gegen Sklaverei in Xinjiang vorzugehen: „Wir dürfen dabei nicht länger mitspielen.“  Margarete Bause, Sprecherin der Grünen-Fraktion für Menschenrechte, fordert eine verbindliche Lieferketten-Überwachung. „Wir alle tragen täglich Kleidung aus Baumwolle. Entsprechend betrifft das jede:n einzelne:n von uns.“ Wegen Verletzung der Menschenrechte in Xinjiang hatten die USA Anfang Dezember den Baumwollimport aus der Region gestoppt und von „Sklavenarbeit“ gesprochen. Peking warf Washington daraufhin vor, Falschnachrichten zu verbreiten. Den Vorwurf der Zwangsarbeit weist China zurück. Dass Menschenrechte von Uiguren in China verletzt werden,  . Mindestens eine Million Menschen sind laut Menschenrechtsorganisationen in Haft- und Umerziehungslagern eingesperrt. Der chinesische Staat hingegen spricht – nachdem er die Existenz der Institutionen bis 2018 geleugnet hatte – von Bildungszentren.  Die Maßnahmen begründet er mit dem Kampf gegen religiösen Extremismus. Ihre Religion dürfen Uiguren nicht ausüben. Exil-Uiguren berichten etwa von Misshandlungen, Zwangssterilisationen und zwangsweisen Trennungen von Familien. Die CDP-Studie verdeutlicht, wie der chinesische Staat vorgeht und auch wirtschaftlich davon profitiert. Studie der US-amerikanischen NGO Center for Global Policy (CGP) Ausmaß von Zwangsarbeit in der westchinesischen Region Lage der Menschenrechte in Xinjiang ist bekannt",tagesspiegel
Hongkonger Medienmogul und Aktivist . Jimmy Lai vom Gefängnis in Hausarrest entlassen,no_author,"23.12.2020, 11:52 Uhr",https://www.tagesspiegel.de/politik/hongkonger-medienmogul-und-aktivist-jimmy-lai-vom-gefaengnis-in-hausarrest-entlassen/26745838.html,"Der   darf unter strengen Auflagen das Gefängnis verlassen. Das Oberste Gericht in Hongkong gewährte am Mittwoch nach 20 Tagen Haft einen Kautionsantrag des 73-Jährigen. Lai darf laut dem Beschluss das Gefängnis verlassen, muss sich aber in Hausarrest begeben. Zudem muss Lai eine Kaution in Höhe von zehn Millionen Hongkong-Dollar (etwa eine Million Euro) hinterlegen. Lai war Anfang Dezember zunächst wegen Betrugsvorwürfen und kurz darauf wegen Verstößen gegen das neue Hongkonger Sicherheitsgesetz angeklagt worden. Bei einer Verurteilung droht ihm im schlimmsten Falle eine lebenslange Haftstrafe. Die Gerichtsverhandlung soll am 16. April fortgesetzt werden. Die Hongkonger Justiz geht mit harter Hand gegen die demokratischen Kräfte vor. Zuletzt waren der prominente Aktivist   zu Haftstrafen verurteilt worden. Während Wong eine Haftstrafe von 13,5 Monaten erhielt, müssen die ebenfalls bekannten Aktivisten Agnes Chow und Ivan Lam für zehn beziehungsweise sieben Monate ins Gefängnis.  Hongkonger Medienmogul und Aktivist Jimmy Lai Joshua Wong und zwei seiner Mitstreiter",tagesspiegel
Chinas Raumfahrtmission „Chang'e 5“ . Chinas Raumkapsel mit Mondgestein gelandet,no_author,"16.12.2020, 19:22 Uhr",https://www.tagesspiegel.de/wissen/chinas-raumfahrtmission-change-5-chinas-raumkapsel-mit-mondgestein-gelandet/26723374.html,"Die chinesische Raumkapsel mit zwei Kilogramm Mondgestein ist in der Steppe der Inneren Mongolei   Das berichtete das staatliche Fernsehen in der Nacht zum Donnerstag Ortszeit (Mittwoch MEZ). Damit ist China nach den USA und der Sowjetunion erst die dritte Raumfahrtnation, die Mondproben zur Erde gebracht hat. Der Lander des nach der chinesischen Mondgöttin benannten Raumschiffes „Chang'e 5“ hatte am 1. Dezember auf dem Mond aufgesetzt und Gesteinsproben gesammelt. Es ist das erste Mal seit 44 Jahren, dass wieder Mondproben zur Erde gebracht werden. Die Kapsel ist nur ein Siebtel so groß wie bemannte chinesische Raumschiffe. Auch ist das Landegebiet diesmal 16-mal größer als sonst, weil die Kapsel eine besondere Methode für den gefährlichen Eintritt in die Erdatmosphäre mit einer langgezogenen Flugbahn verwendet, um Hitze und Materialschäden zu vermeiden. Die Mission gilt als eine der schwierigsten in Chinas Raumfahrtgeschichte und ist auch eine Vorbereitung für eine geplante bemannte chinesische Mondlandung. Das Raumschiff, das aus einem Lander und einem Aufstiegsmodul sowie einem Orbiter und der Rückkehrkapsel besteht,  . Forscher warten gespannt auf das Mondgestein, dass viel jünger ist als alle bisher gesammelten Proben der USA und der Sowjetunion. Die Untersuchung könnte neue Erkenntnisse über die vulkanische Aktivität und die Geschichte des Mondes liefern. Die Apollo-Missionen der USA hatten rund 380 Kilogramm Mondgestein mitgebracht. Die Sowjetunion sammelte mit unbemannten Missionen etwa 300 Gramm ein. Der Lander von „Chang'e 5“ war in einem nach dem deutschen Astronomen Karl Rümker (1788-1862) genannten Vulkangebiet gelandet, das im „Ozean der Stürme“ liegt. Diese Region im oberen, linken Teil der erdzugewandten Seite des Mondes ist erst 1,2 Milliarden Jahre alt. Dagegen wird das Alter des Mondgesteins, das die USA und die Sowjetunion gesammelt hatten, auf 3,1 und 4,4 Milliarden Jahren geschätzt. China verfolgt ein ehrgeiziges Raumfahrtprogramm mit Missionen zum Mond und Mars sowie dem Aufbau einer eigenen Raumstation. Im Januar 2019 landete China als erste Raumfahrtnation mit „Chang'e 4“ auf der relativ unerforschten erdabgewandten Seite des Mondes. Es wurde ein Rover ausgesetzt, der weiter die Oberfläche erforscht. Chinas Mondflug erfolgte 51 Jahre nach der ersten bemannten Mondlandung der USA am 21. Juli 1969, bei der Neil Armstrong und Edwin „Buzz“ Aldrin als erste Menschen die Oberfläche des Erdtrabanten betraten. Die USA haben sechs Mal Astronauten auf den Mond gebracht. Mit „Apollo 17“ im Dezember 1972 stellten die Vereinigten Staaten ihre bemannten Mondlandungen ein. im Norden Chinas gelandet. war am 24. November gestartet",tagesspiegel
