title,author,date_published,url,article_text,source
Weltweite Handelskonflikte . EU setzt auf Abschreckung,Albrecht Meier,"08.12.2021, 13:06 Uhr",https://www.tagesspiegel.de/politik/weltweite-handelskonflikte-eu-setzt-auf-abschreckung/27873518.html,"Nach den Plänen der EU-Kommission soll die Gemeinschaft der 27 Staaten künftig ihre Handelsmacht gezielt einsetzen, um auf den wirtschaftlichen Druck von Drittstaaten zu reagieren. EU-Handelskommissar   stellte am Mittwoch ein neues Instrument vor, das gegen Länder wie   und Russland eingesetzt werden könnte, aber auch gegen die USA. Zwar haben sich die Beziehungen zwischen der EU und den USA nach dem Ende der Amtszeit von Präsident Donald Trump  . Zuletzt legten beide Seiten ihren Handelskonflikt vorläufig bei, nachdem Trump Strafzölle auf Aluminium- und Stahlimporte aus der EU verhängt hatte. Dennoch ist in der EU Trumps Willkürakt – der damalige Präsident begründete die Sonderzölle mit einer Bedrohung der nationalen Sicherheit – nicht vergessen. Um in solchen Fällen gewappnet zu sein, soll in der EU nun ein neues Sanktionsinstrument geschmiedet werden, das aus der Sicht der Kommission vor allem einen Vorteil hat: Ein effektiveres Handeln der Gemeinschaft soll dadurch ermöglicht werden, dass die Verhängung von EU-Sanktionen gegen Einzelpersonen, Unternehmen und Staaten nicht mehr an die Einstimmigkeit geknüpft ist. „Die EU wird nicht zögern zu reagieren, wenn wir bedroht werden“, sagte Dombrovskis. Die Gemeinschaft werde die Werkzeuge schaffen, die zur Verteidigung ihrer Werte und Interessen nötig seien. Es sei eine Tatsache, dass die Handelspolitik weltweit zunehmend als Waffe eingesetzt werde, sagte der Handelskommissar zur Begründung für den Vorschlag. Im Streitfall steht es der Kommission offen, gegenüber Drittstaaten Vergeltungsmaßnahmen wie Strafzölle zu verhängen oder deren Zugang zum EU-Binnenmarkt zu beschränken. Die Kommission würde damit über ein zusätzliches Machtmittel verfügen. Denn stoppen ließen sich von der Brüsseler Behörde verhängte Sanktionen nur, wenn eine qualifizierte Mehrheit der Mitgliedstaaten dagegen stimmt. Auch wenn die Kommission mit ihrem Vorschlag dem Drängen einiger Mitgliedstaaten folgt, so sind die nun anschließenden Beratungen mit den EU-Ländern und dem Europaparlament kein Selbstläufer. Während Deutschland und Frankreich den Vorschlag unterstützen, haben Länder wie Tschechien und Schweden Bedenken. Was es bedeutet, dem wirtschaftlichen Druck von Großmächten ausgesetzt zu sein, erlebt derzeit das kleine EU-Mitglied Litauen. Die Baltenrepublik hatte Taiwan die Eröffnung einer De-Facto-Botschaft erlaubt. Weil China die Insel als Teil der Volksrepublik betrachtet, reagierte Peking prompt: Einfuhren aus Litauen nach China wurden blockiert. Daraufhin bat Vilnius die EU um Hilfe. Das neue Sanktionsinstrument könnte demnächst eine wirksame Antwort der EU in derartigen Situationen ermöglichen. Aus der Sicht der EU-Kommission handelt es sich dabei in erster Linie um ein Abschreckungsinstrument: Drittstaaten sollen im besten Fall gar nicht erst auf die Idee kommen, wirtschaftlichen Druck auszuüben, um Einfluss auf die Klima- und Steuerpolitik der EU oder Fragen der Lebensmittelsicherheit zu nehmen. Valdis Dombrovskis China wieder verbessert",tagesspiegel
Kontinuität nach 16 Jahren Merkel? . Die Außenpolitik wird zum Härtetest für Scholz,Christoph von Marschall,"07.12.2021, 23:26 Uhr",https://www.tagesspiegel.de/politik/kontinuitaet-nach-16-jahren-merkel-die-aussenpolitik-wird-zum-haertetest-fuer-scholz/27870452.html,"Aus Raider wird Twix, sonst ändert sich nix. Und auf Angela Merkel folgt Olaf Scholz, aber die Außenpolitik bleibt, wie sie ist?  Man kann verstehen, warum der neue Kanzler da Kontinuität verspricht, in auffallendem Gegensatz zur Innenpolitik. Man möchte aber zugleich hoffen, dass er das nicht ernst meint.  Klar doch, Merkel ist die beliebteste Politikerin. Das verdankt sie auch dem verbreiteten Gefühl, dass sie das Land alles in allem gut durch die Abfolge von Krisen und Kriegen in ihren 16 Jahren Amtszeit geführt hat. Deshalb ist die Versuchung für den Neuen groß, ein Weiter-so zu versprechen, um diesen Teil ihrer Popularität auf sich zu lenken. in die sich  . Der wahre Härtetest für Scholz wartet trotz Corona und Reformstau nicht im Innern, sondern außerhalb Deutschlands und Europas.  Es ist zugleich ein Test potenzieller Bruchstellen in seiner Koalition. Die künftige Außenministerin Annalena   gegenüber autoritären Staaten wie China und Russland. In den Tagen um die Vereidigung der neuen Regierung   an der Grenze zur Ukraine, wie geschlossen der Westen handelt. Das Timing ist kein Zufall. Ganz  , um zu sehen, wie der neue US-Präsident Joe Biden reagiert.  Nun testet er, ob ein Kanzler aus den Reihen der traditionell Moskau-freundlicheren SPD die harte Linie aufweicht, die Biden und die Grünen favorisieren. Baerbock will die  . Biden droht mit Russlands Ausschluss vom internationalen Zahlungsverkehr. Bei China wird Scholz sich ebenfalls bald entscheiden müssen. Trägt Deutschland den diplomatischen Boykott der Olympischen Winterspiele mit? Drängt er deutsche Konzerne, Investitionen vom Umgang mit Menschenrechten abhängig zu machen?  Wie weit geht er in Absprache mit den USA und den Demokratien in Asien, um  ? Auch die   verlangen ihm bald Festlegungen ab, schon wegen der Mitverantwortung für Israels Sicherheit. Die Frage nach der künftigen Außenpolitik führt mitten hinein in ein Paradox der 16 Jahre Merkel. Die weitgehende Zustimmung zu ihrer Außenpolitik, die bis an die Grenze der Wertevergessenheit auf Dialog setzte, kontrastiert auffallend mit einer eher ruhmlosen Bilanz der Ergebnisse. In der ersten Hälfte ihrer Amtszeit konnte sie noch mit erfolgreichem Krisenmanagement glänzen.  In der zweiten Hälfte von 2014 an ging es bergab. Putin griff die Ukraine an und ließ im Ausland Dissidenten ermorden, auch in Berlin. China beendete die langsame Öffnung für westliche Werte und Regeln; Präsident Xi agiert nach innen diktatorischer und nach außen aggressiver.    Die EU  , erlitt Euro- und Migrationskrisen, von denen   hat, und kann  . Vier Jahre Donald Trump zeigten, dass auf die USA nur noch bedingt Verlass ist.  Die Klimakrise verschärft sich, weil Europa keine Mittel findet, um die  , zur   Die Welthandelsordnung zerbricht allmählich. Die Veränderungen zum Schlechteren sind nicht Merkels Schuld. Aber hat sie so erfolgreich auf die neue Lage reagiert, dass nun Kontinuität die Devise ist? Merkels Dialog mit Russland und China war richtig, um den Schaden zu begrenzen. Aber er reicht nicht als Zukunftsstrategie für eine konfliktreiche Welt.  Die sieben Jahre seit 2014 haben gelehrt: Deutschland und Europa müssen robuster auftreten, um ihre Interessen zu verteidigen. Das erwarten auch die EU-Partner und   von Scholz. Je früher er einkalkuliert, dass seine Regierung an einer Vernachlässigung der Außenpolitik scheitern kann, desto mehr Freiraum bleibt ihm für eine erfolgreiche Innenpolitik. Kontinuität passt jedoch schlecht  rapide wandelnde internationale Lage Baerbock fordert ausdrücklich eine Neuausrichtung der Politik prüft Wladimir Putin mit einem Truppenaufmarsch ähnlich hat Putin im Frühjahr gehandelt Betriebsgenehmigung für die Gas-Pipeline Nord Stream 2 stoppen Taiwan vor Pekings Zugriff zu schützen Atomgespräche mit dem Iran verlor Großbritannien im Brexit sie sich bis heute nicht erholt Grundwerte wie den Rechtsstaat nicht durchsetzen größten Emissionssünder, voran China Reduzierung zu bewegen. die USA",tagesspiegel
Auslandsblick auf die Ampel-Koalition . Das erwartet die Welt von der neuen Bundesregierung,no_author,"07.12.2021, 16:56 Uhr",https://www.tagesspiegel.de/politik/auslandsblick-auf-die-ampel-koalition-das-erwartet-die-welt-von-der-neuen-bundesregierung/27870378.html,"Deutlicher hätte das   nicht sein können. Beim G20-Gipfel in Rom nahmen   (CDU) und ihr Vizekanzler und wahrscheinlicher   quasi im Duett teil und absolvierten alle wichtigen Gespräche gemeinsam.    Wahrscheinlich am Freitag will Scholz zu seiner ersten Auslandsreise als Kanzler aufbrechen. Ab dann wird sich zeigen, ob er Merkels Linie auf dem internationalen Parkett fortführt oder doch einiges anders macht. Im Ausland wird das genau beobachtet werden. Die Regierung von   setzt weiter auf ein starkes Deutschland, das innerhalb der EU, der Nato und der internationalen Gemeinschaft Verantwortung übernimmt. Die   werden ganz besonders darauf achten, wie sich die neue deutsche Regierung gegenüber China positioniert. Washington dringt auf einen konfrontativeren Umgang mit dem strategischen Rivalen, während Merkels Regierung eher auf Dialog und gute Handelsbeziehungen gesetzt hatte. Gleiches gilt für den künftigen Umgang mit Russland. Moskaus Truppenbewegungen an der ukrainischen Grenze sorgen derzeit für besondere Unruhe. Washington setzt auf die Androhung harter Sanktionen, um Russlands mögliche militärische Ambitionen im Zaum zu halten. Dabei braucht die US-Regierung auch die Unterstützung Deutschlands und der EU - auch weil die Nato-Verbündeten in Europa für Moskau wichtige Handelspartner und Finanzplätze darstellen.   In Bezug auf den Umgang mit Russland geht es auch um das alte Streitthema der Erdgas-Pipeline Nord Stream 2. Washington wird mit Nachdruck einfordern, dass die neue Regierung ihre Verpflichtungen aus einer Kompromissvereinbarung mit den USA zu dem Thema erfüllt. Demnach muss Deutschland vor allem die Ukraine unterstützen. Merkel wird in Peking schon heute schwer vermisst, weil sie ehrlich ihre Meinung gesagt, aber immer auch Verständnis für   aufgebracht und eine eher wirtschaftsorientierte China-Politik betrieben hat. Peking hofft nicht nur, dass auch Scholz bewusst ist, wie abhängig Deutschland von der wirtschaftlichen Kooperation mit China ist. Wichtig wäre dann natürlich auch, dass der neue Kanzler sich ähnlich federführend um China kümmert und das schwierige Verhältnis nicht der neuen Außenministerin Annalena Baerbock überlässt. Denn Grüne und FDP wollen sich nicht nur stärker für Menschenrechte, verfolgte Uiguren und Tibeter oder Hongkong einsetzen, sondern auch für freien Handel und fairen Marktzugang eintreten. Peking stellt sich schon wegen der Spannungen mit den USA aber auch auf schwerere Zeiten ein, indem es seine Abhängigkeit vom Ausland reduzieren will.  erwartet angesichts der schweren Spannungen der vergangenen Jahre keine grundlegende Besserung des Verhältnisses mit Deutschland. Zwar betonen Kommentatoren in Moskau, die Gasgroßmacht komme im Koalitionsvertrag vergleichsweise gut weg. Aber sie verweisen auch auf Baerbocks scharfen Ton gegenüber Moskau - und besonders auf ihre Ablehnung der fertigen Ostsee-Pipeline Nord Stream 2. Der Moskauer Deutschland-Experte Wladislaw Below erwartet aber, dass der Bundeskanzler weiter die außenpolitischen Linien vorgibt. Er sieht keinen neuen Konfrontationskurs unter dem SPD-Mann Scholz. „Die Koalitionäre starten nicht von „roten Linien“ aus, sondern von einem konstruktiven Ansatz“, sagt der Chef des Deutschland-Zentrums beim Europainstitut der Russischen Akademie der Wissenschaften. Zudem setzt die Atommacht sicherheitspolitisch auf einen respektvolleren Ton unter der neuen Verteidigungsministerin Christine Lambrecht (SPD). Annegret Kramp-Karrenbauer (CDU) hatte Moskau immer wieder verärgert mit Äußerungen, Deutschland müsse mit „Russland aus einer Position der Stärke“ reden. Mit einem grün-geführten Außenamt unter der designierten Außenministerin Annalena Baerbock dürfte sich die   auf einen härteren Kurs der neuen Bundesregierung einstellen müssen. Grünen-Politiker gehen den türkischen Präsidenten Recep Tayyip Erdogan immer wieder scharf an, etwa in Menschenrechtsfragen.  Mit Blick auf die europäische Asylpolitik nannte Baerbock Erdogan etwa im September als Beispiel für einen „antidemokratischen Akteur“, zu dessen „Spielball“ Europäerinnen und Europäer geworden seien. Die Partei hat bisher außerdem ein Ende des Flüchtlingsdeals gefordert. Der ist zwar ein Abkommen zwischen der Türkei und der EU, Merkel hat ihn aber mit ausgehandelt und entsprechend unterstützt. Erdogan betonte bei Merkels Abschiedsbesuch als Kanzlerin in der Türkei Mitte Oktober, dass er auch unter der neuen Bundesregierung auf eine enge Zusammenarbeit beider Länder hoffe. Wie sich das konkret entwickelt, bleibt abzuwarten.  geht es vor allem um eine möglich schnelle Regierungsbildung in Deutschland, denn Paris übernimmt im Januar den EU-Ratsvorsitz. Deutschland kommt als bevölkerungsreichstem EU-Mitglied bei neuen Projekten eine besondere Bedeutung zu. Mit SPD, Grünen und FDP als proeuropäische Parteien erwartet Paris eine gewisse Kontinuität der bisherigen deutschen Politik, wie Éric-André Martin vom Institut Français des Relations Internationales sagt. Scholz gebe Paris als bereits bekannter und erfahrener Politiker eine gewisse Sicherheit und werde als Wunschpartner gesehen.  Eine offene Frage sei für Frankreich, ob Scholz die mitunter weit auseinanderliegenden Grünen und die FDP werde zusammenhalten können, sagt der Experte für deutsch-französische Beziehungen. Auch wie die notwendigen Investitionen beim Klima mit der bisher eher strikten Schuldenpolitik und dem Kurs finanzieller Stabilität vereinbart würden, beobachte Frankreich aufmerksam. Mit Blick auf   ist von der Ampel-Regierung insgesamt eine Politik der Kontinuität zu erwarten. Die von Angela Merkel geprägte Aussage zu Israels Sicherheit als „Staatsräson“ Deutschlands ist sogar im Koalitionsvertrag festgehalten. Auch der voraussichtlich künftige Kanzler Olaf Scholz hat sie sich auf die Fahne geschrieben. Die neue Regierung setzt sich ebenfalls für eine Zwei-Staaten-Lösung in Nahost ein, also die Gründung eines unabhängigen Palästinenserstaates. Von den Palästinensern werden derweil „Fortschritte bei Demokratie, Rechtsstaatlichkeit und Menschenrechen“ erwartet. Von Israel wird ein Stopp des Siedlungsausbaus in den Palästinensergebieten gefordert, der als Hindernis für eine künftige Friedensregelung gilt. Aufmerksam betrachtet wird in Israel die designierte Außenministerin Annalena Baerbock. Die Grünen-Politikerin hatte zwar 2018 einen Lieferstopp von US-Booten an Israel gefordert. Im jüngsten Konflikt mit der im Gazastreifen herrschenden islamistischen Hamas im Mai stellte sie sich jedoch klar an Israels Seite und betonte das Recht des jüdischen Staates auf Selbstverteidigung. Sie distanzierte sich außerdem von der Israel-Boykott-Bewegung BDS. Der Abschied von Kanzlerin Angela Merkel, die   in der „Bild“-Zeitung als „Titanin der internationalen Diplomatie“ würdigte, überstrahlt in   den Beginn der Ampel-Koalition deutlich. Leitartikel oder Kommentare zur neuen Regierung sind kaum zu finden, ebenso wenig wie Äußerungen von Politikern.  Für alle scheint klar, dass sich trotz der neuen Koalitionsfarben die Politik nicht grundsätzlich ändern wird. Der Brexit hat die Prioritäten verschoben: Für London ist Brüssel wichtigster und oft einziger Ansprechpartner in der EU, auch weil Berlin in Streitpunkten wie Nordirland und Fischereirechten ohnehin keine eigene Meinung äußern wird.  Der Blick von Premier Johnson geht längst über Europa hinaus: „Global Britain“ heißt sein Motto. Außenministerin Liz Truss würdigt zwar die militärische Zusammenarbeit der Nato. Die EU oder gar Deutschland erwähnt sie aber kaum.  Signal der Kontinuität in der deutschen Außenpolitik Bundeskanzlerin Angela Merkel Nachfolger Olaf Scholz (SPD) US-Präsident Joe Biden USA China Russland Türkei Frankreich Israel Premierminister Boris Johnson Großbritannien",tagesspiegel
Initiative „Global Gateway“ . EU macht Chinas „Neuer Seidenstraße“ Konkurrenz,Albrecht Meier,"01.12.2021, 15:33 Uhr",https://www.tagesspiegel.de/politik/initiative-global-gateway-eu-macht-chinas-neuer-seidenstrasse-konkurrenz/27851764.html,"Die EU möchte den weltweiten Einfluss Chinas eindämmen. Um dem Pekinger Projekt der   etwas entgegenzusetzen, stellte EU-Kommissionspräsidentin Ursula von der Leyen am Mittwoch eine milliardenschwere Initiative vor, mit der in den kommenden sechs Jahren Infrastrukturprojekte in Schwellen- und Entwicklungsländern gefördert werden sollen. Die Initiative mit dem Namen „Global Gateway“ (auf Deutsch etwa: „Tor zur Welt“) werde bis 2027 die Summe von 300 Milliarden Euro mobilisieren, kündigte   an. Als Beispiele für förderwürdige Projekte nannte von der Leyen den Einsatz von grünem Wasserstoff, den Ausbau des Gesundheitswesens, aber auch die Unterstützung des Bildungssystems in den Schwellen- und Entwicklungsländern. Auch Bahnlinien und Internetverbindungen sind geplant. Die Partnerländer könnten selbst ihre Projekte benennen, sagte die Kommissionspräsidentin. Allerdings müssten die beteiligten Länder der EU-Maxime der   und einer menschenwürdigen Digitalisierung folgen. „Hier handelt die geopolitische Kommission“, erklärte von der Leyen. Mit dem Anspruch, mitsamt ihrer Kommission weltweit als außenpolitischer Akteur wahrgenommen zu werden, hatte sie vor zwei Jahren ihr Spitzenamt in Brüssel angetreten. Kritiker wandten allerdings ein, dass die Deutsche das Versprechen bislang nicht eingelöst habe. Vor allem das als „Systemrivale“ eingestufte China stellt die Gemeinschaft der 27 Staaten vor globale Herausforderungen. Denn mit der Seidenstraßen-Initiative hat Peking  inzwischen in über 60 Ländern in Europa, Asien und Afrika Handels- und Infrastrukturprojekte in Angriff genommen. Als Antwort auf die Neue Seidenstraße haben die sieben führenden westlichen Industriestaaten (G7) auf Initiative von US-Präsident Joe Biden im vergangenen Juni die Initiative „Build Back Better World“ (auf Deutsch: „eine bessere Welt wiederaufbauen“) ins Leben gerufen. Dabei sollen hunderte Milliarden Dollar von den G7-Ländern in einer Kooperation mit der Privatwirtschaft weltweit investiert werden. Nach einem ähnlichen Modell soll auch die „Global Gateway“-Initiative der EU funktionieren. Die Summe von 300 Milliarden Euro setzt sich aus Mitteln aus dem EU-Haushalt zusammen, die um die Gelder von privaten Investoren ergänzt werden sollen. Mit Hilfe des EU-Fonds für nachhaltige Entwicklung sollen beispielsweise insgesamt bis zu 135 Milliarden Euro mobilisiert werden. Bei der Finanzierung baut die EU-Kommission unter anderem auf private Anleger, die Europäische Investitionsbank (EIB) und die Europäische Bank für Wiederaufbau und Entwicklung (EBRD). Anders als die chinesische Regierung werde die EU in erster Linie Zuschüsse an die beteiligten Länder vergeben, sagte die für internationale Partnerschaften zuständige EU-Kommissarin Jutta Urpilainen. Von der Leyen betonte, dass die Partnerländer angesichts der EU-Finanzierung nicht befürchten müssten, untragbare Schuldenberge aufzuhäufen. Zudem herrsche bei den EU-Hilfen Transparenz. „Deshalb ist es eine echte Alternative“, sagte sie mit Blick auf die Konkurrenz aus China. Bei den geplanten Förderprojekten hat die EU nicht zuletzt die unmittelbare Nachbarschaft im Blick. Wie EU-Erweiterungskommissar Oliver Varhelyi ausführte, seien für die Region des westlichen Balkans bis 2027 fast  30 Milliarden Euro als Zuschüsse und Kredite vorgesehen.  Mit dem Geld sollen Straßen- und Bahnverbindungen gebaut werden. Das Ziel bestehe dabei darin, alle Hauptstädte der Region untereinander und mit der EU zu verbinden.  Im Rahmen der Östlichen Partnerschaft, der die   angehört, sei  die Verlegung eines Datenkabels unter dem Schwarzen Meer geplant. Während der Vorsitzende des Handelsausschusses im EU-Parlament, Bernd Lange (SPD), die Initiative als einen „Beitrag zum weltweiten Kampf gegen Klimawandel und Armut“ begrüßte, kam vom CSU-Europaabgeordneten Markus Ferber Kritik. „Ein großer Teil des Geldes kommt aus bestehenden Programmen oder hängt von privaten Mitteln ab“, monierte  Ferber. „Ein großer Wurf sieht anders aus. China wird nicht vor Angst erstarren“, so Ferber. Der Bundesverband der Deutschen Industrie (BDI) lobte hingegen die Initiative aus Brüssel. Da chinesische Infrastrukturangebote an andere Länder oft keine Konkurrenz hätten, sei es „höchste Zeit, pragmatische Alternativangebote nach europäischen Standards anzubieten“ erklärte Wolfgang Niedermark, Mitglied der BDI-Hauptgeschäftsführung.  Neuen Seidenstraße von der Leyen Klimafreundlichkeit Ukraine",tagesspiegel
Auch deutsche Konzerne legen laut Sipri zu . Weltweite Rüstungsindustrie steigert trotz Pandemie ihre Umsätze,no_author,"06.12.2021, 09:38 Uhr",https://www.tagesspiegel.de/wirtschaft/auch-deutsche-konzerne-legen-laut-sipri-zu-weltweite-ruestungsindustrie-steigert-trotz-pandemie-ihre-umsaetze/27865392.html,"Die weltweit führenden Rüstungsfirmen haben trotz der Corona-Pandemie im vergangenen Jahr ihre Umsätze gesteigert. Die 100 größten Hersteller setzten insgesamt 531 Milliarden US-Dollar (470 Milliarden Euro) um - ein Plus von 1,3 Prozent im Vergleich zum Vorjahr, wie das Stockholmer Friedensforschungsinstituts Sipri bekanntgab. Mit Abstand führend sind US-Unternehmen, dahinter folgen Rüstungsfirmen aus China. Kritik an den Geschäften kam vom katholischen Hilfswerk Misereor. Die Umsätze der vier deutschen Hersteller in der Liste erhöhten sich laut Sipri auf 8,9 Milliarden Dollar, ihr Anteil am Gesamtumsatz der 100 größten Rüstungsunternehmen lag bei 1,7 Prozent. Trotz schrumpfender Weltwirtschaft und Lieferkettenengpässen seien die Branchenriesen „weitgehend durch die anhaltende staatliche Nachfrage nach   und Dienstleistungen geschützt“, sagt Alexandra Marksteiner, Sipri-Expertin für Rüstungsproduktion. „Einige Regierungen haben sogar ihre Zahlungen an die Rüstungsindustrie erhöht, um die Auswirkungen der Covid-19-Krise abzumildern.“ US-Unternehmen dominieren auch 2020 die Sipri-Rangliste. Die Umsätze durch Waffenverkäufe der 41 in der Liste geführten US-Firmen beliefen sich zusammen auf 285 Milliarden US-Dollar - ein Anstieg um 1,9 Prozent im Vergleich zu 2019. Auf die US-Rüstungsproduzenten entfielen 54 Prozent der gesamten Waffenverkäufe der Top 100. Um weiterhin führend zu bleiben, setzt der US-Rüstungsmarkt dem Bericht zufolge auf Fusionen und Übernahmen. Die Unternehmen erweiterten demnach auch ihr Portfolio. „Dieser Trend ist besonders ausgeprägt im Raumfahrtsektor“, sagte die Sipri-Expertin Marksteiner. Chinesische Firmen entwickeln sich derweil zu einigen der „fortschrittlichsten Militärtechnologieproduzenten der Welt“, wie Nan Tian, leitender Wissenschaftler bei Sipri, sagte. Auf die fünf chinesischen Rüstungsfirmen in der Rangliste entfielen 13 Prozent des Gesamt-Umsatzes. Damit befindet sich China zwar weit hinter den USA, aber noch vor Großbritannien, das auf Platz drei liegt. Laut Sipri verkauften chinesische Firmen Rüstungsgüter im Wert von schätzungsweise 66,8 Milliarden Dollar - 1,5 Prozent mehr als im Vorjahr. Die chinesischen Hersteller hätten in den vergangenen Jahren von den militärischen Modernisierungsprogrammen des Landes sowie der Verschmelzung von militärischen und zivilen Projekten profitiert, sagte Nan Tian. Die europäischen Hersteller haben hingegen einen durchwachsene Bilanz im ersten Corona-Jahr vorzuweisen. Auf die 26 europäischen Rüstungsunternehmen entfielen zusammen 21 Prozent der gesamten Waffenverkäufe (109 Milliarden Dollar). Der Umsatz des britischen Konzerns BAE Systems - des einzigen europäischen Unternehmens unter den Top 10 - stieg laut dem Bericht um 6,6 Prozent auf 24 Milliarden Dollar. Hingegen brach der Umsatz der französischen Unternehmen um 7,7 Prozent ein. Die vier   in der Sipri-Liste der 100 größten   generierten ein Umsatzplus von 1,3 Prozent, wobei der größte deutsche Waffenhersteller Rheinmetall einen Anstieg von 5,2 Prozent verzeichnete. Der Schiffbauer ThyssenKrupp hingegen meldete einen Rückgang von 3,7 Prozent. Russlands größte Rüstungshersteller sahen sich das dritte Jahr in Folge mit einem Umsatzrückgang konfrontiert. Die Verkaufsbilanzen der neun in der Rangliste geführten Firmen sanken laut Sipri um 6,5 Prozent auf 26,4 Milliarden US-Dollar. Der Rückgang fiel laut Sipri mit pandemiebedingten Lieferverzögerungen und dem Ende des staatlichen Rüstungsprogramms zusammen. Insgesamt beliefen sich die Waffenverkäufe der Unternehmen in den Top 100 mit Sitz außerhalb der USA, Chinas, Russland und Europa auf 43,1 Milliarden Dollar - ein Anstieg von 3,4 Prozent im Vergleich mit 2019. Dies entsprach 8,1 Prozent des Gesamtumsatzes der 100 größten Hersteller. Das katholische Hilfswerk Misereor kritisierte die Rüstungsgeschäfte. Der Bericht zeige „einmal mehr“, dass „die Staaten dieser Welt in Krisenzeiten falsche Prioritäten setzen“, sagte dessen Hauptgeschäftsführer, Pirmin Spiegel, der „Neuen Osnabrücker Zeitung“.  Die Corona-Pandemie bedeute für viele Menschen den Verlust ihrer Lebensgrundlagen. „Gleichzeitig boomt die Rüstungsindustrie, und auch deutsche Hersteller machen gute Geschäfte zulasten von Menschen in Konfliktregionen und auf Kosten zahlreicher Gewaltopfer.“ Die neue Bundesregierung müsse nun „Ernst machen mit ihren Ankündigungen zur Exportkontrolle und Abrüstung“.  militärischen Gütern deutschen Unternehmen Rüstungsfirmen",tagesspiegel
