title,author,date_published,url,article_text,source
Blauäugig in Brüssel . Die EU billigt stillschweigend chinesische Zwangsarbeit,Albrecht Meier,"30.12.2020, 16:15 Uhr",https://www.tagesspiegel.de/politik/blauaeugig-in-bruessel-die-eu-billigt-stillschweigend-chinesische-zwangsarbeit/26758978.html,"Nach siebenjährigen Verhandlungen gibt es nun kurz vor Jahresende eine   über ein Investitionsabkommen. Das klingt zunächst wie die letzte Erfolgsmeldung in der zu Ende gehenden deutschen EU-Ratspräsidentschaft. In Wahrheit handelt es sich um einen geostrategischen Punktgewinn - allerdings nicht für die EU, sondern für China, das nun nicht mehr einen gemeinsamen harten Kurs der Europäer und der   befürchten muss. China ist für die EU nach den USA der zweitwichtigste Handelspartner. Nicht zuletzt für Deutschland sind China und dessen Markt mit 1,4 Milliarden Menschen von entscheidender Bedeutung. Vor diesem Hintergrund mag es nachvollziehbar sein, dass sich insbesondere Bundeskanzlerin Angela Merkel im vergangenen Halbjahr für das Investitionsabkommen stark gemacht hat.  Sofern die Grundsatzeinigung bei weiteren Verhandlungen den letzten Schliff erhält und auch das Europaparlament anschließend zustimmt, bietet die Vereinbarung für die Europäer die Aussicht auf weitere Investitionen in Fernost - etwa bei E-Autos oder im Gesundheitswesen. Umgekehrt können chinesische Firmen auf größere Rechtssicherheit in der EU zählen. Dafür zahlen die Europäer aber einen hohen Preis – und der besteht in der stillschweigenden Billigung von chinesischen Praktiken wie Zwangsarbeit und der Verletzung der Rechte von Minderheiten.  Auch wenn Peking zuletzt bei den Verhandlungen so große Zugeständnisse gemacht hat wie nie zuvor, so sollte niemand in Brüssel blauäugig sein: Der „systemische Rivale“ China lässt sich auch dank guter Handelsbeziehungen noch lange nicht zähmen. Und wenn Peking in dem Abkommen zusagt, künftig Standards der internationalen Arbeitsorganisation ILO einhalten zu wollen, so stellt sich doch die Frage, wie Zuwiderhandlungen in der Praxis geahndet werden sollen. Statt überstürzt eine Einigung mit Chinas Staatschef Xi Jinping zu suchen, wäre es für die Europäer sinnvoller gewesen, zunächst einmal mit dem   zu sondieren, wie eine kraftvolle transatlantische Antwort auf unfaire chinesische Wettbewerbspraktiken - etwa bei den Staatsbeihilfen - aussehen könnte. Doch diese Chance ist nun vertan. grundsätzliche Einigung zwischen der EU und China USA künftigen US-Präsidenten Joe Biden",tagesspiegel
Angebliche Verstöße gegen Chinas Sicherheitsgesetz . Hongkonger Verleger und Aktivist Jimmy Lai angeklagt,no_author,"11.12.2020, 11:26 Uhr",https://www.tagesspiegel.de/politik/angebliche-verstoesse-gegen-chinas-sicherheitsgesetz-hongkonger-verleger-und-aktivist-jimmy-lai-angeklagt/26709118.html,"Der Hongkonger   ist wegen angeblicher Verstöße gegen das Sicherheitsgesetz angeklagt worden. Das berichteten mehrere Hongkonger Medien am Freitag übereinstimmend unter Berufung auf Polizeiquellen. Laut der Zeitung   werden Lai geheime Absprachen mit Kräften im Ausland vorgeworfen. Bei einer Verurteilung droht ihm demnach im schlimmsten Falle eine lebenslange Haftstrafe. Lai sitzt bereits seit vergangener Woche wegen Betrugsvorwürfen in Untersuchungshaft. Der Unternehmer, dem unter anderem die pro-demokratische Zeitung „Apple Daily“ gehört, musste schon im August zwei Tage in Polizeigewahrsam verbringen, als sein Unternehmen Next Digital Media wegen des Verdachts auf Verstöße gegen das neue Gesetz zum Schutz der Nationalen Sicherheit durchsucht worden war. Die Hongkonger Justiz geht mit harter Hand gegen die demokratischen Kräfte vor. Allein in dieser Woche waren erneut 16   festgenommen worden. Peking bereite durch die Anklage von Jimmy Lai ein „altbekanntes Narrativ“ vor, kritisierte die Vorsitzende des Menschenrechtsausschusses des Bundestages, Gyde Jensen (FDP), am Freitag. Durch den Vorwurf der Zusammenarbeit mit ausländischen Kräften solle der Eindruck entstehen, dass die Demokratiebewegung eine Randerscheinung sei, obwohl sie mitten aus der Gesellschaft komme. „Jimmy Lai muss dafür nun wohl jahrelang mit seiner Freiheit bezahlen. Das darf die Weltgemeinschaft nicht einfach hinnehmen“, so Jensen weiter.  Als Reaktion auf anhaltende Proteste und Rufe nach mehr Demokratie in Hongkong hatte Chinas kommunistische Führung im Sommer ein ebenso scharfes wie vage formuliertes Sicherheitsgesetz für Hongkong erlassen. Es richtet sich gegen Aktivitäten, die Peking als subversiv, separatistisch, terroristisch oder verschwörerisch ansieht. Das Gesetz ist der bisher weitestgehende Eingriff in Hongkongs Autonomie und gibt Chinas Staatssicherheit weitreichende Vollmachten in dem eigenständigen Territorium. Aus Sicht der Kritiker ist es das Ende des Grundsatzes „ein Land, zwei Systeme“, nach dem Hongkong seit 1997 unter chinesischer Souveränität autonom mit weitreichenden Freiheitsrechten für seine sieben Millionen Einwohner regiert wurde.  Medienmogul und Aktivist Jimmy Lai „South China Morning Post“ Anhänger der Demokratiebewegung",tagesspiegel
Wegen Protest gegen Chinas Sicherheitsgesetz . Acht Demokratieaktivisten in Hongkong festgenommen,no_author,"08.12.2020, 10:09 Uhr",https://www.tagesspiegel.de/politik/wegen-protest-gegen-chinas-sicherheitsgesetz-acht-demokratieaktivisten-in-hongkong-festgenommen/26696798.html,"In Hongkong sind   auf der Grundlage des umstrittenen chinesischen Sicherheitsgesetzes festgenommen worden. Den acht Aktivisten, darunter drei ehemalige Parlamentsabgeordnete, werde die Organisation und Teilnahme an einer nicht genehmigten Demonstration gegen das Gesetz am 1. Juli vorgeworfen, teilte die Polizei am Dienstag mit. Bei einer Verurteilung nach dem Sicherheitsgesetz drohen den Aktivisten bis zu fünf Jahre Haft. Unter den Festgenommenen sind der bekannte Demokratieaktivist Leung Kwok Hung, der frühere Vorsitzende der Demokratischen Partei von Hongkong, Wu Chi Wai und der Ex-Abgeordnete Eddie Chu. Auch der Organisator einer jährlichen Demonstration zur Erinnerung an die Übergabe der früheren britischen Kronkolonie an Großbritannien, Figo Chan, wurde festgesetzt. Die Festnahmen erfolgten wenige Stunden, nachdem die USA als Reaktion auf den Ausschluss pro-demokratischer Abgeordneter aus dem Hongkonger Parlament 14 chinesische Führungsvertreter mit neuen Sanktionen belegt hatten. US-Außenminister Mike Pompeo verurteilte in der Begründung der Strafmaßnahmen erneut das sogenannte Sicherheitsgesetz. Dieses ""untergrabe"" die Autonomie Hongkongs. Das im Juni erlassene Gesetz erlaubt den chinesischen Behörden in Hongkong ein hartes Vorgehen gegen alle Aktivitäten, die nach ihrer Auffassung die nationale Sicherheit bedrohen. Das Gesetzt greift massiv in die Autonomierechte Hongkongs ein. Es war unter dem Eindruck der pro-demokratischen Proteste des vergangenen Jahres erlassen worden. Gegen die Verabschiedung des Gesetzes waren Zehntausende Menschen auf die Straße gegangen. Im Zusammenhang mit der Demonstration am 1. Juli wurden mehr als 370 Menschen festgenommen - unter anderem, weil sie Banner oder Flaggen mit pro-demokratischen Aufschriften gezeigt hatten.  erneut mehrere Demokratieaktivisten",tagesspiegel
Durchwachsene EU-Bilanz . EU-Finanzen und Rechtsstaatsmechanismus stehen - das zählt,Albrecht Meier,"11.12.2020, 17:31 Uhr",https://www.tagesspiegel.de/politik/durchwachsene-eu-bilanz-eu-finanzen-und-rechtsstaatsmechanismus-stehen-das-zaehlt/26711272.html,"Vor fünfeinhalb Monaten, als die deutsche EU-Präsidentschaft begann, hatte sich Berlin viel vorgenommen. Die EU sollte beim Klimaschutz vorankommen, Europas Rolle in der Welt sollte gestärkt und nebenbei auch die gemeinsame Migrationspolitik rundum erneuert werden. Gemessen an diesen Ansprüchen ist der deutsche EU-Vorsitz vieles schuldig geblieben. Das wichtigste Ziel hat Kanzlerin Angela Merkel allerdings erreicht: Ihr ist es gelungen, einen europäischen Scherbenhaufen zum Ende des Jahres zu verhindern. Den hätte sich die EU in Zeiten der Pandemie weniger denn je leisten können. An der Pandemie liegt es auch, dass die Bilanz des halbjährigen deutschen EU-Vorsitzes gemischt ist. Ein aufwändig geplanter EU-China-Gipfel musste in Leipzig ausfallen und schrumpfte zur Videokonferenz. Bis heute mühen sich beide Seiten an einem Investitionsabkommen zum gegenseitigen wirtschaftlichen Nutzen. Auch Innenminister Horst Seehofer bekam zu spüren, dass die Kapazitäten in Brüssel beschränkt sind. Sein Vorhaben, das EU-Asylsystem zu reformieren, landete in der Warteschleife. Das wichtigste Vorhaben bestand aber für Berlin von Anfang an darin, einen tragfähigen Mehrjahresetat der EU für die kommenden sieben Jahre mitsamt dem neuartigen Corona-Wiederaufbaufonds und einem Rechtsstaatsmechanismus unbeschadet durch die Brüsseler Institutionen zu schleusen. Bundeskanzlerin Angela Merkel kann nun nach dem EU-Gipfel vermelden:  . Das ist umso bemerkenswerter, als Ungarns Regierungschef Viktor Orbán und der polnische Vize-Regierungschef Jaroslaw Kaczynski zuvor versucht haben, den neuen Rechtsstaatsmechanismus der EU zu torpedieren. Mit einem Veto gegen die Freigabe der Corona-Hilfsmilliarden, die in Ländern wie Italien und Spanien dringend benötigt werden, wollten sie sich vor einer drohenden Kürzung von Brüsseler Subventionen in Sicherheit bringen. Aber sie sind eingeknickt – weil die übrigen 25 EU-Staaten damit drohten, den Corona-Hilfsfonds ohne Ungarn und Polen zu organisieren. Die Aussicht, auf Corona-Milliarden verzichten zu müssen, hat sie dann doch zu sehr geschreckt. Der deutsche EU-Vorsitz kann es auch als Erfolg verbuchen, dass demnächst EU-Gelder gekürzt werden können, wenn bei der Verwendung von Subventionen aus Brüssel rechtsstaatliche Kriterien missachtet werden. Weil aber Ungarn und Polen vor dem Europäischen Gerichtshof erst einmal gegen den Rechtsstaatsmechanismus klagen wollen, können die Nationalisten in Budapest und Warschau bis auf Weiteres in vollem Umfang von den Milliarden aus Brüssel profitieren. Bedenklich stimmt auch, dass unter dem Vorsitz Merkels die Fliehkräfte in der EU nicht geringer geworden sind. Das zeigt sich etwa in der Klimapolitik. Zwar kann die EU froh darüber sein, wenn es nun in der Gemeinschaft eine Einigung auf   gibt. Aber dass Polen eine ganze Verhandlungsnacht erzwang, um möglichst viel Geld für den energiepolitischen Übergang herauszuschlagen, spricht Bände über das Klima unter den 27 EU-Staaten.Glücklicherweise hält die Gemeinschaft beim derzeit wichtigsten Härtetest zusammen – dem drohenden   vor dem Ausscheiden Großbritanniens aus dem EU-Binnenmarkt in drei Wochen. Die Endlos-Verhandlungen mit London halten auch eine Lehre für alle Skeptiker im Inneren bereit: Dass es sich auszahlt, Teil der Gemeinschaft zu bleiben. Mission erfüllt ehrgeizigere Ziele für 2030 „No Deal“",tagesspiegel
Jahrestag des ersten Corona-Ausbruchs . Wie Chinas Wirtschaft in nur einem Jahr zurück auf Erfolgskurs kam ,Carla Neuhaus,"07.12.2020, 23:40 Uhr",https://www.tagesspiegel.de/politik/jahrestag-des-ersten-corona-ausbruchs-wie-chinas-wirtschaft-in-nur-einem-jahr-zurueck-auf-erfolgskurs-kam-/26695736.html,"Am 8. Dezember 2019 registrierten die Behörden in der chinesischen   einer mysteriösen Lungenkrankheit. Lokale Beamte behielten diese Erkenntnis zunächst für sich, der Arzt Li Wanliang, der vor der neuen Krankheit warnte und später daran verstarb, wurde sogar von der örtlichen Polizei wegen „Verbreitung von Gerüchten“ gemaßregelt. Was wiederum seine Kollegen verunsicherte, wie die „Financial Times“ schreibt: „In den ersten zwei Januar-Wochen wuchs unter den Ärzten im Wuhan- Zentralkrankenhaus die Verwirrung darüber, welche Informationen sie überhaupt noch an die Behörden weitergeben sollten.“ Ende Januar aber war die Krankheit nicht mehr zu leugnen. China ergriff deshalb drastische Maßnahmen, um die Pandemie einzudämmen.  Ein Jahr später hat das Land das Virus in den Griff bekommen – während weltweit viele Nationen weiter dagegen kämpfen – und viele Tote zu beklagen haben. China meldete zuletzt nur vereinzelte Corona-Fälle. Ansonsten scheint das Virus unter Kontrolle. Und das in dem Land mit der weltweit größten Bevölkerung und den weltweit längsten territorialen Außengrenzen. Wenn neue Fälle auftreten, wie zuletzt in Tianjin, Qingdao oder Kashgar, dann ist das   worden: Von zurückreisenden Chinesen oder Ausländern, die nach China eingereist sind, so berichten es die staatlich kontrollierten chinesischen Behörden. Beim Ausbruch in Tianjin machten die Behörden eine aus Deutschland importierte Schweinshaxe verantwortlich. Tests hätten Virus-Spuren an der Verpackung der gefrorenen Haxe entdeckt, heißt es. Diese sei zunächst aus Bremen nach Tianjin importiert und von dort weiter nach Dezhou gesendet worden. Das deutsche Bundeslandwirtschaftsministerium hält diese Erklärung für „unwahrscheinlich“. Acht Menschen hatten sich in Tianjin infiziert. Die Behörden ordneten daraufhin einen Massentest für eine Million Menschen an. Das Beispiel Tianjin zeigt: Sobald irgendwo ein Corona-Fall auftritt, reagieren die Behörden mit einer Massentestpflicht. Als im Oktober in der ostchinesischen Stadt Qingdao sechs Neuinfektionen bekannt wurden, mussten sich knapp zehn Millionen Menschen testen lassen. Dabei kamen nach Behördenangaben 13 weitere positive Tests zum Vorschein. Auch wenn den staatlichen Angaben nicht immer Glauben geschenkt werden kann, wäre ein erneuter massenhafter Covid-19-Ausbruch in China auf jeden Fall bekannt geworden. Die Regierung hatte nach den ersten Vertuschungsversuchen im Frühjahr rigorose Maßnahmen ergriffen. So wurde die Stadt Wuhan vom 23. Januar bis zum 7. April von der Außenwelt abgeriegelt und mit einer Ausgangssperre belegt. Menschen, die aus Wuhan oder der angrenzenden Provinz Hubei kamen, wurden für 14 Tage in ihren Hotels und Aufenthaltsorten festgesetzt. Ebenso Menschen mit positiven Corona-Tests. Diese Quarantänemaßnahmen sowie Masken und Temperaturkontrollen stoppten die Verbreitung, die Corona-App- Pflicht ermöglichte eine genaue Kontaktverfolgung. Zudem gelten seit Monaten strikte Einreisebeschränkungen. Wer noch ins Land darf, findet sich in einer streng kontrollierten 14-tägigen Quarantäne wieder. Kurioserweise hatte China in der Anfangsphase der Pandemie ähnliche Einreiseverbote im Ausland für Chinesen, zum Beispiel in Israel, als „rassistisch“ gebrandmarkt. Chinas Wirtschaft hat derzeit ein Problem. Es ist ein Luxusproblem: Die Volksrepublik hat schlicht  , die Amerikaner wie Europäer derzeit bestellen. Gerade das Exportgeschäft läuft so gut, dass Chinas Hersteller von Containern Berichten zufolge Sonderschichten fahren. 300 000 stählerne Transportboxen fertigen sie seit September jeden Monat. Und selbst das reicht nicht. Händler in Europa machen sich bereits Sorgen, dass die bestellten Computer, Fahrräder und Spielzeuge nicht rechtzeitig vor Weihnachten ankommen. Um mehr als 20 Prozent sind Chinas Exporte im November im Vergleich zum Vorjahresmonat gestiegen: eine Zahl, die sämtliche Vorhersagen übertrifft. „Der Exportboom ist eine der größten wirtschaftlichen Überraschungen in diesem Jahr, was die Aussichten für China angeht“, sagte Zhou Hao von der Commerzbank der Finanzagentur Bloomberg. Aber auch im Inland laufen die Geschäfte in China wieder auf Hochtouren. Die größten Onlinehändler des Landes, Alibaba und JD.com, haben allein am sogenannten Singles Day Waren im Wert von umgerechnet 96 Milliarden Euro verkauft – so viel wie nie. Chinas Wirtschaft profitiert dabei enorm davon, dass es keinen zweiten Lockdown gab. Die Volksrepublik wird deshalb in diesem Jahr wohl eines von wenigen Ländern weltweit sein, in denen die Wirtschaft wächst. Während Deutschland einen Einbruch um rund fünf Prozent verkraften muss, geht es in China um knapp zwei Prozent aufwärts. Die Folge: Die Welt wird zumindest kurzfristig noch abhängiger von der Volksrepublik. „China wird im nächsten Jahr sicherlich sehr viel mehr zum Wachstum der Weltwirtschaft beitragen als bislang“, sagte erst kürzlich OECD-Chefvolkswirtin Laurence Boone im Tagesspiegel-Interview. Damit könnte die Volksrepublik auch die USA schneller als erwartet als größte Wirtschaftsmacht der Welt ablösen. Aber auch für Deutschland hat Chinas schnelle Erholung Folgen. So sind die hiesigen Autobauer zum Beispiel mehr denn je von der Volksrepublik abhängig. Während in Europa und den USA die Neuwagenverkäufe einbrechen, leisten sich viele Chinesen wieder ein neues Auto. Schon vor Corona war die Volksrepublik für deutsche Konzerne ein wichtiger Absatzmarkt, Corona verstärkt das aber noch weiter. Daimler zum Beispiel verkauft aktuell 36 Prozent seiner Limousinen und SUVs in China. Noch profitiert Deutschland davon, weil wichtige Teile wie Getriebe und Motoren hierzulande gefertigt und dann in die Volksrepublik verschifft werden. Doch mit dem Trend zur Elektromobilität könnte sich das ändern: Etwa wenn Batteriezellen künftig in China produziert werden. Noch dazu hat China mit seinen Nachbarstaaten gerade erst ein   geschlossen: Dadurch fallen die Zölle in der Region Asien/Pazifik und die Volksrepublik kann ihre Waren in den   noch günstiger verkaufen. Die chinesische Propaganda feiert die eigene Regierung ausführlich dafür, die Pandemie erfolgreich bekämpft zu haben. Sie wertet das als Beweis für die Überlegenheit des chinesischen politischen Systems. Nur im „Sozialismus chinesischer Prägung“ sei es möglich, so geht das Narrativ, ein derart gefährliches Virus effektiv zu bekämpfen. Freiheitsliebende individualistische Demokratien hingegen könnten eine ähnliche Kraftanstrengung nicht aufbringen. Diese Sicht teilen nicht nur sehr viele Chinesen, auch im westlichen Ausland wird diese Darstellung gerne übernommen. Mitunter um von eigenen Versäumnissen abzulenken oder um zu entschuldigen, dass man das Virus nicht mit den gleichen Methoden bekämpfen könne. Dabei wird vergessen, dass es in Asien eine lebendige Demokratie wie Taiwan gibt, die derart frühzeitig und effektiv auf das Virus in Festlandchina reagiert hat, dass bislang nur sieben Corona-Tote zu beklagen waren. Weitere Demokratien wie Japan und Südkorea sind ebenfalls sehr erfolgreich gegen das Virus vorgegangen. Gerne wird in Europa entschuldigend eingewendet, dass dies doch alles Inseln oder Halbinseln seien. Doch auch Vietnam und Thailand sind trotz langer Territorialgrenzen nicht minder erfolgreich im Anti-Virus-Kampf. Und schließlich wird hierzulande auch auf die konfuzianische Traditionen in Ostasien mit einer größeren Autoritätsgläubigkeit verwiesen. Doch auch angelsächsisch geprägte Demokratien wie Australien und Neuseeland haben mit strengen Maßnahmen das Coronavirus erfolgreich bekämpft – und feiern schon wieder Konzerte und Partys. Möglicherweise liegt ein Grund für die bessere Reaktion auch in   mit dem Sars-Virus und der Vogelgrippe. Sie war auch besser vorbereitet. Klar ist aber, dass die Erfolge in Ostasien und Ozeanien nicht nur wirtschaftliche, sondern auch geopolitischeFolgen haben werden. Bundeskanzlerin Angela Merkel sagte in der vergangenen Woche: „Das wird noch mal eine Neuordnung der Regionen sein.“ Stadt Wuhan die ersten Fälle Virus aus dem Ausland importiert nicht genug Container, um all die Waren zu verschiffen gigantisches Freihandelsabkommen beteiligten 14 Ländern der Erfahrung dieser Region",tagesspiegel
Rendezvous in 380.000 Kilometer Entfernung . China gelingt nach Mondlandung Docking-Manöver mit Rückkehrkapsel,no_author,"06.12.2020, 10:09 Uhr",https://www.tagesspiegel.de/wissen/rendezvous-in-380-000-kilometer-entfernung-china-gelingt-nach-mondlandung-docking-manoever-mit-rueckkehrkapsel/26691100.html,"Nach seiner unbemannten Mondlandung ist China das erste robotergesteuerte Andock-Manöver eines Raumschiffes in der Umlaufbahn um den Erdtrabanten gelungen. Die Aufstiegsstufe des nach der chinesischen Mondgöttin   koppelte am Sonntagmorgen erfolgreich an den Orbiter an, wie die amtliche Nachrichtenagentur Xinhua berichtete.  Rund zwei Kilogramm Mondgestein, die zur Erde zurückgebracht werden sollen, seien anschließend sicher in der Rückkehrkapsel verstaut worden. Das Manöver galt als einer der schwierigsten Schritte auf dem Flug zurück zur Erde. Zwar hat China mit seinen Raumschiffen bereits mehrere Rendezvous in der Erdumlaufbahn vorgenommen, aber nie zuvor in 380 000 Kilometer Entfernung. Nach den bemannten Mondlandungen der USA in den 60er und 70er Jahren ist es auch das erste Mal, dass im Mond-Orbit ein Docking-Manöver auch ohne Astronauten gelungen ist. gilt als weiterer wichtiger Schritt in Chinas ambitioniertem Weltraumprogramm. Die junge Raumfahrtnation will Erfahrungen sammeln, mit denen in Zukunft auch eine bemannte Landung auf dem Mond gelingen kann. Es ist das erste Mal seit 44 Jahren, dass wieder Gesteinsproben auf dem Mond gesammelt wurden und zur Untersuchung auf die Erde gebracht werden sollen. Bei einer erfolgreichen Rückkehr wäre China nach den USA und der Sowjetunion erst die dritte Nation, der ein solches Vorhaben gelungen ist. Forscher warten mit Spannung auf die Mondproben, die jünger sind als alles andere Gestein, das die USA und die Sowjetunion eingesammelt hatten. Die Untersuchungen könnten neue Erkenntnisse über die vulkanische Aktivität des Mondes liefern. Die Apollo-Missionen der USA hatten rund 380 Kilogramm Mondgestein mitgebracht. Die Sowjetunion sammelte mit unbemannten Missionen etwa 300 Gramm ein. In dem nächsten Schritt des chinesischen Mondfluges wird sich die Rückkehrkapsel von der Aufstiegsstufe trennen und auf den richtigen Zeitpunkt für die Rückkehr zur Erde warten, wie Xinhua berichtete. Die Landung wird Mitte Dezember in der Inneren Mongolei erwartet. Die Mondmission Chinas erfolgt 51 Jahre nach der ersten bemannten Mondlandung der USA am 21. Juli 1969, bei der Neil Armstrong und Edwin „Buzz“ Aldrin als erste Menschen die Oberfläche des Erdtrabanten betraten. Die USA haben sechs Mal Astronauten auf den Mond gebracht. Mit „Apollo 17“ im Dezember 1972 stellten die USA ihre bemannten Mondlandungen ein. „Chang'e 5“ war am 23. November deutscher Zeit vom Raumfahrtbahnhof in Wenchang auf der südchinesischen Insel Hainan gestartet. Am 1. Dezember setzte der Lander in einem nach dem deutschen Astronomen Karl Rümker(1788-1862) genannten Vulkangebiet auf. Es liegt im „Ozean der Stürme“ im oberen, linken Teil der erdzugewandten Seite des Mondes. (dpa) benannten Raumschiffes „Chang'e 5“ Die Mond-Mission ",tagesspiegel
