title,author,date_published,url,article_text,source
Chinas Raumfahrtmission . Chang'e-5 mit Mondgestein auf dem Weg zur Erde – fast,Ralf Nestler,"03.12.2020, 22:55 Uhr",https://www.tagesspiegel.de/wissen/chinas-raumfahrtmission-change-5-mit-mondgestein-auf-dem-weg-zur-erde-fast/26685024.html,"Der chinesischen Raumfahrt ist am Donnerstagabend ein   gelungen. Nachdem am   ein Landemodul der Chang'e-5-Sonde auf dem Mond landen und am Mittwoch Gesteinsproben sammeln konnte, ist es nun offenbar erfolgreich von der Oberfläche abgehoben. Das   die chinesische Raumfahrtagentur CNSA.  Damit sind zum ersten Mal seit 1976 Gesteinsproben vom Mond genommen worden. Das Modul hat nach wenigen Minuten Aufstieg seinen Orbit um den Erdtrabanten erreicht und soll dort am Samstag mit der Chang'e-5-Sonde koppeln, um samt Ladung zurück zur Erde zu kommen. Ein besonders schwieriges Manöver.  Was alles schiefgehen kann? Diese Frage begleitet jede Raumfahrtmission. Zu Recht, denn bei Operationen im All ist die Ingenieurskunst besonders gefragt und die Liste gescheiterter Vorhaben lang.  Dies gilt auch für den Mond, wo zuletzt im April 2019 die erste israelische Sonde „Beresheet“ schon beim Landeversuch hart aufschlug. China hingegen hat mehrfach gezeigt, was seine Fachleute können: weiche Landungen, darunter die erste auf der erdabgewandten Seite überhaupt, und auf dem Planeten herumfahrende Rover konnten ebenfalls abgesetzt werden.   Nun ist die chinesische Raumfahrtagentur CNSA im Begriff, einen weiteren Erfolg zu erzielen. Die fünfte „Chang’e“-Mission, benannt nach der chinesischen Mondgöttin, soll erstmals Gesteinsproben vom Erdtrabanten nehmen und zur Erde zurückbringen.  Am Dienstagnachmittag um 16:11 Uhr deutscher Zeit ist die Landung geglückt, die Sonde faltete ihre Solarzellen aus. Anschließend drang ein Bohrer in den Untergrund – geplant waren zwei Meter – und barg Material; weitere Proben wurden von der Oberfläche der Umgebung genommen. Zudem wurde eine Panoramaaufnahme in Farbe erstellt und der Boden mit einem Radar untersucht, um mehr über die Landestelle zu erfahren.  Wenn die Rückkehr zur Erde gelingt, wäre der Triumph perfekt. Rund zwei Kilogramm Gestein sollen es werden. Die bisher letzte Mondprobe hatte die russische Mission „Luna 24“ im Jahr 1976 herbeigeschafft, 170 Gramm. Es war ebenfalls das Werk eines Roboters. Die Nasa hatte auf astronautische Probenehmer gesetzt, die knapp 400 Kilo Mondgestein aufgeklaubt hatten.  Die Steine, die Chang’e 5 einsammelt, sollen zeigen, was China technologisch draufhat. Und doch sind sie mehr als nur ein Souvenir. Die Landestelle befindet sich nahe dem Vulkanmassiv „Mons Rümker“, benannt nach dem deutschen Astronom Carl Rümker, welches wiederum im „Oceanus Procellarum“ liegt, dem „Mondmeer“, das von der Erde aus gesehen oben links auf dem Mond ist.  „Das ist eine sehr interessante Gegend“, sagt Ulrich Köhler, Planetengeologe am Deutschen Zentrum für Luft- und Raumfahrt in Berlin. Anhand der Dichte von Kratern werde die Region auf ein Alter von rund zwei Milliarden Jahren geschätzt. „Von dort eine Probe zu haben, wäre klasse, denn das jüngste Gestein aus der ,Apollo‘-Ära ist mit 3,1 Milliarden Jahren deutlich älter.“ Die Chang’e- Proben ermöglichen einen Blick in eine jüngere Mondepoche.  Auf den ersten Blick werden sie aussehen wie Basalte, die man hier beispielsweise in der Eifel oder auf dem Ozeanboden findet. Mit genauen Laboranalysen können Wissenschaftler herausfinden, aus welcher Art von Magma sie bestehen und wie viel Wasser der Mond früher einmal hatte. Dies sei ein großer Streitpunkt seiner Zunft, sagt der Planetenforscher. „Es geht um die Frage, woher die Erde und alle weiteren Gesteinsplaneten ihr Wasser haben, ob es später mit Kometen herkam, mit Asteroiden oder vielleicht doch aus der Entstehungszeit des Sonnensystems stammt und in den Himmelskörpern erhalten geblieben ist.“  Die chinesischen Mondproben dürften wichtige Argumente im Forscherstreit liefern. Dies erklärt auch, warum der Roboter zwei Meter tief bohren soll. An der Oberfläche unterliegt das Gestein der Verwitterung durch den Sonnenwind und wird geochemisch verändert, erst in der Tiefe ist ursprüngliches Material zu erwarten. All diese Eckpunkte der Mission zeigen, dass die Chinesen sehr genau überlegt haben, was sie tun und welche Erkenntnisse daraus hervorgehen könnten, sagt Köhler.  Der gelegentlich geäußerten Behauptung, die Chinesen überholten gerade die Amerikaner, widerspricht er allerdings. Die Nasa arbeitet an der Rückkehr von Astronauten. Ob der Zieltermin – oder sollte man besser sagen Wunschtermin von Präsident Trump – 2024 zu schaffen ist, wird vielfach bezweifelt. Dennoch ist eine astronautische Mission etwas anderes als eine robotische, zumal die Nasa ein komplexes Missionsprofil für längere Aufenthalte vorsieht.  „Und sie hat mehrfach gezeigt, dass sie Probenahme im Weltraum kann, man denke nur an die Mission ,Osiris-Rex‘.“ Im Oktober hatte die Sonde während eines Manövers Brocken des Asteroiden „Bennu“ aufgewirbelt und eingesammelt, die 2023 hier eintreffen sollen. „China hat aufgeholt, das kann man sicher sagen, auch eine bemannte Landung auf dem Mond in der Zukunft erscheint realistisch.“  Anders verhalte es sich mit Russland. „Die hat China überholt“, sagt Köhler. „Bei Missionen zu anderen Himmelskörpern ist Russland seit Jahren nichts Großes mehr gelungen.“ Die Probenahme vom Marsmond „Phobos“ scheiterte 2011, weil die Sonde nicht einmal die Bahn für den Hinflug erreicht hatte.  Ob China mehr Glück hat, wird sich zeigen. Das Aufsammeln und Verstauen der Bodenproben ist offenbar gelungen, der Aufstieg in den Mondorbit auch, wo sie am Samstag an den wartenden Orbiter koppeln soll, um gemeinsam zur Erde zu fliegen - nach Plan am 16. Dezember. Kunststück Dienstag meldet",tagesspiegel
USA und China bei Rüstungshandel vorn . Weltweit werden immer mehr Waffen verkauft,no_author,"07.12.2020, 08:41 Uhr",https://www.tagesspiegel.de/politik/usa-und-china-bei-ruestungshandel-vorn-weltweit-werden-immer-mehr-waffen-verkauft/26692840.html,"Die weltweiten Ausgaben für Waffen und Rüstungsgüter sind im vergangenen Jahr weiter gestiegen. Das internationale Friedensforschungsinstitut Sipri bezifferte den Gesamtumsatz der 25 größten internationalen Rüstungsunternehmen 2019 auf insgesamt 361 Milliarden US-Dollar, also knapp 300 Milliarden Euro. Das sind 8,5 Prozent mehr als im Vorjahr.  Der Bericht wurde am Montag in Stockholm veröffentlicht. Der wichtigste Händler sind mit weitem Abstand die Vereinigten Staaten. Die zwölf US-Unternehmen, die in der Rangliste erfasst sind, stehen für 61 Prozent der Verkäufe weltweit. Allein die fünf größten Rüstungsproduzenten Lockheed Martin, Boeing, Northrop Grumman, Raytheon und General Dynamics   (136 Mrd Euro). Auf   mit 16 Prozent. Die vier von Sipri gelisteten chinesischen Unternehmen steigerten ihren Umsatz binnen eines Jahres um 4,8 Prozent. Sipri-Forscher Nan Tian erklärte dies so: „Chinesische Waffenunternehmen profitieren von militärischen Modernisierungsprogrammen für die Volksbefreiungsarmee.“  Verkauft werde überwiegend im eigenen Land. Auf Platz drei in der globalen Rangliste findet sich Russland mit einem Anteil von 3,9 Prozent. Die Ausfuhr ins Ausland ist für russische Rüstungsproduzenten durch die Sanktionen infolge des Ukraine-Konflikts und der Besetzung der Krim-Halbinsel beschränkt.  Die Einnahmen der beiden gelisteten Unternehmen gingen um insgesamt 634 Millionen US-Dollar (522 Mio Euro) zurück. Ein dritter russischer Produzent fiel aus den Top 25 heraus. „Russland ist ein sehr starker Player und  “, sagte Lucie Béraud-Sudreau, Leiterin des Sipri-Forschungsprogramms zu Waffenhandel und Militärausgaben.  Aufgrund der Wirtschaftslage habe sich die Modernisierung des Militärs jedoch verlangsamt. „Das bedeutet natürlich einen Umsatzrückgang für die russische Rüstungsindustrie, weil ihr Hauptauftraggeber, die russische Regierung, weniger ordert.“ Die Umweltschutzorganisation Greenpeace kritisierte den Anstieg der Rüstungsausgaben und  “.  „Selten wird eine  : Weltweit sind Hunderte Millionen Existenzen durch die Corona-Pandemie bedroht, Abermillionen sind infiziert und Unzählige haben keine ausreichende medizinische Versorgung“, sagte Greenpeace-Abrüstungsexperte Alexander Lurz der Deutschen Presse-Agentur.  Die Sipri-Zahlen zeigten, „wohin das knappe Geld nicht fließen sollte: immer weiter in die Taschen der internationalen Waffenindustrie.“ Die sechs größten westeuropäischen Unternehmen machten zusammen 18 Prozent aus. Deutsche Firmen rangieren nicht unter den Top 25. Das größte deutsche Rüstungsunternehmen Rheinmetall steigerte seinen Umsatz um 4 Prozent auf 3,9 Milliarden US-Dollar (3,2 Mrd Euro).    Der Anstieg der Rüstungsausgaben sei auch ein Spiegel der Spannungen in der internationalen Politik, sagte Béraud-Sudreau. Diese Entwicklung sei bereits seit der Besetzung der Krim-Halbinsel durch Russland 2014 zu beobachten. Nach dem Einzug des inzwischen abgewählten US-Präsidenten Donald Trump ins Weiße Haus 2016 habe sie sich verstärkt. (dpa) verzeichneten einen Umsatz von 166 Milliarden US-Dollar Platz zwei im weltweiten Waffenhandel folgt China hat eine starke Rüstungsindustrie forderte ein „radikales Umdenken Fehlentwicklung so deutlich vor Augen geführt",tagesspiegel
Wo bleibt die neue Strategie der Allianz? . Das größte Nato-Risiko kommt von innen – durch die Türkei,Christoph von Marschall,"03.12.2020, 08:05 Uhr",https://www.tagesspiegel.de/politik/wo-bleibt-die-neue-strategie-der-allianz-das-groesste-nato-risiko-kommt-von-innen-durch-die-tuerkei/26680542.html,"Die Nato ist kein mit Elektronik vollgestopftes Auto, das den Fahrer mahnt, wenn der Werkstattbesuch ansteht. Es bedarf eines politischen Anstoßes. Den haben Donald Trump und Emmanuel Macron gegeben. Die Allianz sei „obsolet“ befand der US-Präsident. Sein französischer Kollege  Ein Expertenteam hat nun, um im Bild zu bleiben, die Verschleißteile in Fahrwerk, Motor und Getriebe sowie den Bordcomputer und das Navi als Steuerungssysteme überprüft.   wurde nun beim Außenministertreffen präsentiert: Ein Ölwechsel reicht nicht, eine große Inspektion ist fällig.  . Das strategische Konzept stammt von 2010 und wirkt wie ein Navi mit veralteten Karten. Russland war damals ein Partner, nicht eine Militärmacht, die seit 2014 Krieg in der Ukraine führt, nahe der Ostgrenze der Nato.  China tauchte im Frühwarnsystem noch nicht auf. Es galt als militärischer Zwerg, weit entfernt von Nato-Gebiet; heute ist es eine Supermacht mit dem gleichen ökonomischen Output wie die USA und die EU; seine Machtansprüche reichen über Asien hinaus. Auch Klimawandel und Cyberwaffen kamen 2010 als Sicherheitsrisiken nicht vor; Corona ebenso wenig, obwohl eine Pandemie eine Armee lahmlegen kann. So bedeutsam der Blick auf die potenziellen Gefahren von außen ist samt der Aufforderung, die Steuerungssysteme der Nato an die Weltlage anzupassen: Noch wichtiger für ihre Zukunft sind die Risiken von innen. Oft werden Entscheidungen blockiert, weil Einzelne das Einstimmigkeitsprinzip als Druckmittel missbrauchen, um eigene Ziele durchzusetzen. Generell wächst die Zahl der Mitglieder, die wie selbstverständlich davon ausgehen, dass sie die Vorteile der Allianz haben können, selbst wenn sie egoistische Ziele verfolgen, die gegen das Gemeinschaftsinteresse gerichtet sind. Das größte Problem in dieser Hinsicht ist   In Syrien hat sie Krieg gegen Kurden geführt, obwohl die dort Verbündete der Nato waren. Sie macht Waffengeschäfte mit Russland ungeachtet der Folge, dass dadurch sensible Daten zu Ausrüstung und Kommunikation in die Hände eines potenziellen Gegners fallen. Die Experten werfen auch Deutschland vor, es trage zu den Spaltungen bei.  , zwei Prozent des BIP für Verteidigung auszugeben. Die Erfüllung sei „eine zentrale Grundlage für den politischen Zusammenhalt“. Übersetzt in Autosprache: Deutschland ist durch den TÜV gefallen und muss nachbessern, um die Plakette für die Welt von morgen zu erhalten. diagnostizierte ihren „Hirntod“.  Das Ergebnis Die Nato bedarf einer Rundum-Erneuerung seit Jahren die Türkei. Es bricht die Zusage",tagesspiegel
Coronavirus in Deutschland und der Welt . Blog-Archiv vom 12. Oktober bis 14. Dezember,no_author,"14.12.2020, 13:13 Uhr",https://www.tagesspiegel.de/wissen/coronavirus-in-deutschland-und-der-welt-blog-archiv-vom-12-oktober-bis-14-dezember/26716706.html,Dies ist ein archivierter Blog. Die aktuellen Entwicklungen zur Coronavirus-Pandemie finden Sie  in diesem Newsblog.,tagesspiegel
Schwierigster Teil der Mission steht noch bevor . Chinesisches Modul landet erfolgreich auf dem Mond,no_author,"01.12.2020, 18:39 Uhr",https://www.tagesspiegel.de/wissen/schwierigster-teil-der-mission-steht-noch-bevor-chinesisches-modul-landet-erfolgreich-auf-dem-mond/26677342.html,"China hat erstmals eine Sonde zum Sammeln von Gesteinsproben auf dem Mond landen lassen. Das gilt als weiterer wichtiger Schritt in dem ambitionierten Weltraumprogramm des Landes. Ein Lander der nach der chinesischen Mondgöttin ""Chang'e 5"" benannten   setzte am Dienstag ""erfolgreich"" auf der Oberfläche auf, wie Chinas staatliche Nachrichtenagentur Xinhua und der Staatssender CCTV übereinstimmend berichteten.  Ziel der chinesischen Mission ist es, weltweit erstmals seit 44 Jahren wieder   zur Erde zurückzubringen. Bei einer erfolgreichen Rückkehr zur Erde wäre China nach den USA und der Sowjetunion in den 60er und 70er Jahren erst die dritte Nation, der ein solches Vorhaben gelungen ist. ""Chang'e 5"" war am 23. November (deutscher Zeit) vom Raumfahrtbahnhof in Wenchang auf der südchinesischen Insel Hainan gestartet. Eine größere Herausforderung als die Ankunft auf dem Mond, wo chinesische Sonden schon zweimal zuvor gelandet waren, ist für die Forscher der weitere Verlauf der Mission. Die ""Chang'e 5"" ist mit 8200 Kilogramm das bisher größte Raumschiff der ""Chang'e""-Flotte und besteht aus vier Modulen: dem Orbiter mit der Rückkehrkapsel sowie dem Lander mit der Aufstiegsstufe.  Nach dem Aufsetzen auf der Mondoberfläche soll nun das Landegerät mit einem langen Arm Mondgestein und Proben aus Bohrungen in   zusammentragen und in einer Kammer verstauen. Diese Aktion soll zwei Tage dauern. Danach steht die Rückreise an. Geplant ist, rund zwei Kilogramm Material auf die Erde zurückzubringen. Forscher erhoffen sich von den Proben neuen Aufschluss über die vulkanische Aktivität des Mondes. Die Apollo-Missionen der USA hatten rund 380 Kilogramm Mondgestein mitgebracht. Die Sowjetunion sammelte mit unbemannten Missionen etwa 300 Gramm ein. In der derzeit laufenden Mondreise der Chinesen sehen Raumfahrtexperten nicht nur eine geologische Mission, sondern einen wichtigen Technologietest, etwa für künftige bemannte Flüge zum Mond. China verfolgt ein e . Geplant ist so mittelfristig nicht nur, wieder Menschen zum Mond zu schicken. Derzeit ist auch eine chinesische Sonde zum Mars unterwegs. Zudem soll kommendes Jahr der Bau einer Raumstation beginnen. ""Chang'e 5"" ist die zweite Mond-Mission der Chinesen innerhalb von zwei Jahren. Im Januar 2019 landete China als erste Raumfahrtnation mit ""Chang'e 4"" auf der relativ unerforschten erdabgewandten Seite des Mondes. Es wurde ein Rover ausgesetzt, der weiter die Oberfläche erforscht. Mit ""Chang'e 3"" hatten die Chinesen 2013 eine Sonde auf der Vorderseite des Erdtrabanten gelandet - weit später als Russen und Amerikaner. Die USA hatten nach unbemannten Sonden zwischen 1969 und 1972 auch zwölf Astronauten auf den Mond gebracht.  Raumsonde Gesteinsproben bis zu zwei Meter Tiefe hrgeiziges Raumfahrtprogramm",tagesspiegel
Proteste gegen wachsenden Einfluss Chinas . Hongkonger Aktivist Joshua Wong und Mitstreiter zu Haft verurteilt,no_author,"02.12.2020, 09:07 Uhr",https://www.tagesspiegel.de/politik/proteste-gegen-wachsenden-einfluss-chinas-hongkonger-aktivist-joshua-wong-und-mitstreiter-zu-haft-verurteilt/26678350.html,"Der prominente Hongkonger Aktivist   sind für das Organisieren eines Protests zu Gefängnisstrafen verurteilt worden. Ein Hongkonger Gericht verurteilte Wong am Mittwoch zu einer Haftstrafe von 13,5 Monaten. Die ebenfalls bekannten Aktivisten Agnes Chow und Ivan Lam müssen für zehn beziehungsweise sieben Monate ins Gefängnis.  Die drei Demokratieaktivisten hatten zuvor gestanden, im Juni des Vorjahres, als es in Hongkong beinahe tägliche Proteste gegen die Regierung gab, an der Organisation einer nicht genehmigten Versammlung vor dem Hongkonger Polizeipräsidium mitgewirkt zu haben. Für Wong ist es die dritte Gefängnisstrafe, seit er sich in Hongkong   engagiert. Der 24-Jährige hatte bereits als Teenager Proteste organisiert. Nach den 2014 ausgebrochenen „Regenschirm-Protesten“ für mehr Demokratie musste er zweimal mehrere Monate in Haft verbringen.  Joshua Wong und zwei seiner Mitstreiter für die Demokratiebewegung",tagesspiegel
