title,author,date_published,url,article_text,source
„Wir haben solche Angst“ . Warum die Hongkong-Revolution in Göttingen weitergeht,Katja Demirci,"15.07.2020, 07:28 Uhr",https://www.tagesspiegel.de/themen/reportage/wir-haben-solche-angst-warum-die-hongkong-revolution-in-goettingen-weitergeht/26004054.html,"Er wirkt angespannt, müde, nervös. Er spricht leise und manchmal nimmt er dabei sogar noch die Hand vor den Mund, beugt sich vorsichtig in Richtung seines Laptops, zum Bildschirm und Mikrofon. Eine Nachricht geht auf seinem Handy ein, er liest vor: Ein paar hundert Meter von seinem Haus entfernt sammele sich die Polizei. Das hat nichts mit ihm zu tun, bestimmt nicht. Aber angenehm ist die Vorstellung trotzdem nicht.  Das ist Hongkong, an einem Sonntag Mitte Juli 2020, spät am Abend.  In Hongkong ist plötzlich gefährlich geworden, was zuvor weitgehend in Ordnung war. Seine Meinung sagen zum Beispiel. Demonstrieren. Mit Journalisten, noch dazu ausländischen, in einem Video-Anruf über den Wunsch nach Unabhängigkeit sprechen.  Der junge Mann auf dem Bildschirm verzieht seinen Mund zu einem traurigen Lächeln. Er ist in seinen Zwanzigern, ein schmaler Kerl, der die Wochenenden des vergangenen Jahres für Demokratie in Hongkong demonstriert hat wie so viele Millionen Bewohner seiner Heimatstadt.  Erst richteten sich ihre Proteste gegen eine Gesetzesänderung, die es erlauben sollte, Straftäter und Verdächtige unproblematisch nach China auszuliefern. Schnell kam es am Rande der regelmäßigen Versammlungen zu brutalen Straßenschlachten zwischen jungen Demonstranten und der Polizei. Als die Hongkonger Regierungschefin Carrie Lam das Gesetz schließlich zurückzog, wähnten sich die Demonstranten erfolgreich. Ihre Forderung nach Demokratie vermischte sich bald mit einem grundsätzlichen Protest gegen die Regierung in China.  Nun, ein Jahr später, hat die Kommunistische Partei Chinas den Hongkongern eine neue Verordnung übergestülpt: das Nationale Sicherheitsgesetz.  Dahinter steht wohl der Wunsch, die Stabilität im Land zu wahren. Für die demokratiebewegten Hongkonger kommt es einer Unterdrückung gleich: Wem Terrorismus vorgeworfen wird, der muss ins Gefängnis. Was jedoch alles Terrorismus ist, bleibt vage. Schon Vandalismus kann dazugehören. Wer öffentlich die Demokratiebewegung unterstützt, kann verhaftet werden – ganz egal, ob er Hongkonger ist oder Tourist. Ein nationales Sicherheitsbüro wird als Ableger der chinesischen Staatsgewalt dafür sorgen, dass das Gesetz eingehalten wird. Die Mitarbeiter dürfen ohne Ankündigung Wohnungen durchsuchen, Menschen festhalten oder deren Kommunikation überwachen.  „Ich hoffe, dass sie das hier nicht finden und nachverfolgen können“, sagt der junge Mann im Video-Telefonat. Seinen echten Namen verschweigt er: „Nenn mich Brandon Chu.“  Brandon Chu war seit Anfang Juli bei keiner großen Demonstration mehr. Weil keine mehr stattfinden. „Die Menschen protestieren nicht mehr in den Straßen“, sagt er, „weil es das nicht mehr wert ist.“ Der Preis für Protest sei nun zu hoch. „Wir haben solche Angst“, sagt er.  Als das neue Gesetz am 30. Juni um 23 Uhr Hongkonger Zeit in Kraft tritt, kennt dessen Inhalt gerüchteweise nicht mal Regierungschefin Carrie Lam, so schnell ist es vom chinesischen Volkskongress installiert worden. Als am 1. Juli – dem 23. Jahrestag der Übergabe der ehemaligen britischen Kolonie Hongkong an China – traditionell Menschen in den Straßen demonstrieren, wird der Erste bereits festgenommen, weil er gegen das Gesetz verstoßen hat. Er hielt eine Flagge hoch, auf der er Unabhängigkeit für Hongkong forderte. Die Hongkonger Polizei twitterte stolz ein Beweisfoto.  Es ist ein Risiko, dass Brandon Chu nicht mehr eingeht. Er sehe, wie viele nun verurteilt werden, die während der Proteste festgenommen worden sind. Während die Polizei, so sagt er es, noch immer keine Rechenschaft über ihr brutales Vorgehen habe ablegen müssen.  „Man kann die Veränderung in den Straßen spüren“, sagt er. Die Menschen seien nicht mehr freundlich, wie üblich, stattdessen angespannt. Als liege über allen und allem wie ein Schleier die Bedrohlichkeit Chinas.  „Trotzdem“, sagt Brandon Chu, „wir beugen uns noch immer nicht.“  Als am vergangenen Wochenende Hunderttausende Hongkonger ihre Stimmen bei den Vorwahlen der Opposition gaben, wusste niemand, ob sie dadurch schon das Gesetz brechen. Peking empfand es laut Mitteilung als „schwere Provokation“. Die meisten Stimmen erhielten junge Kandidaten, unter ihnen auch der pro-demokratische Aktivist Joshua Wong. Am 6. September sollen in Hongkong Parlamentswahlen stattfinden.  Geschäfte und Restaurants, die noch vor Kurzem mit Plakaten an ihren Fassaden und in den Fenstern gezeigt haben, dass sie die Demokratiebewegung unterstützen, entfernten all diese „Beweise“ eilig in der Nacht zum 1. Juli, sagt Chu.  Es war die Idee der Demonstranten gewesen, als klar wurde, dass ihr Protest in den Straßen gegen eine übermächtige Polizeigewalt eher aussichtslos sein würde. Sie gründeten den „yellow economic circle“, den gelben Wirtschaftszirkel, der pro-demokratische Geschäfte unterstützt. Karten und Apps wurden entwickelt, die zeigen, welche Läden gelb waren und welche blau, also pro-Peking. In stillem Einverständnis, das berichteten Demonstranten noch im Winter, standen sie lieber in einer langen Schlange für den „richtigen“ Kaffee an, als schnell im falschen Geschäft bedient zu werden.  „Jeder weiß, auf welcher Seite du bist“, sagt Brandon Chu, der überzeugt ist, dass der gelbe Zirkel sich längst etabliert hat, dass auch jetzt noch klar ist, welcher Ladenbesitzer die Proteste unterstützt hat. Der Protest verlagerte sich damals ein erstes Mal – nun wird er es wieder tun müssen, unter erschwerten Bedingungen. Viele, die monatelang demonstriert haben, überlegen auszuwandern. Australien und Großbritannien erleichtern es Hongkongern bereits, ein Visum zu bekommen und sich einbürgern zu lassen. Wer einen BNO besitzt, einen British National Overseas Pass aus der Zeit, als Hongkong britische Kolonie war, lässt ihn nun erneuern. Beim Treffen der EU-Außenminister einigten sich jetzt auch Deutschland und Frankreich darauf, politisch verfolgten Hongkongern leichter einen dauerhaften Aufenthalt in der EU zu ermöglichen. Zuvor war bereits der chinesische Botschafter in Deutschland ins Auswärtige Amt bestellt worden, wo ihm mitgeteilt wurde, wie besorgt man um die Autonomie Hongkongs sei, nun, da das Sicherheitsgesetz in Kraft ist.  Es sei absurd, sagt Brandon Chu. „Noch vor Jahren lebten wir hier wie Menschen in jedem anderen freien Land.“ Er wird nicht gehen. Noch nicht.  In Göttingen sitzt ein paar Tage vorher unter dicken Kopfhörern ein junger Mann vor dem Computer, der sich anders entscheiden musste. Ray Wong ist einer der ersten zwei Hongkonger, die in Deutschland als politische Flüchtlinge anerkannt wurden und Asyl bekamen. Mittlerweile studiert der bald 27-Jährige Philosophie und Politik, bald stehen Klausuren an, eine Stunde Zeit für ein Videotelefonat über Skype hat er dennoch.  Dass Wong bereits im Herbst 2017 in Deutschland angekommen war, Asyl schließlich im Mai 2018 erhielt, wusste zunächst niemand. Bis auf die chinesische Regierung, die angeblich versucht habe, auf das Asylverfahren Einfluss zu nehmen. Erst als die Proteste gegen das Auslieferungsgesetz in Hongkong heftiger wurden, begann Wong sich öffentlich zu äußern. In Göttingen fühle er sich sicher, sagt er. Was er in Hongkong begonnen hat, führt er im Exil weiter.  „Viele meiner Freunde und Freunde von Freunden wollen nach Großbritannien auswandern. Das heißt nicht, dass sie aufgeben“, sagt Ray Wong. „Wir geben den Kampf nicht auf, wir schützen nur unsere Energie und Ressourcen, während wir unsere Kraft im Ausland noch verstärken und uns breiter aufstellen.“  Ray Wong ist ein guter Redner, es ist nicht schwer vorstellbar, wie er neben Edward Leung zum charismatischen Anführer der 2015 von ihm gegründeten politische Gruppe Hong Kong Indigenous wurde. Auch Brandon Chu in Hongkong spricht voller Respekt über Ray Wong, dessen Ruf nach Unabhängigkeit im vergangenen Jahr von mehr und mehr Demonstranten übernommen worden war.  „Ich glaube, dass Hongkong unabhängig werden soll, ist bereits Konsens in der gesamten Demokratiebewegung dort“, sagt Ray Wong. Bevor das Sicherheitsgesetz vor zwei Wochen in Kraft getreten sei, habe man die Menschen bei den Demonstrationen oft rufen hören: „Unabhängigkeit ist der einzige Ausweg!“ Ray Wong hat das auch lange geglaubt.  Als er begann, sich politisch zu engagieren, 2012, sollte in Hongkong ein neues Schul-Curriculum eingeführt werden. Für die Schüler sah es eine Art nationale Erziehung vor – gemeinsam mit den Eltern liefen sie dagegen Sturm, bis die Regierung einknickte. Vermeintlich, wie Ray Wong sagt. Tatsächlich aber hätten sie solcherlei patriotische und pro-chinesische Inhalte einfach in andere Fächer integriert. Für ihn war es ein erster warnender Hinweis auf den wachsenden Einfluss Chinas in Hongkong, dem laut Vertrag doch zumindest bis 2047 noch unter dem Motto „ein Land, zwei Systeme“ ein Sonderstatus zugestanden werden sollte.  Die Intention der Regierungen, von Hongkong sowohl als auch von China, sei klar. Es gehe darum, die Identität und die Werte der Hongkonger auszulöschen und in einem zweiten Schritt auch die nächste Generation einer Gehirnwäsche zu unterziehen. Immer wieder habe Peking in den Folgejahren versucht, Einfluss zu nehmen. Im Ausland vor allem wahrgenommen: die (gescheiterte) Wahlrechtsreform 2014, Auslöser für die Regenschirmproteste. Und jetzt.  „Wir verstanden: Okay, es gibt keine Hoffnung auf Demokratie, darauf, unseren Lebensstil zu behalten und unsere Freiheit“, sagt Ray Wong. „Also begannen wir, Unabhängigkeit zu fordern.“ Ihnen sei klar gewesen, wie naiv das ist, sagt er. Und erklärt, dass es um praktische Umsetzung erst gar nicht gegangen sei. „Unsere Idee war: Als Erstes müssen wir uns trauen, darüber nachzudenken!“  Freiheit, das sei für ihn die Möglichkeit, sich über viele Perspektiven zu informieren und eine zu wählen. Er studiere auch deswegen Philosophie, sagt er, weil ihn die großen Fragen interessieren: Was ist Gerechtigkeit? Und wie kann man darüber verhandeln?  Was Ray Wong nötigte, zu fliehen, ist als #fishballrevolution bekannt geworden, Fischfrikadellenrevolution. Während des Neujahrsfestes im Februar 2016 kämpften im Stadtteil Mongkok Demonstranten mit Polizisten. Letztere wollten die Händler vertreiben, die dort auf einem Nachtmarkt Essen anboten.  Tatsächlich ging es um mehr als das Essen. Denn Gruppen wie Hong Kong Indigenous sahen schon in der Vertreibung der Händler einen Angriff auf die Hongkonger Identität und Tradition.  Dass friedlicher Protest China nicht beeindruckt, schien ihnen da mittlerweile erwiesen. „Proaktiver Widerstand“ ist, was Ray Wong noch heute befürwortet. Keine rohe Gewalt, sagt er und erläutert, was er meint: Barrikaden auf großen Straßen etwa, die den Verkehr unterbrechen, weswegen Menschen nicht zur Arbeit kommen, weswegen Firmen weniger produktiv sind, weniger Umsatz machen … Das System destabilisieren. Die Videos der Auseinandersetzungen, die bei Youtube zu finden sind, zeigen Bilder wie aus dem vergangenen Jahr. Prügelnde Polizisten, Steine werfende Demonstranten, brennende Barrikaden. Ray Wong erzählt, wie Edward Leung von einem Gericht zu sechs Jahren Gefängnis verurteilt wurde, wie er – als vermeintlicher Anführer der Krawalle – eine längere Strafe zu erwarten gehabt hätte und sich noch vor seiner Gerichtsverhandlung zur Flucht entschied.  In einem Video der deutschen Unterstützergruppe „Wir für Hongkong“ hat Ray Wong vor einer Weile erzählt, wie es war, in Deutschland chinesische Studenten zu treffen. Manche hätten ihn im Deutschkurs erkannt, einige wenige unterstützen sogar die Demokratiebewegung in Hongkong. Den meisten Deutschen hingegen sei er fremd gewesen. Nur einmal habe ihn jemand in der Mensa angesprochen: Bist du Ray Wong? Hier versuche er nun, seine Rolle als politischer Flüchtling zu finden – und den Protest zu unterstützen. Seine Strategie habe sich geändert, sagt Ray Wong. Sein Fokus sei nicht mehr die Unabhängigkeit Hongkongs. Stattdessen versuche er, die Aufmerksamkeit auf die Menschenrechtssituation in seiner Heimat zu lenken. „Ich versuche mein Bestes, die Geschichte Hongkongs so vielen europäischen Politikern wie möglich zu erzählen.“ Bilder zeigen Ray Wong im Anzug im und vor dem Bundestag, im Herbstwind in Brüssel.  Und doch ist deren Haltung gegenüber China nicht immer so definitiv, wie er sich das wünscht. Weil am Ende wirtschaftliche Interessen schwerer wiegen als Menschenrechte.  „Ich bin frustriert, aber ich bin auch optimistisch, was die langfristige Entwicklung angeht“, sagt Wong. „Die Geschichte der Sowjetunion haben wir Hongkonger immer im Hinterkopf.“ Kein totalitäres Regime habe sich für immer halten können. „Wir haben Hoffnung“, sagt er, „solange die freie Welt uns zur Seite steht.“  Der Protest werde seinen Weg finden, glaubt auch Brandon Chu in Hongkong. Weil jegliche politische Äußerung nun gefährlich werden kann, hielten Demonstranten am 1. Juli weiße Schilder hoch. Es war ein lautes Schweigen.",tagesspiegel
Berlin besorgt über Ausländer-Passus . Hongkong-Gesetz könnte deutsche Unternehmer gefährden,Albert Funk,"08.07.2020, 14:44 Uhr",https://www.tagesspiegel.de/politik/berlin-besorgt-ueber-auslaender-passus-hongkong-gesetz-koennte-deutsche-unternehmer-gefaehrden/25986570.html,"Ein bisher in Deutschland kaum beachteter Artikel im scharf kritisierten chinesischen Sicherheitsgesetz für Hongkong setzt auch die Bundesregierung unter Druck. Das Gesetz stellt in seinem Artikel 38 fest, dass seine Vorgaben auch Anwendung finden, wenn Menschen, die nicht permanent in Hongkong leben, von außerhalb der Region dagegen verstoßen, also zum Beispiel wenn sie die Demokratiebewegung unterstützen. Das bedeute vor allem „eine Gefährdung für ausländische und damit auch für deutsche Wirtschaftstreibende in Hongkong“, sagte Margarete Bause, Sprecherin für Menschenrechte der Grünen-Bundestagsfraktion, dem Tagesspiegel.  „Der Artikel entfaltet in dieser Form eine universelle Wirkung"", sagte sie Vermutlich seien die Formulierungen bewusst vage gehalten, um internationale Unterstützer der Demokratiebewegung in Hongkong zu verunsichern und mundtot zu machen. „Ich halte es für nicht nachvollziehbar, dass die Bundesregierung immer noch an ihrer Leisetreterei gegenüber Peking festhält und nicht wenigstens hier massiv interveniert.“ Reisehinweise des Auswärtigen Amtes reichten nicht, wenn die Sicherheit von Bundesbürgern so massiv bedroht sei. In Großbritannien u , in Deutschland bisher kaum. Merkel hat soeben die EU-Ratspräsidentschaft übernommen, auch der Koalitionspartner SPD fordert von der  , - auch auf die Debatte um eine Beteiligung des Huawei-Konzerns am Aufbau des deutschen 5G-Netzes dürfte das Agieren Chinas Auswirkungen haben, Merkel wehrt sich gegen einen pauschalen Ausschluss.   Die Regierungschefin der bisher autonomen Sonderverwaltungszone, Carrie Lam, betont, ihre Regierung werde dieses Gesetz „rigoros umsetzen“. Sie warnte „Radikale“ vor „sehr ernsthaften Konsequenzen“, sollten sie gegen das Gesetz verstoßen. Die Drohung gilt weltweit, auch für Ausländer, die weder in China noch in Hongkong leben. Wer sich außerhalb des Landes für demokratische Rechte in Hongkong engagiert und das auch dokumentiert, etwa in sozialen Medien, muss mit Strafverfolgung rechnen, sobald er dort einreist. Aus Außenwirtschaftskreisen hieß es, noch seien keine Abzugspläne von deutschen Firmen in Hongkong bekannt. Doch werde sich das Gesetz mit Blick auf die Rechtssicherheit zweifellos auf die Attraktivität des Standorts auswirken. Die eigentlich bis 2047 garantierte Regel „ein Land, zwei Systeme“ in der früheren britischen Kronkolonie sei infrage gestellt. Es gibt international scharfe Proteste, zeigt aber auch Chinas Selbstbewusstsein.  Das Auswärtige Amt betonte mit Blick auf den Artikel 38 lediglich, dass man in seiner Aktualisierung der Reise- und Sicherheitshinweise auf die in Hongkong seit Inkrafttreten des „Gesetz zum Schutz der nationalen Sicherheit in der Sonderverwaltungszone Hongkong“ geltende neue Rechtslage und mögliche Risiken hin. Auf die Anfrage nach möglichen Risiken auch für Ausländer ging man nicht näher ein.  Am Mittwoch hat die chinesische Führung auch ihr eigenes Sicherheitsbüro in der Sonderverwaltungszone eröffnet. Die pekingtreue Regierungschefin Carrie Lam sprach von einem ""historischen Moment"" und einem ""Meilenstein"". Das Büro werde dazu beitragen, in der Finanzmetropole ""ein intaktes Rechtswesen"" aufzubauen und die ""nationale Sicherheit"" zu schützen. Der oberste chinesische Gesandte in Hongkong, Luo Huining, erklärte, die Stadt habe sich ""von den Tagen verabschiedet, als sie in Bezug auf die nationale Sicherheit wehrlos war"". Mit dem Sicherheitsgesetz reagiert Peking auf die monatelangen und teils gewalttätigen Massenproteste der Demokratiebewegung in der früheren britischen Kronkolonie reagierte. Das drakonische Gesetz erlaubt es der Pekinger Führung, gegen Aktivitäten vorzugehen, die sie als subversiv, separatistisch, terroristisch oder als Verschwörung mit ausländischen Kräften einstuft. Bestraft werden unter anderem der Besitz von Flaggen, Aufklebern und Flugblättern, auf denen die Unabhängigkeit Hongkongs befürwortet wird. Wer das Gesetz bricht, muss mit mindestens zehn Jahren Haft rechnen, könnte aber auch lebenslang im Gefängnis landen. Das Gesetz erlaubt es dem chinesischen Sicherheitsapparat auch, offen in der Sonderverwaltungszone zu operieren. Das Sicherheitsbüro ist ein zentraler Bestandteil dieser Präsenz. nd den USA sorgt der Artikel 38 schon seit Tagen für Aufregung Kanzlerin eine härtere Gangart über China Ex-SPD-Chef Sigmar Gabriel warnt bereits vor einem neuen kalten Krieg.  Seit einer Woche ist das neue Sicherheitsgesetz in Kraft.",tagesspiegel
Kritik an Haltung zu China . „Aus der deutschen Regierung wird das Minimum geliefert“,no_author,"09.07.2020, 12:37 Uhr",https://www.tagesspiegel.de/politik/kritik-an-haltung-zu-china-aus-der-deutschen-regierung-wird-das-minimum-geliefert/25990118.html,"Der Vorsitzende des Auswärtigen Ausschusses im Bundestag, Norbert Röttgen (CDU), hat die Bundesregierung zu einer entschiedenen Positionierung gegenüber China aufgefordert. Angesichts der chinesischen Repression in Hongkong   habe die Regierung bisher „das Minimum geliefert, was man als Demokratie und Rechtsstaat liefert“, sagte Röttgen am Donnerstag  .  Dabei  , eine europäische Antwort zu finden. Die Sichtweise, China vor allem als großen Markt zu betrachten, auf den man Rücksicht nehmen müsse, habe in der Vergangenheit funktioniert, reiche aber nicht mehr aus. „China ist eine geostrategische Macht geworden und sie verlangt mehr, als dass wir nur den Markt sehen"", sagte Röttgen, der sich auch für den CDU-Vorsitz bewirbt. Unrecht, das von China ausgehe, müsse klar verurteilt werden. Das von Chinas Führung erlassene Sicherheitsgesetz für Hongkong ist der  , die ihr bei der Übergabe an China 1997 nach dem Prinzip „Ein Land - zwei Systeme“ für mindestens 50 Jahre zugesagt wurde. Es sieht lebenslange Haft als Höchststrafe für zahlreiche Vergehen vor, die Chinas Behörden als Subversion, Abspaltung und Terrorismus werten. Mit dem Gesetz unterdrücke China Freiheit und Autonomie in der Sonderverwaltungszone und verstoße gegen internationales Recht. Wirtschaftssanktionen schloss Röttgen aber aus.  Auch der Präsident des Europäischen Parlaments, David Sassoli, sagte, die Entwicklungen in Hongkong, würden ihn „zutiefst beunruhigen“. Es gebe keine Versammlungs- oder Redefreiheit mehr. Was einst demokratische Realität in Hongkong gewesen sei, drohe nun, „für immer verloren zu gehen“. Er forderte die zuständigen Behörden auf, internationale Verpflichtungen und Grundfreiheiten zu respektieren. Der aus Hongkong geflohene Aktivist Nathan Law hat Bundeskanzlerin Angela Merkel (CDU) um Unterstützung gebeten. „Die Welt blickt auf Hongkong. Liebe Frau Merkel, wir brauchen Ihre Hilfe“, sagte er der Zeitung „Hessische Niedersächsische Allgemeine“ (HNA). „Es ist ein Kampf der Ideologien. Bedenken Sie: Den Wert, den Sie Hongkong beimessen, den messen Sie der Demokratie insgesamt bei.“ Nach dem Erlass des Sicherheitsgesetzes hatte Law Hongkong verlassen. Er werde seinen Einsatz auf internationaler Ebene fortsetzen, erklärte er auf Facebook. Seinen Aufenthaltsort wolle er nicht verraten. Zuvor waren Law und prominente Mitstreiter wie Joshua Wong aus ihrer Partei Demosisto ausgetreten,  . Wong will in Hongkong bleiben. Als Reaktion auf das umstrittene Sicherheitsgesetz hat Australien sein Auslieferungsabkommen mit der chinesischen Sonderverwaltungsregion ausgesetzt. Das gab der australische Premierminister Scott Morrison am Donnerstag bekannt. Chinas Sicherheitsgesetz stelle eine „fundamentale Änderung“ der Sachverhalte in Bezug auf Australiens Vereinbarung mit Hongkong zu Auslieferungen dar, sagte Morrison.  Man habe Hongkong formal über die Entscheidung seiner Regierung in Kenntnis gesetzt und die chinesischen Behörden entsprechend benachrichtigt. Bürgern Hongkongs, die durch Chinas umstrittenes Sicherheitsgesetz für die frühere britische Kronkolonie gefährdet sein könnten, werde Australien Sondervisa und einen Weg hin zu einer dauerhaften Aufenthaltsgenehmigung anbieten, erklärte Morrison weiter. China drohte der australischen Regierung mit Konsequenzen. „Die angekündigten Maßnahmen verstoßen grob gegen das Völkerrecht und Grundregeln internationaler Beziehungen“, sagte Zhao Lijian, ein Sprecher des Pekinger Außenministeriums, am Donnerstag. Es handele sich zudem um eine massive Einmischung in die inneren Angelegenheiten Chinas. Die chinesische Regierung behalte sich das Recht vor, auf die Ankündigung zu reagieren. „Alle daraus resultierenden Konsequenzen werden vollständig von der australischen Seite getragen“, sagte der Sprecher weiter.  Die Beziehungen zwischen Australien und seinem wichtigsten Wirtschaftspartner China sind bereits seit längerer Zeit angespannt - vor allem, seitdem die Regierung in Canberra eine unabhängige internationale Untersuchung zum Ursprung des Coronavirus in China gefordert hatte. Peking wirft Australien seinerseits Spionage vor und hat chinesische Studenten und Touristen vor Reisen in das Land gewarnt. Vergangenen Freitag hatte bereits Kanadas Regierung wegen Chinas Hongkong-Gesetzes das Auslieferungsabkommen mit der Metropole beendet. Auch in Großbritannien, den USA und der EU wurden entsprechende Forderungen laut. Die Grünen-Vorsitzende Annalena Baerbock fordert auch von der Bundesregierung eine sofortige Aussetzung des Auslieferungsabkommens mit Hongkong. „Das Pekinger Sicherheitsgesetz in Hongkong bricht mit geltendem Völkerrecht und ist ein massiver Angriff auf die Rechtsstaatlichkeit und Demokratie“, sagte Baerbock. Andere Länder zögen Konsequenzen, die Bundesregierung schaue tatenlos zu. „Zum Schutze der Menschen muss die Bundesregierung das Auslieferungs- und Rechtshilfeabkommen mit Hongkong unverzüglich aussetzen“, forderte die Grünen-Vorsitzende. Die EU müsse Hongkonger Demokraten Schutz vor politischer Verfolgung garantieren, forderte Baerbock. „Dafür sollte sie die Ausweitung von Aufenthaltsmöglichkeiten in der EU prüfen, wenn Menschenrechte und Grundfreiheiten in Hongkong weiter eingeschränkt werden.“ Die Grünen-Chefin kritisierte, Kanzlerin Angela Merkel (CDU) habe in ihrer Rede vor dem EU-Parlament am Dienstag „nur zwei dürre Sätze zu Pekings Verstößen“ geäußert, „als sei sie nicht willens, Verantwortung zu übernehmen“. Die Kanzlerin habe im Rahmen der deutschen EU-Ratspräsidentschaft „alle Karten in der Hand“. Es müssten Konsequenzen für die europäische Chinapolitik gezogen werden, forderte Baerbock, und zwar „einschließlich der laufenden Verhandlungen über das europäisch-chinesische Investitionsschutzabkommen“. Auch die Vorsitzende des Bundestags-Ausschusses für Menschenrechte und humanitäre Hilfe sowie menschenrechtspolitische Sprecherin der FDP-Fraktion, Gyde Jensen, sagte, Deutschland solle sich Australien als Vorbild nehmen. „Leider zeigt sich Innenminister (Horst) Seehofer bisher in Sachen Sicherheitsgesetz ebenso passiv und lethargisch wie sein Kabinettskollege Außenminister (Heiko) Maas und die Kanzlerin“, sagte Jensen. Komme es nicht schnell zu einer gemeinsamen Einigung auf EU-Ebene, müsse Deutschland zunächst auf nationaler Ebene beispielhaft vorangehen, forderte Jensen.  durch das jüngst erlassene Sicherheitsgesetz im Deutschlandfunk liege es maßgeblich an Deutschland radikalste Einschnitt in die Autonomie der Finanzmetropole die daraufhin aufgelöst wurde „Das Minimum ist hier zu wenig, angesichts des Unrechts, das China klar angekündigt hat und auch praktiziert“, sagte Röttgen weiter. ",tagesspiegel
