title,author,date_published,url,article_text,source
EU sanktioniert Russland und China . Erstmals Strafen wegen Cyberangriffen,no_author,"30.07.2020, 18:04 Uhr",https://www.tagesspiegel.de/politik/eu-sanktioniert-russland-und-china-erstmals-strafen-wegen-cyberangriffen/26052922.html,"Sanktionen Um sich vor gezielten Cyberangriffen zu schützen, hatte die EU im vergangenen Jahr einen   geschaffen. Dieses Instrument wurde nun zum ersten Mal genutzt. ( ,  ) Rechtrahmen für Sanktionsmaßnahmen Die Europäische Union hat   gegen   und China verhängt. Wie der Rat der Mitgliedstaaten am Donnerstag in Brüssel mitteilte, richten sich die Strafmaßnahmen gegen insgesamt sechs Einzelpersonen und drei Organisationen. Dazu gehören Einreiseverbote. Zudem kann die EU Vermögenswerte einfrieren. Betroffen sind vier russische Agenten, denen die EU einen versuchten Cyberangriff gegen die Organisation für das Verbot von Chemiewaffen in Den Haag vorwirft.  Zudem sind das Hauptzentrum für Spezialtechnologien des russischen Militärgeheimdiensts GRU gelistet sowie zwei mutmaßliche Mitglieder der chinesischen Hackergruppe APT10, die bei einer Aktion mit dem Namen „Cloud Hopper“ IT-Dienstleister in aller Welt angegriffen haben sollen. Als Grund für die Strafmaßnahmen werden von der EU auch die   und NotPetya genannt. Mit ihrer Hilfe wurden Computer verschlüsselt und Lösegelder gefordert.    Betroffen waren unter anderem britische Krankenhäuser und Anzeigen auf Bahnhöfen in Deutschland. ",tagesspiegel
Nach Schließung von US-Konsulat in China . Wie gefährlich ist der Konflikt der Weltmächte?,Hans Monath,"24.07.2020, 20:50 Uhr",https://www.tagesspiegel.de/politik/nach-schliessung-von-us-konsulat-in-china-wie-gefaehrlich-ist-der-konflikt-der-weltmaechte/26035936.html,"Rund 34 Millionen Chinesen blickten am Freitag in einem mit dramatischer Musik unterlegten Livestream des staatlichen Fernsehsenders CCTV auf das US-Konsulat in der westchinesischen Stadt Chengdu und sahen: nichts. Oder genauer gesagt, ein Gebäude.  Auch vor dem Konsulat hatten sich viele Menschen versammelt, eine Feuerwehr wurde auch gesichtet. Die Schaulustigen erwarteten offenbar ein ähnliches Schauspiel wie zuvor in Houston, Texas. Dort hatten Mitarbeiter des chinesischen Konsulats im Hof Dokumente verbrannt, nachdem die USA beschlossen hatten, dass dieses Konsulat innerhalb von 72 Stunden geschlossen werden müsse. Das Gleiche ordnete nun China für das US-Konsulat in Chengdu an. Die US-Regierung wirft China vor, das Konsulat in Houston, Texas, sei ein  . Mitarbeiter des Konsulats seien an diesen Aktivitäten beteiligt und hätten sie unter Nutzung falscher Personalangaben unterstützt. Washington verlangte am Dienstag, Peking müsse das Konsulat bis Freitag dieser Woche schließen. China unterhält neben der Botschaft in Washington noch vier weitere Konsulate in  . Die Außenstelle in Houston ist dabei die unbedeutendste. Chinas Außenamtssprecherin Hua Chunying wiederum begründete die chinesische Anordnung auf Twitter als „legitime und notwendige Antwort auf die einseitige und provokative Entscheidung der USA, die Schließung des chinesischen Generalkonsulats in Houston zu verlangen.“ Die USAwarnten daraufhin am Freitag ihre Bürger in China in einer Reisewarnung vor „willkürlichen Verhaftungen“. Der Konflikt um die Konsulate wirkt eskalierend, weil er zu einer Reihe weiterer Streitthemen hinzukommt. US-Präsident Donald Trump wirft China kontinuierlich unfaire Handelspraktiken und Währungsmanipulationen vor, die im Effekt die Jobs amerikanischer Arbeiter vernichten. Die Unterdrückung der Demokratiebewegung in Hongkong hat diplomatische Proteste nahezu aller westlichen Staaten ausgelöst.  Auch Chinas Umgang mit den muslimischen Uiguren und mit Tibet sowie generell die Menschenrechtspolitik sind Kritikpunkte; sie stehen allerdings nicht im Fokus der Angriffe Trumps, der sich um Grundrechte und Religionsfreiheit wenig kümmert. Von geostrategischer Bedeutung sind Chinas Anspruch auf Taiwan – ein demokratischer Staat, der von China nicht anerkannt wird und von den USA mit Waffen unterstützt wird – sowie die Territorialkonflikte im Südchinesischen und im Ostchinesischen Meer. Dort versucht China seine Hoheitsrechte über die international festgelegten Lufträume und Territorialgewässer auszudehnen.  Es baut Infrastruktur auf unbewohnten oder künstlichen Inseln auf, um dort Hoheitsrechte zu beanspruchen sowie Bodenschätze im Meer. Es missachtet dabei auch einen Schiedsspruch des Seegerichtshofs.  Dabei ist es mehrfach zu militärisch gefährlichen Situationen mit Kriegsschiffen und Militärjets der Nachbarstaaten sowie der USA und europäischer Staaten gekommen, die China zwingen wollen, die internationalen Lufträume und internationalen Handelsgewässer zu respektieren. US-Außenminister Mike Pompeo hat die Demokratien in Europa und Asien in einer  . Seit der gewaltsamen Niederschlagung der Demokratiebewegung auf dem Tiananmenplatz 1989 und dem Untergang der Sowjetunion führt die KP China einen ideologischen Krieg gegen feindliche Kräfte. „Für die KP China hat der Kalte Krieg nie geendet“, schreiben Mareike Ohlberg und Clive Hamilton in ihrem Buch „Die lautlose Eroberung.“ Unter dem inzwischen auf Lebenszeit regierendem   spitzt sich der Konflikt weiter zu. 2013 erklärte er in einer Rede zum Thema „Verteidigung und Entwicklung des Sozialismus“ vor Mitgliedern des KP-Zentralkomitees, dass das chinesische System letzten Endes über den Kapitalismus triumphieren werde. Die Partei müsse sich aber auf eine „langfristige Kooperation und Auseinandersetzung zwischen beiden Systemen“ vorbereiten. Letzten Endes versucht die KP das Duell der politischen Systeme auch deshalb für sich zu entscheiden, um ihre autoritäre Alleinherrschaft in China zu legitimieren. Im Vergleich mit früheren US-Regierungen hat Donald Trump den Kurs gegenüber China verschärft.   agierte konzilianter und suchte in der globalen Finanzkrise die Kooperation mit Peking. Trump hingegen übt mit Strafzöllen Druck auf China aus, seine Märkte ebenso für westliche Produkte zu öffnen, wie China Zugang für seine Waren in westlichen Volkswirtschaften beansprucht. Er verschärft den Ton, indem er das Coronavirus „China Virus“ nennt und betont, Peking trage die Hauptschuld dafür, dass aus einer anfangs regional eingegrenzten Infektionswelle eine weltweite Pandemie wurde. Neben Trumps kombativem Kurs hat sich freilich auch die objektive Lage geändert. Vor 15, 20 Jahren wurde China noch als Entwicklungsland betrachtet, dessen Aufstieg die technische und geostrategische Dominanz des Westens nicht in Frage stellt – weshalb man mit Nachsicht reagieren könne, wenn China sich nicht an die selben Standards bei Handelsregeln, Sozialvorschriften, Umwelt- und Klimaauflagen hält. Heute ist China technisch und ökonomisch ähnlich stark wie die USA oder die EU. Ungleiche Regeln gelten als Wettbewerbsnachteil zu Lasten Amerikas und Europas. Wenn der  die Präsidentschaftswahl gewinnt, würde dieser Grundkonflikt in seiner Brisanz bleiben.  Im Verhältnis zu China hat die EU ein Problem: Ihre Mitgliedstaaten verfolgen so unterschiedliche Interessen, dass eine gemeinsame Positionierung in zentralen Streitfragen schwierig wird. Es wäre die Aufgabe Deutschlands in seiner laufenden EU-Präsidentschaft gewesen, für den ursprünglich für September geplanten  eine gemeinsame Position herbeizuführen.  Wegen der Corona-Krise wurde der Gipfel aber nun verschoben. Ohne Zwang zur Einigung, so glaubt zumindest   wird es keine gemeinsame europäische Position geben. Daran dürfte auch die Zuspitzung des Konflikts zwischen Washington und Peking wenig ändern. Zumindest die letzte EU-Kommission hatte diese Schwäche erkannt und versuchte gegenzusteuern. Im März 2019 veröffentlichte sie ein Zehn-Punkte-Papier, mit dem sie dem politischen und wirtschaftlichen Machtstreben Chinas auf vielen Feldern etwas entgegensetzen wollte. China sei Partner, Wettbewerber und systemischer Rivale, heißt es darin. Doch die nationalen Regierungen orientieren sich oft nicht am dem EU-Beschluss, der die Bedeutung der Menschenrechte betont und gleiche Wettbewerbsbedingungen verlangt. Zugleich nimmt China Einfluss und spaltet die EU. In Italien, aber auch in anderen süd- und osteuropäischen Staaten sind die Investitionen aus Peking hochwillkommen. Das stimmt diese Regierungen milde, wenn es darum geht, China zu kritisieren.  Auf der anderen Seite prescht Dänemark mit einer harten Verurteilung der neuen Sicherheitsgesetze für Hongkong voran und erntet als Lob einen Besuch von US-Außenminister Mike Pompeo. Die Wirtschafts- und Handelsmacht EU kann zwar weder von Washington noch Peking ignoriert werden. Wo es aber um harte politische Interessen geht, füllt die EU die weltpolitische Rolle nicht aus, die ihr auch die deutsche Politik ständig aufgibt. Ähnlich sieht das Johannes Varwick, Professor für Internationale Beziehungen und Europäische Politik in Halle: ""Die Vorstellung, die EU könnte als weltpolitischer Pol zwischen den USA und China ausgleichend wirken, ist unrealistisch"", sagte er. Sie scheitere daran, dass es keine wirkliche EU-Aussenpolitik gebe. ""Wie jede Großmacht, schafft es China gut, innereuropäische Uneinigkeit für sich zu nutzen"", meint Varwick und kommt zu dem Schluss: ""Von Europa ist da nicht viel zu erwarten."" Die jüngste Zuspitzung hatte die Bundesregierung am Freitag nicht offiziell kommentiert. Grundsätzlich gilt aber: Zwar sieht auch die schwarz-rote Regierung die problematischen Seiten Chinas, zuletzt die neuen Sicherheitsgesetze für Hongkong. Doch hält man die Bereitschaft von US-Präsident Trump zur Eskalation des Konflikts mit Peking für gefährlich, zumal die Kontrahenten wirtschaftlich aufeinander angewiesen sind. Blinde Gefolgschaft kann die US-Regierung von Deutschland deshalb nicht erwarten. Regierungsvertreter betonen: China bleibt ein wichtiger Partner in der internationalen Politik, etwa beim Klimaschutz und beim Atomabkommen mit dem Iran, und ein wichtiger Wirtschaftspartner. Die USA wiederum sind als Sicherheitsgarant für Deutschland unerlässlich und teilen gemeinsame Werte, auch wenn der aktuelle Präsident diese häufig mit Füßen tritt. Die  , die harte Kritik an Peking weitgehend vermeidet, wird von Grünen und FDP, aber auch vom CDU-Außenpolitiker Norbert Röttgen kritisiert. Zuletzt hat auch die SPD-Fraktion einen  . Merkel müsse sich endlich der Realität stellen und einsehen, dass die wirtschaftliche Verflechtung nicht zu einer Annäherung Chinas an den Westen führen werde, forderte der SPD-Außenpolitiker Nils Schmid. Die ""eher China-freundliche Haltung des Kanzleramtes"" gerate unter Druck, sagt auch der Außenpolitik-Experte Johannes Varwick von der Universität Hallte. Zu offenkundig sei inzwischen, ""dass Chinas neuer Machtanspruch und sein im Inneren wie Äußeren zunehmend  aggressives Auftreten kein business as usual zulässt.""  Mit etwas Verzögerung nehme die deutsche Politik China inzwischen kritisch wahr -  ohne allerdings bereits eine tragfähige Strategie erarbeitet zu haben. Dem US-Druck, bei der amerikanischen Eindämmungspolitik zu folgen und wie die USA auch auf ökonomische  Abkoppelung von China zu setzen, werde Deutschland aber wohl nicht nachkommen: ""Es will in dem neuen Grossmächtekonflikt am liebsten nicht Partei sein und weiterhin gute Geschäfte machen."" Ob ein Raushalten dauerhaft funktioniert, sei aber zu bezweifeln. China dürfte sich eher in Richtung USA bewegen.   drohte China gegenüber am Freitag mit Konsequenzen wegen des Sicherheitsgesetzes für Hongkong. „Wenn das Prinzip ,Ein Land, zwei Systeme’ durch das Sicherheitsgesetz ausgehöhlt wird, hat das auch Folgen für unser Verhältnis zu Hongkong und China“, sagte er nach einer Videokonferenz mit Chinas Außenminister Wang Yi.  Maas bereitet die Vereinfachung der Einreise für Hongkong-Chinesen, einen Exportstopp für bestimmte Rüstungsgüter, Stipendienprogramme für bedrohte Wissenschaftler, Künstler oder Journalisten sowie ein Ende des Auslieferungsabkommens mit Hongkong vor. Zentrum der Wirtschaftsspionage und des Diebstahls von geistigem Eigentum New York, Chicago, Los Angeles und San Franzisko Grundsatzrede aufgefordert, sich mit den USA China entgegenzustellen Partei- und Staatschef Xi Jinping Barack Obama  Demokrat Joe Biden  EU-China-Gipfel Wolfgang Ischinger, der Chef der Münchner Sicherheitskonferenz, ausgleichende China-Politik der Kanzlerin Angela Merkel (CDU) härteren Kurs gegenüber China angemahnt Außenminister Heiko Maas (SPD)",tagesspiegel
China versus USA . Das Gespenst des Kalten Krieges geht um,Christoph von Marschall,"27.07.2020, 06:42 Uhr",https://www.tagesspiegel.de/politik/china-versus-usa-das-gespenst-des-kalten-krieges-geht-um/26039164.html,"Ein Gespenst geht um in Europa: das Gespenst des  . Kehrt er zurück wie ein Wiedergänger, der nicht tot zu kriegen ist?  Europa hoffte, den bösen Geist besiegt zu haben mit den Freiheitsbewegungen gegen den Kommunismus. Russland fehlt heute die Kraft zu einer existenziellen Bedrohung, wie sie einst von der Sowjetunion ausging. Doch die Konflikte mit China nehmen beängstigend zu und haben sich auf so viele Gebiete ausgeweitet, dass das Wort vom globalen Systemgegensatz nicht übertrieben ist.  Es geht um die durch internationale Verträge garantierte  , um Menschenrechte in Chinas Mehrheitsbevölkerung, wie um die der Minderheiten von den muslimischen Uiguren bis zu den Tibetern, um freie Schifffahrtswege und Lufträume in Asien, um geistiges Eigentum,  , um eine verantwortliche Nutzung von Ressourcen in der Dritten Welt, etwa in Afrika, um Klimaschutz – und um verlässlichen Datenschutz hier in Europa, wenn man staatsnahe Giganten wie Huawei an 5G-Netzen beteiligt. Das Wort vom neuen Kalten Krieg hat seine Tücken, weil es eine Wiederholung der Geschichte andeutet, die es so nicht gibt. Zugleich hat es seine Berechtigung wegen der Dimension der Herausforderung.  China bedroht Europa nicht militärisch wie früher der hoch gerüstete Warschauer Pakt. Es herrscht auch keine riskante Gesprächslosigkeit zwischen West und Ost, die zu Fehlkalkulationen verleiten könnte, wie in den 1950er Jahren. China ist Teil der internationalen Institutionen und Dialogforen, spielt eine wichtige Rolle in den G 20, treibt regen Warenaustausch mit Amerika und Europa. Zugleich hat China jedoch ein ökonomisches Entwicklungspotenzial, das der Sowjetunion fehlte. Als klar wurde, dass der Ostblock auf Dauer weder wirtschaftlich noch technisch mit dem Westen mithalten konnte, tröstete man sich dort mit der Losung „Überholen ohne einzuholen“. Das hat nicht funktioniert.  China hat Amerika und Europa in vielen Bereichen eingeholt und in manchen Zukunftstechniken wie 5G und Künstliche Intelligenz überholt. Seine Wirtschaftskraft ist heute ähnlich groß wie die der EU oder die der USA.  Die Effizienz seines Systems – vom Entwicklungsland zur Supermacht in wenigen Jahrzehnten – und vielfältige Kooperationsangebote an ärmere Länder zum Ausbau der Infrastruktur oder die „Neue Seidenstraße“ machen China zu einem attraktiven Partner. Und einer Alternative zur EU und den USA. Die geostrategische Weltkarte ordnet sich neu. Länder wie Iran, die im Konflikt mit dem Westen stehen, orientieren sich an Peking, verkaufen ihre   und erhalten dafür Devisen und andere knappe Güter.  Auch einige EU-Staaten wie Griechenland oder Ungarn haben sich riskant abhängig von Peking gemacht. Insgesamt freilich haben Europa und Amerika mehr „Soft Power“. Chinas   schadet seinem Image. Und Schwergewichte wie  . Was sind Deutschlands und Europas Interessen in dieser Lage?   Der erste Anlauf – Wandel durch Handel, Annäherung und Einbindung – hat das nicht erreicht.  China redet von Multilateralismus und vom Wert internationaler Abkommen, um sich positiv von Trumps Unilateralismus und dessen Rückzug aus Verträgen abzusetzen. Doch in Hongkong bricht China den Vertrag über dessen Autonomie.  Peking bekennt sich zu Klimaschutz, ist aber selbst der größte Verschmutzer, baut tausende Kohlekraftwerke und möchte seine Emissionen nicht so bald reduzieren. Es nutzt den Zugang zu westlichen Märkten, gewährt ihn westlichen Firmen aber nicht. Auf ihre Weise ist die Volksrepublik eine größere Bedrohung für die freie Weltordnung, als die Sowjetunion es war.  Deshalb muss Europa ihr mit derselben Entschlossenheit entgegentreten wie der UdSSR. Mit einem Unterschied: nicht als militärischer Feind, sondern als systemischer Rivale, der Vertragstreue einfordert und seine Werte nicht preisgibt. Kalten Krieges Demokratie in Hongkong Marktzugang und faire Handelsregeln Ressourcen dorthin wie Iran sein Öl Umgang mit Corona Indien, die man früher als „blockfrei“ umwarb, haben mit China wenig am Hut China auf die Einhaltung der freien Weltordnung zu verpflichten.",tagesspiegel
VPN-Zugänge nicht mehr sicher . Wie Peking Hongkongs Tunnel in die Freiheit abschneidet,no_author,"29.07.2020, 11:13 Uhr",https://www.tagesspiegel.de/wirtschaft/vpn-zugaenge-nicht-mehr-sicher-wie-peking-hongkongs-tunnel-in-die-freiheit-abschneidet/26045102.html,"Die Reaktion kam unerwartet schnell, aber konsequent. Der VPN-Anbieter TunnelBear aus Toronto kündigte als einer der ersten an, seine Server in Hongkong abzuschalten und künftig den Datenverkehr nicht mehr in die chinesische Sonderverwaltungszone weiterzuleiten, um seine Nutzer zu schützen. Auch der US-Anbieter IPVanish teilte in einem Blogbeitrag mit, dass er seine VPN-Server in Hongkong außer Betrieb genommen und den Betrieb dort eingestellt habe, um „die Freiheiten der Benutzer in Hongkong“ zu schützen. „Das neue Gesetz stellt auch die Region, die einst eine   war, hinter die gleichen strengen Internet-Beschränkungen, die für das chinesische Festland gelten“, heißt es von IPVanish. „Mit dieser Gesetzesänderung müssen wir leider Hongkong und China als eine Einheit betrachten.“ Diese Entscheidungen kommen als Reaktion auf das sogenannte Sicherheitsgesetz, das Peking zum 30. Juni in   eingeführt hatte. Technologieunternehmen sind laut Artikel 43 verpflichtet, den Behörden des neuen Sicherheitsbüros in Hongkong Zugang zu ihren Daten zu ermöglichen und gezwungen, bei der Entschlüsselung der Identität der Nutzer zu helfen, sowie unerwünschte Beiträge auf Anweisung der Behörden zu zensieren. Auch eine Reihe anderer VPN-Anbieter zogen nach und kündigten an, ihre  . Denn das Sicherheitsgesetz entzieht ihnen sozusagen die Geschäftsgrundlage. Virtual Private Networks verschlüsseln den Datenverkehr zwischen dem Nutzer und dem Empfänger, leiten den Datenverkehr aber über öffentliche Netze. Das funktioniert nur, wenn der VPN-Anbieter die Identität des Nutzers kennt und diese schützt. Genau das hebelt das neue Gesetz aus. In der Vergangenheit bot die Hafenmetropole Hongkong internationalen Unternehmen durch das eigene Rechtssystem ein vertrauenswürdiges Umfeld, in dem Internetverbindungen zuverlässig waren und schnelles Wachstum möglich schien. Die einstige britische Kronkolonie wurde aufgrund ihrer strategischen Lage in Asien daher von vielen VPN-Betreibern als Standort für ihre Server genutzt. Gerade auch wegen der Nähe zum chinesischen Festland, wo durch die Great Firewall viele internationale Webseiten blockiert sind. So konnten sie die Nachfrage von Nutzern aus China sehr gut bedienen, die ihre Internetaktivitäten vor den Behörden verbergen wollen oder auf Webseiten zugreifen möchten, die die chinesischen Behörden zensieren. Solche Verhältnisse fürchten nun auch die Hongkonger. Nur einen Tag vor dem Inkrafttreten des Sicherheitsgesetzes sprang die Suche nach VPN-Anbietern in Hongkong im Vergleich zum Rest des Monats Juni um 320 Prozent nach oben, so Top10VPN, ein britisches Marktforschungsunternehmen, das das weltweite VPN-Nutzerverhalten verfolgt. „Die Kriminalisierung der Sezession“ und „Subversion der Staatsmacht“ hat viele zu der Annahme geführt, „dass Online-Äußerungen Anlass zu einer Verhaftung sein könnten“, sagte Samuel Woodhams, ein Forscher bei TOP10VPN. „Es scheint nur eine Frage der Zeit zu sein, bis die strenge digitale Zensur und ständige Überwachung des Festlandes auch in Hongkong zu spüren ist.“ Einige VPN- Betreiber warten noch ab, wie das Gesetz in der Realität umgesetzt werden wird. Dem „Wall Street Journal“ sagte der Schweizer Anbieter ProtonVPN, dass die Nutzernachfrage aus Hongkong Ende Mai schon um mehr als 3000 Prozent gestiegen war. Surf shark, ein VPN-Anbieter mit Sitz auf den britischen Jungferninseln, verzeichnete seit Inkrafttreten des neuen Sicherheitsgesetzes einen Umsatzzuwachs von 400 Prozent in Hongkong. Surfshark, ProtonVPN, oder der bekannte Anbieter NordVPN, haben keine Absichten Hongkong den Rücken zu kehren. Dennoch: Dass Hongkongs Regierungschefin Carrie Lam auf die Frage, was geschähe, wenn ausländische Technologiefirmen sich weigerten, ihre Daten mit Behörden zu teilen, bekräftigte, das Gesetz durchsetzen zu wollen, ist Antwort genug. „Internetdienstanbieter und andere Organisationen werden möglicherweise aufgefordert, Informationen oder Nachrichten online zu entfernen. Diese Macht besteht“, sagte Lam. Hochburg der Online-Freiheit Hongkong Server in Hongkong abzuschalten",tagesspiegel
