title,author,date_published,url,article_text,source
Unsichtbar zum Erfolg? . Die ungewöhnliche Wahlkampftaktik des Joe Biden,Christoph von Marschall,"23.07.2020, 13:54 Uhr",https://www.tagesspiegel.de/politik/unsichtbar-zum-erfolg-die-ungewoehnliche-wahlkampftaktik-des-joe-biden/26030690.html,"Trump, Trump, Trump. Der US-Präsident beherrscht die Schlagzeilen, in den USA wie im Ausland. Einen Moment mal: Warum hört man so wenig von Joe Biden? Es bleiben rund 100 Tage bis zur Wahl am 3. November. Die heiße Phase des Wahlkampfs hat längst begonnen.  Doch das generelle Bild von den beiden Kandidaten sieht so aus: Trump ist omnipräsent. Biden hockt im Keller seines Hauses in Delaware, wo er sich ein Studio mit vielen Bücherregalen als Bildhintergrund eingerichtet hat und verschickt von dort gelegentlich virtuelle Botschaften. Nun gut, jetzt hat Biden es zwei Mal kurz hintereinander in die Nachrichten geschafft. In einem gemeinsamen   verdammen die beiden Trump wegen seines Umgang mit der Coronakrise: „Kann man sich das vorstellen, dass einer von uns in dem Amt sagen würde: Das fällt nicht in meine Verantwortung?“  Freilich reichte es nicht einmal für einen gemeinsamen körperlichen Auftritt des Teams, das die USA von 2009 bis 2017 regiert hatte. Obama und Biden begnügen sich mit einem „Chat“ nach Social-Distancing-Regeln. In der Nacht zu Donnerstag ging Bidens Attacke um die Erde, Trump sei der erste rassistische Präsident der USA. Klingt wie ein harter Punch. War aber nicht geplant, sondern ein spontanes Zufallsprodukt. Bei einem Treffen mit Beschäftigten des Gesundheitswesens wurde er gefragt, was er davon halte, dass Trump den Corona-Erreger meist „China-Virus“ nenne? Es sei „absolut widerlich“, Menschen nach ihrer „Hautfarbe oder nationalen Herkunft“ einzuteilen. Kein Präsident habe das jemals getan. „Es gab   werden wollten. Er ist der erste, der es geschafft hat.“ Nun würden einem eine ganze Reihe US-Präsidenten einfallen, die nach heutigen Maßstäben und auch nach den von Biden genannten Kriterien Rassisten wären. Sie hielten Menschen anderer Hautfarbe für minderwertig, hielten sie als Sklaven, verweigerten ihnen lange politische Rechte. Aber darum geht es nicht. Die entscheidende Frage ist: Klingen die beiden Gegenbeispiele nach einer strategischen Offensive? Sie lassen doch eher sichtbar werden, dass Biden es in der medialen Präsenz mit Trump nicht aufnehmen kann. Trump gehören die nationalen Megaphone und die Schlagzeilen.  Trump schickt Bundespolizei nach Portland, Chicago, New York, weil die dortigen Sicherheitskräfte angeblich die Proteste nicht unter Kontrolle bekommen und die Gewalt nicht beenden. Trump trägt plötzlich eine Schutzmaske und empfiehlt das  , was er lange abgelehnt hatte – ein Schwenk in der Pandemiebekämpfung? Trump wünscht Ghislaine Maxwell, der Ex-Geliebten und Helferin des Sex-Straftäters Jeffrey Epstein alles Gute. Trump nimmt die Corona-Briefings im Weißen Haus wieder auf. Manche Beobachter analysieren ganz offen, Bidens Strategie bestehe genau darin: Nicht so präsent wie Trump zu sein.   Die allererste Anforderung an Politik sei, die Lage nicht noch zu verschlimmern und Betroffenen nicht noch mehr Schaden zuzufügen, hat er schon früher gerne gescherzt. Wenn   wie in den vergangenen Wochen, falle ihm der Sieg im November in den Schoß. Und deshalb sei das Wichtigste, nichts zu tun, was den für Trump schädlichen Trend umkehren könnte.  Also: keine Aufmerksamkeit auf sich lenken. Keine zu aggressiven oder zu lockeren Sprüche, die zu einer öffentlichen Debatte über den 78-jährigen Biden und seine potenziellen Schwächen führen. Einfach abwarten, wie Trump sich und seine Chancen selbst zerstört. Der Präsident ist erkennbar nervös. Der  , der nun schon seit Wochen anhält, hat ihn unvorbereitet erwischt. Zuvor funktionierte die Devise: Alle Nachrichten müssen sich um ihn drehen, ziemlich egal ob es gute oder schlechte sind. Denn den Raum in den Medien, den er einnimmt und beherrscht, kann kein anderer nutzen, schon gar nicht Biden mit seinem weniger aufdringlichen Temperament. Und wer die Nachrichten dominiert, wirkt wie der Macher. Nun sucht Trump nach einem Thema und einer Strategie, mit denen er wieder Oberwasser gewinnt. Und natürlich soll es etwas sein, was provoziert, was Konflikte auslöst, was skandalträchtig ist: überzogene Polizeieinsätze, die ihm die Aura des hart durchgreifenden „Law and order“-Präsidenten verleihen. Abfällige Äußerungen über ausländische Konkurrenz und Nicht-Weiße-Migranten, die bei den weißen US-Bürgern in ökonomisch benachteiligten Regionen den Eindruck erwecken, er kämpfe ohne Rücksicht auf politische Korrektheit für die Interessen der schweigenden Mehrheit.  Und wenn man ihn deshalb einen Rassisten nennt – umso besser! Das macht ihn in der weißen Unterschicht nur noch glaubwürdiger. Das ist Trumps Erfahrung: Wenn er auf effektive Art spaltet, gewinnt er am Ende. Auch wenn der Anteil der Weißen an der US-Bevölkerung sinkt – sie stellen noch immer rund zwei Drittel der Wahlberechtigten. Doch dieser Dynamik entzieht sich Biden weitgehend. Er ist nicht darauf aus, Trump täglich entgegenzutreten. Dass er als politischer Charakter ein Gegenmodell ist, dieser Eindruck setzt sich auch ohne sein Zutun fest. Schließlich ist Joe seit Jahrzehnten eine Type in der US-Politik. Der Verlässliche, der Großvatertyp. . Die Devise „Bleib in deinem Keller in Delaware - and do no harm!“ könnte sich als die Siegesformel erweisen. Wahlkampfvideo mit Ex-Präsident Barack Obama schon immer Rassisten, die Präsident Biden bleibt weitgehend unsichtbar. Tragen auch den Bürgern „Do no harm!“ die Wahlkampfdynamik sich weiter so entwickele Abwärtssog in den Umfragen  Der Kumpel, der die Interessen der Arbeiterschaft im Blick hat",tagesspiegel
"""Hybrides Wirtschaftsmodell"" . Monopolkommission warnt vor Einfluss des Pekinger Staatskapitalismus",no_author,"29.07.2020, 17:28 Uhr",https://www.tagesspiegel.de/wirtschaft/hybrides-wirtschaftsmodell-monopolkommission-warnt-vor-einfluss-des-pekinger-staatskapitalismus/26048512.html,"Das Thema China spielt die Hauptrolle im diesjährigen Hauptgutachten der Monopolkommission. Das unabhängige Beratungsgremium der Bundesregierung hat das Land am Mittwoch in den Fokus seines Hauptgutachtens gestellt, das alle zwei Jahre erscheint. Der umfangreiche Titel des Werks: „Die Wettbewerbsordnung in Europa in Zeiten der Corona-Krise, des digitalen Wandels und wachsender Herausforderungen durch den   stärken.“ Allein 150 Seiten des 400 Seiten schweren Gutachtens befassen sich mit dem Thema „Chinas Staatskapitalismus“. Achim Wambach, Vorsitzender der Monopolkommission und Präsident des ZEW – Leibniz-Zentrum für Europäische Wirtschaftsforschung GmbH Mannheim, sieht darin eines der wichtigsten bisher kaum beachteten Themen. Im Fokus stehen in der Studie vor allem die  , die auf den europäischen Binnenmarkt drängen und ihn laut Wambach „durcheinanderbringen“. In einer Zusammenfassung beschreibt die Monopolkommission, dass das massive Eingreifen des chinesischen Staats in das Wirtschaftsgeschehen in seiner Bedeutung für die Weltwirtschaft bisher nicht genug beschrieben wurde, und sich dessen Markteingriffe immer stärker zum Nachteil für die europäischen Unternehmen auswirkten. Insbesondere geht es dabei um hoch  , die deutsche Unternehmen, denen unter Preisdruck die Innovationsfähigkeit genommen werde, aus dem Markt drängen. Insgesamt verstärke sich auch der Eindruck, dass China mit seiner „Sozialistischen Marktwirtschaft mit chinesischen Merkmalen“ ein hybrides Wirtschaftsmodell, das sowohl staatswirtschaftliche als auch marktwirtschaftliche Elemente enthält verfolge, so das Gutachten. Dadurch sei es dem chinesischen Staat möglich, zur Erreichung seiner industriepolitischen Ziele, auf vielfache Weise direkten Einfluss auf das Wirtschaftsgeschehen zu nehmen. Um diese Wettbewerbsverzerrung zu beseitigen, empfiehlt die Monopolkommission daher die Einführung eines Drittlandbeihilfeinstruments. Hinter dem komplizierten Begriff verbirgt sich folgender Mechanismus: Unternehmen, die Subventionen erhalten haben, müssten diese künftig anmelden und, laut Wambach, zurückzahlen oder an Brüssel abgeben. Dadurch wären drittstaatliche Subventionen, wie die, des chinesischen Staats an seine Unternehmen, denen der mitgliedstaatlichen in der EU weitgehend gleichgestellt. In der Vergangenheit hätte die deutsche Regierung eher einzelne Unternehmen geschützt, so Wambach. Das von der Monopolkommission entworfene Modell sei jedoch in der Lage, den gesamten EU-Binnenmarkt abzusichern. Da Deutschland derzeit die EU-Ratspräsidentschaft inne hat, erhofft sich die Monopolkommission, dass diese Empfehlungen auf offene Ohren stoßen. Nach den USA ist China derzeit der zweitgrößte Handelspartner der EU und die EU der größte Handelspartner Chinas.Auch sei der Anteil Chinas am weltweiten Warenexport zwischen den Jahren 2002 bis 2018 von sieben auf 17 Prozent gestiegen (ohne Berücksichtigung des Warenhandels zwischen den EU-Mitgliedstaaten).  Die kumulierten Direktinvestitionen der EU in China liegen bei 351 Milliarden Euro. Die von China in die EU bei 231 Milliarden Euro. Als weitere Maßnahmen empfiehlt die Monopolkommission die Anpassung von Fusionskontrollregeln, wenn es um chinesische Unternehmen geht, da diese häufig von politisch-strategischen, statt wirtschaftlichen Erwägungen getragen sind. Auch eine „Skepsis bei Offensivinstrumenten“ sieht die Kommission um Wambach als angemessen an. So würden Abwehrfusionen oder Defensivbeihilfen dem Binnenmarkt eher schaden. Die deutsche Beihilfekontrolle wäre damit ausgeschaltet. Es würde dadurch eine Hintertür geschaffen, die wiederum den Binnenmarkt kaputt macht. chinesischen Staatskapitalismus strategisch gelenkten Staatsunternehmen subventionierte chinesische Staatsunternehmen",tagesspiegel
Vor Erneuerung eines Abkommens mit Peking . Chinesische Hacker spähten offenbar Vatikan aus,no_author,"29.07.2020, 16:44 Uhr",https://www.tagesspiegel.de/politik/vor-erneuerung-eines-abkommens-mit-peking-chinesische-hacker-spaehten-offenbar-vatikan-aus/26048158.html,"Wenige Monate vor der möglichen Erneuerung eines Abkommens mit Peking ist   einem Bericht zufolge Ziel eines chinesischen Hackerangriffs geworden. Laut Recorded Future, einem US-Unternehmen für Cybersicherheit, gab es seit Mai eine Reihe unbefugter Zugriffe auf Netzwerke des Heiligen Stuhls und des katholischen Bistums Hongkong. Aus dem Vatikan war am Mittwoch keine Stellungnahme zu erhalten. Hinter den verdächtigen Aktivitäten soll RedDelta stehen, eine vom chinesischen Staat finanzierte Hackergruppe. Zweck war laut dem am Dienstag veröffentlichen Bericht, Informationen über die vatikanische Verhandlungsposition mit Blick auf das China-Abkommen und über die Haltung zur Demokratiebewegung in Hongkong zu bekommen. Auch Rechner des diplomatischen Vertreters des Vatikan in Hongkong und des Päpstlichen Missionsinstituts in Rom seien attackiert worden, hieß es weiter. Der vatikanische Informationsdienst Asianews bestätigte die Darstellung am Mittwoch und ergänzte, ebenfalls Cyberangriffe registriert, diese aber abgewehrt zu haben. Die Angriffe erfolgen laut Recorded Future nach der sogenannten Spear-Phishing-Methode. Dabei wurden einzelnen Personen und Büros gezielt E-Mails zugesandt, die zusammen mit unverdächtigen Dokumenten – teils Schreiben des vatikanischen Staatssekretariats – eine Spionagesoftware enthielten. Der Vatikan bemüht sich seit längerem um eine diplomatische Annäherung an China. Im September 2018 schlossen der Heilige Stuhl und die Regierung in Peking ein vorläufiges Abkommen, das vor allem Bischofsernennungen betrifft.  Bislang gab es in dieser Frage Spannungen über die „Patriotische Vereinigung“ regierungstreuer Katholiken und eine parallel bestehende Untergrundkirche,  . Auch hochrangige Katholiken wie Kardinal Joseph Zen Ze-kiun, früherer Bischof von Hongkong, kritisierten den Annäherungskurs als naiv und Verrat an den Untergrundchristen.  Der Vatikan selbst forderte Peking zwar unverblümt auf, sich seinerseits an das Abkommen zu halten, zeigte aber in anderen diplomatisch heiklen Fragen Zurückhaltung. Zu den unterdrückten Uiguren in China und der Freiheitsbewegung in Hongkong äußerte sich   bislang nicht. ( ) der Vatikan deren Mitglieder zu Rom hielten und dafür Repressalien und Verfolgung in Kauf nahmen Papst Franziskus  ",tagesspiegel
Deutsch-chinesische Studie in Wuhan . Weltweit erste Corona-Infizierte könnten dauerhaft immun sein,no_author,"21.07.2020, 11:57 Uhr",https://www.tagesspiegel.de/wissen/deutsch-chinesische-studie-in-wuhan-weltweit-erste-corona-infizierte-koennten-dauerhaft-immun-sein/26023060.html,"Coronavirus-Patienten haben einer Studie zufolge in vielen Fällen dauerhaft so viele Antikörper, dass eine erneute Infektion mit dem Virus vermutlich abgewehrt werden kann. Zu diesem Ergebnis kommt eine noch unveröffentlichte Studie an 327 Covid-19-Patienten im chinesischen Wuhan, die zu den weltweit ersten infizierten Menschen gehören.  Bei mehr als 80 Prozent der Patienten seien sechs Monate nach ihrer Erkrankung noch biologisch aktive Antikörper nachgewiesen worden, die fähig seien, das Virus unschädlich zu machen, sagte der Virologe Ulf Dittmer, Direktor des Instituts für Virologie der Uniklinik Essen. An der Studie des deutsch-chinesischen Gemeinschaftslabors in Wuhan waren neben chinesischen Experten auch drei Virologen aus Essen beteiligt, darunter Mirko Trilling. Die Ergebnisse der Untersuchung sollen in den nächsten Tagen einem Fachmagazin zur Begutachtung vorgelegt werden. Die untersuchten Patienten seien alle im Krankenhaus behandelt worden und hätten leichte oder schwere Symptome gezeigt, so Dittmer. Die Bildung der Antikörper habe dem entsprochen, was man auch von anderen Viruserkrankungen kenne, sagte der Virologe.  „Eine Antikörper-Antwort gegen Viren wird in der Regel schnell hervorgerufen. Die Menge an Antikörpern steigt erst sehr stark an, erreicht einen Höhepunkt, fällt danach wieder ab und stabilisiert sich dann auf einem Niveau, das meistens noch Schutz gegen eine neue Infektion vermitteln kann“, so Dittmer. In den letzten zwei bis drei Monaten des jeweils sechsmonatigen Untersuchungszeitraums bei den chinesischen Covid-19-Patienten sei die Antikörper-Menge relativ stabil geblieben. „Ich glaube, dass daraus folgt, dass wir zumindest eine Zeit lang von einer Immunität nach einer durchgemachten Erkrankung ausgehen können“, sagte Dittmer weiter. Dies könne auch bedeuten,   – sofern der Impfstoff in der Lage ist, ähnlich stabile Antikörper-Antworten wie eine Covid-19-Erkrankung auszulösen.  Wie lange solch eine Immunität anhalte, sei noch unbekannt. „Nach der aktuellen Studie muss man aber zumindest von mehreren Monaten, vermutlich eher Jahren, ausgehen.“ Derzeit werde bei anderen Corona-Virustypen diskutiert,  .  Dies sei aber noch nicht ausreichend untersucht worden. Dittmer betonte, dass weltweit bislang noch kein eindeutiger Fall bekannt sei, bei dem ein genesener Patient erneut mit dem Sars-CoV-2-Virus infiziert wurde. Dies würde ebenfalls für eine anhaltende Immunität sprechen. , die die Hoffnung auf eine lang anhaltende Immunität und damit auch auf eine lange Wirksamkeit einer möglichen Impfung gedämpft hatten. So hatten Bluttests der ersten Coronavirus-Patienten in Deutschland, die Ende Januar in der München Klinik Schwabing behandelt wurden, in einigen Fällen ein deutliches Absinken der Anzahl von sogenannten neutralisierenden Antikörpern im Blut gezeigt. Insbesondere nach ermutigenden Zwischenergebnissen mit ersten Coronavirus-Impfstoffen sehen viele Forscher darin dennoch die stärkste künftige Waffe gegen die Krankheit. „Die einzige Illusion, die man nehmen muss, ist, dass eine Impfung gegen Covid-19 ein Leben lang hält“, sagte Clemens Wendtner, Chefarzt der Klinik für Infektiologie in der München Klinik Schwabing.  „Es könnte auch bei einem Covid-19-Impfstoff sein, dass man wie bei der Influenza-Schutzimpfung regelmäßig wieder geimpft werden muss.“ Es sei nicht ungewöhnlich, dass Impfungen nicht jahrelang hielten, sondern regelmäßig aufgefrischt werden müssten. „Man sollte sehen, was eine Impfung für uns alle bewirken kann“, sagte Wendtner. Auch nach den ermutigenden Zwischenergebnissen bei der Impfstoffsuche erwarteten Experten einen in der Breite einsetzbaren und zugelassenen Impfstoff frühestens im Lauf des kommenden Jahres. „Es ist also auch weiterhin Geduld und Verständnis für die wichtigen Schutzmaßnahmen eines jeden Einzelnen gefragt.“ Chinesische Forscher hatten im Fachblatt „Nature Medicine“ berichtet, dass die Antikörper nach zwei Monaten vor allem bei Patienten mit symptomfreiem Verlauf stark zurückgingen, aber auch bei tatsächlich erkrankten Patienten fielen die Werte. Patienten mit wenig Symptomen hatten zudem weniger Antikörper und somit eine schwächere Immunantwort entwickelt. Symptomfreie Patienten wurden in der neuen Studie aus Essen/Wuhan allerdings nicht untersucht.  dass eine Impfung einen länger anhaltenden Schutz vermitteln könne dass eine Immunität nur wenige Jahre anhalte In den vergangenen Wochen waren Untersuchungen bekannt geworden",tagesspiegel
USA fordert Schließung des Konsulats . Chinesische Diplomaten sollen Dokumente in Houston verbrannt haben,no_author,"22.07.2020, 15:58 Uhr",https://www.tagesspiegel.de/politik/usa-fordert-schliessung-des-konsulats-chinesische-diplomaten-sollen-dokumente-in-houston-verbrannt-haben/26026308.html,"Nach der angeordneten Schließung des chinesischen Konsulats in der texanischen Stadt Houston haben Chinas Diplomaten nach amerikanischen Medienberichten auf dem Gelände Dokumente verbrannt. Chinas Außenamtssprecher Wang Wenbin wollte die Berichte am Mittwoch auf Fragen von Journalisten in Peking nicht bestätigen, sondern sagte nur, das Konsulat arbeite „normal“. Nach den US-Berichten haben Polizei und Feuerwehr in Houston auf Berichte von Anwohnern über das Feuer reagiert, das Gelände aber nicht betreten können. Augenzeugen hätten berichtet, dass im Hof des Konsulats in Mülltonnen Dokumente verbrannt worden seien. Auch sei Rauch aufgestiegen, hieß es. Zuvor hatte Wang Wenbin berichtet, dass die USA China aufgefordert habe, das Konsulat in der texanischen Stadt Houston zu schließen. Nach chinesischen Medienberichten wurde den Diplomaten nur 72 Stunden gegeben, die USA zu verlassen. Der Außenamtssprecher sprach vor der Presse in der chinesischen Hauptstadt von einer „ “. „Wir fordern die USA auf, ihre falsche Entscheidung sofort zurückzuziehen“, sagte der Sprecher. „Anderenfalls wird China eine legitime und notwendige Reaktion geben.“ Die einseitige Schließung eines Konsulats in einer derart kurzen Zeit sei eine „ “.   Die Schließung erfolge, „um geistiges amerikanisches Eigentum und private amerikanische Informationen zu schützen“, teilte die Sprecherin des US-Außenministeriums, Morgan Ortagus, mit.  Nach der Wiener Konvention hätten Diplomaten die Gesetze und Vorschriften des jeweiligen Gastlandes zu respektieren. Auch hätten sie die Pflicht, „sich nicht in innere Angelegenheiten des Staates einzumischen“. Vermutet wird, dass China als Gegenmaßnahme amerikanische Diplomaten ausweisen wird. Aus dem US-Außenministerium hieß es weiter, die chinesische Regierung führe seit langem illegale Operationen zur Spionage und zur Einflussnahme in den USA aus. Diese hätten in den vergangenen Jahren deutlich zugenommen. Regierungsvertreter hätten sich unter anderem in die US-Innenpolitik eingemischt, geistiges Eigentum gestohlen, amerikanische Manager unter Druck gesetzt und Familien von Amerikanern mit chinesischen Wurzeln in China bedroht. Die Entscheidung verschärft die Spannungen zwischen den beiden größten Volkswirtschaften, die schon wegen Chinas Umgang mit dem Ausbruch des Coronavirus, der Handelspolitik und dem harten chinesischen Vorgehen in Hongkong und in Xinjiang im Streit liegen. Das Verhältnis ist aus chinesischer Sicht so schlecht wie seit Aufnahme der diplomatischen Beziehungen 1979 nicht mehr. Das US-Justizministerium hatte am Dienstag eine Anklage veröffentlicht, in der zwei chinesischen Hackern der Diebstahl von Geschäftsgeheimnissen und geistigem Eigentum im Wert von Hunderten Millionen Dollar vorgeworfen wird. Die beiden in China lebenden Beschuldigten seien vom Ministerium für Staatssicherheit unterstützt worden. Sie hätten zuletzt Unternehmen ins Visier genommen, die in der Corona-Pandemie an Impfstoffen und Behandlungsmethoden arbeiteten. Seit einiger Zeit schon belästigten die USA das diplomatische und konsularische Personal Chinas, kritisierte Wang Wenbin. Auch sei diplomatische Post, die eigentlich geschützt ist, mehrfach geöffnet worden. Auch seien dabei Gegenstände konfisziert worden. Die einseitige Schließung eines Konsulats in einer derart kurzen Zeit sei eine „beispiellose Eskalation des jüngsten Vorgehens gegen China“. Die USA hätten im vergangenen Oktober und im Juni schon zweimal Beschränkungen gegen diplomatisches Personal erlassen, beklagte der Außenamtssprecher. Er warf amerikanischen Diplomaten in China seinerseits vor, sich in China „einzumischen“ und die Gesellschaft zu „infiltrieren“. Auch gebe es mehr Personal in den diplomatischen Missionen der USA in China als umgekehrt. Das Konsulat in Houston ist vergleichsweise groß – mit Dutzenden von Diplomaten. Es dient den Südstaaten der USA. Allerdings ist die Visavergabe wegen der Corona-Pandemie ohnehin eingestellt, da China die Grenze für Ausländer seit März praktisch dicht gemacht hat. Im diplomatischen Geschäft folgt auf eine drastische Maßnahme wie die Schließung eines Konsulats oder die Ausweisung von Diplomaten meist eine ähnliche Gegenreaktion, so dass eines der fünf Konsulate der USA in China in Chengdu, Guangzhou, Shanghai, Shenyang und Wuhan von Vergeltungsmaßnahmen betroffen sein könnten. ( ) politischen Provokation beispiellose Eskalation des jüngsten Vorgehens gegen China",tagesspiegel
