title,author,date_published,url,article_text,source
Peking kontert . Trump unterzeichnet Sanktionsgesetz gegen China,no_author,"15.07.2020, 08:12 Uhr",https://www.tagesspiegel.de/politik/peking-kontert-trump-unterzeichnet-sanktionsgesetz-gegen-china/26005158.html,"Im   hat US-Präsident Donald Trump ein Sanktionsgesetz gegen China unterzeichnet. Damit solle China für „repressive Aktionen“ gegen die Menschen in Hongkong zur Rechenschaft gezogen werden, sagte Trump am Dienstagabend (Ortszeit) im Weißen Haus.  Das Gesetz gebe der Regierung wirksame neue Werkzeuge, um gegen Personen und Institutionen vorzugehen, „die Hongkongs Freiheiten auslöschen“. Der Senat und das Repräsentantenhaus hatten das Hongkong-Autonomiegesetz zuvor einstimmig verabschiedet. Zudem erklärte Trump, er habe eine Verfügung unterzeichnet, die alle Vorzugsbehandlungen für Hongkong beende. Die Millionenmetropole werde künftig wie ein Teil Chinas behandelt, sagte der Präsident. Die Regierung hatte diesen Schritt bereits angekündigt. Chinas Regierung kündigte als Vergeltung ihrerseits Strafmaßnahmen gegen „betreffende Bürger und Einrichtungen der USA“ an. Ein Außenamtssprecher verurteilte am Mittwoch in Peking scharf das Sanktionsgesetz der USA. China müsse die „notwendige Antwort“ geben, um seine legitimen Interessen zu schützen. Die Strafmaßnahmen sollen sich nach früheren Erläuterungen gegen Personen und Institutionen in den USA richten, die sich in Hongkong-Fragen „schlecht benehmen“. Auslöser des Streits ist das umstrittene Gesetz zum Schutz der nationalen Sicherheit in Hongkong, das Peking Ende Juni erlassen hatte. Es richtet sich gegen Aktivitäten in der chinesischen Sonderverwaltungsregion, die von Peking als subversiv, separatistisch oder terroristisch angesehen werden. Auch soll es „heimliche Absprachen“ von Aktivisten mit Kräften im Ausland bestrafen. Das Gesetz gibt Chinas Staatssicherheit weitreichende Vollmachten, eigenmächtig in Hongkong zu operieren und zu ermitteln. Als Reaktion hatten das Repräsentantenhaus und der Senat das Sanktionsgesetz ohne Gegenstimmen verabschiedet. Es sieht Sanktionen vor, nach denen der Besitz von chinesischen Funktionären in den USA eingefroren und ihnen die Einreise in die Vereinigten Staaten verwehrt werden kann.  Auch gegen ausländische Banken, die aus US-Sicht zu Chinas Bestrebungen beitragen, die Autonomie Hongkongs zu untergraben, können Strafmaßnahmen verhängt werden. So kann US-Finanzinstitutionen untersagt werden, ihnen Kredite zu geben. Trump erklärte ferner, er habe eine Verfügung unterzeichnet, die wegen der Einmischung Chinas alle Vorzugsbehandlungen für Hongkong beende. Die Millionenmetropole werde künftig wie ein Teil Chinas behandelt, sagte der Präsident. Die Regierung hatte diesen Schritt bereits im Mai angekündigt.  Neben den Exportkontrollen soll dies auch Zölle und die Vergabe von Visa betreffen, hatte es damals geheißen. In Hongkong wird jetzt befürchtet, dass der Schritt dazu führen könnte, dass die Strafzölle der USA im Handelsstreit mit China auch auf Exporte aus der Sonderverwaltungsregion ausgeweitet werden. Die neuen US-Maßnahmen verschärfen die Spannungen zwischen den USA und China weiter. Trump machte China am Dienstag auch erneut für die weltweite Verbreitung des Coronavirus verantwortlich. Der US-Präsident sagte auch auf eine Frage, er habe nicht vor, mit dem chinesischen Staats- und Parteichef Xi Jinping zu sprechen. Die frühere britische Kronkolonie wird seit der Rückgabe 1997 an China weitgehend autonom nach dem Grundsatz „ein Land, zwei Systeme“ verwaltet. Die USA sehen in dem von Peking   aber eine klare Verletzung von Hongkongs Autonomie und Freiheitsrechten. Mit dem Vorhaben plant Peking, das Hongkonger Parlament zu umgehen. Die USA hatten sich bereits im vergangenen Jahr hinter die Bemühungen zur Bewahrung der Demokratie in Hongkong gestellt. Der US-Kongress hatte fast einstimmig zwei Gesetze beschlossen, die die   unterstützen sollten. Trump hatte die Gesetze im November unterzeichnet. China hatte gegen die „unverhohlene Einmischung in innere Angelegenheiten“ protestiert.  Streit um die Autonomie Hongkongs geplanten Sicherheitsgesetz Proteste in der asiatischen Metropole",tagesspiegel
"""Zynische Geopolitik"" in Syrien . Machtspiele auf Kosten der Hungernden",Thomas Seibert,"12.07.2020, 17:26 Uhr",https://www.tagesspiegel.de/politik/zynische-geopolitik-in-syrien-machtspiele-auf-kosten-der-hungernden/25998094.html,"Ein Lastwagen nach dem anderen rollt durch das Tor am Grenzübergang Bab al Salam von der Türkei nach Syrien. Die 31 Fahrzeuge bringen medizinische Hilfsgüter für Hunderttausende Menschen in die Gegend nördlich der syrischen Großstadt Aleppo. Mark Cutts, bei der Uno für die Koordinierung der Syrien-Hilfe zuständig, schaut den Lastwagen zu. Seit sechs Jahren werde Bab al Salam von der Uno genutzt, sagt er in einem Videoclip auf Twitter.  Es sei äußerst wichtig, diese Hilfe fortzusetzen. Doch es ist wohl der letzte Lastwagen-Konvoi der Uno an diesem Grenzübergang. Nur wenige Stunden nach der Videobotschaft vom Samstag beschließt der Sicherheitsrat in New York, Bab al Salam für Hilfslieferungen zu schließen. Nach langen Verhandlungen einigte sich das UN-Entscheidungsgremium in der Nacht zum Sonntag darauf, wie   in den nächsten zwölf Monaten geregelt werden soll.    als ständige Mitglieder des Sicherheitsrates benutzt, um ihren Willen durchzusetzen. Deutschland und Belgien als Verfasser des Resolutionsentwurfes beugten sich schließlich dem Druck: Bab al Salam wird geschlossen, sodass die gesamte Hilfe für Nordwest-Syrien über einen einzigen Grenzübergang, Bab al Hawa, aus der Türkei abgewickelt werden muss.  Zwar sei ein Übergang nicht genug, erklärten Berlin und Brüssel nach dem Votum. Aber die Schließung aller Übergänge, die bei einer Blockade im Sicherheitsrat gedroht hätte, wäre noch schlimmer gewesen. Schon im Januar hatte der UN-Sicherheitsrat auf Druck Russlands und Chinas die Zahl der Grenzübergänge, über die Hilfsgüter in syrische Rebellengebiete gebracht werden dürfen, von damals vier auf zwei reduziert. Jetzt bleibt nur noch Bab al Hawa übrig. Russland und China fordern, dass Hilfsgüter über die von der Regierung kontrollierten Gebiete Syriens verteilt werden sollten.  Der Westen lehnt dies ab, weil dieses Verfahren die Menschen in Gegenden wie der Rebellenprovinz Idlib zu Geiseln des syrischen   machten. Till Küster, Nahost-Koordinator der deutschen Hilfsorganisation Medico International, kritisierte Moskau und Beijing: „Es ist nicht das erste Mal, dass im syrischen Krieg ganze Gebiete und Städte von Hilfe abgeschnitten werden.“ In anderen Regionen sei diese Strategie benutzt worden, um Rebellen, Oppositionelle und Zivilisten zur Aufgabe zu zwingen. „Ähnlich verhält es sich nun in Idlib, Leider in weit größerem Maßstab.“ Das sei „zynische Geopolitik“. Ein Zusammenschluss von Hilfsorganisationen kritisierte die UN-Entscheidung ebenfalls. Viele Menschen würden ab sofort nicht mehr die Hilfe erhalten, auf die sie dringend angewiesen seien. „Menschen werden ihr Leben verlieren. Das Leid wird schlimmer“, hieß es in einer gemeinsamen Erklärung von Organisationen, die in Syrien tätig sind. Der UN-Sicherheitsrat solle mehr Hilfe für den Norden Syriens ermöglichen „und aufhören, auf dem Rücken der Menschen politische Spielchen zu spielen“. Allein in Idlib an der Grenze zur Türkei drängen sich rund drei Millionen Flüchtlinge, die sich im letzten Rebellengebiet Syriens vor Assads Truppen in Sicherheit gebracht haben. Viele leben in Zelten, andere suchen Schutz in halb zerstörten Gebäuden. Zu Hunger und Angriffen der Regierungstruppen kommt jetzt eine weitere Gefahr: In Idlib sind die ersten Infektionen mit dem Coronavirus festgestellt worden.  Zuerst wurde vorige Woche ein Arzt aus einem Krankenhaus in der Nähe des Grenzübergangs Bab al Hawa positiv getestet, wenig später zwei Kollegen aus derselben Klinik. Nach unbestätigten Berichten steckte sich auch eine Krankenschwester an.  Sollte dies der Beginn einer Corona-Welle im Nordwesten Syriens sein, wären Gesundheit und Leben von Hunderttausenden in Gefahr. „Es gibt weitverbreitete Mangelernährung, sehr schlechte hygienische Zustände und ein vollkommen überlastetes, durch Angriffe gezielt zerstörtes Gesundheitssystem“, sagte Küster von Medico International. Die amerikanische Syrien-Expertin Elizabeth Tsurkov schrieb auf Twitter, es gebe in Idlib nur ein einziges Corona-Testgerät und einen Arzt, der die Untersuchungen vornehme.  Laut der Weltgesundheitsorganisation WHO gibt es im Nordwesten Syriens 203 Beatmungsgeräte. Idlib sei „einer der elendsten Orte der Welt“, schrieb Tsurkov. Mit der Entscheidung des Sicherheitsrates könnte es jetzt noch schlimmer werden. die UN-Hilfe für Rebellengebiete in Syrien Russland und China hatten ihr Veto Diktators Baschar al Assad",tagesspiegel
Russland setzt sich bei UN durch . Hilfe für Syrien wird fortgesetzt – aber stark eingeschränkt,no_author,"12.07.2020, 11:57 Uhr",https://www.tagesspiegel.de/politik/russland-setzt-sich-bei-un-durch-hilfe-fuer-syrien-wird-fortgesetzt-aber-stark-eingeschraenkt/25997564.html,"Nach langem Streit hat sich der UN-Sicherheitsrat doch noch auf  geeinigt. Die Lösung, die einem Sieg Russlands gleichkommt, könnte jedoch nach Einschätzung von Hilfsorganisationen die Versorgung von Millionen Notleidenden gefährden. Das mächtigste UN-Gremium stimmte am Samstag (Ortszeit) für einen deutsch-belgischen Resolutionsvorschlag  . Deutschlands Außenminister Heiko Maas zeigte sich angesichts der Einigung trotzdem erleichtert. Die angenommene Regelung sieht die Offenhaltung von nur noch einem Grenzübergang aus der Türkei für Hilfslieferungen nach Nordsyrien über einen Zeitraum von zwölf Monaten vor. Das entspricht in einem Kernpunkt den Forderungen Russlands. Moskau – einer der wichtigsten Verbündeten Syriens – hatte in den vergangenen Tagen mehrere deutsche Vorschläge mit zwei Grenzübergängen zusammen mit China durch Vetos verhindert. Hintergrund ist eine seit 2014 bestehende UN-Resolution, die in der Nacht zu Samstag nach sechs Jahren zunächst ausgelaufen war. Sie erlaubte es den Vereinten Nationen, wichtige Hilfsgüter über Grenzübergänge auch in Teile Syriens zu bringen, die nicht von der Regierung kontrolliert werden. Nach russischem Widerstand wurden die einst vier Übergänge Anfang des Jahres bereits auf zwei reduziert – seitdem hat sich die Versorgungslage für einige Regionen Hilfsorganisationen zufolge deutlich verschlechtert. Dies könnte sich mit der Einigung vom Samstag zuspitzen, denn im Nordwesten Syriens sind nach UN-Angaben 2,8 Millionen Menschen auf humanitäre Hilfe angewiesen. „Beide Grenzübergänge sind erforderlich, um die Lieferung aufrechtzuerhalten“, hatte UN-Nothilfekoordinator Mark Lowcock Ende Juni vor dem Sicherheitsrat gesagt. Der Übergang Bab al Salam, der nun geschlossen wird, hätte den direkten Zugang in eine Region mit einer der höchsten Zahlen an Vertriebenen gesichert. Syrien betont immer wieder, dass die Lieferungen auch dort agierenden Terroristen zukämen. Außenminister Maas bezeichnete es als „gute Nachricht für Millionen von Menschen“, dass der Kompromissvorschlag angenommen wurde. Das sahen die meisten Mitglieder des UN-Sicherheitsrates in einer hitzigen Diskussion nach der Annahme der Resolution anders. Deutschlands Botschafter Christoph Heusgen, der die Verhandlungen geleitet hatte, gab den Vertretern Russlands und Chinas eine Nachricht für ihre Regierungen mit: „Sagt ihnen, dass der deutsche Botschafter fragt, ob die Leute, die die Anweisungen dafür gegeben haben, 500.000 Kindern die Hilfe zu entziehen, morgen noch in den Spiegel gucken können.“ Zuvor hatte der russische Vertreter Dmitri Poljanski Deutschland und Belgien Heuchelei vorgeworfen und auch, bei den Verhandlungen ungeschickt und respektlos gehandelt zu haben. Ein chinesischer Diplomat sagte: „Botschafter Christoph, wir brauchen ihre Vorhaltungen nicht.“ Die Vertreter der USA und Großbritanniens äußerten sich enttäuscht über den Kompromiss, der den Bedürfnissen der syrischen Bevölkerung nicht gerecht werde. Kritik an der Entscheidung in New York kam von der Hilfsorganisation Save the Children. „Dies ist nicht die Zeit, Hilfe zu reduzieren“, sagte ihr Leiter Inger Ashing. „Während die Verlängerung um zwölf Monate statt sechs willkommen ist, ist es inakzeptabel, dass es jetzt nur einen nutzbaren Grenzübergang gibt.“ Das Leben von Millionen syrischer Kinder hänge von dieser Rettungsleine ab, nun müssten sie die Konsequenzen ertragen. Ashing forderte den Sicherheitsrat auf, die Entscheidung zu ändern. Das Gremium müsse „aufhören, Politik zu spielen und das Leben von Kindern an erste Stelle setzen“. Russland hatte in den schwierigen Verhandlungen der vergangenen Wochen eine stärkere Verhandlungsposition und machte deutlich, dass es auch ein Scheitern der Verlängerung der humanitären Hilfe in Kauf nehmen würde – das wollte Deutschland auf jeden Fall vermeiden. Moskau verfolgt den Ansatz, den Mechanismus wegen des wachsenden Einflusses der syrischen Regierung schrittweise auslaufen zu lassen. Die Einstellung oder Beschneidung der UN-gesteuerten Hilfe würde die Position von Moskaus verbündeten   nach Einschätzung von Beobachtern stärken. Seit Ausbruch des Syrienkriegs im März 2011 sind Schätzungen zufolge mindestens 500.000 Menschen ums Leben gekommen. Die Regierungsanhänger kontrollieren mittlerweile wieder rund zwei Drittel des Landes, darunter die großen Städte.   kommt in dem Land momentan noch die Coronavirus-Gefahr. In Idlib gaben die örtlichen Gesundheitsbehörden gerade den Nachweis eines ersten registrierten Coronavirus-Falls bekannt. Das syrische Pfund war in den vergangenen Monaten abgestürzt, die Preise stark gestiegen. Auch in den Regierungsgebieten klagen viele Syrer über eine mangelnde Versorgung mit Lebensmitteln und Medikamenten. Nach Schätzungen des Welternährungsprogramms WFP – einem humanitären Nebenorgan der UN – haben rund 9,3 Millionen Syrer nicht mehr genug zu essen und sind deshalb auf humanitäre Hilfe angewiesen – 1,4 Millionen mehr als sechs Monate zuvor. Die Lage im von Regierungsgegnern kontrollierten Nordwesten Syriens ist besonders angespannt. Anfang des Jahres waren rund eine Million Menschen vor einer Regierungsoffensive in die Region geflohen.   eine eingeschränkte Fortsetzung der humanitären Syrienhilfe bei Enthaltung unter anderem von Russland und China Machthaber Baschar al Assad Zu einer schweren Wirtschaftskrise",tagesspiegel
Schlimmste Regenfälle seit 60 Jahren . Mehr als 37 Millionen Menschen betroffen,no_author,"14.07.2020, 12:08 Uhr",https://www.tagesspiegel.de/gesellschaft/schlimmste-regenfaelle-seit-60-jahren-mehr-als-37-millionen-menschen-betroffen/26000720.html,"Nach Dutzenden Todesopfern durch Hochwasser entlang des Jangtse-Flusses in China haben am Dienstag zehntausende Einsatzkräfte gegen weitere folgenschwere Überschwemmungen in der Region gekämpft. Soldaten in Rettungswesten schleppten Sandsäcke zum Ufer des Poyang-Sees in der südöstlichen Provinz Jiangxi. In der Stadt Jiujiang, in deren Nähe der See in den Jangtse mündet, bauten sie einen mannshohen Damm. Staatsmedien zufolge wurden mehr als 100.000 Soldaten, Rettungskräfte und andere Menschen für den Hochwasserschutz mobilisiert. Rund die Hälfte von ihnen wurde zum Poyang-See geschickt, wo bereits viele Dämme und Deiche gebrochen sind. Der Poyang-See ist das größte Süßwassergewässer, das sich vollständig auf chinesischem Gebiet befindet. Die amtliche Nachrichtenagentur Xinhua berichtete, der Wasserstand des Sees habe bereits einen Rekord aus dem Jahr 1998 gebrochen, als in der Region mehr als 4000 Menschen bei Überschwemmungen ums Leben gekommen waren. Bereits seit Juni regnet es in der Region so heftig wie seit 60 Jahren nicht mehr. Bei vielen mit dem Jangtse verbundenen Gewässern wurden Rekord-Wasserstände gemessen. Nach Behördenangaben kamen bereits 141 Menschen ums Leben oder gelten als vermisst. Zudem führen mehr als 30 Flüsse im Zentrum und Osten Chinas inzwischen Rekord-Hochwasser mit sich, für mehr als 430 weitere Flüsse gelten Warnungen, wie das Ministerium für Wasserwirtschaft am Montag mitteilte. Heftiger Regen und Überschwemmungen begleiten jeden Sommer die Menschen in den betroffenen Regionen – vor allem im dicht besiedelten Jangtse-Becken. Seit Ende Juni regnet es aber praktisch ununterbrochen, und in der vergangenen Woche wurde der Regen so heftig, dass die Behörden ihre Warnstufen weiter erhöhten. Mehr als 28.000 Häuser sind demnach bereits zerstört und fast 38 Millionen Menschen betroffen. Aufnahmen im Staatsfernsehen zeigten am Wochenende zahlreiche überflutete Gemeinden und Städte. In einigen Gegenden reichte das Wasser bis zu den Dächern, in anderen wurden Häuser von Erdrutschen mitgerissen, die sich von den Hügeln lösten. Besonders betroffen sind die Megametropole Chongqing im Südwesten Chinas, die Provinzen Anhui, Zhejiang und Jiangsu im Osten sowie die Provinzen Jiangxi, Hunan und Hubei mit der Hauptstadt Wuhan im Landesinneren. Im elf Millionen Einwohner zählenden  , erreichte der Jangtse den dritthöchsten Pegel in seiner Geschichte – und dürfte in dieser Woche weiter anschwellen. Angesichts der dramatischen Lage rief Staatspräsident Xi Jinping die örtlichen Behörden auf, alle Kräfte zur Rettung gestrandeter Menschen und einem Ausbau des Hochwasserschutzes zu mobilisieren. . Die Regensaison sowie die Gletscherschmelze im Hochland von Tibet, seinem Quellgebiet, sorgen jeden Sommer für Überschwemmungen. Seit Jahrzehnten verschärft sich das Problem jedoch durch den Bau von Staudämmen und Schutzdeichen. Umweltschützer warnen zudem, dass die zunehmende Gletscherschmelze im Himalaya aufgrund der Klimaerwärmung zu weiteren Verheerungen führen dürfte.  Wuhan, dem Ausgangspunkt der Corona-Pandemie Der Jangtse ist nach dem Nil und dem Amazonas der drittlängste Fluss der Welt",tagesspiegel
Wegen nicht genehmigter Mahnwache . Demokratie-Aktivisten aus Hongkong vor Gericht,no_author,"13.07.2020, 13:14 Uhr",https://www.tagesspiegel.de/politik/wegen-nicht-genehmigter-mahnwache-demokratie-aktivisten-aus-hongkong-vor-gericht/25999940.html,"Weil sie eine nicht genehmigte Mahnwache zur Erinnerung an die brutale   auf dem Pekinger Tiananmen-Platz abhielten, sind 13 bekannte Hongkonger Demokratie-Aktivisten angeklagt worden.  Die Aktivisten erschienen am Montag in der Finanzmetropole vor Gericht, wo sie formell der  Anstiftung"" zu einer unrechtmäßigen Versammlung beschuldigt wurden. Dafür drohen ihnen bis zu fünf Jahre Haft. Anlässlich des Jahrestages der Niederschlagung der studentischen Pro-Demokratie-Proteste 1989 hatten sich Anfang Juni zehntausende Menschen in Hongkong einem Versammlungsgsverbot widersetzt.  Die Mahnwache findet seit Jahren in Hongkong statt und zieht gewöhnlich riesige Menschenmassen an. Mit dem wachsenden Druck aus Peking auf die halbautonome Stadt hat die symbolische Bedeutung der Veranstaltung in den vergangenen Jahren zugenommen. Die diesjährige Mahnwache war unter Verweis auf die Corona-Pandemie erstmals untersagt worden. Dennoch gingen tausende Hongkonger mit Kerzen auf die Straße. Später nahm die Polizei 13 führende Aktivisten fest. Das ist politische Verfolgung"", sagte der Angeklagte Lee Cheuk Yan. Das eigentliche Verbrechen habe die Kommunistische Partei Chinas vor 31 Jahren begangen. Einige der am Montag angeklagten Aktivisten stehen bereits im Zusammenhang mit den oft gewalttätigen pro-demokratischen Protesten des vergangenen Jahres vor Gericht. Die chinesischen Behörden bezeichnen die  . Anfang Juli setzten sie ein neues   in Kraft, das ein hartes Vorgehen gegen alle Aktivitäten erlaubt, die aus ihrer Sicht die nationale Sicherheit bedrohen. International wird das Gesetz scharf kritisiert. ( ) Niederschlagung der Proteste Proteste als vom Ausland gesteuerte Unruhen Sicherheitsgesetz für Hongkong „ „",tagesspiegel
