title,author,date_published,url,article_text,source
Asiens ignorierte Demokratie . Taiwan gehört in die Vereinten Nationen,no_author,"24.10.2021, 12:25 Uhr",https://www.tagesspiegel.de/meinung/asiens-ignorierte-demokratie-taiwan-gehoert-in-die-vereinten-nationen/27732320.html,"Qiao Guanhua lachte. Der 58-Jährige hatte in New York gerade hinter dem Schild mit der Aufschrift „China“ Platz genommen, im Rücken die Delegation Äquatorial-Guineas, vor sich die Kameras der Weltpresse, als er von den Journalisten gefragt wurde, wie er sich fühle an diesem 15. November 1971.  Mit dem Strahlen des siegreichen Diplomaten fragte der Gesandte Mao Zedongs aus Peking zurück, ob sein Gesichtsausdruck nicht Antwort genug sei. Der Tag besiegelte den Durchbruch der   auf internationaler Bühne. Als die   kurz zuvor – mit Resolution 2758 vom 25. Oktober 1971 – die Volksrepublik zur legitimen Vertreterin Chinas erklärten, gab es dafür gute Gründe. Bis dato hatten die UN die auf der Insel Taiwan regierende Republik China anerkannt. Dorthin war 1949 die von Chiang Kai-shek geführte nationalistische Kuomintang (KMT) geflohen, nachdem sie den Bürgerkrieg gegen   verloren hatte. Obwohl die KMT auf dem Festland fortan nichts mehr zu sagen hatte, hielt sie den Anspruch aufrecht, weiter Chinas wahre Regierung zu sein. Ihr tatsächliches Herrschaftsgebiet, Taiwan, regierte die KMT brutal und unter Einsatz dauerhaften Kriegsrechts. Taiwans Bevölkerung, die bis zur Machtübernahme durch Chiangs Republik unter japanischer Kolonialherrschaft gestanden hatte, erlebte die Zeit des „Weißen Terrors“. Die KMT agierte als weitenteils diktatorisches Regime.  Eine von den USA vorgeschlagene Zwei-Staaten-Lösung interessierte weder Peking noch Taipeh. 1971 stimmten die USA noch gegen die Anerkennung der Volksrepublik, 1979 nahm dann auch Washington diplomatische Beziehungen zu Peking auf. Die zu Taipeh sind bis heute gut – aber inoffiziell. Wer 2021 auf den Inselstaat blickt, stellt zweierlei fest. Erstens: Taiwan sitzt noch immer nicht in der UN-Generalversammlung. Zweitens: Das jetzige Taiwan hat mit dem damaligen wenig zu tun. Seit der Demokratisierung in den 1990er Jahren hat sich eine lebendige Zivilgesellschaft entwickelt, es gibt Meinungs- und Pressefreiheit, ein Parteienspektrum (die KMT sitzt in der Opposition).  Die überwältigende Mehrheit der Bevölkerung versteht sich nicht als chinesisch. In einer   sagten 63,3 Prozent, sie seien taiwanesisch, nur 2,7 Prozent definierten sich als chinesisch (31,4 Prozent: beides). Für eine schnelle oder spätere Vereinigung mit China sprachen sich gerade einmal   aus. Präsidentin Tsai Ing-wen ist Verfechterin des Status Quo: dem Erhalt der faktisch längst existierenden Unabhängigkeit bei gleichzeitigem Verzicht darauf – um des Friedens willen –, diese formal zu vollziehen. Wenn Chinas Staats- und Parteichef Xi Jinping nun behauptet, Taiwan gehöre seiner Regierung, ist das ebenso geschichtsvergessen, wie es umgekehrt größenwahnsinnig wäre, würde Tsai das Festland beanspruchen (was sie nicht tut). Denn entgegen verbreitetem Halbwissen hatte die Volksrepublik, von Mao bis Xi, nie irgendwelche Macht in Taiwan. Schon weil sie erst 1949 gegründet wurde, ist   falsch, genau wie die beliebte Bezeichnung Taiwans als „abtrünniger Provinz“. Eine militärische Einnahme wäre eine Annexion. Die gut 150 Militärflugzeuge, die China Anfang Oktober durch Taiwans Luftüberwachungszone schickte, sind eine Eskalation, die auch Deutschland nicht kalt lassen darf. Xi, der sich als größter Herrscher seit Mao verewigen will, macht klar, dass ihm Hongkong, wo er die  , auf Dauer nicht genügt. Bis 2025, warnt Taiwans Verteidigungsminister, könnte China zum Angriff bereit sein. US-Präsident Joe Biden hat gerade ungewohnt deutlich die   betont, Taiwan im Falle eines Angriffs zu verteidigen. US-Militärs bilden bereits taiwanesische Soldaten aus. Doch Deutschland darf sich nicht damit begnügen, dass die USA ihre Flügel schützend über Taiwan ausbreiten werden (zumal das Weiße Haus Bidens Äußerung wenig später relativierte), ist dies auch noch so alte deutsche Tradition. Die Regierung Merkel gab sich meist damit zufrieden, nach Gipfeltreffen zu betonen, man habe „das Thema Menschenrechte“ angesprochen, sei es mit Blick auf  , wo China Hunderttausende Uiguren einsperrt, oder Hongkong. Was Taiwan angeht, erinnerte man schmallippig an die Ein-China-Politik. Symptomatischer Tiefpunkt im April 2020:  , war sich Regierungssprecher Steffen Seibert in der Bundespressekonferenz zu schade, das Wort „Taiwan“ auch nur auszusprechen. Die Kanzlerin selbst äußert sich öffentlich nicht zu Taiwan. China hat sich von schüchtern erhobenen Zeigefingern ohnehin nie beeindrucken lassen, erst recht nicht, wenn Merkel oder ihre Minister auf Chinareisen  . Das Signal war ein Festhalten an der hinlänglich als Illusion entlarvten Losung „Wandel durch Handel“, die schon Merkels Vorgänger Schröder zum Leisetreten gegenüber Peking motiviert hatte. Die neue Bundesregierung muss eine klarere Sprache finden. Es ist höchste Zeit, dass sich Deutschland schärfer für Taiwans multilaterale Teilhabe einsetzt. Das EU-Parlament hat in dieser Woche den richtigen Ton gesetzt: Mit   votierte es für eine engere Partnerschaft mit Taiwan. Nicht nur die Pandemie hat gezeigt, was der Staatengemeinschaft entgeht, wenn Taiwan nicht mit am Tisch sitzt. Allenthalben wurde der Staat für seine Viruseindämmung gelobt. Aber weil er etwa bei der WHO keinen Sitz hat, konnte er seine Expertise nicht teilen. Taiwans Ersuchen einer UN-Mitgliedschaft, das offiziell seit 2007 ruht, wurde kürzlich von Außenminister Jaushieh Joseph Wu angedeutet. Taiwan, schrieb er  , dürfe nicht länger aus dem UN-System exkludiert werden. Die Resolution von 1971, über die der Volksrepublikaner Qiao so herzlich lachen konnte, behandle lediglich die Repräsentation Chinas, nicht die Taiwans. Der Wortlaut gibt Wu recht. Geradezu absurd sei es, dass selbst taiwanesische Journalisten keine Akkreditierung für UN-Gelände erhalten können. Der Menschenverstand gibt ihm recht. Präsidentin Tsai sagte in ihrer Rede am taiwanesischen Nationalfeiertag jüngst, ihr Land sei „nicht mehr das Waisenkind Asiens“. Das stimmt – weil sich zuletzt etwa die EU-Staaten Litauen und Tschechien Taiwan zugewandt haben; weil Australien und Japan ihre Beziehungen zu Taiwan stärken;  . Und es stimmt nicht – weil die 23,5 Millionen Einwohner Taiwans vor der weltweit wichtigsten Versammlung keine Stimme haben. Das ist ein Missstand, den eine außenpolitisch glaubhafte Bundesregierung nicht mit Achselzucken oder Kritik im Flüsterton quittieren darf. Sie muss sich entschieden   – mit dem kurzfristigen Ziel des Beobachterstatus und dem langfristigen Ziel der UN-Mitgliedschaft. Chinas militärische Drohgebärden müssen ein Weckruf sein. Wer sich ausmalt, was Taiwan bevorsteht, wenn Peking im Wissen um die internationale, auch deutsche, Passivität ernst macht, dem bleibt das Lachen im Halse stecken. Volksrepublik China Vereinten Nationen Maos Kommunisten 2019 legalisierte Taiwan als erstes asiatisches Land die Ehe für alle. aktuellen Umfrage der National Chengchi University 7,4 Prozent der oft kolportierte Begriff „Wiedervereinigung“ Demokratie schon rasant beseitigt hat „Verpflichtung“ seines Landes Xinjiang Nachdem Taiwan Deutschland eine Million Corona-Masken geschenkt hatte wieder einmal Top-Manager im Gepäck hatten 580 zu 26 Stimmen in einem Artikel weil die G7 für Taiwans Teilnahme an WHO-Foren plädiert haben für Taiwans Inklusion auf multilateraler Ebene aussprechen",tagesspiegel
Buch über Xi Jinping . Scharfe Kritik nach Absage von Lesung an den Unis Duisburg und Hannover,no_author,"25.10.2021, 16:33 Uhr",https://www.tagesspiegel.de/politik/buch-ueber-xi-jinping-scharfe-kritik-nach-absage-von-lesung-an-den-unis-duisburg-und-hannover/27736438.html,"Die Absage einer Lesung aus einem Buch über den   durch die Konfuzius-Institute in Hannover und Duisburg hat zu scharfen Reaktionen in Hochschulen und Politik geführt. Die Leitung der Leibniz Universität Hannover nannte die Absage in einer Mitteilung vom Montag „nicht akzeptabel, befremdlich und unverständlich“. Auch von FDP und CDU in Niedersachsen kam Kritik. Die Journalisten Stefan Aust und Adrian Geiges wollten am Mittwoch ihre Biografie „Xi Jinping - der mächtigste Mann der Welt“ in einer Online-Lesung parallel in Hannover und Duisburg vorstellen. Medienberichten zufolge erhielten die veranstaltenden Konfuzius-Institute jedoch kurzfristig die Anweisung aus China, dass diese Lesung auf keinen Fall stattfinden dürfe.   Dabei soll es nicht um einen möglicherweise kritischen Inhalt des Buches gegangen sein, sondern um eine in China um Xi Jinping herrschende nahezu kultische Verehrung. Über ihn dürfe nicht als normalen Menschen gesprochen oder geschrieben werden. Das   und dem Ministerium für Bildung unterstellt. Offizielles Ziel ist es, die chinesische Sprache und Kultur zu fördern und einen kulturellen Austausch zu ermöglichen. In Deutschland gibt es rund 20 Konfuzius-Institute. Sie sind oft deutschen Hochschulen angegliedert. Die Leibniz Universität Hannover war nach eigenen Angaben nicht über die Planung der Veranstaltung ihres örtlichen Kooperationspartners Leibniz-Konfuzius-Institut informiert oder in die Absage involviert. Die Hochschule verstehe sich als weltoffene Universität mit Raum für kritischen wissenschaftlichen Diskurs und Austausch, hieß es. „Jeglicher Versuch der politischen Einflussnahme auf Forschung, Lehre und Öffentlichkeitsarbeit der Leibniz Universität durch ausländische Regierungen ist dabei strikt zurückzuweisen“, heißt es in der Mitteilung. Die Hochschulleitung werde zeitnah das Gespräch mit dem Direktorium des Leibniz-Konfuzius-Institutes suchen, um die mögliche weitere Zusammenarbeit zu überprüfen. Gleichzeitig lud die Universität die Autoren und den Verlag ein, die Lesung „mit ihr als Gastgeberin“ nachzuholen. Der niedersächsische Wissenschaftsminister Björn Thümler (CDU) sagte laut NDR über den Vorfall: „In Deutschland herrschen Wissenschafts- und Meinungsfreiheit. Jeder, der bei uns lebt und lehrt, sollte sich dessen bewusst sein. Daher ist die Absage der Vorlesung an den beiden Konfuzius-Instituten nicht akzeptabel.“ Die FDP im niedersächsischen Landtag hat dazu nach eigenen Angaben bereits eine Anfrage an das Wissenschaftsministerium gerichtet. Die chinesische Intervention sei ein „beunruhigender Eingriff in unsere Wissenschafts- und Kulturfreiheit“, sagte der FDP-Abgeordnete Lars Alt.  chinesischen Staatschef Xi Jinping Konfuzius-Institut ist eine staatliche chinesische Bildungsorganisation",tagesspiegel
Reich durch Wasser und Tiktok . Jeden Tag ein neuer Dollar-Milliardär in China,no_author,"27.10.2021, 12:30 Uhr",https://www.tagesspiegel.de/wirtschaft/reich-durch-wasser-und-tiktok-jeden-tag-ein-neuer-dollar-milliardaer-in-china/27742216.html,"Fast jeden Tag hat China einem Bericht zufolge einen Dollar-Milliardär mehr. Ihre Zahl stieg im vergangenen Jahr um 307 auf 1185, wie aus der neuen Reichenliste hervorging, die das Shanghaier Magazin „Hurun“ am Mittwoch vorlegte.  Das Land mit der zweitgrößten Volkswirtschaft habe heute fünfmal mehr US-Dollar-Milliardäre als vor zehn Jahren. Der reichste Chinese ist demnach der 67-jährige   mit einem Vermögen von 60,6 Milliarden Dollar. Auf Platz 2 steht jetzt der 38-jährige Gründer der  , Zhang Yiming, mit 52,8 Milliarden Dollar. Ihm folgt der Chef des Autobatterie-Herstellers CATL, Zeng Yuqun. Der 53-Jährige habe sein Vermögen auf 47,4 Milliarden US-Dollar verdreifachen können. Der Chef des Internetriesen Tencent, Pony Ma (50), rutschte auf Platz 4. Ähnlich landete   (57) auf dem fünften Platz. Vor dem Hintergrund der Krise auf dem Häusermarkt in China ist erstmals kein Immobilienunternehmer auf den ersten zehn Plätzen. Der Gründer des hoch verschuldeten Immobilienriesen Evergrande, Xu Jiayin, der die Liste 2017 angeführt hatte, fiel mit nur noch 11,3 Milliarden Dollar vom fünften Rang im Vorjahr auf Platz 70.  Mineralwasserunternehmer Zhong Shanshan Videoplattform Tiktok Alibaba-Gründer Jack Ma",tagesspiegel
50 Jahre Volksrepublik China in den UN . Taiwan berät mit USA über Beteiligung in Vereinten Nationen,no_author,"25.10.2021, 09:48 Uhr",https://www.tagesspiegel.de/politik/50-jahre-volksrepublik-china-in-den-un-taiwan-beraet-mit-usa-ueber-beteiligung-in-vereinten-nationen/27734486.html,"Zum 50. Jahrestag der Aufnahme der kommunistischen Volksrepublik Chinas in die Vereinten Nationen ist neuer Streit um Taiwan ausgebrochen. Chinas Staats- und Parteichef Xi Jinping sagte am Montag in einer Rede in Peking, mit der Resolution 2758 habe die UN-Generalversammlung am 25. Oktober 1971 anerkannt, dass die Regierungsvertreter der 1949 in Peking gegründeten Volksrepublik die „einzig rechtmäßigen Repräsentanten Chinas in den UN“ seien. Er sprach von einem „Sieg für das chinesische Volk“. Der damals im Gegenzug verfügte Ausschluss Taiwans ist bis heute strittig. Nur drei Tage vor dem Jahrestag sprachen Regierungsvertreter aus Washington und Taipeh offiziell darüber, wie die heute demokratische Inselrepublik wieder richtig in den UN mitarbeiten kann. „Die Diskussionen konzentrierten sich darauf, die Fähigkeit Taiwans zu unterstützen, sich bedeutsam in den UN zu beteiligen“, teilte das Außenministerium in Washington mit. Als Konsequenz der Anerkennung der Volksrepublik durch die UN waren die Vertreter der in Taiwan ansässigen nationalchinesischen Republik China 1971   worden. Die nationalchinesische Kuomintang-Regierung war nach der Niederlage im Bürgerkrieg gegen die Kommunisten nach Taiwan geflüchtet, während diese 1949 in Peking die Volksrepublik gründeten. Taiwans Regierung widersprach der Pekinger Darstellung, dass die UN damals auch anerkannt habe, dass Taiwan zur Volksrepublik gehöre. Die UN-Resolution habe nur die Frage der Vertretung Chinas im UN-System behandelt. „Sie sagt weder, dass Taiwan ein Teil der Volksrepublik ist, noch autorisiert sie die Volksrepublik, das Volk Taiwans zu repräsentieren“, sagte Außenamtssprecherin Joanne Ou in Taipeh. „Nur die demokratisch gewählte Regierung von Taiwan hat das Recht, ihr Volk in internationalen Organisationen bei den UN oder in internationalen Foren zu repräsentieren.“ Die Führung in Peking betrachtet das 23 Millionen Einwohner zählende Taiwan nur als Teil der Volksrepublik und droht mit einer Eroberung, um eine „Wiedervereinigung“ zu erreichen. Auch versucht Peking, Taiwan international zu isolieren. Wegen seiner „Ein-China-Doktrin“ dürfen diplomatische Partner keine offiziellen Beziehungen zu Taipeh unterhalten. Nur weniger als 20 meist kleinere Staaten erkennen Taiwan trotzdem an. Wegen des Drucks aus Peking unterhält auch Deutschland nur eine inoffizielle Vertretung in Taipeh. In den offiziellen Online-Gesprächen der USA mit Taiwan am Freitag ging es nach US-Angaben um „globale Herausforderungen“ wie Gesundheit, Entwicklungshilfe, Klimawandel und Umweltverschmutzung, technische Standards und Wirtschaftskooperation. Die US-Vertreter hätten auch die Unterstützung der USA für eine „bedeutungsvolle Teilnahme“ Taiwans in der Weltgesundheitsorganisation (WHO) und dem Pariser Klimaabkommen bekräftigt, hieß es. Die Regierung in Taipeh bedankte sich für die „starke Unterstützung“ der USA. Die Spannungen zwischen China und Taiwan hatten sich jüngst verschärft. Eine Rekordzahl chinesischer Militärflugzeuge dringt seit Wochen immer wieder in Taiwans Luftüberwachungszone (ADIZ) ein und stellt die Luftabwehr auf die Probe.  Deutlicher als seine Vorgänger stellte US-Präsident Joe Biden erst vergangene Woche klar, dass die USA Taiwan   würden: „Wir haben eine Verpflichtung, das zu tun.“ Peking reagierte empört. Taiwan sei eine „innere Angelegenheit“ Chinas, in die sich niemand einmischen dürfe, sagte ein Sprecher.  aus den UN ausgeschlossen im Falle eines Angriffs durch China verteidigen",tagesspiegel
Druck durch Chinas Sicherheitsgesetz . Amnesty International gibt Büros in Hongkong auf,no_author,"25.10.2021, 11:30 Uhr",https://www.tagesspiegel.de/politik/druck-durch-chinas-sicherheitsgesetz-amnesty-international-gibt-bueros-in-hongkong-auf/27734618.html,"Die Menschenrechtsorganisation Amnesty International zieht sich als Reaktion auf das umstrittene Hongkonger Sicherheitsgesetz aus der chinesischen Sonderverwaltungsregion zurück. Das im Juni 2020 eingeführte Gesetz habe es „praktisch unmöglich gemacht, frei und ohne Angst vor ernsthaften Repressalien der Regierung zu arbeiten“, sagte Anjhula Mya Singh Bais, Vorstandsvorsitzender von Amnesty, laut einer Pressemitteilung vom Montag. Daher sei schweren Herzens entschieden worden, die beiden Amnesty-Büros in Hongkong bis Ende des Jahres zu schließen. Die Stadt sei lange ein idealer regionaler Stützpunkt für internationale Organisationen der Zivilgesellschaft gewesen. Die jüngsten Angriffe auf   hätten jedoch „eine Intensivierung der Kampagne der Behörden, die Stadt  “, signalisiert. „Es wird immer schwieriger für uns, in einem so instabilen Umfeld weiterzuarbeiten“, hieß es weiter. Nach anhaltenden Demonstrationen und dem Ruf nach mehr Demokratie in Hongkong hatte die kommunistische Führung in Peking das Sicherheitsgesetz erlassen. Es zielt auf die prodemokratische Opposition und richtet sich vage gegen Aktivitäten, die Peking als umstürzlerisch, separatistisch, terroristisch oder verschwörerisch ansieht.   oder warten auf ihren Prozess. Einige wurden verurteilt. Aus Angst vor Strafverfolgung haben sich viele Oppositionsmitglieder ins Ausland abgesetzt. Seit dem 1. Juli 1997 gehört die frühere britische Kronkolonie Hongkong wieder zu China und wird als Sonderverwaltungsregion autonom regiert. Eigentlich sollen die sieben Millionen Hongkonger bis 2047 „ein hohes Maß an Autonomie“ und weiter viele politische Freiheiten genießen.  lokale Menschenrechts- und Gewerkschaftsgruppen von allen abweichenden Stimmen zu befreien Mehr als 100 Aktivisten wurden festgenommen",tagesspiegel
China setzt Klimaschutz aus . Deutschland würde auf Energiemangel genauso reagieren,Jakob Schlandt,"19.10.2021, 15:54 Uhr",https://www.tagesspiegel.de/politik/china-setzt-klimaschutz-aus-deutschland-wuerde-auf-energiemangel-genauso-reagieren/27718968.html,"China fährt den Kohleabbau in seinen Minen hoch, versucht mit allen Mitteln, sich mehr Energierohstoffe auf dem Weltmarkt zu sichern und fährt seine Kohlekraftwerke ans Limit. Schlechtere Nachrichten für das Weltklima sind auf den ersten Blick kaum denkbar. Denn in China entstehen inzwischen mehr als ein Viertel der globalen Treibhausgasemissionen. Auf den zweiten Blick zeigt sich allerdings, dass sich das Land in einer konkreten Notlage befindet, die hektische Reaktionen notwendig macht. „Rollierende Lastabwürfe“ plagen das Land, was nichts anderes heißt, als das Fabriken und sogar Wohnvierteln reihum der Strom abgestellt wird. Das bedroht das ohnehin schwächer als erwartet ausfallende Wirtschaftswachstum nach der globalen Coronakrise. Wie auch im Rest der Welt sind Lieferketten und Logistik überspannt, es mangelt an vielem. Man stelle sich vor, geplante Blackouts würden Deutschland und   treffen: Es gäbe auch hier keine nennenswerten Hemmungen, kurzfristig zu verbrennen, was notwendig ist, um das zu stoppen. Chinas Führung wird dazu noch in einem besonders unangenehmen Moment von diesem Problem erwischt. Der   beginnt Ende Oktober. Peking hat sich in den vergangenen Jahren zögerlich zur Klimaschutzpolitik entschlossen. Ab 2030 sollen die Emissionen immerhin anfangen, zu sinken, bis 2060 soll CO2-Neutralität erreicht werden. Und auch in der Wirtschaftsaußenpolitik soll Klimaschutz nun großgeschrieben werden. Das reicht allerdings bei weitem noch nicht, um einen ausreichenden Beitrag zum Stopp der Klimaerwärmung zu leisten. Die chinesische Regierung steht deshalb gerade jetzt international unter Druck, den kurzfristigen Kohleboom mit einem detaillierteren Klimaschutzplan zu flankieren. Ein Beispiel: Präsident Xi Jinping hat zwar angekündigt, die Finanzierung von Kohlekraftwerken im Ausland zu beenden, aber noch ist völlig unklar, was das genau bedeutet, zum Beispiel, ob damit neben direkten staatlichen Zahlungen auch private Kredite chinesischer Banken gemeint sind. China ist nicht nur der größte globale Emittent, sondern auch einer der Hauptverlierer bei kaum gebremster Klimaerhitzung, durch Hitzewellen und Überflutungen, beispielsweise. Das kurzfristige Kohle-Comeback ist nachvollziehbar. Aber es wird umso mehr Zeit für einen glaubwürdigen und nachvollziehbaren Klimaschutzplan. Europa Weltklimagipfel in Glasgow",tagesspiegel
