title,author,date_published,url,article_text,source
China und die Meinungsfreiheit . Eine Zensur findet (nicht) statt,Christiane Peitz,"27.10.2021, 12:56 Uhr",https://www.tagesspiegel.de/kultur/china-und-die-meinungsfreiheit-eine-zensur-findet-nicht-statt/27742684.html,"China versucht zunehmend, Zensur auch in Europa auszuüben. Vor wenigen Tagen wurde eine an den Konfuzius-Instituten in Duisburg und Hannover geplante Online-Lesung aus Stefan Austs und Adrian Geiges‘ Biografie über den chinesischen Staatschef „Xi Jinping – der mächtigste Mann der Welt“ auf chinesische Intervention hin vorerst abgesagt. Zwar findet sie an diesem Mittwoch nun doch um 19 Uhr statt, allerdings ausgetragen vom Ostasieninstitut der Universität Duisburg-Essen (Registrierung zum  ).  .„Unsere Kooperations-Uni in Wuhan hat uns freundlich dargelegt, dass sie es nicht gut fänden, wenn wir die Veranstaltung durchführen“, sagte Markus Taube, einer der Direktoren des Duisburger Konfuzius-Instituts. Es sei der erste Fall einer solchen Einflussnahme. Alle Konfuzius-Institute basieren auf der Zusammenarbeit deutscher und chinesischer Universitäten, alleine in Deutschland gibt es 20 davon. Sie werden vom chinesischen Bildungsministerium gefördert.  Dass die Lesung nun doch stattfindet, ist auch die Folge von deutlicher Kritik am Rückzieher der Institute, etwa seitens des niedersächsischen Wissenschaftsministers Björn Thümler. „Die Freiheit von Forschung und Lehre ist nicht verhandelbar“, betonte der Duisburger Universitätsrektor Ulrich Radtke am Montag; NRW-Kulturministerin Isabel Pfeiffer-Poensgen sprach von einem  „besorgniserregenden“ Vorgang. Noch gravierender ist der Versuch der chinesischen Botschaft in Italien, dort an der Meinungs- und Kunstfreiheit zu rütteln – ohne dass chinesische Fördergelder im Spiel sind. Die Botschaft hat den Bürgermeister von Brescia in einem Brief aufgefordert, die im Museo di Santa Giulia für November geplante  abzusagen. Laut der Zeitung “Giornale di Brescia” heißt es in dem Schreiben, Badiucaos Arbeiten seien “voller anti-chinesischer Lügen”. Sie verdrehten Fakten und verbreiteten Falschinformationen. Badiucao, der seit 2009 im Exil in Australien lebt und zur Zeit die Ausstellung in Brescia aufbaut,  , die Niederschlagung der Protestbewegung in Hongkong oder die Inhaftierung und den Tod des Friedensnobelpreisträgers Liu Xiaobo. Auch versucht er, mit seinen Bildern das Tienanmen-Massaker vom 4. Juni 1989 in Erinnerung zu halten.  Dennoch versteht er sich nicht in erster Linie als Protestkünstler. Überall auf der Welt sei es normal, sich mit Cartoons und Satire über die Mächtigen lustig zu machen, n nlässlich der großformatigen Open-Air-Präsentation seiner Hongkong-Cartoons an der Berliner Eastside Gallery. 2019 hatten die chinesischen Behörden eine große Ausstellung in Hongkong in letzter Sekunde verhindert.  Der 35-jährige, aus Schanghai stammende Künstler wird öfter auch der „Banksy von China“ genannt. Da Badiucao selbst im Exil in Melbourne bedroht wurde, ebenso Mitglieder seiner Familie, zeigte er sich öffentlich nur mit Mütze über dem Kopf – bis er 2018 enttarnt wurde. Auch andere Künstler vor allem aus Hongkong haben ihre Heimat wegen des zunehmenden Drucks verlassen. So ging der  im August nach Taiwan, ein Exil aus politischen Gründen, wie er betonte.  Museumsleiter Stefano Karadjov und Politiker der Stadt haben das Ansinnen der chinesischen Botschaft entschieden zurückgewiesen. „Was hier geschieht, bestätigt nur die Dringlichkeit, über Themen wie Demokratie und Freiheit zu diskutieren“, so Karadjov. „Museen müssen dies schützen.” Dem Journal “The Art Newspaper” sagte er, in den 20 Jahren der Fondazione Brescia Musei habe es nie einen solchen Einmischungsversuch gegeben. „Die Freundschaft zwischen dem italienischen und dem chinesischen Volk steht außer Frage“, aber es sei „wichtig zu zeigen, dass man Freunde bleiben und gleichzeitig Dinge kritisieren“ kann, teilte der Bürgermeister von Brescia Emilio Del Bono mit, wie die Zeitung „Il Foglio“ berichtete. „Kunst und Meinungsfreiheit gehören für uns unabdingbar zusammen“, twitterte die stellvertretende Bürgermeisterin Laura Castelletti am Montag. Badiucao weiß diese klaren Signale Richtung China und die unmissverständliche Absage an jeden Zensurversuch sehr zu schätzen, wie er beim Telefonat am Mittwochabend sagt. Er wurde zuletzt in den sozialen Medien auch wieder persönlich bedroht, auch von einem Twitter-Account, der auf den chinesischen Staatssender CGTN zurückzuführen ist. Badiucao arbeitet seit einiger Zeit auch mit dem Basketballstar Enes Kanter zusammen. Bei einem Match der Boston-Celtics in der vergangenen Woche trug Kanter Sportschuhe, die von Badiucao bemalt waren - mit dem Schriftzug ""Free Tibet"" in den Farben der Tibetflagge.  Die Folge: Die Spiele seiner Mannschaft werden in China nicht mehr live übertragen. Trotzdem macht Kanter weiter: In einem Tweet bezeichnete er Xi Jinping als ""brutalen Diktator"", schrieb, er lasse sich nicht zum Schweigen bringen. Er trägt weiterhin Badiucao-Schuhe mit wechselnden china-kritischen Slogans. Die Ausstellung sei schon für 2020 geplant gewesen, habe wegen der Covid-19-Pandemie aber verschoben werden müssen, erzählt Badiucao am Telefon. Brescia war ein Corona-Hotspot, es gebe eine enge Verbindung zwischen Städten wie Brescia und Wuhan. In seinen aktuellen Arbeiten würdigt er deshalb auch die Leidtragenden der Pandemie, couragierte Helfer, Klinikpersonal, Sozialarbeiter. Bei der Ausstellung “La Cina (non) è vicina“ (China ist  nah) handelt es sich um die erste große internationale Einzelschau von Badiucao. Sie eröffnet am 13. November und soll für drei Monate zu sehen sein.  Zoom-Webinar hier Ausstellung des chinesischen Künstlers und politischen Karikaturisten Badiucao  thematisiert in seinen Cartoons die Allmacht der Kommunistischen Partei Chinas ur China finde das nicht normal, sagte er 2019 im Tagesspiegel-Interview a Hongkonger Künstler und Demokratie-Aktivist Kacey Wong  nicht ",tagesspiegel
Ex-Verteidigungsminister Volker Rühe . „Natürlich brauchen wir die nukleare Teilhabe“,Christoph von Marschall,"31.10.2021, 09:13 Uhr",https://www.tagesspiegel.de/politik/ex-verteidigungsminister-volker-ruehe-natuerlich-brauchen-wir-die-nukleare-teilhabe/27751832.html,"Die Bekämpfung des Terrorismus in Afghanistan war ein legitimes und vernünftiges Ziel, darauf hätte man sich konzentrieren sollen. Aber der Westen wollte dort eine Demokratie aufbauen.  Das musste schief gehen.  hatte das erkannt, schon als Vizepräsident trat er für einen früheren Abzug der US-Soldaten ein. Grundsätzlich hatte er den richtigen Ansatz, aber in der letzten Phase hat er Fehler gemacht, weil er dann nicht mehr auf seine Militärs hörte. Wenn die USA einzelne Regionen etwa ein halbes Jahr militärisch länger gesichert hätten, dann hätten sie die Kontrolle behalten und die Entwicklung besser steuern können. Alle westlichen Staaten hätten auch viel mehr ihrer afghanischen Helfer herausholen können. Stattdessen hat die US-Regierung ein Chaos angerichtet. Das war eine politische Niederlage, keine militärische. Wenn man die richtigen Schlussfolgerungen aus dem Afghanistan-Einsatz zieht, muss sein Ende aber keine langfristige Schwäche des Westens bedeuten.  Der Afghanistan-Einsatz wird als eine Wasserscheide wirken – die Außen- und Sicherheitspolitik danach muss sich von der davor unterscheiden. Mit militärischen Mitteln kann man kein „Nation building“ machen, keine Demokratie schaffen, wenigstens nicht außerhalb Europas. In Afghanistan hat es nie einen funktionierenden Zentralstaat gegeben, geschweige denn eine Demokratie. Wir müssen für die Zukunft lernen, nur in Auslandseinsätze zu gehen, die realistische Ziele verfolgen und diese in einer genau definierten Zeit erreichen können. In der letzten Phase des Einsatzes haben sich Auswärtiges Amt, Verteidigungsministerium und Innenministerium gegenseitig blockiert. Es ist eine Schande, dass riesige bürokratische Hürden die Rettung der deutsche   verhinderten. Man hätte sie nach Deutschland holen und den Papierkram dann hier erledigen sollen. Es ist ein Versagen des Kanzleramtes, dass es diesen Streit nicht aufgelöst hat. Wenn die Bundesregierung nun nicht alles dafür tut, noch möglichst viele Ortskräfte zu retten, dann wird Blut an ihren Händen kleben. Sie steht jetzt in einer ganz besonderen Verantwortung. Das gilt auch für die neue Regierung. Ich messe die Ampel an ihren eigenen Ansprüchen. SPD, Grüne und FDP haben erklärt, dass sie die strategische Souveränität Europas erhöhen wollen. Das ist dringend notwendig. Denn die Hinwendung der USA nach Asien, der „Pivot to Asia“, ist in vollem Gange: Die USA ziehen nach und nach militärische Kapazitäten aus Europa ab und verlagern sie nach Asien. Wenn wir nicht eines Tages völlig schutzlos dastehen wollen, muss Deutschland einen fairen Anteil an der Garantie europäischer Sicherheit übernehmen.   Da geht es um viel Geld für nationale Kapazitäten, aber auch eine europäische Zusammenarbeit jenseits nationaler Zuständigkeiten. Es greift zu kurz, wenn die Ampelpartner in ihrem Sondierungspapier für eine verstärkte europäische Zusammenarbeit nationaler Armeen eintreten.  Wir brauchen europäische multilaterale Strukturen, wir brauchen europäische Arbeitsteilung und Spezialisierung in der Verteidigungspolitik. Wir sollten den größten konventionellen Beitrag bei den Landstreitkräften stellen. Kleine und mittlere EU-Länder müssen nicht über das ganze Spektrum militärischer Fähigkeiten verfügen. Ich könnte mir auch vorstellen, dass wir etwa   im Verbund mit den Franzosen anschaffen und nutzen. Darauf lässt sich Frankreich aber nur ein, wenn die Deutschen ohne jeden Zweifel bereit sind, diese Waffe einzusetzen. Das ist eine offene Frage. Wenn die Ampelkoalition es ernst meint mit der Stärkung der europäischen Souveränität, muss sie bewaffnete Drohnen anschaffen. Wenn sie sich gegen diese Waffen entscheidet, beschreitet sie einen deutschen Sonderweg und schadet der gemeinsamen europäischen Sicherheit. Ganz abgesehen davon, dass diese Waffe Leben und Gesundheit deutscher Soldaten schützen kann. Zum Beispiel beim  . Drohnen werden von der Bundeswehr dort ja heute schon zur Aufklärung eingesetzt. Stellen Sie sich vor, sie erkennen die Vorbereitung eines Angriffs auf einen deutschen Konvoi. In diesem riesigen Land kann es aber lange dauern, bis Verstärkung geholt werden kann. Eine bewaffnete Drohne kann den angegriffenen deutschen Soldaten sehr schnell und effektiv helfen. Ich glaube, da liegt ein Missverständnis vor. Die USA töten im Kampf gegen den Terrorismus mit bewaffneten Drohnen weltweit gezielt Personen, die sie für Terroranschläge verantwortlich machen. Diese Praxis verschreckt viele, aber das hat in Deutschland niemand vor. Hier geht es um etwas völlig anderes, und der Unterschied ist wichtig. Wenn das zutreffen solle, ist das bitter und nur dann zu vertreten, wenn die eingesparten Mittel in die notwendigen großen Ausrüstungsentscheidungen der Bundeswehr fließen. Ich bin kein Anhänger des Zwei-Prozent-Ziels, denn es ist kein vernünftiger Maßstab. Ich sage ihnen ein Beispiel, dass die Absurdität dieser Vorgabe zeigt: Wegen des Wirtschaftseinbruchs in der Corona-Pandemie ist das deutsche Bruttosozialprodukt gesunken, die Ausgaben für Verteidigung stiegen dadurch anteilmäßig auf einen Wert von 1,5 Prozent. Aber in Wirklichkeit hat die Bundeswehr keinen Cent mehr bekommen.  Ich werbe weiter für das, was ich das „Bundeswehrfähigkeitengesetz“ nenne: Der Bundestag sollte grundsätzlich darüber entscheiden, welche Fähigkeiten die deutschen Streitkräfte über einen längeren Zeitraum, sagen wir, in den nächsten drei Legislaturperioden, braucht und sie entsprechend ausstatten. Da geht es um Strukturen, Personalstärke, Bewaffnung. Dann wäre die Bundeswehr wirklich eine Parlamentsarmee. Nein. Das ist doch ein Taschenspielertrick. Auch eine solche Zielmarke würde keine Klarheit darüber bringen, welchen Beitrag die Bundeswehr für eine verstärkte europäische Souveränität bringen könnte. Natürlich brauchen wir sie. Briten und Franzosen haben eigene Nuklearwaffen, Deutschland hat keine – und das völlig zurecht. Die nukleare Teilhabe ist auf deutschen Wunsch eingeführt worden, damit wir mitreden können, wenn in der Nato über die atomare Abschreckung und eventuelle Atomwaffeneinsätze in Europa entschieden wird. Ich bedauere es, dass viele das heute nur noch als Last empfinden. Kanzlerin Angela Merkel und ihre Regierung haben völlig versagt vor der Aufgabe, dieses wichtige Thema den Bürgern zu erklären. Die nukleare Teilhabe ist unverzichtbar für unsere Sicherheit. Wenn wir aus ihr aussteigen, gefährdet das den atomaren Schutzschirm für Europa und den Zusammenhalt der Nato. Wir müssen wieder einen Konsens in der Bevölkerung über den Wert der nuklearen Teilhabe herstellen. Was man nicht diskutiert und erklärt, wird man gegenüber den Bürgern auf  Dauer auch nicht durchsetzen können. Im Kalten Krieg war Landesverteidigung für die Deutschen zugleich Bündnisverteidigung. Für die anderen Nationen war es umgekehrt: Indem sie in Deutschland das Bündnis verteidigten, verteidigten sie auch die Sicherheit ihres Landes. Heute liegt Deutschland nicht mehr an der Außengrenze der Nato. Auch für uns ist die Bündnisverteidigung zur Landesverteidigung geworden. Deutschland wird nicht erst an der Oder verteidigt, sondern an den Außengrenzen der Nato, etwa in Litauen. Wegen Chinas Verhalten verlagern die USA ihre Kräfte nach Asien. Drei Dinge beunruhigen mich. In Hongkong bricht Peking den Vertrag über das Prinzip „Ein Land, zwei Systeme“. Zweitens hat Präsident Xi lebenslange Vollmachten bekommen. China war auch vorher keine Demokratie. Der Präsident wird nicht vom Volk gewählt, sondern von der Partei. Jetzt wird er nicht mal mehr nach zehn Jahren ausgewechselt. Das ist ein Anzeichen für eine Diktatur: wenn der geordnete Machtwechsel gar nicht mehr vorgesehen ist, sondern einer lebenslang regiert. Drittens tritt China aggressiver auf und möchte Taiwan eingliedern, durch Druck und notfalls gewaltsam. Die „Kaffeefahrt“ der   ist jedenfalls kein Mittel, um unsere Sicherheit zu stärken. Damit übernehmen wir uns, das ist lächerlich. Denken Sie nur an die US-amerikanischen und britischen Kampfflugzeuge, die die USA und Großbritannien gemeinsam auf einem Flugzeugträger in den Indopazifik schicken. Deutschland hat nichts Vergleichbares zu bieten. Wir entlasten die Amerikaner in Asien, indem wir in Europa mehr Verantwortung übernehmen.  Wir können nicht neutral sein. In einer Welt, in der China die Demokratie in Taiwan mit militärischen Mitteln beendet, möchte ich nicht leben. Alle Bundeskanzler seit Helmut Schmidt waren von China fasziniert, auch Helmuth Kohl, Gerhard Schröder, Angela Merkel. Das kann ich nachvollziehen. Aber  man muss sich ein realistisches Bild von der Lage machen und verstehen, warum sich die USA in Asien an der Seite der Demokratien stärker engagieren.  US-Präsident Joe Biden  Ortskräfte bewaffnete Drohnen Einsatz in Mali deutschen Fregatte Bayern in den Indopazifik",tagesspiegel
Nach G20 geht´s weiter zum Klimagipfel . Die Krisenlöser reisen mit leeren Händen nach Glasgow,Christoph von Marschall,"31.10.2021, 20:30 Uhr",https://www.tagesspiegel.de/politik/nach-g20-gehts-weiter-zum-klimagipfel-die-krisenloeser-reisen-mit-leeren-haenden-nach-glasgow/27756002.html,"Bei vier Großthemen wollten   in Rom vorankommen. Nur bei einem können sie Erfolg vermelden: der Einführung einer globalen Mindeststeuer; sie soll 2023 verbindlich werden.  Das ist gut. Sie war aber nicht wichtiger als die drei anderen Herausforderungen. Wie befreit sich die Weltwirtschaft aus der Corona-Rezession, wie erreichen ärmere Länder Impfquoten über 65 Prozent, und wie kommt der Globus dem Ziel näher, die Erderwärmung auf 1,5 Grad zu begrenzen? So reist die Karawane der globalen Krisenlöser mit weitgehend leeren Händen von Rom zur Klimakonferenz nach Glasgow weiter. Es fehlt an Ehrgeiz und Mut. Was kann die Welt von den G20 bei den drängenden Problemen überhaupt noch erwarten? Seinen Wert hatte das Format in der globalen Finanzkrise von 2008 bewiesen. Damals wurde rasch klar, dass die Kraft der G7 – der sieben größten demokratischen Marktwirtschaften in Nordamerika und Europa – nicht reichen würde, um die Weltwirtschaft zu retten, zumal ihre Führungsmacht, die USA, den Absturz durch eine verantwortungslose Immobilienpolitik ausgelöst hatten.  Die Zeiten, in denen die G7 mehr als die Hälfte der globalen Wirtschaftskraft produzieren, sind vorbei. Das Gewicht der Schwellenländer wächst kontinuierlich. Globale Rettungsstrategien sind nur noch in Absprache mit G20-Ländern wie China, Indien, Saudi Arabien, Südafrika, Brasilien und Indonesien möglich.  Warum gelang in Rom so wenig? Die Antworten variieren, je nachdem, ob es um das Klima, das Impfen oder den Aufschwung geht – sowie um die handelnden Personen. Auch wenn Joe Biden Donald Trump ersetzt hat, erschweren autoritäre Figuren weiter die G20-Arbeit, etwa Bolsonaro in Brasilien, Erdogan in der Türkei, Putin in Russland, Xi in China.  Gemeinsame Strategien sind zudem nur möglich, wenn alle Beteiligten ein ähnliches Bild von den drängendsten Problemen und den Lösungsmöglichkeiten haben. Und wenn sie sich vom Mittun mehr Nutzen als Kosten versprechen. Diese Übereinstimmung fehlt bei den drei Großthemen. Am leichtesten zu verschmerzen ist das bei Wegen aus der Rezession. Die globale Erholung kann auch gelingen, wenn es keinen verbindlichen Plan für alle gibt, sondern jedes Land seinen Wachstumspfad verfolgt. Die USA wollen, dass alle Staaten ohne Rücksicht auf ihre Verschuldung möglichst viel Geld in die Hand nehmen. Deutschland hält hohe Staatsschulden in der Eurozone für eine Gefahr. Der Streit ist da, muss aber nicht beigelegt werden, um die Welt zu retten. Beim Klima ist die Lage heikler. Das  führt zwangsläufig zur Benennung von Schuldigen. Xi und Putin wussten, warum sie nicht zum ersten persönlichen G20-Treffen nach der Pandemiepause kamen.  und verschiebt seine Zusagen, wann es daran etwas ändern will, immer weiter. Russland hat keine Strategie, wie es den Lebensunterhalt der Bürger und den militärischen Großmachtstatus finanzieren will, wenn Öl und Gas als Haupteinnahmequellen wegfallen.  Nur die   Man kann ihnen vorhalten, auch ihre Erfolge reichten nicht für   Andere G20-Staaten liegen jedoch viel weiter zurück. Das muss offen ausgesprochen werden, um Druck auf die Säumigen auszuüben. Ähnliches gilt für das globale Impfen. Liegt es wirklich am egoistischen Westen und dem Festhalten an Patenten, dass die Quoten in den armen Ländern gering sind? Oder spielen ineffiziente Verwaltungen dort auch eine Rolle? Die USA haben 1,1 Milliarden Impfdosen gespendet, Deutschland 100 Millionen.  China und Russland haben eigene Impfstoffe. Dennoch ist die Impfquote in Russland gering, und China liegt beim Ziel, arme Länder mit Impfdosen zu versorgen, hinter den G7.  Bei aller berechtigten Kritik: Im Vergleich mit anderen G20-Staaten sind Amerika und Europa wohl doch besser als ihr Ruf. die G20 bei ihrem Gipfel  Gespräch über die Ursachen mangelnder Erfolge China ist der größte Klimasünder  G7-Staaten haben ihre Emissionen im Vergleich zu 1990 gesenkt. die Klimaziele.",tagesspiegel
