title,author,date_published,url,article_text,source
Global Challenges . Seitenwege zur Seidenstraße,no_author,"20.10.2021, 14:46 Uhr",https://www.tagesspiegel.de/politik/global-challenges-seitenwege-zur-seidenstrasse/27722024.html,"Über den Rückzug der USA und der Nato-Länder aus Afghanistan  . Peking bietet sich nun die Möglichkeit, die letzte Lücke seines 2013 gestarteten Mega-Projekts Neue Seidenstraße (Belt and Road Initiative, BRI) zu schließen und Waren auch über Afghanistans Transportwege zwischen Ost und West zu verschieben.  Bei der BRI geht es darum, den Güterverkehr zwischen westeuropäischen Ländern und China mit Lastwagen und Eisenbahnen durch Zentralasien und mit Containerschiffen auf den indopazifischen Routen zu beleben. Der entsprechende Infrastrukturausbau wird von China (vor)finanziert, die Partnerländer stimmen dem von Peking geplanten Infrastrukturausbau auf ihrem jeweiligen Hoheitsgebiet zu. Außerdem plant die Volksrepublik auch Investitionen in Landwirtschafts-, Industrie- und Rohstoffprojekte: Gerade für ärmere asiatische, afrikanische und europäische Länder ist das mehr als ein Hoffnungsschimmer.  Nachdem sie die 10000 Kilometer lange Strecke hinter sich haben, kommen mittlerweile im Duisburger Hafen jede Woche rund 60 Güterzüge aus China an. Im vergangenen August wurde der Wilhelmshavener Jade-Weser-Port als offizieller Teil der BRI eingeweiht. Insgesamt plant China in seinem Mega-Projekt Investitionen in rund 100 Ländern mit ungefähr vier Milliarden Einwohnern.  Der Zweck ist klar: Peking will seine Rolle im internationalen Handel stärken. Es geht um gut ausgebaute Verkehrsverbindungen, neue Absatzmärkte, Zugang zu Rohstoffen und die Auslagerung von Überkapazitäten. Außerdem will China seine geopolitische Position stärken, nicht zuletzt in militärischer Hinsicht. Gut ausgebaute neue Tiefseehäfen im indopazifischen Raum würden es China beispielsweise erlauben, bestehende Schifffahrtswege zu modernisieren und damit vor allem den Konkurrenten Indien auszustechen.   Japan und Australien auf den Plan: 2019 starteten sie die Gegeninitiative „Blue Dot Network“. Die Europäer konnten sich erst im April 2021 auf eine „EU-Strategie für die Zusammenarbeit im indopazifischen Raum“ verständigen – ein überfälliger Beschluss, soll der alte Kontinent nicht von der BRI überrollt werde.  Die Engagements europäischer Firmen in zentralasiatischen Ländern sind bisher überschaubar, zum einen wegen politisch heikler Konstellationen in diesen Staaten, zum anderen weil die entsprechenden Märkte als wenig gewinnträchtig gelten. Letzteres auch deshalb, weil Unternehmen aus der EU vergleichsweise strikte Umweltauflagen und hohe Regulierungsstandards beachten müssen. Gegenüber China geraten sie da schnell ins Hintertreffen.  Eine koordinierte Kooperations-Strategie könnte die Wettbewerbsposition europäischer Unternehmen spürbar verbessern – zumal inzwischen schon mehrere BRI-Partnerländer bedauern, sich auf den   eingelassen zu haben. Die anfängliche Euphorie über die in Aussicht gestellten chinesischen Investitionen ist beispielsweise in Sri Lanka, Malaysia und Thailand, aber auch in Italien deutlicher Ernüchterung gewichen. Sie resultiert nicht zuletzt daraus, dass viele Partnerländer sich bei China hoch verschulden mussten, um die Infrastrukturinvestitionen mitfinanzieren zu können.  Peking nutzt die „Schuldenfalle“, um die finanziell abhängigen Länder auf seine geostrategischen Interessen einzuschwören. Hinzu kommt: Die Partnerländer haben in ihrem eigenen Land bei der konkreten Gestaltung der Infrastrukturinvestitionen kein echtes Mitspracherecht. Peking gibt vor, was wie zu tun ist. Außerdem investiert China nur, wenn chinesische Firmen und Arbeitskräfte die Projekte umsetzen. Damit fallen die von den Partnerländern erhofften einheimischen Arbeitsplatzgewinne deutlich geringer aus als gedacht.  Ist vor diesem Hintergrund die EU-Strategie zur indopazifischen Zusammenarbeit geeignet, ein Gegengewicht zur BRI zu bilden und Pekings geopolitischen Vormarsch – und damit die geopolitische Entmachtung Europas – zu bremsen? Die Antwort lautet: Ja, aber nur, wenn den schönen Worten schnell konkrete Taten folgen. Die Unzufriedenheit vieler BRI-Partnerländer bildet einen idealen Nährboden, neue Allianzen zu schmieden und Alternativen zu Chinas Aktivitäten zu schaffen.  Dieses Momentum sollten die Europäer nutzen. Die Grundidee der EU-Strategie ist durchaus überzeugend: Die EU-Mitgliedsländer wollen verstärkt als Kooperationspartner im indopazifischen Raum auftreten, etwa mit Freihandelsabkommen, in der Entwicklungszusammenarbeit, bei gemeinsamen Maßnahmen zur Bekämpfung der Klimakrise und im Hinblick auf die Folgen der Corona-Pandemie. Grundsätzlich soll dabei, im Gegensatz zu Pekings Praxis, die Einhaltung der Menschenrechte einen hohen Stellenwert haben und die Autonomie der Partnerländer gefördert werden. Geplant ist, in Afrika und Asien ehrgeizige Handels- und Investitionsabkommen zu schließen, wobei die bereits mit Japan, Südkorea, Singapur und Vietnam besiegelten Abkommen als Vorbild dienen können. Regionale Stabilität, Wohlstand und Sicherheit in den Partnerländern stehen im Zentrum der EU-Initiative. All dies soll einen Gegenpol zu Chinas wirtschaftlichem Expansionismus schaffen – sowohl in der Handelspolitik als auch im technologischen, politischen und sicherheitspolitischen Bereich. Allerdings: Die EU-Strategie für den indopazifischen Raum ist bisher sehr allgemein gehalten, und konkrete nächste Schritte fehlen weitgehend.  Tatsächlich war es ja schon ein Kunststück, die Mehrheit der in ihrer Einschätzung der Neuen Seidenstraße heterogenen EU-Staaten hinter dieser Strategie zu vereinen. Während beispielsweise Italien auf Distanz zur BRI gegangen ist, treten Griechenland und Ungarn weiterhin für Chinas Mega-Projekt ein.  Dieser sehr allgemeine Charakter der EU-Strategie erschwert eine rasche und wirkungsvolle Implementierung der Vorhaben in der indopazifischen Region. Die unlängst von den USA, Großbritannien und Australien verkündete Sicherheitsallianz, in deren Rahmen Australien nuklearbetriebene U-Boote nicht mehr von Frankreich, sondern im Rahmen der Allianz bezieht, hat die Bedeutung dieser Region noch einmal verdeutlicht – vor allem für die USA in ihrem Machtkampf mit China.  Letztlich kann es der Europäischen Union nur gemeinsam mit den USA gelingen, die geopolitischen Ansprüche Chinas in die Schranken zu weisen. Die beim G7-Gipfel im Juni beschlossene milliardenschwere Infrastruktur-Initiative für Schwellenländer könnte hier eine Grundlage sein. Zu beachten ist jedoch: China ist zwar Konkurrent, aber auch Partner. Die EU wäre gut beraten, die positiven Effekte der wirtschaftlichen Verflechtung mit China nicht zu gefährden. Sie sollte gegenüber Peking entschieden, aber im Ton gemäßigt auftreten und unnötige Konfrontationen vermeiden.  Kurzum: Die neue Indopazifik-Strategie der Europäischen Union ist ein schwieriger Balanceakt. Ob er gelingt, scheint derzeit ungewiss. zeigte sich China hocherfreut Das alles rief die USA, Deal mit China",tagesspiegel
Kampfflugzeuge als Machtdemonstration . Goliath gegen David – Chinas wachsender Druck auf Taiwan,no_author,"08.10.2021, 14:15 Uhr",https://www.tagesspiegel.de/politik/kampfflugzeuge-als-machtdemonstration-goliath-gegen-david-chinas-wachsender-druck-auf-taiwan/27689862.html,"Schon jetzt hat China für den Monat Oktober einen neuen Rekord in Sachen Machtdemonstration gegenüber Taiwan aufgestellt: Insgesamt 150 chinesische Flugzeuge – einschließlich atomwaffenfähiger Bomber des Typs H-6 – flogen in den ersten fünf Oktobertagen durch Taiwans Luftraumüberwachungszone (Air Defense Identification Zone, ADIZ) südwestlich der Insel.  Vor allem in den USA wächst die Sorge, dass die Volksrepublik versucht sein könnte, seinen Anspruch auf Taiwan als „untrennbaren“ Bestandteil seines Territoriums militärisch durchzusetzen. Zwar kann ein militärischer Konflikt um Taiwan angesichts wachsender Spannungen nicht ausgeschlossen werden, trotzdem lassen sich aus den Drohgebärden Chinas   ableiten.  In den letzten eineinhalb Jahren haben chinesische Flüge in Taiwans ADIZ deutlich zugenommen. In diesem Jahr sollen es laut taiwanischem Verteidigungsministerium bereits mehr als 600 solcher Flüge gewesen sein – weit mehr als im letzten Jahr, als 380 Fälle gezählt wurden.  Auch wenn diese Flüge in Taiwan klar   wahrgenommen werden, dringt China dabei nicht in Taiwans nationalen Luftraum ein, der 12 Seemeilen vor dessen Küste beginnt. Die ADIZ ist eine von Taiwan einseitig ausgerufene Zone, in der sich Flugzeuge gegenüber taiwanischen Behörden identifizieren sollen. Ähnliche Zonen haben auch Taiwans Nachbarländer ausgewiesen, darunter China.    Vor diesem Hintergrund wird in den USA über das Risiko einer militärischen Auseinandersetzung um Taiwan diskutiert. So warnte im März 2021 der scheidende US-Kommandant für den Indo-Pazifik, Admiral Philip Davidson, vor einem Konflikt innerhalb der nächsten sechs Jahre. Auch für seinen Nachfolger Admiral John Aquilino ist ein Konflikt mit China „viel näher, als die meisten denken“.  Hinter diesen Warnungen steht die Sorge um das militärische Gleichgewicht in der Region, das zunehmend zugunsten Chinas ausfällt. Das Kräfteverhältnis könnte sich in den kommenden Jahren noch weiter verschieben, unter anderem durch geplante Ausmusterungen von Schiffen der US-Navy – darunter Kreuzer und U-Boote.  Angesichts dieser Entwicklungen gibt es in den USA Spekulationen darüber, dass Präsident Xi Jinping zum Ende seiner als wahrscheinlich geltenden dritten Amtszeit von 2022 bis 2027 die Wiedervereinigung als sein politisches Vermächtnis durchsetzen möchte.  Ungeachtet internationaler Kritik hat China in Hongkong in den letzten Jahren das demokratische System ausgehöhlt und damit gegen das Völkerrecht verstoßen. Eine Invasion der de facto unabhängigen „Modelldemokratie“ Taiwan mit seinen knapp 24 Millionen Einwohnern wäre für China aber mit ungleich größeren Risiken verbunden als das Vorgehen in Hongkong.  Neben wirtschaftlichen Strafmaßnahmen, die der Westen zweifelsfrei ergreifen würde, droht im Falle Taiwans vor allem eine militärische Auseinandersetzung mit den USA – mit unschätzbaren Folgen. Zwar haben die USA keine Bündnisverpflichtung gegenüber Taiwan, trotzdem haben sie laut dem „Taiwan Relations Act“ von 1979 Sorge dafür zu tragen, dass der Status Taiwans nur auf friedlichem Weg verändert wird.  Für die Führung in Peking spricht daher viel gegen ein gewaltsames Vorgehen gegenüber Taiwan, vor allem so lange sie der Überzeugung ist, eine Vereinigung auch mit anderen Mitteln erreichen zu können. Chinas Säbelrasseln in Taiwans ADIZ ist Teil einer Zermürbungsstrategie, die der Bevölkerung Taiwans deutlich machen soll, dass eine Vereinigung angesichts des Kräfteverhältnisses unausweichlich und Widerstand zwecklos ist.  Druck übt Peking beispielsweise auch durch Cyberangriffe, gezielte Desinformationskampagnen oder wirtschaftliche Strafmaßnahmen aus. Auf der internationalen Bühne sucht China Taiwan zu isolieren, unter anderem indem es dessen Beteiligung in internationalen Organisationen blockiert. Mit seinem Druck bringt China auch zum Ausdruck, dass es eine formale Unabhängigkeit Taiwans als Staat nicht hinnehmen wird.  Angesichts Chinas Machtdemonstrationen signalisieren westliche Länder zunehmend ihre Unterstützung für Taiwan. Dabei rücken sie offiziell jedoch nicht von ihrer Ein-China-Politik ab, die Peking als alleinige, rechtmäßige Regierung eines einzigen Chinas anerkennt. Die G7-Gipfelerklärung vom Juni 2021 hob beispielsweise die Bedeutung von Frieden und Stabilität in der Taiwan-Straße hervor, woraufhin China demonstrativ eine größere Zahl Flugzeuge in Taiwans ADIZ fliegen ließ.  Eine Warnung an China war wohl auch ein gemeinsames Manöver der USA, Großbritanniens, Japans, Kanadas und der Niederlande am vergangenen Wochenende. Die Übungen – an der immerhin zwei amerikanische und ein britischer Flugzeugträger beteiligt waren – fand südöstlich der japanischen Insel Okinawa und damit in geographischer Nähe zu Taiwan statt. Sie mögen China dazu veranlasst haben, weitere Flugzeuge in Taiwans ADIZ zu schicken.  – einschließlich Deutschland – muss dem wachsenden Druck Chinas begegnen, indem es seine Beziehungen zum demokratischen Wertepartner Taiwan unterhalb der Schwelle diplomatischer Anerkennung weiter ausbaut. Gleichzeitig sollte es Taiwan in seinem internationalen Bewegungsspielraum unterstützen, indem es sich für dessen Teilnahme an internationalen Organisationen ausspricht.  Europa muss China die negativen Konsequenzen deutlich machen, die eine gewaltsame Veränderung des Status Quos um Taiwan für die Beziehungen hätte. Angesichts der angespannten Lage in der Taiwan-Straße sollte die deutsche und europäische Politik aber auch Handlungsoptionen für den Fall entwickeln, dass die Friedenswahrung in der Taiwan-Straße nicht gelingt.  nicht unbedingt Kriegsabsichten als Provokation Europa ",tagesspiegel
38 Kampfflugzeuge im Verteidigungsluftraum . Taiwan beklagt „kriegerisches Verhalten“ durch China,no_author,"02.10.2021, 16:41 Uhr",https://www.tagesspiegel.de/politik/38-kampfflugzeuge-im-verteidigungsluftraum-taiwan-beklagt-kriegerisches-verhalten-durch-china/27671344.html,"Die Regierung in Taipeh hat China eine beispiellose Verletzung des taiwanischen Luftraums durch Kampfflugzeuge vorgeworfen. Insgesamt 38 chinesische Militärflugzeuge seien am Freitag und in der Nacht zum Samstag in den Verteidigungsluftraum von Taiwan eingedrungen, erklärte das taiwanische Verteidigungsministerium. Regierungschef Su Tseng-Chang prangerte „kriegerisches Verhalten“ Chinas an, das dem Frieden in der Region schade. China hatte am Freitag zum chinesischen Nationalfeiertag eine große Machtdemonstration seiner Luftwaffe abgehalten. Unter dem chinesischen Präsidenten Xi Jinping dringen chinesische Kampfflugzeuge nahezu täglich in den taiwanischen Verteidigungsluftraum (Adiz) ein. Diese Zone umfasst nicht nur den eigentlichen Luftraum, sondern auch Teile der chinesischen Luftüberwachungsgebiete und sogar Teile von Festland-China. Massenhafte Militärflüge Chinas im taiwanischen Adiz waren bislang dennoch selten. Peking tritt in der Region jedoch immer aggressiver auf. Vergangene Woche waren 24 chinesische Militärflugzeuge in Taiwans Verteidigungsluftraum eingedrungen, nachdem Taiwan sich um den Beitritt zu einem großen Handelsabkommen im Pazifikraum bemüht hatte. Unter den Kampfflugzeugen, die nun in die Adiz-Zone eindrangen,  . Am Montag hatte sich China empört gezeigt über die Fahrt eines britischen Kampfschiffs durch die Meerenge, die Taiwan vom Festland trennt. Peking beansprucht die Meerenge als seine eigene Wasserstraße, ebenso wie den größten Teil des Südchinesischen Meeres, das für die anderen Länder der Region ebenso wichtig ist. Taiwan wird von China als Teil der Volksrepublik beansprucht. Taipeh hatte sich 1949 am Ende eines Bürgerkriegs von China losgesagt.  , die wieder mit dem Festland vereinigt werden soll. Präsident Xi ist für seinen Ausspruch bekannt, Taiwans Anschluss an die Volksrepublik sei ""unausweichlich"". Vertreter des US-Militärs sprechen mittlerweile offen von der Möglichkeit, dass China seine Drohungen gegen Taiwan in die Tat umsetzen könnte. Der Schutz der Insel ist eines der wenigen Themen, bei denen in Washington parteiübergreifend Einigkeit herrscht. Eine wachsende Zahl westlicher Staaten hat sich zudem den US-Militärübungen zur ""Freiheit der Schifffahrt"" angeschlossen, um Chinas Ansprüchen auf das Südchinesische Meer und die Straße von Taiwan zu begegnen.  waren auch atomwaffenfähige Bomber des Typs H-6 Peking betrachtet die demokratisch regierte Insel jedoch bis heute als abtrünnige Provinz",tagesspiegel
Der nächste Immobilienkonzern strauchelt . Die Sorge vor dem Dominoeffekt,Thorsten Mumme,"05.10.2021, 16:14 Uhr",https://www.tagesspiegel.de/wirtschaft/der-naechste-immobilienkonzern-strauchelt-die-sorge-vor-dem-dominoeffekt/27679780.html,"Die   zieht immer weitere Kreise. Nachdem der schuldenbeladene Konzern Evergrande Zahlungsfristen für Anleihezinsen gerissen hat, ließ nun auch der kleinere Rivale Fantasia Holdings eine Frist für Zinszahlungen verstreichen. Zudem stuften Ratingagenturen die Kreditwürdigkeit des Immobilienentwicklers Sinic zurück und warnten vor Zahlungsausfällen.  An den asiatischen Börsen war deshalb die  , besonders Immobilien-Aktien gingen in die Knie. Evergrande-Titel blieben in Erwartung eines möglichen Anteilsverkaufs vom Handel ausgesetzt. „Seit der Evergrande-Krise schauen die Anleger besorgter auf die Zahlungsfähigkeit chinesischer Immobilienentwickler“, sagte Thomas Kwok, Leiter des Aktiengeschäfts beim Brokerhaus Chief Securities. Fantasia zahlte am Montag fällige Anleihezinsen von 206 Millionen Dollar nicht aus, wie der Konzern gegenüber der Hongkonger Börse erklärte. Zudem konnte eine Fantasia-Tochter einen Kredit über 108 Millionen Dollar an den Immobilienmanager Country Garden Services nicht zurückbezahlen. Fitch senkte daraufhin das Rating von Fantasia um mehrere Stufen. Das Rating des Wettbewerbers Sinic wurde von Fitch und S&P Global nach unten gestuft. Sinic befinde sich in einer ernsten Liquiditätskrise und die Fähigkeit zur Schuldenbedienung sei fast erschöpft, begründeten die Experten von S&P ihre Rating-Senkung. Mitte Oktober werden bei Sinic Anleihezinsen über 246 Millionen Dollar fällig. Die beiden Immobilienfirmen sind zwar deutlich kleiner als Evergrande. Ihre Probleme befeuern aber die Sorgen von Anlegern, dass die Blase am chinesischen Immobilienmarkt vor dem Platzen steht und andere Branchen sowie das ganze Finanzsystem erfasst. „Es ist ein Teufelskreis für die Immobilienentwickler, die nicht stark genug sind, denn es gibt nicht genügend Liquidität auf dem Markt für alle“, warnte Kwok. Viele Immobilienfirmen in China bekommen derzeit keine Kredite mehr zur Refinanzierung. Und die Möglichkeit, Kapital durch Immobilienverkäufe zu generieren, ist zuletzt deutlich gesunken. Evergrande versucht sich in seiner Liquiditätskrise mit dem Verkauf von Unternehmensteilen Luft zu verschaffen. Laut einem Bericht der staatlichen Zeitung „Global Times“ will Evergrande 51 Prozent seiner Tochter Property Services Group für fünf Milliarden Dollar an den Rivalen Hopson verkaufen. Am Dienstag warteten Investoren allerdings  . Auch die chinesische Regierung äußerte sich weiterhin nicht zu den Schwierigkeiten des Immobilienentwicklers. Damit ist auch unklar, ob die Führung bei einer Pleite einspringt. Experten mutmaßen, Peking könne eine Zerschlagung anordnen. Evergrande würde sich mit einer solchen Transaktion jedoch nur bedingt freischwimmen. Der zweitgrößte Immobilienentwickler Chinas hat Schulden von mehr als 300 Milliarden Dollar. Mit fünf Milliarden Dollar könnte Evergrande theoretisch in den nächsten sechs Monaten seinen Verpflichtungen gegenüber Gläubigern nachkommen. Bis Ende 2021 werden rund 500 Millionen Dollar Zinsen für Anleihen fällig. Im März steht zudem die Rückzahlung für eine zwei Milliarden Dollar Anleihe an.  Die Folgen der Krise sind an einigen Stellen schon spürbar. In China warten Kleinanleger und Kunden, die ihre Wohnungen und Häuser im Voraus bezahlt haben, auf ihr Geld. Auch Mitarbeitern soll Evergrande Gehalt schulden. Darüber hinaus sind die Auswirkungen auf internationale Finanzmärkte noch nicht einzuschätzen.  Während das deutsche Finanzsystem sich noch sicher wähnt, sind etwa die Schweizer Banken UBS, Credit Suisse und Julius Bär deutlich stärker in Asien involviert und mussten bereits deutliche Kurseinbußen hinnehmen.  Pikant: Laut einem Bericht der „Financial Times“ hat Credit Suisse bereits Ende des Jahres 2018 einen Kreditwunsch des Evergrande-Präsidenten Hui Ka Yuan über eine Milliarde Dollar abgeschmettert. Hui habe damit neue Evergrande- Anleihen kaufen wollen – zur Absicherung. Die Bank bewertete das laut Bericht aber als „zirkuläre Finanzierung“ und lehnte ab.  Krise der chinesischen Immobilienunternehmen Stimmung am Dienstag gedämpft immer noch auf die Bestätigung des Deals",tagesspiegel
Militär weiter fortgeschritten als erwartet . China testet nuklearfähige Hyperschallrakete,no_author,"17.10.2021, 18:18 Uhr",https://www.tagesspiegel.de/politik/militaer-weiter-fortgeschritten-als-erwartet-china-testet-nuklearfaehige-hyperschallrakete/27713846.html,"China soll im August eine atomwaffenfähige Hyperschallrakete getestet haben. Wie die „Financial Times“ unter Berufung auf fünf anonyme Quellen am Samstag berichtete, sei die Rakete bei niedriger Umlaufbahn einmal um den Globus gekreist, ehe sie das anvisierte Ziel um etwa 15 Kilometer verfehlt habe. Laut der „Financial Times“ soll der Test belegen, dass Chinas Militär mit seinem Hyperschallwaffenprogramm bereits weit fortgeschrittener ist, als US-Geheimdienste bisher angenommen hatten. Hyperschallwaffen sind besonders schwer abzufangen, da sie mehr als die fünffache Schallgeschwindigkeit erreichen können. Derzeit arbeiten sowohl die Vereinigten Staaten als auch Russland an Hyperschallraketen. Auch Nordkorea hat im September nach eigenem Bekunden eine Hyperschallrakete getestet. Das chinesische Verteidigungsministerium in Peking äußerte sich zu dem Medienbericht zunächst nicht. ",tagesspiegel
Inselrepublik pocht auf Souveränität . Chinas Staatschef Xi fordert „Wiedervereinigung“ mit Taiwan,no_author,"09.10.2021, 13:57 Uhr",https://www.tagesspiegel.de/politik/inselrepublik-pocht-auf-souveraenitaet-chinas-staatschef-xi-fordert-wiedervereinigung-mit-taiwan/27692204.html," hat Chinas Staats- und Parteichef Xi Jinping zu einer „Wiedervereinigung“ aufgerufen. Eine Vereinigung mit „friedlichen Mitteln“ diene am besten den Interessen der ganzen chinesischen Nation, sagte der Präsident am Samstag bei einer Feier in der Großen Halle des Volkes. Er warnte, dass eine Abspaltung Taiwans kein gutes Ende nehmen werde. Anlass seiner Rede war der 110. Jahrestag der Revolution von 1911 in China, auf die sich sowohl   als auch die damals gegründete und auf Taiwan weiter existierende Republik China berufen. Peking sieht das heute freiheitliche Taiwan als Teil der Volksrepublik an und droht mit einer Eroberung. „Der Unabhängigkeits-Separatismus Taiwans ist das größte Hindernis für die Wiedervereinigung des Mutterlandes und die größte versteckte Gefahr für die nationale Verjüngung“, sagte Xi. Er betonte, China werde seine Souveränität und Einheit schützen. „Niemand sollte die standhafte Entschlossenheit, den festen Willen und die starke Fähigkeit des chinesischen Volkes unterschätzen, die nationale Souveränität und territoriale Integrität zu verteidigen.“ Das chinesische Volk blicke auf eine „glorreiche Tradition“ des Widerstands gegen Separatismus. „Die historische Aufgabe der vollständigen Wiedervereinigung des Mutterlandes muss erfüllt werden und wird definitiv erfüllt.“ Mit dem Hinweis auf seine Unabhängigkeit und Demokratie wies Taiwan den Appell Xi Jinpings umgehend zurück. Die Inselrepublik sei ein „souveränes und unabhängiges Land und nicht Teil der Volksrepublik China“, sagte in Taipeh der Sprecher von Präsidentin Tsai Ing-wen. „Die Zukunft des Landes liegt in den Händen des taiwanischen Volkes.“ Bei der Revolution von 1911 sei eine „demokratische Republik, nicht eine autoritäre Diktatur“ gegründet worden, so der Sprecher. Auf Taiwan sei diese Demokratie „wahrhaftig verwirklicht“ worden. Er bezog sich auf die nach dem Sturz der Qing-Dynastie geschaffene Republik China, wie sich Taiwan auch heute noch offiziell nennt. Unter Hinweis auf Hongkong, das oft als Vorbild für eine Vereinigung genannt wird, warf der Sprecher Peking vor, Versprechen gebrochen zu haben. Es habe widerrufen, dass sich 50 Jahre nichts ändern solle. Der Grundsatz „ein Land, zwei Systeme“ sei nicht machbar. Die Mehrheit der 23 Millionen Taiwaner lehne das Modell ab. Sie verteidigten ihren demokratischen und freiheitlichen Lebensstil. Xi Jinping hatte zuvor gesagt: „Die Landsleute auf beiden Seiten der Taiwanstraße sollten auf der richtigen Seite der Geschichte stehen und sich zusammenschließen, um die völlige Wiedervereinigung und Erneuerung der chinesischen Nation zu erreichen.“ Er warnte zugleich: „Jene, die ihr Erbe vergessen, ihr Vaterland verraten und versuchen, das Land zu spalten, werden ein böses Ende nehmen.“ Ohne die USA zu nennen, die sich der Verteidigungsfähigkeit Taiwans verpflichtet haben, verbat sich der Präsident jede ausländischer Einmischung: „Die Taiwanfrage ist eine rein interne Angelegenheit Chinas.“   Peking ist auch verärgert, dass die USA ihre Beziehungen zu Taiwan auf eine höhere Ebene gehoben haben. In der Revolution von 1911 wurde die Qing-Dynastie gestürzt und unter Sun Yat-sen die Republik China gegründet. In dem späteren Bürgerkrieg setzten sich aber die Kommunisten durch und die nationalchinesische Kuomintang-Partei flüchtete mit der Regierung nach Taiwan. Taiwans Nationalfeiertag an diesem Sonntag ist der Jahrestag der Revolution.  In den verschärften Spannungen um Taiwan die heutige kommunistische Volksrepublik Seine Mahnungen erfolgten angesichts einer Verschärfung des Konflikts, indem China den Druck mit verstärkten Militärflügen im Luftraum nahe Taiwan erhöht.",tagesspiegel
